Date of data,Trading partner code,Trading partner,Commodity code,Commodity,Renminbi Yuan
202504,502,United States,3826,"Biodiesel and mixtures thereof, not containing or containing less than 70% by weight of petroleum oils or oils obtained from bituminous minerals.",4063426
202504,502,United States,3901,"Polymers of ethylene, in primary forms.",1930351657
202504,502,United States,3902,"Polymers of propylene or of other olefins, in primary forms.",191457068
202504,502,United States,3903,"Polymers of styrene, in primary forms.",64006392
202504,502,United States,3904,"Polymers of vinyl chloride or of other halogenated olefins, in primary forms.",193737164
202504,502,United States,3905,"Polymers of vinyl acetate or of other vinyl esters, in primary forms; other vinyl polymers in primary forms.",51478532
202504,502,United States,3906,crylic polymers in primary forms.,72687849
202504,502,United States,3907,"Polyacetals, other polyethers and epoxide resins, in primary forms; polycarbonates, alkyd resins, polyallyl esters and other polyesters, in primary forms.",558427303
202504,502,United States,3908,Polyamides in primary forms.,123848545
202504,502,United States,3909,"minoresins, phenolic resins and polyurethanes, in primary forms.",44239541
202504,502,United States,3910,Silicones in primary forms,132366545
202504,502,United States,3911,"etroleum resins, coumaroneindene resins, polyterpenes, polysulphides, polysulphones and other products specified in Note 3 to this Chapter, not elsewhere specified or included, in primary forms.",104313668
202504,502,United States,3912,"Cellulose and its chemical derivatives, not elsewhere specified or included, in primary forms.",201335113
202504,502,United States,3913,"Natural polymers (for example, alginic acid) and modified natural polymers (for example, hardened proteins, chemical derivatives of natural rubber), not elsewhere specified or included, in primary forms.",17130116
202504,502,United States,3914,"Ionexchangers based on polymers of headings 39.01 to 39.13, in primary forms",24039320
202504,502,United States,3916,"Monofilament of which any crosssectional dimension exceeds 1 mm, rods, sticks and profile shapes, whether or not surfac worked but not otherwise worked, of plastics.",19438846
202504,502,United States,3917,"Tubes, pipes and hoses, and fittings therefor (for example, joints,elbows, flanges), of plastics.",120236465
202504,502,United States,3918,"Floor coverings of plastics, whether or not selfadhesive, in rolls or in the form of tiles; wall or ceiling coverings of plastics, as defined in Note 9 to this Chapter.",9825025
202504,502,United States,3919,"Selfadhesive plates, sheets, film, foil, tape, strip and other flat shapes, of plastics, whether or not in rolls.",269860890
202504,502,United States,3920,"Other plates, sheets, film, foil and strip, of plastics, noncellular and not reinforced, laminated, supported or similarly combined with other materials.",389558201
202504,502,United States,3921,"Other plates, sheets, film, foil and strip, of plastics.",98478379
202504,502,United States,3922,"Baths, showerbaths, sinks, washbasins, bidets, lavatory pans, seats and covers, flushing cisterns and similar sanitary ware, of plastics.",837281
202504,502,United States,3923,"Articles for the conveyance or packing of goods, of plastics; stoppers, lids, caps and other closures, of plastics.",52160274
202504,502,United States,3924,"Tableware, kitchenware, other household articles and hygienic or toilet articles, of plastics.",1382581
202504,502,United States,3925,"Builders' ware of plastics, not elsewhere specified or included.",2023873
202504,502,United States,3926,Other articles of plastics and articles of other materials of headings 39.01 to 39.14.,421767947
202504,502,United States,4001,"Natural rubber, balata, guttapercha, guayule, chicle and similar natural gums, in primary forms or in plates, sheets or strip.",9632
202504,502,United States,4002,"Synthetic rubber and factice derived from oils, in primary forms or in plates, sheets or strip; mixtures of any product of heading 40.01 with any product of this heading, in primary forms or in plates, sheets or strip.",125515151
202504,502,United States,4003,"Reclaimed rubber in primary forms or in plates, sheets or strip.",799897
202504,502,United States,4005,"ompounded rubber, unvulcanised, in primary forms or in plates, sheets or strip.",19198838
202504,502,United States,4006,"Other forms (for example, rods, tubes and profile shapes) and articles (for example, discs and rings), of unvulcanised rubber.",5599589
202504,502,United States,4007,Vulcanised rubber thread and cord.,50928
202504,502,United States,4008,"lates, sheets, strip, rods and profile shapes, of vulcanised rubber other than hard rubber.",8845131
202504,502,United States,4009,"Tubes, pipes and hoses, of vulcanised rubber other than hard rubber, with or without their fittings (for example, joints, elbows, flanges).",40406704
202504,502,United States,4010,"Conveyor or transmission belts or belting, of vulcanised rubber.",9569272
202504,502,United States,4011,"New pneumatic tyres, of rubber.",27375148
202504,502,United States,4012,"Retreaded or used pneumatic tyres of rubber; solid or cushion tyres, tyre treads and tyre flaps, of rubber.",2019289
202504,502,United States,4013,"Inner tubes, of rubber.",223716
202504,502,United States,4014,"Hygienic or pharmaceutical articles (including teats), of vulcanised rubber other than hard rubber, with or without fittings of hard rubber.",137100
202504,502,United States,4015,"Articles of apparel and clothing accessories (including gloves, mittens and mitts), for all purposes, of vulcanised rubber other than hard rubber.",3074324
202504,502,United States,4016,Other articles of vulcanised rubber other than hard rubber.,201863036
202504,502,United States,4017,"Hard rubber (for example, ebonite) in all forms, including waste and scrap; articles of hard rubber",1034426
202504,502,United States,4101,"Raw hides and skins of bovine (including buffalo) or equine animals (fresh, or salted, dried, limed, pickled or otherwise preserved, but not tanned, parchmentdressed or further prepared), whether or not dehaired or split.",243177630
202504,502,United States,4102,"Raw skins of sheep or lambs (fresh, or salted, dried, limed, pickled or otherwise preserved, but not tanned, parchment dressed or further prepared), whether or not with wool on or split, other than those excluded by Note 1 (c) to this Chapter.",656403
202504,502,United States,4103,"Other raw hides and skins (fresh, or salted, dried, limed, pickled or otherwise preserved, but not tanned, parchmentdressed or further prepared), whether or not dehaired or split, other thanthose excluded by Note 1 (b) or 1 (c) to this Chapter.",5768723
202504,502,United States,4104,"Tanned or crust hides and skins of bovine (including buffalo) or equine animals, without hair on, whether or not split, but not further prepared.",58102635
202504,502,United States,4106,"Tanned or crust hides and skins of other animals, without wool whether or not split, but not further prepared.",945771
202504,502,United States,4107,"Leather further prepared after tanning or crusting, including parchmentdressed leather, of bovine (including buffalo) or equine animals, without hair on, whether or not split, other than leather of heading 41.14.",2061355
202504,502,United States,4112,"Leather further prepared after tanning or crusting, including parchmentdressed leather, of sheep or lamb, without wool on, whether or not split, other than leather of heading 41.14",215
202504,502,United States,4113,"Leather further prepared after tanning or crusting, including parchmentdressed leather, of other animals, without wool or hair on, whether or not split, other than leather of heading 41.14.",6045
202504,502,United States,4114,Chamois (including combination chamois) leather; patentleather and patent laminated leather; metallised leather.,1089
202504,502,United States,4115,"Composition leather with a basis of leather or leather fibre, in slabs, sheets or strip, whether or not in rolls; parings and other waste of leather or of composition leather, not suitable for the manufacture of leather articles; leather dust, powder and flour.",235867
202504,502,United States,4201,"Saddlery and harness for any animal, incl. traces, leads, knee pads, muzzles, saddle cloths, saddlebags, dog coats and the like, of any material",22100
202504,502,United States,4202,"Trunks, suitcases, vanitycases, executivecases, briefcases, school satchels, spectacle cases, binocular cases, camera cases, musical instrument cases, gun cases, holsters and similar containers; travellingbags, insulated food or beverages bags, toilet bags, rucksacks, handbags, shoppingbags, wallets, purses, mapcases, cigarettecases, tobaccopouches, tool bags, sports bags, bottlecases, jewellery boxes, powderboxes, cutlery cases and similar containers, of leather or of composition leather, of sheeting of plastics, of textile materials, of vulcanised fibre or of paperboard, or wholly or mainly covered with such materials or with paper.",28407314
202504,502,United States,4203,"Articles of apparel and clothing accessories, of leather or of composition leather.",902385
202504,502,United States,4205,Other articles of leather or of composition leather,1554315
202504,502,United States,4302,"Tanned or dressed furskins (including heads, tails, paws and other pieces or cuttings), unassembled, or assembled (without the addition of other materials) other than those of heading 43.03.",1369
202504,502,United States,4303,"rticles of apparel, clothing accessories and other articles of furskin.",37514
202504,502,United States,4304,Artificial fur and articles thereof,6525
202504,502,United States,4401,"Fuel wood, in logs, billets, twigs, faggots or similar forms; wood in chips or particles; sawdust and wood waste and scrap, whether or not agglomerated in logs, briquettes, pellets or similar forms",1560190
202504,502,United States,4402,"Wood charcoal (including shell or nut charcoal), whether or notagglomerated.",122331
202504,502,United States,4403,"Wood in the rough, whether or not stripped of bark or sapwood,or roughly squared.",256692788
202504,502,United States,4407,"Wood sawn or chipped lengthwise, sliced or peeled, whether or not planed, sanded or endjointed, of a thickness exceeding 6 mm.",462509231
202504,502,United States,4408,"Sheets for veneering, incl. those obtained by slicing laminated wood, for plywood or for other similar laminated wood and other wood, sawn lengthwise, sliced or peeled, whether or not planed, sanded, spliced or end-jointed, of a thickness of ≤ 6 mm",1030320
202504,502,United States,4409,"Wood, incl. strips and friezes for parquet flooring, not assembled, continuously shaped ""tongued, grooved, rebated, chamfered, V-jointed beaded, moulded, rounded or the like"" along any of its edges, ends or faces, whether or not planed, sanded or end-jointed",3560
202504,502,United States,4410,"Particle board, oriented strand board (OSB) and similar board (for example, waferboard) of wood or other ligneous materials, whether or not agglomerated with resins or other organic binding substances.",118944
202504,502,United States,4411,"Fibreboard of wood or other ligneous materials, whether or not bonded with resins or other organic substances.",7984
202504,502,United States,4412,"Plywood, veneered panels and similar laminated wood.",940
202504,502,United States,4414,"Wooden frames for paintings, photographs, mirrors or similar objects.",67811
202504,502,United States,4415,"Packing cases, boxes, crates, drums and similar packings, of wood; cabledrums of wood; pallets, box pallets and other load boards,of wood; pallet collars of wood.",688656
202504,502,United States,4416,"Wood casks, barrels, vats, tubs and other coopers' products and parts thereof, of wood, including stave",12098361
202504,502,United States,4417,"Tools, tool bodies, tool handles, broom or brush bodies and handles, of wood; boot or shoe lasts and trees, of wood",275561
202504,502,United States,4418,"Builders' joinery and carpentry of wood, including cellular wood panels, assembled flooring panels, shingles and shakes.",15564
202504,502,United States,4419,"Tableware and kitchenware, of wood.",525388
202504,502,United States,4420,"Wood marquetry and inlaid wood; caskets and cases for jewellery or cutlery, and similar articles, of wood; statuettes and other ornaments, of wood; wooden articles of furniture (excluding furniture, lighting fixtures and parts thereof)",72498
202504,502,United States,4421,Other articles of wood.,143790
202504,502,United States,4501,"Natural cork, raw or merely surface-worked or otherwise cleaned; cork waste; crushed, powdered or ground cork",46325
202504,502,United States,4503,Articles of natural cork.,10569
202504,502,United States,4504,"Agglomerated cork, with or without a binding substance, and articles of agglomerated cork",87164
202504,502,United States,4602,"Basketwork, wickerwork and other articles, made directly to shape from plaiting materials or made up from goods of heading 46.01; articles of loofah.",2307
202504,502,United States,4701,Mechanical wood pulp,574
202504,502,United States,4702,"Chemical wood pulp, dissolving grades",181745868
202504,502,United States,4703,"Chemical wood pulp, soda or sulphate, other than dissolving grades.",520492134
202504,502,United States,4706,"Pulps of fibres derived from recovered ""waste and scrap"" paper or paperboard or of other fibrous cellulosic material",2971199
202504,502,United States,4801,"Newsprint, in rolls or sheets",162
202504,502,United States,4802,"Uncoated paper and paperboard, of a kind used for writing, printing or other graphic purposes, and non perforated punchcards and punch tape paper, in rolls or rectangular (including square) sheets, of any size, other than paper of heading 48.01 or 48.03; handmade paper and paperboard.",4947181
202504,502,United States,4803,"Toilet or facial tissue stock, towel or napkin stock and similar paper of a kind used for household or sanitary purposes, cellulose wadding and webs of cellulose fibres, whether or not creped, crinkled, embossed, perforated, surfacecoloured, surface decorated or printed, in rolls or sheets",3247440
202504,502,United States,4804,"Uncoated kraft paper and paperboard, in rolls or sheets, other than that of heading 48.02 or 48.03.",201213689
202504,502,United States,4805,"Other uncoated paper and paperboard, in rolls or sheets, not further worked or processed than as specified in Note 3 to this Chapter.",23636287
202504,502,United States,4806,"vegetable parchment, greaseproof papers, tracing papers and glassine and other glazed transparent or translucent papers, in rolls or sheets.",2338776
202504,502,United States,4807,"Composite paper and paperboard (made by sticking flat layers of paper or paperboard together with an adhesive), not surface coated or impregnated, whether or not internally reinforced, in rolls or sheets.",930987
202504,502,United States,4808,"Paper and paperboard, corrugated (with or without glued flat surface sheets), creped, crinkled, embossed or perforated, in rolls or sheets, other than paper of the kind described in heading 48.03.",5084180
202504,502,United States,4810,"Paper and paperboard, coated on one or both sides with kaolin (China clay) or other inorganic substances, with or without a binder, and with no other coating, whether or not surface coloured, surfacedecorated or printed, in rolls or rectangular (including square) sheets, of any size.",33744886
202504,502,United States,4811,"Paper, paperboard, cellulose wadding and webs of cellulose fibres,coated,impregnated,covered, surfacecoloured, surface decorated or printed, in rolls or rectangular (including square) sheets, of any size, other than goods of the kind described in heading 48.03, 48.09 or 48.10.",76068873
202504,502,United States,4812,"Filter blocks, slabs and plates, of paper pulp",2029
202504,502,United States,4814,Wallpaper and similar wall coverings; window transparencies of paper.,2290448
202504,502,United States,4816,"Carbon paper, self-copy paper and other copying or transfer papers, in rolls of a width of ≤ 36 cm or in rectangular or square sheets with no side measuring ＞ 36 cm in the unfolded state, or cut into shapes other than rectangles or squares, together with full duplicator stencils and offset plates of paper, whether or not in boxes",788714
202504,502,United States,4817,"Envelopes, letter cards, plain postcards and correspondence cards, of paper or paperboard; boxes, pouches, wallets and writing compendiums, of paper or paperboard, containing an assortment of paper stationery.",37633
202504,502,United States,4818,"Toilet paper and similar paper, cellulose wadding or webs of cellulose fibres, of a kind used for household or sanitary purposes, in rolls of a width ≤ 36 cm, or cut to size or shape; handkerchiefs, cleansing tissues, towels, tablecloths, serviettes, bedsheets and similar household, sanitary or hospital articles, articles of apparel and clothing accessories, of paper pulp, paper, cellulose wadding or webs of cellulose fibres",2125437
202504,502,United States,4819,"Cartons, boxes, cases, bags and other packing containers, of paper, paperboard, cellulose wadding or webs of cellulose fibres, n.e.s.; box files, letter trays, and similar articles, of paperboard of a kind used in offices, shops or the like",3094578
202504,502,United States,4820,"Registers, account books, note books, order books, receipt books, letter pads, memorandum pads,diaries and similar articles, exercise books, blottingpads, binders (looseleaf or other), folders, file covers, manifold business forms, interleaved carbon sets and other articles of stationery, of paper or paperboard; albums for samples or for collections and book covers, of paper or paperboard.",1478217
202504,502,United States,4821,"paper or paperboard labels of all kinds, whether or not printed.",7367081
202504,502,United States,4822,"Bobbins, spools, cops and similar supports of paper pulp, paper or paperboard (whether or not perforated or hardened).",52742
202504,502,United States,4823,"Other paper, paperboard, cellulose wadding and webs of cellulose fibres, cut to size or shape; other articles of paper pulp, paper,paperboard, cellulose wadding or webs of cellulose fibres.",7665905
202504,502,United States,4901,"Printed books, brochures, leaflets and similar printed matter, whether or not in single sheets.",25848060
202504,502,United States,4902,"Newspapers, journals and periodicals, whether or not illustrated or containing advertising material.",16272174
202504,502,United States,4903,"Children's picture, drawing or colouring books.",169909
202504,502,United States,4904,"Music, printed or in manuscript, whether or not bound or illustrated",168553
202504,502,United States,4905,"Maps and hydrographic or similar charts of all kinds, including atlases, wall maps, topographical plans and globes, printed.",34090
202504,502,United States,4906,"Plans and drawings for architectural, engineering, industrial, commercial, topographical or similar purposes, being originals drawn by hand; handwritten texts; photographic reproductions on sensitised paper and carbon copies of the foregoing",6786
202504,502,United States,4907,"Unused postage, revenue or similar stamps of current or new issue in the country in which they have, or will have, a recognised face value; stamp-impressed paper; banknotes; cheque forms; stock, share or bond certificates and similar documents of title",612309972
202504,502,United States,4908,Transfers (decalcomanias),2664994
202504,502,United States,4909,"Printed or illustrated postcards; printed cards bearing personal greetings, messages or announcements, whether or not illustrated, with or without envelopes or trimmings.",27454
202504,502,United States,4910,"Calendars of any kind, printed, including calendar blocks.",3642
202504,502,United States,4911,"Other printed matter, including printed pictures and photographs.",77533972
202504,502,United States,5006,"Silk yarn and yarn spun from silk waste, put up for retail sale;silkworm gut.",15279
202504,502,United States,5007,Woven fabrics of silk or of silk waste.,5810
202504,502,United States,5101,"Wool, not carded or combed.",1217251
202504,502,United States,5106,"Yarn of carded wool, not put up for retail sale.",1118
202504,502,United States,5109,"Yarn of wool or of fine animal hair, put up for retail sale.",9663
202504,502,United States,5111,Woven fabrics of carded wool or of carded fine animal hair.,1940
202504,502,United States,5112,Woven fabrics of combed wool or of combed fine animal hair.,401422
202504,502,United States,5201,"Cotton, not carded or combed.",259792801
202504,502,United States,5204,"Cotton sewing thread, whether or not put up for retail sale.",68
202504,502,United States,5208,"Woven fabrics of cotton, containing 85% or more by weight of cotton, weighing not more than 200 g/m2",108820
202504,502,United States,5209,"Woven fabrics of cotton, containing 85% or more by weight of cotton, weighing more than 200 g/m2",12219
202504,502,United States,5210,"Woven fabrics of cotton, containing less than 85% by weight of cotton, mixed mainly or solely with manmade fibres, weighing not more than 200 g/m2.",1625
202504,502,United States,5211,"Woven fabrics of cotton, containing less than 85% by weight of cotton, mixed mainly or solely with manmade fibres, weighing more than 200 g/m2.",153403
202504,502,United States,5212,Other woven fabrics of cotton.,5450
202504,502,United States,5309,Woven fabrics of flax.,30824
202504,502,United States,5401,"Sewing thread of manmade filaments, whether or not put up for retail sale.",107046
202504,502,United States,5402,"Synthetic filament yarn (other than sewing thread), not put up for retail sale, including synthetic monofilament of less than 67 decitex.",32465662
202504,502,United States,5403,"Artificial filament yarn (other than sewing thread), not put up for retail sale, including artificial monofilament of less than 67 decitex.",34505904
202504,502,United States,5404,"Synthetic monofilament of 67 decitex or more and of which no crosssectional dimension exceeds 1 mm; strip and the like (for example, artificial straw) of synthetic textile materials of an apparent width not exceeding 5 mm.",10502065
202504,502,United States,5406,"Manmade filament yarn (other than sewing thread), put up for retail sale.",5106
202504,502,United States,5407,"Woven fabrics of synthetic filament yarn, including woven fabrics obtained from materials of heading 54.04.",4988271
202504,502,United States,5408,"Woven fabrics of artificial filament yarn, including woven fabrics obtained from materials of heading 54.05.",1771
202504,502,United States,5501,Synthetic filament tow.,274824
202504,502,United States,5503,"Synthetic staple fibres, not carded, combed or otherwise processed for spinning.",11888882
202504,502,United States,5504,"Artificial staple fibres, not carded, combed or otherwise processed for spinning.",758745
202504,502,United States,5506,"Synthetic staple fibres, carded, combed or otherwise processed for spinning.",21635
202504,502,United States,5508,"Sewing thread of manmade staple fibres, whether or not put up for retail sale.",3497
202504,502,United States,5509,"Yarn (other than sewing thread) of synthetic staple fibres, not put up for retail sale.",49180
202504,502,United States,5512,"Woven fabrics of synthetic staple fibres, containing 85% or more by weight of synthetic staple fibres.",8250688
202504,502,United States,5513,"Woven fabrics of synthetic staple fibres, containing less than 85% by weight of such fibres, mixed mainly or solely with cotton, of a weight not exceeding 170 g/m2.",451
202504,502,United States,5514,"Woven fabrics of synthetic staple fibres, containing less than 85% by weight of such fibres, mixed mainly or solely with cotton, of a weight exceeding 170g/m2.",21645
202504,502,United States,5515,Other woven fabrics of synthetic staple fibres.,582535
202504,502,United States,5516,Woven fabrics of artificial staple fibres.,19040
202504,502,United States,5601,"Wadding of textile materials and articles thereof; textile fibres, not exceeding 5 mm in length (flock),textile dust and mill neps.",8203651
202504,502,United States,5602,"Felt, whether or not impregnated, coated, covered or laminated.",2126889
202504,502,United States,5603,"Nonwovens, whether or not impregnated, coated, covered or laminated.",95061091
202504,502,United States,5604,"Textile-covered rubber thread and cord; textile yarn, strip and the like of heading 5404 and 5405, impregnated, coated, covered or sheathed with rubber or plastics",2805424
202504,502,United States,5606,"Gimped yarn, gimped strip and the like of heading 5404 or 5405; chenille yarn, incl. flock chenille yarn, and loop wale-yarn",89897
202504,502,United States,5607,"Twine, cordage, ropes and cables, whether or not plaited or braided and whether or not impregnated, coated, covered or sheathed with rubber or plastics",6898134
202504,502,United States,5608,"Knotted netting of twine, cordage or rope; made up fishing nets and other made up nets, of textile materials.",107581
202504,502,United States,5609,"Articles of yarn, strip or the like of heading 54.04 or 54.05, twine, cordage, rope or cables, not elsewhere specified or included.",730850
202504,502,United States,5701,"Carpets and other textile floor coverings, knotted, whether or not made up.",3757
202504,502,United States,5702,"Carpets and other textile floor coverings, woven, not tufted or flocked, whether or not made up, incl. Kelem, Schumacks, Karamanie and similar hand-woven rugs",1026167
202504,502,United States,5703,"Carpets and other textile floor coverings, tufted, whether or not made up.",131721
202504,502,United States,5705,"Other carpets and other textile floor coverings, whether or not made up.",680186
