Date of data,Trading partner code,Trading partner,Commodity code,Commodity,Renminbi Yuan
202504,502,United States,5801,"Woven pile fabrics and chenille fabrics (excluding terry towelling and similar woven terry fabrics, tufted textile fabrics and narrow woven fabrics of heading 5806)",1952881
202504,502,United States,5802,"Terry towelling and similar woven terry fabrics, tufted textile fabrics (excluding narrow woven fabrics of heading 5806, carpets and other floor coverings)",3031
202504,502,United States,5804,"Tulles and other net fabrics, not including woven, knitted or crocheted fabrics; lace in the piece, in strips or in motifs, other than fabrics of headings 60.02 to 60.06.",473377
202504,502,United States,5806,"Narrow woven fabrics of textile materials, with a width of ≤ 30 cm (excluding labels, badges and similar articles); narrow fabrics consisting of warp without weft assembled by means of an adhesive ""bolducs""",3949568
202504,502,United States,5807,"Cabels, badges and similar articles of textile materials, in the piece, in strips or cut to shape or size, not embroidered.",708849
202504,502,United States,5808,"Braids of textile materials, in the piece; ornamental trimmings of textile materials, in the piece, not embroidered, other than knitted or crocheted; tassels, pompons and similar articles of textile materials",77075
202504,502,United States,5810,"Embroidery on a textile fabric ground, in the piece, in strips or in motifs",51684
202504,502,United States,5811,"Quilted textile products in the piece, composed of one or more layers of textile materials assembled with padding by stitching or otherwise (excluding embroidery of heading 5810 and quilted fabrics for bedding and furnishings)",445063
202504,502,United States,5902,"Tyre cord fabric of high-tenacity yarn of nylon or other polyamides, polyesters or viscose rayon, whether or not dipped or impregnated with rubber or plastic",4230
202504,502,United States,5903,"Textile fabrics impregnated, coated, covered or laminated with plastics, other than those of heading 59.02.",17536891
202504,502,United States,5905,Textile wall coverings.,29427
202504,502,United States,5906,"Rubberised textile fabrics, other than those of heading 59.02.",1640494
202504,502,United States,5907,"Impregnated, coated or covered textile fabrics; painted canvas being theatrical scenery, studio backcloths or the like, n.e.s.",3880875
202504,502,United States,5908,"Textile wicks, woven, plaited or knitted, for lamps, stoves, lighters, candles or the like; incandescent gas mantles and tubular knitted gas-mantle fabric for incandescent gas mantles, whether or not impregnated",969462
202504,502,United States,5909,"Textile hosepiping and similar textile tubing, whether or not impregnated or coated, with or without lining, armour or accessories of other materials",306191
202504,502,United States,5910,"Transmission or conveyor belts or belting, of textile material, whether or not impregnated, coated, covered or laminated with plastics, or reinforced with metal or other material.",3604484
202504,502,United States,5911,"Textile products and articles, for technical use, specified in Note 7 to chapter 59",21297324
202504,502,United States,6001,"Pile fabrics, incl. ""long pile"" fabrics and terry fabrics, knitted or crocheted",908426
202504,502,United States,6002,"Knitted or crocheted fabrics of a width not exceeding 30cm, containing by weight 5% or more of elastomeric yarn or rubber thread, other than those of heading 60.01.",3336
202504,502,United States,6003,"Knitted or crocheted fabrics of a width not exceeding 30cm, other than those of heading 60.01 or 60.02.",69048
202504,502,United States,6004,"Knitted or crocheted fabrics of a width exceeding 30 cm, containing by weight 5% or more of elastomeric yarn or rubber thread, other than those of heading 60.01",906204
202504,502,United States,6005,"Warp knit fabrics (including those made on galloon knitting machines), other than those of headings 60.01 to 60.04.",2363259
202504,502,United States,6006,Other knitted or crocheted fabrics.,208388
202504,502,United States,6101,"Men's or boys' overcoats, car coats, capes, cloaks, anoraks, incl. ski jackets, windcheaters, wind-jackets and similar articles, knitted or crocheted (excluding suits, ensembles, jackets, blazers, bib and brace overalls and trousers)",399551
202504,502,United States,6102,"Women's or girls' overcoats, carcoats, capes, cloaks, anoraks (including skijackets), windcheaters, windjackets and similar articles, knitted or crocheted, other than those of heading 61.04.",96046
202504,502,United States,6103,"Men's or boys' suits, ensembles, jackets, blazers, trousers, bib and brace overalls, breeches and shorts",1356329
202504,502,United States,6104,"Women's or girls' suits, ensembles, jackets, blazers, dresses, skirts, divided skirts, trousers, bib and brace overalls, breeches and shorts, knitted or crocheted",3347988
202504,502,United States,6105,"en's or boys' shirts, knitted or crocheted.",782835
202504,502,United States,6106,"Women's or girls' blouses, shirts and shirt-blouses, knitted or crocheted (excluding T-shirts and vests)",1115123
202504,502,United States,6107,"Men's or boys' underpants, briefs, nightshirts, pyjamas, bathrobes, dressing gowns and similar articles, knitted or crocheted (excluding vests and singlets)",57008
202504,502,United States,6108,"Women's or girls' slips, petticoats, briefs, panties, nightdresses, pyjamas, négligés, bathrobes, dressing gowns, housecoats and similar articles, knitted or crocheted (excluding T-shirts, vests, brassieres, girdles, corsets and similar articles)",150447
202504,502,United States,6109,"T-shirts, singlets and other vests, knitted or crocheted",7898262
202504,502,United States,6110,"Jerseys, pullovers, cardigans, waistcoats and similar articles, of wool, knitted or crocheted (excluding wadded waistcoats)",3166878
202504,502,United States,6111,"Babies' garments and clothing accessories of wool or fine animal hair, knitted or crocheted (excluding hats)",47000
202504,502,United States,6112,"Track-suits, ski-suits and swimwear, knitted or crocheted",104334
202504,502,United States,6113,"Garments, knitted or crocheted, rubberised or impregnated, coated or covered with plastics or other materials (excluding babies' garments and clothing accessories)",536
202504,502,United States,6114,"Special garments for professional, sporting or other purposes, n.e.s., knitted or crocheted",608893
202504,502,United States,6115,"Pantyhose, tights, stockings, socks and other hosiery, incl. graduated compression hosiery [e.g., stockings for varicose veins] and footwear without applied soles, knitted or crocheted (excluding for babies)",904961
202504,502,United States,6116,"Gloves, mittens and mitts, knitted or crocheted (excluding for babies)",68023
202504,502,United States,6117,"Other made up clothing accessories, knitted or crocheted; knitted or crocheted parts of garments or of clothing accessories.",306956
202504,502,United States,6201,"Men’s or boys’ overcoats, car-coats, capes, cloaks, anoraks (including ski-jackets), wind-cheaters, wind jackets and similar articles, other than those of heading 62.03.",2500363
202504,502,United States,6202,"Women’s or girls’ overcoats, car-coats, capes, cloaks, anoraks (including ski-jackets), wind-cheaters, wind-jackets and similar articles, other than those of heading 62.04.",912211
202504,502,United States,6203,"Men's or boys' suits, ensembles, jackets, blazers, trousers, bib and brace overalls, breeches and shorts (excluding knitted or crocheted, wind-jackets and similar articles, separate waistcoats, tracksuits, ski suits and swimwear)",2999080
202504,502,United States,6204,"Women's or girls' suits, ensembles, jackets, blazers, dresses, skirts, divided skirts, trousers, bib and brace overalls, breeches and shorts (excluding knitted or crocheted, wind-jackets and similar articles, slips, petticoats and panties, tracksuits, ski suits and swimwear)",5026772
202504,502,United States,6205,Men's or boys' shirts.,1157142
202504,502,United States,6206,"Women's or girls' blouses, shirts and shirtblouses.",631688
202504,502,United States,6207,"Men's or boys' singlets and other vests, underpants, briefs, nightshirts, pyjamas, bathrobes, dressing gowns and similar articles",25175
202504,502,United States,6208,"Women's or girls' singlets and other vests, slips, petticoats, briefs, panties, nightdresses, pyjamas, négligés, bathrobes, dressing gowns, housecoats and similar articles (excluding knitted or crocheted, brassières, girdles, corsets and similar articles)",85747
202504,502,United States,6209,Babies garments and clothing accessories of textile materials (excluding knitted or crocheted and hats),21365
202504,502,United States,6210,"Garments made up of felt or nonwovens, whether or not impregnated, coated, covered or laminated; garments of textile fabrics, rubberised or impregnated, coated, covered or laminated with plastics or other substances (excluding knitted or crocheted, and babies' garments and clothing accessories)",87980
202504,502,United States,6211,"Tracksuits, ski suits, swimwear and other garments, n.e.s.",886665
202504,502,United States,6212,"Brassieres, girdles, corsets, braces, suspenders, garters and similar articles and parts thereof, of all types of textile materials, whether or not elasticated, incl. knitted or crocheted (excluding belts and corselets made entirely of rubber)",121379
202504,502,United States,6214,"Shawls, scarves, mufflers, mantillas, veils and similar articles",88142
202504,502,United States,6215,"Ties, bow ties and cravats of textile materials",12210
202504,502,United States,6216,"Gloves, mittens and mitts, of all types of textile materials (excluding knitted or crocheted and for babies)",212162
202504,502,United States,6217,"Made-up clothing accessories and parts of garments or clothing accessories, of all types of textile materials, n.e.s.",135555
202504,502,United States,6301,Blankets and travelling rugs,23619
202504,502,United States,6302,"Bed linen, table linen, toilet linen and kitchen linen.",137242
202504,502,United States,6303,Curtains (including drapes) and interior blinds; curtain or bed valances.,1343080
202504,502,United States,6304,"Other furnishing articles, excluding those of heading 94.04.",3344788
202504,502,United States,6305,"Packs and bags, of a kind used for the packing of goods.",146793
202504,502,United States,6306,"Tarpaulins, awnings and sunblinds; tents (including temporary canopies and similar articles); sails for boats, sailboards or landcraft; camping goods.”",297380
202504,502,United States,6307,"other made up articles, including dress patterns.",8323245
202504,502,United States,6401,"Waterproof footwear with outer soles and uppers of rubber or of plastics, the uppers of which are neither fixed to the sole nor assembled by stitching, riveting, nailing, screwing, plugging or similar processes.",7254
202504,502,United States,6402,Other footwear with outer soles and uppers of rubber or plastics.,3785444
202504,502,United States,6403,"ootwear with outer soles of rubber, plastics, leather or composition leather and uppers of leather.",36670466
202504,502,United States,6404,"Footwear with outer soles of rubber, plastics, leather or composition leather and uppers of textile materials.",20577702
202504,502,United States,6405,Other footwear.,1008668
202504,502,United States,6406,"Parts of footwear, incl. uppers whether or not attached to soles other than outer soles; removable in-soles, heel cushions and similar articles; gaiters, leggings and similar articles, and parts thereof (excluding articles of asbestos)",30658155
202504,502,United States,6504,"Hats and other headgear, plaited or made by assembling strips of any material, whether or not lined or trimmed",24226
202504,502,United States,6505,"Hats and other headgear, knitted or crocheted, or made up from lace, felt or other textile fabric, in the piece (but not in strips), whether or not lined or trimmed; hairnets of any material, whether or not lined or trimmed",1019003
202504,502,United States,6506,"Other headgear, whether or not lined or trimmed.",508817
202504,502,United States,6507,"Headbands, linings, covers, hat foundations, hat frames, peaks and chinstraps, for headgear",3210
202504,502,United States,6601,"Umbrellas and sun umbrellas (including walkingstick umbrellas, garden umbrellas and similar umbrellas).",5576
202504,502,United States,6602,"Walkingsticks, seatsticks, whips, ridingcrops and the like",18065
202504,502,United States,6702,"Artificial flowers, foliage and fruit and parts thereof; articles made of artificial flowers, foliage or fruit.",189314
202504,502,United States,6703,"Human hair, dressed, thinned, bleached or otherwise worked; wool or other animal hair or other textile materials, prepared for use in making wigs or the like.",182294
202504,502,United States,6704,"igs, false beards, eyebrows and eyelashes, switches and the like, of human or animal hair or of textile materials; articles of human hair not elsewhere specified or included.",115201
202504,502,United States,6802,"Worked monumental or building stone (except slate) and articles thereof, other than goods of heading 68.01; mosaic cubes and the like, of natural stone (including slate), whether or not on a backing; artificially coloured granules, chippings and powder, of natural stone (including slate).",9486
202504,502,United States,6803,Worked slate and articles of slate or of agglomerated slate.,1952
202504,502,United States,6804,"Millstones, grindstones, grinding wheels and the like, without frameworks, for milling, grinding, pulping, sharpening, polishing, trueing or cutting, hand sharpening or polishing stones, and parts thereof, of natural stone, of agglomerated natural or artificial abrasives, or of ceramics, with or without parts of other materials",6953644
202504,502,United States,6805,"Natural or artificial abrasive powder or grain, on a base of textile material, of paper, of paperboard or of other materials, whether or not cut to shape or sewn or otherwise made up.",39416171
202504,502,United States,6806,"Slag-wool, rock-wool and similar mineral wools; exfoliated vermiculite, expanded clays, foamed slag and similar expanded mineral materials; mixtures and articles of heat-insulating, sound-insulating or sound absorbing mineral materials",10443444
202504,502,United States,6807,"Articles of asphalt or of similar material (for example, petroleum bitumen or coal tar pitch).",725146
202504,502,United States,6809,Articles of plaster or of compositions based on plaster.,42198
202504,502,United States,6810,"Articles of cement, of concrete or of artificial stone, whether or not reinforced.",207943
202504,502,United States,6811,"Articles of asbestos-cement, of cellulose fibre-cement or the like.",13758
202504,502,United States,6812,"Fabricated asbestos fibres; mixtures with a basis of asbestos or with a basis of asbestos and magnesium carbonate; articles of such mixtures or of asbestos (for example, thread, woven fabric, clothing, headgear, footwear, gaskets), whether or not reinforced, other than goods of heading 68.11 or 68.13.",812360
202504,502,United States,6813,"Friction material and articles thereof, e.g., sheets, rolls, strips, segments, discs, washers, pads, not mounted, for brakes, clutches or the like, with a basis of asbestos, other mineral substances or cellulose, whether or not combined with textile or other materials",7580980
202504,502,United States,6814,"Worked mica and articles of mica, including agglomerated or reconstituted mica, whether or not on a support of paper, paperboard or other materials.",194412
202504,502,United States,6815,"Articles of stone or of other mineral substances (including carbon fibres, articles of carbon fibres and articles of peat), not elsewhere specified or included.",93474324
202504,502,United States,6902,"Refractory bricks, blocks, tiles and similar refractory ceramic constructional goods, other than those of siliceous fossil meals or similar siliceous earths.",135728
202504,502,United States,6903,"Other refractory ceramic goods (for example, retorts, crucibles, muffles, nozzles, plugs, supports, cupels, tubes, pipes, sheaths, rods and slide gates), other than those of siliceous fossil meals or of similar siliceous earths.”",13359526
202504,502,United States,6905,"Roofing tiles, chimneypots, cowls, chimney liners, architectural ornaments and other ceramic constructional goods.",8896
202504,502,United States,6906,"Ceramic pipes, conduits, guttering and pipe fittings",779910
202504,502,United States,6907,"Geramic flags and paving, hearth or wall tiles; ceramic mosaic cubes and the like, whether or not on a backing; finishing ceramics.",455246
202504,502,United States,6909,"Geramic wares for laboratory, chemical or other technical uses; ceramic troughs, tubs and similar receptacles of a kind used in agriculture; ceramic pots, jars and similar articles of a kind used for the conveyance or packing of goods.",57751211
202504,502,United States,6910,"Geramic sinks, wash basins, wash basin pedestals, baths, bidets, water closet pans, flushing cisterns, urinals and similar sanitary fixtures.",201889
202504,502,United States,6911,"Tableware, kitchenware, other household articles and toilet articles, of porcelain or china.",21166
202504,502,United States,6912,"Geramic tableware, kitchenware, other household articles and toilet articles, other than of porcelain or china.",31983
202504,502,United States,6913,Statuettes and other ornamental ceramic articles.,18115
202504,502,United States,6914,Other ceramic articles.,22972135
202504,502,United States,7001,"Cullet and other waste and scrap of glass, excluding glass from cathode ray tubes or other activated glass of heading 85.49; glass in the mass.",22217263
202504,502,United States,7002,"Glass in balls (other than microspheres of heading 70.18), rods or tubes, unworked.",19847434
202504,502,United States,7003,"Cast glass and rolled glass, in sheets or profiles, whether or not having an absorbent, reflecting or nonreflecting layer, but not otherwise worked.",229602651
202504,502,United States,7004,"Drawn glass and blown glass, in sheets, whether or not having an absorbent, reflecting or nonreflecting layer, but not otherwise worked.",284070
202504,502,United States,7005,"Float glass and surface ground or polished glass, in sheets, whether or not having an absorbent, reflecting or nonreflecting layer, but not otherwise worked.",500976
202504,502,United States,7006,"Glass of heading 70.03, 70.04 or 70.05, bent, edgeworked, engraved, drilled, enamelled or otherwise worked, but not framed or fitted with other materials.",42327
202504,502,United States,7007,"safety glass, consisting of toughened (tempered) or laminated glass.",8856930
202504,502,United States,7008,Multiplewalled insulating units of glass.,3052
202504,502,United States,7009,"Glass mirrors, whether or not framed, including rearview mirrors.",97474641
202504,502,United States,7010,"Carboys, bottles, flasks, jars, pots, phials, ampoules and other containers, of glass, of a kind used for the conveyance or packing of goods; preserving jars of glass; stoppers, lids and other closures, of glass.",2548968
202504,502,United States,7011,"Glass envelopes (including bulbs and tubes), open, and glass parts thereof, without fittings, for electric lamps and light sources, cathoderay tubes or the like.",1337135
202504,502,United States,7013,"Glassware of a kind used for table, kitchen, toilet, office, indoor decoration or similar purposes (other than that of heading 70.10 or 70.18).",1701999
202504,502,United States,7014,"Signalling glassware and optical elements of glass (other than those of heading 70.15), not optically worked.",5909688
202504,502,United States,7016,"Paving blocks, slabs, bricks, squares, tiles and other articles of pressed or moulded glass, whether or not wired, of a kind used for building or construction purposes; glass cubes and other glass smallwares, whether or not on a backing, for mosaics or similar decorative purposes; leaded lights and the like; multicellular or foam glass in blocks, panels, plates, shells or similar forms.",1934
202504,502,United States,7017,"Laboratory, hygienic or pharmaceutical glassware, whether or not graduated or calibrated.",27189606
202504,502,United States,7018,"Glass beads, imitation pearls, imitation precious or semiprecious stones and similar glass smallwares, and articles thereof other than imitation jewellery; glass eyes other than prosthetic articles; statuettes and other ornaments of lampworked glass, other than imitation jewellery; glass microspheres not exceeding 1mm in diameter.",2030955
202504,502,United States,7019,"Glass fibres (including glass wool) and articles thereof (for example, yarn, rovings, woven fabrics).",75270578
202504,502,United States,7020,Other articles of glass,40223896
202504,502,United States,7101,"Pearls, natural or cultured, whether or not worked or graded but not strung, mounted or set; pearls, natural or cultured, temporarily strung for convenience of transport.",304
202504,502,United States,7103,"Precious stones and semi-precious stones, whether or not worked or graded, but not strung, mounted or set, ungraded precious stones and semi-precious stones, temporarily strung for convenience of transport",708053
202504,502,United States,7104,"Synthetic or reconstructed precious or semiprecious stones, whether or not worked or graded but not strung, mounted or set; ungraded synthetic or reconstructed precious or semiprecious stones, temporarily strung for convenience of transport.",9190118
202504,502,United States,7105,Dust and powder of natural or synthetic precious or semiprecious stones.,1750353
202504,502,United States,7106,"Silver (including silver plated with gold or platinum), unwrought or in semimanufactured forms, or in powder form.",77826224
202504,502,United States,7107,"Base metals clad with silver, not further worked than semimanufactured.",732688
202504,502,United States,7108,"Gold (including gold plated with platinum) unwrought or in semimanufactured forms, or in powder form.",13329932
202504,502,United States,7110,"Platinum, unwrought or in semimanufactured forms, or in powder form.",27035741
202504,502,United States,7113,"Articles of jewellery and parts thereof, of precious metal or of metal clad with precious metal.",143335317
202504,502,United States,7114,"Articles of goldsmiths' or silversmiths' wares and parts thereof, of precious metal or of metal clad with precious metal.",54107
202504,502,United States,7115,Other articles of precious metal or of metal clad with precious metal.,24751315
202504,502,United States,7116,"Articles of natural or cultured pearls, precious or semiprecious stones (natural, synthetic or reconstructed).",960258
202504,502,United States,7117,Imitation jewellery.,2850273
202504,502,United States,7118,Coin.,5736
202504,502,United States,7201,"Pig iron and spiegeleisen in pigs, blocks or other primary forms.",7603
202504,502,United States,7202,Ferroalloys.,967901
202504,502,United States,7204,Ferrous waste and scrap; remelting scrap ingots of iron or steel.,2686236
202504,502,United States,7205,"Nranules and powders, of pig iron, spiegeleisen, iron or steel",16254275
202504,502,United States,7206,Iron and nonalloy steel in ingots or other primary forms (excluding iron of heading 72.03).,68832
202504,502,United States,7207,Semi-finished products of iron or nonalloy steel.,1345
202504,502,United States,7208,"Flat-rolled products of iron or nonalloy steel, of a width of 600 mm or more, hotrolled, not clad, plated or coated.",203629
202504,502,United States,7209,"Flat-rolled products of iron or nonalloy steel, of a width of 600 mm or more, coldrolled (coldreduced), not clad, plated or coated.",1279550
202504,502,United States,7210,"at-rolled products of iron or non-alloy steel, of a width ≥ 600 mm, hot-rolled or cold-rolled ""cold-reduced"", clad, plated or coated",23800094
202504,502,United States,7211,"Flat-rolled products of iron or nonalloy steel, of a width of less than 600 mm, not clad, plated or coated.",469780
202504,502,United States,7212,"Flat-rolled products of iron or nonalloy steel, of a width of less than 600 mm, clad, plated or coated.",8216502
202504,502,United States,7214,"Other bars and rods of iron or nonalloy steel, not further worked than forged, hotrolled, hotdrawn or hotextruded, but including those twisted after rolling.",36284
202504,502,United States,7215,Other bars and rods of iron or nonalloy steel.,81443
202504,502,United States,7216,"Angles, shapes and sections of iron or nonalloy steel.",332072
202504,502,United States,7217,Wire of iron or nonalloy steel.,200656
202504,502,United States,7218,Stainless steel in ingots or other primary forms; semifinished products of stainless steel.,13282
202504,502,United States,7219,"Flat-rolled products of stainless steel, of a width of 600 mm or more.",18809092
202504,502,United States,7220,"Flat-rolled products of stainless steel, of a width of less than 600 mm.",10179700
202504,502,United States,7222,"Other bars and rods of stainless steel; angles, shapes and sections of stainless steel.",46884816
202504,502,United States,7223,Wire of stainless steel,4809293
202504,502,United States,7224,Other alloy steel in ingots or other primary forms; semifinished products of other alloy steel.,12944
202504,502,United States,7225,"Flat-rolled products of other alloy steel, of a width of 600 mm or more.",905860
202504,502,United States,7226,"Flat-rolled products of alloy steel other than stainless, of a width of ≥ 600 mm, hot-rolled or cold-rolled ""cold-reduced"" and further worked (excluding plated or coated with zinc and products of silicon-electrical steel)",2258215
