Date of data,Trading partner code,Trading partner,Commodity code,Commodity,Renminbi Yuan
202410,502,United States,5806,"Narrow woven fabrics of textile materials, with a width of ≤ 30 cm (excluding labels, badges and similar articles); narrow fabrics consisting of warp without weft assembled by means of an adhesive ""bolducs""",2288892
202410,502,United States,5807,"Cabels, badges and similar articles of textile materials, in the piece, in strips or cut to shape or size, not embroidered.",2676788
202410,502,United States,5808,"Braids of textile materials, in the piece; ornamental trimmings of textile materials, in the piece, not embroidered, other than knitted or crocheted; tassels, pompons and similar articles of textile materials",139399
202410,502,United States,5810,"Embroidery on a textile fabric ground, in the piece, in strips or in motifs",75699
202410,502,United States,5902,"Tyre cord fabric of high-tenacity yarn of nylon or other polyamides, polyesters or viscose rayon, whether or not dipped or impregnated with rubber or plastic",250688
202410,502,United States,5903,"Textile fabrics impregnated, coated, covered or laminated with plastics, other than those of heading 59.02.",5033616
202410,502,United States,5905,Textile wall coverings.,94250
202410,502,United States,5906,"Rubberised textile fabrics, other than those of heading 59.02.",3770391
202410,502,United States,5907,"Impregnated, coated or covered textile fabrics; painted canvas being theatrical scenery, studio backcloths or the like, n.e.s.",1440549
202410,502,United States,5908,"Textile wicks, woven, plaited or knitted, for lamps, stoves, lighters, candles or the like; incandescent gas mantles and tubular knitted gas-mantle fabric for incandescent gas mantles, whether or not impregnated",480910
202410,502,United States,5909,"Textile hosepiping and similar textile tubing, whether or not impregnated or coated, with or without lining, armour or accessories of other materials",70891
202410,502,United States,5910,"Transmission or conveyor belts or belting, of textile material, whether or not impregnated, coated, covered or laminated with plastics, or reinforced with metal or other material.",549960
202410,502,United States,5911,"Textile products and articles, for technical use, specified in Note 7 to chapter 59",13181344
202410,502,United States,6001,"Pile fabrics, incl. ""long pile"" fabrics and terry fabrics, knitted or crocheted",1349821
202410,502,United States,6003,"Knitted or crocheted fabrics of a width not exceeding 30cm, other than those of heading 60.01 or 60.02.",111584
202410,502,United States,6004,"Knitted or crocheted fabrics of a width exceeding 30 cm, containing by weight 5% or more of elastomeric yarn or rubber thread, other than those of heading 60.01",19671
202410,502,United States,6005,"Warp knit fabrics (including those made on galloon knitting machines), other than those of headings 60.01 to 60.04.",2853811
202410,502,United States,6006,Other knitted or crocheted fabrics.,330869
202410,502,United States,6101,"Men's or boys' overcoats, car coats, capes, cloaks, anoraks, incl. ski jackets, windcheaters, wind-jackets and similar articles, knitted or crocheted (excluding suits, ensembles, jackets, blazers, bib and brace overalls and trousers)",292562
202410,502,United States,6102,"Women's or girls' overcoats, carcoats, capes, cloaks, anoraks (including skijackets), windcheaters, windjackets and similar articles, knitted or crocheted, other than those of heading 61.04.",125348
202410,502,United States,6103,"Men's or boys' suits, ensembles, jackets, blazers, trousers, bib and brace overalls, breeches and shorts",2663111
202410,502,United States,6104,"Women's or girls' suits, ensembles, jackets, blazers, dresses, skirts, divided skirts, trousers, bib and brace overalls, breeches and shorts, knitted or crocheted",2312922
202410,502,United States,6105,"en's or boys' shirts, knitted or crocheted.",1191055
202410,502,United States,6106,"Women's or girls' blouses, shirts and shirt-blouses, knitted or crocheted (excluding T-shirts and vests)",636669
202410,502,United States,6107,"Men's or boys' underpants, briefs, nightshirts, pyjamas, bathrobes, dressing gowns and similar articles, knitted or crocheted (excluding vests and singlets)",53684
202410,502,United States,6108,"Women's or girls' slips, petticoats, briefs, panties, nightdresses, pyjamas, négligés, bathrobes, dressing gowns, housecoats and similar articles, knitted or crocheted (excluding T-shirts, vests, brassieres, girdles, corsets and similar articles)",80591
202410,502,United States,6109,"T-shirts, singlets and other vests, knitted or crocheted",3173436
202410,502,United States,6110,"Jerseys, pullovers, cardigans, waistcoats and similar articles, of wool, knitted or crocheted (excluding wadded waistcoats)",6970054
202410,502,United States,6111,"Babies' garments and clothing accessories of wool or fine animal hair, knitted or crocheted (excluding hats)",34022
202410,502,United States,6112,"Track-suits, ski-suits and swimwear, knitted or crocheted",59433
202410,502,United States,6113,"Garments, knitted or crocheted, rubberised or impregnated, coated or covered with plastics or other materials (excluding babies' garments and clothing accessories)",1935
202410,502,United States,6114,"Special garments for professional, sporting or other purposes, n.e.s., knitted or crocheted",151125
202410,502,United States,6115,"Pantyhose, tights, stockings, socks and other hosiery, incl. graduated compression hosiery [e.g., stockings for varicose veins] and footwear without applied soles, knitted or crocheted (excluding for babies)",140703
202410,502,United States,6116,"Gloves, mittens and mitts, knitted or crocheted (excluding for babies)",105747
202410,502,United States,6117,"Other made up clothing accessories, knitted or crocheted; knitted or crocheted parts of garments or of clothing accessories.",270806
202410,502,United States,6201,"Men’s or boys’ overcoats, car-coats, capes, cloaks, anoraks (including ski-jackets), wind-cheaters, windjackets and similar articles, other than those of heading 62.03.",5413194
202410,502,United States,6202,"Women’s or girls’ overcoats, car-coats, capes, cloaks, anoraks (including ski-jackets), wind-cheaters, wind-jackets and similar articles, other than those of heading 62.04.",1425171
202410,502,United States,6203,"Men's or boys' suits, ensembles, jackets, blazers, trousers, bib and brace overalls, breeches and shorts (excluding knitted or crocheted, wind-jackets and similar articles, separate waistcoats, tracksuits, ski suits and swimwear)",1925913
202410,502,United States,6204,"Women's or girls' suits, ensembles, jackets, blazers, dresses, skirts, divided skirts, trousers, bib and brace overalls, breeches and shorts (excluding knitted or crocheted, wind-jackets and similar articles, slips, petticoats and panties, tracksuits, ski suits and swimwear)",3459797
202410,502,United States,6205,Men's or boys' shirts.,708740
202410,502,United States,6206,"Women's or girls' blouses, shirts and shirtblouses.",311418
202410,502,United States,6207,"Men's or boys' singlets and other vests, underpants, briefs, nightshirts, pyjamas, bathrobes, dressing gowns and similar articles",72459
202410,502,United States,6208,"Women's or girls' singlets and other vests, slips, petticoats, briefs, panties, nightdresses, pyjamas, négligés, bathrobes, dressing gowns, housecoats and similar articles (excluding knitted or crocheted, brassières, girdles, corsets and similar articles)",46827
202410,502,United States,6209,Babies garments and clothing accessories of textile materials (excluding knitted or crocheted and hats),8614
202410,502,United States,6210,"Garments made up of felt or nonwovens, whether or not impregnated, coated, covered or laminated; garments of textile fabrics, rubberised or impregnated, coated, covered or laminated with plastics or other substances (excluding knitted or crocheted, and babies' garments and clothing accessories)",24150
202410,502,United States,6211,"Tracksuits, ski suits, swimwear and other garments, n.e.s.",2181049
202410,502,United States,6212,"Brassieres, girdles, corsets, braces, suspenders, garters and similar articles and parts thereof, of all types of textile materials, whether or not elasticated, incl. knitted or crocheted (excluding belts and corselets made entirely of rubber)",83494
202410,502,United States,6214,"Shawls, scarves, mufflers, mantillas, veils and similar articles",130389
202410,502,United States,6215,"Ties, bow ties and cravats of textile materials",5920
202410,502,United States,6216,"Gloves, mittens and mitts, of all types of textile materials (excluding knitted or crocheted and for babies)",44948
202410,502,United States,6217,"Made-up clothing accessories and parts of garments or clothing accessories, of all types of textile materials, n.e.s.",70482
202410,502,United States,6301,Blankets and travelling rugs,21972
202410,502,United States,6302,"Bed linen, table linen, toilet linen and kitchen linen.",46114
202410,502,United States,6303,Curtains (including drapes) and interior blinds; curtain or bed valances.,406752
202410,502,United States,6304,"Other furnishing articles, excluding those of heading 94.04.",3318364
202410,502,United States,6305,"Packs and bags, of a kind used for the packing of goods.",544697
202410,502,United States,6306,"Tarpaulins, awnings and sunblinds; tents (including temporary canopies and similar articles); sails for boats, sailboards or landcraft; camping goods.”",313300
202410,502,United States,6307,"other made up articles, including dress patterns.",7629121
202410,502,United States,6308,"Sets consisting of woven fabric and yarn, whether or not with accessories, for making up into rugs, tapestries, embroidered table cloths or serviettes, or similar textile articles, put up in packings for retail sale.",3424
202410,502,United States,6401,"Waterproof footwear with outer soles and uppers of rubber or of plastics, the uppers of which are neither fixed to the sole nor assembled by stitching, riveting, nailing, screwing, plugging or similar processes.",7929
202410,502,United States,6402,Other footwear with outer soles and uppers of rubber or plastics.,2028296
202410,502,United States,6403,"ootwear with outer soles of rubber, plastics, leather or composition leather and uppers of leather.",48669795
202410,502,United States,6404,"Footwear with outer soles of rubber, plastics, leather or composition leather and uppers of textile materials.",12390716
202410,502,United States,6405,Other footwear.,1446650
202410,502,United States,6406,"Parts of footwear, incl. uppers whether or not attached to soles other than outer soles; removable in-soles, heel cushions and similar articles; gaiters, leggings and similar articles, and parts thereof (excluding articles of asbestos)",34087009
202410,502,United States,6505,"Hats and other headgear, knitted or crocheted, or made up from lace, felt or other textile fabric, in the piece (but not in strips), whether or not lined or trimmed; hairnets of any material, whether or not lined or trimmed",1046933
202410,502,United States,6506,"Other headgear, whether or not lined or trimmed.",2586994
202410,502,United States,6507,"Headbands, linings, covers, hat foundations, hat frames, peaks and chinstraps, for headgear",11566
202410,502,United States,6601,"Umbrellas and sun umbrellas (including walkingstick umbrellas, garden umbrellas and similar umbrellas).",6481
202410,502,United States,6702,"Artificial flowers, foliage and fruit and parts thereof; articles made of artificial flowers, foliage or fruit.",4319
202410,502,United States,6703,"Human hair, dressed, thinned, bleached or otherwise worked; wool or other animal hair or other textile materials, prepared for use in making wigs or the like.",1058142
202410,502,United States,6704,"igs, false beards, eyebrows and eyelashes, switches and the like, of human or animal hair or of textile materials; articles of human hair not elsewhere specified or included.",1081358
202410,502,United States,6802,"Worked monumental or building stone (except slate) and articles thereof, other than goods of heading 68.01; mosaic cubes and the like, of natural stone (including slate), whether or not on a backing; artificially coloured granules, chippings and powder, of natural stone (including slate).",82487
202410,502,United States,6804,"Millstones, grindstones, grinding wheels and the like, without frameworks, for milling, grinding, pulping, sharpening, polishing, trueing or cutting, hand sharpening or polishing stones, and parts thereof, of natural stone, of agglomerated natural or artificial abrasives, or of ceramics, with or without parts of other materials",7065988
202410,502,United States,6805,"Natural or artificial abrasive powder or grain, on a base of textile material, of paper, of paperboard or of other materials, whether or not cut to shape or sewn or otherwise made up.",17432901
202410,502,United States,6806,"Slag-wool, rock-wool and similar mineral wools; exfoliated vermiculite, expanded clays, foamed slag and similar expanded mineral materials; mixtures and articles of heat-insulating, sound-insulating or sound absorbing mineral materials",3852768
202410,502,United States,6807,"Articles of asphalt or of similar material (for example, petroleum bitumen or coal tar pitch).",412409
202410,502,United States,6809,Articles of plaster or of compositions based on plaster.,13402
202410,502,United States,6810,"Articles of cement, of concrete or of artificial stone, whether or not reinforced.",627155
202410,502,United States,6811,"Articles of asbestos-cement, of cellulose fibre-cement or the like.",24214
202410,502,United States,6812,"Fabricated asbestos fibres; mixtures with a basis of asbestos or with a basis of asbestos and magnesium carbonate; articles of such mixtures or of asbestos (for example, thread, woven fabric, clothing, headgear, footwear, gaskets), whether or not reinforced, other than goods of heading 68.11 or 68.13.",66465
202410,502,United States,6813,"Friction material and articles thereof, e.g., sheets, rolls, strips, segments, discs, washers, pads, not mounted, for brakes, clutches or the like, with a basis of asbestos, other mineral substances or cellulose, whether or not combined with textile or other materials",8444567
202410,502,United States,6814,"Worked mica and articles of mica, including agglomerated or reconstituted mica, whether or not on a support of paper, paperboard or other materials.",24036
202410,502,United States,6815,"Articles of stone or of other mineral substances (including carbon fibres, articles of carbon fibres and articles of peat), not elsewhere specified or included.",91873543
202410,502,United States,6902,"Refractory bricks, blocks, tiles and similar refractory ceramic constructional goods, other than those of siliceous fossil meals or similar siliceous earths.",11273221
202410,502,United States,6903,"Other refractory ceramic goods (for example, retorts, crucibles, muffles, nozzles, plugs, supports, cupels, tubes, pipes, sheaths, rods and slide gates), other than those of siliceous fossil meals or of similar siliceous earths.”",14629594
202410,502,United States,6904,"Geramic building bricks, flooring blocks, support or filler tiles and the like.",13297
202410,502,United States,6905,"Roofing tiles, chimneypots, cowls, chimney liners, architectural ornaments and other ceramic constructional goods.",14522
202410,502,United States,6906,"Ceramic pipes, conduits, guttering and pipe fittings",873816
202410,502,United States,6907,"Geramic flags and paving, hearth or wall tiles; ceramic mosaic cubes and the like, whether or not on a backing; finishing ceramics.",1800600
202410,502,United States,6909,"Geramic wares for laboratory, chemical or other technical uses; ceramic troughs, tubs and similar receptacles of a kind used in agriculture; ceramic pots, jars and similar articles of a kind used for the conveyance or packing of goods.",43016628
202410,502,United States,6910,"Geramic sinks, wash basins, wash basin pedestals, baths, bidets, water closet pans, flushing cisterns, urinals and similar sanitary fixtures.",165591
202410,502,United States,6911,"Tableware, kitchenware, other household articles and toilet articles, of porcelain or china.",51627
202410,502,United States,6912,"Geramic tableware, kitchenware, other household articles and toilet articles, other than of porcelain or china.",19457
202410,502,United States,6913,Statuettes and other ornamental ceramic articles.,20350
202410,502,United States,6914,Other ceramic articles.,13686445
202410,502,United States,7001,"Cullet and other waste and scrap of glass, excluding glass from cathode ray tubes or other activated glass of heading 85.49; glass in the mass.",9552385
202410,502,United States,7002,"Glass in balls (other than microspheres of heading 70.18), rods or tubes, unworked.",18816874
202410,502,United States,7003,"Cast glass and rolled glass, in sheets or profiles, whether or not having an absorbent, reflecting or nonreflecting layer, but not otherwise worked.",129095413
202410,502,United States,7004,"Drawn glass and blown glass, in sheets, whether or not having an absorbent, reflecting or nonreflecting layer, but not otherwise worked.",302785
202410,502,United States,7005,"Float glass and surface ground or polished glass, in sheets, whether or not having an absorbent, reflecting or nonreflecting layer, but not otherwise worked.",395991
202410,502,United States,7006,"Glass of heading 70.03, 70.04 or 70.05, bent, edgeworked, engraved, drilled, enamelled or otherwise worked, but not framed or fitted with other materials.",368623
202410,502,United States,7007,"safety glass, consisting of toughened (tempered) or laminated glass.",13267263
202410,502,United States,7008,Multiplewalled insulating units of glass.,612
202410,502,United States,7009,"Glass mirrors, whether or not framed, including rearview mirrors.",124108313
202410,502,United States,7010,"Carboys, bottles, flasks, jars, pots, phials, ampoules and other containers, of glass, of a kind used for the conveyance or packing of goods; preserving jars of glass; stoppers, lids and other closures, of glass.",1802359
202410,502,United States,7011,"Glass envelopes (including bulbs and tubes), open, and glass parts thereof, without fittings, for electric lamps and light sources, cathoderay tubes or the like.",615312
202410,502,United States,7013,"Glassware of a kind used for table, kitchen, toilet, office, indoor decoration or similar purposes (other than that of heading 70.10 or 70.18).",1890277
202410,502,United States,7014,"Signalling glassware and optical elements of glass (other than those of heading 70.15), not optically worked.",11561395
202410,502,United States,7016,"Paving blocks, slabs, bricks, squares, tiles and other articles of pressed or moulded glass, whether or not wired, of a kind used for building or construction purposes; glass cubes and other glass smallwares, whether or not on a backing, for mosaics or similar decorative purposes; leaded lights and the like; multicellular or foam glass in blocks, panels, plates, shells or similar forms.",691019
202410,502,United States,7017,"Laboratory, hygienic or pharmaceutical glassware, whether or not graduated or calibrated.",17153843
202410,502,United States,7018,"Glass beads, imitation pearls, imitation precious or semiprecious stones and similar glass smallwares, and articles thereof other than imitation jewellery; glass eyes other than prosthetic articles; statuettes and other ornaments of lampworked glass, other than imitation jewellery; glass microspheres not exceeding 1mm in diameter.",928180
202410,502,United States,7019,"Glass fibres (including glass wool) and articles thereof (for example, yarn, rovings, woven fabrics).",64914327
202410,502,United States,7020,Other articles of glass,33222283
202410,502,United States,7102,"Diamonds, whether or not worked, but not mounted or set.",64497415
202410,502,United States,7103,"Precious stones and semi-precious stones, whether or not worked or graded, but not strung, mounted or set, ungraded precious stones and semi-precious stones, temporarily strung for convenience of transport",63069497
202410,502,United States,7104,"Synthetic or reconstructed precious or semiprecious stones, whether or not worked or graded but not strung, mounted or set; ungraded synthetic or reconstructed precious or semiprecious stones, temporarily strung for convenience of transport.",2708565
202410,502,United States,7105,Dust and powder of natural or synthetic precious or semiprecious stones.,1418190
202410,502,United States,7106,"Silver (including silver plated with gold or platinum), unwrought or in semimanufactured forms, or in powder form.",79068915
202410,502,United States,7107,"Base metals clad with silver, not further worked than semimanufactured.",596006
202410,502,United States,7108,"Gold (including gold plated with platinum) unwrought or in semimanufactured forms, or in powder form.",54370106
202410,502,United States,7110,"Platinum, unwrought or in semimanufactured forms, or in powder form.",9946623
202410,502,United States,7112,"Waste and scrap of precious metal or of metal clad with precious metal; other waste and scrap containing precious metal or precious metal compounds, of a kind used principally for the recovery of precious metal.Except for articles of 85.49",1909
202410,502,United States,7113,"Articles of jewellery and parts thereof, of precious metal or of metal clad with precious metal.",1208129316
202410,502,United States,7114,"Articles of goldsmiths' or silversmiths' wares and parts thereof, of precious metal or of metal clad with precious metal.",48466
202410,502,United States,7115,Other articles of precious metal or of metal clad with precious metal.,12960793
202410,502,United States,7116,"Articles of natural or cultured pearls, precious or semiprecious stones (natural, synthetic or reconstructed).",1480027
202410,502,United States,7117,Imitation jewellery.,1879224
202410,502,United States,7118,Coin.,2367
202410,502,United States,7202,Ferroalloys.,6704
202410,502,United States,7203,"Ferrous products obtained by direct reduction of iron ore and other spongy ferrous products, in lumps, pellets or similar forms; iron having a minimum purity by weight of 99.94%, in lumps, pellets or similar forms.",6606
202410,502,United States,7204,Ferrous waste and scrap; remelting scrap ingots of iron or steel.,793247
202410,502,United States,7205,"Nranules and powders, of pig iron, spiegeleisen, iron or steel",11994019
202410,502,United States,7206,Iron and nonalloy steel in ingots or other primary forms (excluding iron of heading 72.03).,14866
202410,502,United States,7208,"Flat-rolled products of iron or nonalloy steel, of a width of 600 mm or more, hotrolled, not clad, plated or coated.",24566
202410,502,United States,7209,"Flat-rolled products of iron or nonalloy steel, of a width of 600 mm or more, coldrolled (coldreduced), not clad, plated or coated.",145135
202410,502,United States,7210,"at-rolled products of iron or non-alloy steel, of a width ≥ 600 mm, hot-rolled or cold-rolled ""cold-reduced"", clad, plated or coated",10396431
202410,502,United States,7211,"Flat-rolled products of iron or nonalloy steel, of a width of less than 600 mm, not clad, plated or coated.",2111034
202410,502,United States,7212,"Flat-rolled products of iron or nonalloy steel, of a width of less than 600 mm, clad, plated or coated.",8835571
202410,502,United States,7214,"Other bars and rods of iron or nonalloy steel, not further worked than forged, hotrolled, hotdrawn or hotextruded, but including those twisted after rolling.",236051
202410,502,United States,7215,Other bars and rods of iron or nonalloy steel.,315957
202410,502,United States,7216,"Angles, shapes and sections of iron or nonalloy steel.",535940
202410,502,United States,7217,Wire of iron or nonalloy steel.,113137
202410,502,United States,7218,Stainless steel in ingots or other primary forms; semifinished products of stainless steel.,186385
202410,502,United States,7219,"Flat-rolled products of stainless steel, of a width of 600 mm or more.",18306753
202410,502,United States,7220,"Flat-rolled products of stainless steel, of a width of less than 600 mm.",12667394
202410,502,United States,7222,"Other bars and rods of stainless steel; angles, shapes and sections of stainless steel.",58389816
202410,502,United States,7223,Wire of stainless steel,6120429
202410,502,United States,7225,"Flat-rolled products of other alloy steel, of a width of 600 mm or more.",2624885
202410,502,United States,7226,"Flat-rolled products of alloy steel other than stainless, of a width of ≥ 600 mm, hot-rolled or cold-rolled ""cold-reduced"" and further worked (excluding plated or coated with zinc and products of silicon-electrical steel)",6913378
202410,502,United States,7228,"Other bars and rods of other alloy steel; angles, shapes and sections, of other alloy steel; hollow drill bars and rods, of alloy or nonalloy steel.",11140577
202410,502,United States,7229,Wire of other alloy steel.,50096
202410,502,United States,7301,"Sheet piling of iron or steel, whether or not drilled, punched or made from assembled elements; welded angles, shapes and sections, of iron or steel.",6008
202410,502,United States,7303,"Tubes, pipes and hollow profiles, of cast iron.",100368
202410,502,United States,7304,"Tubes, pipes and hollow profiles, seamless, of iron (other than cast iron) or steel.",5154482
202410,502,United States,7306,"Other tubes, pipes and hollow profiles (for example, open seam or welded, riveted or similarly closed), of iron or steel.",4773425
202410,502,United States,7307,"Tube or pipe fittings (for example, couplings, elbows, sleeves), of iron or steel.",89034065
