Date of data,Trading partner code,Trading partner,Commodity code,Commodity,Renminbi Yuan
201902,502,United States,5515,Other woven fabrics of synthetic staple fibres.,306851
201902,502,United States,5516,Woven fabrics of artificial staple fibres.,252388
201902,502,United States,5601,"Wadding of textile materials and articles thereof; textile fibres, not exceeding 5 mm in length (flock),textile dust and mill neps.",10757307
201902,502,United States,5602,"Felt, whether or not impregnated, coated, covered or laminated.",1034398
201902,502,United States,5603,"Nonwovens, whether or not impregnated, coated, covered or laminated.",36558303
201902,502,United States,5604,"Textile-covered rubber thread and cord; textile yarn, strip and the like of heading 5404 and 5405, impregnated, coated, covered or sheathed with rubber or plastics",205956
201902,502,United States,5605,"Metallised yarn, whether or not gimped, being textile yarn, or strip or the like of heading 5404 or 5405, of textile fibres, combined with metal in the form of thread, strip or powder or covered with metal",336488
201902,502,United States,5606,"Gimped yarn, gimped strip and the like of heading 5404 or 5405; chenille yarn, incl. flock chenille yarn, and loop wale-yarn",73424
201902,502,United States,5607,"Twine, cordage, ropes and cables, whether or not plaited or braided and whether or not impregnated, coated, covered or sheathed with rubber or plastics",3697327
201902,502,United States,5608,"Knotted netting of twine, cordage or rope; made up fishing nets and other made up nets, of textile materials.",926045
201902,502,United States,5609,"Articles of yarn, strip or the like of heading 54.04 or 54.05, twine, cordage, rope or cables, not elsewhere specified or included.",412522
201902,502,United States,5701,"Carpets and other textile floor coverings, knotted, whether or not made up.",132177
201902,502,United States,5702,"Carpets and other textile floor coverings, woven, not tufted or flocked, whether or not made up, incl. Kelem, Schumacks, Karamanie and similar hand-woven rugs",527731
201902,502,United States,5703,"Carpets and other textile floor coverings, tufted, whether or not made up.",3711359
201902,502,United States,5705,"Other carpets and other textile floor coverings, whether or not made up.",1043513
201902,502,United States,5801,"Woven pile fabrics and chenille fabrics (excluding terry towelling and similar woven terry fabrics, tufted textile fabrics and narrow woven fabrics of heading 5806)",2421031
201902,502,United States,5802,"Terry towelling and similar woven terry fabrics, tufted textile fabrics (excluding narrow woven fabrics of heading 5806, carpets and other floor coverings)",13109
201902,502,United States,5804,"Tulles and other net fabrics, not including woven, knitted or crocheted fabrics; lace in the piece, in strips or in motifs, other than fabrics of headings 60.02 to 60.06.",233148
201902,502,United States,5806,"Narrow woven fabrics of textile materials, with a width of ≤ 30 cm (excluding labels, badges and similar articles); narrow fabrics consisting of warp without weft assembled by means of an adhesive ""bolducs""",3491160
201902,502,United States,5807,"Cabels, badges and similar articles of textile materials, in the piece, in strips or cut to shape or size, not embroidered.",777466
201902,502,United States,5808,"Braids of textile materials, in the piece; ornamental trimmings of textile materials, in the piece, not embroidered, other than knitted or crocheted; tassels, pompons and similar articles of textile materials",179926
201902,502,United States,5810,"Embroidery on a textile fabric ground, in the piece, in strips or in motifs",34264
201902,502,United States,5811,"Quilted textile products in the piece, composed of one or more layers of textile materials assembled with padding by stitching or otherwise (excluding embroidery of heading 5810 and quilted fabrics for bedding and furnishings)",979961
201902,502,United States,5901,"Quilted textile products in the piece, composed of one or more layers of textile materials assembled with padding by stitching or otherwise (excluding embroidery of heading 5810 and quilted fabrics for bedding and furnishings)",949
201902,502,United States,5902,"Tyre cord fabric of high-tenacity yarn of nylon or other polyamides, polyesters or viscose rayon, whether or not dipped or impregnated with rubber or plastic",49768
201902,502,United States,5903,"Textile fabrics impregnated, coated, covered or laminated with plastics, other than those of heading 59.02.",10783736
201902,502,United States,5905,Textile wall coverings.,64226
201902,502,United States,5906,"Rubberised textile fabrics, other than those of heading 59.02.",1062728
201902,502,United States,5907,"Impregnated, coated or covered textile fabrics; painted canvas being theatrical scenery, studio backcloths or the like, n.e.s.",25177338
201902,502,United States,5908,"Textile wicks, woven, plaited or knitted, for lamps, stoves, lighters, candles or the like; incandescent gas mantles and tubular knitted gas-mantle fabric for incandescent gas mantles, whether or not impregnated",619859
201902,502,United States,5909,"Textile hosepiping and similar textile tubing, whether or not impregnated or coated, with or without lining, armour or accessories of other materials",2763434
201902,502,United States,5910,"Transmission or conveyor belts or belting, of textile material, whether or not impregnated, coated, covered or laminated with plastics, or reinforced with metal or other material.",752537
201902,502,United States,5911,"Textile products and articles, for technical use, specified in Note 7 to chapter 59",16207920
201902,502,United States,6001,"Pile fabrics, incl. ""long pile"" fabrics and terry fabrics, knitted or crocheted",256752
201902,502,United States,6002,"Knitted or crocheted fabrics of a width not exceeding 30cm, containing by weight 5% or more of elastomeric yarn or rubber thread, other than those of heading 60.01.",623
201902,502,United States,6003,"Knitted or crocheted fabrics of a width not exceeding 30cm, other than those of heading 60.01 or 60.02.",341138
201902,502,United States,6004,"Knitted or crocheted fabrics of a width exceeding 30 cm, containing by weight 5% or more of elastomeric yarn or rubber thread, other than those of heading 60.01",816412
201902,502,United States,6005,"Warp knit fabrics (including those made on galloon knitting machines), other than those of headings 60.01 to 60.04.",2836921
201902,502,United States,6006,Other knitted or crocheted fabrics.,1105545
201902,502,United States,6101,"Men's or boys' overcoats, car coats, capes, cloaks, anoraks, incl. ski jackets, windcheaters, wind-jackets and similar articles, knitted or crocheted (excluding suits, ensembles, jackets, blazers, bib and brace overalls and trousers)",614439
201902,502,United States,6102,"Women's or girls' overcoats, carcoats, capes, cloaks, anoraks (including skijackets), windcheaters, windjackets and similar articles, knitted or crocheted, other than those of heading 61.04.",476526
201902,502,United States,6103,"Men's or boys' suits, ensembles, jackets, blazers, trousers, bib and brace overalls, breeches and shorts",2705165
201902,502,United States,6104,"Women's or girls' suits, ensembles, jackets, blazers, dresses, skirts, divided skirts, trousers, bib and brace overalls, breeches and shorts, knitted or crocheted",3571448
201902,502,United States,6105,"en's or boys' shirts, knitted or crocheted.",618880
201902,502,United States,6106,"Women's or girls' blouses, shirts and shirt-blouses, knitted or crocheted (excluding T-shirts and vests)",78884
201902,502,United States,6107,"Men's or boys' underpants, briefs, nightshirts, pyjamas, bathrobes, dressing gowns and similar articles, knitted or crocheted (excluding vests and singlets)",200239
201902,502,United States,6108,"Women's or girls' slips, petticoats, briefs, panties, nightdresses, pyjamas, négligés, bathrobes, dressing gowns, housecoats and similar articles, knitted or crocheted (excluding T-shirts, vests, brassieres, girdles, corsets and similar articles)",712208
201902,502,United States,6109,"T-shirts, singlets and other vests, knitted or crocheted",4740768
201902,502,United States,6110,"Jerseys, pullovers, cardigans, waistcoats and similar articles, of wool, knitted or crocheted (excluding wadded waistcoats)",4282910
201902,502,United States,6111,"Babies' garments and clothing accessories of wool or fine animal hair, knitted or crocheted (excluding hats)",124164
201902,502,United States,6112,"Track-suits, ski-suits and swimwear, knitted or crocheted",145322
201902,502,United States,6113,"Garments, knitted or crocheted, rubberised or impregnated, coated or covered with plastics or other materials (excluding babies' garments and clothing accessories)",8423
201902,502,United States,6114,"Special garments for professional, sporting or other purposes, n.e.s., knitted or crocheted",1730907
201902,502,United States,6115,"Pantyhose, tights, stockings, socks and other hosiery, incl. graduated compression hosiery [e.g., stockings for varicose veins] and footwear without applied soles, knitted or crocheted (excluding for babies)",1174378
201902,502,United States,6116,"Gloves, mittens and mitts, knitted or crocheted (excluding for babies)",132917
201902,502,United States,6117,"Other made up clothing accessories, knitted or crocheted; knitted or crocheted parts of garments or of clothing accessories.",715536
201902,502,United States,6201,"Men's or boys' overcoats, car coats, capes, cloaks, anoraks, incl. ski jackets, windcheaters, wind-jackets and similar articles (excluding knitted or crocheted, suits, ensembles, jackets, blazers and trousers)",1688689
201902,502,United States,6202,"Women's or girls' overcoats, car coats, capes, cloaks, anoraks, incl. ski jackets, windcheaters, wind-jackets and similar articles (excluding knitted or crocheted, suits, ensembles, jackets, blazers and trousers)",787589
201902,502,United States,6203,"Men's or boys' suits, ensembles, jackets, blazers, trousers, bib and brace overalls, breeches and shorts (excluding knitted or crocheted, wind-jackets and similar articles, separate waistcoats, tracksuits, ski suits and swimwear)",3794914
201902,502,United States,6204,"Women's or girls' suits, ensembles, jackets, blazers, dresses, skirts, divided skirts, trousers, bib and brace overalls, breeches and shorts (excluding knitted or crocheted, wind-jackets and similar articles, slips, petticoats and panties, tracksuits, ski suits and swimwear)",9745273
201902,502,United States,6205,Men's or boys' shirts.,904917
201902,502,United States,6206,"Women's or girls' blouses, shirts and shirtblouses.",538325
201902,502,United States,6207,"Men's or boys' singlets and other vests, underpants, briefs, nightshirts, pyjamas, bathrobes, dressing gowns and similar articles",281259
201902,502,United States,6208,"Women's or girls' singlets and other vests, slips, petticoats, briefs, panties, nightdresses, pyjamas, négligés, bathrobes, dressing gowns, housecoats and similar articles (excluding knitted or crocheted, brassières, girdles, corsets and similar articles)",649266
201902,502,United States,6209,Babies garments and clothing accessories of textile materials (excluding knitted or crocheted and hats),92229
201902,502,United States,6210,"Garments made up of felt or nonwovens, whether or not impregnated, coated, covered or laminated; garments of textile fabrics, rubberised or impregnated, coated, covered or laminated with plastics or other substances (excluding knitted or crocheted, and babies' garments and clothing accessories)",5888
201902,502,United States,6211,"Tracksuits, ski suits, swimwear and other garments, n.e.s.",1139822
201902,502,United States,6212,"Brassieres, girdles, corsets, braces, suspenders, garters and similar articles and parts thereof, of all types of textile materials, whether or not elasticated, incl. knitted or crocheted (excluding belts and corselets made entirely of rubber)",641394
201902,502,United States,6213,Handkerchiefs,227
201902,502,United States,6214,"Shawls, scarves, mufflers, mantillas, veils and similar articles",89678
201902,502,United States,6215,"Ties, bow ties and cravats of textile materials",208014
201902,502,United States,6216,"Gloves, mittens and mitts, of all types of textile materials (excluding knitted or crocheted and for babies)",54644
201902,502,United States,6217,"Made-up clothing accessories and parts of garments or clothing accessories, of all types of textile materials, n.e.s.",383312
201902,502,United States,6301,Blankets and travelling rugs,93960
201902,502,United States,6302,"Bed linen, table linen, toilet linen and kitchen linen.",168576
201902,502,United States,6303,Curtains (including drapes) and interior blinds; curtain or bed valances.,714165
201902,502,United States,6304,"Other furnishing articles, excluding those of heading 94.04.",1553283
201902,502,United States,6305,"Packs and bags, of a kind used for the packing of goods.",1061154
201902,502,United States,6306,"Tarpaulins, awnings and sunblinds; tents; sails for boats, sailboards or landcraft; camping goods of all types of textile materials",20961
201902,502,United States,6307,"other made up articles, including dress patterns.",9875440
201902,502,United States,6308,"Sets consisting of woven fabric and yarn, whether or not with accessories, for making up into rugs, tapestries, embroidered table cloths or serviettes, or similar textile articles, put up in packings for retail sale.",5170
201902,502,United States,6401,"Waterproof footwear with outer soles and uppers of rubber or of plastics, the uppers of which are neither fixed to the sole nor assembled by stitching, riveting, nailing, screwing, plugging or similar processes.",8313
201902,502,United States,6402,Other footwear with outer soles and uppers of rubber or plastics.,8944532
201902,502,United States,6403,"ootwear with outer soles of rubber, plastics, leather or composition leather and uppers of leather.",24138687
201902,502,United States,6404,"Footwear with outer soles of rubber, plastics, leather or composition leather and uppers of textile materials.",14883970
201902,502,United States,6405,Other footwear.,3745450
201902,502,United States,6406,"Parts of footwear, incl. uppers whether or not attached to soles other than outer soles; removable in-soles, heel cushions and similar articles; gaiters, leggings and similar articles, and parts thereof (excluding articles of asbestos)",46265404
201902,502,United States,6504,"Hats and other headgear, plaited or made by assembling strips of any material, whether or not lined or trimmed.",105961
201902,502,United States,6505,"Hats and other headgear, knitted or crocheted, or made up from lace, felt or other textile fabric, in the piece (but not in strips), whether or not lined or trimmed; hairnets of any material, whether or not lined or trimmed.",541032
201902,502,United States,6506,"Other headgear, whether or not lined or trimmed.",846279
201902,502,United States,6507,"Headbands, linings, covers, hat foundations, hat frames, peaks and chinstraps, for headgear.",581079
201902,502,United States,6601,"Umbrellas and sun umbrellas (including walkingstick umbrellas, garden umbrellas and similar umbrellas).",64987
201902,502,United States,6602,"Walkingsticks, seatsticks, whips, ridingcrops and the like.",5213
201902,502,United States,6603,"Parts, trimmings and accessories of articles of heading 66.01 or 66.02.",34
201902,502,United States,6701,"Skins and other parts of birds with their feathers or down, feathers, parts of feathers, down and articles thereof (other than goods of heading 05.05 and worked quills and scapes).",20237
201902,502,United States,6702,"Artificial flowers, foliage and fruit and parts thereof; articles made of artificial flowers, foliage or fruit.",207207
201902,502,United States,6703,"Human hair, dressed, thinned, bleached or otherwise worked; wool or other animal hair or other textile materials, prepared for use in making wigs or the like.",742487
201902,502,United States,6704,"igs, false beards, eyebrows and eyelashes, switches and the like, of human or animal hair or of textile materials; articles of human hair not elsewhere specified or included.",542264
201902,502,United States,6802,"Worked monumental or building stone (except slate) and articles thereof, other than goods of heading 68.01; mosaic cubes and the like, of natural stone (including slate), whether or not on a backing; artificially coloured granules, chippings and powder, of natural stone (including slate).",82302
201902,502,United States,6804,"Millstones, grindstones, grinding wheels and the like, without frameworks, for milling, grinding, pulping, sharpening, polishing, trueing or cutting, hand sharpening or polishing stones, and parts thereof, of natural stone, of agglomerated natural or artificial abrasives, or of ceramics, with or without parts of other materials",9151944
201902,502,United States,6805,"Natural or artificial abrasive powder or grain, on a base of textile material, of paper, of paperboard or of other materials, whether or not cut to shape or sewn or otherwise made up.",18447005
201902,502,United States,6806,"Slag-wool, rock-wool and similar mineral wools; exfoliated vermiculite, expanded clays, foamed slag and similar expanded mineral materials; mixtures and articles of heat-insulating, sound-insulating or sound absorbing mineral materials",7264070
201902,502,United States,6809,Articles of plaster or of compositions based on plaster.,239425
201902,502,United States,6810,"Articles of cement, of concrete or of artificial stone, whether or not reinforced.",702073
201902,502,United States,6811,"Articles of asbestos-cement, of cellulose fibre-cement or the like.",23239
201902,502,United States,6812,"Fabricated asbestos fibres; mixtures with a basis of asbestos or with a basis of asbestos and magnesium carbonate; articles of such mixtures or of asbestos (for example, thread, woven fabric, clothing, headgear, footwear, gaskets), whether or not reinforced, other than goods of heading 68.11 or 68.13.",226038
201902,502,United States,6813,"Friction material and articles thereof, e.g., sheets, rolls, strips, segments, discs, washers, pads, not mounted, for brakes, clutches or the like, with a basis of asbestos, other mineral substances or cellulose, whether or not combined with textile or other materials",5002339
201902,502,United States,6814,"Worked mica and articles of mica, including agglomerated or reconstituted mica, whether or not on a support of paper, paperboard or other materials.",136740
201902,502,United States,6815,"Articles of stone or of other mineral substances (including carbon fibres, articles of carbon fibres and articles of peat), not elsewhere specified or included.",59501955
201902,502,United States,6901,"Bricks, blocks, tiles and other ceramic goods of siliceous fossil meals (for example, kieselguhr, tripolite or diatomite) or of similar siliceous earths.",156180
201902,502,United States,6902,"Refractory bricks, blocks, tiles and similar refractory ceramic constructional goods, other than those of siliceous fossil meals or similar siliceous earths.",4380289
201902,502,United States,6903,"Other refractory ceramic goods (for example, retorts, crucibles, muffles, nozzles, plugs, supports, cupels, tubes, pipes, sheaths and rods), other than those of siliceous fossil meals or of similar siliceous earths.",16359281
201902,502,United States,6906,"Ceramic pipes, conduits, guttering and pipe fittings.",297848
201902,502,United States,6907,"Geramic flags and paving, hearth or wall tiles; ceramic mosaic cubes and the like, whether or not on a backing; finishing ceramics.",95559
201902,502,United States,6909,"Geramic wares for laboratory, chemical or other technical uses; ceramic troughs, tubs and similar receptacles of a kind used in agriculture; ceramic pots, jars and similar articles of a kind used for the conveyance or packing of goods.",34334620
201902,502,United States,6910,"Geramic sinks, wash basins, wash basin pedestals, baths, bidets, water closet pans, flushing cisterns, urinals and similar sanitary fixtures.",105574
201902,502,United States,6911,"Tableware, kitchenware, other household articles and toilet articles, of porcelain or china.",197319
201902,502,United States,6912,"Geramic tableware, kitchenware, other household articles and toilet articles, other than of porcelain or china.",167204
201902,502,United States,6913,Statuettes and other ornamental ceramic articles.,122006
201902,502,United States,6914,Other ceramic articles.,11289497
201902,502,United States,7001,Cullet and other waste and scrap of glass; glass in the mass.,13196868
201902,502,United States,7002,"Glass in balls (other than microspheres of heading 70.18), rods or tubes, unworked.",24491133
201902,502,United States,7003,"Cast glass and rolled glass, in sheets or profiles, whether or not having an absorbent, reflecting or nonreflecting layer, but not otherwise worked.",154807815
201902,502,United States,7004,"Drawn glass and blown glass, in sheets, whether or not having an absorbent, reflecting or nonreflecting layer, but not otherwise worked.",2974877
201902,502,United States,7005,"Float glass and surface ground or polished glass, in sheets, whether or not having an absorbent, reflecting or nonreflecting layer, but not otherwise worked.",1310097
201902,502,United States,7006,"Glass of heading 70.03, 70.04 or 70.05, bent, edgeworked, engraved, drilled, enamelled or otherwise worked, but not framed or fitted with other materials.",384931
201902,502,United States,7007,"safety glass, consisting of toughened (tempered) or laminated glass.",12320566
201902,502,United States,7008,Multiplewalled insulating units of glass.,2985
201902,502,United States,7009,"Glass mirrors, whether or not framed, including rearview mirrors.",77519075
201902,502,United States,7010,"Carboys, bottles, flasks, jars, pots, phials, ampoules and other containers, of glass, of a kind used for the conveyance or packing of goods; preserving jars of glass; stoppers, lids and other closures, of glass.",1256512
201902,502,United States,7011,"Glass envelopes (including bulbs and tubes), open, and glass parts thereof, without fittings, for electric lamps, cathoderay tubes or the like.",38904
201902,502,United States,7013,"Glassware of a kind used for table, kitchen, toilet, office, indoor decoration or similar purposes (other than that of heading 70.10 or 70.18).",1183020
201902,502,United States,7014,"Signalling glassware and optical elements of glass (other than those of heading 70.15), not optically worked.",684164
201902,502,United States,7015,"Clock or watch glasses and similar glasses, glasses for non corrective or corrective spectacles, curved, bent, hollowed or the like, not optically worked; hollow glass spheres and their segments, for the manufacture of such glasses.",5531
201902,502,United States,7016,"Paving blocks, slabs, bricks, squares, tiles and other articles of pressed or moulded glass, whether or not wired, of a kind used for building or construction purposes; glass cubes and other glass smallwares, whether or not on a backing, for mosaics or similar decorative purposes; leaded lights and the like; multicellular or foam glass in blocks, panels, plates, shells or similar forms.",416305
201902,502,United States,7017,"Laboratory, hygienic or pharmaceutical glassware, whether or not graduated or calibrated.",8896507
201902,502,United States,7018,"Glass beads, imitation pearls, imitation precious or semiprecious stones and similar glass smallwares, and articles thereof other than imitation jewellery; glass eyes other than prosthetic articles; statuettes and other ornaments of lampworked glass, other than imitation jewellery; glass microspheres not exceeding 1mm in diameter.",709867
201902,502,United States,7019,"Glass fibres (including glass wool) and articles thereof (for example, yarn, woven fabrics).",46185995
201902,502,United States,7020,Other articles of glass.,15992966
201902,502,United States,7102,"Diamonds, whether or not worked, but not mounted or set.",15751650
201902,502,United States,7103,"Precious stones and semi-precious stones, whether or not worked or graded, but not strung, mounted or set, ungraded precious stones and semi-precious stones, temporarily strung for convenience of transport",94328
201902,502,United States,7104,"Synthetic or reconstructed precious or semiprecious stones, whether or not worked or graded but not strung, mounted or set; ungraded synthetic or reconstructed precious or semiprecious stones, temporarily strung for convenience of transport.",14942258
201902,502,United States,7105,Dust and powder of natural or synthetic precious or semiprecious stones.,528151
201902,502,United States,7106,"Silver (including silver plated with gold or platinum), unwrought or in semimanufactured forms, or in powder form.",9555586
201902,502,United States,7107,"Base metals clad with silver, not further worked than semimanufactured.",3890182
201902,502,United States,7108,"Gold (including gold plated with platinum) unwrought or in semimanufactured forms, or in powder form.",8845756
201902,502,United States,7109,"Base metals or silver, clad with gold, not further worked than semimanufactured.",76317
201902,502,United States,7110,"Platinum, unwrought or in semimanufactured forms, or in powder form.",8158066
201902,502,United States,7113,"Articles of jewellery and parts thereof, of precious metal or of metal clad with precious metal.",94939727
201902,502,United States,7114,"Articles of goldsmiths' or silversmiths' wares and parts thereof, of precious metal or of metal clad with precious metal.",64396
201902,502,United States,7115,Other articles of precious metal or of metal clad with precious metal.,12535233
