Date of data,Trading partner code,Trading partner,Commodity code,Commodity,Renminbi Yuan
201902,502,United States,0106,Other live animals,1917752
201902,502,United States,0201,"Meat of bovine animals, fresh or chilled",2461843
201902,502,United States,0202,"Meat of bovine animals, frozen",34368326
201902,502,United States,0203,"Meat of swine, fresh, chilled or frozen",40719211
201902,502,United States,0206,"Edible offal of bovine animals, swine, sheep, goats, horses, asses, mules or hinnies, fresh, chilled or frozen",70725976
201902,502,United States,0301,Live fish,77313
201902,502,United States,0303,"Fish, frozen, excluding fish fillets and other fish meat of heading 0304",103746870
201902,502,United States,0304,"Fish fillets and other fish meat (whether or not minced), fresh, chilled or frozen",4380769
201902,502,United States,0306,"Crustaceans, whether in shell or not, live, fresh, chilled, frozen, dried, salted or in brine; smoked crustaceans, whether in shell or not, whether or not cooked before or during the smoking process; crustaceans, in shell, cooked by steaming or by boiling in water, whether or not chilled, frozen, dried, salted or in brine; flours, meals and pellets of crustaceans, fit for human consumption",138992476
201902,502,United States,0307,"Molluscs, whether in shell or not, live, fresh, chilled, frozen, dried, salted or in brine; smoked molluscs, whether in shell or not, whether or not cooked before or during the smoking process; flours, meals and pellets of molluscs, fit for human consumption",55611981
201902,502,United States,0308,"Aquatic invertebrates other than crustaceans and molluscs, live, fresh, chilled, frozen, dried, salted or in brine; smoked aquatic invertebrates other than crustaceans and molluscs, whether or not cooked before or during the smoking process; flours, meals and pellets of aquatic invertebrates other than crustaceans and molluscs, fit for human consumption",1266
201902,502,United States,0401,"Milk and cream, not concentrated nor containing added sugar or other sweetening matter.",7476
201902,502,United States,0402,"Milk and cream, concentrated or containing added sugar or other sweetening matter",9634709
201902,502,United States,0403,"Buttermilk, curdled milk and cream, yogurt, kephir and other fermented or acidified milk and cream, whether or not concentrated or containing added sugar or other sweetening matter or flavoured or containing added fruit, nuts or cocoa",548343
201902,502,United States,0404,"Whey, whether or not concentrated or containing added sugar or other sweetening matter; products consisting of natural milk constituents, whether or not containing added sugar or other sweetening matter, not elsewhere specified or included",59391989
201902,502,United States,0405,Butter and other fats and oils derived from milk; dairy spreads,168
201902,502,United States,0406,Cheese and curd,12025198
201902,502,United States,0409,atural honey,97489
201902,502,United States,0410,"dible products of animal origin, not elsewhere specified or included",256728
201902,502,United States,0504,"Guts, bladders and stomachs of animals (other than fish), whole and pieces thereof, fresh, chilled, frozen, salted, in brine, dried or smoked",28185421
201902,502,United States,0505,"Skins and other parts of birds, with their feathers or down, feathers and parts of feathers (whether or not with trimmed edges) and down, not further worked than cleaned, disinfected or treated for preservation;powder and waste of feathers or parts of feathers",6074279
201902,502,United States,0511,"Animal products not elsewhere specified or included; dead animals of Chapter 1 or 3, unfit for human consumption",6080326
201902,502,United States,0602,"Other live plants (including their roots), cuttings and slips; mushroom spawn.",2734754
201902,502,United States,0603,"Cut flowers and flower buds of a kind suitable for bouquets or for ornamental purposes, fresh, dried, dyed, bleached, impregnated or otherwise prepared.",2618
201902,502,United States,0604,"Foliage, branches and other parts of plants, without flowers or flower buds, and grasses, mosses and lichens, being goods of a kind suitable for bouquets or for ornamental purposes, fresh,dried, dyed, bleached, impregnated or otherwise prepared",55985
201902,502,United States,0706,"Carrots, turnips, salad beetroot, salsify, celeriac, radishes and similar edible roots, fresh or chilled.",54430
201902,502,United States,0709,"Other vegetables, fresh or chilled.",3919
201902,502,United States,0710,"Vegetables (uncooked or cooked by steaming or boiling in water),frozen.",9241759
201902,502,United States,0712,"Dried vegetables, whole, cut, sliced, broken or in powder, but not further prepared.",176000
201902,502,United States,0713,"Dried leguminous vegetables, shelled, whether or not skinned or split.",6275999
201902,502,United States,0801,"Coconuts, Brazil nuts and cashew nuts, fresh or dried, whether or not shelled or peeled.",3851
201902,502,United States,0802,"Other nuts, fresh or dried, whether or not shelled or peeled.",128172257
201902,502,United States,0805,"Citrus fruit, fresh or dried.",24771733
201902,502,United States,0806,"Grapes, fresh or dried.",2962535
201902,502,United States,0808,"Apples, pears and quinces, fresh.",22827198
201902,502,United States,0811,"Fruit and nuts, uncooked or cooked by steaming or boiling in water, frozen, whether or not containing added sugar or other sweetening matter.",1309155
201902,502,United States,0813,"Fruit, dried, other than that of headings 08.01 to 08.06; mixtures of nuts or dried fruits of this Chapter.",1113938
201902,502,United States,0901,"Coffee, whether or not roasted or decaffeinated; coffee husks and skins; coffee substitutes containing coffee in any proportion.",5124610
201902,502,United States,0902,"Tea, whether or not flavoured.",117526
201902,502,United States,0903,Maté.,60
201902,502,United States,0904,Pepper of the genus Piper; dried or crushed or ground fruits of the genus Capsicum or of the genus Pimenta.,3601
201902,502,United States,0906,Cinnamon and cinnamontree flowers.,16457
201902,502,United States,0907,"loves (whole fruit, cloves and stems).",334
201902,502,United States,0908,"Nutmeg, mace and cardamoms.",197
201902,502,United States,0909,"Seeds of anise, badian, fennel, coriander, cumin or caraway; juniper berries.",808
201902,502,United States,0910,"Ginger, saffron, turmeric (curcuma), thyme, bay leaves, curry and other spices.",13122
201902,502,United States,1004,Oats,2776
201902,502,United States,1005,Maize (corn).,705224
201902,502,United States,1006,Rice.,62
201902,502,United States,1008,"Buckwheat, millet and canary seeds; other cereals.",351
201902,502,United States,1101,Wheat or meslin flour.,52150
201902,502,United States,1102,Cereal flours other than of wheat or meslin.,23967
201902,502,United States,1103,"Cereal groats, meal and pellets.",383
201902,502,United States,1104,"Cereal grains otherwise worked (for example, hulled, rolled, flaked, pearled, sliced or kibbled), except rice of heading 10.06; germ of cereals, whole, rolled, flaked or ground.",190536
201902,502,United States,1105,"Flour, meal, powder, flakes, granules and pellets of potatoes.",1110664
201902,502,United States,1106,"Flour, meal and powder of the dried leguminous vegetables of heading 07.13, of sago or of roots or tubers of heading 07.14 or of the products of Chapter 8.",17282
201902,502,United States,1108,tarches; inulin.,1813272
201902,502,United States,1109,"Wheat gluten, whether or not dried.",2935
201902,502,United States,1201,"Soya beans, whether or not broken.",2471617278
201902,502,United States,1202,"Groundnuts, not roasted or otherwise cooked, whether or not shelled or broken.",739817
201902,502,United States,1203,Copra.,539
201902,502,United States,1206,"Sunflower seeds, whether or not broken.",822
201902,502,United States,1207,"Other oil seeds and oleaginous fruits, whether or not broken.",66194
201902,502,United States,1208,"Flours and meals of oil seeds or oleaginous fruits, other than those of mustard.",4997
201902,502,United States,1209,"Seeds, fruit and spores, of a kind used for sowing.",41694356
201902,502,United States,1210,"Hop cones, fresh or dried, whether or not ground, powdered or in the form of pellets; lupulin.",2334781
201902,502,United States,1211,"lants and parts of plants (including seeds and fruits), of a kind used primarily in perfumery, in pharmacy or for insecticidal, fungicidal or similar purposes, fresh, chilled, frozen or dried, whether or not cut, crushed or powdered.",1325176
201902,502,United States,1212,"Locust beans, seaweeds and other algae, sugar beet and sugar cane, fresh, chilled, frozen or dried, whether or not ground; fruit stones and kernels and other vegetable products (including unroasted chicory roots of the variety Cichorium intybus sativum) of a kind used primarily for human consumption, not elsewhere specified or included.",23029
201902,502,United States,1214,"wedes, mangolds, fodder roots, hay, lucerne (alfalfa), clover, sainfoin, forage kale, lupines, vetches and similar forage products, whether or not in the form of pellets.",78162734
201902,502,United States,1301,"Lac; natural gums, resins, gumresins and oleoresins (for example, balsams).",277136
201902,502,United States,1302,"Vegetable saps and extracts; pectic substances, pectinates and pectates; agaragar and other mucilages and thickeners, whether or not modified, derived from vegetable products.",2598698
201902,502,United States,1404,Vegetable products not elsewhere specified or included.,2261398
201902,502,United States,1504,"ats and oils and their fractions, of fish or marine mammals, whether or not refined, but not chemically modified.",12127108
201902,502,United States,1506,"Other animal fats and oils and their fractions, whether or not refined, but not chemically modified.",8866830
201902,502,United States,1507,"oyabean oil and its fractions, whether or not refined, but not chemically modified.",809
201902,502,United States,1508,"Groundnut oil and its fractions, whether or not refined, but not chemically modified.",3599
201902,502,United States,1509,"Olive oil and its fractions, whether or not refined, but not chemically modified.",10411
201902,502,United States,1510,"Other oils and their fractions, obtained solely from olives, whether or not refined, but not chemically modified, including blends of these oils or fractions with oils or fractions of heading 15.09.",299
201902,502,United States,1511,"Palm oil and its fractions, whether or not refined, but not chemically modified.",157
201902,502,United States,1512,"unflowerseed, safflower or cottonseed oil and fractions thereof, whether or not refined, but not chemically modified.",50026
201902,502,United States,1513,"Coconut (copra), palm kernel or babassu oil and fractions thereof, whether or not refined, but not chemically modified.",527795
201902,502,United States,1514,"Rape, colza or mustard oil and fractions thereof, whether or not refined, but not chemically modified.",8633
201902,502,United States,1515,"Other fixed vegetable fats and oils (including jojoba oil) and their fractions, whether or not refined, but not chemically modified.",1672748
201902,502,United States,1516,"Animal or vegetable fats and oils and their fractions, partly or wholly hydrogenated, interesterified, reesterified or elaidinised, whether or not refined, but not further prepared.",2583880
201902,502,United States,1517,"Margarine; edible mixtures or preparations of animal or vegetable fats or oils or of fractions of different fats or oils of this Chapter, other than edible fats or oils or their fractions of heading 15.16.",13720333
201902,502,United States,1518,"Animal or vegetable fats and oils and their fractions, boiled, oxidised,dehydrated, sulphurised, blown, polymerised by heat in vacuum or in inert gas or otherwise chemically modified, excluding those of heading 15.16; inedible mixtures or preparations of animal or vegetable fats or oils or of fractions of different fats or oils of this Chapter, not elsewhere specified or included.",4318656
201902,502,United States,1520,"Glycerol, crude; glycerol waters and glycerol lyes.",1222822
201902,502,United States,1521,"egetable waxes (other than triglycerides), beeswax, other insect waxes and spermaceti, whether or not refined or coloured.",26478
201902,502,United States,1602,"Other prepared or preserved meat, meat offal or blood.",234
201902,502,United States,1604,Prepared or preserved fish; caviar and caviar substitutes prepared from fish eggs.,1704020
201902,502,United States,1605,"rustaceans, molluscs and other aquatic invertebrates, prepared or preserved.",9478
201902,502,United States,1701,"Cane or beet sugar and chemically pure sucrose, in solid form.",63149
201902,502,United States,1702,"Other sugars, including chemically pure lactose, maltose, glucose and fructose, in solid form; sugar syrups not containing added flavouring or colouring matter; artificial honey, whether or not mixed with natural honey; caramel.",35226716
201902,502,United States,1704,"ugar confectionery (including white chocolate), not containing cocoa.",10012343
201902,502,United States,1801,"Cocoa beans, whole or broken, raw or roasted.",5025
201902,502,United States,1804,"Cocoa butter, fat and oil.",23432
201902,502,United States,1805,"Cocoa powder, not containing added sugar or other sweetening matter.",192520
201902,502,United States,1806,hocolate and other food preparations containing cocoa.,5603087
201902,502,United States,1901,"Malt extract; food preparations of flour, groats, meal, starch or malt extract, not containing cocoa or containing less than 40% by weight of cocoa calculated on a totally defatted basis, not elsewhere specified or included; food preparations of goods of headings 04.01 to 04.04,not containing cocoa or containing less than 5% by weight of cocoa calculated on a totally efatted basis, not elsewhere specified or included.",40129927
201902,502,United States,1902,"Pasta, whether or not cooked or stuffed (with meat or other substances) or otherwise prepared, such as spaghetti, macaroni, noodles, lasagne, gnocchi, ravioli, cannelloni; couscous, whether or not prepared.",142407
201902,502,United States,1904,"repared foods obtained by the swelling or roasting of cereals or cereal products (for example, corn flakes); cereals (other than maize (corn)) in grain form or in the form of flakes or other worked grains (except flour, groats and meal), precooked, or otherwise prepared, not elsewhere specified or included.",9199168
201902,502,United States,1905,"read, pastry, cakes, biscuits and other bakers' wares, whether or not containing cocoa; communion wafers, empty cachets of a kind suitable for pharmaceutical use, sealing wafers, rice paper and similar products.",5002543
201902,502,United States,2001,"Vegetables, fruit, nuts and other edible parts of plants, prepared or preserved by vinegar or acetic acid.",10648
201902,502,United States,2002,Tomatoes prepared or preserved otherwise than by vinegar or acetic acid.,2578762
201902,502,United States,2004,"Other vegetables prepared or preserved otherwise than by vinegar or acetic acid, frozen, other than products of heading 20.06.",40149775
201902,502,United States,2005,"Other vegetables prepared or preserved otherwise than by vinegar or acetic acid, not frozen, other than products of heading 20.06.",878512
201902,502,United States,2006,"Vegetables, fruit, nuts, fruitpeel and other parts of plants, preserved by sugar (drained, glacé or crystallised).",132817
201902,502,United States,2007,"Jams, fruit jellies, marmalades, fruit or nut purée and fruit or nut pastes, obtained by cooking, whether or not containing added sugar or other sweetening matter.",2235549
201902,502,United States,2008,"Fruit, nuts and other edible parts of plants, otherwise prepared or preserved, whether or not containing added sugar or other sweetening matter or spirit, not elsewhere specified or included.",23759723
201902,502,United States,2009,"ruit juices (including grape must) and vegetable juices, unfermented and not containing added spirit, whether or not containing added sugar or other sweetening matter.",25828401
201902,502,United States,2101,"Extracts, essences and concentrates, of coffee, tea or maté and preparations with a basis of these products or with a basis of coffee, tea or mate; roasted chicory and other roasted coffee substitutes, and extracts, essences and concentrates thereof",4762561
201902,502,United States,2102,"Yeasts (active or inactive); other singlecell microorganisms, dead (but not including vaccines of heading 30.02); prepared baking powders.",874453
201902,502,United States,2103,"Sauce and preparations therefor; mixed condiments and mixed seasonings; mustard flour and meal, whether or not prepared, and mustard",5782620
201902,502,United States,2104,Soups and broths and preparations therefor; homogenised composite food preparations.,2026811
201902,502,United States,2105,"Ice cream and other edible ice, whether or not containing cocoa.",561026
201902,502,United States,2106,Food preparations not elsewhere specified or included.,226537259
201902,502,United States,2201,"Waters, including natural or artificial mineral waters andaerated waters, not containing added sugar or other sweetening matter nor flavoured; ice and snow.",64603
201902,502,United States,2202,"Waters, including mineral waters and aerated waters, containing added sugar or other sweetening matter or flavoured, and other nonalcoholic beverages, not including fruit or vegetable juices of heading 20.09.",13216811
201902,502,United States,2203,Beer made from malt.,3761003
201902,502,United States,2204,"Wine of fresh grapes, including fortified wines; grape must other than that of heading 20.09.",8924599
201902,502,United States,2206,"Other fermented beverages (for example, cider, perry, mead, saké); mixtures of fermented beverages and mixtures of fermented beverages and nonalcoholic beverages, not elsewhere specified or included.",35582
201902,502,United States,2207,"Undenatured ethyl alcohol of an alcoholic strength by volume of 80% vol.or higher; ethyl alcohol and other spirits, denatured, of any strength.",149772
201902,502,United States,2208,"Undenatured ethyl alcohol of an alcoholic strength by volume of Undenatured ethyl alcohol of an alcoholic strength by volume of less than 80% vol.; spirits, liqueurs and other spirituous beverages.",3413118
201902,502,United States,2209,Vinegar and substitutes for vinegar obtained from acetic acid.,506996
201902,502,United States,2301,"Flours, meals and pellets, of meat or meat offal, of fish or ofcrustaceans, molluscs or other aquatic invertebrates, unfit for human consumption; greaves.",95527627
201902,502,United States,2302,"Bran, sharps and other residues, whether or not in the form of pellets, derived from the sifting, milling or other working of cereals or of leguminous plants.",8997774
201902,502,United States,2303,"Residues of starch manufacture and similar residues, beetpulp, bagasse and other waste of sugar manufacture, brewing ordistilling dregs and waste, whether or not in the form of pellets.",5556608
201902,502,United States,2304,"Oilcake and other solid residues, whether or not ground or in the form of pellets, resulting from the extraction of soyabean oil.",313121
201902,502,United States,2309,Preparations of a kind used in animal feeding.,24027965
201902,502,United States,2501,"Salts, incl. table salt and denatured salt, and pure sodium chloride, whether or not in aqueous solution or containing added anti-caking or free-flowing agents; sea water",17911528
201902,502,United States,2503,"Sulphur of all kinds (excluding sublimed sulphur, precipitated sulphur and colloidal sulphur)",24581515
201902,502,United States,2504,Natural graphite.,150882
201902,502,United States,2505,"Natural sands of all kinds, whether or not coloured, other than metalbearing sands of Chapter 26.",1768487
201902,502,United States,2506,"Quartz (excluding natural sands); quartzite, whether or not roughly trimmed or merely cut, by sawing or otherwise, into blocks or slabs of a square or rectangular shape",54250253
201902,502,United States,2507,"Kaolin and other kaolinic clays, whether or not calcined",40008426
201902,502,United States,2508,"Other clays (not including expanded clays of heading 68.06), andalusite, kyanite and sillimanite, whether or not calcined; mullite; chamotte or dinas earths.",8399842
201902,502,United States,2511,"Natural barium sulphate (barytes); natural barium carbonate (witherite), whether or not calcined, other than barium oxide of heading 28.16.",5541
201902,502,United States,2512,"Siliceous fossil meals, e.g. kieselguhr, tripolite and diatomite, and similar siliceous earths, whether or not calcined, of an apparent specific gravity of 1 or less.",1869767
201902,502,United States,2513,"Pumice stone; emery; natural corundum, natural garnet and other natural abrasives, whether or not heat-treated",415392
201902,502,United States,2514,"Slate, whether or not roughly trimmed or merely cut, by sawing or otherwise, into blocks or slabs of a square or rectangular shape; slate powder and slate refuse",5796
201902,502,United States,2515,"Marble, travertine, ecaussine and other calcareous monumental or building stone of an apparent specific gravity of 2.5 or more, and alabaster, whether or not roughly trimmed or merely cut, by sawing or otherwise, into blocks or slabs of a rectangular (including square) shape.",1311857
201902,502,United States,2516,"Granite, porphyry, basalt, sandstone and other monumental or building stone, whether or not roughly trimmed or merely cut, by sawing or otherwise, into blocks or slabs of a rectangular (including square) shape.",4417586
201902,502,United States,2517,"Pebbles, gravel, broken or crushed stone, for concrete aggregates, for road metalling or for railway ballast, shingle and flint, whether or not heat-treated; macadam of slag, dross or similar industrial waste, whether or not incorporating the materials cited in the first part of the heading; tarred macadam; granules, chippings and powder, of stones of heading 2515 and 2516, whether or not heat-treated",11918
201902,502,United States,2519,"Natural magnesium carbonate ""magnesite""; fused magnesia; dead-burned ""sintered"" magnesia, whether or not containing small quantities of other oxides added before sintering; other magnesium oxide, whether or not pure",2250471
201902,502,United States,2520,"Gypsum; anhydrite; plasters consisting of calcined gypsum or calcium sulphate, whether or not coloured, with or without small quantities of accelerators or retarders",1220852
201902,502,United States,2521,"Limestone flux; limestone and other calcareous stone, of a kind used for the manufacture of lime or cement",15617
201902,502,United States,2522,"Quicklime, slaked lime and hydraulic lime (excluding pure calcium oxide and calcium hydroxide)",2426
201902,502,United States,2523,"Portland cement, aluminous cement, slagcement, supersulphate cement and similar hydraulic cements, whether or not coloured or in the form of clinkers.",5113241
201902,502,United States,2525,"Mica, including splittings; mica waste.",381049
201902,502,United States,2526,"Natural steatite, whether or not roughly trimmed or merely cut, by sawing or otherwise, into blocks or slabs of a rectangular (including square) shape; talc.",1567308
201902,502,United States,2528,"Natural borates and concentrates thereof (whether or not calcined), but not including borates separated from natural brine; natural boric acid containing not more than 85% of H3BO3 calculated on the dry weight.",12325
201902,502,United States,2529,"Feldspar; leucite, nepheline and nepheline syenite; fluorspar.",114080
201902,502,United States,2530,Mineral substances not elsewhere specified or included.,22223510
201902,502,United States,2607,Lead ores and concentrates.,51473877
201902,502,United States,2613,Molybdenum ores and concentrates.,8723522
201902,502,United States,2614,Titanium ores and concentrates.,3579002
201902,502,United States,2615,"Niobium, tantalum, vanadium or zirconium ores and concentrates.",20393011
201902,502,United States,2617,Other ores and concentrates.,487
201902,502,United States,2621,"Other slag and ash, including seaweed ash (kelp); ash and residues from the incineration of municipal waste.",158728
201902,502,United States,2701,Mituminous substances; mineral waxes,14692
201902,502,United States,2707,Oils and other products of the distillation of high temperature coal tar; similar products in which the weight of the aromatic constituents exceeds that of the non-aromatic constituents,911860
201902,502,United States,2708,"Pitch and pitch coke, obtained from coal tar or from other mineral tars",561
201902,502,United States,2709,"Petroleum oils and oils obtained from bituminous minerals, crude.",319312876
201902,502,United States,2710,"Petroleum oils and oils obtained from bituminous minerals, other than crude; preparations not elsewhere specified or included, containing by weight 70% or more of petroleum oils or of oils obtained from bituminous minerals, these oils being the basic constituents of the preparations; waste oils.",29096314
201902,502,United States,2711,Petroleum gases and other gaseous hydrocarbons.,201659813
201902,502,United States,2712,"Petroleum jelly, paraffin wax, micro- crystalline petroleum wax, slack wax, ozokerite, lignite wax, peat wax, other mineral waxes, and similar products obtained by synthesis or by other processes, whether or not coloured",3470147
201902,502,United States,2713,"Petroleum coke, petroleum bitumen and other residues of petroleum oils or of oils obtained from bituminous minerals.",363110264
