Date of data,Trading partner code,Trading partner,Commodity code,Commodity,Renminbi Yuan
201904,502,United States,7103,"Precious stones and semi-precious stones, whether or not worked or graded, but not strung, mounted or set, ungraded precious stones and semi-precious stones, temporarily strung for convenience of transport",102415
201904,502,United States,7104,"Synthetic or reconstructed precious or semiprecious stones, whether or not worked or graded but not strung, mounted or set; ungraded synthetic or reconstructed precious or semiprecious stones, temporarily strung for convenience of transport.",19315030
201904,502,United States,7105,Dust and powder of natural or synthetic precious or semiprecious stones.,4952887
201904,502,United States,7106,"Silver (including silver plated with gold or platinum), unwrought or in semimanufactured forms, or in powder form.",38178043
201904,502,United States,7107,"Base metals clad with silver, not further worked than semimanufactured.",3066332
201904,502,United States,7108,"Gold (including gold plated with platinum) unwrought or in semimanufactured forms, or in powder form.",4734257
201904,502,United States,7109,"Base metals or silver, clad with gold, not further worked than semimanufactured.",63164
201904,502,United States,7110,"Platinum, unwrought or in semimanufactured forms, or in powder form.",10744544
201904,502,United States,7111,"Base metals, silver or gold, clad with platinum, not further worked than semimanufactured.",15228657
201904,502,United States,7113,"Articles of jewellery and parts thereof, of precious metal or of metal clad with precious metal.",79397898
201904,502,United States,7114,"Articles of goldsmiths' or silversmiths' wares and parts thereof, of precious metal or of metal clad with precious metal.",75553
201904,502,United States,7115,Other articles of precious metal or of metal clad with precious metal.,26226328
201904,502,United States,7116,"Articles of natural or cultured pearls, precious or semiprecious stones (natural, synthetic or reconstructed).",655400
201904,502,United States,7117,Imitation jewellery.,4141484
201904,502,United States,7202,Ferroalloys.,10322654
201904,502,United States,7203,"Ferrous products obtained by direct reduction of iron ore and other spongy ferrous products, in lumps, pellets or similar forms; iron having a minimum purity by weight of 99.94%, in lumps, pellets or similar forms.",349
201904,502,United States,7205,"Nranules and powders, of pig iron, spiegeleisen, iron or steel.",15376129
201904,502,United States,7206,Iron and nonalloy steel in ingots or other primary forms (excluding iron of heading 72.03).,22586
201904,502,United States,7208,"Flat-rolled products of iron or nonalloy steel, of a width of 600 mm or more, hotrolled, not clad, plated or coated.",1135963
201904,502,United States,7209,"Flat-rolled products of iron or nonalloy steel, of a width of 600 mm or more, coldrolled (coldreduced), not clad, plated or coated.",2875597
201904,502,United States,7210,"at-rolled products of iron or non-alloy steel, of a width ≥ 600 mm, hot-rolled or cold-rolled ""cold-reduced"", clad, plated or coated",14175085
201904,502,United States,7211,"Flat-rolled products of iron or nonalloy steel, of a width of less than 600 mm, not clad, plated or coated.",3874445
201904,502,United States,7212,"Flat-rolled products of iron or nonalloy steel, of a width of less than 600 mm, clad, plated or coated.",13260730
201904,502,United States,7214,"Other bars and rods of iron or nonalloy steel, not further worked than forged, hotrolled, hotdrawn or hotextruded, but including those twisted after rolling.",895095
201904,502,United States,7215,Other bars and rods of iron or nonalloy steel.,912386
201904,502,United States,7216,"Angles, shapes and sections of iron or nonalloy steel.",622710
201904,502,United States,7217,Wire of iron or nonalloy steel.,212802
201904,502,United States,7218,Stainless steel in ingots or other primary forms; semifinished products of stainless steel.,452423
201904,502,United States,7219,"Flat-rolled products of stainless steel, of a width of 600 mm or more.",16780927
201904,502,United States,7220,"Flat-rolled products of stainless steel, of a width of less than 600 mm.",10787027
201904,502,United States,7222,"Other bars and rods of stainless steel; angles, shapes and sections of stainless steel.",40335006
201904,502,United States,7223,Wire of stainless steel.,5454756
201904,502,United States,7224,Other alloy steel in ingots or other primary forms; semifinished products of other alloy steel.,83469
201904,502,United States,7225,"Flat-rolled products of other alloy steel, of a width of 600 mm or more.",27565461
201904,502,United States,7226,"Flat-rolled products of alloy steel other than stainless, of a width of ≥ 600 mm, hot-rolled or cold-rolled ""cold-reduced"" and further worked (excluding plated or coated with zinc and products of silicon-electrical steel)",10559790
201904,502,United States,7228,"Other bars and rods of other alloy steel; angles, shapes and sections, of other alloy steel; hollow drill bars and rods, of alloy or nonalloy steel.",6706795
201904,502,United States,7229,Wire of other alloy steel.,1175844
201904,502,United States,7301,"Sheet piling of iron or steel, whether or not drilled, punched or made from assembled elements; welded angles, shapes and sections, of iron or steel.",39559
201904,502,United States,7302,"Railway or tramway track construction material of iron or steel, the following : rails, check-rails and rack rails, switch blades, crossing frogs, point rods and other crossing pieces, sleepers ""cross-ties"", fish-plates, chairs, chair wedges, sole plates ""base plates"", rail clips, bedplates, ties and other material specialised for jointing or fixing rails",59468
201904,502,United States,7303,"Tubes, pipes and hollow profiles, of cast iron.",27244
201904,502,United States,7304,"Tubes, pipes and hollow profiles, seamless, of iron (other than cast iron) or steel.",22139318
201904,502,United States,7305,"Other tubes and pipes (for example, welded, riveted or similarly closed), having circular cross-sections, the external diameter of which exceeds 406.4 mm, of iron or steel.",321096
201904,502,United States,7306,"Other tubes, pipes and hollow profiles (for example, open seam or welded, riveted or similarly closed), of iron or steel.",15098532
201904,502,United States,7307,"Tube or pipe fittings (for example, couplings, elbows, sleeves), of iron or steel.",107950760
201904,502,United States,7308,"Structures (excluding prefabricated buildings of heading 94.06) and parts of structures (for example, bridges and bridgesections, lockgates, towers, lattice masts, roofs, roofing frameworks, doors and windows and their frames and thresholds for doors, shutters, balustrades, pillars and columns), of iron or steel; plates, rods, angles, shapes, sections, tubes and the like, prepared for use in structures, of iron or steel.",2143605
201904,502,United States,7309,"eservoirs, tanks, vats and similar containers for any material (other than compressed or liquefied gas), of iron or steel, of a capacity exceeding 300 l, whether or not lined or heatinsulated, but not fitted with mechanical or thermal equipment.",3154782
201904,502,United States,7310,"anks, casks, drums, cans, boxes and similar containers, for any material (other than compressed or liquefied gas), of iron or steel, of a capacity not exceeding 300 l, whether or not lined or heatinsulated, but not fitted with mechanical or thermal equipment.",3955854
201904,502,United States,7311,"Containers for compressed or liquefied gas, of iron or steel.",6833322
201904,502,United States,7312,"Stranded wire, ropes, cables, plaited bands, slings and the like, of iron or steel, not electrically insulated.",9396776
201904,502,United States,7313,"Barbed wire of iron or steel; twisted hoop or single flat wire, barbed or not, and loosely twisted double wire, of a kind used for fencing, of iron or steel.",30365
201904,502,United States,7314,"Cloth (including endless bands), grill, netting and fencing, of iron or steel wire; expanded metal of iron or steel.",3671401
201904,502,United States,7315,"Chain and parts thereof, of iron or steel.",7256527
201904,502,United States,7316,"Anchors, grapnels and parts thereof, of iron or steel.",101730
201904,502,United States,7317,"Nails, tacks, drawing pins, corrugated nails, staples (other than those of heading 83.05) and similar articles, of iron or steel, whether or not with heads of other material, but excluding such articles with heads of copper.",2864732
201904,502,United States,7318,"Screws, bolts, nuts, coach screws, screw hooks, rivets, cotters, cotterpins, washers (including spring washers) and similar articles, of iron or steel.",217281299
201904,502,United States,7319,"Sewing needles, knitting needles, bodkins, crochet hooks, embroidery stilettos and similar articles, for use in the hand, of iron or steel; safety pins and other pins of iron or steel, not elsewhere specified or included.",996558
201904,502,United States,7320,"Springs and leaves for springs, of iron or steel.",33178623
201904,502,United States,7321,"Stoves, ranges, grates, cookers (including those with subsidiary boilers for central heating), barbecues, braziers, gasrings, plate warmers and similar nonelectric domestic appliances, and parts thereof, of iron or steel.",1112477
201904,502,United States,7322,"Radiators for central heating, not electrically heated, and parts thereof, of iron or steel; air heaters and hot air distributors (including distributors which can also distribute fresh or conditioned air), not electrically heated, incorporating a motordriven fan or blower, and parts thereof, of iron or steel.",527692
201904,502,United States,7323,"Table, kitchen or other household articles and parts thereof, of iron or steel; iron or steel wool; pot scourers and scouring or polishing pads, gloves and the like, of iron or steel.",2132485
201904,502,United States,7324,"Sanitary ware and parts thereof, of iron or steel.",3741773
201904,502,United States,7325,Other cast articles of iron or steel.,5228054
201904,502,United States,7326,Other articles of iron or steel.,231306234
201904,502,United States,7402,Unrefined copper; copper anodes for electrolytic refining.,1023886
201904,502,United States,7403,"Refined copper and copper alloys, unwrought.",359572
201904,502,United States,7404,Copper waste and scrap.,382140129
201904,502,United States,7405,Master alloys of copper.,239003
201904,502,United States,7406,Copper powders and flakes.,3940723
201904,502,United States,7407,"Copper bars, rods and profiles.",5960249
201904,502,United States,7408,Copper wire.,6030098
201904,502,United States,7409,"Copper plates, sheets and strip, of a thickness exceeding 0.15mm.",21122436
201904,502,United States,7410,"Copper foil (whether or not printed or backed with paper, paperboard, plastics or similar backing materials) of a thickness (excluding any backing) not exceeding 0.15 mm.",51273486
201904,502,United States,7411,Copper tubes and pipes.,60360099
201904,502,United States,7412,"Copper tube or pipe fittings (for example, couplings, elbows, sleeves).",6601271
201904,502,United States,7413,"Stranded wire, cables, plaited bands and the like, of copper, not electrically insulated.",1050412
201904,502,United States,7415,"Nails, tacks, drawing pins, staples (other than those of heading 83.05) and similar articles, of copper or of iron or steel with heads of copper; screws, bolts, nuts, screw hooks, rivets, cotters, cotterpins, washers (including spring washers) and similar articles, of copper.",8498701
201904,502,United States,7418,"Table, kitchen or other household articles and parts thereof, of copper; pot scourers and scouring or polishing pads, gloves and the like, of copper; sanitary ware and parts thereof, of copper.",177513
201904,502,United States,7419,Other articles of copper.,21398430
201904,502,United States,7502,nwrought nickel.,1572468
201904,502,United States,7504,Nickel powders and flakes.,5357568
201904,502,United States,7505,"Nickel bars, rods, profiles and wire.",54349696
201904,502,United States,7506,"Nickel plates, sheets, strip and foil.",38873795
201904,502,United States,7507,"Nickel tubes, pipes and tube or pipe fittings (for example, couplings, elbows, sleeves).",23667958
201904,502,United States,7508,Other articles of nickel.,103219898
201904,502,United States,7601,Unwrought aluminium.,376841
201904,502,United States,7602,Aluminium waste and scrap.,329084145
201904,502,United States,7603,Aluminium powders and flakes.,2686210
201904,502,United States,7604,"Aluminium bars, rods and profiles.",38450174
201904,502,United States,7605,Aluminium wire.,9865937
201904,502,United States,7606,"Aluminium plates, sheets and strip, of a thickness exceeding 0.2 mm.",70130516
201904,502,United States,7607,"Aluminium foil (whether or not printed or backed with paper, paperboard, plastics or similar backing materials) of a thickness (excluding any backing) not exceeding 0.2 mm.",9402402
201904,502,United States,7608,Aluminium tubes and pipes.,3235544
201904,502,United States,7609,"Aluminium tube or pipe fittings (for example, couplings, elbows, sleeves).",12533847
201904,502,United States,7610,"Aluminium structures (excluding prefabricated buildings of heading 94.06) and parts of structures (for example, bridges and bridgesections, towers, lattice masts, roofs, roofing frameworks, doors and windows and their frames and thresholds for doors, balustrades, pillars and columns); aluminium plates, rods, profiles, tubes and the like, prepared for use in structures.",2160793
201904,502,United States,7611,"Aluminium reservoirs, tanks, vats and similar containers, for any material (other than compressed or liquefied gas), of a capacity exceeding 300 l, whether or not lined or heatinsulated, but not fitted with mechanical or thermal equipment.",1527690
201904,502,United States,7612,"Aluminium casks, drums, cans, boxes and similar containers (including rigid or collapsible tubular containers), for any material (other than compressed or liquefied gas), of a capacity not exceeding 300 l, whether or not lined or heatinsulated, but not fitted with mechanical or thermal equipment.",3481751
201904,502,United States,7613,Aluminium containers for compressed or liquefied gas.,3658235
201904,502,United States,7614,"Stranded wire, cables, plaited bands and the like, of aluminium, not electrically insulated.",1628
201904,502,United States,7615,"Table, kitchen or other household articles and parts thereof, of aluminium; pot scourers and scouring or polishing pads, gloves and the like, of aluminium; sanitary ware and parts thereof, of aluminium.",1354502
201904,502,United States,7616,Other articles of aluminium.,77845924
201904,502,United States,7801,Unwrought lead.,156800
201904,502,United States,7804,"Lead plates, sheets, strip and foil; lead powders and flakes.",105380
201904,502,United States,7806,Other articles of lead.,980584
201904,502,United States,7901,Unwrought zinc.,1418113
201904,502,United States,7903,"zinc dust, powders and flakes.",31272006
201904,502,United States,7904,"Zinc bars, rods, profiles and wire.",78536
201904,502,United States,7905,"Zinc plates, sheets, strip and foil.",497339
201904,502,United States,7907,Other articles of zinc.,389661
201904,502,United States,8001,Unwrought tin.,347122
201904,502,United States,8003,"Tin bars, rods, profiles and wire.",655408
201904,502,United States,8007,Other articles of tin.,781913
201904,502,United States,8101,"Wungsten (wolfram) and articles thereof, including waste and scrap.",1996780
201904,502,United States,8102,"Molybdenum and articles thereof, including waste and scrap.",2588417
201904,502,United States,8103,"Tantalum and articles thereof, including waste and scrap.",20676149
201904,502,United States,8104,"Magnesium and articles thereof, including waste and scrap.",461517
201904,502,United States,8105,"Cobalt mattes and other intermediate products of cobalt metallurgy; cobalt and articles thereof, including waste and scrap.",14215812
201904,502,United States,8106,"Bismuth and articles thereof, including waste and scrap.",220865
201904,502,United States,8107,"Cadmium and articles thereof, including waste and scrap.",6774
201904,502,United States,8108,"Titanium and articles thereof, including waste and scrap.",115744456
201904,502,United States,8109,"Zirconium and articles thereof, including waste and scrap.",3269483
201904,502,United States,8110,"Antimony and articles thereof, including waste and scrap.",310
201904,502,United States,8111,"Manganese and articles thereof, including waste and scrap.",2926631
201904,502,United States,8112,"Beryllium, chromium, germanium, vanadium, gallium, hafnium, indium, niobium (columbium), rhenium and thallium, and articles of these metals, including waste and scrap.",7886023
201904,502,United States,8113,"Cermets and articles thereof, including waste and scrap.",4858214
201904,502,United States,8201,"Hand tools, the following : spades, shovels, mattocks, picks, hoes, forks and rakes; axes, bill hooks and similar hewing tools; secateurs and pruners of any kind; scythes, sickles, hay knives, hedge shears, timber wedges and other tools of a kind used in agriculture, horticulture or forestry.",125380
201904,502,United States,8202,"Hand saws; blades for saws of all kinds (including slitting, slotting or toothless saw blades).",15835287
201904,502,United States,8203,"Files, rasps, pliers (including cutting pliers), pincers, tweezers, metal cutting shears, pipecutters, bolt croppers, perforating punches and similar hand tools.",4397466
201904,502,United States,8204,"Hand-operated spanners and wrenches (including torque meter wrenches but not including tap wrenches); interchangeable spanner sockets, with or without handles.",3488824
201904,502,United States,8205,"Hand tools (including glaziers' diamonds), not elsewhere specified or included; blow lamps; vices, clamps and the like, other than accessories for and parts of, machinetools or waterjet cutting machines; anvils; portable forges; hand or pedaloperated grinding wheels with frameworks.",12353080
201904,502,United States,8206,"Tools of two or more of the headings 82.02 to 82.05, put up in sets for retail sale.",4320493
201904,502,United States,8207,"Interchangeable tools for hand tools, whether or not poweroperated, or for machinetools (for example, for pressing, stamping, punching, tapping, threading, drilling, boring, broaching, milling, turning or screw driving), including dies for drawing or extruding metal, and rock drilling or earth boring tools.",74475175
201904,502,United States,8208,"Knives and cutting blades, for machines or for mechanical appliances.",41616109
201904,502,United States,8209,"Plates, sticks, tips and the like for tools, unmounted, of cermets.",4389109
201904,502,United States,8210,"Hand-operated mechanical appliances, weighing 10 kg or less, used in the preparation, conditioning or serving of food or drink.",121193
201904,502,United States,8211,"Knives with cutting blades, serrated or not (including pruning knives), other than knives of heading 82.08, and blades therefor.",1107027
201904,502,United States,8212,Razors and razor blades (including razor blade blanks in strips).,17043459
201904,502,United States,8213,"Scissors, tailors' shears and similar shears, and blades therefor.",202541
201904,502,United States,8214,"Other articles of cutlery (for example, hair clippers, butchers' or kitchen cleavers, choppers and mincing knives, paper knives); manicure or pedicure sets and instruments (including nail files).",295663
201904,502,United States,8215,"Spoons, forks, ladles, skimmers, cakeservers, fishknives, butterknives, sugar tongs and similar kitchen or tableware.",90488
201904,502,United States,8301,"Padlocks and locks (key, combination or electrically operated), of base metal; clasps and frames with clasps, incorporating locks, of base metal; keys for any of the foregoing articles, of base metal",20395259
201904,502,United States,8302,"Base metal mountings, fittings and similar articles suitable for furniture, doors, staircases, windows, blinds, coachwork, saddlery, trunks, chests, caskets or the like; base metal hatracks, hatpegs, brackets and similar fixtures; castors with mountings of base metal; automatic door closers of base metal",29468754
201904,502,United States,8303,"Armoured or reinforced safes, strongboxes and doors and safe deposit lockers for strongrooms, cash or deed boxes and the like, of base metal",14256
201904,502,United States,8305,"Fittings for looseleaf binders or files, letter clips, letter corners, paper clips, indexing tags and similar office articles, of base metal; staples in strips (for example, for offices, upholstery, packaging), of base metal",118641
201904,502,United States,8306,"Bells, gongs and the like, nonelectric, of base metal; statuettes and other ornaments, of base metal; photograph, picture or similar frames, of base metal; mirrors of base metal",506941
201904,502,United States,8307,"Flexible tubing of base metal, with or without fittings",8669475
201904,502,United States,8308,"Clasps, frames with clasps, buckles, buckleclasps, hooks, eyes, eyelets and the like, of base metal, of a kind used for clothing or clothing accessories, footwear, jewellery, wristwatches, books, awnings, leather goods, travel goods or saddlery or for other made up articles; tubular or bifurcated rivets, of base metal; beads and spangles, of base metal",6687121
201904,502,United States,8309,"Stoppers, caps and lids (including crown corks, screw caps and pouring stoppers), capsules for bottles, threaded bungs, bung covers, seals and other packing accessories, of base metal",6094715
201904,502,United States,8310,"Signplates, nameplates, addressplates and similar plates, numbers, letters and other symbols, of base metal, excluding those of heading 9405",4396911
201904,502,United States,8311,"Wire, rods, tubes, plates, electrodes and similar products, of base metal or of metal carbides, coated or cored with flux material, of a kind used for soldering, brazing, welding or deposition of metal or of metal carbides; wire and rods, of agglomerated base metal powder, used for metal spraying",17611751
201904,502,United States,8402,Steam or other vapour generating boilers (other than central heating hot water boilers capable also of producing low pressure steam); superheated water boilers.,42973
201904,502,United States,8403,Central heating boilers other than those of heading 8402.,1392887
201904,502,United States,8404,"Auxiliary plant for use with boilers of heading 84.02 or 84.03 (for example, economisers, superheaters, soot removers, gas recoverers); condensers for steam or other vapour power units.",347807
201904,502,United States,8405,"Producer gas or water gas generators, with or without their purifiers; acetylene gas generators and similar water process gas generators, with or without their purifiers.",1940293
201904,502,United States,8406,Steam turbines and other vapour turbines.,548766
201904,502,United States,8407,Sparkignition reciprocating or rotary internal combustion piston engines.,59535616
201904,502,United States,8408,Compressionignition internal combustion piston engines (diesel or semidiesel engines).,295673511
201904,502,United States,8409,Parts suitable for use solely or principally with the engines of heading 84.07 or 84.08.,134942083
201904,502,United States,8411,"Turbojets, turbopropellers and other gas turbines.",2849421571
201904,502,United States,8412,Other engines and motors.,133347075
201904,502,United States,8413,"Pumps for liquids, whether or not fitted with a measuring device; liquid elevators.",561857718
201904,502,United States,8414,"Air or vacuum pumps, air or other gas compressors and fans; ventilating or recycling hoods incorporating a fan, whether or not fitted with filters.",246915668
201904,502,United States,8415,"Air conditioning machines, comprising a motordriven fan and elements for changing the temperature and humidity, including those machines in which the humidity cannot be separately regulated.",26137509
201904,502,United States,8416,"Furnace burners for liquid fuel, for pulverised solid fuel or for gas; mechanical stokers, including their mechanical grates,mechanical ash dischargers and similar appliances.",8795169
201904,502,United States,8417,"Industrial or laboratory furnaces and ovens, including incinerators, nonelectric.",28800955
201904,502,United States,8418,"Refrigerators, freezers and other refrigerating or freezing equipment, electric or other; heat pumps other than air conditioning machines of heading 84.15.",57775668
201904,502,United States,8419,"Machinery, plant or laboratory equipment, whether or not electrically heated (excluding furnaces, ovens and other equipment of heading 85.14), for the treatment of materials by a process involving a change of temperature such as heating, cooking, roasting, distilling, rectifying, sterilising, pasteurising, other than machinery or plant of a kind used for domestic purposes; instantaneous or storage water heaters, nonelectric.",159040865
201904,502,United States,8420,"Calendering or other rolling machines, other than for metals or glass, and cylinders therefor.",1383842
201904,502,United States,8421,"Centrifuges, including centrifugal dryers; filtering or purifying machinery and apparatus, for liquids or gases.",498179778
201904,502,United States,8422,"Dish washing machines; machinery for cleaning or drying bottles or other containers; machinery for filling, closing, sealing or labelling bottles, cans, boxes, bags or other containers; machinery for capsuling bottles, jars, tubes and similar containers; other packing or wrapping machinery (including heatshrink wrapping machinery); machinery for aerating beverages.",12485600
