Date of data,Trading partner code,Trading partner,Commodity code,Commodity,Renminbi Yuan
201904,502,United States,3812,"Prepared rubber accelerators; compound plasticisers for rubber or plastics, not elsewhere specified or included; antioxidising preparations and other compound stabilisers for rubber or plastics.",22537837
201904,502,United States,3813,Preparations and charges for fireextinguishers; charged fireextinguishing grenades.,1498401
201904,502,United States,3814,"Organic composite solvents and thinners, not elsewhere specified or included; prepared paint or varnish removers.",15514273
201904,502,United States,3815,"Reaction initiators, reaction accelerators and catalytic preparations, not elsewhere specified or included.",265744049
201904,502,United States,3816,"Refractory cements, mortars, concretes and similar compositions, other than products of heading 38.01.",1263327
201904,502,United States,3817,"Mixed alkylbenzenes and mixed alkylnaphthalenes, other than those of heading 27.07 or 29.02.",1026235
201904,502,United States,3818,"Chemical elements doped for use in electronics, in the form of discs, wafers or similar forms; chemical compounds doped for use in electronics. form of",72464477
201904,502,United States,3819,"Hydraulic brake fluids and other prepared liquids for hydraulic transmission, not containing or containing less than 70% by weight of petroleum oils or oils obtained from bituminous minerals.",13987010
201904,502,United States,3820,Antifreezing preparations and prepared deicing fluids.,5820491
201904,502,United States,3821,"Prepared culture media for the development or maintenance of microorganisms (including viruses and the like) or of plant, human or animal cells.",57759612
201904,502,United States,3822,"Diagnostic or laboratory reagents on a backing, prepared diagnostic or laboratory reagents whether or not on a backing, other than those of heading 30.02 or 30.06; certified reference materials.",490144872
201904,502,United States,3823,Industrial monocarboxylic fatty acids; acid oils from refining;industrial fatty alcohols.,8216452
201904,502,United States,3824,"Prepared binders for foundry moulds or cores; chemical products and preparations for the chemical or allied industries, incl. mixtures of natural products, n.e.s.",477932763
201904,502,United States,3826,"Biodiesel and mixtures thereof, not containing or containing less than 70% by weight of petroleum oils or oils obtained from bituminous minerals.",1398025
201904,502,United States,3901,"Polymers of ethylene, in primary forms.",536700306
201904,502,United States,3902,"Polymers of propylene or of other olefins, in primary forms.",105459828
201904,502,United States,3903,"Polymers of styrene, in primary forms.",84037474
201904,502,United States,3904,"Polymers of vinyl chloride or of other halogenated olefins, in primary forms.",220320598
201904,502,United States,3905,"Polymers of vinyl acetate or of other vinyl esters, in primary forms; other vinyl polymers in primary forms.",62429100
201904,502,United States,3906,crylic polymers in primary forms.,70003785
201904,502,United States,3907,"Polyacetals, other polyethers and epoxide resins, in primary forms; polycarbonates, alkyd resins, polyallyl esters and other polyesters, in primary forms.",746310330
201904,502,United States,3908,Polyamides in primary forms.,194939806
201904,502,United States,3909,"minoresins, phenolic resins and polyurethanes, in primary forms.",60652235
201904,502,United States,3910,Silicones in primary forms.,81829427
201904,502,United States,3911,"etroleum resins, coumaroneindene resins, polyterpenes, polysulphides, polysulphones and other products specified in Note 3 to this Chapter, not elsewhere specified or included, in primary forms.",75647353
201904,502,United States,3912,"Cellulose and its chemical derivatives, not elsewhere specified or included, in primary forms.",123214436
201904,502,United States,3913,"Natural polymers (for example, alginic acid) and modified natural polymers (for example, hardened proteins, chemical derivatives of natural rubber), not elsewhere specified or included, in primary forms.",17810584
201904,502,United States,3914,"Ionexchangers based on polymers of headings 39.01 to 39.13, in primary forms.",5144715
201904,502,United States,3916,"Monofilament of which any crosssectional dimension exceeds 1 mm, rods, sticks and profile shapes, whether or not surfac worked but not otherwise worked, of plastics.",5389147
201904,502,United States,3917,"Tubes, pipes and hoses, and fittings therefor (for example, joints,elbows, flanges), of plastics.",119234615
201904,502,United States,3918,"Floor coverings of plastics, whether or not selfadhesive, in rolls or in the form of tiles; wall or ceiling coverings of plastics, as defined in Note 9 to this Chapter.",4943376
201904,502,United States,3919,"Selfadhesive plates, sheets, film, foil, tape, strip and other flat shapes, of plastics, whether or not in rolls.",235385837
201904,502,United States,3920,"Other plates, sheets, film, foil and strip, of plastics, noncellular and not reinforced, laminated, supported or similarly combined with other materials.",482467952
201904,502,United States,3921,"Other plates, sheets, film, foil and strip, of plastics.",160851408
201904,502,United States,3922,"Baths, showerbaths, sinks, washbasins, bidets, lavatory pans, seats and covers, flushing cisterns and similar sanitary ware, of plastics.",788701
201904,502,United States,3923,"Articles for the conveyance or packing of goods, of plastics; stoppers, lids, caps and other closures, of plastics.",73135503
201904,502,United States,3924,"Tableware, kitchenware, other household articles and hygienic or toilet articles, of plastics.",5617936
201904,502,United States,3925,"Builders' ware of plastics, not elsewhere specified or included.",2933044
201904,502,United States,3926,Other articles of plastics and articles of other materials of headings 39.01 to 39.14.,312410595
201904,502,United States,4001,"Natural rubber, balata, guttapercha, guayule, chicle and similar natural gums, in primary forms or in plates, sheets or strip.",24492
201904,502,United States,4002,"Synthetic rubber and factice derived from oils, in primary forms or in plates, sheets or strip; mixtures of any product of heading 40.01 with any product of this heading, in primary forms or in plates, sheets or strip.",189161611
201904,502,United States,4003,"Reclaimed rubber in primary forms or in plates, sheets or strip.",500679
201904,502,United States,4005,"ompounded rubber, unvulcanised, in primary forms or in plates, sheets or strip.",18578879
201904,502,United States,4006,"Other forms (for example, rods, tubes and profile shapes) and articles (for example, discs and rings), of unvulcanised rubber.",4935346
201904,502,United States,4007,Vulcanised rubber thread and cord.,100445
201904,502,United States,4008,"lates, sheets, strip, rods and profile shapes, of vulcanised rubber other than hard rubber.",13575556
201904,502,United States,4009,"Tubes, pipes and hoses, of vulcanised rubber other than hard rubber, with or without their fittings (for example, joints, elbows, flanges).",31075712
201904,502,United States,4010,"Conveyor or transmission belts or belting, of vulcanised rubber.",10894977
201904,502,United States,4011,"New pneumatic tyres, of rubber.",21134219
201904,502,United States,4012,"Retreaded or used pneumatic tyres of rubber; solid or cushion tyres, tyre treads and tyre flaps, of rubber.",12258955
201904,502,United States,4013,"Inner tubes, of rubber.",136482
201904,502,United States,4014,"Hygienic or pharmaceutical articles (including teats), of vulcanised rubber other than hard rubber, with or without fittings of hard rubber.",1883747
201904,502,United States,4015,"Articles of apparel and clothing accessories (including gloves, mittens and mitts), for all purposes, of vulcanised rubber other than hard rubber.",4874785
201904,502,United States,4016,Other articles of vulcanised rubber other than hard rubber.,155872444
201904,502,United States,4017,"Hard rubber (for example, ebonite) in all forms, including waste and scrap; articles of hard rubber.",622366
201904,502,United States,4101,"Raw hides and skins of bovine (including buffalo) or equine animals (fresh, or salted, dried, limed, pickled or otherwise preserved, but not tanned, parchmentdressed or further prepared), whether or not dehaired or split.",275994746
201904,502,United States,4102,"Raw skins of sheep or lambs (fresh, or salted, dried, limed, pickled or otherwise preserved, but not tanned, parchment dressed or further prepared), whether or not with wool on or split, other than those excluded by Note 1 (c) to this Chapter.",1943565
201904,502,United States,4103,"Other raw hides and skins (fresh, or salted, dried, limed, pickled or otherwise preserved, but not tanned, parchmentdressed or further prepared), whether or not dehaired or split, other thanthose excluded by Note 1 (b) or 1 (c) to this Chapter.",10137221
201904,502,United States,4104,"Tanned or crust hides and skins of bovine (including buffalo) or equine animals, without hair on, whether or not split, but not further prepared.",66558809
201904,502,United States,4106,"Tanned or crust hides and skins of other animals, without wool whether or not split, but not further prepared.",327568
201904,502,United States,4107,"Leather further prepared after tanning or crusting, including parchmentdressed leather, of bovine (including buffalo) or equine animals, without hair on, whether or not split, other than leather of heading 41.14.",10482431
201904,502,United States,4112,"Leather further prepared after tanning or crusting, including parchmentdressed leather, of sheep or lamb, without wool on, whether or not split, other than leather of heading 41.14.",9585
201904,502,United States,4113,"Leather further prepared after tanning or crusting, including parchmentdressed leather, of other animals, without wool or hair on, whether or not split, other than leather of heading 41.14.",1567948
201904,502,United States,4114,Chamois (including combination chamois) leather; patentleather and patent laminated leather; metallised leather.,388485
201904,502,United States,4115,"Composition leather with a basis of leather or leather fibre, in slabs, sheets or strip, whether or not in rolls; parings and other waste of leather or of composition leather, not suitable for the manufacture of leather articles; leather dust, powder and flour.",10234
201904,502,United States,4201,"Saddlery and harness for any animal, incl. traces, leads, knee pads, muzzles, saddle cloths, saddlebags, dog coats and the like, of any material",85224
201904,502,United States,4202,"Trunks, suitcases, vanitycases, executivecases, briefcases, school satchels, spectacle cases, binocular cases, camera cases, musical instrument cases, gun cases, holsters and similar containers; travellingbags, insulated food or beverages bags, toilet bags, rucksacks, handbags, shoppingbags, wallets, purses, mapcases, cigarettecases, tobaccopouches, tool bags, sports bags, bottlecases, jewellery boxes, powderboxes, cutlery cases and similar containers, of leather or of composition leather, of sheeting of plastics, of textile materials, of vulcanised fibre or of paperboard, or wholly or mainly covered with such materials or with paper.",60403248
201904,502,United States,4203,"Articles of apparel and clothing accessories, of leather or of composition leather.",3166368
201904,502,United States,4205,Other articles of leather or of composition leather.,587604
201904,502,United States,4301,"Raw furskins, incl. heads, tails, paws and other pieces or cuttings suitable for use in furriery (excluding raw hides and skins of heading 4101, 4102 or 4103)",6330763
201904,502,United States,4302,"Tanned or dressed furskins (including heads, tails, paws and other pieces or cuttings), unassembled, or assembled (without the addition of other materials) other than those of heading 43.03.",1446269
201904,502,United States,4303,"rticles of apparel, clothing accessories and other articles of furskin.",28199
201904,502,United States,4304,Artificial fur and articles thereof.,2938
201904,502,United States,4401,"Fuel wood, in logs, billets, twigs, faggots or similar forms; wood in chips or particles; sawdust and wood waste and scrap, whether or not agglomerated in logs, briquettes, pellets or similar forms",1043969
201904,502,United States,4403,"Wood in the rough, whether or not stripped of bark or sapwood,or roughly squared.",503594406
201904,502,United States,4404,"Hoopwood; split poles; piles, pickets and stakes of wood, pointed but not sawn lengthwise; wooden sticks, roughly trimmed but not turned, bent or otherwise worked, suitable for the manufacture of walkingsticks,umbrellas, tool handles or the like; chipwood and the like.",4005
201904,502,United States,4407,"Wood sawn or chipped lengthwise, sliced or peeled, whether or not planed, sanded or endjointed, of a thickness exceeding 6 mm.",545516436
201904,502,United States,4408,"Sheets for veneering, incl. those obtained by slicing laminated wood, for plywood or for other similar laminated wood and other wood, sawn lengthwise, sliced or peeled, whether or not planed, sanded, spliced or end-jointed, of a thickness of ≤ 6 mm",2625468
201904,502,United States,4409,"Wood, incl. strips and friezes for parquet flooring, not assembled, continuously shaped ""tongued, grooved, rebated, chamfered, V-jointed beaded, moulded, rounded or the like"" along any of its edges, ends or faces, whether or not planed, sanded or end-jointed",4540572
201904,502,United States,4410,"Particle board, oriented strand board (OSB) and similar board (for example, waferboard) of wood or other ligneous materials, whether or not agglomerated with resins or other organic binding substances.",84744
201904,502,United States,4411,"Fibreboard of wood or other ligneous materials, whether or not bonded with resins or other organic substances.",518902
201904,502,United States,4412,"Plywood, veneered panels and similar laminated wood.",448180
201904,502,United States,4414,"Wooden frames for paintings, photographs, mirrors or similar objects.",37901
201904,502,United States,4415,"Packing cases, boxes, crates, drums and similar packings, of wood; cabledrums of wood; pallets, box pallets and other load boards,of wood; pallet collars of wood.",774739
201904,502,United States,4416,"Casks, barrels, vats, tubs and other coopers' products and parts thereof, of wood, including staves.",1642533
201904,502,United States,4418,"Builders' joinery and carpentry of wood, including cellular wood panels, assembled flooring panels, shingles and shakes.",3395946
201904,502,United States,4419,"Tableware and kitchenware, of wood.",2679659
201904,502,United States,4420,"Wood marquetry and inlaid wood; caskets and cases for jewellery or cutlery, and similar articles, of wood; statuettes and other ornaments, of wood; wooden articles of furniture (excluding furniture, lighting fixtures and parts thereof)",63639
201904,502,United States,4421,Other articles of wood.,307142
201904,502,United States,4503,Articles of natural cork.,10046
201904,502,United States,4504,"Agglomerated cork, with or without a binding substance, and articles of agglomerated cork",169183
201904,502,United States,4601,"Plaits and similar products of plaiting materials, whether or not assembled into strips; plaiting materials, plaits and similar products of plaiting materials, bound together in parallel strands or woven, in sheet form, whether or not being finished articles (for example, mats, matting, screens).",6495
201904,502,United States,4602,"Basketwork, wickerwork and other articles, made directly to shape from plaiting materials or made up from goods of heading 46.01; articles of loofah.",19880
201904,502,United States,4702,"Chemical wood pulp, dissolving grades.",198535587
201904,502,United States,4703,"Chemical wood pulp, soda or sulphate, other than dissolving grades.",576699675
201904,502,United States,4706,"Pulps of fibres derived from recovered ""waste and scrap"" paper or paperboard or of other fibrous cellulosic material",6642432
201904,502,United States,4707,ecovered (waste and scrap) paper or paperboard.,488454673
201904,502,United States,4802,"Uncoated paper and paperboard, of a kind used for writing, printing or other graphic purposes, and non perforated punchcards and punch tape paper, in rolls or rectangular (including square) sheets, of any size, other than paper of heading 48.01 or 48.03; handmade paper and paperboard.",7629348
201904,502,United States,4803,"Toilet or facial tissue stock, towel or napkin stock and similar paper of a kind used for household or sanitary purposes, cellulose wadding and webs of cellulose fibres, whether or not creped, crinkled, embossed, perforated, surfacecoloured, surface decorated or printed, in rolls or sheets.",2882057
201904,502,United States,4804,"Uncoated kraft paper and paperboard, in rolls or sheets, other than that of heading 48.02 or 48.03.",163302927
201904,502,United States,4805,"Other uncoated paper and paperboard, in rolls or sheets, not further worked or processed than as specified in Note 3 to this Chapter.",16425235
201904,502,United States,4806,"vegetable parchment, greaseproof papers, tracing papers and glassine and other glazed transparent or translucent papers, in rolls or sheets.",9699251
201904,502,United States,4807,"Composite paper and paperboard (made by sticking flat layers of paper or paperboard together with an adhesive), not surface coated or impregnated, whether or not internally reinforced, in rolls or sheets.",64
201904,502,United States,4808,"Paper and paperboard, corrugated (with or without glued flat surface sheets), creped, crinkled, embossed or perforated, in rolls or sheets, other than paper of the kind described in heading 48.03.",5389895
201904,502,United States,4809,"Carbon paper, selfcopy paper and other copying or transfer papers (including coated or impregnated paper for duplicator stencils or offset plates), whether or not printed, in rolls or sheets.",18994
201904,502,United States,4810,"Paper and paperboard, coated on one or both sides with kaolin (China clay) or other inorganic substances, with or without a binder, and with no other coating, whether or not surface coloured, surfacedecorated or printed, in rolls or rectangular (including square) sheets, of any size.",69030570
201904,502,United States,4811,"Paper, paperboard, cellulose wadding and webs of cellulose fibres,coated,impregnated,covered, surfacecoloured, surface decorated or printed, in rolls or rectangular (including square) sheets, of any size, other than goods of the kind described in heading 48.03, 48.09 or 48.10.",93187886
201904,502,United States,4812,"Filter blocks, slabs and plates, of paper pulp.",193525
201904,502,United States,4814,Wallpaper and similar wall coverings; window transparencies of paper.,2500638
201904,502,United States,4816,"Carbon paper, self-copy paper and other copying or transfer papers, in rolls of a width of ≤ 36 cm or in rectangular or square sheets with no side measuring > 36 cm in the unfolded state, or cut into shapes other than rectangles or squares, together with full duplicator stencils and offset plates of paper, whether or not in boxes",1526231
201904,502,United States,4817,"Envelopes, letter cards, plain postcards and correspondence cards, of paper or paperboard; boxes, pouches, wallets and writing compendiums, of paper or paperboard, containing an assortment of paper stationery.",67589
201904,502,United States,4818,"Toilet paper and similar paper, cellulose wadding or webs of cellulose fibres, of a kind used for household or sanitary purposes, in rolls of a width ≤ 36 cm, or cut to size or shape; handkerchiefs, cleansing tissues, towels, tablecloths, serviettes, bedsheets and similar household, sanitary or hospital articles, articles of apparel and clothing accessories, of paper pulp, paper, cellulose wadding or webs of cellulose fibres",4089514
201904,502,United States,4819,"Cartons, boxes, cases, bags and other packing containers, of paper, paperboard, cellulose wadding or webs of cellulose fibres, n.e.s.; box files, letter trays, and similar articles, of paperboard of a kind used in offices, shops or the like",2711642
201904,502,United States,4820,"Registers, account books, note books, order books, receipt books, letter pads, memorandum pads,diaries and similar articles, exercise books, blottingpads, binders (looseleaf or other), folders, file covers, manifold business forms, interleaved carbon sets and other articles of stationery, of paper or paperboard; albums for samples or for collections and book covers, of paper or paperboard.",965009
201904,502,United States,4821,"paper or paperboard labels of all kinds, whether or not printed.",13981446
201904,502,United States,4822,"Bobbins, spools, cops and similar supports of paper pulp, paper or paperboard (whether or not perforated or hardened).",108092
201904,502,United States,4823,"Other paper, paperboard, cellulose wadding and webs of cellulose fibres, cut to size or shape; other articles of paper pulp, paper,paperboard, cellulose wadding or webs of cellulose fibres.",10759036
201904,502,United States,4901,"Printed books, brochures, leaflets and similar printed matter, whether or not in single sheets.",37466477
201904,502,United States,4902,"Newspapers, journals and periodicals, whether or not illustrated or containing advertising material.",15269823
201904,502,United States,4903,"Children's picture, drawing or colouring books.",1691316
201904,502,United States,4904,"Music, printed or in manuscript, whether or not bound or illustrated",34551
201904,502,United States,4905,"Maps and hydrographic or similar charts of all kinds, including atlases, wall maps, topographical plans and globes, printed.",396088
201904,502,United States,4906,"Plans and drawings for architectural, engineering, industrial, commercial, topographical or similar purposes, being originals drawn by hand; handwritten texts; photographic reproductions on sensitised paper and carbon copies of the foregoing",789
201904,502,United States,4907,"Unused postage, revenue or similar stamps of current or new issue in the country in which they have, or will have, a recognised face value; stamp-impressed paper; banknotes; cheque forms; stock, share or bond certificates and similar documents of title",142025868
201904,502,United States,4908,Transfers (decalcomanias),2217340
201904,502,United States,4909,"Printed or illustrated postcards; printed cards bearing personal greetings, messages or announcements, whether or not illustrated, with or without envelopes or trimmings.",59896
201904,502,United States,4910,"Calendars of any kind, printed, including calendar blocks.",1586
201904,502,United States,4911,"Other printed matter, including printed pictures and photographs.",14597789
201904,502,United States,5006,"Silk yarn and yarn spun from silk waste, put up for retail sale;silkworm gut.",5537
201904,502,United States,5007,Woven fabrics of silk or of silk waste.,148704
201904,502,United States,5101,"Wool, not carded or combed.",1870954
201904,502,United States,5103,"Waste of wool or of fine or coarse animal hair, including yarn waste but excluding garnetted stock.",895399
201904,502,United States,5106,"Yarn of carded wool, not put up for retail sale.",423
201904,502,United States,5109,"Yarn of wool or of fine animal hair, put up for retail sale.",68868
201904,502,United States,5111,Woven fabrics of carded wool or of carded fine animal hair.,101949
201904,502,United States,5112,Woven fabrics of combed wool or of combed fine animal hair.,183092
201904,502,United States,5201,"Cotton, not carded or combed.",478319944
201904,502,United States,5204,"Cotton sewing thread, whether or not put up for retail sale.",9472
201904,502,United States,5205,"Cotton yarn (other than sewing thread), containing 85% or more by weight of cotton, not put up for retail sale.",303062
201904,502,United States,5208,"Woven fabrics of cotton, containing 85% or more by weight of cotton, weighing not more than 200 g/m2",217283
201904,502,United States,5209,"Woven fabrics of cotton, containing 85% or more by weight of cotton, weighing more than 200 g/m2",1632624
201904,502,United States,5210,"Woven fabrics of cotton, containing less than 85% by weight of cotton, mixed mainly or solely with manmade fibres, weighing not more than 200 g/m2.",10518
201904,502,United States,5211,"Woven fabrics of cotton, containing less than 85% by weight of cotton, mixed mainly or solely with manmade fibres, weighing more than 200 g/m2.",103507
201904,502,United States,5212,Other woven fabrics of cotton.,58916
201904,502,United States,5309,Woven fabrics of flax.,35152
201904,502,United States,5401,"Sewing thread of manmade filaments, whether or not put up for retail sale.",1356311
201904,502,United States,5402,"Synthetic filament yarn (other than sewing thread), not put up for retail sale, including synthetic monofilament of less than 67 decitex.",34324238
201904,502,United States,5403,"Artificial filament yarn (other than sewing thread), not put up for retail sale, including artificial monofilament of less than 67 decitex.",5046713
201904,502,United States,5404,"Synthetic monofilament of 67 decitex or more and of which no crosssectional dimension exceeds 1 mm; strip and the like (for example, artificial straw) of synthetic textile materials of an apparent width not exceeding 5 mm.",11208451
201904,502,United States,5406,"Manmade filament yarn (other than sewing thread), put up for retail sale.",2723
201904,502,United States,5407,"Woven fabrics of synthetic filament yarn, including woven fabrics obtained from materials of heading 54.04.",7388734
201904,502,United States,5408,"Woven fabrics of artificial filament yarn, including woven fabrics obtained from materials of heading 54.05.",195168
