Date of data,Trading partner code,Trading partner,Commodity code,Commodity,Renminbi Yuan
201902,502,United States,7116,"Articles of natural or cultured pearls, precious or semiprecious stones (natural, synthetic or reconstructed).",339782
201902,502,United States,7117,Imitation jewellery.,1984411
201902,502,United States,7202,Ferroalloys.,1049943
201902,502,United States,7205,"Nranules and powders, of pig iron, spiegeleisen, iron or steel.",4580463
201902,502,United States,7206,Iron and nonalloy steel in ingots or other primary forms (excluding iron of heading 72.03).,37500
201902,502,United States,7209,"Flat-rolled products of iron or nonalloy steel, of a width of 600 mm or more, coldrolled (coldreduced), not clad, plated or coated.",1418115
201902,502,United States,7210,"at-rolled products of iron or non-alloy steel, of a width ≥ 600 mm, hot-rolled or cold-rolled ""cold-reduced"", clad, plated or coated",13095856
201902,502,United States,7211,"Flat-rolled products of iron or nonalloy steel, of a width of less than 600 mm, not clad, plated or coated.",2547108
201902,502,United States,7212,"Flat-rolled products of iron or nonalloy steel, of a width of less than 600 mm, clad, plated or coated.",7988096
201902,502,United States,7214,"Other bars and rods of iron or nonalloy steel, not further worked than forged, hotrolled, hotdrawn or hotextruded, but including those twisted after rolling.",553929
201902,502,United States,7215,Other bars and rods of iron or nonalloy steel.,1066072
201902,502,United States,7216,"Angles, shapes and sections of iron or nonalloy steel.",1137578
201902,502,United States,7217,Wire of iron or nonalloy steel.,120978
201902,502,United States,7218,Stainless steel in ingots or other primary forms; semifinished products of stainless steel.,7743
201902,502,United States,7219,"Flat-rolled products of stainless steel, of a width of 600 mm or more.",7907840
201902,502,United States,7220,"Flat-rolled products of stainless steel, of a width of less than 600 mm.",8935421
201902,502,United States,7222,"Other bars and rods of stainless steel; angles, shapes and sections of stainless steel.",20815835
201902,502,United States,7223,Wire of stainless steel.,3969285
201902,502,United States,7224,Other alloy steel in ingots or other primary forms; semifinished products of other alloy steel.,685087
201902,502,United States,7225,"Flat-rolled products of other alloy steel, of a width of 600 mm or more.",28427638
201902,502,United States,7226,"Flat-rolled products of alloy steel other than stainless, of a width of ≥ 600 mm, hot-rolled or cold-rolled ""cold-reduced"" and further worked (excluding plated or coated with zinc and products of silicon-electrical steel)",5620186
201902,502,United States,7228,"Other bars and rods of other alloy steel; angles, shapes and sections, of other alloy steel; hollow drill bars and rods, of alloy or nonalloy steel.",3434562
201902,502,United States,7229,Wire of other alloy steel.,1008420
201902,502,United States,7301,"Sheet piling of iron or steel, whether or not drilled, punched or made from assembled elements; welded angles, shapes and sections, of iron or steel.",78703
201902,502,United States,7304,"Tubes, pipes and hollow profiles, seamless, of iron (other than cast iron) or steel.",23629917
201902,502,United States,7305,"Other tubes and pipes (for example, welded, riveted or similarly closed), having circular cross-sections, the external diameter of which exceeds 406.4 mm, of iron or steel.",263040
201902,502,United States,7306,"Other tubes, pipes and hollow profiles (for example, open seam or welded, riveted or similarly closed), of iron or steel.",11776207
201902,502,United States,7307,"Tube or pipe fittings (for example, couplings, elbows, sleeves), of iron or steel.",63558220
201902,502,United States,7308,"Structures (excluding prefabricated buildings of heading 94.06) and parts of structures (for example, bridges and bridgesections, lockgates, towers, lattice masts, roofs, roofing frameworks, doors and windows and their frames and thresholds for doors, shutters, balustrades, pillars and columns), of iron or steel; plates, rods, angles, shapes, sections, tubes and the like, prepared for use in structures, of iron or steel.",23827575
201902,502,United States,7309,"eservoirs, tanks, vats and similar containers for any material (other than compressed or liquefied gas), of iron or steel, of a capacity exceeding 300 l, whether or not lined or heatinsulated, but not fitted with mechanical or thermal equipment.",1798329
201902,502,United States,7310,"anks, casks, drums, cans, boxes and similar containers, for any material (other than compressed or liquefied gas), of iron or steel, of a capacity not exceeding 300 l, whether or not lined or heatinsulated, but not fitted with mechanical or thermal equipment.",2775395
201902,502,United States,7311,"Containers for compressed or liquefied gas, of iron or steel.",5090830
201902,502,United States,7312,"Stranded wire, ropes, cables, plaited bands, slings and the like, of iron or steel, not electrically insulated.",7105822
201902,502,United States,7313,"Barbed wire of iron or steel; twisted hoop or single flat wire, barbed or not, and loosely twisted double wire, of a kind used for fencing, of iron or steel.",34
201902,502,United States,7314,"Cloth (including endless bands), grill, netting and fencing, of iron or steel wire; expanded metal of iron or steel.",2588070
201902,502,United States,7315,"Chain and parts thereof, of iron or steel.",7563107
201902,502,United States,7316,"Anchors, grapnels and parts thereof, of iron or steel.",79938
201902,502,United States,7317,"Nails, tacks, drawing pins, corrugated nails, staples (other than those of heading 83.05) and similar articles, of iron or steel, whether or not with heads of other material, but excluding such articles with heads of copper.",2225803
201902,502,United States,7318,"Screws, bolts, nuts, coach screws, screw hooks, rivets, cotters, cotterpins, washers (including spring washers) and similar articles, of iron or steel.",158062760
201902,502,United States,7319,"Sewing needles, knitting needles, bodkins, crochet hooks, embroidery stilettos and similar articles, for use in the hand, of iron or steel; safety pins and other pins of iron or steel, not elsewhere specified or included.",2707367
201902,502,United States,7320,"Springs and leaves for springs, of iron or steel.",24449885
201902,502,United States,7321,"Stoves, ranges, grates, cookers (including those with subsidiary boilers for central heating), barbecues, braziers, gasrings, plate warmers and similar nonelectric domestic appliances, and parts thereof, of iron or steel.",1879288
201902,502,United States,7322,"Radiators for central heating, not electrically heated, and parts thereof, of iron or steel; air heaters and hot air distributors (including distributors which can also distribute fresh or conditioned air), not electrically heated, incorporating a motordriven fan or blower, and parts thereof, of iron or steel.",231624
201902,502,United States,7323,"Table, kitchen or other household articles and parts thereof, of iron or steel; iron or steel wool; pot scourers and scouring or polishing pads, gloves and the like, of iron or steel.",1622901
201902,502,United States,7324,"Sanitary ware and parts thereof, of iron or steel.",3971740
201902,502,United States,7325,Other cast articles of iron or steel.,4272147
201902,502,United States,7326,Other articles of iron or steel.,210748283
201902,502,United States,7402,Unrefined copper; copper anodes for electrolytic refining.,949991
201902,502,United States,7403,"Refined copper and copper alloys, unwrought.",44497
201902,502,United States,7404,Copper waste and scrap.,175131180
201902,502,United States,7405,Master alloys of copper.,267288
201902,502,United States,7406,Copper powders and flakes.,1610517
201902,502,United States,7407,"Copper bars, rods and profiles.",4291099
201902,502,United States,7408,Copper wire.,5402472
201902,502,United States,7409,"Copper plates, sheets and strip, of a thickness exceeding 0.15mm.",14184306
201902,502,United States,7410,"Copper foil (whether or not printed or backed with paper, paperboard, plastics or similar backing materials) of a thickness (excluding any backing) not exceeding 0.15 mm.",34551906
201902,502,United States,7411,Copper tubes and pipes.,1040566
201902,502,United States,7412,"Copper tube or pipe fittings (for example, couplings, elbows, sleeves).",4999929
201902,502,United States,7413,"Stranded wire, cables, plaited bands and the like, of copper, not electrically insulated.",1179939
201902,502,United States,7415,"Nails, tacks, drawing pins, staples (other than those of heading 83.05) and similar articles, of copper or of iron or steel with heads of copper; screws, bolts, nuts, screw hooks, rivets, cotters, cotterpins, washers (including spring washers) and similar articles, of copper.",4689738
201902,502,United States,7418,"Table, kitchen or other household articles and parts thereof, of copper; pot scourers and scouring or polishing pads, gloves and the like, of copper; sanitary ware and parts thereof, of copper.",55438
201902,502,United States,7419,Other articles of copper.,13163483
201902,502,United States,7502,nwrought nickel.,3652733
201902,502,United States,7504,Nickel powders and flakes.,4638326
201902,502,United States,7505,"Nickel bars, rods, profiles and wire.",79539427
201902,502,United States,7506,"Nickel plates, sheets, strip and foil.",25455365
201902,502,United States,7507,"Nickel tubes, pipes and tube or pipe fittings (for example, couplings, elbows, sleeves).",19209087
201902,502,United States,7508,Other articles of nickel.,77532515
201902,502,United States,7601,Unwrought aluminium.,952516
201902,502,United States,7602,Aluminium waste and scrap.,271530884
201902,502,United States,7603,Aluminium powders and flakes.,552380
201902,502,United States,7604,"Aluminium bars, rods and profiles.",17076588
201902,502,United States,7605,Aluminium wire.,2566986
201902,502,United States,7606,"Aluminium plates, sheets and strip, of a thickness exceeding 0.2 mm.",45521176
201902,502,United States,7607,"Aluminium foil (whether or not printed or backed with paper, paperboard, plastics or similar backing materials) of a thickness (excluding any backing) not exceeding 0.2 mm.",10416996
201902,502,United States,7608,Aluminium tubes and pipes.,961890
201902,502,United States,7609,"Aluminium tube or pipe fittings (for example, couplings, elbows, sleeves).",4356709
201902,502,United States,7610,"Aluminium structures (excluding prefabricated buildings of heading 94.06) and parts of structures (for example, bridges and bridgesections, towers, lattice masts, roofs, roofing frameworks, doors and windows and their frames and thresholds for doors, balustrades, pillars and columns); aluminium plates, rods, profiles, tubes and the like, prepared for use in structures.",487058
201902,502,United States,7611,"Aluminium reservoirs, tanks, vats and similar containers, for any material (other than compressed or liquefied gas), of a capacity exceeding 300 l, whether or not lined or heatinsulated, but not fitted with mechanical or thermal equipment.",950419
201902,502,United States,7612,"Aluminium casks, drums, cans, boxes and similar containers (including rigid or collapsible tubular containers), for any material (other than compressed or liquefied gas), of a capacity not exceeding 300 l, whether or not lined or heatinsulated, but not fitted with mechanical or thermal equipment.",416190
201902,502,United States,7613,Aluminium containers for compressed or liquefied gas.,1090526
201902,502,United States,7614,"Stranded wire, cables, plaited bands and the like, of aluminium, not electrically insulated.",40479
201902,502,United States,7615,"Table, kitchen or other household articles and parts thereof, of aluminium; pot scourers and scouring or polishing pads, gloves and the like, of aluminium; sanitary ware and parts thereof, of aluminium.",1187385
201902,502,United States,7616,Other articles of aluminium.,69136800
201902,502,United States,7804,"Lead plates, sheets, strip and foil; lead powders and flakes.",130949
201902,502,United States,7806,Other articles of lead.,2350851
201902,502,United States,7903,"zinc dust, powders and flakes.",16240965
201902,502,United States,7904,"Zinc bars, rods, profiles and wire.",5849
201902,502,United States,7905,"Zinc plates, sheets, strip and foil.",985157
201902,502,United States,7907,Other articles of zinc.,923700
201902,502,United States,8001,Unwrought tin.,79937
201902,502,United States,8003,"Tin bars, rods, profiles and wire.",866858
201902,502,United States,8007,Other articles of tin.,464647
201902,502,United States,8101,"Wungsten (wolfram) and articles thereof, including waste and scrap.",995720
201902,502,United States,8102,"Molybdenum and articles thereof, including waste and scrap.",1638939
201902,502,United States,8103,"Tantalum and articles thereof, including waste and scrap.",17178814
201902,502,United States,8104,"Magnesium and articles thereof, including waste and scrap.",390950
201902,502,United States,8105,"Cobalt mattes and other intermediate products of cobalt metallurgy; cobalt and articles thereof, including waste and scrap.",15957041
201902,502,United States,8106,"Bismuth and articles thereof, including waste and scrap.",36028
201902,502,United States,8107,"Cadmium and articles thereof, including waste and scrap.",4312
201902,502,United States,8108,"Titanium and articles thereof, including waste and scrap.",51785171
201902,502,United States,8109,"Zirconium and articles thereof, including waste and scrap.",947347
201902,502,United States,8110,"Antimony and articles thereof, including waste and scrap.",1245
201902,502,United States,8111,"Manganese and articles thereof, including waste and scrap.",285189
201902,502,United States,8112,"Beryllium, chromium, germanium, vanadium, gallium, hafnium, indium, niobium (columbium), rhenium and thallium, and articles of these metals, including waste and scrap.",7371853
201902,502,United States,8113,"Cermets and articles thereof, including waste and scrap.",7875852
201902,502,United States,8201,"Hand tools, the following : spades, shovels, mattocks, picks, hoes, forks and rakes; axes, bill hooks and similar hewing tools; secateurs and pruners of any kind; scythes, sickles, hay knives, hedge shears, timber wedges and other tools of a kind used in agriculture, horticulture or forestry.",29178
201902,502,United States,8202,"Hand saws; blades for saws of all kinds (including slitting, slotting or toothless saw blades).",5020945
201902,502,United States,8203,"Files, rasps, pliers (including cutting pliers), pincers, tweezers, metal cutting shears, pipecutters, bolt croppers, perforating punches and similar hand tools.",737029
201902,502,United States,8204,"Hand-operated spanners and wrenches (including torque meter wrenches but not including tap wrenches); interchangeable spanner sockets, with or without handles.",2548328
201902,502,United States,8205,"Hand tools (including glaziers' diamonds), not elsewhere specified or included; blow lamps; vices, clamps and the like, other than accessories for and parts of, machinetools or waterjet cutting machines; anvils; portable forges; hand or pedaloperated grinding wheels with frameworks.",10278997
201902,502,United States,8206,"Tools of two or more of the headings 82.02 to 82.05, put up in sets for retail sale.",1503002
201902,502,United States,8207,"Interchangeable tools for hand tools, whether or not poweroperated, or for machinetools (for example, for pressing, stamping, punching, tapping, threading, drilling, boring, broaching, milling, turning or screw driving), including dies for drawing or extruding metal, and rock drilling or earth boring tools.",56548471
201902,502,United States,8208,"Knives and cutting blades, for machines or for mechanical appliances.",27337223
201902,502,United States,8209,"Plates, sticks, tips and the like for tools, unmounted, of cermets.",3518770
201902,502,United States,8210,"Hand-operated mechanical appliances, weighing 10 kg or less, used in the preparation, conditioning or serving of food or drink.",60963
201902,502,United States,8211,"Knives with cutting blades, serrated or not (including pruning knives), other than knives of heading 82.08, and blades therefor.",412087
201902,502,United States,8212,Razors and razor blades (including razor blade blanks in strips).,9861829
201902,502,United States,8213,"Scissors, tailors' shears and similar shears, and blades therefor.",187037
201902,502,United States,8214,"Other articles of cutlery (for example, hair clippers, butchers' or kitchen cleavers, choppers and mincing knives, paper knives); manicure or pedicure sets and instruments (including nail files).",103318
201902,502,United States,8215,"Spoons, forks, ladles, skimmers, cakeservers, fishknives, butterknives, sugar tongs and similar kitchen or tableware.",32220
201902,502,United States,8301,"Padlocks and locks (key, combination or electrically operated), of base metal; clasps and frames with clasps, incorporating locks, of base metal; keys for any of the foregoing articles, of base metal",16263453
201902,502,United States,8302,"Base metal mountings, fittings and similar articles suitable for furniture, doors, staircases, windows, blinds, coachwork, saddlery, trunks, chests, caskets or the like; base metal hatracks, hatpegs, brackets and similar fixtures; castors with mountings of base metal; automatic door closers of base metal",28484453
201902,502,United States,8304,"Filing cabinets, cardindex cabinets, paper trays, paper rests, pen trays, officestamp stands and similar office or desk equipment, of base metal, other than office furniture of heading 9403",5916
201902,502,United States,8305,"Fittings for looseleaf binders or files, letter clips, letter corners, paper clips, indexing tags and similar office articles, of base metal; staples in strips (for example, for offices, upholstery, packaging), of base metal",5872
201902,502,United States,8306,"Bells, gongs and the like, nonelectric, of base metal; statuettes and other ornaments, of base metal; photograph, picture or similar frames, of base metal; mirrors of base metal",393550
201902,502,United States,8307,"Flexible tubing of base metal, with or without fittings",7354951
201902,502,United States,8308,"Clasps, frames with clasps, buckles, buckleclasps, hooks, eyes, eyelets and the like, of base metal, of a kind used for clothing or clothing accessories, footwear, jewellery, wristwatches, books, awnings, leather goods, travel goods or saddlery or for other made up articles; tubular or bifurcated rivets, of base metal; beads and spangles, of base metal",4665249
201902,502,United States,8309,"Stoppers, caps and lids (including crown corks, screw caps and pouring stoppers), capsules for bottles, threaded bungs, bung covers, seals and other packing accessories, of base metal",3960569
201902,502,United States,8310,"Signplates, nameplates, addressplates and similar plates, numbers, letters and other symbols, of base metal, excluding those of heading 9405",1240319
201902,502,United States,8311,"Wire, rods, tubes, plates, electrodes and similar products, of base metal or of metal carbides, coated or cored with flux material, of a kind used for soldering, brazing, welding or deposition of metal or of metal carbides; wire and rods, of agglomerated base metal powder, used for metal spraying",9721006
201902,502,United States,8401,"Nuclear reactors; fuel elements (cartridges), nonirradiated, for nuclear reactors; machinery and apparatus for isotopicseparation.",21765
201902,502,United States,8402,Steam or other vapour generating boilers (other than central heating hot water boilers capable also of producing low pressure steam); superheated water boilers.,17563
201902,502,United States,8403,Central heating boilers other than those of heading 8402.,5622741
201902,502,United States,8404,"Auxiliary plant for use with boilers of heading 84.02 or 84.03 (for example, economisers, superheaters, soot removers, gas recoverers); condensers for steam or other vapour power units.",38544
201902,502,United States,8405,"Producer gas or water gas generators, with or without their purifiers; acetylene gas generators and similar water process gas generators, with or without their purifiers.",196481
201902,502,United States,8406,Steam turbines and other vapour turbines.,61708
201902,502,United States,8407,Sparkignition reciprocating or rotary internal combustion piston engines.,57748427
201902,502,United States,8408,Compressionignition internal combustion piston engines (diesel or semidiesel engines).,220280901
201902,502,United States,8409,Parts suitable for use solely or principally with the engines of heading 84.07 or 84.08.,141480549
201902,502,United States,8411,"Turbojets, turbopropellers and other gas turbines.",2110245547
201902,502,United States,8412,Other engines and motors.,123081526
201902,502,United States,8413,"Pumps for liquids, whether or not fitted with a measuring device; liquid elevators.",225515640
201902,502,United States,8414,"Air or vacuum pumps, air or other gas compressors and fans; ventilating or recycling hoods incorporating a fan, whether or not fitted with filters.",190481509
201902,502,United States,8415,"Air conditioning machines, comprising a motordriven fan and elements for changing the temperature and humidity, including those machines in which the humidity cannot be separately regulated.",35819801
201902,502,United States,8416,"Furnace burners for liquid fuel, for pulverised solid fuel or for gas; mechanical stokers, including their mechanical grates,mechanical ash dischargers and similar appliances.",9271837
201902,502,United States,8417,"Industrial or laboratory furnaces and ovens, including incinerators, nonelectric.",4041916
201902,502,United States,8418,"Refrigerators, freezers and other refrigerating or freezing equipment, electric or other; heat pumps other than air conditioning machines of heading 84.15.",29481842
201902,502,United States,8419,"Machinery, plant or laboratory equipment, whether or not electrically heated (excluding furnaces, ovens and other equipment of heading 85.14), for the treatment of materials by a process involving a change of temperature such as heating, cooking, roasting, distilling, rectifying, sterilising, pasteurising, other than machinery or plant of a kind used for domestic purposes; instantaneous or storage water heaters, nonelectric.",92202319
201902,502,United States,8420,"Calendering or other rolling machines, other than for metals or glass, and cylinders therefor.",3339309
201902,502,United States,8421,"Centrifuges, including centrifugal dryers; filtering or purifying machinery and apparatus, for liquids or gases.",407420410
201902,502,United States,8422,"Dish washing machines; machinery for cleaning or drying bottles or other containers; machinery for filling, closing, sealing or labelling bottles, cans, boxes, bags or other containers; machinery for capsuling bottles, jars, tubes and similar containers; other packing or wrapping machinery (including heatshrink wrapping machinery); machinery for aerating beverages.",13889242
201902,502,United States,8423,"Weighing machinery (excluding balances of a sensitivity of 5 cg or better), including weight operated counting or checking machines; weighing machine weights of all kinds.",579128
201902,502,United States,8424,"Mechanical appliances (whether or not handoperated) for projecting, dispersing or spraying liquids or powders; fire extinguishers, whether or not charged; spray guns and similar appliances; steam or sand blasting machines and similar jet projecting machines.",92133385
201902,502,United States,8425,Pulley tackle and hoists other than skip hoists; winches and capstans; jacks.,7968777
201902,502,United States,8426,"Ships' derricks; cranes, including cable cranes; mobile lifting frames, straddle carriers and works trucks fitted with a crane.",241791
201902,502,United States,8427,Forklift trucks; other works trucks fitted with lifting or handling equipment.,11455058
201902,502,United States,8428,"Other lifting, handling, loading or unloading machinery (for example, lifts, escalators, conveyors, teleferics).",45307412
201902,502,United States,8429,"Self-propelled bulldozers, angledozers, graders, levellers, machines and road rollers.",3414912
201902,502,United States,8430,"Other moving, grading, levelling, scraping, excavating, tamping, compacting, extracting or boring machinery, for earth, minerals or ores; piledrivers and pileextractors; snowploughs and snowblowers.",6673529
201902,502,United States,8431,Parts suitable for use solely or principally with the machinery of headings 84.25 to 84.30.,87960060
201902,502,United States,8432,"Agricultural, horticultural or forestry machinery for soil preparation or cultivation; lawn or sportsground rollers.",3365314
201902,502,United States,8433,"Harvesting or threshing machinery, including straw or fodder balers; grass or hay mowers; machines for cleaning, sorting or grading eggs, fruit or other agricultural produce, other than machinery of heading 84.37.",28416862
201902,502,United States,8434,Milking machines and dairy machinery.,79293
201902,502,United States,8436,"Other agricultural, horticultural, forestry, poultrykeeping or beekeeping machinery, including germination plant fitted with mechanical or thermal equipment; poultry incubators and brooders.",3195816
201902,502,United States,8438,"Machinery, not specified or included elsewhere in this Chapter, for the industrial preparation or manufacture of food or drink, other than machinery for the extraction or preparation of animal or fixed vegetable fats or oils.",7292676
201902,502,United States,8439,Machinery for making pulp of fibrous cellulosic material or for making or finishing paper or paperboard.,8402351
