Date of data,Trading partner code,Trading partner,Commodity code,Commodity,Renminbi Yuan
202410,502,United States,3821,"Prepared culture media for the development or maintenance of microorganisms (including viruses and the like) or of plant, human or animal cells.",110310981
202410,502,United States,3822,"Diagnostic or laboratory reagents on a backing, prepared diagnostic or laboratory reagents whether or not on a backing, whether or not put up in the form of kits, other than those of heading 30.06; certified reference materials",1047830466
202410,502,United States,3823,Industrial monocarboxylic fatty acids; acid oils from refining;industrial fatty alcohols.,27274521
202410,502,United States,3824,"Prepared binders for foundry moulds or cores; chemical products and preparations for the chemical or allied industries, incl. mixtures of natural products, n.e.s.",467135536
202410,502,United States,3827,"Mixtures containing halogenated derivatives of methane, ethane or propane, not elsewhere specified or included",38886
202410,502,United States,3901,"Polymers of ethylene, in primary forms.",1506988261
202410,502,United States,3902,"Polymers of propylene or of other olefins, in primary forms.",138676368
202410,502,United States,3903,"Polymers of styrene, in primary forms.",54933564
202410,502,United States,3904,"Polymers of vinyl chloride or of other halogenated olefins, in primary forms.",96134718
202410,502,United States,3905,"Polymers of vinyl acetate or of other vinyl esters, in primary forms; other vinyl polymers in primary forms.",69665601
202410,502,United States,3906,crylic polymers in primary forms.,84957828
202410,502,United States,3907,"Polyacetals, other polyethers and epoxide resins, in primary forms; polycarbonates, alkyd resins, polyallyl esters and other polyesters, in primary forms.",549849884
202410,502,United States,3908,Polyamides in primary forms.,132024593
202410,502,United States,3909,"minoresins, phenolic resins and polyurethanes, in primary forms.",36411158
202410,502,United States,3910,Silicones in primary forms,95276336
202410,502,United States,3911,"etroleum resins, coumaroneindene resins, polyterpenes, polysulphides, polysulphones and other products specified in Note 3 to this Chapter, not elsewhere specified or included, in primary forms.",91824535
202410,502,United States,3912,"Cellulose and its chemical derivatives, not elsewhere specified or included, in primary forms.",217286466
202410,502,United States,3913,"Natural polymers (for example, alginic acid) and modified natural polymers (for example, hardened proteins, chemical derivatives of natural rubber), not elsewhere specified or included, in primary forms.",15775573
202410,502,United States,3914,"Ionexchangers based on polymers of headings 39.01 to 39.13, in primary forms",4762777
202410,502,United States,3916,"Monofilament of which any crosssectional dimension exceeds 1 mm, rods, sticks and profile shapes, whether or not surfac worked but not otherwise worked, of plastics.",11539551
202410,502,United States,3917,"Tubes, pipes and hoses, and fittings therefor (for example, joints,elbows, flanges), of plastics.",100024149
202410,502,United States,3918,"Floor coverings of plastics, whether or not selfadhesive, in rolls or in the form of tiles; wall or ceiling coverings of plastics, as defined in Note 9 to this Chapter.",8781329
202410,502,United States,3919,"Selfadhesive plates, sheets, film, foil, tape, strip and other flat shapes, of plastics, whether or not in rolls.",183243537
202410,502,United States,3920,"Other plates, sheets, film, foil and strip, of plastics, noncellular and not reinforced, laminated, supported or similarly combined with other materials.",417790296
202410,502,United States,3921,"Other plates, sheets, film, foil and strip, of plastics.",90877490
202410,502,United States,3922,"Baths, showerbaths, sinks, washbasins, bidets, lavatory pans, seats and covers, flushing cisterns and similar sanitary ware, of plastics.",917248
202410,502,United States,3923,"Articles for the conveyance or packing of goods, of plastics; stoppers, lids, caps and other closures, of plastics.",49774486
202410,502,United States,3924,"Tableware, kitchenware, other household articles and hygienic or toilet articles, of plastics.",2262641
202410,502,United States,3925,"Builders' ware of plastics, not elsewhere specified or included.",1165955
202410,502,United States,3926,Other articles of plastics and articles of other materials of headings 39.01 to 39.14.,362159431
202410,502,United States,4002,"Synthetic rubber and factice derived from oils, in primary forms or in plates, sheets or strip; mixtures of any product of heading 40.01 with any product of this heading, in primary forms or in plates, sheets or strip.",100502774
202410,502,United States,4003,"Reclaimed rubber in primary forms or in plates, sheets or strip.",100410
202410,502,United States,4005,"ompounded rubber, unvulcanised, in primary forms or in plates, sheets or strip.",14538661
202410,502,United States,4006,"Other forms (for example, rods, tubes and profile shapes) and articles (for example, discs and rings), of unvulcanised rubber.",2937070
202410,502,United States,4007,Vulcanised rubber thread and cord.,118961
202410,502,United States,4008,"lates, sheets, strip, rods and profile shapes, of vulcanised rubber other than hard rubber.",8283196
202410,502,United States,4009,"Tubes, pipes and hoses, of vulcanised rubber other than hard rubber, with or without their fittings (for example, joints, elbows, flanges).",17239081
202410,502,United States,4010,"Conveyor or transmission belts or belting, of vulcanised rubber.",6442896
202410,502,United States,4011,"New pneumatic tyres, of rubber.",54052226
202410,502,United States,4012,"Retreaded or used pneumatic tyres of rubber; solid or cushion tyres, tyre treads and tyre flaps, of rubber.",2226829
202410,502,United States,4013,"Inner tubes, of rubber.",255973
202410,502,United States,4014,"Hygienic or pharmaceutical articles (including teats), of vulcanised rubber other than hard rubber, with or without fittings of hard rubber.",478843
202410,502,United States,4015,"Articles of apparel and clothing accessories (including gloves, mittens and mitts), for all purposes, of vulcanised rubber other than hard rubber.",2832617
202410,502,United States,4016,Other articles of vulcanised rubber other than hard rubber.,159201031
202410,502,United States,4017,"Hard rubber (for example, ebonite) in all forms, including waste and scrap; articles of hard rubber",1559904
202410,502,United States,4101,"Raw hides and skins of bovine (including buffalo) or equine animals (fresh, or salted, dried, limed, pickled or otherwise preserved, but not tanned, parchmentdressed or further prepared), whether or not dehaired or split.",214383834
202410,502,United States,4102,"Raw skins of sheep or lambs (fresh, or salted, dried, limed, pickled or otherwise preserved, but not tanned, parchment dressed or further prepared), whether or not with wool on or split, other than those excluded by Note 1 (c) to this Chapter.",883677
202410,502,United States,4103,"Other raw hides and skins (fresh, or salted, dried, limed, pickled or otherwise preserved, but not tanned, parchmentdressed or further prepared), whether or not dehaired or split, other thanthose excluded by Note 1 (b) or 1 (c) to this Chapter.",3267172
202410,502,United States,4104,"Tanned or crust hides and skins of bovine (including buffalo) or equine animals, without hair on, whether or not split, but not further prepared.",57988377
202410,502,United States,4106,"Tanned or crust hides and skins of other animals, without wool whether or not split, but not further prepared.",45479
202410,502,United States,4107,"Leather further prepared after tanning or crusting, including parchmentdressed leather, of bovine (including buffalo) or equine animals, without hair on, whether or not split, other than leather of heading 41.14.",3783052
202410,502,United States,4113,"Leather further prepared after tanning or crusting, including parchmentdressed leather, of other animals, without wool or hair on, whether or not split, other than leather of heading 41.14.",362371
202410,502,United States,4201,"Saddlery and harness for any animal, incl. traces, leads, knee pads, muzzles, saddle cloths, saddlebags, dog coats and the like, of any material",24574
202410,502,United States,4202,"Trunks, suitcases, vanitycases, executivecases, briefcases, school satchels, spectacle cases, binocular cases, camera cases, musical instrument cases, gun cases, holsters and similar containers; travellingbags, insulated food or beverages bags, toilet bags, rucksacks, handbags, shoppingbags, wallets, purses, mapcases, cigarettecases, tobaccopouches, tool bags, sports bags, bottlecases, jewellery boxes, powderboxes, cutlery cases and similar containers, of leather or of composition leather, of sheeting of plastics, of textile materials, of vulcanised fibre or of paperboard, or wholly or mainly covered with such materials or with paper.",40409454
202410,502,United States,4203,"Articles of apparel and clothing accessories, of leather or of composition leather.",1560331
202410,502,United States,4205,Other articles of leather or of composition leather,1723652
202410,502,United States,4304,Artificial fur and articles thereof,8393
202410,502,United States,4403,"Wood in the rough, whether or not stripped of bark or sapwood,or roughly squared.",513995190
202410,502,United States,4407,"Wood sawn or chipped lengthwise, sliced or peeled, whether or not planed, sanded or endjointed, of a thickness exceeding 6 mm.",446740939
202410,502,United States,4408,"Sheets for veneering, incl. those obtained by slicing laminated wood, for plywood or for other similar laminated wood and other wood, sawn lengthwise, sliced or peeled, whether or not planed, sanded, spliced or end-jointed, of a thickness of ≤ 6 mm",1092514
202410,502,United States,4410,"Particle board, oriented strand board (OSB) and similar board (for example, waferboard) of wood or other ligneous materials, whether or not agglomerated with resins or other organic binding substances.",1665
202410,502,United States,4411,"Fibreboard of wood or other ligneous materials, whether or not bonded with resins or other organic substances.",1268682
202410,502,United States,4412,"Plywood, veneered panels and similar laminated wood.",13492
202410,502,United States,4414,"Wooden frames for paintings, photographs, mirrors or similar objects.",11128
202410,502,United States,4415,"Packing cases, boxes, crates, drums and similar packings, of wood; cabledrums of wood; pallets, box pallets and other load boards,of wood; pallet collars of wood.",820429
202410,502,United States,4416,"Wood casks, barrels, vats, tubs and other coopers' products and parts thereof, of wood, including stave",5448789
202410,502,United States,4417,"Tools, tool bodies, tool handles, broom or brush bodies and handles, of wood; boot or shoe lasts and trees, of wood",13772
202410,502,United States,4418,"Builders' joinery and carpentry of wood, including cellular wood panels, assembled flooring panels, shingles and shakes.",19049
202410,502,United States,4419,"Tableware and kitchenware, of wood.",18864
202410,502,United States,4420,"Wood marquetry and inlaid wood; caskets and cases for jewellery or cutlery, and similar articles, of wood; statuettes and other ornaments, of wood; wooden articles of furniture (excluding furniture, lighting fixtures and parts thereof)",21576
202410,502,United States,4421,Other articles of wood.,206859
202410,502,United States,4503,Articles of natural cork.,535
202410,502,United States,4504,"Agglomerated cork, with or without a binding substance, and articles of agglomerated cork",17567
202410,502,United States,4601,"Plaits and similar products of plaiting materials, whether or not assembled into strips; plaiting materials, plaits and similar products of plaiting materials, bound together in parallel strands or woven, in sheet form, whether or not being finished articles (for example, mats, matting, screens).",31126
202410,502,United States,4702,"Chemical wood pulp, dissolving grades",130713892
202410,502,United States,4703,"Chemical wood pulp, soda or sulphate, other than dissolving grades.",572466898
202410,502,United States,4705,Wood pulp obtained by a combination of mechanical and chemical pulping processes.,1745849
202410,502,United States,4706,"Pulps of fibres derived from recovered ""waste and scrap"" paper or paperboard or of other fibrous cellulosic material",4022606
202410,502,United States,4801,"Newsprint, in rolls or sheets",3603163
202410,502,United States,4802,"Uncoated paper and paperboard, of a kind used for writing, printing or other graphic purposes, and non perforated punchcards and punch tape paper, in rolls or rectangular (including square) sheets, of any size, other than paper of heading 48.01 or 48.03; handmade paper and paperboard.",5559673
202410,502,United States,4803,"Toilet or facial tissue stock, towel or napkin stock and similar paper of a kind used for household or sanitary purposes, cellulose wadding and webs of cellulose fibres, whether or not creped, crinkled, embossed, perforated, surfacecoloured, surface decorated or printed, in rolls or sheets",2435541
202410,502,United States,4804,"Uncoated kraft paper and paperboard, in rolls or sheets, other than that of heading 48.02 or 48.03.",162832841
202410,502,United States,4805,"Other uncoated paper and paperboard, in rolls or sheets, not further worked or processed than as specified in Note 3 to this Chapter.",28540758
202410,502,United States,4806,"vegetable parchment, greaseproof papers, tracing papers and glassine and other glazed transparent or translucent papers, in rolls or sheets.",2011230
202410,502,United States,4807,"Composite paper and paperboard (made by sticking flat layers of paper or paperboard together with an adhesive), not surface coated or impregnated, whether or not internally reinforced, in rolls or sheets.",773486
202410,502,United States,4808,"Paper and paperboard, corrugated (with or without glued flat surface sheets), creped, crinkled, embossed or perforated, in rolls or sheets, other than paper of the kind described in heading 48.03.",7511876
202410,502,United States,4809,"Carbon paper, selfcopy paper and other copying or transfer papers (including coated or impregnated paper for duplicator stencils or offset plates), whether or not printed, in rolls or sheets.",5655
202410,502,United States,4810,"Paper and paperboard, coated on one or both sides with kaolin (China clay) or other inorganic substances, with or without a binder, and with no other coating, whether or not surface coloured, surfacedecorated or printed, in rolls or rectangular (including square) sheets, of any size.",45757784
202410,502,United States,4811,"Paper, paperboard, cellulose wadding and webs of cellulose fibres,coated,impregnated,covered, surfacecoloured, surface decorated or printed, in rolls or rectangular (including square) sheets, of any size, other than goods of the kind described in heading 48.03, 48.09 or 48.10.",71953985
202410,502,United States,4812,"Filter blocks, slabs and plates, of paper pulp",28109
202410,502,United States,4814,Wallpaper and similar wall coverings; window transparencies of paper.,1896627
202410,502,United States,4816,"Carbon paper, self-copy paper and other copying or transfer papers, in rolls of a width of ≤ 36 cm or in rectangular or square sheets with no side measuring ＞ 36 cm in the unfolded state, or cut into shapes other than rectangles or squares, together with full duplicator stencils and offset plates of paper, whether or not in boxes",631530
202410,502,United States,4817,"Envelopes, letter cards, plain postcards and correspondence cards, of paper or paperboard; boxes, pouches, wallets and writing compendiums, of paper or paperboard, containing an assortment of paper stationery.",4462
202410,502,United States,4818,"Toilet paper and similar paper, cellulose wadding or webs of cellulose fibres, of a kind used for household or sanitary purposes, in rolls of a width ≤ 36 cm, or cut to size or shape; handkerchiefs, cleansing tissues, towels, tablecloths, serviettes, bedsheets and similar household, sanitary or hospital articles, articles of apparel and clothing accessories, of paper pulp, paper, cellulose wadding or webs of cellulose fibres",2899696
202410,502,United States,4819,"Cartons, boxes, cases, bags and other packing containers, of paper, paperboard, cellulose wadding or webs of cellulose fibres, n.e.s.; box files, letter trays, and similar articles, of paperboard of a kind used in offices, shops or the like",3009601
202410,502,United States,4820,"Registers, account books, note books, order books, receipt books, letter pads, memorandum pads,diaries and similar articles, exercise books, blottingpads, binders (looseleaf or other), folders, file covers, manifold business forms, interleaved carbon sets and other articles of stationery, of paper or paperboard; albums for samples or for collections and book covers, of paper or paperboard.",808170
202410,502,United States,4821,"paper or paperboard labels of all kinds, whether or not printed.",8413515
202410,502,United States,4822,"Bobbins, spools, cops and similar supports of paper pulp, paper or paperboard (whether or not perforated or hardened).",70420
202410,502,United States,4823,"Other paper, paperboard, cellulose wadding and webs of cellulose fibres, cut to size or shape; other articles of paper pulp, paper,paperboard, cellulose wadding or webs of cellulose fibres.",6256194
202410,502,United States,4901,"Printed books, brochures, leaflets and similar printed matter, whether or not in single sheets.",19277242
202410,502,United States,4902,"Newspapers, journals and periodicals, whether or not illustrated or containing advertising material.",15142293
202410,502,United States,4903,"Children's picture, drawing or colouring books.",71695
202410,502,United States,4904,"Music, printed or in manuscript, whether or not bound or illustrated",150982
202410,502,United States,4905,"Maps and hydrographic or similar charts of all kinds, including atlases, wall maps, topographical plans and globes, printed.",32333
202410,502,United States,4906,"Plans and drawings for architectural, engineering, industrial, commercial, topographical or similar purposes, being originals drawn by hand; handwritten texts; photographic reproductions on sensitised paper and carbon copies of the foregoing",1444
202410,502,United States,4907,"Unused postage, revenue or similar stamps of current or new issue in the country in which they have, or will have, a recognised face value; stamp-impressed paper; banknotes; cheque forms; stock, share or bond certificates and similar documents of title",147021421
202410,502,United States,4908,Transfers (decalcomanias),6183620
202410,502,United States,4909,"Printed or illustrated postcards; printed cards bearing personal greetings, messages or announcements, whether or not illustrated, with or without envelopes or trimmings.",98748
202410,502,United States,4910,"Calendars of any kind, printed, including calendar blocks.",28620
202410,502,United States,4911,"Other printed matter, including printed pictures and photographs.",93130540
202410,502,United States,5006,"Silk yarn and yarn spun from silk waste, put up for retail sale;silkworm gut.",12591
202410,502,United States,5007,Woven fabrics of silk or of silk waste.,124041
202410,502,United States,5101,"Wool, not carded or combed.",6878345
202410,502,United States,5107,"Yarn of combed wool, not put up for retail sale.",5730
202410,502,United States,5109,"Yarn of wool or of fine animal hair, put up for retail sale.",21764
202410,502,United States,5111,Woven fabrics of carded wool or of carded fine animal hair.,8210
202410,502,United States,5112,Woven fabrics of combed wool or of combed fine animal hair.,761414
202410,502,United States,5201,"Cotton, not carded or combed.",190630147
202410,502,United States,5204,"Cotton sewing thread, whether or not put up for retail sale.",2962
202410,502,United States,5205,"Cotton yarn (other than sewing thread), containing 85% or more by weight of cotton, not put up for retail sale.",5132
202410,502,United States,5208,"Woven fabrics of cotton, containing 85% or more by weight of cotton, weighing not more than 200 g/m2",43602
202410,502,United States,5209,"Woven fabrics of cotton, containing 85% or more by weight of cotton, weighing more than 200 g/m2",60095
202410,502,United States,5211,"Woven fabrics of cotton, containing less than 85% by weight of cotton, mixed mainly or solely with manmade fibres, weighing more than 200 g/m2.",315363
202410,502,United States,5309,Woven fabrics of flax.,335509
202410,502,United States,5401,"Sewing thread of manmade filaments, whether or not put up for retail sale.",593184
202410,502,United States,5402,"Synthetic filament yarn (other than sewing thread), not put up for retail sale, including synthetic monofilament of less than 67 decitex.",26383398
202410,502,United States,5403,"Artificial filament yarn (other than sewing thread), not put up for retail sale, including artificial monofilament of less than 67 decitex.",41799762
202410,502,United States,5404,"Synthetic monofilament of 67 decitex or more and of which no crosssectional dimension exceeds 1 mm; strip and the like (for example, artificial straw) of synthetic textile materials of an apparent width not exceeding 5 mm.",14921591
202410,502,United States,5407,"Woven fabrics of synthetic filament yarn, including woven fabrics obtained from materials of heading 54.04.",4961257
202410,502,United States,5408,"Woven fabrics of artificial filament yarn, including woven fabrics obtained from materials of heading 54.05.",30258
202410,502,United States,5502,Artificial filament tow.,3139362
202410,502,United States,5503,"Synthetic staple fibres, not carded, combed or otherwise processed for spinning.",20292663
202410,502,United States,5504,"Artificial staple fibres, not carded, combed or otherwise processed for spinning.",4670244
202410,502,United States,5506,"Synthetic staple fibres, carded, combed or otherwise processed for spinning.",22907
202410,502,United States,5508,"Sewing thread of manmade staple fibres, whether or not put up for retail sale.",17473
202410,502,United States,5509,"Yarn (other than sewing thread) of synthetic staple fibres, not put up for retail sale.",664573
202410,502,United States,5512,"Woven fabrics of synthetic staple fibres, containing 85% or more by weight of synthetic staple fibres.",23045278
202410,502,United States,5513,"Woven fabrics of synthetic staple fibres, containing less than 85% by weight of such fibres, mixed mainly or solely with cotton, of a weight not exceeding 170 g/m2.",52746
202410,502,United States,5514,"Woven fabrics of synthetic staple fibres, containing less than 85% by weight of such fibres, mixed mainly or solely with cotton, of a weight exceeding 170g/m2.",244205
202410,502,United States,5515,Other woven fabrics of synthetic staple fibres.,718711
202410,502,United States,5516,Woven fabrics of artificial staple fibres.,710333
202410,502,United States,5601,"Wadding of textile materials and articles thereof; textile fibres, not exceeding 5 mm in length (flock),textile dust and mill neps.",3922596
202410,502,United States,5602,"Felt, whether or not impregnated, coated, covered or laminated.",477146
202410,502,United States,5603,"Nonwovens, whether or not impregnated, coated, covered or laminated.",64153628
202410,502,United States,5604,"Textile-covered rubber thread and cord; textile yarn, strip and the like of heading 5404 and 5405, impregnated, coated, covered or sheathed with rubber or plastics",3957675
202410,502,United States,5606,"Gimped yarn, gimped strip and the like of heading 5404 or 5405; chenille yarn, incl. flock chenille yarn, and loop wale-yarn",58
202410,502,United States,5607,"Twine, cordage, ropes and cables, whether or not plaited or braided and whether or not impregnated, coated, covered or sheathed with rubber or plastics",6206953
202410,502,United States,5608,"Knotted netting of twine, cordage or rope; made up fishing nets and other made up nets, of textile materials.",85485
202410,502,United States,5609,"Articles of yarn, strip or the like of heading 54.04 or 54.05, twine, cordage, rope or cables, not elsewhere specified or included.",832417
202410,502,United States,5701,"Carpets and other textile floor coverings, knotted, whether or not made up.",3544
202410,502,United States,5702,"Carpets and other textile floor coverings, woven, not tufted or flocked, whether or not made up, incl. Kelem, Schumacks, Karamanie and similar hand-woven rugs",866122
202410,502,United States,5703,"Carpets and other textile floor coverings, tufted, whether or not made up.",1812563
202410,502,United States,5704,"Carpets and other floor coverings, of felt, not tufted or flocked, whether or not made up",12703
202410,502,United States,5705,"Other carpets and other textile floor coverings, whether or not made up.",746621
202410,502,United States,5801,"Woven pile fabrics and chenille fabrics (excluding terry towelling and similar woven terry fabrics, tufted textile fabrics and narrow woven fabrics of heading 5806)",1537192
202410,502,United States,5802,"Terry towelling and similar woven terry fabrics, tufted textile fabrics (excluding narrow woven fabrics of heading 5806, carpets and other floor coverings)",537
202410,502,United States,5804,"Tulles and other net fabrics, not including woven, knitted or crocheted fabrics; lace in the piece, in strips or in motifs, other than fabrics of headings 60.02 to 60.06.",102427
