Date of data,Trading partner code,Trading partner,Commodity code,Commodity,Renminbi Yuan
202410,502,United States,7308,"Structures (excluding prefabricated buildings of heading 94.06) and parts of structures (for example, bridges and bridgesections, lockgates, towers, lattice masts, roofs, roofing frameworks, doors and windows and their frames and thresholds for doors, shutters, balustrades, pillars and columns), of iron or steel; plates, rods, angles, shapes, sections, tubes and the like, prepared for use in structures, of iron or steel.",1359330
202410,502,United States,7309,"eservoirs, tanks, vats and similar containers for any material (other than compressed or liquefied gas), of iron or steel, of a capacity exceeding 300 l, whether or not lined or heatinsulated, but not fitted with mechanical or thermal equipment.",1155267
202410,502,United States,7310,"anks, casks, drums, cans, boxes and similar containers, for any material (other than compressed or liquefied gas), of iron or steel, of a capacity not exceeding 300 l, whether or not lined or heatinsulated, but not fitted with mechanical or thermal equipment.",8458890
202410,502,United States,7311,"Containers for compressed or liquefied gas, of iron or steel.",6225350
202410,502,United States,7312,"Stranded wire, ropes, cables, plaited bands, slings and the like, of iron or steel, not electrically insulated.",15075249
202410,502,United States,7314,"Cloth (including endless bands), grill, netting and fencing, of iron or steel wire; expanded metal of iron or steel.",1558576
202410,502,United States,7315,"Chain and parts thereof, of iron or steel.",5356445
202410,502,United States,7317,"Nails, tacks, drawing pins, corrugated nails, staples (other than those of heading 83.05) and similar articles, of iron or steel, whether or not with heads of other material, but excluding such articles with heads of copper.",931221
202410,502,United States,7318,"Screws, bolts, nuts, coach screws, screw hooks, rivets, cotters, cotterpins, washers (including spring washers) and similar articles, of iron or steel.",195607866
202410,502,United States,7319,"Sewing needles, knitting needles, bodkins, crochet hooks, embroidery stilettos and similar articles, for use in the hand, of iron or steel; safety pins and other pins of iron or steel, not elsewhere specified or included.",1111447
202410,502,United States,7320,"Springs and leaves for springs, of iron or steel.",31033977
202410,502,United States,7321,"Stoves, ranges, grates, cookers (including those with subsidiary boilers for central heating), barbecues, braziers, gasrings, plate warmers and similar nonelectric domestic appliances, and parts thereof, of iron or steel.",1161261
202410,502,United States,7322,"Radiators for central heating, not electrically heated, and parts thereof, of iron or steel; air heaters and hot air distributors (including distributors which can also distribute fresh or conditioned air), not electrically heated, incorporating a motordriven fan or blower, and parts thereof, of iron or steel.",335269
202410,502,United States,7323,"Table, kitchen or other household articles and parts thereof, of iron or steel; iron or steel wool; pot scourers and scouring or polishing pads, gloves and the like, of iron or steel.",1124734
202410,502,United States,7324,"Sanitary ware and parts thereof, of iron or steel.",7611117
202410,502,United States,7325,Other cast articles of iron or steel.,1843888
202410,502,United States,7326,Other articles of iron or steel.,205730538
202410,502,United States,7402,Unrefined copper; copper anodes for electrolytic refining.,20826
202410,502,United States,7403,"Refined copper and copper alloys, unwrought.",19016361
202410,502,United States,7404,Copper waste and scrap.,2073485772
202410,502,United States,7405,Master alloys of copper.,52497
202410,502,United States,7406,Copper powders and flakes.,7591816
202410,502,United States,7407,"Copper bars, rods and profiles.",3494305
202410,502,United States,7408,Copper wire.,6359325
202410,502,United States,7409,"Copper plates, sheets and strip, of a thickness exceeding 0.15mm.",11237557
202410,502,United States,7410,"Copper foil (whether or not printed or backed with paper, paperboard, plastics or similar backing materials) of a thickness (excluding any backing) not exceeding 0.15 mm.",41516028
202410,502,United States,7411,Copper tubes and pipes.,2090477
202410,502,United States,7412,"Copper tube or pipe fittings (for example, couplings, elbows, sleeves).",5292595
202410,502,United States,7413,"Stranded wire, cables, plaited bands and the like, of copper, not electrically insulated.",842452
202410,502,United States,7415,"Nails, tacks, drawing pins, staples (other than those of heading 83.05) and similar articles, of copper or of iron or steel with heads of copper; screws, bolts, nuts, screw hooks, rivets, cotters, cotterpins, washers (including spring washers) and similar articles, of copper.",5007131
202410,502,United States,7418,"Table, kitchen or other household articles and parts thereof, of copper; pot scourers and scouring or polishing pads, gloves and the like, of copper; sanitary ware and parts thereof, of copper.",93024
202410,502,United States,7419,Other articles of copper.,12398371
202410,502,United States,7502,nwrought nickel.,3156980
202410,502,United States,7504,Nickel powders and flakes.,7607959
202410,502,United States,7505,"Nickel bars, rods, profiles and wire.",125275791
202410,502,United States,7506,"Nickel plates, sheets, strip and foil.",59866675
202410,502,United States,7507,"Nickel tubes, pipes and tube or pipe fittings (for example, couplings, elbows, sleeves).",42333803
202410,502,United States,7508,Other articles of nickel.,75491526
202410,502,United States,7601,Unwrought aluminium.,3594682
202410,502,United States,7602,Aluminium waste and scrap.,178835379
202410,502,United States,7603,Aluminium powders and flakes.,2765308
202410,502,United States,7604,"Aluminium bars, rods and profiles.",20750312
202410,502,United States,7605,Aluminium wire.,3269091
202410,502,United States,7606,"Aluminium plates, sheets and strip, of a thickness exceeding 0.2 mm.",38046688
202410,502,United States,7607,"Aluminium foil (whether or not printed or backed with paper, paperboard, plastics or similar backing materials) of a thickness (excluding any backing) not exceeding 0.2 mm.",6065037
202410,502,United States,7608,Aluminium tubes and pipes.,556795
202410,502,United States,7609,"Aluminium tube or pipe fittings (for example, couplings, elbows, sleeves).",9235425
202410,502,United States,7610,"Aluminium structures (excluding prefabricated buildings of heading 94.06) and parts of structures (for example, bridges and bridgesections, towers, lattice masts, roofs, roofing frameworks, doors and windows and their frames and thresholds for doors, balustrades, pillars and columns); aluminium plates, rods, profiles, tubes and the like, prepared for use in structures.",4003754
202410,502,United States,7612,"Aluminium casks, drums, cans, boxes and similar containers (including rigid or collapsible tubular containers), for any material (other than compressed or liquefied gas), of a capacity not exceeding 300 l, whether or not lined or heatinsulated, but not fitted with mechanical or thermal equipment.",1847805
202410,502,United States,7613,Aluminium containers for compressed or liquefied gas.,3387286
202410,502,United States,7614,"Stranded wire, cables, plaited bands and the like, of aluminium, not electrically insulated.",10759479
202410,502,United States,7615,"Table, kitchen or other household articles and parts thereof, of aluminium; pot scourers and scouring or polishing pads, gloves and the like, of aluminium; sanitary ware and parts thereof, of aluminium.",289607
202410,502,United States,7616,Other articles of aluminium.,78903149
202410,502,United States,7804,"Lead plates, sheets, strip and foil; lead powders and flakes.",800195
202410,502,United States,7806,Other articles of lead.,666399
202410,502,United States,7901,Unwrought zinc.,2255317
202410,502,United States,7903,"zinc dust, powders and flakes.",545158
202410,502,United States,7904,"Zinc bars, rods, profiles and wire.",2427
202410,502,United States,7905,"Zinc plates, sheets, strip and foil.",6473
202410,502,United States,7907,Other articles of zinc.,766572
202410,502,United States,8001,Unwrought tin.,33447
202410,502,United States,8003,"Tin bars, rods, profiles and wire.",319547
202410,502,United States,8007,Other articles of tin.,736792
202410,502,United States,8101,"Wungsten (wolfram) and articles thereof, including waste and scrap.",3909541
202410,502,United States,8102,"Molybdenum and articles thereof, including waste and scrap.",469990
202410,502,United States,8103,"Tantalum and articles thereof, including waste and scrap.",30918078
202410,502,United States,8104,"Magnesium and articles thereof, including waste and scrap.",103539
202410,502,United States,8105,"Cobalt mattes and other intermediate products of cobalt metallurgy; cobalt and articles thereof, including waste and scrap.",14278759
202410,502,United States,8106,"Bismuth and articles thereof, including waste and scrap.",3666
202410,502,United States,8108,"Titanium and articles thereof, including waste and scrap.",145657032
202410,502,United States,8109,"Zirconium and articles thereof, including waste and scrap.",1334173
202410,502,United States,8110,"Antimony and articles thereof, including waste and scrap.",2285
202410,502,United States,8111,"Manganese and articles thereof, including waste and scrap",3317898
202410,502,United States,8112,"Beryllium, chromium, hafnium, rhenium, thallium, cadmium, germanium, vanadium, gallium, indium, niobium and their products, including waste and scrap:",4162447
202410,502,United States,8113,"Cermets and articles thereof, including waste and scrap.",5099678
202410,502,United States,8201,"Hand tools, the following : spades, shovels, mattocks, picks, hoes, forks and rakes; axes, bill hooks and similar hewing tools; secateurs and pruners of any kind; scythes, sickles, hay knives, hedge shears, timber wedges and other tools of a kind used in agriculture, horticulture or forestry.",38979
202410,502,United States,8202,"Hand saws; blades for saws of all kinds (including slitting, slotting or toothless saw blades).",9882388
202410,502,United States,8203,"Files, rasps, pliers (including cutting pliers), pincers, tweezers, metal cutting shears, pipecutters, bolt croppers, perforating punches and similar hand tools.",1520730
202410,502,United States,8204,"Hand-operated spanners and wrenches (including torque meter wrenches but not including tap wrenches); interchangeable spanner sockets, with or without handles.",3386032
202410,502,United States,8205,"Hand tools (including glaziers' diamonds), not elsewhere specified or included; blow lamps; vices, clamps and the like, other than accessories for and parts of, machinetools or waterjet cutting machines; anvils; portable forges; hand or pedaloperated grinding wheels with frameworks.",8017045
202410,502,United States,8206,"Tools of two or more of the headings 82.02 to 82.05, put up in sets for retail sale.",871332
202410,502,United States,8207,"Interchangeable tools for hand tools, whether or not poweroperated, or for machinetools (for example, for pressing, stamping, punching, tapping, threading, drilling, boring, broaching, milling, turning or screw driving), including dies for drawing or extruding metal, and rock drilling or earth boring tools.",32612007
202410,502,United States,8208,"Knives and cutting blades, for machines or for mechanical appliances.",24435962
202410,502,United States,8209,"Plates, sticks, tips and the like for tools, unmounted, of cermets.",24007139
202410,502,United States,8210,"Hand-operated mechanical appliances, weighing 10 kg or less, used in the preparation, conditioning or serving of food or drink.",336269
202410,502,United States,8211,"Knives with cutting blades, serrated or not (including pruning knives), other than knives of heading 82.08, and blades therefor.",948552
202410,502,United States,8212,Razors and razor blades (including razor blade blanks in strips).,10844365
202410,502,United States,8213,"Scissors, tailors' shears and similar shears, and blades therefor.",11705
202410,502,United States,8214,"Other articles of cutlery (for example, hair clippers, butchers' or kitchen cleavers, choppers and mincing knives, paper knives); manicure or pedicure sets and instruments (including nail files).",49419
202410,502,United States,8215,"Spoons, forks, ladles, skimmers, cakeservers, fishknives, butterknives, sugar tongs and similar kitchen or tableware.",17209
202410,502,United States,8301,"Padlocks and locks (key, combination or electrically operated), of base metal; clasps and frames with clasps, incorporating locks, of base metal; keys for any of the foregoing articles, of base metal",12176628
202410,502,United States,8302,"Base metal mountings, fittings and similar articles suitable for furniture, doors, staircases, windows, blinds, coachwork, saddlery, trunks, chests, caskets or the like; base metal hatracks, hatpegs, brackets and similar fixtures; castors with mountings of base metal; automatic door closers of base metal",25655064
202410,502,United States,8306,"Bells, gongs and the like, nonelectric, of base metal; statuettes and other ornaments, of base metal; photograph, picture or similar frames, of base metal; mirrors of base metal",785906
202410,502,United States,8307,"Flexible tubing of base metal, with or without fittings",11249152
202410,502,United States,8308,"Clasps, frames with clasps, buckles, buckleclasps, hooks, eyes, eyelets and the like, of base metal, of a kind used for clothing or clothing accessories, footwear, jewellery, wristwatches, books, awnings, leather goods, travel goods or saddlery or for other made up articles; tubular or bifurcated rivets, of base metal; beads and spangles, of base metal",5977487
202410,502,United States,8309,"Stoppers, caps and lids (including crown corks, screw caps and pouring stoppers), capsules for bottles, threaded bungs, bung covers, seals and other packing accessories, of base metal",5698723
202410,502,United States,8310,"Signplates, nameplates, addressplates and similar plates, numbers, letters and other symbols, of base metal, excluding those of heading 9405",2940608
202410,502,United States,8311,"Wire, rods, tubes, plates, electrodes and similar products, of base metal or of metal carbides, coated or cored with flux material, of a kind used for soldering, brazing, welding or deposition of metal or of metal carbides; wire and rods, of agglomerated base metal powder, used for metal spraying",9034021
202410,502,United States,8401,"Nuclear reactors; fuel elements (cartridges), nonirradiated, for nuclear reactors; machinery and apparatus for isotopicseparation.",41831405
202410,502,United States,8402,Steam or other vapour generating boilers (other than central heating hot water boilers capable also of producing low pressure steam); superheated water boilers.,5840749
202410,502,United States,8403,Central heating boilers other than those of heading 8402.,826126
202410,502,United States,8404,"Auxiliary plant for use with boilers of heading 84.02 or 84.03 (for example, economisers, superheaters, soot removers, gas recoverers); condensers for steam or other vapour power units.",639956
202410,502,United States,8405,"Producer gas or water gas generators, with or without their purifiers; acetylene gas generators and similar water process gas generators, with or without their purifiers.",723823
202410,502,United States,8406,Steam turbines and other vapour turbines.,157117
202410,502,United States,8407,Sparkignition reciprocating or rotary internal combustion piston engines.,50977057
202410,502,United States,8408,Compressionignition internal combustion piston engines (diesel or semidiesel engines).,159421172
202410,502,United States,8409,Parts suitable for use solely or principally with the engines of heading 84.07 or 84.08.,109378230
202410,502,United States,8410,"Hydraulic turbines, water wheels, and regulators therefor.",14328
202410,502,United States,8411,"Turbojets, turbopropellers and other gas turbines.",3441350100
202410,502,United States,8412,Other engines and motors.,142764784
202410,502,United States,8413,"Pumps for liquids, whether or not fitted with a measuring device; liquid elevators.",296795903
202410,502,United States,8414,"Air or vacuum pumps, air or other gas compressors and fans; ventilating or recycling hoods incorporating a fan, whether or not fitted with filters, gas-tight biological safety cabinets, whether or not fitted with filters.",221203765
202410,502,United States,8415,"Air conditioning machines, comprising a motordriven fan and elements for changing the temperature and humidity, including those machines in which the humidity cannot be separately regulated.",27313362
202410,502,United States,8416,"Furnace burners for liquid fuel, for pulverised solid fuel or for gas; mechanical stokers, including their mechanical grates,mechanical ash dischargers and similar appliances.",3957442
202410,502,United States,8417,"Industrial or laboratory furnaces and ovens, including incinerators, nonelectric.",1014231
202410,502,United States,8418,"Refrigerators, freezers and other refrigerating or freezing equipment, electric or other; heat pumps other than air conditioning machines of heading 84.15.",37250932
202410,502,United States,8419,"Machinery, plant or laboratory equipment, whether or not electrically heated (excluding furnaces, ovens and other equipment of heading 85.14), for the treatment of materials by a process involving a change of temperature such as heating, cooking, roasting, distilling, rectifying, sterilising, pasteurising, other than machinery or plant of a kind used for domestic purposes; instantaneous or storage water heaters, nonelectric.",121443092
202410,502,United States,8420,"Calendering or other rolling machines, other than for metals or glass, and cylinders therefor.",5043317
202410,502,United States,8421,"Centrifuges, including centrifugal dryers; filtering or purifying machinery and apparatus, for liquids or gases.",558563091
202410,502,United States,8422,"Dish washing machines; machinery for cleaning or drying bottles or other containers; machinery for filling, closing, sealing or labelling bottles, cans, boxes, bags or other containers; machinery for capsuling bottles, jars, tubes and similar containers; other packing or wrapping machinery (including heatshrink wrapping machinery); machinery for aerating beverages.",7405790
202410,502,United States,8423,"Weighing machinery (excluding balances of a sensitivity of 5 cg or better), including weight operated counting or checking machines; weighing machine weights of all kinds.",2425004
202410,502,United States,8424,"Mechanical appliances (whether or not handoperated) for projecting, dispersing or spraying liquids or powders; fire extinguishers, whether or not charged; spray guns and similar appliances; steam or sand blasting machines and similar jet projecting machines.",104364923
202410,502,United States,8425,Pulley tackle and hoists other than skip hoists; winches and capstans; jacks.,9417161
202410,502,United States,8427,Forklift trucks; other works trucks fitted with lifting or handling equipment.,12981808
202410,502,United States,8428,"Other lifting, handling, loading or unloading machinery (for example, lifts, escalators, conveyors, teleferics).",23906403
202410,502,United States,8429,"Self-propelled bulldozers, angledozers, graders, levellers, machines and road rollers.",37434871
202410,502,United States,8430,"Other moving, grading, levelling, scraping, excavating, tamping, compacting, extracting or boring machinery, for earth, minerals or ores; piledrivers and pileextractors; snowploughs and snowblowers.",289678
202410,502,United States,8431,Parts suitable for use solely or principally with the machinery of headings 84.25 to 84.30.,51562627
202410,502,United States,8432,"Agricultural, horticultural or forestry machinery for soil preparation or cultivation; lawn or sportsground rollers.",9506248
202410,502,United States,8433,"Harvesting or threshing machinery, including straw or fodder balers; grass or hay mowers; machines for cleaning, sorting or grading eggs, fruit or other agricultural produce, other than machinery of heading 84.37.",39655965
202410,502,United States,8434,Milking machines and dairy machinery.,1181166
202410,502,United States,8435,"Presses, crushers and similar machinery used in the manufacture of wine, cider, fruit juices or similar beverages.",2845552
202410,502,United States,8436,"Other agricultural, horticultural, forestry, poultrykeeping or beekeeping machinery, including germination plant fitted with mechanical or thermal equipment; poultry incubators and brooders.",3772421
202410,502,United States,8437,"Machines for cleaning, sorting or grading seed, grain or dried leguminous vegetables; machinery used in the milling industry or for the working of cereals or dried leguminous vegetables, other than farmtype machinery.",1072958
202410,502,United States,8438,"Machinery, not specified or included elsewhere in this Chapter, for the industrial preparation or manufacture of food or drink, other than machinery for the extraction or preparation of animal or fixed vegetable fats or microbial fats or oils.",8772078
202410,502,United States,8439,Machinery for making pulp of fibrous cellulosic material or for making or finishing paper or paperboard.,5640388
202410,502,United States,8441,"Other machinery for making up paper pulp, paper or paperboard, including cutting machines of all kinds.",7331515
202410,502,United States,8442,"Machinery, apparatus and equipment (other than the machines of headings 84.56 to 84.65) for preparing or making plates, cylinders or other printing components; plates, cylinders and other printing components; plates, cylinders and lithographic stones, prepared for printing purposes (for example, planed, grained or polished).",131444
202410,502,United States,8443,"Printing machinery used for printing by means of plates, cylinders and other printing components of heading 84.42; other printers, copying machines and facsimile machines,whether or not combined; parts and accessories thereof.",71250566
202410,502,United States,8448,"Auxiliary machinery for use with machines of heading 84.44, 84.45, 84.46 or 84.47 (for example, dobbies, Jacquards, automatic stop motions, shuttle changing mechanisms); parts and accessories suitable for use solely or principally with the machines of this heading or of heading 84.44, 84.45, 84.46 or 84.47 (for example, spindles and spindle flyers, card clothing, combs, extruding nipples, shuttles, healds and healdframes, hosiery needles).",2503433
202410,502,United States,8449,"Machinery for the manufacture or finishing of felt or 84.49 nonwovens in the piece or in shapes, including machinery for making felt hats; blocks for making hats.",99001
202410,502,United States,8450,"Household or laundrytype washing machines, including machines which both wash and dry.",431220
202410,502,United States,8451,"Machinery (other than machines of heading 84.50) for washing, cleaning, wringing, drying, ironing, pressing (including fusing presses), bleaching, dyeing, dressing, finishing, coating or impregnating textile yarns, fabrics or made up textile articles and machines for applying the paste to the base fabric or other support used in the manufacture of floor coverings such as linoleum; machines for reeling, unreeling, folding, cutting or pinking textile fabrics.",1713222
202410,502,United States,8452,"Sewing machines, other than booksewing machines of heading 84.40; furniture, bases and covers specially designed for sewing machines; sewing machine needles.",20145
202410,502,United States,8453,"Machinery for preparing, tanning or working hides, skins or leather or for making or repairing footwear or other articles of hides, skins or leather, other than sewing machines.",47614
202410,502,United States,8454,"Converters, ladles, ingot moulds and casting machines, of a kind used in metallurgy or in metal foundries.",11118314
202410,502,United States,8455,Metalrolling mills and rolls therefor.,31032699
202410,502,United States,8456,"Machine tools for working any material by removal of material, by laser or other light or photon beam, ultrasonic, electrodischarge, electrochemical, electron beam, ionicbeam or plasma arc processes; waterjet cutting machines.",13811115
202410,502,United States,8457,"Machining centres, unit construction machines (single station) and multistation transfer machines, for working metal.",6994498
202410,502,United States,8460,"Machinetools for deburring, sharpening, grinding, honing, lapping, polishing or otherwise finishing metal or cermets by means of grinding stones, abrasives or polishing products, other heading 84.61.",1299706
202410,502,United States,8461,"Machinetools for planing, shaping, slotting, broaching, gear cutting, gear grinding or gear finishing, sawing, cuttingoff and other machinetools working by removing metal or cermets, not elsewhere specified or included.",1234351
202410,502,United States,8462,"Machine-tools (including presses) for working metal by forging, hammering or die forging (excluding rolling mills); machine-tools (including presses, slitting lines and cut-to-length lines) for working metal by bending, folding, straightening, flattening, shearing, punching, notching or nibbling (excluding draw-benches); presses for working metal or metal carbides, not specified above.",1470535
202410,502,United States,8463,"Other machinetools for working metal or cermets, without removing material.",326924
202410,502,United States,8464,"Machinetools for working stone, ceramics, concrete, asbestoscement or like mineral materials or for cold working glass.",1372882
