Date of data,Trading partner code,Trading partner,Commodity code,Commodity,Renminbi Yuan
202410,502,United States,0105,"Live poultry, that is to say, fowls of the species Gallus domesticus, ducks, geese, turkeys and guinea fowls",41126334
202410,502,United States,0106,Other live animals,2690078
202410,502,United States,0201,"Meat of bovine animals, fresh or chilled",166528283
202410,502,United States,0202,"Meat of bovine animals, frozen",638877051
202410,502,United States,0203,"Meat of swine, fresh, chilled or frozen",64342758
202410,502,United States,0206,"Edible offal of bovine animals, swine, sheep, goats, horses, asses, mules or hinnies, fresh, chilled or frozen",417226977
202410,502,United States,0207,"Meat and edible offal, of the poultry of heading 0105, fresh, chilled or frozen",99938685
202410,502,United States,0302,"Fish, fresh or chilled, excluding fish fillets and other fish meat of heading 0304",303
202410,502,United States,0303,"Fish, frozen, excluding fish fillets and other fish meat of heading 0304",411943546
202410,502,United States,0304,"Fish fillets and other fish meat (whether or not minced), fresh, chilled or frozen",27804721
202410,502,United States,0306,"Crustaceans, whether in shell or not, live, fresh, chilled, frozen, dried, salted or in brine; smoked crustaceans, whether in shell or not, whether or not cooked before or during the smoking process; crustaceans, in shell, cooked by steaming or by boiling in water, whether or not chilled, frozen, dried, salted or in brine",230805428
202410,502,United States,0307,"Molluscs, whether in shell or not, live, fresh, chilled, frozen, dried, salted or in brine; smoked molluscs, whether in shell or not, whether or not cooked before or during the smoking process",115613591
202410,502,United States,0308,"Aquatic invertebrates other than crustaceans and molluscs, live, fresh, chilled, frozen, dried, salted or in brine; smoked aquatic invertebrates other than crustaceans and molluscs, whether or not cooked before or during the smoking process",681054
202410,502,United States,0401,"Milk and cream, not concentrated nor containing added sugar or other sweetening matter.",143839
202410,502,United States,0402,"Milk and cream, concentrated or containing added sugar or other sweetening matter",15824634
202410,502,United States,0403,"Yogurt; buttermilk, curdled milk and cream, kephir and other fermented or acidified milk and cream, whether or not concentrated or containing added sugar or other sweetening matter or flavoured or containing added fruit, nuts or cocoa",71
202410,502,United States,0404,"Whey, whether or not concentrated or containing added sugar or other sweetening matter; products consisting of natural milk constituents, whether or not containing added sugar or other sweetening matter, not elsewhere specified or included",118953194
202410,502,United States,0405,Butter and other fats and oils derived from milk; dairy spreads,3260671
202410,502,United States,0406,Cheese and curd,17797550
202410,502,United States,0504,"Guts, bladders and stomachs of animals (other than fish), whole and pieces thereof, fresh, chilled, frozen, salted, in brine, dried or smoked",158865135
202410,502,United States,0505,"Skins and other parts of birds, with their feathers or down, feathers and parts of feathers (whether or not with trimmed edges) and down, not further worked than cleaned, disinfected or treated for preservation;powder and waste of feathers or parts of feathers",8541186
202410,502,United States,0507,"Ivory, tortoiseshell, whalebone and whalebone hair, horns, antlers, hooves, nails, claws and beaks, unworked or simply prepared but not cut to shape; powder and waste of these products",831798
202410,502,United States,0511,"Animal products not elsewhere specified or included; dead animals of Chapter 1 or 3, unfit for human consumption",29663270
202410,502,United States,0601,"Bulbs, tubers, tuberous roots, corms, crowns and rhizomes, dormant, in growth or in flower; chicory plants and roots other than roots of heading 12.12.",1668190
202410,502,United States,0602,"Other live plants (including their roots), cuttings and slips; mushroom spawn.",564480
202410,502,United States,0604,"Foliage, branches and other parts of plants, without flowers or flower buds, and grasses, mosses and lichens, being goods of a kind suitable for bouquets or for ornamental purposes, fresh,dried, dyed, bleached, impregnated or otherwise prepared",10592
202410,502,United States,0710,"Vegetables (uncooked or cooked by steaming or boiling in water),frozen.",660373
202410,502,United States,0713,"Dried leguminous vegetables, shelled, whether or not skinned or split.",29635228
202410,502,United States,0801,"Coconuts, Brazil nuts and cashew nuts, fresh or dried, whether or not shelled or peeled.",8195
202410,502,United States,0802,"Other nuts, fresh or dried, whether or not shelled or peeled.",154338672
202410,502,United States,0806,"Grapes, fresh or dried.",2181853
202410,502,United States,0808,"Apples, pears and quinces, fresh.",2366772
202410,502,United States,0809,"Apricots, cherries, peaches (including nectarines), plums and sloes, fresh.",8508763
202410,502,United States,0813,"Fruit, dried, other than that of headings 08.01 to 08.06; mixtures of nuts or dried fruits of this Chapter.",2710203
202410,502,United States,0901,"Coffee, whether or not roasted or decaffeinated; coffee husks and skins; coffee substitutes containing coffee in any proportion.",13057113
202410,502,United States,0902,"Tea, whether or not flavoured.",57242
202410,502,United States,0904,Pepper of the genus Piper; dried or crushed or ground fruits of the genus Capsicum or of the genus Pimenta.,31535
202410,502,United States,1001,Wheat and meslin.,15970088
202410,502,United States,1005,Maize (corn).,5332293
202410,502,United States,1007,Grain sorghum.,828520759
202410,502,United States,1101,Wheat or meslin flour.,103822
202410,502,United States,1102,Cereal flours other than of wheat or meslin.,22920
202410,502,United States,1104,"Cereal grains otherwise worked (for example, hulled, rolled, flaked, pearled, sliced or kibbled), except rice of heading 10.06; germ of cereals, whole, rolled, flaked or ground.",133831
202410,502,United States,1105,"Flour, meal, powder, flakes, granules and pellets of potatoes.",3041572
202410,502,United States,1106,"Flour, meal and powder of the dried leguminous vegetables of heading 07.13, of sago or of roots or tubers of heading 07.14 or of the products of Chapter 8.",1211738
202410,502,United States,1108,tarches; inulin.,538238
202410,502,United States,1201,"Soya beans, whether or not broken.",1950306046
202410,502,United States,1202,"Groundnuts, not roasted or otherwise cooked, whether or not shelled or broken.",13520333
202410,502,United States,1204,"Linseed, whether or not broken.",20233
202410,502,United States,1209,"Seeds, fruit and spores, of a kind used for sowing.",43014044
202410,502,United States,1210,"Hop cones, fresh or dried, whether or not ground, powdered or in the form of pellets; lupulin.",3009178
202410,502,United States,1211,"lants and parts of plants (including seeds and fruits), of a kind used primarily in perfumery, in pharmacy or for insecticidal, fungicidal or similar purposes, fresh, chilled, frozen or dried, whether or not cut, crushed or powdered.",3816257
202410,502,United States,1212,"Locust beans, seaweeds and other algae, sugar beet and sugar cane, fresh, chilled, frozen or dried, whether or not ground; fruit stones and kernels and other vegetable products (including unroasted chicory roots of the variety Cichorium intybus sativum) of a kind used primarily for human consumption, not elsewhere specified or included.",1493
202410,502,United States,1214,"wedes, mangolds, fodder roots, hay, lucerne (alfalfa), clover, sainfoin, forage kale, lupines, vetches and similar forage products, whether or not in the form of pellets.",159307851
202410,502,United States,1301,"Lac; natural gums, resins, gumresins and oleoresins (for example, balsams).",1161833
202410,502,United States,1302,"Vegetable saps and extracts; pectic substances, pectinates and pectates; agaragar and other mucilages and thickeners, whether or not modified, derived from vegetable products.",11144059
202410,502,United States,1404,Vegetable products not elsewhere specified or included.,154963
202410,502,United States,1504,"ats and oils and their fractions, of fish or marine mammals, whether or not refined, but not chemically modified.",83955622
202410,502,United States,1506,"Other animal fats and oils and their fractions, whether or not refined, but not chemically modified.",3400288
202410,502,United States,1508,"Groundnut oil and its fractions, whether or not refined, but not chemically modified.",373
202410,502,United States,1509,"Olive oil and its fractions, whether or not refined, but not chemically modified.",23861
202410,502,United States,1512,"unflowerseed, safflower or cottonseed oil and fractions thereof, whether or not refined, but not chemically modified.",625
202410,502,United States,1513,"Coconut (copra), palm kernel or babassu oil and fractions thereof, whether or not refined, but not chemically modified.",36330
202410,502,United States,1514,"Rape, colza or mustard oil and fractions thereof, whether or not refined, but not chemically modified.",704
202410,502,United States,1515,"Other fixed vegetable or microbial fats and oils (including jojoba oil) and their fractions, whether or not refined, but not chemically modified",26482835
202410,502,United States,1516,"Animal，vegetable or microbial fats and oils and their fractions, partly or wholly hydrogenated, interesterified, reesterified or elaidinised, whether or not refined, but not further prepared.",2336421
202410,502,United States,1517,"Margarine; edible mixtures or preparations of animal, vegetable or microbial fats or oils or of fractions of different fats or oils of this Chapter, other than edible fats and oils or their fractions of heading 15.16.",66202805
202410,502,United States,1518,"Animal, vegetable or microbial fats and oils and their fractions, boiled, oxidised, dehydrated, sulphurised, blown, polymerised by heat in vacuum or in inert gas or otherwise chemically modified, excluding those of heading 15.16; inedible mixtures or preparations of animal, vegetable or microbial fats or oils or of fractions of different fats or oils of this Chapter, not elsewhere specified or included",2662637
202410,502,United States,1520,"Glycerol, crude; glycerol waters and glycerol lyes.",2962310
202410,502,United States,1521,"egetable waxes (other than triglycerides), beeswax, other insect waxes and spermaceti, whether or not refined or coloured.",433328
202410,502,United States,1602,"Other prepared or preserved meat, meat offal, blood or insects",147001704
202410,502,United States,1604,Prepared or preserved fish; caviar and caviar substitutes prepared from fish eggs.,1009040
202410,502,United States,1605,"rustaceans, molluscs and other aquatic invertebrates, prepared or preserved.",2017700
202410,502,United States,1701,"Cane or beet sugar and chemically pure sucrose, in solid form.",1053846
202410,502,United States,1702,"Other sugars, including chemically pure lactose, maltose, glucose and fructose, in solid form; sugar syrups not containing added flavouring or colouring matter; artificial honey, whether or not mixed with natural honey; caramel.",62439146
202410,502,United States,1704,"ugar confectionery (including white chocolate), not containing cocoa.",57682300
202410,502,United States,1805,"Cocoa powder, not containing added sugar or other sweetening matter",331768
202410,502,United States,1806,hocolate and other food preparations containing cocoa.,25744620
202410,502,United States,1901,"Malt extract; food preparations of flour, groats, meal, starch or malt extract, not containing cocoa or containing less than 40% by weight of cocoa calculated on a totally defatted basis, not elsewhere specified or included; food preparations of goods of headings 04.01 to 04.04,not containing cocoa or containing less than 5% by weight of cocoa calculated on a totally efatted basis, not elsewhere specified or included.",11309891
202410,502,United States,1902,"Pasta, whether or not cooked or stuffed (with meat or other substances) or otherwise prepared, such as spaghetti, macaroni, noodles, lasagne, gnocchi, ravioli, cannelloni; couscous, whether or not prepared.",25569
202410,502,United States,1904,"repared foods obtained by the swelling or roasting of cereals or cereal products (for example, corn flakes); cereals (other than maize (corn)) in grain form or in the form of flakes or other worked grains (except flour, groats and meal), precooked, or otherwise prepared, not elsewhere specified or included.",1767352
202410,502,United States,1905,"read, pastry, cakes, biscuits and other bakers' wares, whether or not containing cocoa; communion wafers, empty cachets of a kind suitable for pharmaceutical use, sealing wafers, rice paper and similar products.",2120383
202410,502,United States,2001,"Vegetables, fruit, nuts and other edible parts of plants, prepared or preserved by vinegar or acetic acid.",3199
202410,502,United States,2002,Tomatoes prepared or preserved otherwise than by vinegar or acetic acid.,1422
202410,502,United States,2004,"Other vegetables prepared or preserved otherwise than by vinegar or acetic acid, frozen, other than products of heading 20.06.",12674177
202410,502,United States,2005,"Other vegetables prepared or preserved otherwise than by vinegar or acetic acid, not frozen, other than products of heading 20.06.",2841912
202410,502,United States,2006,"Vegetables, fruit, nuts, fruitpeel and other parts of plants, preserved by sugar (drained, glacé or crystallised).",850440
202410,502,United States,2007,"Jams, fruit jellies, marmalades, fruit or nut purée and fruit or nut pastes, obtained by cooking, whether or not containing added sugar or other sweetening matter.",415570
202410,502,United States,2008,"Fruit, nuts and other edible parts of plants, otherwise prepared or preserved, whether or not containing added sugar or other sweetening matter or spirit, not elsewhere specified or included.",139902973
202410,502,United States,2009,"Fruit or nut juices (including grape must and coconut water) and vegetable juices, unfermented and not containing added spirit, whether or not containing added sugar or other sweetening matter",9771238
202410,502,United States,2101,"Extracts, essences and concentrates, of coffee, tea or maté and preparations with a basis of these products or with a basis of coffee, tea or mate; roasted chicory and other roasted coffee substitutes, and extracts, essences and concentrates thereof",5261450
202410,502,United States,2102,"Yeasts (active or inactive); other singlecell microorganisms, dead (but not including vaccines of heading 30.02); prepared baking powders.",3274386
202410,502,United States,2103,"Sauce and preparations therefor; mixed condiments and mixed seasonings; mustard flour and meal, whether or not prepared, and mustard",12193326
202410,502,United States,2104,Soups and broths and preparations therefor; homogenised composite food preparations.,112409
202410,502,United States,2105,"Ice cream and other edible ice, whether or not containing cocoa.",1714885
202410,502,United States,2106,Food preparations not elsewhere specified or included.,1055226886
202410,502,United States,2201,"Waters, including natural or artificial mineral waters andaerated waters, not containing added sugar or other sweetening matter nor flavoured; ice and snow.",4529
202410,502,United States,2202,"Waters, including mineral waters and aerated waters, containing added sugar or other sweetening matter or flavoured, and other non-alcoholic beverages, not including fruit, nut or vegetable juices of heading 20.09",46256690
202410,502,United States,2203,Beer made from malt.,8127196
202410,502,United States,2204,"Wine of fresh grapes, including fortified wines; grape must other than that of heading 20.09.",16530390
202410,502,United States,2207,"Undenatured ethyl alcohol of an alcoholic strength by volume of 80% vol.or higher; ethyl alcohol and other spirits, denatured, of any strength.",356044
202410,502,United States,2208,"Undenatured ethyl alcohol of an alcoholic strength by volume of Undenatured ethyl alcohol of an alcoholic strength by volume of less than 80% vol.; spirits, liqueurs and other spirituous beverages.",13974764
202410,502,United States,2209,Vinegar and substitutes for vinegar obtained from acetic acid.,2147132
202410,502,United States,2301,"Flours, meals and pellets, of meat or meat offal, of fish or ofcrustaceans, molluscs or other aquatic invertebrates, unfit for human consumption; greaves.",251626982
202410,502,United States,2302,"Bran, sharps and other residues, whether or not in the form of pellets, derived from the sifting, milling or other working of cereals or of leguminous plants.",4215245
202410,502,United States,2303,"Residues of starch manufacture and similar residues, beetpulp, bagasse and other waste of sugar manufacture, brewing ordistilling dregs and waste, whether or not in the form of pellets.",23419475
202410,502,United States,2304,"Oilcake and other solid residues, whether or not ground or in the form of pellets, resulting from the extraction of soyabean oil.",3545190
202410,502,United States,2309,Preparations of a kind used in animal feeding.,346896564
202410,502,United States,2402,"Cigars, cheroots, cigarillos and cigarettes, of tobacco or of tobacco substitutes.",652004
202410,502,United States,2404,"Products containing tobacco, reconstituted tobacco, nicotine, or tobacco or nicotine substitutes, intended for inhalation without combustion; other nicotine containing products intended for the intake of nicotine into the human body",9777968
202410,502,United States,2501,"Salts, incl. table salt and denatured salt, and pure sodium chloride, whether or not in aqueous solution or containing added anti-caking or free-flowing agents; sea water",32521979
202410,502,United States,2503,"Sulphur of all kinds (excluding sublimed sulphur, precipitated sulphur and colloidal sulphur)",3575
202410,502,United States,2504,Natural graphite.,494651
202410,502,United States,2505,"Natural sands of all kinds, whether or not coloured, other than metalbearing sands of Chapter 26.",6976524
202410,502,United States,2506,"Quartz (excluding natural sands); quartzite, whether or not roughly trimmed or merely cut, by sawing or otherwise, into blocks or slabs of a square or rectangular shape",215369056
202410,502,United States,2507,"Kaolin and other kaolinic clays, whether or not calcined",49854660
202410,502,United States,2508,"Other clays (not including expanded clays of heading 68.06), andalusite, kyanite and sillimanite, whether or not calcined; mullite; chamotte or dinas earths.",28773697
202410,502,United States,2510,"Natural calcium phosphates, natural aluminium calcium phosphates and phosphatic chalk.",154497
202410,502,United States,2511,"Natural barium sulphate (barytes); natural barium carbonate (witherite), whether or not calcined, other than barium oxide of heading 28.16.",32084
202410,502,United States,2512,"Siliceous fossil meals, e.g. kieselguhr, tripolite and diatomite, and similar siliceous earths, whether or not calcined, of an apparent specific gravity of 1 or less.",2363472
202410,502,United States,2513,"Pumice stone; emery; natural corundum, natural garnet and other natural abrasives, whether or not heat-treated",28648
202410,502,United States,2515,"Marble, travertine, ecaussine and other calcareous monumental or building stone of an apparent specific gravity of 2.5 or more, and alabaster, whether or not roughly trimmed or merely cut, by sawing or otherwise, into blocks or slabs of a rectangular (including square) shape.",19239
202410,502,United States,2516,"Granite, porphyry, basalt, sandstone and other monumental or building stone, whether or not roughly trimmed or merely cut, by sawing or otherwise, into blocks or slabs of a rectangular (including square) shape.",1818958
202410,502,United States,2517,"Pebbles, gravel, broken or crushed stone, for concrete aggregates, for road metalling or for railway ballast, shingle and flint, whether or not heat-treated; macadam of slag, dross or similar industrial waste, whether or not incorporating the materials cited in the first part of the heading; tarred macadam; granules, chippings and powder, of stones of heading 2515 and 2516, whether or not heat-treated",390150
202410,502,United States,2518,"Dolomite, whether or not calcined or sintered, including dolomite roughly trimmed or merely cut, by sawing or otherwise, into blocks or slabs of a rectangular (including square) shape",14045
202410,502,United States,2519,"Natural magnesium carbonate ""magnesite""; fused magnesia; dead-burned ""sintered"" magnesia, whether or not containing small quantities of other oxides added before sintering; other magnesium oxide, whether or not pure",1515776
202410,502,United States,2520,"Gypsum; anhydrite; plasters consisting of calcined gypsum or calcium sulphate, whether or not coloured, with or without small quantities of accelerators or retarders",2135279
202410,502,United States,2522,"Quicklime, slaked lime and hydraulic lime (excluding pure calcium oxide and calcium hydroxide)",53669
202410,502,United States,2523,"Portland cement, aluminous cement, slagcement, supersulphate cement and similar hydraulic cements, whether or not coloured or in the form of clinkers.",218951
202410,502,United States,2525,"Mica, including splittings; mica waste.",514745
202410,502,United States,2526,"Natural steatite, whether or not roughly trimmed or merely cut, by sawing or otherwise, into blocks or slabs of a rectangular (including square) shape; talc.",4679809
202410,502,United States,2528,"Natural borates and concentrates thereof (whether or not calcined), but not including borates separated from natural brine; natural boric acid containing not more than 85% of H3BO3 calculated on the dry weight.",1942
202410,502,United States,2530,Mineral substances not elsewhere specified or included.,82344994
202410,502,United States,2601,"Iron ores and concentrates, including roasted iron pyrites.",58039213
202410,502,United States,2603,Copper ores and concentrates.,202854084
202410,502,United States,2607,Lead ores and concentrates.,503464405
202410,502,United States,2608,Zinc ores and concentrates.,342466285
202410,502,United States,2613,Molybdenum ores and concentrates.,39442680
202410,502,United States,2614,Titanium ores and concentrates.,40773106
202410,502,United States,2615,"Niobium, tantalum, vanadium or zirconium ores and concentrates.",2385425
202410,502,United States,2616,Precious metal ores and concentrates.,4420837
202410,502,United States,2701,Mituminous substances; mineral waxes,1684138667
202410,502,United States,2704,"Coke and semicoke of coal, of lignite or of peat, whether or not agglomerated; retort carbon.",49350
202410,502,United States,2707,Oils and other products of the distillation of high temperature coal tar; similar products in which the weight of the aromatic constituents exceeds that of the non-aromatic constituents,5657735
202410,502,United States,2709,"Petroleum oils and oils obtained from bituminous minerals, crude.",4560933966
202410,502,United States,2710,"Petroleum oils and oils obtained from bituminous minerals, other than crude; preparations not elsewhere specified or included, containing by weight 70% or more of petroleum oils or of oils obtained from bituminous minerals, these oils being the basic constituents of the preparations; waste oils.",274002049
202410,502,United States,2711,Petroleum gases and other gaseous hydrocarbons.,11233951271
202410,502,United States,2712,"Petroleum jelly, paraffin wax, micro- crystalline petroleum wax, slack wax, ozokerite, lignite wax, peat wax, other mineral waxes, and similar products obtained by synthesis or by other processes, whether or not coloured",6178022
202410,502,United States,2713,"Petroleum coke, petroleum bitumen and other residues of petroleum oils or of oils obtained from bituminous minerals.",123894472
202410,502,United States,2715,"Bituminous mastics, cut-backs and other bituminous mixtures based on natural asphalt, on natural bitumen, on petroleum bitumen, on mineral tar or on mineral tar pitch(for example, bituminous mastics, cutbacks).",16562015
202410,502,United States,2801,"Fluorine, chlorine, bromine and iodine",8087667
202410,502,United States,2802,"Sulphur, sublimed or precipitated; colloidal sulphur.",26493
202410,502,United States,2803,Carbon (carbon blacks and other forms of carbon not elsewhere specified or included).,12970061
202410,502,United States,2804,"ydrogen, rare gases and other nonmetals.",60282203
202410,502,United States,2805,"Alkali or alkaline-earth metals; rare-earth metals, scandium and yttrium, whether or not intermixed or interalloyed; mercury",16404597
202410,502,United States,2806,"Hydrogen chloride ""hydrochloric acid""; chlorosulphuric acid",30805
202410,502,United States,2807,Sulphuric acid; oleum.,117720
202410,502,United States,2808,Nitric acid; sulphonitric acids.,907987
202410,502,United States,2809,"Diphosphorus pentaoxide; phosphoric acid; polyphosphoric acids, whether or not chemically defined",101292
202410,502,United States,2810,Oxides of boron; boric acids.,50087098
202410,502,United States,2811,Other inorganic acids and other inorganic oxygen compounds of nonmetals.,10462238
202410,502,United States,2812,Halides and halide oxides of nonmetals.,3825496
202410,502,United States,2813,Sulphides of non-metals; commercial phosphorus trisulphide,1021
202410,502,United States,2814,"Ammonia, anhydrous or in aqueous solution.",48798
202410,502,United States,2815,"Sodium hydroxide (caustic soda), potassium hydroxide (caustic potash); peroxides of sodium or potassium",1860976
