Date of data,Trading partner code,Trading partner,Commodity code,Commodity,Renminbi Yuan
201904,502,United States,0106,Other live animals,2859435
201904,502,United States,0201,"Meat of bovine animals, fresh or chilled",3695762
201904,502,United States,0202,"Meat of bovine animals, frozen",22654733
201904,502,United States,0203,"Meat of swine, fresh, chilled or frozen",94913158
201904,502,United States,0206,"Edible offal of bovine animals, swine, sheep, goats, horses, asses, mules or hinnies, fresh, chilled or frozen",120942683
201904,502,United States,0301,Live fish,98378
201904,502,United States,0303,"Fish, frozen, excluding fish fillets and other fish meat of heading 0304",449834964
201904,502,United States,0304,"Fish fillets and other fish meat (whether or not minced), fresh, chilled or frozen",30620889
201904,502,United States,0306,"Crustaceans, whether in shell or not, live, fresh, chilled, frozen, dried, salted or in brine; smoked crustaceans, whether in shell or not, whether or not cooked before or during the smoking process; crustaceans, in shell, cooked by steaming or by boiling in water, whether or not chilled, frozen, dried, salted or in brine; flours, meals and pellets of crustaceans, fit for human consumption",128036277
201904,502,United States,0307,"Molluscs, whether in shell or not, live, fresh, chilled, frozen, dried, salted or in brine; smoked molluscs, whether in shell or not, whether or not cooked before or during the smoking process; flours, meals and pellets of molluscs, fit for human consumption",61382677
201904,502,United States,0308,"Aquatic invertebrates other than crustaceans and molluscs, live, fresh, chilled, frozen, dried, salted or in brine; smoked aquatic invertebrates other than crustaceans and molluscs, whether or not cooked before or during the smoking process; flours, meals and pellets of aquatic invertebrates other than crustaceans and molluscs, fit for human consumption",510123
201904,502,United States,0401,"Milk and cream, not concentrated nor containing added sugar or other sweetening matter.",111717
201904,502,United States,0402,"Milk and cream, concentrated or containing added sugar or other sweetening matter",6143506
201904,502,United States,0403,"Buttermilk, curdled milk and cream, yogurt, kephir and other fermented or acidified milk and cream, whether or not concentrated or containing added sugar or other sweetening matter or flavoured or containing added fruit, nuts or cocoa",33090
201904,502,United States,0404,"Whey, whether or not concentrated or containing added sugar or other sweetening matter; products consisting of natural milk constituents, whether or not containing added sugar or other sweetening matter, not elsewhere specified or included",82375185
201904,502,United States,0405,Butter and other fats and oils derived from milk; dairy spreads,775
201904,502,United States,0406,Cheese and curd,25467633
201904,502,United States,0409,atural honey,218007
201904,502,United States,0410,"dible products of animal origin, not elsewhere specified or included",23757
201904,502,United States,0504,"Guts, bladders and stomachs of animals (other than fish), whole and pieces thereof, fresh, chilled, frozen, salted, in brine, dried or smoked",46530352
201904,502,United States,0505,"Skins and other parts of birds, with their feathers or down, feathers and parts of feathers (whether or not with trimmed edges) and down, not further worked than cleaned, disinfected or treated for preservation;powder and waste of feathers or parts of feathers",8451890
201904,502,United States,0507,"Ivory, tortoiseshell, whalebone and whalebone hair, horns, antlers, hooves, nails, claws and beaks, unworked or simply prepared but not cut to shape; powder and waste of these products",54895
201904,502,United States,0511,"Animal products not elsewhere specified or included; dead animals of Chapter 1 or 3, unfit for human consumption",23636494
201904,502,United States,0602,"Other live plants (including their roots), cuttings and slips; mushroom spawn.",2464881
201904,502,United States,0603,"Cut flowers and flower buds of a kind suitable for bouquets or for ornamental purposes, fresh, dried, dyed, bleached, impregnated or otherwise prepared.",2599
201904,502,United States,0604,"Foliage, branches and other parts of plants, without flowers or flower buds, and grasses, mosses and lichens, being goods of a kind suitable for bouquets or for ornamental purposes, fresh,dried, dyed, bleached, impregnated or otherwise prepared",64669
201904,502,United States,0706,"Carrots, turnips, salad beetroot, salsify, celeriac, radishes and similar edible roots, fresh or chilled.",144185
201904,502,United States,0710,"Vegetables (uncooked or cooked by steaming or boiling in water),frozen.",7456752
201904,502,United States,0712,"Dried vegetables, whole, cut, sliced, broken or in powder, but not further prepared.",403307
201904,502,United States,0713,"Dried leguminous vegetables, shelled, whether or not skinned or split.",8786915
201904,502,United States,0801,"Coconuts, Brazil nuts and cashew nuts, fresh or dried, whether or not shelled or peeled.",3602
201904,502,United States,0802,"Other nuts, fresh or dried, whether or not shelled or peeled.",295800573
201904,502,United States,0804,"Dates, figs, pineapples, avocados, guavas, mangoes and mangosteens, fresh or dried.",1296
201904,502,United States,0805,"Citrus fruit, fresh or dried.",76782465
201904,502,United States,0806,"Grapes, fresh or dried.",5684128
201904,502,United States,0808,"Apples, pears and quinces, fresh.",20801270
201904,502,United States,0809,"Apricots, cherries, peaches (including nectarines), plums and sloes, fresh.",89687
201904,502,United States,0811,"Fruit and nuts, uncooked or cooked by steaming or boiling in water, frozen, whether or not containing added sugar or other sweetening matter.",761703
201904,502,United States,0813,"Fruit, dried, other than that of headings 08.01 to 08.06; mixtures of nuts or dried fruits of this Chapter.",3468586
201904,502,United States,0901,"Coffee, whether or not roasted or decaffeinated; coffee husks and skins; coffee substitutes containing coffee in any proportion.",13144061
201904,502,United States,0902,"Tea, whether or not flavoured.",200970
201904,502,United States,0903,Maté.,136
201904,502,United States,0904,Pepper of the genus Piper; dried or crushed or ground fruits of the genus Capsicum or of the genus Pimenta.,11941
201904,502,United States,0906,Cinnamon and cinnamontree flowers.,2770
201904,502,United States,0909,"Seeds of anise, badian, fennel, coriander, cumin or caraway; juniper berries.",71
201904,502,United States,0910,"Ginger, saffron, turmeric (curcuma), thyme, bay leaves, curry and other spices.",30966
201904,502,United States,1004,Oats,684044
201904,502,United States,1005,Maize (corn).,320273
201904,502,United States,1006,Rice.,403
201904,502,United States,1007,Grain sorghum.,210932
201904,502,United States,1008,"Buckwheat, millet and canary seeds; other cereals.",1569
201904,502,United States,1101,Wheat or meslin flour.,17524
201904,502,United States,1102,Cereal flours other than of wheat or meslin.,38075
201904,502,United States,1103,"Cereal groats, meal and pellets.",127
201904,502,United States,1104,"Cereal grains otherwise worked (for example, hulled, rolled, flaked, pearled, sliced or kibbled), except rice of heading 10.06; germ of cereals, whole, rolled, flaked or ground.",90264
201904,502,United States,1105,"Flour, meal, powder, flakes, granules and pellets of potatoes.",368131
201904,502,United States,1106,"Flour, meal and powder of the dried leguminous vegetables of heading 07.13, of sago or of roots or tubers of heading 07.14 or of the products of Chapter 8.",1768674
201904,502,United States,1108,tarches; inulin.,1823152
201904,502,United States,1201,"Soya beans, whether or not broken.",4707498640
201904,502,United States,1202,"Groundnuts, not roasted or otherwise cooked, whether or not shelled or broken.",6142231
201904,502,United States,1203,Copra.,20
201904,502,United States,1204,"Linseed, whether or not broken.",656
201904,502,United States,1206,"Sunflower seeds, whether or not broken.",232907
201904,502,United States,1207,"Other oil seeds and oleaginous fruits, whether or not broken.",24402
201904,502,United States,1208,"Flours and meals of oil seeds or oleaginous fruits, other than those of mustard.",3923
201904,502,United States,1209,"Seeds, fruit and spores, of a kind used for sowing.",108442953
201904,502,United States,1210,"Hop cones, fresh or dried, whether or not ground, powdered or in the form of pellets; lupulin.",3706676
201904,502,United States,1211,"lants and parts of plants (including seeds and fruits), of a kind used primarily in perfumery, in pharmacy or for insecticidal, fungicidal or similar purposes, fresh, chilled, frozen or dried, whether or not cut, crushed or powdered.",8521219
201904,502,United States,1212,"Locust beans, seaweeds and other algae, sugar beet and sugar cane, fresh, chilled, frozen or dried, whether or not ground; fruit stones and kernels and other vegetable products (including unroasted chicory roots of the variety Cichorium intybus sativum) of a kind used primarily for human consumption, not elsewhere specified or included.",81311
201904,502,United States,1214,"wedes, mangolds, fodder roots, hay, lucerne (alfalfa), clover, sainfoin, forage kale, lupines, vetches and similar forage products, whether or not in the form of pellets.",163120007
201904,502,United States,1301,"Lac; natural gums, resins, gumresins and oleoresins (for example, balsams).",1238439
201904,502,United States,1302,"Vegetable saps and extracts; pectic substances, pectinates and pectates; agaragar and other mucilages and thickeners, whether or not modified, derived from vegetable products.",7084671
201904,502,United States,1404,Vegetable products not elsewhere specified or included.,69162
201904,502,United States,1504,"ats and oils and their fractions, of fish or marine mammals, whether or not refined, but not chemically modified.",27126085
201904,502,United States,1506,"Other animal fats and oils and their fractions, whether or not refined, but not chemically modified.",401848
201904,502,United States,1507,"oyabean oil and its fractions, whether or not refined, but not chemically modified.",215417
201904,502,United States,1508,"Groundnut oil and its fractions, whether or not refined, but not chemically modified.",130
201904,502,United States,1509,"Olive oil and its fractions, whether or not refined, but not chemically modified.",62729
201904,502,United States,1510,"Other oils and their fractions, obtained solely from olives, whether or not refined, but not chemically modified, including blends of these oils or fractions with oils or fractions of heading 15.09.",69
201904,502,United States,1512,"unflowerseed, safflower or cottonseed oil and fractions thereof, whether or not refined, but not chemically modified.",171893
201904,502,United States,1513,"Coconut (copra), palm kernel or babassu oil and fractions thereof, whether or not refined, but not chemically modified.",623538
201904,502,United States,1514,"Rape, colza or mustard oil and fractions thereof, whether or not refined, but not chemically modified.",7697
201904,502,United States,1515,"Other fixed vegetable fats and oils (including jojoba oil) and their fractions, whether or not refined, but not chemically modified.",9247101
201904,502,United States,1516,"Animal or vegetable fats and oils and their fractions, partly or wholly hydrogenated, interesterified, reesterified or elaidinised, whether or not refined, but not further prepared.",2296455
201904,502,United States,1517,"Margarine; edible mixtures or preparations of animal or vegetable fats or oils or of fractions of different fats or oils of this Chapter, other than edible fats or oils or their fractions of heading 15.16.",8722117
201904,502,United States,1518,"Animal or vegetable fats and oils and their fractions, boiled, oxidised,dehydrated, sulphurised, blown, polymerised by heat in vacuum or in inert gas or otherwise chemically modified, excluding those of heading 15.16; inedible mixtures or preparations of animal or vegetable fats or oils or of fractions of different fats or oils of this Chapter, not elsewhere specified or included.",2855640
201904,502,United States,1520,"Glycerol, crude; glycerol waters and glycerol lyes.",5428469
201904,502,United States,1521,"egetable waxes (other than triglycerides), beeswax, other insect waxes and spermaceti, whether or not refined or coloured.",281795
201904,502,United States,1604,Prepared or preserved fish; caviar and caviar substitutes prepared from fish eggs.,18443
201904,502,United States,1605,"rustaceans, molluscs and other aquatic invertebrates, prepared or preserved.",4331283
201904,502,United States,1701,"Cane or beet sugar and chemically pure sucrose, in solid form.",13142
201904,502,United States,1702,"Other sugars, including chemically pure lactose, maltose, glucose and fructose, in solid form; sugar syrups not containing added flavouring or colouring matter; artificial honey, whether or not mixed with natural honey; caramel.",42348404
201904,502,United States,1704,"ugar confectionery (including white chocolate), not containing cocoa.",23732203
201904,502,United States,1801,"Cocoa beans, whole or broken, raw or roasted.",4033
201904,502,United States,1804,"Cocoa butter, fat and oil.",177
201904,502,United States,1805,"Cocoa powder, not containing added sugar or other sweetening matter.",96964
201904,502,United States,1806,hocolate and other food preparations containing cocoa.,12938261
201904,502,United States,1901,"Malt extract; food preparations of flour, groats, meal, starch or malt extract, not containing cocoa or containing less than 40% by weight of cocoa calculated on a totally defatted basis, not elsewhere specified or included; food preparations of goods of headings 04.01 to 04.04,not containing cocoa or containing less than 5% by weight of cocoa calculated on a totally efatted basis, not elsewhere specified or included.",62218980
201904,502,United States,1902,"Pasta, whether or not cooked or stuffed (with meat or other substances) or otherwise prepared, such as spaghetti, macaroni, noodles, lasagne, gnocchi, ravioli, cannelloni; couscous, whether or not prepared.",1651532
201904,502,United States,1904,"repared foods obtained by the swelling or roasting of cereals or cereal products (for example, corn flakes); cereals (other than maize (corn)) in grain form or in the form of flakes or other worked grains (except flour, groats and meal), precooked, or otherwise prepared, not elsewhere specified or included.",11358024
201904,502,United States,1905,"read, pastry, cakes, biscuits and other bakers' wares, whether or not containing cocoa; communion wafers, empty cachets of a kind suitable for pharmaceutical use, sealing wafers, rice paper and similar products.",10477212
201904,502,United States,2001,"Vegetables, fruit, nuts and other edible parts of plants, prepared or preserved by vinegar or acetic acid.",143110
201904,502,United States,2002,Tomatoes prepared or preserved otherwise than by vinegar or acetic acid.,2009458
201904,502,United States,2003,"Mushrooms and truffles, prepared or preserved otherwise than by vinegar or acetic acid.",419
201904,502,United States,2004,"Other vegetables prepared or preserved otherwise than by vinegar or acetic acid, frozen, other than products of heading 20.06.",55108921
201904,502,United States,2005,"Other vegetables prepared or preserved otherwise than by vinegar or acetic acid, not frozen, other than products of heading 20.06.",1067369
201904,502,United States,2006,"Vegetables, fruit, nuts, fruitpeel and other parts of plants, preserved by sugar (drained, glacé or crystallised).",1596362
201904,502,United States,2007,"Jams, fruit jellies, marmalades, fruit or nut purée and fruit or nut pastes, obtained by cooking, whether or not containing added sugar or other sweetening matter.",5998272
201904,502,United States,2008,"Fruit, nuts and other edible parts of plants, otherwise prepared or preserved, whether or not containing added sugar or other sweetening matter or spirit, not elsewhere specified or included.",52996977
201904,502,United States,2009,"ruit juices (including grape must) and vegetable juices, unfermented and not containing added spirit, whether or not containing added sugar or other sweetening matter.",13002242
201904,502,United States,2101,"Extracts, essences and concentrates, of coffee, tea or maté and preparations with a basis of these products or with a basis of coffee, tea or mate; roasted chicory and other roasted coffee substitutes, and extracts, essences and concentrates thereof",5715059
201904,502,United States,2102,"Yeasts (active or inactive); other singlecell microorganisms, dead (but not including vaccines of heading 30.02); prepared baking powders.",620297
201904,502,United States,2103,"Sauce and preparations therefor; mixed condiments and mixed seasonings; mustard flour and meal, whether or not prepared, and mustard",8692299
201904,502,United States,2104,Soups and broths and preparations therefor; homogenised composite food preparations.,3977564
201904,502,United States,2105,"Ice cream and other edible ice, whether or not containing cocoa.",5105174
201904,502,United States,2106,Food preparations not elsewhere specified or included.,354078487
201904,502,United States,2201,"Waters, including natural or artificial mineral waters andaerated waters, not containing added sugar or other sweetening matter nor flavoured; ice and snow.",2510350
201904,502,United States,2202,"Waters, including mineral waters and aerated waters, containing added sugar or other sweetening matter or flavoured, and other nonalcoholic beverages, not including fruit or vegetable juices of heading 20.09.",41910457
201904,502,United States,2203,Beer made from malt.,7237718
201904,502,United States,2204,"Wine of fresh grapes, including fortified wines; grape must other than that of heading 20.09.",21262509
201904,502,United States,2205,Vermouth and other wine of fresh grapes flavoured with plants or aromatic substances.,1610
201904,502,United States,2206,"Other fermented beverages (for example, cider, perry, mead, saké); mixtures of fermented beverages and mixtures of fermented beverages and nonalcoholic beverages, not elsewhere specified or included.",6318
201904,502,United States,2207,"Undenatured ethyl alcohol of an alcoholic strength by volume of 80% vol.or higher; ethyl alcohol and other spirits, denatured, of any strength.",318378
201904,502,United States,2208,"Undenatured ethyl alcohol of an alcoholic strength by volume of Undenatured ethyl alcohol of an alcoholic strength by volume of less than 80% vol.; spirits, liqueurs and other spirituous beverages.",19366118
201904,502,United States,2209,Vinegar and substitutes for vinegar obtained from acetic acid.,187863
201904,502,United States,2301,"Flours, meals and pellets, of meat or meat offal, of fish or ofcrustaceans, molluscs or other aquatic invertebrates, unfit for human consumption; greaves.",189259393
201904,502,United States,2302,"Bran, sharps and other residues, whether or not in the form of pellets, derived from the sifting, milling or other working of cereals or of leguminous plants.",13545135
201904,502,United States,2303,"Residues of starch manufacture and similar residues, beetpulp, bagasse and other waste of sugar manufacture, brewing ordistilling dregs and waste, whether or not in the form of pellets.",4446682
201904,502,United States,2309,Preparations of a kind used in animal feeding.,61052195
201904,502,United States,2402,"Cigars, cheroots, cigarillos and cigarettes, of tobacco or of tobacco substitutes.",360333
201904,502,United States,2501,"Salts, incl. table salt and denatured salt, and pure sodium chloride, whether or not in aqueous solution or containing added anti-caking or free-flowing agents; sea water",1685207
201904,502,United States,2502,Unroasted iron pyrites.,5100
201904,502,United States,2503,"Sulphur of all kinds (excluding sublimed sulphur, precipitated sulphur and colloidal sulphur)",1483027
201904,502,United States,2504,Natural graphite.,526372
201904,502,United States,2505,"Natural sands of all kinds, whether or not coloured, other than metalbearing sands of Chapter 26.",2637926
201904,502,United States,2506,"Quartz (excluding natural sands); quartzite, whether or not roughly trimmed or merely cut, by sawing or otherwise, into blocks or slabs of a square or rectangular shape",45733546
201904,502,United States,2507,"Kaolin and other kaolinic clays, whether or not calcined",45501784
201904,502,United States,2508,"Other clays (not including expanded clays of heading 68.06), andalusite, kyanite and sillimanite, whether or not calcined; mullite; chamotte or dinas earths.",17820816
201904,502,United States,2511,"Natural barium sulphate (barytes); natural barium carbonate (witherite), whether or not calcined, other than barium oxide of heading 28.16.",168032
201904,502,United States,2512,"Siliceous fossil meals, e.g. kieselguhr, tripolite and diatomite, and similar siliceous earths, whether or not calcined, of an apparent specific gravity of 1 or less.",2049338
201904,502,United States,2513,"Pumice stone; emery; natural corundum, natural garnet and other natural abrasives, whether or not heat-treated",290529
201904,502,United States,2515,"Marble, travertine, ecaussine and other calcareous monumental or building stone of an apparent specific gravity of 2.5 or more, and alabaster, whether or not roughly trimmed or merely cut, by sawing or otherwise, into blocks or slabs of a rectangular (including square) shape.",823087
201904,502,United States,2516,"Granite, porphyry, basalt, sandstone and other monumental or building stone, whether or not roughly trimmed or merely cut, by sawing or otherwise, into blocks or slabs of a rectangular (including square) shape.",7670180
201904,502,United States,2517,"Pebbles, gravel, broken or crushed stone, for concrete aggregates, for road metalling or for railway ballast, shingle and flint, whether or not heat-treated; macadam of slag, dross or similar industrial waste, whether or not incorporating the materials cited in the first part of the heading; tarred macadam; granules, chippings and powder, of stones of heading 2515 and 2516, whether or not heat-treated",163376
201904,502,United States,2518,"Dolomite, whether or not calcined or sintered, including dolomite roughly trimmed or merely cut, by sawing or otherwise, into blocks or slabs of a rectangular (including square) shape; dolomite ramming mix.",296977
201904,502,United States,2519,"Natural magnesium carbonate ""magnesite""; fused magnesia; dead-burned ""sintered"" magnesia, whether or not containing small quantities of other oxides added before sintering; other magnesium oxide, whether or not pure",3788212
201904,502,United States,2520,"Gypsum; anhydrite; plasters consisting of calcined gypsum or calcium sulphate, whether or not coloured, with or without small quantities of accelerators or retarders",1750983
201904,502,United States,2522,"Quicklime, slaked lime and hydraulic lime (excluding pure calcium oxide and calcium hydroxide)",10680
201904,502,United States,2523,"Portland cement, aluminous cement, slagcement, supersulphate cement and similar hydraulic cements, whether or not coloured or in the form of clinkers.",1016802
201904,502,United States,2525,"Mica, including splittings; mica waste.",191880
201904,502,United States,2526,"Natural steatite, whether or not roughly trimmed or merely cut, by sawing or otherwise, into blocks or slabs of a rectangular (including square) shape; talc.",3406372
201904,502,United States,2530,Mineral substances not elsewhere specified or included.,50496333
201904,502,United States,2602,"Manganese ores and concentrates, including ferruginous manganese ores and concentrates with a manganese content of 20% or more,calculated on the dry weight.",197088
201904,502,United States,2607,Lead ores and concentrates.,44595254
201904,502,United States,2610,Chromium ores and concentrates.,10349
201904,502,United States,2613,Molybdenum ores and concentrates.,11795808
201904,502,United States,2614,Titanium ores and concentrates.,7850094
201904,502,United States,2615,"Niobium, tantalum, vanadium or zirconium ores and concentrates.",27774090
201904,502,United States,2701,Mituminous substances; mineral waxes,299555637
201904,502,United States,2702,"ignite, whether or not agglomerated, excluding jet.",1523
201904,502,United States,2707,Oils and other products of the distillation of high temperature coal tar; similar products in which the weight of the aromatic constituents exceeds that of the non-aromatic constituents,4090396
201904,502,United States,2708,"Pitch and pitch coke, obtained from coal tar or from other mineral tars",32439
201904,502,United States,2709,"Petroleum oils and oils obtained from bituminous minerals, crude.",1722562977
201904,502,United States,2710,"Petroleum oils and oils obtained from bituminous minerals, other than crude; preparations not elsewhere specified or included, containing by weight 70% or more of petroleum oils or of oils obtained from bituminous minerals, these oils being the basic constituents of the preparations; waste oils.",69758692
201904,502,United States,2711,Petroleum gases and other gaseous hydrocarbons.,196644683
201904,502,United States,2712,"Petroleum jelly, paraffin wax, micro- crystalline petroleum wax, slack wax, ozokerite, lignite wax, peat wax, other mineral waxes, and similar products obtained by synthesis or by other processes, whether or not coloured",6491947
201904,502,United States,2713,"Petroleum coke, petroleum bitumen and other residues of petroleum oils or of oils obtained from bituminous minerals.",232513642
