Date of data,Trading partner code,Trading partner,Commodity code,Commodity,Renminbi Yuan
201902,502,United States,3813,Preparations and charges for fireextinguishers; charged fireextinguishing grenades.,76745
201902,502,United States,3814,"Organic composite solvents and thinners, not elsewhere specified or included; prepared paint or varnish removers.",7887794
201902,502,United States,3815,"Reaction initiators, reaction accelerators and catalytic preparations, not elsewhere specified or included.",301725663
201902,502,United States,3816,"Refractory cements, mortars, concretes and similar compositions, other than products of heading 38.01.",2045973
201902,502,United States,3817,"Mixed alkylbenzenes and mixed alkylnaphthalenes, other than those of heading 27.07 or 29.02.",2067840
201902,502,United States,3818,"Chemical elements doped for use in electronics, in the form of discs, wafers or similar forms; chemical compounds doped for use in electronics. form of",52005318
201902,502,United States,3819,"Hydraulic brake fluids and other prepared liquids for hydraulic transmission, not containing or containing less than 70% by weight of petroleum oils or oils obtained from bituminous minerals.",5772833
201902,502,United States,3820,Antifreezing preparations and prepared deicing fluids.,2350562
201902,502,United States,3821,"Prepared culture media for the development or maintenance of microorganisms (including viruses and the like) or of plant, human or animal cells.",42735697
201902,502,United States,3822,"Diagnostic or laboratory reagents on a backing, prepared diagnostic or laboratory reagents whether or not on a backing, other than those of heading 30.02 or 30.06; certified reference materials.",276604960
201902,502,United States,3823,Industrial monocarboxylic fatty acids; acid oils from refining;industrial fatty alcohols.,2466856
201902,502,United States,3824,"Prepared binders for foundry moulds or cores; chemical products and preparations for the chemical or allied industries, incl. mixtures of natural products, n.e.s.",328258882
201902,502,United States,3826,"Biodiesel and mixtures thereof, not containing or containing less than 70% by weight of petroleum oils or oils obtained from bituminous minerals.",2287880
201902,502,United States,3901,"Polymers of ethylene, in primary forms.",317152497
201902,502,United States,3902,"Polymers of propylene or of other olefins, in primary forms.",49392438
201902,502,United States,3903,"Polymers of styrene, in primary forms.",49800666
201902,502,United States,3904,"Polymers of vinyl chloride or of other halogenated olefins, in primary forms.",198696253
201902,502,United States,3905,"Polymers of vinyl acetate or of other vinyl esters, in primary forms; other vinyl polymers in primary forms.",43297097
201902,502,United States,3906,crylic polymers in primary forms.,52047894
201902,502,United States,3907,"Polyacetals, other polyethers and epoxide resins, in primary forms; polycarbonates, alkyd resins, polyallyl esters and other polyesters, in primary forms.",428038739
201902,502,United States,3908,Polyamides in primary forms.,181446652
201902,502,United States,3909,"minoresins, phenolic resins and polyurethanes, in primary forms.",25699015
201902,502,United States,3910,Silicones in primary forms.,71266949
201902,502,United States,3911,"etroleum resins, coumaroneindene resins, polyterpenes, polysulphides, polysulphones and other products specified in Note 3 to this Chapter, not elsewhere specified or included, in primary forms.",71971024
201902,502,United States,3912,"Cellulose and its chemical derivatives, not elsewhere specified or included, in primary forms.",92612995
201902,502,United States,3913,"Natural polymers (for example, alginic acid) and modified natural polymers (for example, hardened proteins, chemical derivatives of natural rubber), not elsewhere specified or included, in primary forms.",8266943
201902,502,United States,3914,"Ionexchangers based on polymers of headings 39.01 to 39.13, in primary forms.",7072773
201902,502,United States,3915,"Waste, parings and scrap, of plastics.",117978
201902,502,United States,3916,"Monofilament of which any crosssectional dimension exceeds 1 mm, rods, sticks and profile shapes, whether or not surfac worked but not otherwise worked, of plastics.",4255529
201902,502,United States,3917,"Tubes, pipes and hoses, and fittings therefor (for example, joints,elbows, flanges), of plastics.",68204377
201902,502,United States,3918,"Floor coverings of plastics, whether or not selfadhesive, in rolls or in the form of tiles; wall or ceiling coverings of plastics, as defined in Note 9 to this Chapter.",9423198
201902,502,United States,3919,"Selfadhesive plates, sheets, film, foil, tape, strip and other flat shapes, of plastics, whether or not in rolls.",193229295
201902,502,United States,3920,"Other plates, sheets, film, foil and strip, of plastics, noncellular and not reinforced, laminated, supported or similarly combined with other materials.",304193681
201902,502,United States,3921,"Other plates, sheets, film, foil and strip, of plastics.",96522455
201902,502,United States,3922,"Baths, showerbaths, sinks, washbasins, bidets, lavatory pans, seats and covers, flushing cisterns and similar sanitary ware, of plastics.",586599
201902,502,United States,3923,"Articles for the conveyance or packing of goods, of plastics; stoppers, lids, caps and other closures, of plastics.",47647706
201902,502,United States,3924,"Tableware, kitchenware, other household articles and hygienic or toilet articles, of plastics.",2581658
201902,502,United States,3925,"Builders' ware of plastics, not elsewhere specified or included.",3571008
201902,502,United States,3926,Other articles of plastics and articles of other materials of headings 39.01 to 39.14.,215752126
201902,502,United States,4002,"Synthetic rubber and factice derived from oils, in primary forms or in plates, sheets or strip; mixtures of any product of heading 40.01 with any product of this heading, in primary forms or in plates, sheets or strip.",120127652
201902,502,United States,4003,"Reclaimed rubber in primary forms or in plates, sheets or strip.",764178
201902,502,United States,4005,"ompounded rubber, unvulcanised, in primary forms or in plates, sheets or strip.",9123655
201902,502,United States,4006,"Other forms (for example, rods, tubes and profile shapes) and articles (for example, discs and rings), of unvulcanised rubber.",2201362
201902,502,United States,4007,Vulcanised rubber thread and cord.,353742
201902,502,United States,4008,"lates, sheets, strip, rods and profile shapes, of vulcanised rubber other than hard rubber.",9596730
201902,502,United States,4009,"Tubes, pipes and hoses, of vulcanised rubber other than hard rubber, with or without their fittings (for example, joints, elbows, flanges).",35152602
201902,502,United States,4010,"Conveyor or transmission belts or belting, of vulcanised rubber.",5507299
201902,502,United States,4011,"New pneumatic tyres, of rubber.",13700553
201902,502,United States,4012,"Retreaded or used pneumatic tyres of rubber; solid or cushion tyres, tyre treads and tyre flaps, of rubber.",9549313
201902,502,United States,4013,"Inner tubes, of rubber.",21469
201902,502,United States,4014,"Hygienic or pharmaceutical articles (including teats), of vulcanised rubber other than hard rubber, with or without fittings of hard rubber.",276233
201902,502,United States,4015,"Articles of apparel and clothing accessories (including gloves, mittens and mitts), for all purposes, of vulcanised rubber other than hard rubber.",1705687
201902,502,United States,4016,Other articles of vulcanised rubber other than hard rubber.,114871210
201902,502,United States,4017,"Hard rubber (for example, ebonite) in all forms, including waste and scrap; articles of hard rubber.",600963
201902,502,United States,4101,"Raw hides and skins of bovine (including buffalo) or equine animals (fresh, or salted, dried, limed, pickled or otherwise preserved, but not tanned, parchmentdressed or further prepared), whether or not dehaired or split.",270984306
201902,502,United States,4102,"Raw skins of sheep or lambs (fresh, or salted, dried, limed, pickled or otherwise preserved, but not tanned, parchment dressed or further prepared), whether or not with wool on or split, other than those excluded by Note 1 (c) to this Chapter.",2778180
201902,502,United States,4103,"Other raw hides and skins (fresh, or salted, dried, limed, pickled or otherwise preserved, but not tanned, parchmentdressed or further prepared), whether or not dehaired or split, other thanthose excluded by Note 1 (b) or 1 (c) to this Chapter.",1562178
201902,502,United States,4104,"Tanned or crust hides and skins of bovine (including buffalo) or equine animals, without hair on, whether or not split, but not further prepared.",21769548
201902,502,United States,4107,"Leather further prepared after tanning or crusting, including parchmentdressed leather, of bovine (including buffalo) or equine animals, without hair on, whether or not split, other than leather of heading 41.14.",9280538
201902,502,United States,4112,"Leather further prepared after tanning or crusting, including parchmentdressed leather, of sheep or lamb, without wool on, whether or not split, other than leather of heading 41.14.",29804
201902,502,United States,4113,"Leather further prepared after tanning or crusting, including parchmentdressed leather, of other animals, without wool or hair on, whether or not split, other than leather of heading 41.14.",163036
201902,502,United States,4114,Chamois (including combination chamois) leather; patentleather and patent laminated leather; metallised leather.,506018
201902,502,United States,4115,"Composition leather with a basis of leather or leather fibre, in slabs, sheets or strip, whether or not in rolls; parings and other waste of leather or of composition leather, not suitable for the manufacture of leather articles; leather dust, powder and flour.",112201
201902,502,United States,4201,"Saddlery and harness for any animal, incl. traces, leads, knee pads, muzzles, saddle cloths, saddlebags, dog coats and the like, of any material",222847
201902,502,United States,4202,"Trunks, suitcases, vanitycases, executivecases, briefcases, school satchels, spectacle cases, binocular cases, camera cases, musical instrument cases, gun cases, holsters and similar containers; travellingbags, insulated food or beverages bags, toilet bags, rucksacks, handbags, shoppingbags, wallets, purses, mapcases, cigarettecases, tobaccopouches, tool bags, sports bags, bottlecases, jewellery boxes, powderboxes, cutlery cases and similar containers, of leather or of composition leather, of sheeting of plastics, of textile materials, of vulcanised fibre or of paperboard, or wholly or mainly covered with such materials or with paper.",34458066
201902,502,United States,4203,"Articles of apparel and clothing accessories, of leather or of composition leather.",1994406
201902,502,United States,4205,Other articles of leather or of composition leather.,925297
201902,502,United States,4301,"Raw furskins, incl. heads, tails, paws and other pieces or cuttings suitable for use in furriery (excluding raw hides and skins of heading 4101, 4102 or 4103)",66939
201902,502,United States,4303,"rticles of apparel, clothing accessories and other articles of furskin.",17208
201902,502,United States,4304,Artificial fur and articles thereof.,189
201902,502,United States,4401,"Fuel wood, in logs, billets, twigs, faggots or similar forms; wood in chips or particles; sawdust and wood waste and scrap, whether or not agglomerated in logs, briquettes, pellets or similar forms",206902
201902,502,United States,4402,"Wood charcoal (including shell or nut charcoal), whether or notagglomerated.",100995
201902,502,United States,4403,"Wood in the rough, whether or not stripped of bark or sapwood,or roughly squared.",283599099
201902,502,United States,4404,"Hoopwood; split poles; piles, pickets and stakes of wood, pointed but not sawn lengthwise; wooden sticks, roughly trimmed but not turned, bent or otherwise worked, suitable for the manufacture of walkingsticks,umbrellas, tool handles or the like; chipwood and the like.",98472
201902,502,United States,4407,"Wood sawn or chipped lengthwise, sliced or peeled, whether or not planed, sanded or endjointed, of a thickness exceeding 6 mm.",290029042
201902,502,United States,4408,"Sheets for veneering, incl. those obtained by slicing laminated wood, for plywood or for other similar laminated wood and other wood, sawn lengthwise, sliced or peeled, whether or not planed, sanded, spliced or end-jointed, of a thickness of ≤ 6 mm",1102843
201902,502,United States,4409,"Wood, incl. strips and friezes for parquet flooring, not assembled, continuously shaped ""tongued, grooved, rebated, chamfered, V-jointed beaded, moulded, rounded or the like"" along any of its edges, ends or faces, whether or not planed, sanded or end-jointed",438290
201902,502,United States,4410,"Particle board, oriented strand board (OSB) and similar board (for example, waferboard) of wood or other ligneous materials, whether or not agglomerated with resins or other organic binding substances.",45537
201902,502,United States,4411,"Fibreboard of wood or other ligneous materials, whether or not bonded with resins or other organic substances.",412486
201902,502,United States,4412,"Plywood, veneered panels and similar laminated wood.",586682
201902,502,United States,4414,"Wooden frames for paintings, photographs, mirrors or similar objects.",5514
201902,502,United States,4415,"Packing cases, boxes, crates, drums and similar packings, of wood; cabledrums of wood; pallets, box pallets and other load boards,of wood; pallet collars of wood.",181526
201902,502,United States,4418,"Builders' joinery and carpentry of wood, including cellular wood panels, assembled flooring panels, shingles and shakes.",62452
201902,502,United States,4419,"Tableware and kitchenware, of wood.",63719
201902,502,United States,4420,"Wood marquetry and inlaid wood; caskets and cases for jewellery or cutlery, and similar articles, of wood; statuettes and other ornaments, of wood; wooden articles of furniture (excluding furniture, lighting fixtures and parts thereof)",26497
201902,502,United States,4421,Other articles of wood.,137620
201902,502,United States,4503,Articles of natural cork.,16584
201902,502,United States,4504,"Agglomerated cork, with or without a binding substance, and articles of agglomerated cork",58784
201902,502,United States,4601,"Plaits and similar products of plaiting materials, whether or not assembled into strips; plaiting materials, plaits and similar products of plaiting materials, bound together in parallel strands or woven, in sheet form, whether or not being finished articles (for example, mats, matting, screens).",22025
201902,502,United States,4602,"Basketwork, wickerwork and other articles, made directly to shape from plaiting materials or made up from goods of heading 46.01; articles of loofah.",17985
201902,502,United States,4702,"Chemical wood pulp, dissolving grades.",125955034
201902,502,United States,4703,"Chemical wood pulp, soda or sulphate, other than dissolving grades.",333811715
201902,502,United States,4706,"Pulps of fibres derived from recovered ""waste and scrap"" paper or paperboard or of other fibrous cellulosic material",7091498
201902,502,United States,4707,ecovered (waste and scrap) paper or paperboard.,545177650
201902,502,United States,4802,"Uncoated paper and paperboard, of a kind used for writing, printing or other graphic purposes, and non perforated punchcards and punch tape paper, in rolls or rectangular (including square) sheets, of any size, other than paper of heading 48.01 or 48.03; handmade paper and paperboard.",4023676
201902,502,United States,4803,"Toilet or facial tissue stock, towel or napkin stock and similar paper of a kind used for household or sanitary purposes, cellulose wadding and webs of cellulose fibres, whether or not creped, crinkled, embossed, perforated, surfacecoloured, surface decorated or printed, in rolls or sheets.",992598
201902,502,United States,4804,"Uncoated kraft paper and paperboard, in rolls or sheets, other than that of heading 48.02 or 48.03.",109845765
201902,502,United States,4805,"Other uncoated paper and paperboard, in rolls or sheets, not further worked or processed than as specified in Note 3 to this Chapter.",10386111
201902,502,United States,4806,"vegetable parchment, greaseproof papers, tracing papers and glassine and other glazed transparent or translucent papers, in rolls or sheets.",10199108
201902,502,United States,4807,"Composite paper and paperboard (made by sticking flat layers of paper or paperboard together with an adhesive), not surface coated or impregnated, whether or not internally reinforced, in rolls or sheets.",377894
201902,502,United States,4808,"Paper and paperboard, corrugated (with or without glued flat surface sheets), creped, crinkled, embossed or perforated, in rolls or sheets, other than paper of the kind described in heading 48.03.",2932998
201902,502,United States,4809,"Carbon paper, selfcopy paper and other copying or transfer papers (including coated or impregnated paper for duplicator stencils or offset plates), whether or not printed, in rolls or sheets.",910368
201902,502,United States,4810,"Paper and paperboard, coated on one or both sides with kaolin (China clay) or other inorganic substances, with or without a binder, and with no other coating, whether or not surface coloured, surfacedecorated or printed, in rolls or rectangular (including square) sheets, of any size.",57525992
201902,502,United States,4811,"Paper, paperboard, cellulose wadding and webs of cellulose fibres,coated,impregnated,covered, surfacecoloured, surface decorated or printed, in rolls or rectangular (including square) sheets, of any size, other than goods of the kind described in heading 48.03, 48.09 or 48.10.",52051936
201902,502,United States,4812,"Filter blocks, slabs and plates, of paper pulp.",83927
201902,502,United States,4814,Wallpaper and similar wall coverings; window transparencies of paper.,1431315
201902,502,United States,4816,"Carbon paper, self-copy paper and other copying or transfer papers, in rolls of a width of ≤ 36 cm or in rectangular or square sheets with no side measuring > 36 cm in the unfolded state, or cut into shapes other than rectangles or squares, together with full duplicator stencils and offset plates of paper, whether or not in boxes",2936311
201902,502,United States,4817,"Envelopes, letter cards, plain postcards and correspondence cards, of paper or paperboard; boxes, pouches, wallets and writing compendiums, of paper or paperboard, containing an assortment of paper stationery.",211013
201902,502,United States,4818,"Toilet paper and similar paper, cellulose wadding or webs of cellulose fibres, of a kind used for household or sanitary purposes, in rolls of a width ≤ 36 cm, or cut to size or shape; handkerchiefs, cleansing tissues, towels, tablecloths, serviettes, bedsheets and similar household, sanitary or hospital articles, articles of apparel and clothing accessories, of paper pulp, paper, cellulose wadding or webs of cellulose fibres",4996386
201902,502,United States,4819,"Cartons, boxes, cases, bags and other packing containers, of paper, paperboard, cellulose wadding or webs of cellulose fibres, n.e.s.; box files, letter trays, and similar articles, of paperboard of a kind used in offices, shops or the like",5209948
201902,502,United States,4820,"Registers, account books, note books, order books, receipt books, letter pads, memorandum pads,diaries and similar articles, exercise books, blottingpads, binders (looseleaf or other), folders, file covers, manifold business forms, interleaved carbon sets and other articles of stationery, of paper or paperboard; albums for samples or for collections and book covers, of paper or paperboard.",791907
201902,502,United States,4821,"paper or paperboard labels of all kinds, whether or not printed.",7463733
201902,502,United States,4822,"Bobbins, spools, cops and similar supports of paper pulp, paper or paperboard (whether or not perforated or hardened).",46653
201902,502,United States,4823,"Other paper, paperboard, cellulose wadding and webs of cellulose fibres, cut to size or shape; other articles of paper pulp, paper,paperboard, cellulose wadding or webs of cellulose fibres.",6075819
201902,502,United States,4901,"Printed books, brochures, leaflets and similar printed matter, whether or not in single sheets.",32838799
201902,502,United States,4902,"Newspapers, journals and periodicals, whether or not illustrated or containing advertising material.",11937927
201902,502,United States,4903,"Children's picture, drawing or colouring books.",947306
201902,502,United States,4904,"Music, printed or in manuscript, whether or not bound or illustrated",212882
201902,502,United States,4905,"Maps and hydrographic or similar charts of all kinds, including atlases, wall maps, topographical plans and globes, printed.",367074
201902,502,United States,4907,"Unused postage, revenue or similar stamps of current or new issue in the country in which they have, or will have, a recognised face value; stamp-impressed paper; banknotes; cheque forms; stock, share or bond certificates and similar documents of title",431537876
201902,502,United States,4908,Transfers (decalcomanias),1590577
201902,502,United States,4909,"Printed or illustrated postcards; printed cards bearing personal greetings, messages or announcements, whether or not illustrated, with or without envelopes or trimmings.",193759
201902,502,United States,4910,"Calendars of any kind, printed, including calendar blocks.",23131
201902,502,United States,4911,"Other printed matter, including printed pictures and photographs.",9830643
201902,502,United States,5004,Silk yarn (other than yarn spun from silk waste) not put up for retail sale.,6980
201902,502,United States,5101,"Wool, not carded or combed.",616639
201902,502,United States,5103,"Waste of wool or of fine or coarse animal hair, including yarn waste but excluding garnetted stock.",348093
201902,502,United States,5106,"Yarn of carded wool, not put up for retail sale.",430
201902,502,United States,5109,"Yarn of wool or of fine animal hair, put up for retail sale.",44158
201902,502,United States,5111,Woven fabrics of carded wool or of carded fine animal hair.,161499
201902,502,United States,5112,Woven fabrics of combed wool or of combed fine animal hair.,55669
201902,502,United States,5201,"Cotton, not carded or combed.",309591997
201902,502,United States,5204,"Cotton sewing thread, whether or not put up for retail sale.",13041
201902,502,United States,5205,"Cotton yarn (other than sewing thread), containing 85% or more by weight of cotton, not put up for retail sale.",4148767
201902,502,United States,5208,"Woven fabrics of cotton, containing 85% or more by weight of cotton, weighing not more than 200 g/m2",182861
201902,502,United States,5209,"Woven fabrics of cotton, containing 85% or more by weight of cotton, weighing more than 200 g/m2",766250
201902,502,United States,5211,"Woven fabrics of cotton, containing less than 85% by weight of cotton, mixed mainly or solely with manmade fibres, weighing more than 200 g/m2.",110487
201902,502,United States,5212,Other woven fabrics of cotton.,14147
201902,502,United States,5309,Woven fabrics of flax.,94962
201902,502,United States,5310,Woven fabrics of jute or of other textile bast fibres of heading 5303,7289
201902,502,United States,5401,"Sewing thread of manmade filaments, whether or not put up for retail sale.",993316
201902,502,United States,5402,"Synthetic filament yarn (other than sewing thread), not put up for retail sale, including synthetic monofilament of less than 67 decitex.",28602285
201902,502,United States,5403,"Artificial filament yarn (other than sewing thread), not put up for retail sale, including artificial monofilament of less than 67 decitex.",9446087
201902,502,United States,5404,"Synthetic monofilament of 67 decitex or more and of which no crosssectional dimension exceeds 1 mm; strip and the like (for example, artificial straw) of synthetic textile materials of an apparent width not exceeding 5 mm.",6805730
201902,502,United States,5407,"Woven fabrics of synthetic filament yarn, including woven fabrics obtained from materials of heading 54.04.",3426975
201902,502,United States,5408,"Woven fabrics of artificial filament yarn, including woven fabrics obtained from materials of heading 54.05.",154780
201902,502,United States,5503,"Synthetic staple fibres, not carded, combed or otherwise processed for spinning.",9103310
201902,502,United States,5504,"Artificial staple fibres, not carded, combed or otherwise processed for spinning.",802470
201902,502,United States,5506,"Synthetic staple fibres, carded, combed or otherwise processed for spinning.",52688
201902,502,United States,5508,"Sewing thread of manmade staple fibres, whether or not put up for retail sale.",197080
201902,502,United States,5509,"Yarn (other than sewing thread) of synthetic staple fibres, not put up for retail sale.",1755950
201902,502,United States,5510,"Yarn (other than sewing thread) of artificial staple fibres, not put up for retail sale.",125123
201902,502,United States,5512,"Woven fabrics of synthetic staple fibres, containing 85% or more by weight of synthetic staple fibres.",5752847
201902,502,United States,5513,"Woven fabrics of synthetic staple fibres, containing less than 85% by weight of such fibres, mixed mainly or solely with cotton, of a weight not exceeding 170 g/m2.",9137
201902,502,United States,5514,"Woven fabrics of synthetic staple fibres, containing less than 85% by weight of such fibres, mixed mainly or solely with cotton, of a weight exceeding 170g/m2.",51475
