"Date of data","Trading partner code","Trading partner","Commodity code","Commodity","US dollar",
"202505","502","United States","8211","Knives with cutting blades, serrated or not (including pruning knives), other than knives of heading 82.08, and blades therefor.","28,332,660",
"202505","502","United States","8212","Razors and razor blades (including razor blade blanks in strips).","8,039,937",
"202505","502","United States","8213","Scissors, tailors' shears and similar shears, and blades therefor.","12,806,417",
"202505","502","United States","8214","Other articles of cutlery (for example, hair clippers, butchers' or kitchen cleavers, choppers and mincing knives, paper knives); manicure or pedicure sets and instruments (including nail files).","12,014,091",
"202505","502","United States","8215","Spoons, forks, ladles, skimmers, cakeservers, fishknives, butterknives, sugar tongs and similar kitchen or tableware.","29,951,822",
"202505","502","United States","8301","Padlocks and locks (key, combination or electrically operated), of 
base metal; clasps and frames with clasps, incorporating locks, of 
base metal; keys for any of the foregoing articles, of base metal","66,547,970",
"202505","502","United States","8302","Base metal mountings, fittings and similar articles suitable for 
furniture, doors, staircases, windows, blinds, coachwork, 
saddlery, trunks, chests, caskets or the like; base metal hatracks, 
hatpegs, brackets and similar fixtures; castors with mountings of 
base metal; automatic door closers of base metal","154,635,340",
"202505","502","United States","8303","Armoured or reinforced safes, strongboxes and doors and safe 
deposit lockers for strongrooms, cash or deed boxes and the like, 
of base metal","13,745,030",
"202505","502","United States","8304","Filing cabinets, cardindex cabinets, paper trays, paper rests, pen 
trays, officestamp stands and similar office or desk equipment, 
of base metal, other than office furniture of heading 9403","6,109,848",
"202505","502","United States","8305","Fittings for looseleaf binders or files, letter clips, letter corners, 
paper clips, indexing tags and similar office articles, of base 
metal; staples in strips (for example, for offices, upholstery, 
packaging), of base metal","5,318,316",
"202505","502","United States","8306","Bells, gongs and the like, nonelectric, of base metal; statuettes 
and other ornaments, of base metal; photograph, picture or 
similar frames, of base metal; mirrors of base metal","35,831,817",
"202505","502","United States","8307","Flexible tubing of base metal, with or without fittings","7,370,860",
"202505","502","United States","8308","Clasps, frames with clasps, buckles, buckleclasps, hooks, eyes, eyelets and the like, of base metal, of a kind used for clothing or clothing accessories, footwear, jewellery, wristwatches, books, awnings, leather goods, travel goods or saddlery or for other made up articles; tubular or bifurcated rivets, of base metal; beads and spangles, of base metal","7,071,882",
"202505","502","United States","8309","Stoppers, caps and lids (including crown corks, screw caps and 
pouring stoppers), capsules for bottles, threaded bungs, bung 
covers, seals and other packing accessories, of base metal","11,276,954",
"202505","502","United States","8310","Signplates, nameplates, addressplates and similar plates, numbers, letters and other symbols, of base metal, excluding 
those of heading 9405","6,962,183",
"202505","502","United States","8311","Wire, rods, tubes, plates, electrodes and similar products, of base 
metal or of metal carbides, coated or cored with flux material, of 
a kind used for soldering, brazing, welding or deposition of metal 
or of metal carbides; wire and rods, of agglomerated base metal 
powder, used for metal spraying","1,373,337",
"202505","502","United States","8402","Steam or other vapour generating boilers (other than central heating hot water boilers capable also of producing low pressure steam); superheated water boilers.","1,137,444",
"202505","502","United States","8403","Central heating boilers other than those of heading 8402.","2,263,478",
"202505","502","United States","8404","Auxiliary plant for use with boilers of heading 84.02 or 84.03 (for example, economisers, superheaters, soot removers, gas recoverers); condensers for steam or other vapour power units.","60,593",
"202505","502","United States","8405","Producer gas or water gas generators, with or without their purifiers; acetylene gas generators and similar water process gas generators, with or without their purifiers.","43,893",
"202505","502","United States","8406","Steam turbines and other vapour turbines.","2,284,504",
"202505","502","United States","8407","Sparkignition reciprocating or rotary internal combustion piston engines.","11,062,016",
"202505","502","United States","8408","Compressionignition internal combustion piston engines (diesel or semidiesel engines).","8,878,787",
"202505","502","United States","8409","Parts suitable for use solely or principally with the engines of heading 84.07 or 84.08.","145,430,294",
"202505","502","United States","8410","Hydraulic turbines, water wheels, and regulators therefor.","97,685",
"202505","502","United States","8411","Turbojets, turbopropellers and other gas turbines.","63,947,318",
"202505","502","United States","8412","Other engines and motors.","55,831,059",
"202505","502","United States","8413","Pumps for liquids, whether or not fitted with a measuring device; liquid elevators.","131,394,691",
"202505","502","United States","8414","Air or vacuum pumps, air or other gas compressors and fans; ventilating or recycling hoods incorporating a fan, whether or not fitted with filters, gas-tight biological safety cabinets, whether or not fitted with filters.","296,378,236",
"202505","502","United States","8415","Air conditioning machines, comprising a motordriven fan and elements for changing the temperature and humidity, including those machines in which the humidity cannot be separately regulated.","153,507,262",
"202505","502","United States","8416","Furnace burners for liquid fuel, for pulverised solid fuel or for gas; mechanical stokers, including their mechanical grates,mechanical ash dischargers and similar appliances.","898,055",
"202505","502","United States","8417","Industrial or laboratory furnaces and ovens, including incinerators, nonelectric.","2,493,741",
"202505","502","United States","8418","Refrigerators, freezers and other refrigerating or freezing equipment, electric or other; heat pumps other than air conditioning machines of heading 84.15.","153,524,109",
"202505","502","United States","8419","Machinery, plant or laboratory equipment, whether or not electrically heated (excluding furnaces, ovens and other equipment of heading 85.14), for the treatment of materials by a process involving a change of temperature such as heating, cooking, roasting, distilling, rectifying, sterilising, pasteurising, other than machinery or plant of a kind used for domestic purposes; instantaneous or storage water heaters, nonelectric.","93,183,774",
"202505","502","United States","8420","Calendering or other rolling machines, other than for metals or glass, and cylinders therefor.","515,471",
"202505","502","United States","8421","Centrifuges, including centrifugal dryers; filtering or purifying machinery and apparatus, for liquids or gases.","155,820,381",
"202505","502","United States","8422","Dish washing machines; machinery for cleaning or drying bottles or other containers; machinery for filling, closing, sealing or labelling bottles, cans, boxes, bags or other containers; machinery for capsuling bottles, jars, tubes and similar containers; other packing or wrapping machinery (including heatshrink wrapping machinery); machinery for aerating beverages.","22,863,269",
"202505","502","United States","8423","Weighing machinery (excluding balances of a sensitivity of 5 cg or better), including weight operated counting or checking machines; weighing machine weights of all kinds.","21,026,356",
"202505","502","United States","8424","Mechanical appliances (whether or not handoperated) for projecting, dispersing or spraying liquids or powders; fire extinguishers, whether or not charged; spray guns and similar appliances; steam or sand blasting machines and similar jet projecting machines.","86,274,436",
"202505","502","United States","8425","Pulley tackle and hoists other than skip hoists; winches and capstans; jacks.","40,495,264",
"202505","502","United States","8426","Ships' derricks; cranes, including cable cranes; mobile lifting frames, straddle carriers and works trucks fitted with a crane.","668,754",
"202505","502","United States","8427","Forklift trucks; other works trucks fitted with lifting or handling equipment.","29,106,325",
"202505","502","United States","8428","Other lifting, handling, loading or unloading machinery (for example, lifts, escalators, conveyors, teleferics).","28,891,435",
"202505","502","United States","8429","Self-propelled bulldozers, angledozers, graders, levellers, machines and road rollers.","22,874,992",
"202505","502","United States","8430","Other moving, grading, levelling, scraping, excavating, tamping, compacting, extracting or boring machinery, for earth, minerals or ores; piledrivers and pileextractors; snowploughs and snowblowers.","6,098,063",
"202505","502","United States","8431","Parts suitable for use solely or principally with the machinery of headings 84.25 to 84.30.","147,974,757",
"202505","502","United States","8432","Agricultural, horticultural or forestry machinery for soil preparation or cultivation; lawn or sportsground rollers.","12,291,381",
"202505","502","United States","8433","Harvesting or threshing machinery, including straw or fodder balers; grass or hay mowers; machines for cleaning, sorting or grading eggs, fruit or other agricultural produce, other than machinery of heading 84.37.","43,671,631",
"202505","502","United States","8434","Milking machines and dairy machinery.","477,890",
"202505","502","United States","8435","Presses, crushers and similar machinery used in the manufacture of wine, cider, fruit juices or similar beverages.","700,333",
"202505","502","United States","8436","Other agricultural, horticultural, forestry, poultrykeeping or beekeeping machinery, including germination plant fitted with mechanical or thermal equipment; poultry incubators and brooders.","10,525,358",
"202505","502","United States","8437","Machines for cleaning, sorting or grading seed, grain or dried leguminous vegetables; machinery used in the milling industry or for the working of cereals or dried leguminous vegetables, other than farmtype machinery.","1,470,850",
"202505","502","United States","8438","Machinery, not specified or included elsewhere in this Chapter, for the industrial preparation or manufacture of food or drink, other than machinery for the extraction or preparation of animal or fixed vegetable fats or microbial fats or oils.","11,978,703",
"202505","502","United States","8439","Machinery for making pulp of fibrous cellulosic material or for making or finishing paper or paperboard.","3,623,572",
"202505","502","United States","8440","Bookbinding machinery, including booksewing machines.","346,458",
"202505","502","United States","8441","Other machinery for making up paper pulp, paper or paperboard, including cutting machines of all kinds.","5,631,160",
"202505","502","United States","8442","Machinery, apparatus and equipment (other than the machines of headings 84.56 to 84.65) for preparing or making plates, cylinders or other printing components; plates, cylinders and other printing components; plates, cylinders and lithographic stones, prepared for printing purposes (for example, planed, grained or polished).","700,704",
"202505","502","United States","8443","Printing machinery used for printing by means of plates, cylinders and other printing components of heading 84.42; other printers, copying machines and facsimile machines,whether or not combined; parts and accessories thereof.","100,320,075",
"202505","502","United States","8444","Machines for extruding, drawing, texturing or cutting man-made textile materials","128,046",
"202505","502","United States","8445","Machines for preparing textile fibres; spinning, doubling or twisting machines and other machinery for producing textile yarns; textile reeling or winding (including weftwinding) machines and machines for preparing textile yarns for use on the machines of heading 84.46 or 84.47.","69,831",
"202505","502","United States","8446","Weaving machines (looms)","132,358",
"202505","502","United States","8447","Knitting machines, stitchbonding machines and machines for making gimped yarn, tulle, lace, embroidery, trimmings, braid or net and machines for tufting.","3,546,622",
"202505","502","United States","8448","Auxiliary machinery for use with machines of heading 84.44, 84.45, 84.46 or 84.47 (for example, dobbies, Jacquards, automatic stop motions, shuttle changing mechanisms); parts and accessories suitable for use solely or principally with the machines of this heading or of heading 84.44, 84.45, 84.46 or 84.47 (for example, spindles and spindle flyers, card clothing, combs, extruding nipples, shuttles, healds and healdframes, hosiery needles).","2,154,014",
"202505","502","United States","8449","Machinery for the manufacture or finishing of felt or 84.49 nonwovens in the piece or in shapes, including machinery for making felt hats; blocks for making hats.","482,131",
"202505","502","United States","8450","Household or laundrytype washing machines, including machines which both wash and dry.","12,649,379",
"202505","502","United States","8451","Machinery (other than machines of heading 84.50) for washing, cleaning, wringing, drying, ironing, pressing (including fusing presses), bleaching, dyeing, dressing, finishing, coating or impregnating textile yarns, fabrics or made up textile articles and machines for applying the paste to the base fabric or other support used in the manufacture of floor coverings such as linoleum; machines for reeling, unreeling, folding, cutting or pinking textile fabrics.","6,452,163",
"202505","502","United States","8452","Sewing machines, other than booksewing machines of heading 84.40; furniture, bases and covers specially designed for sewing machines; sewing machine needles.","4,191,783",
"202505","502","United States","8453","Machinery for preparing, tanning or working hides, skins or leather or for making or repairing footwear or other articles of hides, skins or leather, other than sewing machines.","1,328,601",
"202505","502","United States","8454","Converters, ladles, ingot moulds and casting machines, of a kind used in metallurgy or in metal foundries.","1,474,377",
"202505","502","United States","8455","Metalrolling mills and rolls therefor.","3,838,052",
"202505","502","United States","8456","Machine tools for working any material by removal of material, by laser or other light or photon beam, ultrasonic, electrodischarge, electrochemical, electron beam, ionicbeam or plasma arc processes; waterjet cutting machines.","15,593,026",
"202505","502","United States","8457","Machining centres, unit construction machines (single station) and multistation transfer machines, for working metal.","17,111",
"202505","502","United States","8458","Lathes (including turning centres) for removing metal.","649,065",
"202505","502","United States","8459","Machinetools (including waytype unit head machines) for drilling, boring, milling, threading or tapping by removing metal, other than lathes (including turning centres) of heading 84.58.","1,529,952",
"202505","502","United States","8460","Machinetools for deburring, sharpening, grinding, honing, lapping, polishing or otherwise finishing metal or cermets by means of grinding stones, abrasives or polishing products, other heading 84.61.","1,769,384",
"202505","502","United States","8461","Machinetools for planing, shaping, slotting, broaching, gear cutting, gear grinding or gear finishing, sawing, cuttingoff and other machinetools working by removing metal or cermets, not elsewhere specified or included.","2,227,122",
"202505","502","United States","8462","Machine-tools (including presses) for working metal by forging, hammering or die forging (excluding rolling mills); machine-tools (including presses, slitting lines and cut-to-length lines) for working metal by bending, folding, straightening, flattening, shearing, punching, notching or nibbling (excluding draw-benches); presses for working metal or metal carbides, not specified above.","2,745,340",
"202505","502","United States","8463","Other machinetools for working metal or cermets, without removing material.","579,213",
"202505","502","United States","8464","Machinetools for working stone, ceramics, concrete, asbestoscement or like mineral materials or for cold working glass.","3,073,114",
"202505","502","United States","8465","Machinetools (including machines for nailing, stapling, glueing or otherwise assembling) for working wood, cork, bone, hard rubber, hard plastics or similar hard materials.","13,001,896",
"202505","502","United States","8466","Parts and accessories suitable for use solely or principally with the machines of headings 84.56 to 84.65, including work or tool holders, selfopening dieheads, dividing heads and other special attachments for the machines; tool holders for any type of tool for working in the hand.","9,067,927",
"202505","502","United States","8467","Tools for working in the hand, pneumatic, hydraulic or with selfcontained electric or nonelectric motor.","143,474,682",
"202505","502","United States","8468","Machinery and apparatus for soldering, brazing or welding, whether or not capable of cutting, other than those of heading 85.15; gasoperated surface tempering machines and appliances.","5,446,595",
"202505","502","United States","8470","Calculating machines and pocketsize data recording, reproducing and displaying machines with calculating functions; accounting machines, postagefranking machines, ticketissuing machines and similar machines, incorporating a calculating device; cash registers.","13,834,169",
"202505","502","United States","8471","Automatic data processing machines and units thereof; magnetic or optical readers, machines for transcribing data onto data media in d form and machines for processing such data, not elsewhere specified or included.","2,098,242,173",
"202505","502","United States","8472","Other office machines (for example, hectograph or stencil duplicating machines, addressing machines, automatic banknote dispensers, coinsorting machines, coincounting or wrapping machines, pencilsharpening machines, perforating or stapling machines).","10,579,242",
"202505","502","United States","8473","Parts and accessories (other than covers, carrying cases and the like) suitable for use solely or principally with machines of headings 84.70 to 84.72.","370,851,394",
"202505","502","United States","8474","Machinery for sorting, screening, separating, washing, crushing, grinding, mixing or kneading earth, stone, ores or other mineral substances, in solid (including powder or paste) form; machinery for agglomerating, shaping or moulding solid mineral fuels, ceramic paste, unhardened cements, plastering materials or other mineral products in powder or paste form; machines for forming foundry moulds of sand.","11,936,530",
"202505","502","United States","8475","Machines for assembling electric or electronic lamps, tubes or valves or flashbulbs, in glass envelopes; machines for manufacturing or hot working glass or glassware.","145,804",
"202505","502","United States","8476","Automatic goodsvending machines (for example, postage stamp, cigarette, food or beverage machines), including moneychanging machines.","4,479,220",
"202505","502","United States","8477","Machinery for working rubber or plastics or for the manufacture of products from these materials, not specified or included elsewhere in this Chapter.","13,760,586",
"202505","502","United States","8478","Machinery for preparing or making up tobacco, not specified or included elsewhere in this Chapter.","585",
"202505","502","United States","8479","Machines and mechanical appliances having individual functions, not specified or included elsewhere in this Chapter.","133,692,143",
"202505","502","United States","8480","Moulding boxes for metal foundry; mould bases; moulding patterns; moulds for metal (other than ingot moulds), metal carbides, glass, mineral materials, rubber or plastics.","40,332,409",
"202505","502","United States","8481","Taps, cocks, valves and similar appliances for pipes, boiler shells, tanks, vats or the like, including pressurereducing valves and thermostatically controlled valves.","262,769,796",
"202505","502","United States","8482","Ball or roller bearings.","38,545,236",
"202505","502","United States","8483","Transmission shafts (including cam shafts and crank shafts) and cranks; bearing housings and plain shaft bearings; gears and gearing; ball or roller screws; gear boxes and other speed changers, including torque converters; flywheels and pulleys, including pulley blocks; clutches and shaft couplings (including universal joints).","97,393,642",
"202505","502","United States","8484","Gaskets and similar joints of metal sheeting combined with other material or of two or more layers of metal; sets or assortments of gaskets and similar joints, dissimilar in composition, put up in pouches, envelopes or similar packings; mechanical seals.","8,485,365",
"202505","502","United States","8485","Machines for additive manufacturing.","48,496,091",
"202505","502","United States","8486","Machines and apparatus of a kind used solely or principally for the manufacture of semiconductor boules or wafers, semiconductor devices, electronic integrated circuits or flat panel displays; machines and apparatus specified in Note 11 (C) to this Chapter; parts and accessories.","31,895,176",
"202505","502","United States","8487","Machinery parts, not containing electrical connectors, insulators, coils, contacts or other electrical features, not specified or included elsewhere in this Chapter.","3,886,407",
"202505","502","United States","8501","Electric motors and generators (excluding generating sets).","117,161,079",
"202505","502","United States","8502","Electric generating sets and rotary converters.","15,485,483",
"202505","502","United States","8503","Parts suitable for use solely or principally with the machines of heading 85.01 or 85.02.","59,011,775",
"202505","502","United States","8504","Electrical transformers, static converters (for example, rectifiers) and inductors.","315,055,001",
"202505","502","United States","8505","Electromagnets; permanent magnets and articles intended to become permanent magnets after magnetisation; electromagnetic or permanent magnet chucks, clamps and similar holding devices; electromagnetic couplings, clutches and brakes; electromagnetic lifting heads.","12,556,181",
"202505","502","United States","8506","Primary cells and primary batteries.","21,817,849",
"202505","502","United States","8507","Electric accumulators, including separators therefor, whether or not rectangular (including square).","675,973,741",
"202505","502","United States","8508","Vacuum cleaners.","61,310,298",
"202505","502","United States","8509","Electromechanical domestic appliances, with selfcontained electric motor, other than vacuum cleaners of heading 85.08.","168,569,552",
"202505","502","United States","8510","Shavers, hair clippers and hairremoving appliances, with selfcontained electric motor.","29,658,936",
"202505","502","United States","8511","Electrical ignition or starting equipment of a kind used for sparkignition or compressionignition internal combustion engines (for example, ignition magnetos, magnetodynamos, ignition coils, sparking plugs and glow plugs, starter motors); generators (for example, dynamos, alternators) and cutouts of a kind used in conjunction with such engines.","50,651,493",
"202505","502","United States","8512","Electrical lighting or signalling equipment (excluding articles of heading 85.39), windscreen wipers, defrosters and demisters, of a kind used for cycles or motor vehicles.","83,162,294",
"202505","502","United States","8513","Portable electric lamps designed to function by their own source of energy (for example, dry batteries, accumulators, magnetos), other than lighting equipment of heading 85.12.","39,434,623",
"202505","502","United States","8514","Industrial or laboratory electric furnaces and ovens (including those functioning by induction or dielectric loss); other industrial or laboratory equipment for the heat treatment of materials by induction or dielectric loss.","7,245,939",
"202505","502","United States","8515","Electric (including electrically heated gas), laser or other light or photon beam, ultrasonic, electron beam, magnetic pulse or plasma arc soldering, brazing or welding machines and apparatus, whether or not capable of cutting; electric machines and apparatus for hot spraying of metals or cermets.","23,579,587",
"202505","502","United States","8516","Electric instantaneous or storage water heaters and immersion heaters; electric space heating apparatus and soil heating apparatus; electrothermic hairdressing apparatus (for example, hair dryers, hair curlers, curling tong heaters) and hand dryers; electric smoothing irons; other electrothermic appliances of a kind used for domestic purposes; electric heating resistors, other than those of heading 85.45.","298,281,042",
