"Date of data","Trading partner code","Trading partner","Commodity code","Commodity","US dollar",
"202505","502","United States","0106","Other live animals","450,390",
"202505","502","United States","0208","Other meat and edible meat offal, fresh, chilled or frozen","167,796",
"202505","502","United States","0301","Live fish","44,759",
"202505","502","United States","0302","Fish, fresh or chilled, excluding fish fillets and other fish meat of heading 0304","107,082",
"202505","502","United States","0303","Fish, frozen, excluding fish fillets and other fish meat of heading 0304","5,108,251",
"202505","502","United States","0304","Fish fillets and other fish meat (whether or not minced), fresh, chilled or frozen","33,225,128",
"202505","502","United States","0305","Fish, dried, salted or in brine; smoked fish, whether or not 
cooked before or during the smoking process","2,372,134",
"202505","502","United States","0306","Crustaceans, whether in shell or not, live, fresh, chilled, frozen, 
dried, salted or in brine; smoked crustaceans, whether in shell 
or not, whether or not cooked before or during the smoking 
process; crustaceans, in shell, cooked by steaming or by boiling 
in water, whether or not chilled, frozen, dried, salted or in 
brine","6,302,746",
"202505","502","United States","0307","Molluscs, whether in shell or not, live, fresh, chilled, frozen, 
dried, salted or in brine; smoked molluscs, whether in shell or 
not, whether or not cooked before or during the smoking 
process","19,385,309",
"202505","502","United States","0308","Aquatic invertebrates other than crustaceans and molluscs, live, 
fresh, chilled, frozen, dried, salted or in brine; smoked aquatic 
invertebrates other than crustaceans and molluscs, whether or 
not cooked before or during the smoking process","326,828",
"202505","502","United States","0402","Milk and cream, concentrated or containing added sugar or other sweetening matter","741",
"202505","502","United States","0403","Yogurt; buttermilk, curdled milk and cream, kephir and other fermented or acidified milk and cream, whether or not concentrated or containing added sugar or other sweetening matter or flavoured or containing added fruit, nuts or cocoa","65,097",
"202505","502","United States","0407","Birds' eggs, in shell, fresh, preserved or cooked","441,058",
"202505","502","United States","0408","Birds' eggs, not in shell, and egg yolks, fresh, dried, cooked by steaming or by boiling in water, moulded, frozen or otherwise preserved, whether or not containing added sugar or other sweetening matter","824,209",
"202505","502","United States","0409","atural honey","1,233",
"202505","502","United States","0410","Insects and other edible products of animal origin, not elsewhere specified or included","370,462",
"202505","502","United States","0502","Pigs', hogs' or boars' bristles and hair; badger hair and other brush making hair; waste of such bristles or hair","158,659",
"202505","502","United States","0504","Guts, bladders and stomachs of animals (other than fish), whole
and pieces thereof, fresh, chilled, frozen, salted, in brine, dried or
smoked","7,862,351",
"202505","502","United States","0505","Skins and other parts of birds, with their feathers or down, feathers and parts of feathers (whether or not with trimmed edges) and down, not further worked than cleaned, disinfected or treated for preservation;powder and waste of feathers or parts of feathers","333,180",
"202505","502","United States","0508","Coral and similar materials, unworked or simply prepared bunot otherwise worked; shells of molluscs, crustaceans or echinoderms and cuttlebone, unworked or simply prepared bunot cut to shape, powder and waste thereof","43,568",
"202505","502","United States","0511","Animal products not elsewhere specified or included; dead animals of Chapter 1 or 3, unfit for human consumption","4,259,631",
"202505","502","United States","0602","Other live plants (including their roots), cuttings and slips; mushroom spawn.","2,719,633",
"202505","502","United States","0603","Cut flowers and flower buds of a kind suitable for bouquets or for ornamental purposes, fresh, dried, dyed, bleached, impregnated or otherwise prepared.","487,498",
"202505","502","United States","0604","Foliage, branches and other parts of plants, without flowers or flower buds, and grasses, mosses and lichens, being goods of a kind suitable for bouquets or for ornamental purposes, fresh,dried, dyed, bleached, impregnated or otherwise prepared","1,363,572",
"202505","502","United States","0703","Onions, shallots, garlic, leeks and other alliaceous vegetables, fresh or chilled.","5,516,282",
"202505","502","United States","0709","Other vegetables, fresh or chilled.","2,122,365",
"202505","502","United States","0710","Vegetables (uncooked or cooked by steaming or boiling in water),frozen.","10,468,305",
"202505","502","United States","0711","Vegetables provisionally preserved, but unsuitable in that state for immediate consumption.","75,808",
"202505","502","United States","0712","Dried vegetables, whole, cut, sliced, broken or in powder, but not further prepared.","21,022,365",
"202505","502","United States","0713","Dried leguminous vegetables, shelled, whether or not skinned or split.","1,399,542",
"202505","502","United States","0714","Manioc, arrowroot, salep, Jerusalem artichokes, sweet potatoes 
and similar roots and tubers with high starch or inulin content, 
fresh, chilled, frozen or dried, whether or not sliced or in the 
form of pellets; sago pith.","1,376,008",
"202505","502","United States","0801","Coconuts, Brazil nuts and cashew nuts, fresh or dried, whether or not shelled or peeled.","24,300",
"202505","502","United States","0802","Other nuts, fresh or dried, whether or not shelled or peeled.","2,144,371",
"202505","502","United States","0803","Bananas, including plantains, fresh or dried.","58,653",
"202505","502","United States","0804","Dates, figs, pineapples, avocados, guavas, mangoes and mangosteens, fresh or dried.","320,554",
"202505","502","United States","0805","Citrus fruit, fresh or dried.","287,859",
"202505","502","United States","0806","Grapes, fresh or dried.","3,525",
"202505","502","United States","0808","Apples, pears and quinces, fresh.","612,221",
"202505","502","United States","0810","Other fresh fruits","1,609,307",
"202505","502","United States","0811","Fruit and nuts, uncooked or cooked by steaming or boiling in 
water, frozen, whether or not containing added sugar or other 
sweetening matter.","209,423",
"202505","502","United States","0813","Fruit, dried, other than that of headings 08.01 to 08.06; mixtures of nuts or dried fruits of this Chapter.","13,694,649",
"202505","502","United States","0814","Peel of citrus fruit or melons (including watermelons), fresh, 
frozen, dried or provisionally preserved in brine, in sulphur 
water or in other preservative solutions.","4,264",
"202505","502","United States","0901","Coffee, whether or not roasted or decaffeinated; coffee husks and skins; coffee substitutes containing coffee in any proportion.","2,115,650",
"202505","502","United States","0902","Tea, whether or not flavoured.","2,368,532",
"202505","502","United States","0904","Pepper of the genus Piper; dried or crushed or ground fruits of the genus Capsicum or of the genus Pimenta.","3,911,274",
"202505","502","United States","0906","Cinnamon and cinnamontree flowers.","60,461",
"202505","502","United States","0907","loves (whole fruit, cloves and stems).","37,564",
"202505","502","United States","0908","Nutmeg, mace and cardamoms.","580",
"202505","502","United States","0909","Seeds of anise, badian, fennel, coriander, cumin or caraway; juniper berries.","73,056",
"202505","502","United States","0910","Ginger, saffron, turmeric (curcuma), thyme, bay leaves, curry and other spices.","4,372,660",
"202505","502","United States","1008","Buckwheat, millet and canary seeds; other cereals.","30,837",
"202505","502","United States","1102","Cereal flours other than of wheat or meslin.","281",
"202505","502","United States","1104","Cereal grains otherwise worked (for example, hulled, rolled, flaked, pearled, sliced or kibbled), except rice of heading 10.06; germ of cereals, whole, rolled, flaked or ground.","69,827",
"202505","502","United States","1106","Flour, meal and powder of the dried leguminous vegetables of heading 07.13, of sago or of roots or tubers of heading 07.14 or of the products of Chapter 8.","550,724",
"202505","502","United States","1107","Malt, whether or not roasted.","80",
"202505","502","United States","1108","tarches; inulin.","446,761",
"202505","502","United States","1109","Wheat gluten, whether or not dried.","6,204",
"202505","502","United States","1201","Soya beans, whether or not broken.","27,845",
"202505","502","United States","1202","Groundnuts, not roasted or otherwise cooked, whether or not shelled or broken.","1,670",
"202505","502","United States","1203","Copra","5,599",
"202505","502","United States","1206","Sunflower seeds, whether or not broken.","106,630",
"202505","502","United States","1207","Other oil seeds and oleaginous fruits, whether or not broken.","68,940",
"202505","502","United States","1209","Seeds, fruit and spores, of a kind used for sowing.","424,565",
"202505","502","United States","1211","lants and parts of plants (including seeds and fruits), of a kind 
used primarily in perfumery, in pharmacy or for insecticidal, 
fungicidal or similar purposes, fresh, chilled, frozen or dried, 
whether or not cut, crushed or powdered.","981,175",
"202505","502","United States","1212","Locust beans, seaweeds and other algae, sugar beet and sugar cane, fresh, chilled, frozen or dried, whether or not ground; fruit 
stones and kernels and other vegetable products (including unroasted chicory roots of the variety Cichorium intybus sativum) of a kind used primarily for human consumption, not elsewhere specified or included.","4,336,301",
"202505","502","United States","1301","Lac; natural gums, resins, gumresins and oleoresins (for example, balsams).","411,150",
"202505","502","United States","1302","Vegetable saps and extracts; pectic substances, pectinates and 
pectates; agaragar and other mucilages and thickeners, whether 
or not modified, derived from vegetable products.","26,069,596",
"202505","502","United States","1401","Vegetable materials of a kind used primarily for plaiting (for example, bamboos, rattans, reeds, rushes, osier, raffia, cleaned, bleached or dyed cereal straw, and lime bark).","496,518",
"202505","502","United States","1404","Vegetable products not elsewhere specified or included.","975,014",
"202505","502","United States","1504","ats and oils and their fractions, of fish or marine mammals, whether or not refined, but not chemically modified.","3,074,601",
"202505","502","United States","1505","Wool grease and fatty substances derived therefrom (including lanolin).","134,628",
"202505","502","United States","1506","Other animal fats and oils and their fractions, whether or not refined, but not chemically modified.","129,696",
"202505","502","United States","1507","oyabean oil and its fractions, whether or not refined, but not chemically modified.","3,405",
"202505","502","United States","1508","Groundnut oil and its fractions, whether or not refined, but not chemically modified.","229,688",
"202505","502","United States","1512","unflowerseed, safflower or cottonseed oil and fractions thereof, whether or not refined, but not chemically modified.","75,657",
"202505","502","United States","1513","Coconut (copra), palm kernel or babassu oil and fractions thereof, whether or not refined, but not chemically modified.","7,692",
"202505","502","United States","1514","Rape, colza or mustard oil and fractions thereof, whether or not refined, but not chemically modified.","33,182",
"202505","502","United States","1515","Other fixed vegetable or microbial fats and oils (including jojoba oil) and their fractions, whether or not refined, but not chemically modified","1,481,943",
"202505","502","United States","1516","Animal，vegetable or microbial fats and oils and their fractions, partly or wholly hydrogenated, interesterified, reesterified or elaidinised, whether or not refined, but not further prepared.","176,203",
"202505","502","United States","1517","Margarine; edible mixtures or preparations of animal, vegetable or microbial fats or oils or of fractions of different fats or oils of this Chapter, other than edible fats and oils or their fractions of heading 15.16.","1,065,267",
"202505","502","United States","1518","Animal, vegetable or microbial fats and oils and their fractions, boiled, oxidised, dehydrated, sulphurised, blown, polymerised by heat in vacuum or in inert gas or otherwise chemically modified, excluding those of heading 15.16; inedible mixtures or preparations of animal, vegetable or microbial fats or oils or of fractions of different fats or oils of this Chapter, not elsewhere specified or included","7",
"202505","502","United States","1521","egetable waxes (other than triglycerides), beeswax, other insect waxes and spermaceti, whether or not refined or coloured.","175,002",
"202505","502","United States","1601","Sausages and similar products, of meat, meat offal, blood or insects; food preparations based on these products","95,870",
"202505","502","United States","1602","Other prepared or preserved meat, meat offal, blood or insects","531,195",
"202505","502","United States","1604","Prepared or preserved fish; caviar and caviar substitutes prepared from fish eggs.","23,037,001",
"202505","502","United States","1605","rustaceans, molluscs and other aquatic invertebrates, prepared or preserved.","22,292,757",
"202505","502","United States","1701","Cane or beet sugar and chemically pure sucrose, in solid form.","252,229",
"202505","502","United States","1702","Other sugars, including chemically pure lactose, maltose, glucose 
and fructose, in solid form; sugar syrups not containing added 
flavouring or colouring matter; artificial honey, whether or not 
mixed with natural honey; caramel.","5,187,502",
"202505","502","United States","1703","olasses resulting from the extraction or refining of sugar.","27",
"202505","502","United States","1704","ugar confectionery (including white chocolate), not containing cocoa.","14,591,754",
"202505","502","United States","1806","hocolate and other food preparations containing cocoa.","682,192",
"202505","502","United States","1901","Malt extract; food preparations of flour, groats, meal, starch or malt extract, not containing cocoa or containing less than 40% by weight of cocoa calculated on a totally defatted basis, not elsewhere specified or included; food preparations of goods of headings 04.01 to 04.04,not containing cocoa or containing less than 5% by weight of cocoa calculated on a totally efatted basis, not elsewhere specified or included.","361,756",
"202505","502","United States","1902","Pasta, whether or not cooked or stuffed (with meat or other 
substances) or otherwise prepared, such as spaghetti, macaroni, 
noodles, lasagne, gnocchi, ravioli, cannelloni; couscous, whether 
or not prepared.","9,391,604",
"202505","502","United States","1903","Tapioca and substitutes therefor prepared from starch, in the form of flakes, grains, pearls, siftings or in similar forms","152,894",
"202505","502","United States","1904","repared foods obtained by the swelling or roasting of cereals or cereal products (for example, corn flakes); cereals (other than 
maize (corn)) in grain form or in the form of flakes or other worked grains (except flour, groats and meal), precooked, or otherwise prepared, not elsewhere specified or included.","1,234,008",
"202505","502","United States","1905","read, pastry, cakes, biscuits and other bakers' wares, whether 
or not containing cocoa; communion wafers, empty cachets of a 
kind suitable for pharmaceutical use, sealing wafers, rice paper 
and similar products.","3,004,425",
"202505","502","United States","2001","Vegetables, fruit, nuts and other edible parts of plants, prepared or preserved by vinegar or acetic acid.","349,006",
"202505","502","United States","2002","Tomatoes prepared or preserved otherwise than by vinegar or acetic acid.","212,777",
"202505","502","United States","2003","Mushrooms and truffles, prepared or preserved otherwise than by vinegar or acetic acid.","146,193",
"202505","502","United States","2004","Other vegetables prepared or preserved otherwise than by 
vinegar or acetic acid, frozen, other than products of 
heading 20.06.","311,651",
"202505","502","United States","2005","Other vegetables prepared or preserved otherwise than by 
vinegar or acetic acid, not frozen, other than products of 
heading 20.06.","14,188,233",
"202505","502","United States","2006","Vegetables, fruit, nuts, fruitpeel and other parts of plants, preserved by sugar (drained, glacé or crystallised).","219,162",
"202505","502","United States","2007","Jams, fruit jellies, marmalades, fruit or nut purée and fruit or 
nut pastes, obtained by cooking, whether or not containing added sugar or other sweetening matter.","84,031",
"202505","502","United States","2008","Fruit, nuts and other edible parts of plants, otherwise prepared or preserved, whether or not containing added sugar or other sweetening matter or spirit, not elsewhere specified or included.","17,689,194",
"202505","502","United States","2009","Fruit or nut juices (including grape must and coconut water) and vegetable juices, unfermented and not containing added spirit, whether or not containing added sugar or other sweetening matter","6,595,331",
"202505","502","United States","2101","Extracts, essences and concentrates, of coffee, tea or maté and preparations with a basis of these products or with a basis of coffee, tea or mate; roasted chicory and other roasted coffee substitutes, and extracts, essences and concentrates thereof","1,586,360",
"202505","502","United States","2102","Yeasts (active or inactive); other singlecell microorganisms, dead (but not including vaccines of heading 30.02); prepared baking powders.","1,621,260",
"202505","502","United States","2103","Sauce and preparations therefor; mixed condiments and mixed seasonings; mustard flour and meal, whether or not prepared, and mustard","8,972,907",
"202505","502","United States","2104","Soups and broths and preparations therefor; homogenised composite food preparations.","410,987",
"202505","502","United States","2105","Ice cream and other edible ice, whether or not containing cocoa.","2,081,184",
"202505","502","United States","2106","Food preparations not elsewhere specified or included.","26,912,375",
"202505","502","United States","2201","Waters, including natural or artificial mineral waters andaerated waters, not containing added sugar or other sweetening
matter nor flavoured; ice and snow.","4,080",
"202505","502","United States","2202","Waters, including mineral waters and aerated waters, containing added sugar or other sweetening matter or flavoured, and other non-alcoholic beverages, not including fruit, nut or vegetable juices of heading 20.09","2,960,051",
"202505","502","United States","2203","Beer made from malt.","176,526",
"202505","502","United States","2204","Wine of fresh grapes, including fortified wines; grape must other than that of heading 20.09.","12,690",
"202505","502","United States","2206","Other fermented beverages (for example, cider, perry, mead, saké); mixtures of fermented beverages and mixtures of fermented beverages and nonalcoholic beverages, not elsewhere 
specified or included.","133,438",
"202505","502","United States","2207","Undenatured ethyl alcohol of an alcoholic strength by volume of 80% vol.or higher; ethyl alcohol and other spirits, denatured, of any strength.","40",
"202505","502","United States","2208","Undenatured ethyl alcohol of an alcoholic strength by volume of Undenatured ethyl alcohol of an alcoholic strength by volume of less than 80% vol.; spirits, liqueurs and other spirituous beverages.","703,783",
"202505","502","United States","2209","Vinegar and substitutes for vinegar obtained from acetic acid.","239,963",
"202505","502","United States","2303","Residues of starch manufacture and similar residues, beetpulp, bagasse and other waste of sugar manufacture, brewing ordistilling dregs and waste, whether or not in the form of pellets.","29,410",
"202505","502","United States","2306","Oil-cake and other solid residues, whether or not ground or in the form of pellets, resulting from the extraction of vegetable or microbial fats or oils, other than those of heading 23.04 or 23.05","42,969",
"202505","502","United States","2308","Vegetable materials and vegetable waste, vegetable residues and byproducts, whether or not in the form of pellets, of a kind used in animal feeding, not elsewhere specified or included.","359,171",
"202505","502","United States","2309","Preparations of a kind used in animal feeding.","14,758,172",
"202505","502","United States","2404","Products containing tobacco, reconstituted tobacco, nicotine, or tobacco or nicotine substitutes, intended for inhalation without combustion; other nicotine containing products intended for the intake of nicotine into the human body","148,489,589",
"202505","502","United States","2501","Salts, incl. table salt and denatured salt, and pure sodium chloride, whether or not in aqueous solution or containing added anti-caking or free-flowing agents; sea water","110,398",
"202505","502","United States","2504","Natural graphite.","81,000",
"202505","502","United States","2506","Quartz (excluding natural sands); quartzite, whether or not roughly trimmed or merely cut, by sawing or otherwise, into blocks or slabs of a square or rectangular shape","62,862",
"202505","502","United States","2507","Kaolin and other kaolinic clays, whether or not calcined","14,361",
"202505","502","United States","2508","Other clays (not including expanded clays of heading 68.06), andalusite, kyanite and sillimanite, whether or not calcined; mullite; chamotte or dinas earths.","1,063,343",
"202505","502","United States","2512","Siliceous fossil meals, e.g. kieselguhr, tripolite and diatomite, and similar siliceous earths, whether or not calcined, of an apparent specific gravity of 1 or less.","3,585",
"202505","502","United States","2513","Pumice stone; emery; natural corundum, natural garnet and other natural abrasives, whether or not heat-treated","95,124",
"202505","502","United States","2515","Marble, travertine, ecaussine and other calcareous monumental or building stone of an apparent specific gravity of 2.5 or more, and alabaster, whether or not roughly trimmed or merely cut, by sawing or otherwise, into blocks or slabs of a rectangular (including square) shape.","9,460",
"202505","502","United States","2517","Pebbles, gravel, broken or crushed stone, for concrete aggregates, for road metalling or for railway ballast, shingle and flint, whether or not heat-treated; macadam of slag, dross or similar industrial waste, whether or not incorporating the materials cited in the first part of the heading; tarred macadam; granules, chippings and powder, of stones of heading 2515 and 2516, whether or not heat-treated","524,371",
"202505","502","United States","2518","Dolomite, whether or not calcined or sintered, including dolomite roughly trimmed or merely cut, by sawing or otherwise, into blocks or slabs of a rectangular (including square) shape","29,160",
"202505","502","United States","2519","Natural magnesium carbonate "magnesite"; fused magnesia; dead-burned "sintered" magnesia, whether or not containing small quantities of other oxides added before sintering; other magnesium oxide, whether or not pure","10,041,319",
"202505","502","United States","2520","Gypsum; anhydrite; plasters consisting of calcined gypsum or calcium sulphate, whether or not coloured, with or without small quantities of accelerators or retarders","17,441",
"202505","502","United States","2521","Limestone flux; limestone and other calcareous stone, of a kind used for the manufacture of lime or cement","2,952",
"202505","502","United States","2525","Mica, including splittings; mica waste.","244,773",
"202505","502","United States","2526","Natural steatite, whether or not roughly trimmed or merely cut, by sawing or otherwise, into blocks or slabs of a rectangular (including square) shape; talc.","47,227",
"202505","502","United States","2529","Feldspar; leucite, nepheline and nepheline syenite; fluorspar.","138,859",
"202505","502","United States","2530","Mineral substances not elsewhere specified or included.","17,183",
"202505","502","United States","2602","Manganese ores and concentrates, including ferruginous manganese ores and concentrates with a manganese content of 20% or more,calculated on the dry weight.","1",
"202505","502","United States","2615","Niobium, tantalum, vanadium or zirconium ores and concentrates.","771,872",
"202505","502","United States","2621","Other slag and ash, including seaweed ash (kelp); ash and residues from the incineration of municipal waste.","11,290",
"202505","502","United States","2701","Mituminous substances; mineral waxes","5,406",
"202505","502","United States","2710","Petroleum oils and oils obtained from bituminous minerals, other than crude; preparations not elsewhere specified or 
included, containing by weight 70% or more of petroleum oils or of oils obtained from bituminous minerals, these oils being the basic constituents of the preparations; waste oils.","47,823,708",
"202505","502","United States","2711","Petroleum gases and other gaseous hydrocarbons.","863,182",
