Date of data,Trading partner code,Trading partner,Commodity code,Commodity,US dollar
202510,502,United States,841590,"Parts of air conditioning machines, comprising a motor-driven fan and elements for changing the temperature and humidity, n.e.s.",1875490.0
202510,502,United States,841610,Furnace burners for liquid fuel,85020.0
202510,502,United States,841620,"Other furnace burners, including combination burners",11351.0
202510,502,United States,841690,"Parts of furnace burners such as mechanical stokers, incl. their mechanical grates, mechanical ash dischargers and similar appliances, n.e.s.",102715.0
202510,502,United States,841821,"Household refrigerators, compression-type",200.0
202510,502,United States,841830,"Freezers of the chest type, of a capacity ≤ 800L",33864.0
202510,502,United States,841840,"Freezers of the upright type, of a capacity ≤ 900L",141184.0
202510,502,United States,841850,"Furniture (chests, cabinets, display counters, show-cases and the like) for storage and display, incorporating refrigerating or freezing equipment (excluding combined refrigerator-freezers with separate external doors, household refrigerators and freezers of the chest type of a capacity ≤ 800L or of the upright type of a capacity ≤ 900L)",44487.0
202510,502,United States,841861,Heat pumps other than air conditioning machines of heading 84.15,11585.0
202510,502,United States,841869,Refrigerating or freezing equipment (excluding refrigerating and freezing furniture),3740509.0
202510,502,United States,841899,"Parts of refrigerating or freezing equipment and heat pumps, n.e.s.",1577411.0
202510,502,United States,841920,"Medical, surgical or laboratory sterilisers",167875.0
202510,502,United States,841933,"Lyophilisation apparatus, freeze drying units and spray dryers",25000.0
202510,502,United States,841939,"Dryers (excluding dryers for agricultural products, for wood, paper pulp, paper or paperboard, for yarns, fabrics and other textile products, dryers for bottles or other containers, hairdryers, hand dryers and domestic appliances)",32295.0
202510,502,United States,841940,Distilling or rectifying plant,37299.0
202510,502,United States,841950,Heat exchange units,26405412.0
202510,502,United States,841960,Machinery for liquefying air or other gases,32588596.0
202510,502,United States,841981,"Machinery, plant and equipment for making hot drinks or for cooking or heating food (excluding domestic appliances)",713515.0
202510,502,United States,841989,"Machinery, plant or laboratory equipment, whether or not electrically heated, for the treatment of materials by a process involving a change of temperature such as heating, cooking, roasting, sterilising, pasteurising, steaming, evaporating, vaporising, condensing or cooling, n.e.s. (excluding machinery used for domestic purposes and furnaces, ovens and other equipment of heading 8514)",3621736.0
202510,502,United States,841990,"Parts of machinery, plant and laboratory equipment, whether or not electrically heated, for the treatment of materials by a process involving a change of temperature, and of non-electric instantaneous and storage water heaters, n.e.s.",1203338.0
202510,502,United States,842091,Cylinders,1819.0
202510,502,United States,842099,"Parts for calendering or rolling machines, n.e.s. (other than for metals or glass and excluding cylinders)",234324.0
202510,502,United States,842112,Centrifugal clothes-dryers,1299.0
202510,502,United States,842119,"Centrifuges, incl. centrifugal dryers (excluding isotope separators, cream separators and clothes dryers)",749931.0
202510,502,United States,842121,Machinery and apparatus for filtering or purifying water,4567403.0
202510,502,United States,842123,Oil or petrol-filters for internal combustion engines,2952101.0
202510,502,United States,842129,"Machinery and apparatus for filtering or purifying liquids (excluding such machinery and apparatus for water and other beverages, oil or petrol-filters for internal combustion engines and artificial kidneys)",18228054.0
202510,502,United States,842131,Intake air filters for internal combustion engines,675731.0
202510,502,United States,842132,"Catalytic converters or particulate filters, whether or not combined, for purifying or filtering exhaust gases from internal combustion engines",1690706.0
202510,502,United States,842139,Machinery and apparatus for filtering or purifying gases (excluding isotope separators and intake air filters for internal combustion engines),9185900.0
202510,502,United States,842191,"Parts of centrifuges, incl. centrifugal dryers, n.e.s.",316168.0
202510,502,United States,842199,"Parts of machinery and apparatus for filtering or purifying liquids or gases, n.e.s.",17923143.0
202510,502,United States,842211,Dishwashing machines of the household type,1630.0
202510,502,United States,842219,Dishwashing machines (excluding those of the household type),1421.0
202510,502,United States,842220,Machinery for cleaning or drying bottles or other containers (excluding dishwashing machines),3869.0
202510,502,United States,842230,"Machinery for filling, closing, sealing or labelling bottles, cans, boxes, bags or other containers; machinery for capsuling bottles, jars, tubes and similar containers; machinery for aerating beverages",118891.0
202510,502,United States,842240,"Packing or wrapping machinery, incl. heat-shrink wrapping machinery (excluding machinery for filling, closing, sealing or labelling bottles, cans, boxes, bags or other containers and machinery for capsuling bottles, jars, tubes and similar containers)",172679.0
202510,502,United States,842290,"Parts of dishwashing machines, packing or wrapping machinery and other machinery and apparatus of heading 8422, n.e.s.",489151.0
202510,502,United States,842310,"Personal weighing machines, incl. baby scales; household scales",120.0
202510,502,United States,842330,"Constant weight scales and scales for discharging a pre-determined weight of material into a bag or container, incl. hopper scales (excluding scales for continuous weighing of goods on conveyors)",102.0
202510,502,United States,842381,"Weighing machinery having a maximum weighing capacity ≤ 30 kg (excluding balances of a sensitivity of 5 cg or better, personal weighing machines, household scales, scales for continuous weighing of goods on conveyors, constant weight scales and scales for discharging a pre-determined weight of material into a bag or container, incl. hopper scales)",1111.0
202510,502,United States,842382,"Weighing machinery of a maximum weighing capacity ＞ 30 kg but ≤ 5.000 kg (excluding personal weighing machines, scales for continuous weighing of goods on conveyors, constant weight scales and scales for discharging a pre-determined weight of material into a bag or container, incl. hopper scales)",107935.0
202510,502,United States,842389,Weighing machinery of a maximum weighing capacity ＞ 5.000 kg,3546.0
202510,502,United States,842390,"Weighing machine weights of all kinds; parts of weighing machinery, n.e.s.",73025.0
202510,502,United States,842410,"Fire extinguishers, whether or not charged",1753158.0
202510,502,United States,842420,Spray guns and similar appliances,1412596.0
202510,502,United States,842430,Steam or sand blasting machines and similar jet projecting machines,16294.0
202510,502,United States,842482,"Agricultural or horticultural mechanical appliances, whether or not hand-operated, for projecting or dispersing liquids or powders (excl. sprayers)",3215.0
202510,502,United States,842489,"Mechanical appliances, whether or not hand-operated, for projecting, dispersing or spraying liquids or powders, n.e.s.",3632501.0
202510,502,United States,842490,"Parts of fire extinguishers, spray guns and similar appliances, steam or sand blasting machines and similar jet projecting machines and machinery and apparatus for projecting, dispersing or spraying liquids or powders, n.e.s.",4741800.0
202510,502,United States,842511,"Pulley tackle and hoists, powered by electric motor (other than skip hoists or hoists of a kind used for raising vehicles)",386974.0
202510,502,United States,842519,"Pulley tackle and hoists (other than skip hoists or hoists of a kind used for raising vehicles), non-powered by electric motor",122982.0
202510,502,United States,842531,Winches and capstans powered by electric motor,21623.0
202510,502,United States,842539,"Winches and capstans, non-powered by electric motor",176312.0
202510,502,United States,842542,"Jacks and hoists, hydraulic (excluding built-in jacking systems used in garages)",181137.0
202510,502,United States,842549,"Jacks and hoists of a kind used for raising vehicles, not hydraulic",75450.0
202510,502,United States,842630,Portal or pedestal jib cranes,1785.0
202510,502,United States,842699,"Ships' derricks; cranes, incl. cable cranes (excluding overhead travelling cranes, transporter cranes, gantry cranes, portal or pedestal jib cranes, bridge cranes, mobile lifting frames and straddle carriers, tower cranes, works trucks fitted with a crane, mobile cranes and cranes designed for mounting on road vehicles)",514.0
202510,502,United States,842710,Selfpropelled trucks powered by an electric motor,115237.0
202510,502,United States,842790,"Works trucks fitted with lifting or handling equipment, not self-propelled",10347.0
202510,502,United States,842810,Lifts and skip hoists,31715.0
202510,502,United States,842820,Pneumatic elevators and conveyors,40853.0
202510,502,United States,842833,"Continuous-action elevators and conveyors, for goods or materials, belt type",23721.0
202510,502,United States,842839,"Continuous-action elevators and conveyors, for goods or materials (excluding those for underground use and bucket, belt or pneumatic types)",1011443.0
202510,502,United States,842890,"Machinery for lifting, handling, loading or unloading, nes",2669777.0
202510,502,United States,842951,Frontend shovel loaders,543981.0
202510,502,United States,843020,Snowploughs and snowblowers,404.0
202510,502,United States,843049,"Other, boring or sinking machinery for boring earth or extracting minerals or ores, not self-propelled and not hydraulic",4520.0
202510,502,United States,843069,"Earth moving machinery, not self-propelled, n.e.s.",103300.0
202510,502,United States,843110,Part of machinery of heading 84.25,49469.0
202510,502,United States,843120,Part of machinery of heading 84.27,291339.0
202510,502,United States,843131,"Part off lifts, skip hoists or escalators, of heading 84.28",332341.0
202510,502,United States,843139,"Parts of machinery of heading 8428, n.e.s.",2419475.0
202510,502,United States,843141,"Buckets, shovels, grabs and grips",6921.0
202510,502,United States,843143,Parts for boring or sinking machinery of subheading 8430.41 or,1148977.0
202510,502,United States,843149,"Parts of machinery of heading 8426, 8429 and 8430, n.e.s.",3299948.0
202510,502,United States,843229,"Harrows, scarifiers, cultivators, weeders and hoes for use in agriculture, horticulture or forestry (excluding disc harrows)",191643.0
202510,502,United States,843231,"Notill direct seeders, planters and transplanters",158.0
202510,502,United States,843239,"No-till direct seeders, planters and transplanters",11060.0
202510,502,United States,843242,Fertiliser distributors,1321.0
202510,502,United States,843280,"Agricultural, horticultural or forestry machinery for soil preparation or cultivation; lawn or sports-ground rollers (excluding sprayers and dusters, ploughs, harrows, scarifiers, cultivators, weeders, hoes, seeders, planters, manure spreaders and fertiliser distributors)",3899.0
202510,502,United States,843290,"Parts of agricultural, horticultural or forestry machinery for soil preparation or cultivation or of lawn or sports-ground rollers, n.e.s.",67279.0
202510,502,United States,843311,"Powered, with the cutting device rotating in a horizontal plane",66740.0
202510,502,United States,843319,"Mowers for lawns, parks or sports grounds, powered, with the cutting device rotating in a vertical plane or with cutter bars",238969.0
202510,502,United States,843340,"Straw or fodder balers, including pickup balers",60047.0
202510,502,United States,843351,Combine harvester-threshers,65697.0
202510,502,United States,843359,"Harvesting machinery for agricultural produce (excluding mowers, haymaking machinery, straw and fodder balers, incl. pick-up balers, combine harvester-threshers, other threshing machinery and root or tuber harvesting machines)",1190000.0
202510,502,United States,843390,"Parts of harvesting machinery, threshing machinery, mowers and machines for cleaning, sorting or grading agricultural produce, n.e.s.",2302563.0
202510,502,United States,843490,"Parts of milking machines and dairy machinery, n.e.s.",92334.0
202510,502,United States,843510,"Presses, crushers and similar machinery used in the manufacture of wine, cider, fruit juices or similar beverages (excluding machinery for the treatment of these beverages, incl. centrifuges, filter presses, other filtering equipment and domestic appliances)",18884.0
202510,502,United States,843610,Machinery for preparing animal feeding stuffs,39117.0
202510,502,United States,843629,"Poultry-keeping machinery (excluding machines for sorting or grading eggs, poultry pickers of heading 8438 and incubators and brooders)",46.0
202510,502,United States,843680,"Agricultural, horticultural, forestry or bee-keeping machinery, n.e.s.",72048.0
202510,502,United States,843691,"Parts of poultry-keeping machinery or poultry incubators and brooders, n.e.s.",9678.0
202510,502,United States,843699,"Parts of agricultural, horticultural, forestry or bee-keeping machinery of heading 84.36, n.e.s.",118270.0
202510,502,United States,843710,"Machines for cleaning, sorting or grading seed, grain or dried leguminous vegetables",244804.0
202510,502,United States,843850,Machinery for the preparation of meat or poultry,213615.0
202510,502,United States,843860,"Machinery for the preparation of fruits, nuts or vegetables",85000.0
202510,502,United States,843880,"Machinery for the industrial preparation or manufacture of food or drink, nes",208268.0
202510,502,United States,843890,"Parts of machinery for the industrial preparation or manufacture of food or drink, nes",142088.0
202510,502,United States,843991,"Parts of machinery for making pulp of fibrous cellulosic material, n.e.s.",839748.0
202510,502,United States,843999,"Parts of machinery for making or finishing paper or paperboard, n.e.s.",90308.0
202510,502,United States,844090,"Parts of bookbinding machinery, n.e.s.",96.0
202510,502,United States,844110,Cutting machines,29940.0
202510,502,United States,844180,"Machinery for making up paper pulp, paper or paperboard, n.e.s.",951.0
202510,502,United States,844190,"Parts of machinery for making up paper pulp, paper or paperboard, n.e.s.",69411.0
202510,502,United States,844240,"Parts of the foregoing machinery, apparatus or equipment",38311.0
202510,502,United States,844250,"Plates, cylinders and other printing components; plates, cylinders and lithographic stones, prepared for printing purposes (for example, planed, grained or polished)",95441.0
202510,502,United States,844331,"Machines which perform two or more of the functions of printing, copying or facsimile transmission, capable of connecting to an automatic data processing machine or to a network",20307.0
202510,502,United States,844332,"Other, capable of connecting to an automatic data processing machine or to a network",1885039.0
202510,502,United States,844339,"Printers, copying machines and facsimile machines, whether or not combined (excluding those capable of connecting to an automatic data processing machine or to a network and printing machinery used for printing by means of plates, cylinders and other printing components of heading 8442)",288.0
202510,502,United States,844391,"Parts and accessories of printing machinery used for printing by means of plates, cylinders and other printing components of heading 84.42",602942.0
202510,502,United States,844399,"Parts and accessories of printers, copying machines and facsimile machines, n.e.s. (excluding of printing machinery used for printing by means of plates, cylinders and other printing components of heading 8443)",11425660.0
202510,502,United States,844610,Weaving machines for weaving fabrics of a width ≤ 30 cm,63589.0
202510,502,United States,844820,Parts and accessories of machines of heading 84.44 or of their auxiliary machinery,37036.0
202510,502,United States,844833,"Spindles, spindle flyers, spinning rings and ring travellers",58786.0
202510,502,United States,844839,"Parts and accessories of machines of heading 8445, n.e.s.",193.0
202510,502,United States,844859,"Parts and accessories of machines of heading 8447, n.e.s.",9740.0
202510,502,United States,845011,"Fully-automatic household or laundry-type washing machines, of a dry linen capacity ≤ 6 kg",1699.0
202510,502,United States,845020,"Laundry-type washing machines, each of a dry linen capacity exceeding 10 kg",23225.0
202510,502,United States,845090,"Parts of household or laundry-type washing machines, n.e.s.",14357.0
202510,502,United States,845121,"Drying machines, of a dry linen capacity ≤ 10 kg (excluding centrifugal driers)",4408.0
202510,502,United States,845129,"Drying machines for textile yarns, fabrics or made-up textile articles (excluding machines of a dry linen capacity ≤ 10 kg and centrifugal driers)",33819.0
202510,502,United States,845130,Ironing machines and presses (including fusing presses),360.0
202510,502,United States,845180,"Machinery for dressing, finishing, coating or impregnating textile yarns, fabrics or other made-up textile articles and machines used in the manufacture of linoleum or other floor coverings for applying the paste to the base fabric or other support (excluding machinery for dressing or finishing felt, calenders and general purpose presses)",33004.0
202510,502,United States,845190,"Parts of machines for washing, cleaning, wringing, drying, ironing, pressing, bleaching, dyeing, dressing, finishing, coating or impregnating textile yarns, fabrics or made-up textile articles; parts of machines used in the manufacture of linoleum or other floor coverings for applying the paste to the base fabric or other support; parts of machines for reeling, unreeling, folding, cutting or pinking textile fabrics, n.e.s.",15122.0
202510,502,United States,845290,"Furniture, bases and covers for sewing machines and parts thereof; other parts of sewing machines",1286.0
202510,502,United States,845420,Ingot moulds and ladles,924000.0
202510,502,United States,845490,"Parts of converters, ladles, ingot moulds and casting machines of a kind used in metallurgy or in metal foundries, n.e.s.",26890.0
202510,502,United States,845530,Rolls for rolling mills,230505.0
202510,502,United States,845590,"Parts of metal-rolling mills, n.e.s.",8907.0
202510,502,United States,845611,"Machine tools for working any material by removal of material, operated by laser (excl. soldering and welding machines, also those which can be used for cutting, material testing machines and machines for the manufacture of semiconductor devices or of electronic integrated circuits)",218422.0
202510,502,United States,845710,Machining centres,439194.0
202510,502,United States,845819,"Horizontal lathes, incl. turning centres, for removing metal, not numerically controlled",774478.0
202510,502,United States,845929,"Drilling machines for working metal, not numerically controlled (excluding way-type unit head machines and hand-operated machines)",5305.0
202510,502,United States,846024,"Grinding machines for finishing metal, numerically controlled (excl. flat-surface, cylindrical and gear grinding machines)",187688.0
202510,502,United States,846031,"Sharpening tool or cutter grinding"" machines, numerically controlled""",120.0
202510,502,United States,846090,"Machines for deburring, grinding or polishing metals, metal carbides or cermets (excluding grinding machines in which the positioning in any one axis can be set up to an accuracy of at least 0,01 mm, gear cutting, gear grinding or gear finishing machines and machines for working in the hand)",71054.0
202510,502,United States,846150,Sawing or cuttingoff machines,15872.0
202510,502,United States,846229,"Other bending, folding, straightening or flattening machines (including press brakes) for flat products, not numerically controlled",1200.0
202510,502,United States,846262,Mechanical presses,3328.0
202510,502,United States,846269,Other cold metal working presses,59626.0
202510,502,United States,846290,Other presses for working metal or metal carbides,2691.0
202510,502,United States,846310,"Drawbenches for bars, tubes, profiles, wire or the like",42000.0
202510,502,United States,846320,Thread rolling machines,9036.0
202510,502,United States,846390,"Machine tools for working metal, sintered metal carbides or cermets, without removing metal (excluding forging, bending, folding, straightening and flattening presses, shearing machines, punching or notching machines, presses, draw-benches, thread rolling machines, machines for working metal wire and machines for working in the hand)",1000.0
202510,502,United States,846420,"Grinding or polishing machines, for working stone, ceramics, concrete, asbestos-cement or like mineral materials or for cold-working glass",151850.0
202510,502,United States,846592,"Planing, milling or moulding -by cutting- machines, for working wood, cork, bone, hard rubber, hard plastics or similar hard materials (excluding machines for working in the hand and machines of subheading 8465.10)",1696.0
202510,502,United States,846593,"Grinding, sanding or polishing machines for working wood, cork, bone, hard rubber, hard plastics or similar hard materials (excluding machines for working in the hand)",50634.0
202510,502,United States,846595,"Drilling or mortising machines for working wood, cork, bone, hard rubber, hard plastics or similar hard materials (excluding machines for working in the hand and machines of subheading 8465.10)",1575.0
202510,502,United States,846596,"Splitting, slicing or paring machines, for working wood",71397.0
202510,502,United States,846599,"Machine tools for working wood, cork, bone, hard rubber, hard plastics or similar hard materials (excluding machines for working in the hand, machines of subheading 8465.10, sawing machines, planing, milling or moulding by cutting"" machines, grinding, sanding or polishing machines, bending or assembling machines, drilling or mortising machines and splitting, slicing or paring machines)""",10135.0
202510,502,United States,846610,"Tool holders, incl. tool holders for any type of tool for working in the hand, and self-opening dieheads, for machine tools",186681.0
202510,502,United States,846620,Work holders for machine tools,166767.0
202510,502,United States,846630,"Dividing heads and other special attachments for machine tools, n.e.s.",68.0
202510,502,United States,846691,"Parts and accessories for machine tools for working stone, ceramics, concrete, asbestos-cement or like mineral materials or for cold-working glass, n.e.s.",20083.0
202510,502,United States,846692,"Parts and accessories for machine tools for working wood, cork, bone, hard rubber, hard plastics or similar hard materials, nes",16299.0
202510,502,United States,846693,"Parts and accessories for machine tools for working metal by removing material, n.e.s.",1068504.0
202510,502,United States,846694,"Parts and accessories for machine tools for working metal without removing material, nes",320368.0
202510,502,United States,846711,Rotary type (including combined rotary-percussion),112968.0
202510,502,United States,846719,"Pneumatic tools for working in the hand, non-rotary type",537931.0
202510,502,United States,846721,"Drills of all kinds for working in the hand, with self-contained electric motor",661.0
202510,502,United States,846722,"Saws for working in the hand, with self-contained electric motor",96109.0
202510,502,United States,846729,"Electromechanical tools for working in the hand, with self-contained electric motor (excluding saws and drills)",45278.0
202510,502,United States,846781,"Chain saws, with self-contained electric motor",118880.0
202510,502,United States,846789,"Tools for working in the hand, hydraulic or with self-contained non-electric motor (excluding chainsaws and pneumatic tools)",1216913.0
202510,502,United States,846791,"Parts of chainsaws, for working in the hand, with self-contained electric or non-electric motor, n.e.s.",811925.0
202510,502,United States,846792,"Parts of pneumatic tools for working in the hand, n.e.s.",148338.0
202510,502,United States,846799,"Parts of pneumatic tools for working in the hand, hydraulic or with self-contained electric or non-electric motor, n.e.s.",648065.0
202510,502,United States,846810,Handheld blow pipes,4810.0
202510,502,United States,846880,"Machinery and apparatus for welding, not gas-operated (excluding electric machines and apparatus of heading 8515)",12028.0
202510,502,United States,846890,"Parts of machinery and apparatus for soldering, brazing, welding or surface tempering, non-electric, n.e.s.",21321.0
202510,502,United States,847010,"Electronic calculators capable of operation without an external source of electric power and pocketsize data recording, reproducing and displaying machines with calculating functions",521.0
202510,502,United States,847130,"Portable automatic data processing machines, weighing not more than 10 kg, consisting of at least a central processing unit, a keyboard and a display",84224.0
202510,502,United States,847141,"Comprising in the same housing at least a central processing unit and an input and output unit, whether or not combined",56946.0
202510,502,United States,847149,"Other, presented in the form of systems",2090191.0
