Date of data,Trading partner code,Trading partner,Commodity code,Commodity,US dollar
201604,502,United States,570299,"Carpets and other floor coverings, of vegetable textile materials or coarse animal hair, woven, not tufted or flocked, not of pile construction, made up (excluding Kelem, Schumacks, Karamanie and similar hand-woven rugs, and floor coverings of coconut fibres ""coir"")",4159
201604,502,United States,570320,"Carpets and other floor coverings, of nylon or other polyamides, tufted ""needle punched"", whether or not made up",1390993
201604,502,United States,570330,"Carpets and other floor coverings, of man-made textile materials, tufted ""needle punched"", whether or not made up (excluding those of nylon or other polyamides)",4597
201604,502,United States,570390,"Carpet tiles of vegetable textile materials or coarse animal hair, tufted ""needle punched"", whether or not made up",42904
201604,502,United States,570500,"Other carpets and other textile floor coverings, whether or not made up.",201817
201604,502,United States,580110,"Woven pile fabrics and chenille fabrics, of wool or fine animal hair (excluding terry towelling and similar woven terry fabrics, tufted textile fabrics and narrow woven fabrics of heading 5806)",55
201604,502,United States,580121,"Uncut weft pile fabrics, of cotton (excluding terry towelling and similar woven terry fabrics, tufted textile fabrics and narrow woven fabrics of heading 5806)",344
201604,502,United States,580122,"Cut corduroy, of cotton (excluding terry towelling and similar woven terry fabrics, tufted textile fabrics and narrow woven fabrics of heading 5806)",2484
201604,502,United States,580126,"Chenille fabrics, of cotton (excluding terry towelling and similar woven terry fabrics, tufted textile fabrics and narrow woven fabrics of heading 5806)",324
201604,502,United States,580127,"Warp pile fabrics, of cotton (excluding terry towelling and similar woven terry fabrics, tufted textile fabrics and narrow woven fabrics of heading 5806)",202514
201604,502,United States,580131,"Uncut weft pile fabrics, of man-made fibres (excluding terry towelling and similar woven terry fabrics, tufted textile fabrics and narrow woven fabrics of heading 5806)",179
201604,502,United States,580133,"Cut weft pile fabrics, of man-made fibres (excluding terry towelling and similar woven terry fabrics, tufted textile fabrics and narrow woven fabrics of heading 5806)",68629
201604,502,United States,580136,"Chenille fabrics, of man-made fibres (excluding terry towelling and similar woven terry fabrics, tufted textile fabrics and narrow woven fabrics of heading 5806)",13296
201604,502,United States,580137,"Warp pile fabrics, of man-made fibres (excluding terry towelling and similar woven terry fabrics, tufted textile fabrics and narrow woven fabrics of heading 5806)",10470
201604,502,United States,580190,"Woven pile fabrics and chenille fabrics (excluding those of man-made fibres, wool or fine animal hair, terry towelling and similar woven terry fabrics, tufted textile fabrics and narrow woven fabrics of heading 5806)",2026
201604,502,United States,580230,Tufted textile fabrics,19
201604,502,United States,580410,Tulles and other net fabrics,9789
201604,502,United States,580421,"Mechanically made lace of man-made fibres in the piece, in strips or in motifs (excluding fabrics of heading 6002 to 6006)",367868
201604,502,United States,580429,"Mechanically made lace in the piece, in strips or in motifs (excluding that of man-made fibres and fabrics of heading 6002 to 6006)",18713
201604,502,United States,580610,Woven pile fabrics (including terry towelling and similar terry fabrics) and chenille fabrics,368778
201604,502,United States,580620,"Other woven fabrics, containing by weight 5% or more of elastomeric yarn or rubber thread",9800
201604,502,United States,580632,"Narrow woven fabrics of man-made fibres, with a width of ≤ 30 cm, n.e.s.",551215
201604,502,United States,580639,"Narrow woven fabrics of textile materials other than cotton or man-made fibres, with a width of ≤ 30 cm, n.e.s.",1054
201604,502,United States,580640,Fabrics consisting of warp without weft assembled by means of an adhesive (bolducs),17611
201604,502,United States,580710,"Labels, badges and similar articles, of textile materials, in the piece, in strips or cut to shape or size, woven, not embroidered",61347
201604,502,United States,580790,"Labels, badges and similar articles, of textile materials, in the piece, in strips or cut to shape or size, not embroidered (excluding woven)",15527
201604,502,United States,580810,Braids in the piece,10766
201604,502,United States,580890,"Ornamental trimmings of textile materials, in the piece, not embroidered, other than knitted or crocheted; tassels, pompons and similar articles of textile materials (excluding braids in the piece)",15286
201604,502,United States,581091,"Embroidery of cotton on a textile fabric ground, in the piece, in strips or in motifs (excluding embroidery without visible ground)",859
201604,502,United States,581092,"Embroidery of man-made fibres on a textile fabric base, in the piece, in strips or in motifs (excluding embroidery without visible ground)",9002
201604,502,United States,581099,"Embroidery of materials other than cotton or man-made fibres, on a textile fabric base, in the piece, in strips or in motifs (excluding embroidery without visible ground)",5867
201604,502,United States,581100,"Quilted textile products in the piece, composed of one or more layers of textile materials assembled with padding by stitching or otherwise (excluding embroidery of heading 5810 and quilted fabrics for bedding and furnishings)",409784
201604,502,United States,590110,"Textile fabrics coated with gum or amylaceous substances, of a kind used for the outer covers of books or the like",31984
201604,502,United States,590190,Tracing cloth; prepared painting canvas; buckram and similar stiffened textile fabrics of a kind used for hat foundations (excluding plastic-coated textile fabrics),406
201604,502,United States,590210,"Tyre cord fabric of high-tenacity yarn of nylon or other polyamides, whether or not dipped or impregnated with rubber or plastic",28980
201604,502,United States,590310,"Textile fabrics impregnated, coated, covered or laminated with poly""vinyl chloride"" (excluding wallcoverings of textile materials impregnated or covered with poly""vinyl chloride""; floor coverings consisting of a textile backing and a top layer or covering of poly""vinyl chloride"")",616393
201604,502,United States,590320,"Textile fabrics impregnated, coated, covered or laminated with polyurethane (excluding wallcoverings of textile materials impregnated or covered with polyurethane; floor coverings consisting of a textile backing and a top layer or covering of polyurethane)",322376
201604,502,United States,590390,"Textile fabrics impregnated, coated, covered or laminated with plastics other than poly""vinyl chloride"" or polyurethane (excluding tyre cord fabric of high-tenacity yarn of nylon or other polyamides, polyesters or viscose rayon; wallcoverings of textile materials impregnated or covered with plastic; floor coverings consisting of a textile backing and a top layer or covering of plastics)",1422024
201604,502,United States,590500,Textile wall coverings.,60164
201604,502,United States,590610,Adhesive tape of a width not exceeding 20 cm,206900
201604,502,United States,590699,"Rubberised textile fabrics (excluding knitted or crocheted textile fabrics, adhesive tape of a width of ≤ 20 cm, and tyre cord fabric of high-tenacity yarn of nylon or other polyamides, polyesters or viscose rayon)",409179
201604,502,United States,590700,"Impregnated, coated or covered textile fabrics; painted canvas being theatrical scenery, studio backcloths or the like, n.e.s.",1531983
201604,502,United States,590800,"Textile wicks, woven, plaited or knitted, for lamps, stoves, lighters, candles or the like; incandescent gas mantles and tubular knitted gas-mantle fabric for incandescent gas mantles, whether or not impregnated",94561
201604,502,United States,590900,"Textile hosepiping and similar textile tubing, whether or not impregnated or coated, with or without lining, armour or accessories of other materials",82427
201604,502,United States,591000,"Transmission or conveyor belts or belting, of textile material, whether or not impregnated, coated, covered or laminated with plastics, or reinforced with metal or other material.",546428
201604,502,United States,591110,"Textile fabrics, felt and felt-lined woven fabrics, coated, covered or laminated with rubber, leather or other material, of a kind used for card clothing, and similar fabrics of a kind used for other technical purposes, incl. narrow fabrics made of velvet impregnated with rubber, for covering weaving spindles ""weaving beams""",83627
201604,502,United States,591120,"Bolting cloth, whether or not made up",188264
201604,502,United States,591131,"Textile fabrics and felts, endless or fitted with linking devices, of a kind used in papermaking or similar machines, e.g. for paper pulp or asbestos-cement, weighing ＜ 650 g/m2",85380
201604,502,United States,591132,"Textile fabrics and felts, endless or fitted with linking devices, of a kind used in papermaking or similar machines, e.g. for paper pulp or asbestos-cement, weighing ≥ 650 g/m2",214202
201604,502,United States,591140,"Filtering or straining cloth of a kind used in oil-presses or for similar technical purposes, incl. that of human hair",443127
201604,502,United States,591190,"Textile products and articles, for technical purposes, specified in Note 7 to chapter 59, n.e.s.",2792230
201604,502,United States,600110,"Long pile fabrics, knitted or crocheted",45116
201604,502,United States,600122,"Looped pile fabrics of man-made fibres, knitted or crocheted",57115
201604,502,United States,600191,"Pile fabrics of cotton, knitted or crocheted (excluding ""long pile"" fabrics)",858
201604,502,United States,600192,"Pile fabrics of man-made fibres, knitted or crocheted (excluding ""long pile"" fabrics)",497567
201604,502,United States,600199,"Pile fabrics, knitted or crocheted (excluding cotton or man-made fibres and ""long pile"" fabrics)",2217
201604,502,United States,600320,"Knitted or crocheted fabrics of cotton, of a width of ≤ 30 cm",124
201604,502,United States,600330,"Knitted or crocheted fabrics of synthetic fibres, of a width of ≤ 30 cm",2834
201604,502,United States,600410,"Knitted or crocheted fabrics, of a width of ＞ 30 cm, containing ≥ 5% by weight elastomeric yarn",236747
201604,502,United States,600490,"Knitted or crocheted fabrics, of a width of ＞ 30 cm, containing ≥ 5% by weight elastomeric yarn and rubber thread or rubber thread only",990
201604,502,United States,600531,-------,113723
201604,502,United States,600532,-------,278141
201604,502,United States,600533,-------,44964
201604,502,United States,600534,-------,1005
201604,502,United States,600542,"Dyed warp knit fabrics of artificial fibres ""incl. those made on galloon knitting machines"", of a width of ＞ 30 cm",1852
201604,502,United States,600622,"Dyed cotton fabrics, knitted or crocheted, of a width of ＞ 30 cm",3458
201604,502,United States,600623,"Cotton fabrics, knitted or crocheted, of yarns of different colours, of a width of ＞ 30 cm",6543
201604,502,United States,600631,"Unbleached or bleached fabrics, knitted or crocheted, of synthetic fibres, of a width of ＞ 30 cm",1051
201604,502,United States,600632,"Dyed fabrics, knitted or crocheted, of synthetic fibres, of a width of ＞ 30 cm",144332
201604,502,United States,600641,"Unbleached or bleached fabrics, knitted or crocheted, of artificial fibres, of a width of ＞ 30 cm",17664
201604,502,United States,600642,"Dyed fabrics, knitted or crocheted, of artificial fibres, of a width of ＞ 30 cm",676
201604,502,United States,600643,"Fabrics, knitted or crocheted, of artificial fibres, of yarns of different colours, of a width of ＞ 30 cm",1693
201604,502,United States,600690,"Fabrics, knitted or crocheted, of a width of ＞ 30 cm",34
201604,502,United States,610120,"Overcoats, car coats, capes, cloaks, anoraks, incl. ski jackets, windcheaters, wind-jackets and similar articles of cotton, for men or boys, knitted or crocheted",73
201604,502,United States,610130,"Overcoats, car coats, capes, cloaks, anoraks, incl. ski jackets, windcheaters, wind-jackets and similar articles of man-made fibres, for men or boys, knitted or crocheted",42060
201604,502,United States,610190,"Overcoats, car coats, capes, cloaks, anoraks, incl. ski jackets, windcheaters, wind-jackets and similar articles of textile materials, for men or boys, knitted or crocheted",1234
201604,502,United States,610220,"Women's or girls' overcoats, car coats, capes, cloaks, anoraks, incl. ski jackets, windcheaters, wind-jackets and similar articles of cotton, knitted or crocheted",518
201604,502,United States,610332,"Men's or boys' jackets and blazers of cotton, knitted or crocheted",3007
201604,502,United States,610333,"Men's or boys' jackets and blazers of synthetic fibres, knitted or crocheted",1790
201604,502,United States,610339,Men's or boys' jackets and blazers of textile materials,271
201604,502,United States,610342,"Men's or boys' trousers, bib and brace overalls, breeches and shorts of cotton, knitted or crocheted",14899
201604,502,United States,610343,"Men's or boys' trousers, bib and brace overalls, breeches and shorts of synthetic fibres, knitted or crocheted",35140
201604,502,United States,610349,"Men's or boys' trousers, bib and brace overalls, breeches and shorts of textile materials, knitted or crocheted",1704
201604,502,United States,610431,"Women's or girls' jackets and blazers of wool or fine animal hair, knitted or crocheted",188
201604,502,United States,610432,"Women's or girls' jackets and blazers of cotton, knitted or crocheted",5610
201604,502,United States,610433,"Women's or girls' jackets and blazers of synthetic fibres, knitted or crocheted",17627
201604,502,United States,610439,"Women's or girls' jackets and blazers of textile materials, knitted or crocheted",3700
201604,502,United States,610441,"Women's or girls' dresses of wool or fine animal hair, knitted or crocheted",109
201604,502,United States,610442,"Women's or girls' dresses of cotton, knitted or crocheted",7747
201604,502,United States,610443,"Women's or girls' dresses of synthetic fibres, knitted or crocheted",2492
201604,502,United States,610444,"Women's or girls' dresses of artificial fibres, knitted or crocheted",3668
201604,502,United States,610449,"Women's or girls' dresses of textile materials, knitted or crocheted",3710
201604,502,United States,610452,"Women's or girls' skirts and divided skirts of cotton, knitted or crocheted",1462
201604,502,United States,610453,"Women's or girls' skirts and divided skirts of synthetic fibres, knitted or crocheted",8357
201604,502,United States,610459,"Women's or girls' skirts and divided skirts of textile materials, knitted or crocheted",2178
201604,502,United States,610461,"Women's or girls' trousers, bib and brace overalls, breeches and shorts of wool or fine animal hair, knitted or crocheted",887
201604,502,United States,610462,"Women's or girls' trousers, bib and brace overalls, breeches and shorts of cotton, knitted or crocheted",27359
201604,502,United States,610463,"Women's or girls' trousers, bib and brace overalls, breeches and shorts of synthetic fibres, knitted or crocheted",34852
201604,502,United States,610469,"Women's or girls' trousers, bib and brace overalls, breeches and shorts of textile materials, knitted or crocheted",20035
201604,502,United States,610510,"Men's or boys' shirts of cotton, knitted or crocheted (excluding nightshirts, T-shirts, singlets and other vests)",17991
201604,502,United States,610520,"Men's or boys' shirts of man-made fibres, knitted or crocheted (excluding nightshirts, T-shirts, singlets and other vests)",8441
201604,502,United States,610610,"Women's or girls' blouses, shirts and shirt-blouses of cotton, knitted or crocheted (excluding T-shirts and vests)",5310
201604,502,United States,610620,"Women's or girls' blouses, shirts and shirt-blouses of man-made fibres, knitted or crocheted (excluding T-shirts and vests)",740
201604,502,United States,610690,"Women's or girls' blouses, shirts and shirt-blouses of textile materials, knitted or crocheted (excluding of cotton or man-made fibres, T-shirts and vests)",565
201604,502,United States,610711,"Men's or boys' underpants and briefs of cotton, knitted or crocheted",65
201604,502,United States,610821,"Women's or girls' briefs and panties of cotton, knitted or crocheted",310
201604,502,United States,610822,"Women's or girls' briefs and panties of man-made fibres, knitted or crocheted",156
201604,502,United States,610910,"T-shirts, singlets and other vests of cotton, knitted or crocheted",132096
201604,502,United States,610990,"T-shirts, singlets and other vests of textile materials, knitted or crocheted (excluding cotton)",98924
201604,502,United States,611011,"Jerseys, pullovers, cardigans, waistcoats and similar articles, of hair of Kashmir ""cashmere"" goats, knitted or crocheted (excluding quilted articles)",212
201604,502,United States,611012,"Jerseys, pullovers, cardigans, waistcoats and similar articles, of fine animal hair, knitted or crocheted (excluding from hair of Kashmir ""cashmere"" goats and quilted articles)",1611
201604,502,United States,611020,"Jerseys, pullovers, cardigans, waistcoats and similar articles, of man-made fibres, knitted or crocheted (excluding wadded waistcoats)",180943
201604,502,United States,611030,"Jerseys, pullovers, cardigans, waistcoats and similar articles, of textile materials, knitted or crocheted (excluding of wool, fine animal hair, cotton or man-made fibres, and wadded waistcoats)",23383
201604,502,United States,611090,"bies' garments and clothing accessories, knitted or crocheted (excluding hats)",1301
201604,502,United States,611120,"Babies' garments and clothing accessories of cotton, knitted or crocheted (excluding hats)",213
201604,502,United States,611211,"Track-suits of cotton, knitted or crocheted",1310
201604,502,United States,611241,"Women's or girls' swimwear of synthetic fibres, knitted or crocheted",16755
201604,502,United States,611300,"Garments, knitted or crocheted, rubberised or impregnated, coated or covered with plastics or other materials (excluding babies' garments and clothing accessories)",4659
201604,502,United States,611420,"Other garments of cotton, knitted or crocheted",8176
201604,502,United States,611430,"Other garments of man-made fibres, knitted or crocheted",11525
201604,502,United States,611510,"Graduated compression hosiery [e.g., stockings for varicose veins], of textile materials, knitted or crocheted (excluding hosiery for babies)",15884
201604,502,United States,611521,"Pantyhose and tights of synthetic fibres, knitted or crocheted, measuring per single yarn ＜ 67 decitex (excluding graduated compression hosiery)",266
201604,502,United States,611529,"Pantyhose and tights of textile materials, knitted or crocheted (excluding graduated compression hosiery, those of synthetic fibres and hosiery for babies)",102
201604,502,United States,611595,"Full-length or knee-length stockings, socks and other hosiery, incl. footwear without applied soles, of cotton, knitted or crocheted (excluding graduated compression hosiery, pantyhose and tights, women's full-length or knee-length stockings, measuring per single yarn ＜ 67 decitex, and hosiery for babies)",6696
201604,502,United States,611596,"Full-length or knee-length stockings, socks and other hosiery, incl. footwear without applied soles, of synthetic fibres, knitted or crocheted (excluding graduated compression hosiery, pantyhose and tights, women's full-length or knee-length stockings, measuring per single yarn ＜ 67 decitex, and hosiery for babies)",18479
201604,502,United States,611599,"Full-length or knee-length stockings, socks and other hosiery, incl. footwear without applied soles, of textile materials, knitted or crocheted (excluding of wool, fine animal hair, cotton or synthetic fibres, graduated compression hosiery, pantyhose and tights, women's full-length or knee-length stockings, measuring per single yarn ＜ 67 decitex, and hosiery for babies)",49
201604,502,United States,611610,"Gloves, mittens and mitts, impregnated, coated or covered with plastics or rubber, knitted or crocheted",7853
201604,502,United States,611691,"Gloves, mittens and mitts, of wool or fine animal hair, knitted or crocheted (excluding for babies)",23
201604,502,United States,611692,"Gloves, mittens and mitts, of cotton, knitted or crocheted (excluding impregnated, coated or covered with plastics or rubber, and for babies)",5590
201604,502,United States,611693,"Gloves, mittens and mitts, of synthetic fibres, knitted or crocheted (excluding impregnated, coated or covered with plastics or rubber, and for babies)",10748
201604,502,United States,611699,"Gloves, mittens and mitts, of textile materials, knitted or crocheted (excluding of wool, fine animal hair, cotton or synthetic fibres, impregnated, coated or covered with plastics or rubber, and for babies)",45
201604,502,United States,611780,"Ties, bow ties, cravats and other made-up clothing accessories, knitted or crocheted, n.e.s. (excluding shawls, scarves, mufflers, mantillas, veils and the like)",2274
201604,502,United States,620112,"Men's or boys' overcoats, raincoats, car coats, capes, cloaks and similar articles, of cotton",2693
201604,502,United States,620119,"Men's or boys' overcoats, raincoats, car coats, capes, cloaks and similar articles, of textile materials (excluding of wool or fine animal hair, cotton or man-made fibres, knitted or crocheted)",200
201604,502,United States,620192,"Men's or boys' anoraks, windcheaters, wind jackets and similar articles, of cotton (not knitted or crocheted and excluding suits, ensembles, jackets, blazers, trousers and tops of ski suits)",149
201604,502,United States,620193,"Men's or boys' anoraks, windcheaters, wind jackets and similar articles, of man-made fibres (not knitted or crocheted and excluding suits, ensembles, jackets, blazers, trousers and tops of ski suits)",2739
201604,502,United States,620199,"Men's or boys' anoraks, incl. ski jackets, windcheaters, wind-jackets and similar articles of textile materials (excluding of wool, fine animal hair, cotton or man-made fibres, knitted or crocheted, suits, ensembles, jackets, blazers and trousers)",3430
201604,502,United States,620211,"Women's or girls' overcoats, raincoats, car coats, capes, cloaks and similar articles, of wool or fine animal hair",46
201604,502,United States,620212,"Women's or girls' overcoats, raincoats, car coats, capes, cloaks and similar articles, of cotton",933
201604,502,United States,620213,"Women's or girls' overcoats, raincoats, car coats, capes, cloaks and similar articles, of man-made fibres",9483
201604,502,United States,620219,"Women's or girls' overcoats, raincoats, car coats, capes, cloaks and similar articles, of textile materials (excluding of wool or fine animal hair, cotton or man-made fibres, knitted or crocheted)",5667
201604,502,United States,620291,"Women's or girls' anoraks, incl. ski jackets, windcheaters, wind-jackets and similar articles, of wool or fine animal hair (excluding knitted or crocheted, suits, ensembles, jackets, blazers and trousers)",83
201604,502,United States,620292,"Women's or girls' anoraks, windcheaters, wind jackets and similar articles, of cotton (not knitted or crocheted and excluding suits, ensembles, jackets, blazers, trousers and tops of ski suits)",2443
201604,502,United States,620293,"Women's or girls' anoraks, windcheaters, wind jackets and similar articles, of man-made fibres (not knitted or crocheted and excluding suits, ensembles, jackets, blazers, trousers and tops of ski suits)",145
201604,502,United States,620311,"Men's or boys' suits of wool or fine animal hair (excluding knitted or crocheted, tracksuits, ski suits and swimwear)",160
201604,502,United States,620322,"Men's or boys' ensembles of cotton (excluding knitted or crocheted, ski ensembles and swimwear)",216
201604,502,United States,620331,"Men's or boys' jackets and blazers of wool or fine animal hair (excluding knitted or crocheted, and wind-jackets and similar articles)",2694
201604,502,United States,620332,"Men's or boys' jackets and blazers of cotton (excluding knitted or crocheted, and wind-jackets and similar articles)",12916
201604,502,United States,620333,"Men's or boys' jackets and blazers of synthetic fibres (excluding knitted or crocheted, and wind-jackets and similar articles)",8402
201604,502,United States,620341,"Men's or boys' trousers, bib and brace overalls, breeches and shorts, of wool or fine animal hair (excluding knitted or crocheted, underpants and swimwear)",1448
201604,502,United States,620342,"Men's or boys' trousers, bib and brace overalls, breeches and shorts, of cotton (excluding knitted or crocheted, underpants and swimwear)",203288
201604,502,United States,620343,"Men's or boys' trousers, bib and brace overalls, breeches and shorts of synthetic fibres (excluding knitted or crocheted, underpants and swimwear)",2456
201604,502,United States,620349,"Men's or boys' trousers, bib and brace overalls, breeches and shorts of textile materials (excluding of wool, fine animal hair, cotton or synthetic fibres, knitted or crocheted, underpants and swimwear)",1927
201604,502,United States,620431,"Women's or girls' jackets and blazers of wool or fine animal hair (excluding knitted or crocheted, wind-jackets and similar articles)",4257
201604,502,United States,620432,"Women's or girls' jackets and blazers of cotton (excluding knitted or crocheted, wind-jackets and similar articles)",38145
