Date of data,Trading partner code,Trading partner,Commodity code,Commodity,US dollar
202310,502,United States,842119,"Centrifuges, incl. centrifugal dryers (excluding isotope separators, cream separators and clothes dryers)",3864104.0
202310,502,United States,842121,Machinery and apparatus for filtering or purifying water,3529841.0
202310,502,United States,842122,Machinery and apparatus for filtering or purifying beverages (excludingwater),6785.0
202310,502,United States,842123,Oil or petrol-filters for internal combustion engines,3291455.0
202310,502,United States,842129,"Machinery and apparatus for filtering or purifying liquids (excluding such machinery and apparatus for water and other beverages, oil or petrol-filters for internal combustion engines and artificial kidneys)",10809426.0
202310,502,United States,842131,Intake air filters for internal combustion engines,762501.0
202310,502,United States,842132,"Catalytic converters or particulate filters, whether or not combined, for purifying or filtering exhaust gases from internal combustion engines",3604242.0
202310,502,United States,842139,Machinery and apparatus for filtering or purifying gases (excluding isotope separators and intake air filters for internal combustion engines),13817397.0
202310,502,United States,842191,"Parts of centrifuges, incl. centrifugal dryers, n.e.s.",1229744.0
202310,502,United States,842199,"Parts of machinery and apparatus for filtering or purifying liquids or gases, n.e.s.",32493588.0
202310,502,United States,842211,Dishwashing machines of the household type,3661.0
202310,502,United States,842230,"Machinery for filling, closing, sealing or labelling bottles, cans, boxes, bags or other containers; machinery for capsuling bottles, jars, tubes and similar containers; machinery for aerating beverages",195711.0
202310,502,United States,842240,"Packing or wrapping machinery, incl. heat-shrink wrapping machinery (excluding machinery for filling, closing, sealing or labelling bottles, cans, boxes, bags or other containers and machinery for capsuling bottles, jars, tubes and similar containers)",2233626.0
202310,502,United States,842290,"Parts of dishwashing machines, packing or wrapping machinery and other machinery and apparatus of heading 8422, n.e.s.",338712.0
202310,502,United States,842310,"Personal weighing machines, incl. baby scales; household scales",538.0
202310,502,United States,842381,"Weighing machinery having a maximum weighing capacity ≤ 30 kg (excluding balances of a sensitivity of 5 cg or better, personal weighing machines, household scales, scales for continuous weighing of goods on conveyors, constant weight scales and scales for discharging a pre-determined weight of material into a bag or container, incl. hopper scales)",13504.0
202310,502,United States,842382,"Weighing machinery of a maximum weighing capacity ＞ 30 kg but ≤ 5.000 kg (excluding personal weighing machines, scales for continuous weighing of goods on conveyors, constant weight scales and scales for discharging a pre-determined weight of material into a bag or container, incl. hopper scales)",45094.0
202310,502,United States,842389,Weighing machinery of a maximum weighing capacity ＞ 5.000 kg,12423.0
202310,502,United States,842390,"Weighing machine weights of all kinds; parts of weighing machinery, n.e.s.",36984.0
202310,502,United States,842410,"Fire extinguishers, whether or not charged",2754812.0
202310,502,United States,842420,Spray guns and similar appliances,1877098.0
202310,502,United States,842430,Steam or sand blasting machines and similar jet projecting machines,1352904.0
202310,502,United States,842441,"Agricultural or horticultural sprayers, portable",421.0
202310,502,United States,842449,Agricultural or horticultural sprayers (excl. portable),404876.0
202310,502,United States,842482,"Agricultural or horticultural mechanical appliances, whether or not hand-operated, for projecting or dispersing liquids or powders (excl. sprayers)",193552.0
202310,502,United States,842489,"Mechanical appliances, whether or not hand-operated, for projecting, dispersing or spraying liquids or powders, n.e.s.",12951208.0
202310,502,United States,842490,"Parts of fire extinguishers, spray guns and similar appliances, steam or sand blasting machines and similar jet projecting machines and machinery and apparatus for projecting, dispersing or spraying liquids or powders, n.e.s.",5180232.0
202310,502,United States,842511,"Pulley tackle and hoists, powered by electric motor (other than skip hoists or hoists of a kind used for raising vehicles)",116122.0
202310,502,United States,842519,"Pulley tackle and hoists (other than skip hoists or hoists of a kind used for raising vehicles), non-powered by electric motor",20388.0
202310,502,United States,842531,Winches and capstans powered by electric motor,886362.0
202310,502,United States,842539,"Winches and capstans, non-powered by electric motor",131141.0
202310,502,United States,842542,"Jacks and hoists, hydraulic (excluding built-in jacking systems used in garages)",73662.0
202310,502,United States,842549,"Jacks and hoists of a kind used for raising vehicles, not hydraulic",117408.0
202310,502,United States,842619,"Overhead travelling cranes, transporter cranes, gantry cranes, bridge cranes and mobile lifting frames (excluding overhead travelling cranes on fixed support, mobile lifting frames on tyres, straddle carriers and portal or pedestal jib cranes)",887250.0
202310,502,United States,842710,Selfpropelled trucks powered by an electric motor,1032072.0
202310,502,United States,842790,"Works trucks fitted with lifting or handling equipment, not self-propelled",883567.0
202310,502,United States,842810,Lifts and skip hoists,31550.0
202310,502,United States,842820,Pneumatic elevators and conveyors,36628.0
202310,502,United States,842832,"Continuous-action elevators and conveyors, for goods or materials, bucket type",12917.0
202310,502,United States,842839,"Continuous-action elevators and conveyors, for goods or materials (excluding those for underground use and bucket, belt or pneumatic types)",7420300.0
202310,502,United States,842870,Industrial robots,4093.0
202310,502,United States,842890,"Machinery for lifting, handling, loading or unloading, nes",1459808.0
202310,502,United States,842911,"Bulldozers and angledozers,track laying",115770.0
202310,502,United States,842951,Frontend shovel loaders,521955.0
202310,502,United States,843010,Piledrivers and pileextractors,4338.0
202310,502,United States,843020,Snowploughs and snowblowers,12684.0
202310,502,United States,843031,"Other, self-propelled coal or rock cutters and tunnelling machinery",4298581.0
202310,502,United States,843049,"Other, boring or sinking machinery for boring earth or extracting minerals or ores, not self-propelled and not hydraulic",1108226.0
202310,502,United States,843110,Part of machinery of heading 84.25,205882.0
202310,502,United States,843120,Part of machinery of heading 84.27,430590.0
202310,502,United States,843131,"Part off lifts, skip hoists or escalators, of heading 84.28",163951.0
202310,502,United States,843139,"Parts of machinery of heading 8428, n.e.s.",3909178.0
202310,502,United States,843141,"Buckets, shovels, grabs and grips",2912.0
202310,502,United States,843143,Parts for boring or sinking machinery of subheading 8430.41 or,3045966.0
202310,502,United States,843149,"Parts of machinery of heading 8426, 8429 and 8430, n.e.s.",4135933.0
202310,502,United States,843242,Fertiliser distributors,91314.0
202310,502,United States,843280,"Agricultural, horticultural or forestry machinery for soil preparation or cultivation; lawn or sports-ground rollers (excluding sprayers and dusters, ploughs, harrows, scarifiers, cultivators, weeders, hoes, seeders, planters, manure spreaders and fertiliser distributors)",6319.0
202310,502,United States,843290,"Parts of agricultural, horticultural or forestry machinery for soil preparation or cultivation or of lawn or sports-ground rollers, n.e.s.",1646602.0
202310,502,United States,843311,"Powered, with the cutting device rotating in a horizontal plane",274201.0
202310,502,United States,843319,"Mowers for lawns, parks or sports grounds, powered, with the cutting device rotating in a vertical plane or with cutter bars",107790.0
202310,502,United States,843320,"Other mowers, including cutter bars for tractor mounting",724303.0
202310,502,United States,843340,"Straw or fodder balers, including pickup balers",167402.0
202310,502,United States,843351,Combine harvester-threshers,1996986.0
202310,502,United States,843359,"Harvesting machinery for agricultural produce (excluding mowers, haymaking machinery, straw and fodder balers, incl. pick-up balers, combine harvester-threshers, other threshing machinery and root or tuber harvesting machines)",1701750.0
202310,502,United States,843390,"Parts of harvesting machinery, threshing machinery, mowers and machines for cleaning, sorting or grading agricultural produce, n.e.s.",2496643.0
202310,502,United States,843410,Milking machines,141529.0
202310,502,United States,843490,"Parts of milking machines and dairy machinery, n.e.s.",324605.0
202310,502,United States,843629,"Poultry-keeping machinery (excluding machines for sorting or grading eggs, poultry pickers of heading 8438 and incubators and brooders)",152259.0
202310,502,United States,843680,"Agricultural, horticultural, forestry or bee-keeping machinery, n.e.s.",48629.0
202310,502,United States,843699,"Parts of agricultural, horticultural, forestry or bee-keeping machinery of heading 84.36, n.e.s.",9685.0
202310,502,United States,843710,"Machines for cleaning, sorting or grading seed, grain or dried leguminous vegetables",316914.0
202310,502,United States,843780,"Machinery used in the milling industry or for the working of cereals or dried leguminous vegetables (excluding farm-type machinery, heat treatment equipment, centrifugal dryers, air filters and machines for cleaning, sorting or grading seed, grain or dried leguminous vegetables)",36600.0
202310,502,United States,843790,"Parts of machinery used in the milling industry or for the working of cereals or dried leguminous vegetables or machines for cleaning, sorting or grading seed, grain or dried leguminous vegetables, n.e.s.",7454.0
202310,502,United States,843810,"Bakery machinery and machinery for the manufacture of macaroni, spaghetti or similar products",13018.0
202310,502,United States,843850,Machinery for the preparation of meat or poultry,145286.0
202310,502,United States,843860,"Machinery for the preparation of fruits, nuts or vegetables",324477.0
202310,502,United States,843880,"Machinery for the industrial preparation or manufacture of food or drink, nes",76808.0
202310,502,United States,843890,"Parts of machinery for the industrial preparation or manufacture of food or drink, nes",670806.0
202310,502,United States,843930,Machinery for finishing paper or paperboard,12430.0
202310,502,United States,843991,"Parts of machinery for making pulp of fibrous cellulosic material, n.e.s.",2107844.0
202310,502,United States,843999,"Parts of machinery for making or finishing paper or paperboard, n.e.s.",164026.0
202310,502,United States,844090,"Parts of bookbinding machinery, n.e.s.",896.0
202310,502,United States,844190,"Parts of machinery for making up paper pulp, paper or paperboard, n.e.s.",234256.0
202310,502,United States,844230,"Machinery, apparatus and equipment",61217.0
202310,502,United States,844240,"Parts of the foregoing machinery, apparatus or equipment",16718.0
202310,502,United States,844250,"Plates, cylinders and other printing components; plates, cylinders and lithographic stones, prepared for printing purposes (for example, planed, grained or polished)",73026.0
202310,502,United States,844313,Other offset printing machinery,2334331.0
202310,502,United States,844331,"Machines which perform two or more of the functions of printing, copying or facsimile transmission, capable of connecting to an automatic data processing machine or to a network",313535.0
202310,502,United States,844332,"Other, capable of connecting to an automatic data processing machine or to a network",1089458.0
202310,502,United States,844339,"Printers, copying machines and facsimile machines, whether or not combined (excluding those capable of connecting to an automatic data processing machine or to a network and printing machinery used for printing by means of plates, cylinders and other printing components of heading 8442)",21749.0
202310,502,United States,844391,"Parts and accessories of printing machinery used for printing by means of plates, cylinders and other printing components of heading 84.42",167013.0
202310,502,United States,844399,"Parts and accessories of printers, copying machines and facsimile machines, n.e.s. (excluding of printing machinery used for printing by means of plates, cylinders and other printing components of heading 8443)",11093039.0
202310,502,United States,844610,Weaving machines for weaving fabrics of a width ≤ 30 cm,51253.0
202310,502,United States,844790,"Machines for making gimped yarn, tulle, lace, embroidery, trimmings, braid or net and machines for tufting (excluding chain or blanket stitch machines)",107762.0
202310,502,United States,844820,Parts and accessories of machines of heading 84.44 or of their auxiliary machinery,11632.0
202310,502,United States,844831,Card clothing,146089.0
202310,502,United States,844832,"Parts and accessories of machines for preparing textile fibres, n.e.s. (other than card clothing)",11.0
202310,502,United States,844833,"Spindles, spindle flyers, spinning rings and ring travellers",249649.0
202310,502,United States,844839,"Parts and accessories of machines of heading 8445, n.e.s.",12428.0
202310,502,United States,844849,"Parts and accessories of weaving machines (looms)and their auxiliary machinery, n.e.s.",25509.0
202310,502,United States,844851,"Sinkers, needles and other articles used in forming stitches",135.0
202310,502,United States,844859,"Parts and accessories of machines of heading 8447, n.e.s.",40397.0
202310,502,United States,845011,"Fully-automatic household or laundry-type washing machines, of a dry linen capacity ≤ 6 kg",2777.0
202310,502,United States,845020,"Laundry-type washing machines, each of a dry linen capacity exceeding 10 kg",37842.0
202310,502,United States,845090,"Parts of household or laundry-type washing machines, n.e.s.",12450.0
202310,502,United States,845121,"Drying machines, of a dry linen capacity ≤ 10 kg (excluding centrifugal driers)",2019.0
202310,502,United States,845129,"Drying machines for textile yarns, fabrics or made-up textile articles (excluding machines of a dry linen capacity ≤ 10 kg and centrifugal driers)",10928.0
202310,502,United States,845150,"Machines for reeling, unreeling, folding, cutting or pinking textile fabrics",515674.0
202310,502,United States,845180,"Machinery for dressing, finishing, coating or impregnating textile yarns, fabrics or other made-up textile articles and machines used in the manufacture of linoleum or other floor coverings for applying the paste to the base fabric or other support (excluding machinery for dressing or finishing felt, calenders and general purpose presses)",20053.0
202310,502,United States,845190,"Parts of machines for washing, cleaning, wringing, drying, ironing, pressing, bleaching, dyeing, dressing, finishing, coating or impregnating textile yarns, fabrics or made-up textile articles; parts of machines used in the manufacture of linoleum or other floor coverings for applying the paste to the base fabric or other support; parts of machines for reeling, unreeling, folding, cutting or pinking textile fabrics, n.e.s.",21922.0
202310,502,United States,845210,Sewing machines of the household type,17853.0
202310,502,United States,845290,"Furniture, bases and covers for sewing machines and parts thereof; other parts of sewing machines",563.0
202310,502,United States,845420,Ingot moulds and ladles,1329787.0
202310,502,United States,845490,"Parts of converters, ladles, ingot moulds and casting machines of a kind used in metallurgy or in metal foundries, n.e.s.",139119.0
202310,502,United States,845521,Hot or combination hot and cold metal-rolling mills (excluding tubes mills),7661022.0
202310,502,United States,845530,Rolls for rolling mills,708325.0
202310,502,United States,845590,"Parts of metal-rolling mills, n.e.s.",1065254.0
202310,502,United States,845611,"Machine tools for working any material by removal of material, operated by laser (excl. soldering and welding machines, also those which can be used for cutting, material testing machines and machines for the manufacture of semiconductor devices or of electronic integrated circuits)",978427.0
202310,502,United States,845630,"Machine tools for working any material by removal of material, operated by electro-discharge processes",161468.0
202310,502,United States,845640,"Machine tools for working any material by removal of material, operated by plasma arc processes",577012.0
202310,502,United States,845650,Water-jet cutting machines,230779.0
202310,502,United States,845690,"Machine tools for working any material by removal of material, operated by electro-chemical processes or electron beam, ion beam or plasma arc processes; water-jet cutting machines (excluding for soldering and welding machines, materials testing machines and machines for the manufacture of semiconductor devices or of electronic integrated circuits)",179506.0
202310,502,United States,845710,Machining centres,4133317.0
202310,502,United States,845811,"Horizontal lathes, incl. turning centres, for removing metal, numerically controlled",1399210.0
202310,502,United States,845819,"Horizontal lathes, incl. turning centres, for removing metal, not numerically controlled",50057.0
202310,502,United States,846040,"Honing or lapping machines, for working metals, metal carbides or cermets (excluding gear cutting, gear grinding or gear finishing machines)",190898.0
202310,502,United States,846090,"Machines for deburring, grinding or polishing metals, metal carbides or cermets (excluding grinding machines in which the positioning in any one axis can be set up to an accuracy of at least 0,01 mm, gear cutting, gear grinding or gear finishing machines and machines for working in the hand)",52493.0
202310,502,United States,846150,Sawing or cuttingoff machines,8519.0
202310,502,United States,846211,Closed die forging machines,4186156.0
202310,502,United States,846229,"Other bending, folding, straightening or flattening machines (including press brakes) for flat products, not numerically controlled",14743.0
202310,502,United States,846242,"Numerically controlled punching, notching or nibbling machines (excluding presses) for flat products including combined punching and shearing machines",2206166.0
202310,502,United States,846259,"Machines for working tube, pipe, hollow section and bar (excluding presses), not numerically controlled",6737.0
202310,502,United States,846262,Mechanical presses,614229.0
202310,502,United States,846290,Other presses for working metal or metal carbides,24576.0
202310,502,United States,846320,Thread rolling machines,51300.0
202310,502,United States,846410,"Sawing machines for working stone, ceramics, concrete, asbestos-cement or like mineral materials or for cold-working glass",4433.0
202310,502,United States,846420,"Grinding or polishing machines, for working stone, ceramics, concrete, asbestos-cement or like mineral materials or for cold-working glass",10128.0
202310,502,United States,846490,"Machine tools for working stones, concrete, asbestos cement or similar mineral substances or for cold-working glass (excluding sawing machines, grinding machines, polishing machines, hand-operated machines and machines for scribing or scoring semiconductor wafers)",1539148.0
202310,502,United States,846592,"Planing, milling or moulding -by cutting- machines, for working wood, cork, bone, hard rubber, hard plastics or similar hard materials (excluding machines for working in the hand and machines of subheading 8465.10)",274710.0
202310,502,United States,846593,"Grinding, sanding or polishing machines for working wood, cork, bone, hard rubber, hard plastics or similar hard materials (excluding machines for working in the hand)",8613.0
202310,502,United States,846595,"Drilling or mortising machines for working wood, cork, bone, hard rubber, hard plastics or similar hard materials (excluding machines for working in the hand and machines of subheading 8465.10)",9588.0
202310,502,United States,846610,"Tool holders, incl. tool holders for any type of tool for working in the hand, and self-opening dieheads, for machine tools",408868.0
202310,502,United States,846620,Work holders for machine tools,1037536.0
202310,502,United States,846630,"Dividing heads and other special attachments for machine tools, n.e.s.",75431.0
202310,502,United States,846691,"Parts and accessories for machine tools for working stone, ceramics, concrete, asbestos-cement or like mineral materials or for cold-working glass, n.e.s.",102687.0
202310,502,United States,846692,"Parts and accessories for machine tools for working wood, cork, bone, hard rubber, hard plastics or similar hard materials, nes",1727.0
202310,502,United States,846693,"Parts and accessories for machine tools for working metal by removing material, n.e.s.",2589819.0
202310,502,United States,846694,"Parts and accessories for machine tools for working metal without removing material, nes",712435.0
202310,502,United States,846711,Rotary type (including combined rotary-percussion),264317.0
202310,502,United States,846719,"Pneumatic tools for working in the hand, non-rotary type",275587.0
202310,502,United States,846721,"Drills of all kinds for working in the hand, with self-contained electric motor",319.0
202310,502,United States,846722,"Saws for working in the hand, with self-contained electric motor",135165.0
202310,502,United States,846729,"Electromechanical tools for working in the hand, with self-contained electric motor (excluding saws and drills)",427820.0
202310,502,United States,846781,"Chain saws, with self-contained electric motor",55358.0
202310,502,United States,846789,"Tools for working in the hand, hydraulic or with self-contained non-electric motor (excluding chainsaws and pneumatic tools)",519006.0
202310,502,United States,846791,"Parts of chainsaws, for working in the hand, with self-contained electric or non-electric motor, n.e.s.",103154.0
202310,502,United States,846792,"Parts of pneumatic tools for working in the hand, n.e.s.",378338.0
202310,502,United States,846799,"Parts of pneumatic tools for working in the hand, hydraulic or with self-contained electric or non-electric motor, n.e.s.",1086875.0
202310,502,United States,846810,Handheld blow pipes,520.0
202310,502,United States,846880,"Machinery and apparatus for welding, not gas-operated (excluding electric machines and apparatus of heading 8515)",92419.0
202310,502,United States,846890,"Parts of machinery and apparatus for soldering, brazing, welding or surface tempering, non-electric, n.e.s.",242730.0
202310,502,United States,847010,"Electronic calculators capable of operation without an external source of electric power and pocketsize data recording, reproducing and displaying machines with calculating functions",489.0
202310,502,United States,847090,"Accounting machines, postage-franking machines, ticket-issuing machines and similar machines, incorporating a calculating device (excluding calculating machin, cash registers and automatic vending machines)",2106.0
202310,502,United States,847130,"Portable automatic data processing machines, weighing not more than 10 kg, consisting of at least a central processing unit, a keyboard and a display",119515.0
202310,502,United States,847141,"Comprising in the same housing at least a central processing unit and an input and output unit, whether or not combined",503853.0
202310,502,United States,847149,"Other, presented in the form of systems",2733635.0
202310,502,United States,847150,"Processing units other than those of subheading 8471.41 or 8471.49, whether or not containing in the same housing one or two of the following types of unit : storage units, input units, output units",13278039.0
202310,502,United States,847160,"Input or output units, whether or not containing storage units in the same housing",1009618.0
202310,502,United States,847170,Storage units,3300643.0
202310,502,United States,847180,Other units of automatic data processing machines,2106290.0
202310,502,United States,847190,"Magnetic or optical readers, machines for transcribing data onto data media in coded form and machines for processing such data, n.e.s.",559209.0
202310,502,United States,847290,"Office machines, n.e.s.",29724.0
202310,502,United States,847329,"Parts and accessories of non-electronic calculators for accounting machines, cash registers or other machines, incorporating a calculating device, of heading 8470, n.e.s.",28356.0
202310,502,United States,847330,Parts and accessories of the machines of heading 84.71,3394964.0
202310,502,United States,847340,Parts and accessories of the machines of heading 84.72,30102.0
202310,502,United States,847350,Parts and accessories equally suitable for use with the machines of two or more of the headings 84.70 to 84.72,3176.0
202310,502,United States,847410,"Sorting, screening, separating or washing machines",479800.0
202310,502,United States,847439,"Machinery for mixing or kneading solid mineral substances, incl. those in powder or paste form",5176.0
202310,502,United States,847480,"Machinery for agglomerating, shaping or moulding solid mineral fuels, ceramic paste, unhardened cements, plastering materials and other mineral products in powder or paste form; machines for forming foundry moulds of sand",135221.0
