Date of data,Trading partner code,Trading partner,Commodity code,Commodity,US dollar
202507,502,United States,380400,"Residual lyes from the manufacture of wood pulp, whether or not concentrated, desugared or chemically treated, including lignin sulphonates, but excluding tall oil of heading 38.03.",337251.0
202507,502,United States,380590,"Crude dipentene; sulphite turpentine and other crude para-cymene; terpenic oils produced by the distillation or other treatment of coniferous woods (excluding gum turpentine, wood turpentine and sulphate turpentine)",215.0
202507,502,United States,380610,Rosin and resin acids,808.0
202507,502,United States,380620,"Salts of rosin, of resin acids or of derivatives of rosin or resin acids, other than salts of rosin adducts",42944.0
202507,502,United States,380630,Ester gums,126684.0
202507,502,United States,380690,"Derivatives of rosin, incl. salts of rosin adducts, and of resin acids, light and heavy resin oils and modified natural resins obtained by heat treatment run gums"" (excluding salts of rosin, of resin acids or salts of derivatives of rosin or resin acids, and ester gums)""",1892.0
202507,502,United States,380700,"Wood tar; wood tar oils; wood creosote; wood naphtha; vegetable pitch; brewers' pitch and similar preparations based on rosin, resin acids or on vegetable pitch.",97665.0
202507,502,United States,380891,Insecticides,528987.0
202507,502,United States,380892,Fungicides,635385.0
202507,502,United States,380893,"Herbicides, antisprouting products and plantgrowth regulators",384933.0
202507,502,United States,380894,Disinfectants,2155641.0
202507,502,United States,380991,"Other finishing agents and like, of a kind used in the textile or like industries",1432361.0
202507,502,United States,380992,"Other finishing agents and like, of a kind used in the paper or like industries",1301162.0
202507,502,United States,380993,"Other finishing agents and like, of a kind used in the leather or like industries",430374.0
202507,502,United States,381010,"Pickling preparations for metal surfaces; soldering, brazing or welding powders and pastes consisting of metal and other materials",1049243.0
202507,502,United States,381090,"Fluxes and other auxiliary preparations for soldering, brazing or welding;preparations of a kind used as cores or coatings for welding electrodes or rods",865544.0
202507,502,United States,381121,"Additives for lubricating oils,containing petroleum oils or oils obtained from bituminous minerals",19042329.0
202507,502,United States,381129,Other additives for lubricating oils,4473090.0
202507,502,United States,381190,"Oxidation inhibitors, gum inhibitors, viscosity improvers, anti-corrosive preparations and other prepared additives for mineral oils, incl. gasoline, or for other liquids used for the same purposes as mineral oils (excluding anti-knock preparations and oil lubricant additives)",1274118.0
202507,502,United States,381210,Prepared rubber accelerators,246613.0
202507,502,United States,381220,Compound plasticisers for rubber or plastics,66729.0
202507,502,United States,381239,"Anti-oxidising preparations and other compound stabilisers for rubber or plastics (excl. mixtures of oligomers of 2,2,4-trimethyl-1,2-dihydroquinoline TMQ"")""",1047109.0
202507,502,United States,381300,Preparations and charges for fireextinguishers; charged fireextinguishing grenades,569922.0
202507,502,United States,381400,"Organic composite solvents and thinners, not elsewhere specified or included; prepared paint or varnish removers.",323566.0
202507,502,United States,381511,Supported catalysts with nickel or nickel compounds as the active substance,15587057.0
202507,502,United States,381512,Supported catalysts with precious metal or precious metal compounds as the active substance,84517324.0
202507,502,United States,381519,"Supported catalysts, n.e.s. (excluding with precious metal, a precious-metal compound, nickel or a nickel compound as the active substance)",28811308.0
202507,502,United States,381590,"Reaction initiators, reaction accelerators and catalytic preparations, n.e.s. (excluding rubber accelerators and supported catalysts)",4907394.0
202507,502,United States,381600,"Refractory cements, mortars, concretes and similar compositions, other than products of heading 38.01",361743.0
202507,502,United States,381800,"Chemical elements doped for use in electronics, in the form of discs, wafers or similar forms; chemical compounds doped for use in electronics. form of",18230215.0
202507,502,United States,381900,"Hydraulic brake fluids and other prepared liquids for hydraulictransmission, not containing or containing less than 70% byweight of petroleum oils or oils obtained from bituminousminerals.",1343109.0
202507,502,United States,382000,Antifreezing preparations and prepared deicing fluids.,214269.0
202507,502,United States,382100,"Prepared culture media for the development or maintenance of microorganisms (including viruses and the like) or of plant, human or animal cells.",6374732.0
202507,502,United States,382211,"Diagnostic or laboratory reagents on a backing, prepared diagnostic or laboratory reagents, for malaria",2686.0
202507,502,United States,382212,"Diagnostic or laboratory reagents on a backing, prepared diagnostic or laboratory reagents whether or not on a backing, for Zika and other diseases transmitted by mosquitoes of the genus Aedes",13203.0
202507,502,United States,382213,"Diagnostic or laboratory reagents on a backing, prepared diagnostic or laboratory reagents whether or not on a backing, for blood-grouping",70037.0
202507,502,United States,382219,"Other diagnostic or laboratory reagents attached to backing and dispensing reagents, whether or not attached to backing",113692575.0
202507,502,United States,382290,Certified reference sample,3168008.0
202507,502,United States,382311,Stearic acid,6565.0
202507,502,United States,382313,Tall oil fatty acids,117617.0
202507,502,United States,382319,"Fatty acids, industrial, monocarboxylic; acid oils from refining (excluding stearic acid, oleic acid and tall oil fatty acids)",38890.0
202507,502,United States,382370,Industrial fatty alcohols,4143954.0
202507,502,United States,382410,Prepared binders for foundry moulds or cores,1507.0
202507,502,United States,382430,Nonagglomerated metal carbides mixed together or with metallic binders,191812.0
202507,502,United States,382440,"Prepared additives for cements, mortars or concretes",236818.0
202507,502,United States,382450,Nonrefractory mortars and concretes,4887500.0
202507,502,United States,382481,"Goods specified in subheading note 3 to chapter 38, containing oxirane (ethylene oxide)",7532.0
202507,502,United States,382499,"Chemical products and preparations of the chemical or allied industries, incl. those consisting of mixtures of natural products, n.e.s.",55330738.0
202507,502,United States,382600,"Biodiesel and mixtures thereof, not containing or containing less than 70% by weight of petroleum oils or oils obtained from bituminous minerals.",44059.0
202507,502,United States,390110,Polyethylene having a specific gravity of less than 0.94,15613676.0
202507,502,United States,390120,Polyethylene having a specific gravity of 0.94 or more,18049562.0
202507,502,United States,390130,Ethylenevinyl acetate copolymers,2079919.0
202507,502,United States,390140,"Ethylenealphaolefin copolymers, having a specific gravity of less than 0.94",50069654.0
202507,502,United States,390190,"Polymers of ethylene, in primary forms (excluding polyethylene and ethylene-vinyl acetate copolymers)",11674261.0
202507,502,United States,390210,Polypropylene,2819364.0
202507,502,United States,390220,Polyisobutylene,1342253.0
202507,502,United States,390230,Propylene copolymers,1273398.0
202507,502,United States,390290,"Polymers of propylene or of other olefins, in primary forms (excluding polypropylene, polyisobutylene and propylene copolymers)",6124834.0
202507,502,United States,390311,"Expansible polystyrene, in primary forms",1578952.0
202507,502,United States,390319,"Polystyrene, in primary forms (excluding expansible)",187988.0
202507,502,United States,390320,Styreneacrylonitrile (SAN) copolymers,17785.0
202507,502,United States,390330,Acrylonitrilebutadienestyrene (ABS) copolymers,1117366.0
202507,502,United States,390390,"Polymers of styrene, in primary forms (excluding polystyrene, styrene-acrylonitrile copolymers SAN"" and acrylonitrile-butadiene-styrene ""ABS"")""",4093375.0
202507,502,United States,390410,"Poly(vinyl chloride), not mixed with any other substances",12059125.0
202507,502,United States,390421,Nonplasticised,166401.0
202507,502,United States,390422,Plasticised,1545320.0
202507,502,United States,390430,Vinyl chloridevinyl acetate copolymers,75.0
202507,502,United States,390440,Other vinyl chloride copolymers,17791.0
202507,502,United States,390461,Polytetrafluoroethylene,7021585.0
202507,502,United States,390469,"Fluoropolymers of vinyl chloride or of other halogenated olefins, in primary forms (excluding polytetrafluoroethylene)",5949921.0
202507,502,United States,390490,"Polymers of vinyl chloride or other halogenated olefins, in primary forms (excluding polyvinyl chloride"", copolymers of vinyl chloride, polymers of vinyl chloride and fluoropolymers)""",6080.0
202507,502,United States,390512,"Polyvinyl acetate"", in aqueous dispersion""",62823.0
202507,502,United States,390519,"Polyvinyl acetate"", in primary forms (excluding in aqueous dispersion)""",120.0
202507,502,United States,390521,"Vinyl acetate copolymers, in aqueous dispersion",52287.0
202507,502,United States,390529,"Vinyl acetate copolymers, in primary forms (excluding in aqueous dispersion)",5350.0
202507,502,United States,390530,"Poly(vinyl alcohol), whether or not containing unhydrolysed acetate groups",282894.0
202507,502,United States,390591,Copolymers,4019088.0
202507,502,United States,390599,"Polymers of vinyl esters and other vinyl polymers, in primary forms (excluding those of vinyl chloride or other halogenated olefins, polyvinyl acetate"", vinyl acetate copolymers and poly""vinyl alcohol"", whether or not containing unhydrolised acetate groups)""",4421618.0
202507,502,United States,390610,"Polymethyl methacrylate"", in primary forms""",369279.0
202507,502,United States,390690,"Acrylic polymers, in primary forms (excluding polymethyl methacrylate"")""",12013738.0
202507,502,United States,390710,Polyacetals,3313932.0
202507,502,United States,390721,"Bis(polyoxyethylene) methylphosphonate, in primary forms",36569.0
202507,502,United States,390729,"Other polyethers, in primary forms",11129973.0
202507,502,United States,390730,Epoxide resins,2401880.0
202507,502,United States,390740,Polycarbonates,6913680.0
202507,502,United States,390750,Alkyd resins,208770.0
202507,502,United States,390761,"Polyethylene terephthalate"", in primary forms, having a viscosity number of 78 ml/g or higher""",46061.0
202507,502,United States,390769,"Polyethylene terephthalate"", in primary forms, having a viscosity number of ＜ 78 ml/g""",750133.0
202507,502,United States,390770,Poly(lactic acid) in primary forms,3585272.0
202507,502,United States,390791,Unsaturated polyesters in primary forms,73412.0
202507,502,United States,390799,"Saturated polyesters in primary forms (excluding polycarbonates, alkyd resins, polyethylene terephthalate"" and poly""lactic acid"")""",25044482.0
202507,502,United States,390810,"Polyamide6, 11, 12, 6,6, 6,9, 6,10 or 6,12 ,in primary forms",2188828.0
202507,502,United States,390890,"Polyamides, in primary forms (excluding polyamides-6, -11, -12, -6,6, -6,9, -6,10 and -6,12)",10758274.0
202507,502,United States,390910,"Urea resins and thiourea resins, in primary forms",237.0
202507,502,United States,390920,Melamine resins,172090.0
202507,502,United States,390931,"Poly(methylene phenyl isocyanate) (crude MDI, polymeric MDI) ,in primary forms",118288.0
202507,502,United States,390939,"Amino-resins, in primary forms (excl. urea, thiourea and melamine resins and MDI)",225166.0
202507,502,United States,390940,"Phenolic resins,in primary forms",1713621.0
202507,502,United States,390950,"Polyurethanes,in primary forms",6654263.0
202507,502,United States,391000,Silicones in primary forms,12203127.0
202507,502,United States,391110,"Petroleum resins, coumarone, indene or coumaroneindene resins and polyterpenes",1164845.0
202507,502,United States,391190,"Polysulphides, polysulphones and other polymers and prepolymers produced by chemical synthesis, nes, in primary forms",14198411.0
202507,502,United States,391211,"Nonplasticised cellulose acetates,in primary forms",18574533.0
202507,502,United States,391212,"Plasticised cellulose acetates,in primary forms",88140.0
202507,502,United States,391231,"Carboxymethylcellulose and its salts,in primary forms",9896.0
202507,502,United States,391239,"Cellulose ethers, in primary forms (excluding carboxymethylcellulose and its salts)",7264246.0
202507,502,United States,391290,"Cellulose and chemical derivatives thereof, n.e.s., in primary forms (excluding cellulose acetates, cellulose nitrates and cellulose ethers)",5257717.0
202507,502,United States,391390,"Natural polymers and modified natural polymers, e.g. hardened proteins, chemical derivatives of natural rubber, n.e.s., in primary forms (excluding alginic acid and its salts and esters)",1706747.0
202507,502,United States,391400,"Ionexchangers based on polymers of headings 39.01 to 39.13, in primary forms",925244.0
202507,502,United States,391610,Monofilament of polymers of ethylene,637810.0
202507,502,United States,391620,Monofilament of polymers of vinyl chloride,3688.0
202507,502,United States,391690,Monofilament of other plastics,2311808.0
202507,502,United States,391710,Artificial guts (sausage casings) of hardened protein or of cellulosic materials,766.0
202507,502,United States,391721,"Rigid tubes, pipes and hoses, of polymers of ethylene",385540.0
202507,502,United States,391722,"Rigid tubes, pipes and hoses, of polymers of propylene",106642.0
202507,502,United States,391723,"Rigid tubes, pipes and hoses, of polymers of vinyl chloride",162130.0
202507,502,United States,391729,"Rigid tubes, pipes and hoses, of other plastics",681440.0
202507,502,United States,391731,"Flexible tubes, pipes and hoses, having a minimum burst pressure of 27.6 Mpa",3100360.0
202507,502,United States,391732,"Other plastic tubes, not reinforced or otherwise combined with other materials,without fittings",5995443.0
202507,502,United States,391733,"Other plastic tubes, not reinforced or otherwise combined with other materials,with fittings",415727.0
202507,502,United States,391739,"Flexible tubes, pipes and hoses, of plastics, reinforced or otherwise combined with other materials (excluding those with a burst pressure of ≥ 27,6 MPa)",2186524.0
202507,502,United States,391740,"Fittings for tubes, of plastic",5332279.0
202507,502,United States,391810,"Wall or floor coverings, of polymers of vinyl chloride",1267483.0
202507,502,United States,391890,"Wall or floor coverings, of other plastics",1127871.0
202507,502,United States,391910,"Self-adhesive plates, sheets, film, foil, tape, strip and other flat shapes, of plastics, in rolls ≤ 20 cm wide",4456792.0
202507,502,United States,391990,"Self-adhesive plates, sheets, film, foil, tape, strip and other flat shapes, of plastics, whether or not in rolls ＞ 20 cm wide (excluding floor, wall and ceiling coverings of heading 3918)",26591330.0
202507,502,United States,392010,"Plates, sheets, film, foil and strip, of non-cellular polymers of ethylene, not reinforced, laminated, supported or similarly combined with other materials, without backing, unworked or merely surface-worked or merely cut into squares or rectangles (excluding self-adhesive products, and floor, wall and ceiling coverings of heading 3918)",9569773.0
202507,502,United States,392020,"Plates, sheets, film, foil and strip, of non-cellular polymers of ethylene, not reinforced, laminated, supported or similarly combined with other materials, without backing, unworked or merely surface-worked or merely cut into squares or rectangles (excluding self-adhesive products, and floor, wall and ceiling coverings of heading 3918)",3800850.0
202507,502,United States,392030,"Plates, sheets, foil, film and strip, of non-cellular polymers of styrene, not reinforced, laminated, supported or similarly combined with other materials, without backing, unworked or merely surface-worked or merely cut into squares or rectangles (excluding self-adhesive products, and floor, wall and ceiling coverings of heading 3918)",34463.0
202507,502,United States,392043,"Plates, sheets, film, foil and strip, of non-cellular polymers of vinyl chloride, containing by weight ≥ 6% of plasticisers, not reinforced, laminated, supported or similarly combined with other materials, without backing, unworked or merely surface-worked or merely cut into squares or rectangles (excluding self-adhesive products, and floor, wall and ceiling coverings of heading 3918)",465398.0
202507,502,United States,392049,"Plates, sheets, film, foil and strip, of non-cellular polymers of vinyl chloride, containing by weight ＜ 6% of plasticisers, not reinforced, laminated, supported or similarly combined with other materials, without backing, unworked or merely surface-worked or merely cut into squares or rectangles (excluding self-adhesive products, and floor, wall and ceiling coverings of heading 3918)",363628.0
202507,502,United States,392051,"Plates, sheets, film, foil and strip, of non-cellular polymethyl methacrylate"", not reinforced, laminated, supported or similarly combined with other materials, without backing, unworked or merely surface-worked or merely cut into squares or rectangles (excluding self-adhesive products, and floor, wall and ceiling coverings of heading 3918)""",989160.0
202507,502,United States,392059,"Plates, sheets, film, foil and strip, of non-cellular acrylic polymers, not reinforced, laminated, supported or similarly combined with other materials, without backing, unworked or merely surface-worked or merely cut into squares or rectangles (excluding those of polymethyl methacrylate"", self-adhesive products, and floor, wall and ceiling coverings of heading 3918)""",392874.0
202507,502,United States,392061,"Plates, sheets, film, foil and strip, of non-cellular polycarbonates, not reinforced, laminated, supported or similarly combined with other materials, without backing, unworked or merely surface-worked or merely cut into squares or rectangles (excluding those of polymethyl methacrylate"", self-adhesive products, and floor, wall and ceiling coverings of heading 3918)""",497934.0
202507,502,United States,392062,"Plates, sheets, film, foil and strip, of non-cellular polyethylene terephthalate"", not reinforced, laminated, supported or similarly combined with other materials, without backing, unworked or merely surface-worked or merely cut into squares or rectangles (excluding those of poly""methyl methacrylate"", self-adhesive products, and floor, wall and ceiling coverings of heading 3918)""",13038801.0
202507,502,United States,392063,"Plates, sheets, film, foil and strip, of non-cellular unsaturated polyesters, not reinforced, laminated, supported or similarly combined with other materials, without backing, unworked or merely surface-worked or merely cut into squares or rectangles (excluding those of polymethyl methacrylate"", self-adhesive products, and floor, wall and ceiling coverings of heading 3918)""",11320.0
202507,502,United States,392069,"Plates, sheets, film, foil and strip, of non-cellular polyesters, not reinforced, laminated, supported or similarly combined with other materials, not worked or only surface-worked, or only cut to rectangular, incl. square, shapes (excluding polycarbonates, polythylene terephthalate and other unsaturated polyesters, self-adhesive products, and floor, wall and ceiling coverings in heading 3918)",1384931.0
202507,502,United States,392071,"Plates, sheets, film, foil and strip, of non-cellular regenerated cellulose, not reinforced, laminated, supported or similarly combined with other materials, without backing, unworked or merely surface-worked or merely cut into squares or rectangles (excluding self-adhesive products, and floor, wall and ceiling coverings of heading 3918)",17794.0
202507,502,United States,392073,"Plates, sheets, film, foil and strip, of non-cellular cellulose acetates, not reinforced, laminated, supported or similarly combined with other materials, without backing, unworked or merely surface-worked or merely cut into squares or rectangles (excluding self-adhesive products, and floor, wall and ceiling coverings of heading 3918)",908.0
202507,502,United States,392079,"Plates, sheets, film, foil and strip, of non-cellular cellulose derivatives, not reinforced, laminated, supported or similarly combined with other materials, without backing, unworked or merely surface-worked or merely cut into squares or rectangles (excluding products of cellulose acetates, self-adhesive products, floor, wall and ceiling coverings of heading 3918)",39132.0
202507,502,United States,392091,"Plates, sheets, film, foil and strip, of non-cellular polyvinyl butyral"", not reinforced, laminated, supported or similarly combined with other materials, without backing, unworked or merely surface-worked or merely cut into squares or rectangles (excluding self-adhesive products, floor, wall and ceiling coverings of heading 3918)""",1001.0
202507,502,United States,392092,"Plates, sheets, film, foil and strip, of non-cellular polyamides, not reinforced, laminated, supported or similarly combined with other materials, without backing, unworked or merely surface-worked or merely cut into squares or rectangles (excluding self-adhesive products, floor, wall and ceiling coverings of heading 3918)",632061.0
202507,502,United States,392093,"Plates, sheets, film, foil and strip, of non-cellular amino-resins, not reinforced, laminated, supported or similarly combined with other materials, without backing, unworked or merely surface-worked or merely cut into squares or rectangles (excluding self-adhesive products, floor, wall and ceiling coverings of heading 3918)",22950.0
202507,502,United States,392094,"Plates, sheets, film, foil and strip, of non-cellular phenolic resins, not reinforced, laminated, supported or similarly combined with other materials, without backing, unworked or merely surface-worked or merely cut into squares or rectangles (excluding self-adhesive products, floor, wall and ceiling coverings of heading 3918)",245647.0
202507,502,United States,392099,"Plates, sheets, film, foil and strip, of non-cellular plastics, n.e.s., not reinforced, laminated, supported or similarly combined with other materials, without backing, unworked or merely surface-worked or merely cut into squares or rectangles (excluding self-adhesive products, floor, wall and ceiling coverings of heading 3918 and sterile surgical or dental adhesion barriers of subheading 3006.10.30)",13089761.0
202507,502,United States,392111,"Plates, sheets, film, foil and strip, of polymers of styrene",66165.0
202507,502,United States,392112,"Plates, sheets, film, foil and strip, of polymers of vinyl chloride",84569.0
202507,502,United States,392113,"Plates, sheets, film, foil and strip, of polyurethanes",2105847.0
202507,502,United States,392119,"Plates, sheets, film, foil and strip, of other plastics",4161060.0
202507,502,United States,392190,"Plates, sheets, film, foil and strip, (excluding of cellular plastic; self-adhesive products, floor, wall and ceiling coverings of heading 3918)",15253320.0
202507,502,United States,392210,"Baths, showerbaths, sinks and washbasins,of plastics",502.0
202507,502,United States,392220,Lavatory seats and covers,89019.0
202507,502,United States,392290,"Bidets, lavatory pans, flushing cisterns and similar sanitary ware, of plastics (excluding baths, shower-baths, sinks, washbasins, lavatory seats and covers)",93972.0
202507,502,United States,392310,"Boxes, cases, crates and similar articles",1678559.0
202507,502,United States,392321,"Sacks and bags, incl. cones, of polymers of ethylene",664405.0
202507,502,United States,392329,"Sacks and bags, incl. cones, of other plastics",485557.0
202507,502,United States,392330,"Carboys, bottles, flasks and similar articles, of plastics",1388063.0
202507,502,United States,392340,"Spools, cops, bobbins and similar supports, of plastics",82411.0
202507,502,United States,392350,"Stoppers, lids, caps and other closures, of plastics",2117276.0
202507,502,United States,392390,"Articles for the conveyance or packaging of goods, of plastics (excluding boxes, cases, crates and similar articles; sacks and bags, incl. cones; carboys, bottles, flasks and similar articles; spools, spindles, bobbins and similar supports; stoppers, lids, caps and other closures)",973304.0
202507,502,United States,392410,"Tableware and kitchenware, of plastics",165139.0
202507,502,United States,392490,"Household articles and toilet articles, of plastics (excluding tableware, kitchenware, baths, shower-baths, washbasins, bidets, lavatory pans, seats and covers, flushing cisterns and similar sanitary ware)",55025.0
202507,502,United States,392510,"Reservoirs, tanks, vats and similar containers, of a capacity exceeding 300 l, of plastics",375901.0
202507,502,United States,392520,"Doors, windows and their frames and thresholds for doors, of plastics",30842.0
202507,502,United States,392530,"Shutters, blinds (including Venetian blinds) and similar articles and parts thereof, of plastics",98421.0
202507,502,United States,392590,"Builderss ware of plastics, nes",1469.0
202507,502,United States,392610,"Office or school supplies, of plastics",19581.0
202507,502,United States,392620,"Articles of apparel and clothing accessories (including gloves, mittens and mitts), of plastics",208914.0
