Date of data,Trading partner code,Trading partner,Commodity code,Commodity,US dollar
202510,502,United States,10511,"Fowls of the species Gallus omesticus, weighing not more than 185 g",951826.0
202510,502,United States,10619,Other mammals,283214.0
202510,502,United States,10649,Other insects,13590.0
202510,502,United States,20120,Other cuts with bone in,2451.0
202510,502,United States,20130,Boneless,1664891.0
202510,502,United States,20220,Other cuts with bone in,766532.0
202510,502,United States,20230,Boneless,2224552.0
202510,502,United States,20322,"Hams, shoulders and cuts thereof, with bone in",5906624.0
202510,502,United States,20329,Other frozen meat of swine,41147.0
202510,502,United States,20629,"Other edible offal of bovine animals,frozen",197934.0
202510,502,United States,20649,"Other edible offal of swine,frozen",41031672.0
202510,502,United States,20714,"Cuts and offal, frozen",3128784.0
202510,502,United States,30311,"Sockeye salmon (red salmon) (Oncorhynchus nerka) ,frozen",696859.0
202510,502,United States,30312,"Other Pacific salmon (Oncorhynchus gorbuscha, Oncorhynchus keta, Oncorhynchus tschawytscha, Oncorhynchus kisutch, Oncorhynchus masou and Oncorhynchus rhodurus) ,frozen",65603204.0
202510,502,United States,30331,"Halibut (Reinhardtius hippoglossoides, Hippoglossus hippoglossus, Hippoglossus stenolepis) , frozen",289273.0
202510,502,United States,30339,"Other flat fish (Pleuronectidae, Bothidae, Cynoglossidae, Soleidae Scophthalmidae and Citharidae), frozen",10629534.0
202510,502,United States,30363,"Cod (Gadus morhua, Gadus ogac, Gadus macrocephalus) ,frozen",3061213.0
202510,502,United States,30367,"Alaska Pollack (Theragra chalcogramma) ,frozen",1404273.0
202510,502,United States,30389,"Other fish ,frozen",15942858.0
202510,502,United States,30391,"Livers, roes and milt,frozen",35840.0
202510,502,United States,30399,"Other fish fins, heads, tails, maws and other edible fish offal,frozen",131400.0
202510,502,United States,30471,"Frozen fillets of cod (Gadus morhua, Gadus ogac, Gadus macrocephalus)",450.0
202510,502,United States,30481,"Frozen fillets of Pacific salmon (Oncorhynchus nerka, Oncorhynchus gorbuscha, Oncorhynchus keta, Oncorhynchus tschawytscha, Oncorhynchus kisutch, Oncorhynchus masou and Oncorhynchus rhodurus), Atlantic salmon (Salmo salar) and Danube salmon (Hucho hucho)",77574.0
202510,502,United States,30494,"Frozen meat, whether or not minced, of alaska Pollack (Theragra chalcogramma)",634572.0
202510,502,United States,30495,"Frozen meat, whether or not minced, of fish of the families Bregmacerotidae, Euclichthyidae, Gadidae, Macrouridae, Melanonidae, Merlucciidae, Moridae and Muraenolepididae, other than Alaska Pollack (Theragra chalcogramma)",100221.0
202510,502,United States,30520,"Livers, roes and milt of fish, dried, smoked, salted or in brine",530.0
202510,502,United States,30611,"Frozen rock lobster and other sea crawfish (Palinurus spp, Panulirus spp, Jasus spp)",251591.0
202510,502,United States,30616,"Frozen cold-water shrimps and prawns (Pandalus spp, Crangon crangon)",4095.0
202510,502,United States,30631,"Rock lobster and other sea crawfish (Palinurus spp, Panulirus spp, Jasus spp) , whether in shell or not, live, fresh or chilled",5331951.0
202510,502,United States,30632,"Lobsters (Homarus spp), whether in shell or not, live, fresh or chilled",22214459.0
202510,502,United States,30633,"Crabs , whether in shell or not, live, fresh or chilled",3712509.0
202510,502,United States,30635,"Coldwater shrimps and prawns (Pandalus spp, Crangon crangon), whether in shell or not, live, fresh or chilled",31596.0
202510,502,United States,30636,"Other shrimps and prawns, whether in shell or not, live, fresh or chilled",198104.0
202510,502,United States,30711,"Oysters, live, fresh, chilled",14121.0
202510,502,United States,30743,"Frozen cuttle fish and squid, with or without shell",14074717.0
202510,502,United States,30791,"Other molluscs,live/fresh/chilled",8551312.0
202510,502,United States,30821,"Live, fresh or chilled, sea urchins (Strongylocentrotus spp., Paracentrotus lividus, Loxechinus albus, Echinus esculentus)",27716.0
202510,502,United States,40120,"Milk and cream of a fat content, by weight, exceeding 1% but not exceeding 6%",5546.0
202510,502,United States,40140,"Milk and cream of a fat content, by weight, exceeding 6% but not exceeding 10%",1109.0
202510,502,United States,40210,"Milk and cream in powder, granules or other solid forms, of a fat content, by weight, not exceeding 1.5%",292735.0
202510,502,United States,40221,"Not containing added sugar or other sweetening matter, of a fat content, by weight, more than 1.5%",593.0
202510,502,United States,40291,"Milk and cream, concentrated but unsweetened (excluding in solid forms)",14241.0
202510,502,United States,40299,"Milk and cream, concentrated and sweetened (excluding in solid forms)",720.0
202510,502,United States,40410,"Whey and modified whey, whether or not concentrated or containing added sugar or other sweetening matter",23345762.0
202510,502,United States,40490,"Products consisting of natural milk constituents, whether or not sweetened, n.e.s.",8324.0
202510,502,United States,40510,Butter,330030.0
202510,502,United States,40610,"Fresh (unripened or uncured) cheese, including whey cheese, and curd",122477.0
202510,502,United States,40620,"Grated or powdered cheese, of all kinds",646896.0
202510,502,United States,40630,"Processed cheese, not grated or powdered",567284.0
202510,502,United States,40690,Other cheese,527215.0
202510,502,United States,40900,atural honey,52173.0
202510,502,United States,50400,"Guts, bladders and stomachs of animals (other than fish), wholeand pieces thereof, fresh, chilled, frozen, salted, in brine, dried orsmoked",18811489.0
202510,502,United States,50510,Feathers of a kind used for stuffing; down,430415.0
202510,502,United States,50590,"Skins and other parts of birds, with their feathers or down, feathers and parts of feathers, whether or not with trimmed edges, not further worked than cleaned, disinfected or treated for preservation; powder and waste of feathers or parts of feathers (excluding feathers used for stuffing and down)",156278.0
202510,502,United States,50790,"Tortoiseshell, whalebone, Otherhorns, antlers, hooves, nails, claws and beaks, other powder and waste there of",316216.0
202510,502,United States,51191,"Products of fish or crustaceans, molluscs or other aquatic invertebrates; dead animals of Chapter 3",7207.0
202510,502,United States,51199,"Unkown Products of animal origin, n.e.s., dead animals, unfit for human consumption (excluding fish, crustaceans, molluscs or other aquatic invertebrates)",311.0
202510,502,United States,60110,"Bulbs, tubers, tuberous roots, corms, crowns and rhizomes, dormant",42233.0
202510,502,United States,60220,"Trees, shrubs and bushes, grafted or not, of kinds which bear edible fruit or nuts",177670.0
202510,502,United States,60290,Other live plant,91267.0
202510,502,United States,60420,"Foliage, branches and other parts of plants, without flowers or flower buds, and grasses, mosses and lichens, being goods of a kind suitable for bouquets or for ornamental purposes, fresh",632.0
202510,502,United States,71040,"Sweet corn,frozen.",821820.0
202510,502,United States,71310,"Dried peas (Pisum sativum), shelled, whether or not skinned or split.",4603473.0
202510,502,United States,71340,"Dried, shelled lentils",156727.0
202510,502,United States,80212,"Shelled almonds, fresh or dried, whether or not shelled or peeled.",1053406.0
202510,502,United States,80232,Shelled walnuts,160326.0
202510,502,United States,80251,In shell pistachios,300080.0
202510,502,United States,80299,"Other nuts, fresh or dried",445034.0
202510,502,United States,80620,Dried Grapes,536115.0
202510,502,United States,80810,Fresh Apples,97395.0
202510,502,United States,80940,Fresh Plums and sloes,890469.0
202510,502,United States,81320,Dried Prunes,104471.0
202510,502,United States,81330,Dried Apples,1375.0
202510,502,United States,81340,Other Dried fruit,29160.0
202510,502,United States,90111,Coffee not roasted (not decaffeinated),7111.0
202510,502,United States,90121,Coffee roasted (Not decaffeinated ),832834.0
202510,502,United States,90122,Coffee roasted(Decaffeinated ),21380.0
202510,502,United States,90210,Green tea (not fermented) in immediate packings of a content not exceeding 3 kg,7519.0
202510,502,United States,90230,"Black tea (fermented) and partly fermented tea, in immediate packings of a content not exceeding 3 kg",23072.0
202510,502,United States,90240,"Black tea (fermented) and partly fermented tea, in packings exceeding 3 kg",92.0
202510,502,United States,100410,Oats seed for sowing.,48907.0
202510,502,United States,110100,Wheat or meslin flour.,10425.0
202510,502,United States,110290,"Cereal flours (excluding wheat, meslin and maize)",20984.0
202510,502,United States,110630,Of the products of Chapter 8,971.0
202510,502,United States,110812,Maize (corn) starch,56364.0
202510,502,United States,110820,Inulin,198.0
202510,502,United States,120241,In shell groundnuts,210059.0
202510,502,United States,120923,Fescue seeds,1117663.0
202510,502,United States,120924,Kentucky blue grass (Poa pratensis L.) seeds,1835700.0
202510,502,United States,120925,"Rye grass (Lolium multiflorum Lam., Lolium perenne L.) seeds",1732439.0
202510,502,United States,120991,Vegetable seeds,265103.0
202510,502,United States,120999,"Seeds, fruits and spores, for sowing (excluding leguminous vegetables and sweetcorn, coffee, tea, maté and spices, cereals, oil seeds and oleaginous fruits, beets, forage plants, vegetable seeds, and seeds of herbaceous plants cultivated mainly for flowers or used primarily in perfumery, medicaments or for insecticidal, fungicidal or similar purposes)",355900.0
202510,502,United States,121020,"Hop cones, ground, powdered or in the form of pellets; lupulin",333686.0
202510,502,United States,121120,Ginseng roots,11045.0
202510,502,United States,121190,"Other plants and parts of plants, of a kind used primarily in perfumery, in pharmacy or for insecticidal, fungicidal or similar purposes",101359.0
202510,502,United States,121490,"Other forage products, whether or not in the form of pellets",21324777.0
202510,502,United States,130120,Gum Arabic,104.0
202510,502,United States,130219,"Mucilages and thickeners, derived from locust beans, locust bean seeds or guar seeds, whether or not modified",416505.0
202510,502,United States,130220,"Pectic substances, pectinates and pectates",1602.0
202510,502,United States,130231,Agaragar,41033.0
202510,502,United States,130232,"Mucilages and thickeners, whether or not modified, derived from locust beans, locust bean seeds or guar seeds",79574.0
202510,502,United States,130239,"Other mucilages and thickeners, derived for vegetable products",934847.0
202510,502,United States,140490,Vegetable products not elsewhere specified or included,2509.0
202510,502,United States,150410,Fishliver oils and their fractions,149436.0
202510,502,United States,150420,"Fats and oils and their fractions, of fish, other than liver oils",4346957.0
202510,502,United States,150600,"Other animal fats and oils and their fractions, whether or not refined, but not chemically modified.",2563844.0
202510,502,United States,150790,"Soya-bean oil and its fractions, whether or not refined (excluding chemically modified and crude)",281.0
202510,502,United States,150890,Other ground-nut oil and its fractions,29.0
202510,502,United States,150920,Extra virgin olive oil,1784.0
202510,502,United States,150930,"Virgin olive oil,with a free acidity(oleic acid)≤2.0 g/ 100 g",147.0
202510,502,United States,150940,Other virgin olive oils,800.0
202510,502,United States,151219,Other oil of sunflower-seed or safflower and its fractions,937.0
202510,502,United States,151311,Crude coconut oil,1122.0
202510,502,United States,151319,Other coconut oil and its fractions,2627.0
202510,502,United States,151499,"High erucic acid rape or colza oil fixed oil which has an erucic acid content of ≥ 2%"", and mustard oil, and fractions thereof, whether or not refined, but not chemically modified (excluding crude)""",224.0
202510,502,United States,151511,Crude linseed oil,633.0
202510,502,United States,151519,"Linseed oil and fractions thereof, whether or not refined, but not chemically modified (excluding crude)",10906.0
202510,502,United States,151530,Castor oil and its fractions,11665.0
202510,502,United States,151550,Sesame oil and its fractions,364.0
202510,502,United States,151560,"Microbial fats and oils and their fractions,not chemically modified",1655225.0
202510,502,United States,151590,Other fixed vegetable fats and oils and their fractions,419923.0
202510,502,United States,151610,Animal fats and oils and their fractions,138168.0
202510,502,United States,151620,Vegetable fats and oils and their fractions,91081.0
202510,502,United States,151790,"Other edible fats/oils/fractions of this chptr, excl.that of 15.16",1064830.0
202510,502,United States,151800,"Animal, vegetable or microbial fats and oils and their fractions, boiled, oxidised, dehydrated, sulphurised, blown, polymerised by heat in vacuum or in inert gas or otherwise chemically modified, excluding those of heading 15.16; inedible mixtures or preparations of animal, vegetable or microbial fats or oils or of fractions of different fats or oils of this Chapter, not elsewhere specified or included",216848.0
202510,502,United States,152110,Vegetable waxes,8137.0
202510,502,United States,152190,"Beeswax, other insect waxes and spermaceti",7758.0
202510,502,United States,160231,Meat or offal of turkeys,47650.0
202510,502,United States,160232,Meat or offal of fowls of the species Gallus domesticus,16786550.0
202510,502,United States,160249,"Other prepared or preserved meat and meat offal of swine, including mixtures",435623.0
202510,502,United States,170191,"Cane or beet sugar and chemically pure sucrose,containing added flavouring or colouring matter",600.0
202510,502,United States,170199,"Cane or beet sugar and chemically pure sucrose, in solid form (excluding cane and beet sugar containing added flavouring or colouring and raw sugar)",253256.0
202510,502,United States,170211,"Lactose in solid form and lactose syrup, not containing added flavouring or colouring matter, containing by weight 99% or more lactose, expressed as anhydrous lactose, calculated on the dry matter",10218839.0
202510,502,United States,170220,Maple sugar and maple syrup,310.0
202510,502,United States,170230,"Glucose and glucose syrup, not containing fructose or containing in the dry state less than 20% by weight of fructose",87289.0
202510,502,United States,170250,Chemically pure fructose,340289.0
202510,502,United States,170260,"Other fructose and fructose syrup, containing in the dry state more than 50% by weight of fructose, excluding invert sugar",20107.0
202510,502,United States,170290,Other sugars in solid form and sugar syrups not containing added flavouring or colouring matter,49108.0
202510,502,United States,170410,"Chewing gum, whether or not sugarcoated",2304.0
202510,502,United States,170490,"Other sugar confectionery, not containing cocoa",7331373.0
202510,502,United States,180500,"Cocoa powder, not containing added sugar or other sweetening matter",26120.0
202510,502,United States,180610,"Cocoa powder, containing added sugar or other sweetening matter",7943.0
202510,502,United States,180620,"Other preparations in blocks, slabs or bars weighing more than 2 kg or in liquid, paste, powder, granular or other bulk form in containers or immediate packings, of a content exceeding 2 kg",2689657.0
202510,502,United States,180631,"Chocolate and other preparations containing cocoa, in blocks, slabs or bars of ≤ 2 kg, filled",414444.0
202510,502,United States,180632,"Chocolate and other preparations containing cocoa, in blocks, slabs or bars of ≤ 2 kg (excluding filled)",94733.0
202510,502,United States,180690,"Chocolate and other preparations containing cocoa, in containers or immediate packings of ≤ 2 kg (excluding in blocks, slabs or bars and cocoa powder)",1768165.0
202510,502,United States,190110,"Preparations suitable for infants or young children, put up for retail sale",1879724.0
202510,502,United States,190120,Mixes and doughs for the preparation of bakers' wares of heading 19.05,22559.0
202510,502,United States,190190,"Other food prep. of flour(cocoa＜40%)/milk(cocoa＜5%), nes",3447.0
202510,502,United States,190219,"Uncooked pasta, not stuffed or otherwise prepared, not containing eggs",173.0
202510,502,United States,190220,"Stuffed pasta, whether or not cooked or otherwise prepared",13.0
202510,502,United States,190230,Other pasta,6228.0
202510,502,United States,190410,Prepared foods obtained by the swelling or roasting of cereals or cereal products,213540.0
202510,502,United States,190420,Prepared foods obtained from unroasted cereal flakes or from mixtures of unroasted cereal flakes and roasted cereal flakes or swelled cereals,34900.0
202510,502,United States,190430,Bulgur wheat,37.0
202510,502,United States,190490,Other precooked or otherwise prepared cereals (other than maize (corn) ),9766.0
202510,502,United States,190531,Sweet biscuits,18073.0
202510,502,United States,190532,Waffles and wafers,59.0
202510,502,United States,190590,"Bread, pastry, cakes, biscuits and other bakers' wares, whether or not containing cocoa; communion wafers, empty cachets of a kind suitable for pharmaceutical use, sealing wafers, rice paper and similar products (excluding crispbread, gingerbread and the like, sweet biscuits, waffles, wafers not mentioned, rusks, toasted bread and similar toasted products)",218024.0
202510,502,United States,200110,"Cucumbers and gherkins, prepared or preserved by vinegar or acetic acid",129389.0
202510,502,United States,200210,"Tomatoes, whole or in pieces",2267.0
202510,502,United States,200410,"Potatoes, prepared or preserved otherwise than by vinegar or acetic acid, frozen",623928.0
202510,502,United States,200510,"Homogenised vegetables put up for retail sale as infant food or for dietetic purposes, in containers of ≤ 250 g",194.0
202510,502,United States,200520,"Potatoes, prepared or preserved otherwise than by vinegar or acetic acid (excluding frozen)",319183.0
202510,502,United States,200599,"Vegetables and mixtures of vegetables, prepared or preserved otherwise than by vinegar, non-frozen (excluding preserved by sugar, homogenised vegetables of subheading 2005.10, and tomatoes, mushrooms, truffles, potatoes, peas Pisum sativum"", beans ""Vigna, Phaseolus"", asparagus, olives, sweetcorn ""Zea Mays var. Saccharata"" and bamboo shoots, unmixed)""",22941.0
202510,502,United States,200600,"Vegetables, fruit, nuts, fruitpeel and other parts of plants, preserved by sugar (drained, glacé or crystallised).",19340.0
202510,502,United States,200710,"Homogenised preparations of jams, fruit jellies, marmalades, fruit or nut purée and fruit or nut pastes, obtained by cooking, whether or not containing added sugar or other sweetening matter.",27221.0
202510,502,United States,200799,"Jams, jellies, marmalades, purées or pastes of fruit, obtained by cooking, whether or not containing added sugar or other sweetening matter (excluding citrus fruit and homogenised preparations of subheading 2007.10)",12949.0
202510,502,United States,200811,"Groundnuts, prepared or preserved (excluding preserved with sugar)",156709.0
202510,502,United States,200819,"Other prepared or preserved nuts and other seeds, including mixtures",273248.0
202510,502,United States,200893,Prepared/preserved Cranberries or lingonberries,908192.0
202510,502,United States,200897,Other prepared or preserved mixtures of fruits and nuts,35.0
202510,502,United States,200899,"Other prepared or preserved fruits,nuts and edible parts of plants",423007.0
202510,502,United States,200950,Tomato juice,736.0
202510,502,United States,200969,Other grape juice,210448.0
202510,502,United States,200979,"Apple juice, unfermented, Brix value ＞ 20 at 20°C, whether or not containing added sugar or other sweetening matter (excluding containing spirit)",3571.0
202510,502,United States,200981,"Cranberry (Vaccinium macrocarpon, Vaccinium oxycoccos) juice; lingonberry (Vaccinium vitis-idaea) juice",3438.0
202510,502,United States,200989,"Juice of any other single fruit, nut or vegetable",1593045.0
202510,502,United States,200990,Mixtures of juices,114300.0
202510,502,United States,210111,"Extracts, essences and concentrates, of coffee",214755.0
202510,502,United States,210112,"Preparations with a basis of extracts, essences or concentrates of coffee or with a basis of coffee",1943.0
202510,502,United States,210120,"Extracts, essences and concentrates, of tea or mate, and preparations with a basis of these extracts, essences or concentrates, or with a basis of tea or maté",52534.0
202510,502,United States,210130,"Roasted chicory and other roasted coffee substitutes, and extracts, essences and concentrates thereof",21.0
202510,502,United States,210210,Active yeasts,1039.0
202510,502,United States,210220,Inactive yeasts; other dead single-cell micro-organisms (excluding packaged as medicaments),52772.0
202510,502,United States,210230,Prepared baking powders,694.0
202510,502,United States,210310,Soya sauce,1240.0
202510,502,United States,210320,Tomato ketchup and other tomato sauces,665630.0
202510,502,United States,210330,Mustard flour and meal and prepared mustard,301501.0
202510,502,United States,210390,"Preparations for sauces and prepared sauces; mixed condiments and seasonings (excluding soya sauce, tomato ketchup and other tomato sauces, mustard, and mustard flour and meal)",867839.0
202510,502,United States,210410,Soups and broths and preparations therefor,240.0
202510,502,United States,210420,Homogenised composite food preparations,1072.0
202510,502,United States,210500,"Ice cream and other edible ice, whether or not containing cocoa.",107538.0
202510,502,United States,210610,Protein concentrates and textured protein substances,464158.0
202510,502,United States,210690,"Food preparations, n.e.s.",140973636.0
202510,502,United States,220110,"Mineral waters and aerated waters, not containing added sugar, other sweetening matter or flavoured",5007.0
202510,502,United States,220210,"Waters, including mineral waters and aerated waters, containing added sugar or other sweetening matter or flavoured",67668.0
202510,502,United States,220299,"Non-alcoholic beverages (excl. water, fruit or vegetable juices, milk and beer)",4643711.0
202510,502,United States,220300,Beer made from malt.,2122384.0
202510,502,United States,220421,"Wine of fresh grapes, incl. fortified wines, and grape must whose fermentation has been arrested by the addition of alcohol, in containers of ≤ 2 l (excluding sparkling wine)",1105504.0
202510,502,United States,220422,"Wine of fresh grapes, incl. fortified wines, and grape must whose fermentation has been arrested by the addition of alcohol, in containers of ＞ 2 l but ≤ 10 l (excl. sparkling wine)",101119.0
202510,502,United States,220600,"Other fermented beverages (for example, cider, perry, mead, saké); mixtures of fermented beverages and mixtures of fermented beverages and nonalcoholic beverages, not elsewhere specified or included.",21766.0
202510,502,United States,220710,"Undenatured ethyl alcohol, of actual alcoholic strength of ≥ 80%",13881.0
202510,502,United States,220720,Denatured ethyl alcohol and other spirits of any strength,7633.0
202510,502,United States,220830,Whiskies,1018596.0
202510,502,United States,220860,Vodka,47121.0
202510,502,United States,220870,Liqueurs and cordials,765513.0
202510,502,United States,220890,"Ethyl alcohol of an alcoholic strength of ＜ 80% vol, not denatured; spirits and other spirituous beverages (excluding compound alcoholic preparations of a kind used for the manufacture of beverages, spirits obtained by distilling grape wine or grape marc, whiskies, rum and other spirits obtained by distilling fermented sugar-cane products, gin, geneva, vodka, liqueurs and cordials)",1039.0
202510,502,United States,220900,Vinegar and substitutes for vinegar obtained from acetic acid.,202114.0
202510,502,United States,230110,"Flours, meals and pellets, of meat or offal, unfit for human consumption; greaves",8024409.0
202510,502,United States,230120,"Flours, meals and pellets of fish or crustaceans, molluscs or other aquatic invertebrates, unfit for human consumption",12908009.0
202510,502,United States,230240,"Bran, sharps and other residues of wheat, whether or not in the form of pellets, derived from sifting, milling or other working",1131229.0
202510,502,United States,230400,"Oilcake and other solid residues, whether or not ground or in the form of pellets, resulting from the extraction of soyabean oil.",584040.0
202510,502,United States,230910,"Dog or cat food, put up for retail sale",16876057.0
202510,502,United States,230990,Preparations of a kind used in animal feeding (excluding dog or cat food put up for retail sale),9659604.0
202510,502,United States,240319,"Smoking tobacco, whether or not containing tobacco substitutes in any proportion (excluding water-pipe tobacco containing tobacco)",193034.0
202510,502,United States,240412,"Other procucts containing nicotine, intended for inhalation without combustion",1020461.0
202510,502,United States,240419,Other procucts intended for inhalation without combustion,30462.0
202510,502,United States,250100,"Salts, incl. table salt and denatured salt, and pure sodium chloride, whether or not in aqueous solution or containing added anti-caking or free-flowing agents; sea water",5227496.0
202510,502,United States,250300,"Sulphur of all kinds (excluding sublimed sulphur, precipitated sulphur and colloidal sulphur)",538.0
202510,502,United States,250410,Natural graphite in powder or in flakes,7522.0
