Date of data,Trading partner code,Trading partner,Commodity code,Commodity,US dollar
201604,502,United States,840310,"Central heating boilers, non-electric (excluding vapour generating boilers and superheated water boilers of heading 8402)",273672
201604,502,United States,840390,"Parts of central heating boilers, n.e.s.",45977
201604,502,United States,840490,"Parts of auxiliary plant of heading 8402 or 8403 and condensers for steam or other vapour power units, n.e.s.",87365
201604,502,United States,840510,"Producer gas or water gas generators, with or without their purifiers; acetylene gas generators and similar water process gas generators, with or without their purifiers",25790
201604,502,United States,840590,"Parts of producer gas or water gas generators and acetylene gas generators or similar water process gas generators, n.e.s.",7415
201604,502,United States,840682,"Turbines, of an output not exceeding 40 MW",147633
201604,502,United States,840690,"Parts of steam and other vapour turbines, n.e.s.",36316
201604,502,United States,840710,"Spark-ignition reciprocating or rotary internal combustion piston engine, for aircraft",213355
201604,502,United States,840721,Spark-ignition outboard motors for marine propulsion,581499
201604,502,United States,840729,"Spark-ignition reciprocating or rotary engines, for marine propulsion (excluding outboard motors)",349778
201604,502,United States,840734,"Spark-ignition reciprocating piston engine, of a kind used for the propulsion of vehicles of chapter 87, Of a cylinder capacity exceeding 1,000 cc",10009865
201604,502,United States,840790,Other engines,2453979
201604,502,United States,840810,Marine propulsion engines,5871900
201604,502,United States,840820,Engines of a kind used for the propulsion of vehicles of Chapter 87,9000
201604,502,United States,840890,Other engines,21889946
201604,502,United States,840910,"Parts suitable for use solely or principally with internal combustion piston engine for aircraft, n.e.s.",337259
201604,502,United States,840991,"Parts suitable for use solely or principally with spark-ignition internal combustion piston engine, n.e.s.",11815106
201604,502,United States,840999,"Parts suitable for use solely or principally with compression-ignition internal combustion piston engine ""diesel or semi-diesel engine"", n.e.s.",7862846
201604,502,United States,841090,Parts of hydraulic turbines and water wheels incl. regulators,1397
201604,502,United States,841111,Turbojets of a thrust not exceeding 25 kN,85706
201604,502,United States,841112,Turbojets of a thrust exceeding 25 kN,91164623
201604,502,United States,841181,"Gas turbines of a power not exceeding 5,000 kW",382826
201604,502,United States,841191,"Parts of turbojets or turbopropellers, n.e.s.",105038692
201604,502,United States,841199,"Parts of gas turbines, n.e.s.",7014993
201604,502,United States,841221,"Hydraulic power engines and motors, linear acting (cylinders)",10223187
201604,502,United States,841229,"Hydraulic power engines and motors (excluding hydraulic turbines and water wheels of heading 8410, steam turbines and hydraulic power engines and motors, linear acting)",4599295
201604,502,United States,841231,"Pneumatic power engines and motors, linear acting (cylinders)",2085752
201604,502,United States,841239,Pneumatic power engines and motors (excluding linear acting),966129
201604,502,United States,841280,"Engines and motors (excluding steam turbines, internal combustion piston engine, hydraulic turbines, water wheels, gas turbines, reaction engines, hydraulic power engines and motors, pneumatic power engines and motors and electric motors)",181205
201604,502,United States,841290,"Parts of non-electrical engines and motors, n.e.s.",1449220
201604,502,United States,841311,"Pumps for dispensing fuel or lubricants, of the type used in fillingstations or in garages",11961
201604,502,United States,841319,"Pumps for liquids, fitted or designed to be fitted with a measuring device (excluding pumps for dispensing fuel or lubricants, of the type used in filling stations or in garages)",1495368
201604,502,United States,841320,"Hand pumps, other than those of subheading 8413.11 or 8413.19",243936
201604,502,United States,841330,"Fuel, lubricating or cooling medium pumps for internal combustion piston engines",6698121
201604,502,United States,841350,Other reciprocating positive displacement pumps,8086986
201604,502,United States,841360,Other rotary positive displacement pumps,6529727
201604,502,United States,841370,Other centrifugal pumps,39733678
201604,502,United States,841381,"Pumps for liquids, power-driven (excluding those of subheading 8413.11 and 8413.19, fuel, lubricating or cooling medium pumps for internal combustion piston engine, concrete pumps, general reciprocating or rotary positive displacement pumps and centrifugal pumps of all kinds)",1108148
201604,502,United States,841382,Liquid elevators,2166
201604,502,United States,841391,"Parts of pumps for liquids, n.e.s.",8280656
201604,502,United States,841392,"Parts of liquid elevators, n.e.s.",6746
201604,502,United States,841410,Vacuum pumps,2413502
201604,502,United States,841420,Hand or footoperated air pumps,23768
201604,502,United States,841430,Compressors of a kind used in refrigerating equipment,2638194
201604,502,United States,841440,Air compressors mounted on a wheeled chassis for towing,24313
201604,502,United States,841451,"Table, floor, wall, window, ceiling or roof fans, with a selfcontained electric motor of an output not exceeding 125 W",165973
201604,502,United States,841459,"Fans (excluding table, floor, wall, window, ceiling or roof fans, with a self-contained electric motor of an output ≤ 125 W)",2398218
201604,502,United States,841460,Hoods having a maximum horizontal side not exceeding 120 cm,161421
201604,502,United States,841480,"Air pumps, air or other gas compressors and ventilating or recycling hoods incorporating a fan, whether or not fitted with filters, having a maximum horizontal side ＞ 120 cm (excluding vacuum pumps, hand- or foot-operated air pumps, compressors for refrigerating equipment and air compressors mounted on a wheeled chassis for towing)",10249030
201604,502,United States,841490,"Parts of: air or vacuum pumps, air or other gas compressors, fans and ventilating or recycling hoods incorporating a fan, n.e.s.",10446370
201604,502,United States,841510,"Air conditioning machines of a kind designed to be fixed to a window, wall, ceiling or floor, selfcontained or .splitsystem.",297881
201604,502,United States,841520,"Air conditioning machines of a kind used for persons, in motor vehicles",30640
201604,502,United States,841581,Air conditioning machines incorporating a refrigerating unit and a valve for reversal of the cooling/heat cycle (reversible heat pumps),356684
201604,502,United States,841582,"Other, air conditioning machines incorporating a refrigerating unit",214708
201604,502,United States,841583,"Air conditioning machines,not incorporating a refrigerating unit",52283
201604,502,United States,841590,"Parts of air conditioning machines, comprising a motor-driven fan and elements for changing the temperature and humidity, n.e.s.",3665171
201604,502,United States,841610,Furnace burners for liquid fuel,968361
201604,502,United States,841620,"Other furnace burners, including combination burners",819859
201604,502,United States,841690,"Parts of furnace burners such as mechanical stokers, incl. their mechanical grates, mechanical ash dischargers and similar appliances, n.e.s.",297025
201604,502,United States,841720,"Bakery ovens, including biscuit ovens",34991
201604,502,United States,841780,"Industrial or laboratory furnaces and ovens, non-electric, incl. incinerators (excluding those for the roasting, melting or other heat treatment of ores, pyrites or metals, bakery ovens, drying ovens and ovens for cracking operations)",543092
201604,502,United States,841790,"Parts of industrial or laboratory furnaces, non-electric, incl. incinerators, n.e.s.",326926
201604,502,United States,841810,"Combined refrigeratorfreezers, fitted with separate external doors",259433
201604,502,United States,841821,"Household refrigerators, compression-type",17936
201604,502,United States,841830,"Freezers of the chest type, of a capacity ≤ 800L",107358
201604,502,United States,841840,"Freezers of the upright type, of a capacity ≤ 900L",945905
201604,502,United States,841850,"Furniture (chests, cabinets, display counters, show-cases and the like) for storage and display, incorporating refrigerating or freezing equipment (excluding combined refrigerator-freezers with separate external doors, household refrigerators and freezers of the chest type of a capacity ≤ 800L or of the upright type of a capacity ≤ 900L)",1213216
201604,502,United States,841861,Heat pumps other than air conditioning machines of heading 84.15,46400
201604,502,United States,841869,Refrigerating or freezing equipment (excluding refrigerating and freezing furniture),2738964
201604,502,United States,841899,"Parts of refrigerating or freezing equipment and heat pumps, n.e.s.",1833743
201604,502,United States,841911,Instantaneous gas water heaters,7503
201604,502,United States,841919,"Instantaneous or storage water heaters, non-electric (excluding instantaneous gas water heaters and boilers or water heaters for central heating)",82768
201604,502,United States,841920,"Medical, surgical or laboratory sterilisers",1010494
201604,502,United States,841939,"Dryers (excluding dryers for agricultural products, for wood, paper pulp, paper or paperboard, for yarns, fabrics and other textile products, dryers for bottles or other containers, hairdryers, hand dryers and domestic appliances)",983082
201604,502,United States,841940,Distilling or rectifying plant,3000
201604,502,United States,841950,Heat exchange units,5178496
201604,502,United States,841960,Machinery for liquefying air or other gases,33815
201604,502,United States,841981,"Machinery, plant and equipment for making hot drinks or for cooking or heating food (excluding domestic appliances)",1351753
201604,502,United States,841989,"Machinery, plant or laboratory equipment, whether or not electrically heated, for the treatment of materials by a process involving a change of temperature such as heating, cooking, roasting, sterilising, pasteurising, steaming, evaporating, vaporising, condensing or cooling, n.e.s. (excluding machinery used for domestic purposes and furnaces, ovens and other equipment of heading 8514)",6197755
201604,502,United States,841990,"Parts of machinery, plant and laboratory equipment, whether or not electrically heated, for the treatment of materials by a process involving a change of temperature, and of non-electric instantaneous and storage water heaters, n.e.s.",1180050
201604,502,United States,842010,Calendering or other rolling machines,896306
201604,502,United States,842091,Cylinders,52864
201604,502,United States,842099,"Parts for calendering or rolling machines, n.e.s. (other than for metals or glass and excluding cylinders)",249497
201604,502,United States,842112,Centrifugal clothes-dryers,2950
201604,502,United States,842119,"Centrifuges, incl. centrifugal dryers (excluding isotope separators, cream separators and clothes dryers)",3441886
201604,502,United States,842121,Machinery and apparatus for filtering or purifying water,16608445
201604,502,United States,842122,Machinery and apparatus for filtering or purifying beverages (excludingwater),20933
201604,502,United States,842123,Oil or petrol-filters for internal combustion engines,3041645
201604,502,United States,842129,"Machinery and apparatus for filtering or purifying liquids (excluding such machinery and apparatus for water and other beverages, oil or petrol-filters for internal combustion engines and artificial kidneys)",5181667
201604,502,United States,842131,Intake air filters for internal combustion engines,703139
201604,502,United States,842139,Machinery and apparatus for filtering or purifying gases (excluding isotope separators and intake air filters for internal combustion engines),13833162
201604,502,United States,842191,"Parts of centrifuges, incl. centrifugal dryers, n.e.s.",380475
201604,502,United States,842199,"Parts of machinery and apparatus for filtering or purifying liquids or gases, n.e.s.",31620459
201604,502,United States,842211,Dishwashing machines of the household type,19564
201604,502,United States,842219,Dishwashing machines (excluding those of the household type),410
201604,502,United States,842220,Machinery for cleaning or drying bottles or other containers (excluding dishwashing machines),831878
201604,502,United States,842230,"Machinery for filling, closing, sealing or labelling bottles, cans, boxes, bags or other containers; machinery for capsuling bottles, jars, tubes and similar containers; machinery for aerating beverages",1356083
201604,502,United States,842240,"Packing or wrapping machinery, incl. heat-shrink wrapping machinery (excluding machinery for filling, closing, sealing or labelling bottles, cans, boxes, bags or other containers and machinery for capsuling bottles, jars, tubes and similar containers)",1079373
201604,502,United States,842290,"Parts of dishwashing machines, packing or wrapping machinery and other machinery and apparatus of heading 8422, n.e.s.",307640
201604,502,United States,842310,"Personal weighing machines, incl. baby scales; household scales",924
201604,502,United States,842320,Scales for continuous weighing of goods on conveyors,2006
201604,502,United States,842330,"Constant weight scales and scales for discharging a pre-determined weight of material into a bag or container, incl. hopper scales (excluding scales for continuous weighing of goods on conveyors)",31661
201604,502,United States,842381,"Weighing machinery having a maximum weighing capacity ≤ 30 kg (excluding balances of a sensitivity of 5 cg or better, personal weighing machines, household scales, scales for continuous weighing of goods on conveyors, constant weight scales and scales for discharging a pre-determined weight of material into a bag or container, incl. hopper scales)",1820
201604,502,United States,842382,"Weighing machinery of a maximum weighing capacity ＞ 30 kg but ≤ 5.000 kg (excluding personal weighing machines, scales for continuous weighing of goods on conveyors, constant weight scales and scales for discharging a pre-determined weight of material into a bag or container, incl. hopper scales)",26476
201604,502,United States,842389,Weighing machinery of a maximum weighing capacity ＞ 5.000 kg,341737
201604,502,United States,842390,"Weighing machine weights of all kinds; parts of weighing machinery, n.e.s.",61083
201604,502,United States,842410,"Fire extinguishers, whether or not charged",416508
201604,502,United States,842420,Spray guns and similar appliances,2217972
201604,502,United States,842430,Steam or sand blasting machines and similar jet projecting machines,458353
201604,502,United States,842481,-------,1530551
201604,502,United States,842489,"Mechanical appliances, whether or not hand-operated, for projecting, dispersing or spraying liquids or powders, n.e.s.",7951045
201604,502,United States,842490,"Parts of fire extinguishers, spray guns and similar appliances, steam or sand blasting machines and similar jet projecting machines and machinery and apparatus for projecting, dispersing or spraying liquids or powders, n.e.s.",6793487
201604,502,United States,842511,"Pulley tackle and hoists, powered by electric motor (other than skip hoists or hoists of a kind used for raising vehicles)",328337
201604,502,United States,842519,"Pulley tackle and hoists (other than skip hoists or hoists of a kind used for raising vehicles), non-powered by electric motor",240629
201604,502,United States,842531,Winches and capstans powered by electric motor,32952
201604,502,United States,842539,"Winches and capstans, non-powered by electric motor",619904
201604,502,United States,842542,"Jacks and hoists, hydraulic (excluding built-in jacking systems used in garages)",161580
201604,502,United States,842549,"Jacks and hoists of a kind used for raising vehicles, not hydraulic",85746
201604,502,United States,842611,Overhead travelling cranes on fixed support,1495
201604,502,United States,842619,"Overhead travelling cranes, transporter cranes, gantry cranes, bridge cranes and mobile lifting frames (excluding overhead travelling cranes on fixed support, mobile lifting frames on tyres, straddle carriers and portal or pedestal jib cranes)",13230
201604,502,United States,842641,"Mobile cranes and works trucks fitted with a crane, self-propelled, on tyres (excluding wheel-mounted cranes, mobile lifting frames on tyres and straddle carriers)",14762
201604,502,United States,842699,"Ships' derricks; cranes, incl. cable cranes (excluding overhead travelling cranes, transporter cranes, gantry cranes, portal or pedestal jib cranes, bridge cranes, mobile lifting frames and straddle carriers, tower cranes, works trucks fitted with a crane, mobile cranes and cranes designed for mounting on road vehicles)",14910
201604,502,United States,842710,Selfpropelled trucks powered by an electric motor,3104974
201604,502,United States,842720,Other selfpropelled trucks,1365013
201604,502,United States,842790,"Works trucks fitted with lifting or handling equipment, not self-propelled",4748
201604,502,United States,842810,Lifts and skip hoists,27346
201604,502,United States,842820,Pneumatic elevators and conveyors,508355
201604,502,United States,842833,"Continuous-action elevators and conveyors, for goods or materials, belt type",277524
201604,502,United States,842839,"Continuous-action elevators and conveyors, for goods or materials (excluding those for underground use and bucket, belt or pneumatic types)",2578645
201604,502,United States,842890,"Machinery for lifting, handling, loading or unloading, nes",3591217
201604,502,United States,842920,Graders and levellers,113249
201604,502,United States,842940,Tamping machines and road rollers,9704
201604,502,United States,842951,Frontend shovel loaders,461330
201604,502,United States,843010,Piledrivers and pileextractors,104889
201604,502,United States,843020,Snowploughs and snowblowers,121524
201604,502,United States,843041,"Other, self-propelled boring or sinking machinery for boring earth or extracting minerals or ores",180000
201604,502,United States,843061,"Tamping or compacting machinery, not self-propelled (excluding hand-operated tools)",887393
201604,502,United States,843069,"Earth moving machinery, not self-propelled, n.e.s.",5783631
201604,502,United States,843110,Part of machinery of heading 84.25,178447
201604,502,United States,843120,Part of machinery of heading 84.27,525165
201604,502,United States,843131,"Part off lifts, skip hoists or escalators, of heading 84.28",392176
201604,502,United States,843139,"Parts of machinery of heading 8428, n.e.s.",2444804
201604,502,United States,843141,"Buckets, shovels, grabs and grips",301620
201604,502,United States,843143,Parts for boring or sinking machinery of subheading 8430.41 or,12918442
201604,502,United States,843149,"Parts of machinery of heading 8426, 8429 and 8430, n.e.s.",2759277
201604,502,United States,843229,"Harrows, scarifiers, cultivators, weeders and hoes for use in agriculture, horticulture or forestry (excluding disc harrows)",123582
201604,502,United States,843230,-------,638181
201604,502,United States,843240,-------,120050
201604,502,United States,843280,"Agricultural, horticultural or forestry machinery for soil preparation or cultivation; lawn or sports-ground rollers (excluding sprayers and dusters, ploughs, harrows, scarifiers, cultivators, weeders, hoes, seeders, planters, manure spreaders and fertiliser distributors)",26119
201604,502,United States,843290,"Parts of agricultural, horticultural or forestry machinery for soil preparation or cultivation or of lawn or sports-ground rollers, n.e.s.",259065
201604,502,United States,843311,"Powered, with the cutting device rotating in a horizontal plane",157872
201604,502,United States,843319,"Mowers for lawns, parks or sports grounds, powered, with the cutting device rotating in a vertical plane or with cutter bars",18610
201604,502,United States,843320,"Other mowers, including cutter bars for tractor mounting",87286
201604,502,United States,843330,Other haymaking machinery,42623
201604,502,United States,843340,"Straw or fodder balers, including pickup balers",2541053
201604,502,United States,843351,Combine harvester-threshers,10005814
201604,502,United States,843360,"Machines for cleaning, sorting or grading eggs, fruit or other agricultural produce",121767
201604,502,United States,843390,"Parts of harvesting machinery, threshing machinery, mowers and machines for cleaning, sorting or grading agricultural produce, n.e.s.",4543836
201604,502,United States,843420,Dairy machinery,5269
201604,502,United States,843490,"Parts of milking machines and dairy machinery, n.e.s.",310430
201604,502,United States,843610,Machinery for preparing animal feeding stuffs,139488
201604,502,United States,843621,Poultry incubators and brooders,447672
201604,502,United States,843629,"Poultry-keeping machinery (excluding machines for sorting or grading eggs, poultry pickers of heading 8438 and incubators and brooders)",879107
201604,502,United States,843680,"Agricultural, horticultural, forestry or bee-keeping machinery, n.e.s.",558071
201604,502,United States,843691,"Parts of poultry-keeping machinery or poultry incubators and brooders, n.e.s.",228751
201604,502,United States,843699,"Parts of agricultural, horticultural, forestry or bee-keeping machinery of heading 84.36, n.e.s.",39537
201604,502,United States,843710,"Machines for cleaning, sorting or grading seed, grain or dried leguminous vegetables",294235
201604,502,United States,843780,"Machinery used in the milling industry or for the working of cereals or dried leguminous vegetables (excluding farm-type machinery, heat treatment equipment, centrifugal dryers, air filters and machines for cleaning, sorting or grading seed, grain or dried leguminous vegetables)",380582
201604,502,United States,843790,"Parts of machinery used in the milling industry or for the working of cereals or dried leguminous vegetables or machines for cleaning, sorting or grading seed, grain or dried leguminous vegetables, n.e.s.",2341
201604,502,United States,843810,"Bakery machinery and machinery for the manufacture of macaroni, spaghetti or similar products",161535
201604,502,United States,843850,Machinery for the preparation of meat or poultry,321369
201604,502,United States,843860,"Machinery for the preparation of fruits, nuts or vegetables",195124
201604,502,United States,843880,"Machinery for the industrial preparation or manufacture of food or drink, nes",443014
201604,502,United States,843890,"Parts of machinery for the industrial preparation or manufacture of food or drink, nes",15993
201604,502,United States,843930,Machinery for finishing paper or paperboard,78161
201604,502,United States,843991,"Parts of machinery for making pulp of fibrous cellulosic material, n.e.s.",806939
201604,502,United States,843999,"Parts of machinery for making or finishing paper or paperboard, n.e.s.",293878
201604,502,United States,844010,"Bookbinding machinery, incl. book-sewing machines (excluding machinery of heading 8441, general-purpose presses, printing machinery of heading 8443 and machines of uses ancillary to printing)",605
201604,502,United States,844090,"Parts of bookbinding machinery, n.e.s.",30418
201604,502,United States,844110,Cutting machines,42039
201604,502,United States,844140,"Machines for moulding articles in paper pulp, paper or paperboard",39063
201604,502,United States,844180,"Machinery for making up paper pulp, paper or paperboard, n.e.s.",1500
201604,502,United States,844190,"Parts of machinery for making up paper pulp, paper or paperboard, n.e.s.",1095073
201604,502,United States,844230,"Machinery, apparatus and equipment",3055
201604,502,United States,844240,"Parts of the foregoing machinery, apparatus or equipment",9900
201604,502,United States,844250,"Plates, cylinders and other printing components; plates, cylinders and lithographic stones, prepared for printing purposes (for example, planed, grained or polished)",66956
201604,502,United States,844313,Other offset printing machinery,985
201604,502,United States,844316,Flexographic printing machinery,577295
201604,502,United States,844317,Gravure printing machinery,1976
201604,502,United States,844319,"Printing machinery used for printing by means of plates, cylinders and other printing components of heading 8442 (excluding hectograph or stencil duplicating machines, addressing machines and other office printing machines of heading 8469 to 8472, ink jet printing machines and offset, flexographic, letterpress and gravure printing machinery)",22855
201604,502,United States,844331,"Machines which perform two or more of the functions of printing, copying or facsimile transmission, capable of connecting to an automatic data processing machine or to a network",1069055
201604,502,United States,844332,"Other, capable of connecting to an automatic data processing machine or to a network",1557288
201604,502,United States,844339,"Printers, copying machines and facsimile machines, whether or not combined (excluding those capable of connecting to an automatic data processing machine or to a network and printing machinery used for printing by means of plates, cylinders and other printing components of heading 8442)",146334
201604,502,United States,844391,"Parts and accessories of printing machinery used for printing by means of plates, cylinders and other printing components of heading 84.42",623784
