Date of data,Trading partner code,Trading partner,Commodity code,Commodity,US dollar
202510,502,United States,591190,"Textile products and articles, for technical purposes, specified in Note 7 to chapter 59, n.e.s.",1593335.0
202510,502,United States,600110,"Long pile fabrics, knitted or crocheted",619.0
202510,502,United States,600122,"Looped pile fabrics of man-made fibres, knitted or crocheted",121399.0
202510,502,United States,600191,"Pile fabrics of cotton, knitted or crocheted (excluding long pile"" fabrics)""",233.0
202510,502,United States,600192,"Pile fabrics of man-made fibres, knitted or crocheted (excluding long pile"" fabrics)""",85602.0
202510,502,United States,600199,"Pile fabrics, knitted or crocheted (excluding cotton or man-made fibres and long pile"" fabrics)""",40290.0
202510,502,United States,600240,"Knitted or crocheted fabrics, of a width of ≤ 30 cm, containing ≥ 5% by weight elastomeric yarn",1544.0
202510,502,United States,600310,"Knitted or crocheted fabrics of wool or fine animal hair, of a width of ≤ 30 cm",258.0
202510,502,United States,600320,"Knitted or crocheted fabrics of cotton, of a width of ≤ 30 cm",1208.0
202510,502,United States,600330,"Knitted or crocheted fabrics of synthetic fibres, of a width of ≤ 30 cm",2822.0
202510,502,United States,600340,"Knitted or crocheted fabrics of artificial fibres, of a width of ≤ 30 cm",97.0
202510,502,United States,600410,"Knitted or crocheted fabrics, of a width of ＞ 30 cm, containing ≥ 5% by weight elastomeric yarn",5087.0
202510,502,United States,600490,"Knitted or crocheted fabrics, of a width of ＞ 30 cm, containing ≥ 5% by weight elastomeric yarn and rubber thread or rubber thread only",46.0
202510,502,United States,600536,"Unbleached or bleached warp knit fabrics of synthetic fibres incl. those made on galloon knitting machines"", of a width of ＞ 30 cm""",320973.0
202510,502,United States,600537,"Dyed warp knit fabrics of synthetic fibres incl. those made on galloon knitting machines"", of a width of ＞ 30 cm""",183909.0
202510,502,United States,600538,"Warp knit fabrics of synthetic fibres, of yarns of different colours incl. those made on galloon knitting machines"", of a width of ＞ 30 cm""",131.0
202510,502,United States,600610,"Fabrics, knitted or crocheted, of a width of ＞ 30 cm, of wool or fine animal hair",1120.0
202510,502,United States,600621,"Unbleached or bleached cotton fabrics, knitted or crocheted, of a width of ＞ 30 cm",1.0
202510,502,United States,600622,"Dyed cotton fabrics, knitted or crocheted, of a width of ＞ 30 cm",8519.0
202510,502,United States,600623,"Cotton fabrics, knitted or crocheted, of yarns of different colours, of a width of ＞ 30 cm",949.0
202510,502,United States,600624,"Printed cotton fabrics, knitted or crocheted, of a width of ＞ 30 cm",59.0
202510,502,United States,600631,"Unbleached or bleached fabrics, knitted or crocheted, of synthetic fibres, of a width of ＞ 30 cm",307.0
202510,502,United States,600632,"Dyed fabrics, knitted or crocheted, of synthetic fibres, of a width of ＞ 30 cm",219974.0
202510,502,United States,600633,"Fabrics, knitted or crocheted, of synthetic fibres, of yarns of different colours, of a width of ＞ 30 cm",16098.0
202510,502,United States,600634,"Printed fabrics, knitted or crocheted, of synthetic fibres, of a width of ＞ 30 cm",150.0
202510,502,United States,600690,"Fabrics, knitted or crocheted, of a width of ＞ 30 cm",6.0
202510,502,United States,610120,"Overcoats, car coats, capes, cloaks, anoraks, incl. ski jackets, windcheaters, wind-jackets and similar articles of cotton, for men or boys, knitted or crocheted",17641.0
202510,502,United States,610130,"Overcoats, car coats, capes, cloaks, anoraks, incl. ski jackets, windcheaters, wind-jackets and similar articles of man-made fibres, for men or boys, knitted or crocheted",119670.0
202510,502,United States,610210,"Women's or girls' overcoats, car coats, capes, cloaks, anoraks, incl. ski jackets, windcheaters, wind-jackets and similar articles, of wool or fine animal hair, knitted or crocheted",169.0
202510,502,United States,610220,"Women's or girls' overcoats, car coats, capes, cloaks, anoraks, incl. ski jackets, windcheaters, wind-jackets and similar articles of cotton, knitted or crocheted",854.0
202510,502,United States,610230,"Women's or girls' overcoats, car coats, capes, cloaks, anoraks, incl. ski jackets, windcheaters, wind-jackets and similar articles of man-made fibres, knitted or crocheted",28787.0
202510,502,United States,610310,"Men's or boys' suits of textile materials, knitted or crocheted",662.0
202510,502,United States,610322,"Men's or boys' ensembles of cotton, knitted or crocheted",104.0
202510,502,United States,610323,"Men's or boys' ensembles of synthetic fibres, knitted or crocheted",115.0
202510,502,United States,610331,"Men's or boys' jackets and blazers of wool or fine animal hair, knitted or crocheted",106.0
202510,502,United States,610332,"Men's or boys' jackets and blazers of cotton, knitted or crocheted",60445.0
202510,502,United States,610333,"Men's or boys' jackets and blazers of synthetic fibres, knitted or crocheted",28322.0
202510,502,United States,610341,"Men's or boys' trousers, bib and brace overalls, breeches and shorts of wool or fine animal hair, knitted or crocheted",36353.0
202510,502,United States,610342,"Men's or boys' trousers, bib and brace overalls, breeches and shorts of cotton, knitted or crocheted",30674.0
202510,502,United States,610343,"Men's or boys' trousers, bib and brace overalls, breeches and shorts of synthetic fibres, knitted or crocheted",20492.0
202510,502,United States,610349,"Men's or boys' trousers, bib and brace overalls, breeches and shorts of textile materials, knitted or crocheted",1868.0
202510,502,United States,610422,"Women's or girls' ensembles of cotton, knitted or crocheted",193.0
202510,502,United States,610423,"Women's or girls' ensembles of synthetic fibres, knitted or crocheted",405.0
202510,502,United States,610429,Women's or girls' ensembles of textile materials,56.0
202510,502,United States,610431,"Women's or girls' jackets and blazers of wool or fine animal hair, knitted or crocheted",838.0
202510,502,United States,610432,"Women's or girls' jackets and blazers of cotton, knitted or crocheted",2873.0
202510,502,United States,610433,"Women's or girls' jackets and blazers of synthetic fibres, knitted or crocheted",2662.0
202510,502,United States,610439,"Women's or girls' jackets and blazers of textile materials, knitted or crocheted",460.0
202510,502,United States,610441,"Women's or girls' dresses of wool or fine animal hair, knitted or crocheted",2973.0
202510,502,United States,610442,"Women's or girls' dresses of cotton, knitted or crocheted",34756.0
202510,502,United States,610443,"Women's or girls' dresses of synthetic fibres, knitted or crocheted",131623.0
202510,502,United States,610444,"Women's or girls' dresses of artificial fibres, knitted or crocheted",27757.0
202510,502,United States,610449,"Women's or girls' dresses of textile materials, knitted or crocheted",14254.0
202510,502,United States,610452,"Women's or girls' skirts and divided skirts of cotton, knitted or crocheted",9295.0
202510,502,United States,610453,"Women's or girls' skirts and divided skirts of synthetic fibres, knitted or crocheted",728.0
202510,502,United States,610459,"Women's or girls' skirts and divided skirts of textile materials, knitted or crocheted",72.0
202510,502,United States,610461,"Women's or girls' trousers, bib and brace overalls, breeches and shorts of wool or fine animal hair, knitted or crocheted",638.0
202510,502,United States,610462,"Women's or girls' trousers, bib and brace overalls, breeches and shorts of cotton, knitted or crocheted",92427.0
202510,502,United States,610463,"Women's or girls' trousers, bib and brace overalls, breeches and shorts of synthetic fibres, knitted or crocheted",7254.0
202510,502,United States,610469,"Women's or girls' trousers, bib and brace overalls, breeches and shorts of textile materials, knitted or crocheted",1347.0
202510,502,United States,610510,"Men's or boys' shirts of cotton, knitted or crocheted (excluding nightshirts, T-shirts, singlets and other vests)",32052.0
202510,502,United States,610520,"Men's or boys' shirts of man-made fibres, knitted or crocheted (excluding nightshirts, T-shirts, singlets and other vests)",114414.0
202510,502,United States,610590,"Men's or boys' shirts of textile materials, knitted or crocheted (excluding of cotton or man-made fibres, nightshirts, T-shirts, singlets and other vests)",16709.0
202510,502,United States,610610,"Women's or girls' blouses, shirts and shirt-blouses of cotton, knitted or crocheted (excluding T-shirts and vests)",33493.0
202510,502,United States,610620,"Women's or girls' blouses, shirts and shirt-blouses of man-made fibres, knitted or crocheted (excluding T-shirts and vests)",37831.0
202510,502,United States,610690,"Women's or girls' blouses, shirts and shirt-blouses of textile materials, knitted or crocheted (excluding of cotton or man-made fibres, T-shirts and vests)",4872.0
202510,502,United States,610711,"Men's or boys' underpants and briefs of cotton, knitted or crocheted",2312.0
202510,502,United States,610712,"Men's or boys' underpants and briefs of man-made fibres, knitted or crocheted",758.0
202510,502,United States,610722,"Men's or boys' nightshirts and pyjamas of man-made fibres, knitted or crocheted (excluding vests and singlets)",4157.0
202510,502,United States,610791,"Men's or boys' bathrobes, dressing gowns and similar articles of cotton, knitted or crocheted",20.0
202510,502,United States,610799,"Men's or boys' bathrobes, dressing gowns and similar articles of textile materials, knitted or crocheted (excluding of cotton)",108.0
202510,502,United States,610821,"Women's or girls' briefs and panties of cotton, knitted or crocheted",1528.0
202510,502,United States,610822,"Women's or girls' briefs and panties of man-made fibres, knitted or crocheted",422.0
202510,502,United States,610831,"Women's or girls' nightdresses and pyjamas of cotton, knitted or crocheted (excluding T-shirts, vests and négligés)",3508.0
202510,502,United States,610832,"Women's or girls' nightdresses and pyjamas of man-made fibres, knitted or crocheted (excluding T-shirts, vests and négligés)",2835.0
202510,502,United States,610891,"Women's or girls' négligés, bathrobes, dressing gowns, housejackets and similar articles of cotton, knitted or crocheted (excluding vests, slips, petticoats, briefs and panties, nightdresses, pyjamas, brassiéres, girdles, corsets and similar articles)",638.0
202510,502,United States,610892,"Women's or girls' négligés, bathrobes, dressing gowns, housejackets and similar articles of man-made fibres, knitted or crocheted (excluding vests, slips, petticoats, briefs and panties, nightdresses, pyjamas, brassiéres, girdles, corsets and similar articles)",90.0
202510,502,United States,610910,"T-shirts, singlets and other vests of cotton, knitted or crocheted",131452.0
202510,502,United States,610990,"T-shirts, singlets and other vests of textile materials, knitted or crocheted (excluding cotton)",74539.0
202510,502,United States,611011,"Jerseys, pullovers, cardigans, waistcoats and similar articles, of hair of Kashmir cashmere"" goats, knitted or crocheted (excluding quilted articles)""",28844.0
202510,502,United States,611012,"Jerseys, pullovers, cardigans, waistcoats and similar articles, of fine animal hair, knitted or crocheted (excluding from hair of Kashmir cashmere"" goats and quilted articles)""",173620.0
202510,502,United States,611019,"Jerseys, pullovers, cardigans, waistcoats and similar articles, of cotton, knitted or crocheted (excluding wadded waistcoats)",32.0
202510,502,United States,611020,"Jerseys, pullovers, cardigans, waistcoats and similar articles, of man-made fibres, knitted or crocheted (excluding wadded waistcoats)",510706.0
202510,502,United States,611030,"Jerseys, pullovers, cardigans, waistcoats and similar articles, of textile materials, knitted or crocheted (excluding of wool, fine animal hair, cotton or man-made fibres, and wadded waistcoats)",66864.0
202510,502,United States,611090,"bies' garments and clothing accessories, knitted or crocheted (excluding hats)",28251.0
202510,502,United States,611120,"Babies' garments and clothing accessories of cotton, knitted or crocheted (excluding hats)",3233.0
202510,502,United States,611130,"Babies' garments and clothing accessories of synthetic fibres, knitted or crocheted (excluding hats)",35.0
202510,502,United States,611211,"Track-suits of cotton, knitted or crocheted",51.0
202510,502,United States,611219,"Track-suits of textile materials, knitted or crocheted (excluding cotton or synthetic fibres)",136.0
202510,502,United States,611231,"Men's or boys' swimwear of synthetic fibres, knitted or crocheted",174.0
202510,502,United States,611241,"Women's or girls' swimwear of synthetic fibres, knitted or crocheted",8356.0
202510,502,United States,611300,"Garments, knitted or crocheted, rubberised or impregnated, coated or covered with plastics or other materials (excluding babies' garments and clothing accessories)",171.0
202510,502,United States,611420,"Other garments of cotton, knitted or crocheted",1803.0
202510,502,United States,611430,"Other garments of man-made fibres, knitted or crocheted",58395.0
202510,502,United States,611510,"Graduated compression hosiery [e.g., stockings for varicose veins], of textile materials, knitted or crocheted (excluding hosiery for babies)",43973.0
202510,502,United States,611521,"Pantyhose and tights of synthetic fibres, knitted or crocheted, measuring per single yarn ＜ 67 decitex (excluding graduated compression hosiery)",271.0
202510,502,United States,611522,"Pantyhose and tights of synthetic fibres, knitted or crocheted, measuring per single yarn ≥ 67 decitex (excluding graduated compression hosiery)",184.0
202510,502,United States,611529,"Pantyhose and tights of textile materials, knitted or crocheted (excluding graduated compression hosiery, those of synthetic fibres and hosiery for babies)",248.0
202510,502,United States,611530,"Women's full-length or knee-length hosiery, knitted or crocheted, measuring per single yarn ＜ 67 decitex (excluding graduated compression hosiery, pantyhose and tights)",7.0
202510,502,United States,611594,"Full-length or knee-length stockings, socks and other hosiery, incl. footwear without applied soles, of wool or fine animal hair, knitted or crocheted (excluding graduated compression hosiery, pantyhose and tights, women's full-length or knee-length stockings, measuring per single yarn ＜ 67 decitex, and hosiery for babies)",1743.0
202510,502,United States,611595,"Full-length or knee-length stockings, socks and other hosiery, incl. footwear without applied soles, of cotton, knitted or crocheted (excluding graduated compression hosiery, pantyhose and tights, women's full-length or knee-length stockings, measuring per single yarn ＜ 67 decitex, and hosiery for babies)",2917.0
202510,502,United States,611596,"Full-length or knee-length stockings, socks and other hosiery, incl. footwear without applied soles, of synthetic fibres, knitted or crocheted (excluding graduated compression hosiery, pantyhose and tights, women's full-length or knee-length stockings, measuring per single yarn ＜ 67 decitex, and hosiery for babies)",2872.0
202510,502,United States,611599,"Full-length or knee-length stockings, socks and other hosiery, incl. footwear without applied soles, of textile materials, knitted or crocheted (excluding of wool, fine animal hair, cotton or synthetic fibres, graduated compression hosiery, pantyhose and tights, women's full-length or knee-length stockings, measuring per single yarn ＜ 67 decitex, and hosiery for babies)",444.0
202510,502,United States,611610,"Impregnated, coated, covered or laminated with plastics or rubber",95.0
202510,502,United States,611691,"Gloves, mittens and mitts, of wool or fine animal hair, knitted or crocheted (excluding for babies)",468.0
202510,502,United States,611692,"Gloves, mittens and mitts, of cotton, knitted or crocheted (excluding impregnated, coated or covered with plastics or rubber, and for babies)",63.0
202510,502,United States,611693,"Gloves, mittens and mitts, of synthetic fibres, knitted or crocheted (excluding impregnated, coated or covered with plastics or rubber, and for babies)",14816.0
202510,502,United States,611699,"Gloves, mittens and mitts, of textile materials, knitted or crocheted (excluding of wool, fine animal hair, cotton or synthetic fibres, impregnated, coated or covered with plastics or rubber, and for babies)",403.0
202510,502,United States,611710,"Shawls, scarves, mufflers, mantillas, veils and the like, knitted or crocheted",27234.0
202510,502,United States,611780,"Ties, bow ties, cravats and other made-up clothing accessories, knitted or crocheted, n.e.s. (excluding shawls, scarves, mufflers, mantillas, veils and the like)",7382.0
202510,502,United States,611790,"Parts of garments or clothing accessories, knitted or crocheted, n.e.s.",30739.0
202510,502,United States,620120,"Men’s or boys’ overcoats, car-coats, capes, cloaks, anoraks (including ski-jackets), wind-cheaters, windjackets and similar artic,of wool or fine animal hair",5651.0
202510,502,United States,620130,"Men’s or boys’ overcoats, car-coats, capes, cloaks, anoraks (including ski-jackets), wind-cheaters, windjackets and similar artic,of cotton",70174.0
202510,502,United States,620140,"Men’s or boys’ overcoats, car-coats, capes, cloaks, anoraks (including ski-jackets), wind-cheaters, windjackets and similar artic,of man-made fibres",80728.0
202510,502,United States,620190,"Men's or boys' overcoats, raincoats, car coats, capes, cloaks and similar articles, of  other textile materials",2022.0
202510,502,United States,620220,"Women’s or girls’ overcoats, car-coats, capes, cloaks, anoraks (including ski-jackets), wind-cheaters, wind jackets and similar articles, of wool or fine animal hair",92483.0
202510,502,United States,620230,"Women’s or girls’ overcoats, car-coats, capes, cloaks, anoraks (including ski-jackets), wind-cheaters, wind jackets and similar articles, of cotton",11378.0
202510,502,United States,620240,"Women’s or girls’ overcoats, car-coats, capes, cloaks, anoraks (including ski-jackets), wind-cheaters, wind jackets and similar articles,of man-made fibres",67351.0
202510,502,United States,620290,"Women’s or girls’ overcoats, car-coats, capes, cloaks, anoraks (including ski-jackets), wind-cheaters, wind jackets and similar articles, of other textile materials",6042.0
202510,502,United States,620323,"Men's or boys' ensembles of synthetic fibres (excluding knitted or crocheted, ski ensembles and swimwear)",143.0
202510,502,United States,620331,"Men's or boys' jackets and blazers of wool or fine animal hair (excluding knitted or crocheted, and wind-jackets and similar articles)",1093.0
202510,502,United States,620332,"Men's or boys' jackets and blazers of cotton (excluding knitted or crocheted, and wind-jackets and similar articles)",4847.0
202510,502,United States,620333,"Men's or boys' jackets and blazers of synthetic fibres (excluding knitted or crocheted, and wind-jackets and similar articles)",21540.0
202510,502,United States,620339,"Men's or boys' jackets and blazers of textile materials (excluding of wool, fine animal hair, cotton or synthetic fibres, knitted or crocheted, and wind-jackets and similar articles)",16032.0
202510,502,United States,620341,"Men's or boys' trousers, bib and brace overalls, breeches and shorts, of wool or fine animal hair (excluding knitted or crocheted, underpants and swimwear)",5776.0
202510,502,United States,620342,"Men's or boys' trousers, bib and brace overalls, breeches and shorts, of cotton (excluding knitted or crocheted, underpants and swimwear)",131171.0
202510,502,United States,620343,"Men's or boys' trousers, bib and brace overalls, breeches and shorts of synthetic fibres (excluding knitted or crocheted, underpants and swimwear)",49452.0
202510,502,United States,620349,"Men's or boys' trousers, bib and brace overalls, breeches and shorts of textile materials (excluding of wool, fine animal hair, cotton or synthetic fibres, knitted or crocheted, underpants and swimwear)",1869.0
202510,502,United States,620413,"Women's or girls' suits of synthetic fibres (excluding knitted or crocheted, ski overalls and swimwear)",192.0
202510,502,United States,620423,"Women's or girls' ensembles of synthetic fibres (excluding knitted or crocheted, ski overalls and swimwear)",406.0
202510,502,United States,620431,"Women's or girls' jackets and blazers of wool or fine animal hair (excluding knitted or crocheted, wind-jackets and similar articles)",17094.0
202510,502,United States,620432,"Women's or girls' jackets and blazers of cotton (excluding knitted or crocheted, wind-jackets and similar articles)",7643.0
202510,502,United States,620433,"Women's or girls' jackets and blazers of synthetic fibres (excluding knitted or crocheted, wind-jackets and similar articles)",11203.0
202510,502,United States,620439,"Women's or girls' jackets and blazers of textile materials (excluding of wool, fine animal hair, cotton or synthetic fibres, knitted or crocheted, wind-jackets and similar articles)",6037.0
202510,502,United States,620441,Women's or girls' dresses of wool or fine animal hair (excluding knitted or crocheted and petticoats),331.0
202510,502,United States,620442,Women's or girls' dresses of cotton (excluding knitted or crocheted and petticoats),6184.0
202510,502,United States,620443,Women's or girls' dresses of synthetic fibres (excluding knitted or crocheted and petticoats),15685.0
202510,502,United States,620444,Women's or girls' dresses of artificial fibres (excluding knitted or crocheted and petticoats),1806.0
202510,502,United States,620449,"Women's or girls' dresses of textile materials (excluding of wool, fine animal hair, cotton or man-made fibres, knitted or crocheted and petticoats)",11070.0
202510,502,United States,620451,Women's or girls' skirts and divided skirts of wool or fine animal hair (excluding knitted or crocheted and petticoats),1321.0
202510,502,United States,620452,Women's or girls' skirts and divided skirts of cotton (excluding knitted or crocheted and petticoats),8758.0
202510,502,United States,620453,Women's or girls' skirts and divided skirts of synthetic fibres (excluding knitted or crocheted and petticoats),7911.0
202510,502,United States,620459,"Women's or girls' skirts and divided skirts of textile materials (excluding of wool, fine animal hair, cotton or synthetic fibres, knitted or crocheted and petticoats)",6815.0
202510,502,United States,620461,"Women's or girls' trousers, bib and brace overalls, breeches and shorts of wool or fine animal hair (excluding knitted or crocheted, panties and swimwear)",779.0
202510,502,United States,620462,"Women's or girls' trousers, bib and brace overalls, breeches and shorts of cotton (excluding knitted or crocheted, panties and swimwear)",183864.0
202510,502,United States,620463,"Women's or girls' trousers, bib and brace overalls, breeches and shorts of synthetic fibres (excluding knitted or crocheted, panties and swimwear)",23970.0
202510,502,United States,620469,"Women's or girls' trousers, bib and brace overalls, breeches and shorts of textile materials (excluding of wool, fine animal hair, cotton or synthetic fibres, knitted or crocheted, panties and swimwear)",39304.0
202510,502,United States,620520,"Men's or boys' shirts of cotton (excluding knitted or crocheted, nightshirts, singlets and other vests)",19795.0
202510,502,United States,620530,"Men's or boys' shirts of man-made fibres (excluding knitted or crocheted, nightshirts, singlets and other vests)",2373.0
202510,502,United States,620590,"Men's or boys' shirts of textile materials (excluding of cotton or man-made fibres, knitted or crocheted, nightshirts, singlets and other vests)",1473.0
202510,502,United States,620610,"Women's or girls' blouses, shirts and shirt-blouses of silk or silk waste (excluding knitted or crocheted and vests)",326.0
202510,502,United States,620630,"Women's or girls' blouses, shirts and shirt-blouses of cotton (excluding knitted or crocheted and vests)",5242.0
202510,502,United States,620640,"Women's or girls' blouses, shirts and shirt-blouses of man-made fibres (excluding knitted or crocheted and vests)",3647.0
202510,502,United States,620690,"Women's or girls' blouses, shirts and shirt-blouses of textile materials (excluding of silk, silk waste, wool, fine animal hair, cotton or man-made fibres, knitted or crocheted and vests)",756.0
202510,502,United States,620711,Men's or boys' underpants and briefs of cotton,2293.0
202510,502,United States,620719,Men's or boys' underpants and briefs of textile materials (excluding cotton and knitted or crocheted),21297.0
202510,502,United States,620721,"Men's or boys' nightshirts and pyjamas of cotton (excluding knitted or crocheted, vests, singlets and underpants)",546.0
202510,502,United States,620791,"Men's or boys' singlets and other vests, bathrobes, dressing gowns and similar articles of cotton (excluding knitted or crocheted, underpants, nightshirts and pyjamas)",4216.0
202510,502,United States,620811,Women's or girls' slips and petticoats of man-made fibres (excluding knitted or crocheted and vests),13.0
202510,502,United States,620821,"Women's or girls' nightdresses and pyjamas of cotton (excluding knitted or crocheted, vests and négligés)",3735.0
202510,502,United States,620822,"Women's or girls' nightdresses and pyjamas of man-made fibres (excluding knitted or crocheted, vests and négligés)",487.0
