Date of data,Trading partner code,Trading partner,Commodity code,Commodity,US dollar
202507,502,United States,830590,"Office articles such as letter clips, letter corners, paper clips and indexing tags, of base metal, incl. parts of articles of heading 8305 (excluding fittings for loose-leaf binders or files, staples in strips, drawing pins and clasps for books or registers)",10091.0
202507,502,United States,830621,"Statuettes and other ornaments, of base metal, plated with precious metal",858.0
202507,502,United States,830629,"Statuettes and other ornaments, of base metal, not plated with precious metal",55081.0
202507,502,United States,830630,"Photograph, picture or similar frames, of base metal; mirrors of base metal",4320.0
202507,502,United States,830710,"Flexible tubing of iron or steel, with or without fittings",1509710.0
202507,502,United States,830790,"Flexible tubing of base metal other than iron or steel, with or without fittings",588486.0
202507,502,United States,830810,"Hooks, eyes and eyelets, of base metal, of a kind used for clothing, footwear, awnings, handbags, travel goods or other made-up articles",112479.0
202507,502,United States,830820,"Tubular or bifurcated rivets, of base metal",1779767.0
202507,502,United States,830890,"Clasps, frames with clasps without locks, buckles and buckle-clasps, of base metal, for clothing, footwear, handbags, travel goods or other made-up articles, incl. parts of articles of heading 8308, of base metal (excluding hooks, eyes, eyelets and tubular or bifurcated rivets)",324711.0
202507,502,United States,830990,"Stoppers, caps and lids, incl. screw caps and pouring stoppers, capsules for bottles, threaded bungs, bung covers, seals and other packing accessories of base metal (excluding crow corks)",1155191.0
202507,502,United States,831000,"Signplates, nameplates, addressplates and similar plates, numbers, letters and other symbols, of base metal, excluding those of heading 9405",392114.0
202507,502,United States,831110,"Coated electrodes of base metal, for electric arc-welding",127751.0
202507,502,United States,831120,"Cored wire of base metal, for electric arc-welding",728703.0
202507,502,United States,831130,"Coated rods and cored wire, of base metal, for soldering, brazing or welding by flame (excluding wire and rods cored with solder which, excluding the flux material, contains ≥ 2% by weight of precious metal)",774526.0
202507,502,United States,831190,"Wire, rods, tubes, plates, electrodes and the like, of base metal or of metal carbides, coated or cored with flux material, for soldering, brazing, welding or deposition of metal or metal carbides, n.e.s., and wire and rods of agglomerated base metal powder, for metal spraying, n.e.s.",66200.0
202507,502,United States,840140,Parts of nuclear reactors,12323127.0
202507,502,United States,840390,"Parts of central heating boilers, n.e.s.",18815.0
202507,502,United States,840420,Condensers for steam or other vapour power units,58018.0
202507,502,United States,840510,"Producer gas or water gas generators, with or without their purifiers; acetylene gas generators and similar water process gas generators, with or without their purifiers",158064.0
202507,502,United States,840590,"Parts of producer gas or water gas generators and acetylene gas generators or similar water process gas generators, n.e.s.",11183.0
202507,502,United States,840690,"Parts of steam and other vapour turbines, n.e.s.",1120.0
202507,502,United States,840710,"Spark-ignition reciprocating or rotary internal combustion piston engine, for aircraft",192212.0
202507,502,United States,840721,Spark-ignition outboard motors for marine propulsion,4404502.0
202507,502,United States,840729,"Spark-ignition reciprocating or rotary engines, for marine propulsion (excluding outboard motors)",37524.0
202507,502,United States,840733,"Spark-ignition reciprocating piston engine, of a kind used for the propulsion of vehicles of chapter 87, Of a cylinder capacity exceeding 250 cc but not exceeding 1,000 cc",8405.0
202507,502,United States,840734,"Spark-ignition reciprocating piston engine, of a kind used for the propulsion of vehicles of chapter 87, Of a cylinder capacity exceeding 1,000 cc",88147.0
202507,502,United States,840790,Other engines,2791322.0
202507,502,United States,840810,Marine propulsion engines,1631880.0
202507,502,United States,840820,Engines of a kind used for the propulsion of vehicles of Chapter 87,550420.0
202507,502,United States,840890,Other engines,20913731.0
202507,502,United States,840910,"Parts suitable for use solely or principally with internal combustion piston engine for aircraft, n.e.s.",746402.0
202507,502,United States,840991,"Parts suitable for use solely or principally with spark-ignition internal combustion piston engine, n.e.s.",3416535.0
202507,502,United States,840999,"Parts suitable for use solely or principally with compression-ignition internal combustion piston engine diesel or semi-diesel engine"", n.e.s.""",13450575.0
202507,502,United States,841011,"Hydraulic turbines and water wheels, off a power not exceeding 1,000 kW",159.0
202507,502,United States,841112,Turbojets of a thrust exceeding 25 kN,253299449.0
202507,502,United States,841181,"Gas turbines of a power not exceeding 5,000 kW",11307615.0
202507,502,United States,841182,"Gas turbines of a power exceeding 5,000 kW",14752331.0
202507,502,United States,841191,"Parts of turbojets or turbopropellers, n.e.s.",431005040.0
202507,502,United States,841199,"Parts of gas turbines, n.e.s.",19817787.0
202507,502,United States,841221,"Hydraulic power engines and motors, linear acting (cylinders)",15342047.0
202507,502,United States,841229,"Hydraulic power engines and motors (excluding hydraulic turbines and water wheels of heading 8410, steam turbines and hydraulic power engines and motors, linear acting)",4032917.0
202507,502,United States,841231,"Pneumatic power engines and motors, linear acting (cylinders)",1648997.0
202507,502,United States,841239,Pneumatic power engines and motors (excluding linear acting),2861688.0
202507,502,United States,841280,"Engines and motors (excluding steam turbines, internal combustion piston engine, hydraulic turbines, water wheels, gas turbines, reaction engines, hydraulic power engines and motors, pneumatic power engines and motors and electric motors)",537407.0
202507,502,United States,841290,"Parts of non-electrical engines and motors, n.e.s.",2771388.0
202507,502,United States,841311,"Pumps for dispensing fuel or lubricants, of the type used in fillingstations or in garages",16650.0
202507,502,United States,841319,"Pumps for liquids, fitted or designed to be fitted with a measuring device (excluding pumps for dispensing fuel or lubricants, of the type used in filling stations or in garages)",1552506.0
202507,502,United States,841320,"Hand pumps, other than those of subheading 8413.11 or 8413.19",364008.0
202507,502,United States,841330,"Fuel, lubricating or cooling medium pumps for internal combustion piston engines",2559031.0
202507,502,United States,841350,Other reciprocating positive displacement pumps,13278591.0
202507,502,United States,841360,Other rotary positive displacement pumps,6527337.0
202507,502,United States,841370,Other centrifugal pumps,7884793.0
202507,502,United States,841381,"Pumps for liquids, power-driven (excluding those of subheading 8413.11 and 8413.19, fuel, lubricating or cooling medium pumps for internal combustion piston engine, concrete pumps, general reciprocating or rotary positive displacement pumps and centrifugal pumps of all kinds)",563064.0
202507,502,United States,841391,"Parts of pumps for liquids, n.e.s.",9481884.0
202507,502,United States,841410,Vacuum pumps,2796280.0
202507,502,United States,841420,Hand or footoperated air pumps,30100.0
202507,502,United States,841430,Compressors of a kind used in refrigerating equipment,2413496.0
202507,502,United States,841440,Air compressors mounted on a wheeled chassis for towing,803542.0
202507,502,United States,841451,"Table, floor, wall, window, ceiling or roof fans, with a selfcontained electric motor of an output not exceeding 125 W",409075.0
202507,502,United States,841459,"Fans (excluding table, floor, wall, window, ceiling or roof fans, with a self-contained electric motor of an output ≤ 125 W)",2175460.0
202507,502,United States,841460,Hoods having a maximum horizontal side not exceeding 120 cm,1641.0
202507,502,United States,841480,"Air pumps, air or other gas compressors and ventilating or recycling hoods incorporating a fan, whether or not fitted with filters, having a maximum horizontal side ＞ 120 cm (excluding vacuum pumps, hand- or foot-operated air pumps, compressors for refrigerating equipment and air compressors mounted on a wheeled chassis for towing)",24407275.0
202507,502,United States,841490,"Parts of: air or vacuum pumps, air or other gas compressors, fans and ventilating or recycling hoods incorporating a fan, n.e.s.",9390338.0
202507,502,United States,841510,"Air conditioning machines of a kind designed to be fixed to a window, wall, ceiling or floor, selfcontained or .splitsystem.",307079.0
202507,502,United States,841520,"Air conditioning machines of a kind used for persons, in motor vehicles",185700.0
202507,502,United States,841581,Air conditioning machines incorporating a refrigerating unit and a valve for reversal of the cooling/heat cycle (reversible heat pumps),167472.0
202507,502,United States,841582,"Other, air conditioning machines incorporating a refrigerating unit",675396.0
202507,502,United States,841583,"Air conditioning machines,not incorporating a refrigerating unit",732.0
202507,502,United States,841590,"Parts of air conditioning machines, comprising a motor-driven fan and elements for changing the temperature and humidity, n.e.s.",1566908.0
202507,502,United States,841610,Furnace burners for liquid fuel,33324.0
202507,502,United States,841620,"Other furnace burners, including combination burners",153234.0
202507,502,United States,841690,"Parts of furnace burners such as mechanical stokers, incl. their mechanical grates, mechanical ash dischargers and similar appliances, n.e.s.",292411.0
202507,502,United States,841780,"Industrial or laboratory furnaces and ovens, non-electric, incl. incinerators (excluding those for the roasting, melting or other heat treatment of ores, pyrites or metals, bakery ovens, drying ovens and ovens for cracking operations)",1464653.0
202507,502,United States,841790,"Parts of industrial or laboratory furnaces, non-electric, incl. incinerators, n.e.s.",42517.0
202507,502,United States,841810,"Combined refrigeratorfreezers, fitted with separate external doors or draws, or combinations thereof",3959.0
202507,502,United States,841821,"Household refrigerators, compression-type",12449.0
202507,502,United States,841830,"Freezers of the chest type, of a capacity ≤ 800L",86436.0
202507,502,United States,841840,"Freezers of the upright type, of a capacity ≤ 900L",156568.0
202507,502,United States,841850,"Furniture (chests, cabinets, display counters, show-cases and the like) for storage and display, incorporating refrigerating or freezing equipment (excluding combined refrigerator-freezers with separate external doors, household refrigerators and freezers of the chest type of a capacity ≤ 800L or of the upright type of a capacity ≤ 900L)",243360.0
202507,502,United States,841869,Refrigerating or freezing equipment (excluding refrigerating and freezing furniture),3406661.0
202507,502,United States,841891,Furniture designed to receive refrigerating or freezing equipment,14257.0
202507,502,United States,841899,"Parts of refrigerating or freezing equipment and heat pumps, n.e.s.",2615049.0
202507,502,United States,841933,"Lyophilisation apparatus, freeze drying units and spray dryers",124020.0
202507,502,United States,841934,Dryers for agricultural products,59257.0
202507,502,United States,841939,"Dryers (excluding dryers for agricultural products, for wood, paper pulp, paper or paperboard, for yarns, fabrics and other textile products, dryers for bottles or other containers, hairdryers, hand dryers and domestic appliances)",116485.0
202507,502,United States,841940,Distilling or rectifying plant,1362.0
202507,502,United States,841950,Heat exchange units,10271758.0
202507,502,United States,841960,Machinery for liquefying air or other gases,7855.0
202507,502,United States,841981,"Machinery, plant and equipment for making hot drinks or for cooking or heating food (excluding domestic appliances)",752840.0
202507,502,United States,841989,"Machinery, plant or laboratory equipment, whether or not electrically heated, for the treatment of materials by a process involving a change of temperature such as heating, cooking, roasting, sterilising, pasteurising, steaming, evaporating, vaporising, condensing or cooling, n.e.s. (excluding machinery used for domestic purposes and furnaces, ovens and other equipment of heading 8514)",3079409.0
202507,502,United States,841990,"Parts of machinery, plant and laboratory equipment, whether or not electrically heated, for the treatment of materials by a process involving a change of temperature, and of non-electric instantaneous and storage water heaters, n.e.s.",1214586.0
202507,502,United States,842010,Calendering or other rolling machines,37950.0
202507,502,United States,842099,"Parts for calendering or rolling machines, n.e.s. (other than for metals or glass and excluding cylinders)",497234.0
202507,502,United States,842112,Centrifugal clothes-dryers,600.0
202507,502,United States,842119,"Centrifuges, incl. centrifugal dryers (excluding isotope separators, cream separators and clothes dryers)",6518942.0
202507,502,United States,842121,Machinery and apparatus for filtering or purifying water,2638754.0
202507,502,United States,842123,Oil or petrol-filters for internal combustion engines,4808010.0
202507,502,United States,842129,"Machinery and apparatus for filtering or purifying liquids (excluding such machinery and apparatus for water and other beverages, oil or petrol-filters for internal combustion engines and artificial kidneys)",15281509.0
202507,502,United States,842131,Intake air filters for internal combustion engines,1443978.0
202507,502,United States,842132,"Catalytic converters or particulate filters, whether or not combined, for purifying or filtering exhaust gases from internal combustion engines",2815876.0
202507,502,United States,842139,Machinery and apparatus for filtering or purifying gases (excluding isotope separators and intake air filters for internal combustion engines),20074392.0
202507,502,United States,842191,"Parts of centrifuges, incl. centrifugal dryers, n.e.s.",579970.0
202507,502,United States,842199,"Parts of machinery and apparatus for filtering or purifying liquids or gases, n.e.s.",24319273.0
202507,502,United States,842219,Dishwashing machines (excluding those of the household type),1230.0
202507,502,United States,842220,Machinery for cleaning or drying bottles or other containers (excluding dishwashing machines),110.0
202507,502,United States,842230,"Machinery for filling, closing, sealing or labelling bottles, cans, boxes, bags or other containers; machinery for capsuling bottles, jars, tubes and similar containers; machinery for aerating beverages",62181.0
202507,502,United States,842240,"Packing or wrapping machinery, incl. heat-shrink wrapping machinery (excluding machinery for filling, closing, sealing or labelling bottles, cans, boxes, bags or other containers and machinery for capsuling bottles, jars, tubes and similar containers)",70141.0
202507,502,United States,842290,"Parts of dishwashing machines, packing or wrapping machinery and other machinery and apparatus of heading 8422, n.e.s.",597028.0
202507,502,United States,842310,"Personal weighing machines, incl. baby scales; household scales",1481.0
202507,502,United States,842320,Scales for continuous weighing of goods on conveyors,33573.0
202507,502,United States,842330,"Constant weight scales and scales for discharging a pre-determined weight of material into a bag or container, incl. hopper scales (excluding scales for continuous weighing of goods on conveyors)",579.0
202507,502,United States,842381,"Weighing machinery having a maximum weighing capacity ≤ 30 kg (excluding balances of a sensitivity of 5 cg or better, personal weighing machines, household scales, scales for continuous weighing of goods on conveyors, constant weight scales and scales for discharging a pre-determined weight of material into a bag or container, incl. hopper scales)",8501.0
202507,502,United States,842382,"Weighing machinery of a maximum weighing capacity ＞ 30 kg but ≤ 5.000 kg (excluding personal weighing machines, scales for continuous weighing of goods on conveyors, constant weight scales and scales for discharging a pre-determined weight of material into a bag or container, incl. hopper scales)",104603.0
202507,502,United States,842389,Weighing machinery of a maximum weighing capacity ＞ 5.000 kg,30690.0
202507,502,United States,842390,"Weighing machine weights of all kinds; parts of weighing machinery, n.e.s.",51976.0
202507,502,United States,842410,"Fire extinguishers, whether or not charged",1633895.0
202507,502,United States,842420,Spray guns and similar appliances,2249436.0
202507,502,United States,842430,Steam or sand blasting machines and similar jet projecting machines,146805.0
202507,502,United States,842441,"Agricultural or horticultural sprayers, portable",918.0
202507,502,United States,842449,Agricultural or horticultural sprayers (excl. portable),95709.0
202507,502,United States,842482,"Agricultural or horticultural mechanical appliances, whether or not hand-operated, for projecting or dispersing liquids or powders (excl. sprayers)",13291.0
202507,502,United States,842489,"Mechanical appliances, whether or not hand-operated, for projecting, dispersing or spraying liquids or powders, n.e.s.",5537344.0
202507,502,United States,842490,"Parts of fire extinguishers, spray guns and similar appliances, steam or sand blasting machines and similar jet projecting machines and machinery and apparatus for projecting, dispersing or spraying liquids or powders, n.e.s.",10793155.0
202507,502,United States,842511,"Pulley tackle and hoists, powered by electric motor (other than skip hoists or hoists of a kind used for raising vehicles)",27473.0
202507,502,United States,842519,"Pulley tackle and hoists (other than skip hoists or hoists of a kind used for raising vehicles), non-powered by electric motor",50722.0
202507,502,United States,842531,Winches and capstans powered by electric motor,254808.0
202507,502,United States,842539,"Winches and capstans, non-powered by electric motor",214745.0
202507,502,United States,842542,"Jacks and hoists, hydraulic (excluding built-in jacking systems used in garages)",313.0
202507,502,United States,842549,"Jacks and hoists of a kind used for raising vehicles, not hydraulic",45874.0
202507,502,United States,842699,"Ships' derricks; cranes, incl. cable cranes (excluding overhead travelling cranes, transporter cranes, gantry cranes, portal or pedestal jib cranes, bridge cranes, mobile lifting frames and straddle carriers, tower cranes, works trucks fitted with a crane, mobile cranes and cranes designed for mounting on road vehicles)",3657.0
202507,502,United States,842710,Selfpropelled trucks powered by an electric motor,447288.0
202507,502,United States,842790,"Works trucks fitted with lifting or handling equipment, not self-propelled",1169218.0
202507,502,United States,842810,Lifts and skip hoists,31550.0
202507,502,United States,842820,Pneumatic elevators and conveyors,466027.0
202507,502,United States,842833,"Continuous-action elevators and conveyors, for goods or materials, belt type",19406.0
202507,502,United States,842839,"Continuous-action elevators and conveyors, for goods or materials (excluding those for underground use and bucket, belt or pneumatic types)",2781151.0
202507,502,United States,842890,"Machinery for lifting, handling, loading or unloading, nes",6620816.0
202507,502,United States,842951,Frontend shovel loaders,326270.0
202507,502,United States,843020,Snowploughs and snowblowers,716.0
202507,502,United States,843041,"Other, self-propelled boring or sinking machinery for boring earth or extracting minerals or ores",6341.0
202507,502,United States,843049,"Other, boring or sinking machinery for boring earth or extracting minerals or ores, not self-propelled and not hydraulic",8298.0
202507,502,United States,843069,"Earth moving machinery, not self-propelled, n.e.s.",56010.0
202507,502,United States,843110,Part of machinery of heading 84.25,127473.0
202507,502,United States,843120,Part of machinery of heading 84.27,283002.0
202507,502,United States,843131,"Part off lifts, skip hoists or escalators, of heading 84.28",314088.0
202507,502,United States,843139,"Parts of machinery of heading 8428, n.e.s.",3798049.0
202507,502,United States,843143,Parts for boring or sinking machinery of subheading 8430.41 or,1375040.0
202507,502,United States,843149,"Parts of machinery of heading 8426, 8429 and 8430, n.e.s.",4822751.0
202507,502,United States,843210,Ploughs,37733.0
202507,502,United States,843229,"Harrows, scarifiers, cultivators, weeders and hoes for use in agriculture, horticulture or forestry (excluding disc harrows)",137555.0
202507,502,United States,843280,"Agricultural, horticultural or forestry machinery for soil preparation or cultivation; lawn or sports-ground rollers (excluding sprayers and dusters, ploughs, harrows, scarifiers, cultivators, weeders, hoes, seeders, planters, manure spreaders and fertiliser distributors)",128002.0
202507,502,United States,843290,"Parts of agricultural, horticultural or forestry machinery for soil preparation or cultivation or of lawn or sports-ground rollers, n.e.s.",324263.0
202507,502,United States,843311,"Powered, with the cutting device rotating in a horizontal plane",1374450.0
202507,502,United States,843319,"Mowers for lawns, parks or sports grounds, powered, with the cutting device rotating in a vertical plane or with cutter bars",688.0
202507,502,United States,843320,"Other mowers, including cutter bars for tractor mounting",199.0
202507,502,United States,843340,"Straw or fodder balers, including pickup balers",55137.0
202507,502,United States,843351,Combine harvester-threshers,1603286.0
202507,502,United States,843359,"Harvesting machinery for agricultural produce (excluding mowers, haymaking machinery, straw and fodder balers, incl. pick-up balers, combine harvester-threshers, other threshing machinery and root or tuber harvesting machines)",4122627.0
202507,502,United States,843360,"Machines for cleaning, sorting or grading eggs, fruit or other agricultural produce",162621.0
202507,502,United States,843390,"Parts of harvesting machinery, threshing machinery, mowers and machines for cleaning, sorting or grading agricultural produce, n.e.s.",2352656.0
202507,502,United States,843490,"Parts of milking machines and dairy machinery, n.e.s.",36012.0
202507,502,United States,843510,"Presses, crushers and similar machinery used in the manufacture of wine, cider, fruit juices or similar beverages (excluding machinery for the treatment of these beverages, incl. centrifuges, filter presses, other filtering equipment and domestic appliances)",98.0
202507,502,United States,843590,"Parts of presses, crushers and similar machinery used in the manufacture of wine, cider, fruit juices or similar beverages, n.e.s.",5449.0
202507,502,United States,843691,"Parts of poultry-keeping machinery or poultry incubators and brooders, n.e.s.",36965.0
202507,502,United States,843699,"Parts of agricultural, horticultural, forestry or bee-keeping machinery of heading 84.36, n.e.s.",80214.0
202507,502,United States,843710,"Machines for cleaning, sorting or grading seed, grain or dried leguminous vegetables",113863.0
202507,502,United States,843780,"Machinery used in the milling industry or for the working of cereals or dried leguminous vegetables (excluding farm-type machinery, heat treatment equipment, centrifugal dryers, air filters and machines for cleaning, sorting or grading seed, grain or dried leguminous vegetables)",193849.0
202507,502,United States,843790,"Parts of machinery used in the milling industry or for the working of cereals or dried leguminous vegetables or machines for cleaning, sorting or grading seed, grain or dried leguminous vegetables, n.e.s.",39554.0
202507,502,United States,843850,Machinery for the preparation of meat or poultry,217079.0
202507,502,United States,843860,"Machinery for the preparation of fruits, nuts or vegetables",253000.0
202507,502,United States,843880,"Machinery for the industrial preparation or manufacture of food or drink, nes",4662017.0
202507,502,United States,843890,"Parts of machinery for the industrial preparation or manufacture of food or drink, nes",778521.0
202507,502,United States,843930,Machinery for finishing paper or paperboard,25066.0
202507,502,United States,843991,"Parts of machinery for making pulp of fibrous cellulosic material, n.e.s.",1361041.0
202507,502,United States,843999,"Parts of machinery for making or finishing paper or paperboard, n.e.s.",63122.0
202507,502,United States,844090,"Parts of bookbinding machinery, n.e.s.",40.0
202507,502,United States,844110,Cutting machines,849.0
202507,502,United States,844190,"Parts of machinery for making up paper pulp, paper or paperboard, n.e.s.",149501.0
202507,502,United States,844230,"Machinery, apparatus and equipment",16865.0
202507,502,United States,844240,"Parts of the foregoing machinery, apparatus or equipment",1904.0
202507,502,United States,844250,"Plates, cylinders and other printing components; plates, cylinders and lithographic stones, prepared for printing purposes (for example, planed, grained or polished)",65651.0
