Date of data,Trading partner code,Trading partner,Commodity code,Commodity,US dollar
202507,502,United States,580429,"Mechanically made lace in the piece, in strips or in motifs (excluding that of man-made fibres and fabrics of heading 6002 to 6006)",318.0
202507,502,United States,580610,Woven pile fabrics (including terry towelling and similar terry fabrics) and chenille fabrics,153797.0
202507,502,United States,580620,"Other woven fabrics, containing by weight 5% or more of elastomeric yarn or rubber thread",54414.0
202507,502,United States,580631,"Narrow woven fabrics of cotton, with a width of ≤ 30 cm, n.e.s.",1116.0
202507,502,United States,580632,"Narrow woven fabrics of man-made fibres, with a width of ≤ 30 cm, n.e.s.",283546.0
202507,502,United States,580639,"Narrow woven fabrics of textile materials other than cotton or man-made fibres, with a width of ≤ 30 cm, n.e.s.",5369.0
202507,502,United States,580710,"Labels, badges and similar articles, of textile materials, in the piece, in strips or cut to shape or size, woven, not embroidered",123121.0
202507,502,United States,580790,"Labels, badges and similar articles, of textile materials, in the piece, in strips or cut to shape or size, not embroidered (excluding woven)",44810.0
202507,502,United States,580810,Braids in the piece,3226.0
202507,502,United States,580890,"Ornamental trimmings of textile materials, in the piece, not embroidered, other than knitted or crocheted; tassels, pompons and similar articles of textile materials (excluding braids in the piece)",8642.0
202507,502,United States,581010,Embroidery without visible ground,138.0
202507,502,United States,581091,"Embroidery of cotton on a textile fabric ground, in the piece, in strips or in motifs (excluding embroidery without visible ground)",181.0
202507,502,United States,581092,"Embroidery of man-made fibres on a textile fabric base, in the piece, in strips or in motifs (excluding embroidery without visible ground)",6666.0
202507,502,United States,581100,"Quilted textile products in the piece, composed of one or more layers of textile materials assembled with padding by stitching or otherwise (excluding embroidery of heading 5810 and quilted fabrics for bedding and furnishings)",4589.0
202507,502,United States,590190,Tracing cloth; prepared painting canvas; buckram and similar stiffened textile fabrics of a kind used for hat foundations (excluding plastic-coated textile fabrics),170.0
202507,502,United States,590210,"Tyre cord fabric of high-tenacity yarn of nylon or other polyamides, whether or not dipped or impregnated with rubber or plastic",585.0
202507,502,United States,590310,"Textile fabrics impregnated, coated, covered or laminated with polyvinyl chloride"" (excluding wallcoverings of textile materials impregnated or covered with poly""vinyl chloride""; floor coverings consisting of a textile backing and a top layer or covering of poly""vinyl chloride"")""",219057.0
202507,502,United States,590320,"Textile fabrics impregnated, coated, covered or laminated with polyurethane (excluding wallcoverings of textile materials impregnated or covered with polyurethane; floor coverings consisting of a textile backing and a top layer or covering of polyurethane)",159469.0
202507,502,United States,590390,"Textile fabrics impregnated, coated, covered or laminated with plastics other than polyvinyl chloride"" or polyurethane (excluding tyre cord fabric of high-tenacity yarn of nylon or other polyamides, polyesters or viscose rayon; wallcoverings of textile materials impregnated or covered with plastic; floor coverings consisting of a textile backing and a top layer or covering of plastics)""",356383.0
202507,502,United States,590500,Textile wall coverings.,5092.0
202507,502,United States,590610,Adhesive tape of a width not exceeding 20 cm,7485.0
202507,502,United States,590691,"Knitted or crocheted textile fabrics, rubberised, n.e.s.",14232.0
202507,502,United States,590699,"Rubberised textile fabrics (excluding knitted or crocheted textile fabrics, adhesive tape of a width of ≤ 20 cm, and tyre cord fabric of high-tenacity yarn of nylon or other polyamides, polyesters or viscose rayon)",285345.0
202507,502,United States,590700,"Impregnated, coated or covered textile fabrics; painted canvas being theatrical scenery, studio backcloths or the like, n.e.s.",367286.0
202507,502,United States,590800,"Textile wicks, woven, plaited or knitted, for lamps, stoves, lighters, candles or the like; incandescent gas mantles and tubular knitted gas-mantle fabric for incandescent gas mantles, whether or not impregnated",29197.0
202507,502,United States,590900,"Textile hosepiping and similar textile tubing, whether or not impregnated or coated, with or without lining, armour or accessories of other materials",45848.0
202507,502,United States,591000,"Transmission or conveyor belts or belting, of textile material, whether or not impregnated, coated, covered or laminated with plastics, or reinforced with metal or other material.",389380.0
202507,502,United States,591110,"Textile fabrics, felt and felt-lined woven fabrics, coated, covered or laminated with rubber, leather or other material, of a kind used for card clothing, and similar fabrics of a kind used for other technical purposes, incl. narrow fabrics made of velvet impregnated with rubber, for covering weaving spindles weaving beams""""",48040.0
202507,502,United States,591120,"Bolting cloth, whether or not made up",50080.0
202507,502,United States,591140,"Filtering or straining cloth of a kind used in oil-presses or for similar technical purposes, incl. that of human hair",241751.0
202507,502,United States,591190,"Textile products and articles, for technical purposes, specified in Note 7 to chapter 59, n.e.s.",2217049.0
202507,502,United States,600110,"Long pile fabrics, knitted or crocheted",7529.0
202507,502,United States,600121,"Looped pile fabrics of cotton, knitted or crocheted",85.0
202507,502,United States,600122,"Looped pile fabrics of man-made fibres, knitted or crocheted",234256.0
202507,502,United States,600192,"Pile fabrics of man-made fibres, knitted or crocheted (excluding long pile"" fabrics)""",180086.0
202507,502,United States,600199,"Pile fabrics, knitted or crocheted (excluding cotton or man-made fibres and long pile"" fabrics)""",41038.0
202507,502,United States,600240,"Knitted or crocheted fabrics, of a width of ≤ 30 cm, containing ≥ 5% by weight elastomeric yarn",1883.0
202507,502,United States,600290,"Knitted or crocheted fabrics, of a width of ≤ 30 cm, containing ≥ 5% by weight elastomeric yarn and rubber thread or rubber thread only",131.0
202507,502,United States,600310,"Knitted or crocheted fabrics of wool or fine animal hair, of a width of ≤ 30 cm",173.0
202507,502,United States,600320,"Knitted or crocheted fabrics of cotton, of a width of ≤ 30 cm",1176.0
202507,502,United States,600330,"Knitted or crocheted fabrics of synthetic fibres, of a width of ≤ 30 cm",4478.0
202507,502,United States,600410,"Knitted or crocheted fabrics, of a width of ＞ 30 cm, containing ≥ 5% by weight elastomeric yarn",19237.0
202507,502,United States,600536,"Unbleached or bleached warp knit fabrics of synthetic fibres incl. those made on galloon knitting machines"", of a width of ＞ 30 cm""",82132.0
202507,502,United States,600537,"Dyed warp knit fabrics of synthetic fibres incl. those made on galloon knitting machines"", of a width of ＞ 30 cm""",210554.0
202507,502,United States,600621,"Unbleached or bleached cotton fabrics, knitted or crocheted, of a width of ＞ 30 cm",362.0
202507,502,United States,600622,"Dyed cotton fabrics, knitted or crocheted, of a width of ＞ 30 cm",1780.0
202507,502,United States,600623,"Cotton fabrics, knitted or crocheted, of yarns of different colours, of a width of ＞ 30 cm",1886.0
202507,502,United States,600624,"Printed cotton fabrics, knitted or crocheted, of a width of ＞ 30 cm",821.0
202507,502,United States,600631,"Unbleached or bleached fabrics, knitted or crocheted, of synthetic fibres, of a width of ＞ 30 cm",1479.0
202507,502,United States,600632,"Dyed fabrics, knitted or crocheted, of synthetic fibres, of a width of ＞ 30 cm",27575.0
202507,502,United States,600633,"Fabrics, knitted or crocheted, of synthetic fibres, of yarns of different colours, of a width of ＞ 30 cm",4925.0
202507,502,United States,600634,"Printed fabrics, knitted or crocheted, of synthetic fibres, of a width of ＞ 30 cm",662.0
202507,502,United States,600642,"Dyed fabrics, knitted or crocheted, of artificial fibres, of a width of ＞ 30 cm",164.0
202507,502,United States,600643,"Fabrics, knitted or crocheted, of artificial fibres, of yarns of different colours, of a width of ＞ 30 cm",2406.0
202507,502,United States,600690,"Fabrics, knitted or crocheted, of a width of ＞ 30 cm",309.0
202507,502,United States,610120,"Overcoats, car coats, capes, cloaks, anoraks, incl. ski jackets, windcheaters, wind-jackets and similar articles of cotton, for men or boys, knitted or crocheted",3179.0
202507,502,United States,610130,"Overcoats, car coats, capes, cloaks, anoraks, incl. ski jackets, windcheaters, wind-jackets and similar articles of man-made fibres, for men or boys, knitted or crocheted",9159.0
202507,502,United States,610190,"Overcoats, car coats, capes, cloaks, anoraks, incl. ski jackets, windcheaters, wind-jackets and similar articles of textile materials, for men or boys, knitted or crocheted",114.0
202507,502,United States,610220,"Women's or girls' overcoats, car coats, capes, cloaks, anoraks, incl. ski jackets, windcheaters, wind-jackets and similar articles of cotton, knitted or crocheted",554.0
202507,502,United States,610230,"Women's or girls' overcoats, car coats, capes, cloaks, anoraks, incl. ski jackets, windcheaters, wind-jackets and similar articles of man-made fibres, knitted or crocheted",4635.0
202507,502,United States,610310,"Men's or boys' suits of textile materials, knitted or crocheted",238.0
202507,502,United States,610323,"Men's or boys' ensembles of synthetic fibres, knitted or crocheted",75.0
202507,502,United States,610332,"Men's or boys' jackets and blazers of cotton, knitted or crocheted",78384.0
202507,502,United States,610333,"Men's or boys' jackets and blazers of synthetic fibres, knitted or crocheted",1048.0
202507,502,United States,610339,Men's or boys' jackets and blazers of textile materials,306.0
202507,502,United States,610342,"Men's or boys' trousers, bib and brace overalls, breeches and shorts of cotton, knitted or crocheted",184716.0
202507,502,United States,610343,"Men's or boys' trousers, bib and brace overalls, breeches and shorts of synthetic fibres, knitted or crocheted",16265.0
202507,502,United States,610349,"Men's or boys' trousers, bib and brace overalls, breeches and shorts of textile materials, knitted or crocheted",872.0
202507,502,United States,610423,"Women's or girls' ensembles of synthetic fibres, knitted or crocheted",152.0
202507,502,United States,610429,Women's or girls' ensembles of textile materials,44.0
202507,502,United States,610432,"Women's or girls' jackets and blazers of cotton, knitted or crocheted",946.0
202507,502,United States,610433,"Women's or girls' jackets and blazers of synthetic fibres, knitted or crocheted",1519.0
202507,502,United States,610439,"Women's or girls' jackets and blazers of textile materials, knitted or crocheted",45.0
202507,502,United States,610441,"Women's or girls' dresses of wool or fine animal hair, knitted or crocheted",2271.0
202507,502,United States,610442,"Women's or girls' dresses of cotton, knitted or crocheted",93138.0
202507,502,United States,610443,"Women's or girls' dresses of synthetic fibres, knitted or crocheted",184850.0
202507,502,United States,610444,"Women's or girls' dresses of artificial fibres, knitted or crocheted",12764.0
202507,502,United States,610449,"Women's or girls' dresses of textile materials, knitted or crocheted",43574.0
202507,502,United States,610452,"Women's or girls' skirts and divided skirts of cotton, knitted or crocheted",17746.0
202507,502,United States,610453,"Women's or girls' skirts and divided skirts of synthetic fibres, knitted or crocheted",1189.0
202507,502,United States,610459,"Women's or girls' skirts and divided skirts of textile materials, knitted or crocheted",1170.0
202507,502,United States,610462,"Women's or girls' trousers, bib and brace overalls, breeches and shorts of cotton, knitted or crocheted",29394.0
202507,502,United States,610463,"Women's or girls' trousers, bib and brace overalls, breeches and shorts of synthetic fibres, knitted or crocheted",40402.0
202507,502,United States,610469,"Women's or girls' trousers, bib and brace overalls, breeches and shorts of textile materials, knitted or crocheted",385.0
202507,502,United States,610510,"Men's or boys' shirts of cotton, knitted or crocheted (excluding nightshirts, T-shirts, singlets and other vests)",55594.0
202507,502,United States,610520,"Men's or boys' shirts of man-made fibres, knitted or crocheted (excluding nightshirts, T-shirts, singlets and other vests)",28725.0
202507,502,United States,610590,"Men's or boys' shirts of textile materials, knitted or crocheted (excluding of cotton or man-made fibres, nightshirts, T-shirts, singlets and other vests)",923.0
202507,502,United States,610610,"Women's or girls' blouses, shirts and shirt-blouses of cotton, knitted or crocheted (excluding T-shirts and vests)",54714.0
202507,502,United States,610620,"Women's or girls' blouses, shirts and shirt-blouses of man-made fibres, knitted or crocheted (excluding T-shirts and vests)",55173.0
202507,502,United States,610690,"Women's or girls' blouses, shirts and shirt-blouses of textile materials, knitted or crocheted (excluding of cotton or man-made fibres, T-shirts and vests)",7942.0
202507,502,United States,610711,"Men's or boys' underpants and briefs of cotton, knitted or crocheted",1797.0
202507,502,United States,610712,"Men's or boys' underpants and briefs of man-made fibres, knitted or crocheted",771.0
202507,502,United States,610721,"Men's or boys' nightshirts and pyjamas of cotton, knitted or crocheted (excluding vests and singlets)",108.0
202507,502,United States,610722,"Men's or boys' nightshirts and pyjamas of man-made fibres, knitted or crocheted (excluding vests and singlets)",3846.0
202507,502,United States,610791,"Men's or boys' bathrobes, dressing gowns and similar articles of cotton, knitted or crocheted",154.0
202507,502,United States,610799,"Men's or boys' bathrobes, dressing gowns and similar articles of textile materials, knitted or crocheted (excluding of cotton)",110.0
202507,502,United States,610821,"Women's or girls' briefs and panties of cotton, knitted or crocheted",1027.0
202507,502,United States,610822,"Women's or girls' briefs and panties of man-made fibres, knitted or crocheted",524.0
202507,502,United States,610829,"Women's or girls' briefs and panties of textile materials, knitted or crocheted (excluding cotton or man-made fibres)",98.0
202507,502,United States,610831,"Women's or girls' nightdresses and pyjamas of cotton, knitted or crocheted (excluding T-shirts, vests and négligés)",8062.0
202507,502,United States,610832,"Women's or girls' nightdresses and pyjamas of man-made fibres, knitted or crocheted (excluding T-shirts, vests and négligés)",3309.0
202507,502,United States,610839,"Women's or girls' nightdresses and pyjamas of textile materials, knitted or crocheted (excluding of cotton and man-made fibres, T-shirts, vests and négligés)",176.0
202507,502,United States,610891,"Women's or girls' négligés, bathrobes, dressing gowns, housejackets and similar articles of cotton, knitted or crocheted (excluding vests, slips, petticoats, briefs and panties, nightdresses, pyjamas, brassiéres, girdles, corsets and similar articles)",683.0
202507,502,United States,610892,"Women's or girls' négligés, bathrobes, dressing gowns, housejackets and similar articles of man-made fibres, knitted or crocheted (excluding vests, slips, petticoats, briefs and panties, nightdresses, pyjamas, brassiéres, girdles, corsets and similar articles)",1413.0
202507,502,United States,610910,"T-shirts, singlets and other vests of cotton, knitted or crocheted",172184.0
202507,502,United States,610990,"T-shirts, singlets and other vests of textile materials, knitted or crocheted (excluding cotton)",103232.0
202507,502,United States,611011,"Jerseys, pullovers, cardigans, waistcoats and similar articles, of hair of Kashmir cashmere"" goats, knitted or crocheted (excluding quilted articles)""",5015.0
202507,502,United States,611012,"Jerseys, pullovers, cardigans, waistcoats and similar articles, of fine animal hair, knitted or crocheted (excluding from hair of Kashmir cashmere"" goats and quilted articles)""",53329.0
202507,502,United States,611019,"Jerseys, pullovers, cardigans, waistcoats and similar articles, of cotton, knitted or crocheted (excluding wadded waistcoats)",2455.0
202507,502,United States,611020,"Jerseys, pullovers, cardigans, waistcoats and similar articles, of man-made fibres, knitted or crocheted (excluding wadded waistcoats)",287825.0
202507,502,United States,611030,"Jerseys, pullovers, cardigans, waistcoats and similar articles, of textile materials, knitted or crocheted (excluding of wool, fine animal hair, cotton or man-made fibres, and wadded waistcoats)",35496.0
202507,502,United States,611090,"bies' garments and clothing accessories, knitted or crocheted (excluding hats)",8230.0
202507,502,United States,611120,"Babies' garments and clothing accessories of cotton, knitted or crocheted (excluding hats)",1497.0
202507,502,United States,611130,"Babies' garments and clothing accessories of synthetic fibres, knitted or crocheted (excluding hats)",63.0
202507,502,United States,611212,"Track-suits of synthetic fibres, knitted or crocheted",79.0
202507,502,United States,611231,"Men's or boys' swimwear of synthetic fibres, knitted or crocheted",378.0
202507,502,United States,611241,"Women's or girls' swimwear of synthetic fibres, knitted or crocheted",19146.0
202507,502,United States,611300,"Garments, knitted or crocheted, rubberised or impregnated, coated or covered with plastics or other materials (excluding babies' garments and clothing accessories)",283.0
202507,502,United States,611420,"Other garments of cotton, knitted or crocheted",9244.0
202507,502,United States,611430,"Other garments of man-made fibres, knitted or crocheted",123082.0
202507,502,United States,611510,"Graduated compression hosiery [e.g., stockings for varicose veins], of textile materials, knitted or crocheted (excluding hosiery for babies)",492.0
202507,502,United States,611521,"Pantyhose and tights of synthetic fibres, knitted or crocheted, measuring per single yarn ＜ 67 decitex (excluding graduated compression hosiery)",201.0
202507,502,United States,611522,"Pantyhose and tights of synthetic fibres, knitted or crocheted, measuring per single yarn ≥ 67 decitex (excluding graduated compression hosiery)",256.0
202507,502,United States,611529,"Pantyhose and tights of textile materials, knitted or crocheted (excluding graduated compression hosiery, those of synthetic fibres and hosiery for babies)",182.0
202507,502,United States,611530,"Women's full-length or knee-length hosiery, knitted or crocheted, measuring per single yarn ＜ 67 decitex (excluding graduated compression hosiery, pantyhose and tights)",362.0
202507,502,United States,611594,"Full-length or knee-length stockings, socks and other hosiery, incl. footwear without applied soles, of wool or fine animal hair, knitted or crocheted (excluding graduated compression hosiery, pantyhose and tights, women's full-length or knee-length stockings, measuring per single yarn ＜ 67 decitex, and hosiery for babies)",190947.0
202507,502,United States,611595,"Full-length or knee-length stockings, socks and other hosiery, incl. footwear without applied soles, of cotton, knitted or crocheted (excluding graduated compression hosiery, pantyhose and tights, women's full-length or knee-length stockings, measuring per single yarn ＜ 67 decitex, and hosiery for babies)",3938.0
202507,502,United States,611596,"Full-length or knee-length stockings, socks and other hosiery, incl. footwear without applied soles, of synthetic fibres, knitted or crocheted (excluding graduated compression hosiery, pantyhose and tights, women's full-length or knee-length stockings, measuring per single yarn ＜ 67 decitex, and hosiery for babies)",13638.0
202507,502,United States,611599,"Full-length or knee-length stockings, socks and other hosiery, incl. footwear without applied soles, of textile materials, knitted or crocheted (excluding of wool, fine animal hair, cotton or synthetic fibres, graduated compression hosiery, pantyhose and tights, women's full-length or knee-length stockings, measuring per single yarn ＜ 67 decitex, and hosiery for babies)",184.0
202507,502,United States,611610,"Impregnated, coated, covered or laminated with plastics or rubber",366.0
202507,502,United States,611691,"Gloves, mittens and mitts, of wool or fine animal hair, knitted or crocheted (excluding for babies)",40.0
202507,502,United States,611692,"Gloves, mittens and mitts, of cotton, knitted or crocheted (excluding impregnated, coated or covered with plastics or rubber, and for babies)",171.0
202507,502,United States,611693,"Gloves, mittens and mitts, of synthetic fibres, knitted or crocheted (excluding impregnated, coated or covered with plastics or rubber, and for babies)",11083.0
202507,502,United States,611699,"Gloves, mittens and mitts, of textile materials, knitted or crocheted (excluding of wool, fine animal hair, cotton or synthetic fibres, impregnated, coated or covered with plastics or rubber, and for babies)",145.0
202507,502,United States,611710,"Shawls, scarves, mufflers, mantillas, veils and the like, knitted or crocheted",3259.0
202507,502,United States,611780,"Ties, bow ties, cravats and other made-up clothing accessories, knitted or crocheted, n.e.s. (excluding shawls, scarves, mufflers, mantillas, veils and the like)",27826.0
202507,502,United States,611790,"Parts of garments or clothing accessories, knitted or crocheted, n.e.s.",1551.0
202507,502,United States,620120,"Men’s or boys’ overcoats, car-coats, capes, cloaks, anoraks (including ski-jackets), wind-cheaters, windjackets and similar artic,of wool or fine animal hair",4966.0
202507,502,United States,620130,"Men’s or boys’ overcoats, car-coats, capes, cloaks, anoraks (including ski-jackets), wind-cheaters, windjackets and similar artic,of cotton",99412.0
202507,502,United States,620140,"Men’s or boys’ overcoats, car-coats, capes, cloaks, anoraks (including ski-jackets), wind-cheaters, windjackets and similar artic,of man-made fibres",26716.0
202507,502,United States,620190,"Men's or boys' overcoats, raincoats, car coats, capes, cloaks and similar articles, of  other textile materials",1327.0
202507,502,United States,620220,"Women’s or girls’ overcoats, car-coats, capes, cloaks, anoraks (including ski-jackets), wind-cheaters, wind jackets and similar articles, of wool or fine animal hair",147.0
202507,502,United States,620230,"Women’s or girls’ overcoats, car-coats, capes, cloaks, anoraks (including ski-jackets), wind-cheaters, wind jackets and similar articles, of cotton",2491.0
202507,502,United States,620240,"Women’s or girls’ overcoats, car-coats, capes, cloaks, anoraks (including ski-jackets), wind-cheaters, wind jackets and similar articles,of man-made fibres",13021.0
202507,502,United States,620290,"Women’s or girls’ overcoats, car-coats, capes, cloaks, anoraks (including ski-jackets), wind-cheaters, wind jackets and similar articles, of other textile materials",985.0
202507,502,United States,620311,"Men's or boys' suits of wool or fine animal hair (excluding knitted or crocheted, tracksuits, ski suits and swimwear)",113.0
202507,502,United States,620312,"Men's or boys' suits of synthetic fibres (excluding knitted or crocheted, tracksuits, ski suits and swimwear)",366.0
202507,502,United States,620322,"Men's or boys' ensembles of cotton (excluding knitted or crocheted, ski ensembles and swimwear)",257.0
202507,502,United States,620323,"Men's or boys' ensembles of synthetic fibres (excluding knitted or crocheted, ski ensembles and swimwear)",1000.0
202507,502,United States,620331,"Men's or boys' jackets and blazers of wool or fine animal hair (excluding knitted or crocheted, and wind-jackets and similar articles)",6321.0
202507,502,United States,620332,"Men's or boys' jackets and blazers of cotton (excluding knitted or crocheted, and wind-jackets and similar articles)",16024.0
202507,502,United States,620333,"Men's or boys' jackets and blazers of synthetic fibres (excluding knitted or crocheted, and wind-jackets and similar articles)",4742.0
202507,502,United States,620339,"Men's or boys' jackets and blazers of textile materials (excluding of wool, fine animal hair, cotton or synthetic fibres, knitted or crocheted, and wind-jackets and similar articles)",9451.0
202507,502,United States,620341,"Men's or boys' trousers, bib and brace overalls, breeches and shorts, of wool or fine animal hair (excluding knitted or crocheted, underpants and swimwear)",1053.0
202507,502,United States,620342,"Men's or boys' trousers, bib and brace overalls, breeches and shorts, of cotton (excluding knitted or crocheted, underpants and swimwear)",160618.0
202507,502,United States,620343,"Men's or boys' trousers, bib and brace overalls, breeches and shorts of synthetic fibres (excluding knitted or crocheted, underpants and swimwear)",18307.0
202507,502,United States,620349,"Men's or boys' trousers, bib and brace overalls, breeches and shorts of textile materials (excluding of wool, fine animal hair, cotton or synthetic fibres, knitted or crocheted, underpants and swimwear)",1557.0
