Date of data,Trading partner code,Trading partner,Commodity code,Commodity,US dollar
201902,502,United States,570500,"Other carpets and other textile floor coverings, whether or not made up.",154456
201902,502,United States,580122,"Cut corduroy, of cotton (excluding terry towelling and similar woven terry fabrics, tufted textile fabrics and narrow woven fabrics of heading 5806)",3565
201902,502,United States,580126,"Chenille fabrics, of cotton (excluding terry towelling and similar woven terry fabrics, tufted textile fabrics and narrow woven fabrics of heading 5806)",1205
201902,502,United States,580127,"Warp pile fabrics, of cotton (excluding terry towelling and similar woven terry fabrics, tufted textile fabrics and narrow woven fabrics of heading 5806)",316288
201902,502,United States,580133,"Cut weft pile fabrics, of man-made fibres (excluding terry towelling and similar woven terry fabrics, tufted textile fabrics and narrow woven fabrics of heading 5806)",738
201902,502,United States,580136,"Chenille fabrics, of man-made fibres (excluding terry towelling and similar woven terry fabrics, tufted textile fabrics and narrow woven fabrics of heading 5806)",4171
201902,502,United States,580137,"Warp pile fabrics, of man-made fibres (excluding terry towelling and similar woven terry fabrics, tufted textile fabrics and narrow woven fabrics of heading 5806)",29229
201902,502,United States,580190,"Woven pile fabrics and chenille fabrics (excluding those of man-made fibres, wool or fine animal hair, terry towelling and similar woven terry fabrics, tufted textile fabrics and narrow woven fabrics of heading 5806)",2884
201902,502,United States,580219,"Terry towelling and similar woven terry fabrics, of cotton (excluding unbleached, narrow woven fabrics of heading 5806, carpets and other floor coverings)",1381
201902,502,United States,580230,Tufted textile fabrics,530
201902,502,United States,580410,Tulles and other net fabrics,30734
201902,502,United States,580421,"Mechanically made lace of man-made fibres in the piece, in strips or in motifs (excluding fabrics of heading 6002 to 6006)",3731
201902,502,United States,580610,Woven pile fabrics (including terry towelling and similar terry fabrics) and chenille fabrics,319940
201902,502,United States,580620,"Other woven fabrics, containing by weight 5% or more of elastomeric yarn or rubber thread",16921
201902,502,United States,580631,"Narrow woven fabrics of cotton, with a width of ≤ 30 cm, n.e.s.",703
201902,502,United States,580632,"Narrow woven fabrics of man-made fibres, with a width of ≤ 30 cm, n.e.s.",164930
201902,502,United States,580639,"Narrow woven fabrics of textile materials other than cotton or man-made fibres, with a width of ≤ 30 cm, n.e.s.",544
201902,502,United States,580640,Fabrics consisting of warp without weft assembled by means of an adhesive (bolducs),13239
201902,502,United States,580710,"Labels, badges and similar articles, of textile materials, in the piece, in strips or cut to shape or size, woven, not embroidered",58127
201902,502,United States,580790,"Labels, badges and similar articles, of textile materials, in the piece, in strips or cut to shape or size, not embroidered (excluding woven)",56878
201902,502,United States,580810,Braids in the piece,10651
201902,502,United States,580890,"Ornamental trimmings of textile materials, in the piece, not embroidered, other than knitted or crocheted; tassels, pompons and similar articles of textile materials (excluding braids in the piece)",15916
201902,502,United States,581092,"Embroidery of man-made fibres on a textile fabric base, in the piece, in strips or in motifs (excluding embroidery without visible ground)",5067
201902,502,United States,581100,"Quilted textile products in the piece, composed of one or more layers of textile materials assembled with padding by stitching or otherwise (excluding embroidery of heading 5810 and quilted fabrics for bedding and furnishings)",144931
201902,502,United States,590110,"Textile fabrics coated with gum or amylaceous substances, of a kind used for the outer covers of books or the like",140
201902,502,United States,590210,"Tyre cord fabric of high-tenacity yarn of nylon or other polyamides, whether or not dipped or impregnated with rubber or plastic",7360
201902,502,United States,590310,"Textile fabrics impregnated, coated, covered or laminated with poly""vinyl chloride"" (excluding wallcoverings of textile materials impregnated or covered with poly""vinyl chloride""; floor coverings consisting of a textile backing and a top layer or covering of poly""vinyl chloride"")",278769
201902,502,United States,590320,"Textile fabrics impregnated, coated, covered or laminated with polyurethane (excluding wallcoverings of textile materials impregnated or covered with polyurethane; floor coverings consisting of a textile backing and a top layer or covering of polyurethane)",535043
201902,502,United States,590390,"Textile fabrics impregnated, coated, covered or laminated with plastics other than poly""vinyl chloride"" or polyurethane (excluding tyre cord fabric of high-tenacity yarn of nylon or other polyamides, polyesters or viscose rayon; wallcoverings of textile materials impregnated or covered with plastic; floor coverings consisting of a textile backing and a top layer or covering of plastics)",781629
201902,502,United States,590500,Textile wall coverings.,9499
201902,502,United States,590610,Adhesive tape of a width not exceeding 20 cm,12384
201902,502,United States,590699,"Rubberised textile fabrics (excluding knitted or crocheted textile fabrics, adhesive tape of a width of ≤ 20 cm, and tyre cord fabric of high-tenacity yarn of nylon or other polyamides, polyesters or viscose rayon)",144796
201902,502,United States,590700,"Impregnated, coated or covered textile fabrics; painted canvas being theatrical scenery, studio backcloths or the like, n.e.s.",3723595
201902,502,United States,590800,"Textile wicks, woven, plaited or knitted, for lamps, stoves, lighters, candles or the like; incandescent gas mantles and tubular knitted gas-mantle fabric for incandescent gas mantles, whether or not impregnated",92331
201902,502,United States,590900,"Textile hosepiping and similar textile tubing, whether or not impregnated or coated, with or without lining, armour or accessories of other materials",408716
201902,502,United States,591000,"Transmission or conveyor belts or belting, of textile material, whether or not impregnated, coated, covered or laminated with plastics, or reinforced with metal or other material.",111108
201902,502,United States,591110,"Textile fabrics, felt and felt-lined woven fabrics, coated, covered or laminated with rubber, leather or other material, of a kind used for card clothing, and similar fabrics of a kind used for other technical purposes, incl. narrow fabrics made of velvet impregnated with rubber, for covering weaving spindles ""weaving beams""",30365
201902,502,United States,591120,"Bolting cloth, whether or not made up",121087
201902,502,United States,591131,"Textile fabrics and felts, endless or fitted with linking devices, of a kind used in papermaking or similar machines, e.g. for paper pulp or asbestos-cement, weighing < 650 g/m2",245570
201902,502,United States,591132,"Textile fabrics and felts, endless or fitted with linking devices, of a kind used in papermaking or similar machines, e.g. for paper pulp or asbestos-cement, weighing ≥ 650 g/m2",67911
201902,502,United States,591140,"Straining cloth of a kind used in oil-presses or for similar technical purposes, incl. that of human hair",136218
201902,502,United States,591190,"Textile products and articles, for technical purposes, specified in Note 7 to chapter 59, n.e.s.",1792768
201902,502,United States,600110,"Long pile fabrics, knitted or crocheted",2460
201902,502,United States,600122,"Looped pile fabrics of man-made fibres, knitted or crocheted",529
201902,502,United States,600192,"Pile fabrics of man-made fibres, knitted or crocheted (excluding ""long pile"" fabrics)",35129
201902,502,United States,600290,"Knitted or crocheted fabrics, of a width of ≤ 30 cm, containing ≥ 5% by weight elastomeric yarn and rubber thread or rubber thread only",92
201902,502,United States,600330,"Knitted or crocheted fabrics of synthetic fibres, of a width of ≤ 30 cm",50453
201902,502,United States,600410,"Knitted or crocheted fabrics, of a width of > 30 cm, containing ≥ 5% by weight elastomeric yarn",119692
201902,502,United States,600521,"Unbleached or bleached cotton warp knit fabrics ""incl. those made on galloon knitting machines"", of a width of > 30 cm",601
201902,502,United States,600536,"Unbleached or bleached warp knit fabrics of synthetic fibres ""incl. those made on galloon knitting machines"", of a width of > 30 cm",76980
201902,502,United States,600537,"Dyed warp knit fabrics of synthetic fibres ""incl. those made on galloon knitting machines"", of a width of > 30 cm",340292
201902,502,United States,600542,"Dyed warp knit fabrics of artificial fibres ""incl. those made on galloon knitting machines"", of a width of > 30 cm",282
201902,502,United States,600590,"Warp knit fabrics ""incl. those made on galloon knitting machines"", of a width of > 30 cm",1443
201902,502,United States,600622,"Dyed cotton fabrics, knitted or crocheted, of a width of > 30 cm",1076
201902,502,United States,600623,"Cotton fabrics, knitted or crocheted, of yarns of different colours, of a width of > 30 cm",470
201902,502,United States,600624,"Printed cotton fabrics, knitted or crocheted, of a width of > 30 cm",313
201902,502,United States,600631,"Unbleached or bleached fabrics, knitted or crocheted, of synthetic fibres, of a width of > 30 cm",8128
201902,502,United States,600632,"Dyed fabrics, knitted or crocheted, of synthetic fibres, of a width of > 30 cm",78090
201902,502,United States,600633,"Fabrics, knitted or crocheted, of synthetic fibres, of yarns of different colours, of a width of > 30 cm",5771
201902,502,United States,600641,"Unbleached or bleached fabrics, knitted or crocheted, of artificial fibres, of a width of > 30 cm",40329
201902,502,United States,600642,"Dyed fabrics, knitted or crocheted, of artificial fibres, of a width of > 30 cm",29297
201902,502,United States,600643,"Fabrics, knitted or crocheted, of artificial fibres, of yarns of different colours, of a width of > 30 cm",29
201902,502,United States,610120,"Overcoats, car coats, capes, cloaks, anoraks, incl. ski jackets, windcheaters, wind-jackets and similar articles of cotton, for men or boys, knitted or crocheted",69583
201902,502,United States,610130,"Overcoats, car coats, capes, cloaks, anoraks, incl. ski jackets, windcheaters, wind-jackets and similar articles of man-made fibres, for men or boys, knitted or crocheted",16325
201902,502,United States,610190,"Overcoats, car coats, capes, cloaks, anoraks, incl. ski jackets, windcheaters, wind-jackets and similar articles of textile materials, for men or boys, knitted or crocheted",3359
201902,502,United States,610210,"Women's or girls' overcoats, car coats, capes, cloaks, anoraks, incl. ski jackets, windcheaters, wind-jackets and similar articles, of wool or fine animal hair, knitted or crocheted",4111
201902,502,United States,610220,"Women's or girls' overcoats, car coats, capes, cloaks, anoraks, incl. ski jackets, windcheaters, wind-jackets and similar articles of cotton, knitted or crocheted",12104
201902,502,United States,610230,"Women's or girls' overcoats, car coats, capes, cloaks, anoraks, incl. ski jackets, windcheaters, wind-jackets and similar articles of man-made fibres, knitted or crocheted",21380
201902,502,United States,610290,"Women's or girls' overcoats, car coats, capes, cloaks, anoraks, incl. ski jackets, windcheaters, wind-jackets and similar articles, of textile materials, knitted or crocheted",31792
201902,502,United States,610310,"Men's or boys' suits of textile materials, knitted or crocheted",3607
201902,502,United States,610322,"Men's or boys' ensembles of cotton, knitted or crocheted",297
201902,502,United States,610323,"Men's or boys' ensembles of synthetic fibres, knitted or crocheted",114
201902,502,United States,610329,Men's or boys' ensembles of textile materials,16
201902,502,United States,610331,"Men's or boys' jackets and blazers of wool or fine animal hair, knitted or crocheted",9643
201902,502,United States,610332,"Men's or boys' jackets and blazers of cotton, knitted or crocheted",200331
201902,502,United States,610333,"Men's or boys' jackets and blazers of synthetic fibres, knitted or crocheted",15630
201902,502,United States,610339,Men's or boys' jackets and blazers of textile materials,13925
201902,502,United States,610341,"Men's or boys' trousers, bib and brace overalls, breeches and shorts of wool or fine animal hair, knitted or crocheted",4108
201902,502,United States,610342,"Men's or boys' trousers, bib and brace overalls, breeches and shorts of cotton, knitted or crocheted",70200
201902,502,United States,610343,"Men's or boys' trousers, bib and brace overalls, breeches and shorts of synthetic fibres, knitted or crocheted",35381
201902,502,United States,610349,"Men's or boys' trousers, bib and brace overalls, breeches and shorts of textile materials, knitted or crocheted",40359
201902,502,United States,610422,"Women's or girls' ensembles of cotton, knitted or crocheted",930
201902,502,United States,610423,"Women's or girls' ensembles of synthetic fibres, knitted or crocheted",562
201902,502,United States,610429,Women's or girls' ensembles of textile materials,100
201902,502,United States,610431,"Women's or girls' jackets and blazers of wool or fine animal hair, knitted or crocheted",25715
201902,502,United States,610432,"Women's or girls' jackets and blazers of cotton, knitted or crocheted",37780
201902,502,United States,610433,"Women's or girls' jackets and blazers of synthetic fibres, knitted or crocheted",2497
201902,502,United States,610439,"Women's or girls' jackets and blazers of textile materials, knitted or crocheted",15164
201902,502,United States,610441,"Women's or girls' dresses of wool or fine animal hair, knitted or crocheted",796
201902,502,United States,610442,"Women's or girls' dresses of cotton, knitted or crocheted",16788
201902,502,United States,610443,"Women's or girls' dresses of synthetic fibres, knitted or crocheted",31817
201902,502,United States,610444,"Women's or girls' dresses of artificial fibres, knitted or crocheted",4243
201902,502,United States,610449,"Women's or girls' dresses of textile materials, knitted or crocheted",9017
201902,502,United States,610451,"Women's or girls' skirts and divided skirts of wool or fine animal hair, knitted or crocheted",136
201902,502,United States,610452,"Women's or girls' skirts and divided skirts of cotton, knitted or crocheted",106075
201902,502,United States,610453,"Women's or girls' skirts and divided skirts of synthetic fibres, knitted or crocheted",19255
201902,502,United States,610459,"Women's or girls' skirts and divided skirts of textile materials, knitted or crocheted",20731
201902,502,United States,610461,"Women's or girls' trousers, bib and brace overalls, breeches and shorts of wool or fine animal hair, knitted or crocheted",22171
201902,502,United States,610462,"Women's or girls' trousers, bib and brace overalls, breeches and shorts of cotton, knitted or crocheted",65352
201902,502,United States,610463,"Women's or girls' trousers, bib and brace overalls, breeches and shorts of synthetic fibres, knitted or crocheted",99256
201902,502,United States,610469,"Women's or girls' trousers, bib and brace overalls, breeches and shorts of textile materials, knitted or crocheted",42826
201902,502,United States,610510,"Men's or boys' shirts of cotton, knitted or crocheted (excluding nightshirts, T-shirts, singlets and other vests)",83054
201902,502,United States,610520,"Men's or boys' shirts of man-made fibres, knitted or crocheted (excluding nightshirts, T-shirts, singlets and other vests)",5727
201902,502,United States,610590,"Men's or boys' shirts of textile materials, knitted or crocheted (excluding of cotton or man-made fibres, nightshirts, T-shirts, singlets and other vests)",1130
201902,502,United States,610610,"Women's or girls' blouses, shirts and shirt-blouses of cotton, knitted or crocheted (excluding T-shirts and vests)",7331
201902,502,United States,610620,"Women's or girls' blouses, shirts and shirt-blouses of man-made fibres, knitted or crocheted (excluding T-shirts and vests)",2091
201902,502,United States,610690,"Women's or girls' blouses, shirts and shirt-blouses of textile materials, knitted or crocheted (excluding of cotton or man-made fibres, T-shirts and vests)",2038
201902,502,United States,610711,"Men's or boys' underpants and briefs of cotton, knitted or crocheted",24508
201902,502,United States,610712,"Men's or boys' underpants and briefs of man-made fibres, knitted or crocheted",3436
201902,502,United States,610719,"Men's or boys' underpants and briefs of other textile materials, knitted or crocheted (excluding of cotton or man-made fibres)",73
201902,502,United States,610722,"Men's or boys' nightshirts and pyjamas of man-made fibres, knitted or crocheted (excluding vests and singlets)",98
201902,502,United States,610791,"Men's or boys' bathrobes, dressing gowns and similar articles of cotton, knitted or crocheted",964
201902,502,United States,610811,"Women's or girls' slips and petticoats of man-made fibres, knitted or crocheted (excluding T-shirts and vests)",214
201902,502,United States,610821,"Women's or girls' briefs and panties of cotton, knitted or crocheted",23019
201902,502,United States,610822,"Women's or girls' briefs and panties of man-made fibres, knitted or crocheted",3653
201902,502,United States,610829,"Women's or girls' briefs and panties of textile materials, knitted or crocheted (excluding cotton or man-made fibres)",531
201902,502,United States,610831,"Women's or girls' nightdresses and pyjamas of cotton, knitted or crocheted (excluding T-shirts, vests and négligés)",5904
201902,502,United States,610832,"Women's or girls' nightdresses and pyjamas of man-made fibres, knitted or crocheted (excluding T-shirts, vests and négligés)",1601
201902,502,United States,610891,"Women's or girls' négligés, bathrobes, dressing gowns, housejackets and similar articles of cotton, knitted or crocheted (excluding vests, slips, petticoats, briefs and panties, nightdresses, pyjamas, brassiéres, girdles, corsets and similar articles)",64574
201902,502,United States,610892,"Women's or girls' négligés, bathrobes, dressing gowns, housejackets and similar articles of man-made fibres, knitted or crocheted (excluding vests, slips, petticoats, briefs and panties, nightdresses, pyjamas, brassiéres, girdles, corsets and similar articles)",3994
201902,502,United States,610910,"T-shirts, singlets and other vests of cotton, knitted or crocheted",651401
201902,502,United States,610990,"T-shirts, singlets and other vests of textile materials, knitted or crocheted (excluding cotton)",38172
201902,502,United States,611011,"Jerseys, pullovers, cardigans, waistcoats and similar articles, of hair of Kashmir ""cashmere"" goats, knitted or crocheted (excluding quilted articles)",55619
201902,502,United States,611012,"Jerseys, pullovers, cardigans, waistcoats and similar articles, of fine animal hair, knitted or crocheted (excluding from hair of Kashmir ""cashmere"" goats and quilted articles)",14503
201902,502,United States,611019,"Jerseys, pullovers, cardigans, waistcoats and similar articles, of cotton, knitted or crocheted (excluding wadded waistcoats)",60364
201902,502,United States,611020,"Jerseys, pullovers, cardigans, waistcoats and similar articles, of man-made fibres, knitted or crocheted (excluding wadded waistcoats)",402743
201902,502,United States,611030,"Jerseys, pullovers, cardigans, waistcoats and similar articles, of textile materials, knitted or crocheted (excluding of wool, fine animal hair, cotton or man-made fibres, and wadded waistcoats)",84359
201902,502,United States,611090,"bies' garments and clothing accessories, knitted or crocheted (excluding hats)",6835
201902,502,United States,611120,"Babies' garments and clothing accessories of cotton, knitted or crocheted (excluding hats)",16404
201902,502,United States,611130,"Babies' garments and clothing accessories of synthetic fibres, knitted or crocheted (excluding hats)",367
201902,502,United States,611190,"Babies' garments and clothing accessories of textile materials, knitted or crocheted (excluding of cotton or synthetic fibres, and hats)",1260
201902,502,United States,611211,"Track-suits of cotton, knitted or crocheted",1290
201902,502,United States,611212,"Track-suits of synthetic fibres, knitted or crocheted",6310
201902,502,United States,611219,"Track-suits of textile materials, knitted or crocheted (excluding cotton or synthetic fibres)",392
201902,502,United States,611231,"Men's or boys' swimwear of synthetic fibres, knitted or crocheted",3266
201902,502,United States,611241,"Women's or girls' swimwear of synthetic fibres, knitted or crocheted",9838
201902,502,United States,611249,"Women's or girls' swimwear of textile materials, knitted or crocheted (excluding synthetic fibres)",96
201902,502,United States,611300,"Garments, knitted or crocheted, rubberised or impregnated, coated or covered with plastics or other materials (excluding babies' garments and clothing accessories)",1237
201902,502,United States,611420,Of cotton,101924
201902,502,United States,611430,Of manmade fibres,151818
201902,502,United States,611510,"Graduated compression hosiery [e.g., stockings for varicose veins], of textile materials, knitted or crocheted (excluding hosiery for babies)",27367
201902,502,United States,611521,"Pantyhose and tights of synthetic fibres, knitted or crocheted, measuring per single yarn < 67 decitex (excluding graduated compression hosiery)",2747
201902,502,United States,611522,"Pantyhose and tights of synthetic fibres, knitted or crocheted, measuring per single yarn ≥ 67 decitex (excluding graduated compression hosiery)",141
201902,502,United States,611529,"Pantyhose and tights of textile materials, knitted or crocheted (excluding graduated compression hosiery, those of synthetic fibres and hosiery for babies)",29711
201902,502,United States,611530,"Women's full-length or knee-length hosiery, knitted or crocheted, measuring per single yarn < 67 decitex (excluding graduated compression hosiery, pantyhose and tights)",403
201902,502,United States,611594,"Full-length or knee-length stockings, socks and other hosiery, incl. footwear without applied soles, of wool or fine animal hair, knitted or crocheted (excluding graduated compression hosiery, pantyhose and tights, women's full-length or knee-length stockings, measuring per single yarn < 67 decitex, and hosiery for babies)",66513
201902,502,United States,611595,"Full-length or knee-length stockings, socks and other hosiery, incl. footwear without applied soles, of cotton, knitted or crocheted (excluding graduated compression hosiery, pantyhose and tights, women's full-length or knee-length stockings, measuring per single yarn < 67 decitex, and hosiery for babies)",8256
201902,502,United States,611596,"Full-length or knee-length stockings, socks and other hosiery, incl. footwear without applied soles, of synthetic fibres, knitted or crocheted (excluding graduated compression hosiery, pantyhose and tights, women's full-length or knee-length stockings, measuring per single yarn < 67 decitex, and hosiery for babies)",34704
201902,502,United States,611599,"Full-length or knee-length stockings, socks and other hosiery, incl. footwear without applied soles, of textile materials, knitted or crocheted (excluding of wool, fine animal hair, cotton or synthetic fibres, graduated compression hosiery, pantyhose and tights, women's full-length or knee-length stockings, measuring per single yarn < 67 decitex, and hosiery for babies)",2669
201902,502,United States,611610,"Gloves, mittens and mitts, impregnated, coated or covered with plastics or rubber, knitted or crocheted",3258
201902,502,United States,611691,"Gloves, mittens and mitts, of wool or fine animal hair, knitted or crocheted (excluding for babies)",1026
201902,502,United States,611692,"Gloves, mittens and mitts, of cotton, knitted or crocheted (excluding impregnated, coated or covered with plastics or rubber, and for babies)",1771
201902,502,United States,611693,"Gloves, mittens and mitts, of synthetic fibres, knitted or crocheted (excluding impregnated, coated or covered with plastics or rubber, and for babies)",11538
201902,502,United States,611699,"Gloves, mittens and mitts, of textile materials, knitted or crocheted (excluding of wool, fine animal hair, cotton or synthetic fibres, impregnated, coated or covered with plastics or rubber, and for babies)",1984
201902,502,United States,611710,"Shawls, scarves, mufflers, mantillas, veils and the like, knitted or crocheted",47410
201902,502,United States,611780,"Ties, bow ties, cravats and other made-up clothing accessories, knitted or crocheted, n.e.s. (excluding shawls, scarves, mufflers, mantillas, veils and the like)",50159
201902,502,United States,611790,"Parts of garments or clothing accessories, knitted or crocheted, n.e.s.",6447
201902,502,United States,620111,"Men's or boys' overcoats, raincoats, car coats, capes, cloaks and similar articles, of wool or fine animal hair",2959
201902,502,United States,620112,"Men's or boys' overcoats, raincoats, car coats, capes, cloaks and similar articles, of cotton",16254
201902,502,United States,620113,"Men's or boys' overcoats, raincoats, car coats, capes, cloaks and similar articles, of man-made fibres",41123
