Date of data,Trading partner code,Trading partner,Commodity code,Commodity,US dollar
201902,502,United States,820810,"Knives and cutting blades, of base metal, for machines or for mechanical appliances, for metalworking",3278657
201902,502,United States,820830,"Knives and cutting blades, of base metal, for kitchen appliances or for machines used by the food industry",25400
201902,502,United States,820840,"Knives and cutting blades, of base metal, for agricultural, horticultural or forestry machines (excluding those for wood-working)",254909
201902,502,United States,820890,"Knives and cutting blades, of base metal, for machines or for mechanical appliances (excluding those for metal or wood-working, kitchen appliances or machines used by the food industry and those for agricultural, horticultural or forestry machines)",491391
201902,502,United States,820900,"Plates, sticks, tips and the like for tools, unmounted, of cermets.",521477
201902,502,United States,821000,"Hand-operated mechanical appliances, weighing 10 kg or less, used in the preparation, conditioning or serving of food or drink.",8853
201902,502,United States,821110,Sets of assorted articles,154
201902,502,United States,821191,Table knives having fixed blades,144
201902,502,United States,821192,Other knives having fixed blades,12435
201902,502,United States,821193,Knives having other than fixed blades,4612
201902,502,United States,821194,"Blades of base metal for table knives, pocket knives and other knives of heading 8211",36601
201902,502,United States,821195,Handles of base metal,6916
201902,502,United States,821210,Razors,372184
201902,502,United States,821220,"Safety razor blades, including razor blade blanks in strips",1084491
201902,502,United States,821290,Parts of non-electric razors of base metal (excluding safety razor blades and razor blade blanks in strips),15
201902,502,United States,821300,"Scissors, tailors' shears and similar shears, and blades therefor.",27624
201902,502,United States,821410,"Paper knives, letter openers, erasing knives, pencil sharpeners and blades therefor",6224
201902,502,United States,821420,Manicure or pedicure sets and instruments (including nail files),3778
201902,502,United States,821490,"Hair clippers, butchers' or kitchen cleavers and other articles of cutlery of base metal, n.e.s.",5182
201902,502,United States,821520,Other sets of assorted articles,1730
201902,502,United States,821591,Plated with precious metal,1105
201902,502,United States,821599,"Spoons, forks, ladles, skimmers, cake-servers, fish-knives, butter-knives, sugar tongs and similar kitchen or tableware of base metal, not plated with precious metal (excluding sets of articles such as lobster cutters and poultry shears)",1844
201902,502,United States,830110,Padlocks,12679
201902,502,United States,830120,Locks of a kind used for motor vehicles,79834
201902,502,United States,830130,Locks of a kind used for furniture,113929
201902,502,United States,830140,Other locks,892112
201902,502,United States,830150,"Clasps and frames with clasps, incorporating locks",128405
201902,502,United States,830160,"Parts of padlocks, locks, clasps and frames with clasps, incorporating locks, of base metal, n.e.s.",1087687
201902,502,United States,830170,Keys presented separately,89733
201902,502,United States,830210,"Hinges of all kinds, of base metal",863204
201902,502,United States,830220,Castors with mountings of base metal,74641
201902,502,United States,830230,"Base metal mountings, fittings and similar articles suitable for motor vehicles (excluding hinges and castors)",153875
201902,502,United States,830241,Base metal mountings and fittings suitable for buildings (excluding locks with keys and hinges),247827
201902,502,United States,830242,"Base metal mountings, fittings and similar articles suitable for furniture (excluding locks with keys, hinges and castors)",210444
201902,502,United States,830249,"Base metal mountings, fittings and similar articles (excluding locks with keys, clasps and frames with clasps incorporating locks, hinges, castors and mountings and fittings suitable for buildings, motor vehicles or furniture)",2610193
201902,502,United States,830250,"Hat-racks, hat-pegs, brackets and similar fixtures of base metal",13281
201902,502,United States,830260,Automatic door closers of base metal,16066
201902,502,United States,830400,"Filing cabinets, cardindex cabinets, paper trays, paper rests, pen trays, officestamp stands and similar office or desk equipment, of base metal, other than office furniture of heading 9403",874
201902,502,United States,830520,"Staples in strips, of base metal",60
201902,502,United States,830590,"Office articles such as letter clips, letter corners, paper clips and indexing tags, of base metal, incl. parts of articles of heading 8305 (excluding fittings for loose-leaf binders or files, staples in strips, drawing pins and clasps for books or registers)",795
201902,502,United States,830610,"Bells, gongs and the like, non-electric, of base metal",195
201902,502,United States,830621,"Statuettes and other ornaments, of base metal, plated with precious metal",168
201902,502,United States,830629,"Statuettes and other ornaments, of base metal, not plated with precious metal",51552
201902,502,United States,830630,"Photograph, picture or similar frames, of base metal; mirrors of base metal",5429
201902,502,United States,830710,"Flexible tubing of iron or steel, with or without fittings",897169
201902,502,United States,830790,"Flexible tubing of base metal other than iron or steel, with or without fittings",187230
201902,502,United States,830810,"Hooks, eyes and eyelets, of base metal, of a kind used for clothing, footwear, awnings, handbags, travel goods or other made-up articles",205659
201902,502,United States,830820,"Tubular or bifurcated rivets, of base metal",241612
201902,502,United States,830890,"Clasps, frames with clasps without locks, buckles and buckle-clasps, of base metal, for clothing, footwear, handbags, travel goods or other made-up articles, incl. parts of articles of heading 8308, of base metal (excluding hooks, eyes, eyelets and tubular or bifurcated rivets)",241077
201902,502,United States,830910,Crown corks of base metal,2726
201902,502,United States,830990,"Stoppers, caps and lids, incl. screw caps and pouring stoppers, capsules for bottles, threaded bungs, bung covers, seals and other packing accessories of base metal (excluding crow corks)",579895
201902,502,United States,831000,"Signplates, nameplates, addressplates and similar plates, numbers, letters and other symbols, of base metal, excluding those of heading 9405",183245
201902,502,United States,831110,"Coated electrodes of base metal, for electric arc-welding",176369
201902,502,United States,831120,"Cored wire of base metal, for electric arc-welding",692625
201902,502,United States,831130,"Coated rods and cored wire, of base metal, for soldering, brazing or welding by flame (excluding wire and rods cored with solder which, excluding the flux material, contains ≥ 2% by weight of precious metal)",480635
201902,502,United States,831190,"Wire, rods, tubes, plates, electrodes and the like, of base metal or of metal carbides, coated or cored with flux material, for soldering, brazing, welding or deposition of metal or metal carbides, n.e.s., and wire and rods of agglomerated base metal powder, for metal spraying, n.e.s.",85154
201902,502,United States,840140,Parts of nuclear reactors,3219
201902,502,United States,840290,"Parts of vapour generating boilers and superheated water boilers, n.e.s.",2597
201902,502,United States,840310,"Central heating boilers, non-electric (excluding vapour generating boilers and superheated water boilers of heading 8402)",771043
201902,502,United States,840390,"Parts of central heating boilers, n.e.s.",59999
201902,502,United States,840410,Auxiliary plant for use with boilers of heading 84.02 or 84.03,3021
201902,502,United States,840420,Condensers for steam or other vapour power units,2680
201902,502,United States,840510,"Producer gas or water gas generators, with or without their purifiers; acetylene gas generators and similar water process gas generators, with or without their purifiers",29059
201902,502,United States,840690,"Parts of steam and other vapour turbines, n.e.s.",9126
201902,502,United States,840710,"Spark-ignition reciprocating or rotary internal combustion piston engine, for aircraft",158327
201902,502,United States,840721,Spark-ignition outboard motors for marine propulsion,413066
201902,502,United States,840729,"Spark-ignition reciprocating or rotary engines, for marine propulsion (excluding outboard motors)",194758
201902,502,United States,840733,"Spark-ignition reciprocating piston engine, of a kind used for the propulsion of vehicles of chapter 87, Of a cylinder capacity exceeding 250 cc but not exceeding 1,000 cc",1646
201902,502,United States,840734,"Spark-ignition reciprocating piston engine, of a kind used for the propulsion of vehicles of chapter 87, Of a cylinder capacity exceeding 1,000 cc",2846735
201902,502,United States,840790,Other engines,4885736
201902,502,United States,840810,Marine propulsion engines,128488
201902,502,United States,840820,Engines of a kind used for the propulsion of vehicles of Chapter 87,1097023
201902,502,United States,840890,Other engines,31238311
201902,502,United States,840910,"Parts suitable for use solely or principally with internal combustion piston engine for aircraft, n.e.s.",32410
201902,502,United States,840991,"Parts suitable for use solely or principally with spark-ignition internal combustion piston engine, n.e.s.",12703379
201902,502,United States,840999,"Parts suitable for use solely or principally with compression-ignition internal combustion piston engine ""diesel or semi-diesel engine"", n.e.s.",8027232
201902,502,United States,841111,Turbojets of a thrust not exceeding 25 kN,1885800
201902,502,United States,841112,Turbojets of a thrust exceeding 25 kN,183269927
201902,502,United States,841181,"Gas turbines of a power not exceeding 5,000 kW",138551
201902,502,United States,841182,"Gas turbines of a power exceeding 5,000 kW",7200000
201902,502,United States,841191,"Parts of turbojets or turbopropellers, n.e.s.",99110590
201902,502,United States,841199,"Parts of gas turbines, n.e.s.",20215524
201902,502,United States,841221,"Hydraulic power engines and motors, linear acting (cylinders)",6580295
201902,502,United States,841229,"Hydraulic power engines and motors (excluding hydraulic turbines and water wheels of heading 8410, steam turbines and hydraulic power engines and motors, linear acting)",7560266
201902,502,United States,841231,"Pneumatic power engines and motors, linear acting (cylinders)",802909
201902,502,United States,841239,Pneumatic power engines and motors (excluding linear acting),879699
201902,502,United States,841280,"Engines and motors (excluding steam turbines, internal combustion piston engine, hydraulic turbines, water wheels, gas turbines, reaction engines, hydraulic power engines and motors, pneumatic power engines and motors and electric motors)",552097
201902,502,United States,841290,"Parts of non-electrical engines and motors, n.e.s.",1811461
201902,502,United States,841311,"Pumps for dispensing fuel or lubricants, of the type used in fillingstations or in garages",698
201902,502,United States,841319,"Pumps for liquids, fitted or designed to be fitted with a measuring device (excluding pumps for dispensing fuel or lubricants, of the type used in filling stations or in garages)",1304009
201902,502,United States,841320,"Hand pumps, other than those of subheading 8413.11 or 8413.19",169234
201902,502,United States,841330,"Fuel, lubricating or cooling medium pumps for internal combustion piston engines",1628380
201902,502,United States,841350,Other reciprocating positive displacement pumps,10723679
201902,502,United States,841360,Other rotary positive displacement pumps,4907032
201902,502,United States,841370,Other centrifugal pumps,7929944
201902,502,United States,841381,"Pumps for liquids, power-driven (excluding those of subheading 8413.11 and 8413.19, fuel, lubricating or cooling medium pumps for internal combustion piston engine, concrete pumps, general reciprocating or rotary positive displacement pumps and centrifugal pumps of all kinds)",659921
201902,502,United States,841391,"Parts of pumps for liquids, n.e.s.",5971856
201902,502,United States,841410,Vacuum pumps,1786624
201902,502,United States,841420,Hand or footoperated air pumps,23551
201902,502,United States,841430,Compressors of a kind used in refrigerating equipment,2518818
201902,502,United States,841451,"Table, floor, wall, window, ceiling or roof fans, with a selfcontained electric motor of an output not exceeding 125 W",287486
201902,502,United States,841459,"Fans (excluding table, floor, wall, window, ceiling or roof fans, with a self-contained electric motor of an output ≤ 125 W)",4278624
201902,502,United States,841460,Hoods having a maximum horizontal side not exceeding 120 cm,8219
201902,502,United States,841480,"Air pumps, air or other gas compressors and ventilating or recycling hoods incorporating a fan, whether or not fitted with filters, having a maximum horizontal side > 120 cm (excluding vacuum pumps, hand- or foot-operated air pumps, compressors for refrigerating equipment and air compressors mounted on a wheeled chassis for towing)",10342550
201902,502,United States,841490,"Parts of: air or vacuum pumps, air or other gas compressors, fans and ventilating or recycling hoods incorporating a fan, n.e.s.",8854615
201902,502,United States,841510,"Air conditioning machines of a kind designed to be fixed to a window, wall, ceiling or floor, selfcontained or .splitsystem.",172661
201902,502,United States,841520,"Air conditioning machines of a kind used for persons, in motor vehicles",43555
201902,502,United States,841581,Air conditioning machines incorporating a refrigerating unit and a valve for reversal of the cooling/heat cycle (reversible heat pumps),45116
201902,502,United States,841582,"Other, air conditioning machines incorporating a refrigerating unit",1294239
201902,502,United States,841583,"Air conditioning machines,not incorporating a refrigerating unit",950
201902,502,United States,841590,"Parts of air conditioning machines, comprising a motor-driven fan and elements for changing the temperature and humidity, n.e.s.",3687161
201902,502,United States,841610,Furnace burners for liquid fuel,218532
201902,502,United States,841620,"Other furnace burners, including combination burners",971186
201902,502,United States,841690,"Parts of furnace burners such as mechanical stokers, incl. their mechanical grates, mechanical ash dischargers and similar appliances, n.e.s.",175916
201902,502,United States,841780,"Industrial or laboratory furnaces and ovens, non-electric, incl. incinerators (excluding those for the roasting, melting or other heat treatment of ores, pyrites or metals, bakery ovens, drying ovens and ovens for cracking operations)",81845
201902,502,United States,841790,"Parts of industrial or laboratory furnaces, non-electric, incl. incinerators, n.e.s.",515616
201902,502,United States,841810,"Combined refrigeratorfreezers, fitted with separate external doors",13230
201902,502,United States,841821,"Household refrigerators, compression-type",1807
201902,502,United States,841830,"Freezers of the chest type, of a capacity ≤ 800L",213190
201902,502,United States,841840,"Freezers of the upright type, of a capacity ≤ 900L",573277
201902,502,United States,841850,"Furniture (chests, cabinets, display counters, show-cases and the like) for storage and display, incorporating refrigerating or freezing equipment (excluding combined refrigerator-freezers with separate external doors, household refrigerators and freezers of the chest type of a capacity ≤ 800L or of the upright type of a capacity ≤ 900L)",117639
201902,502,United States,841861,Heat pumps other than air conditioning machines of heading 84.15,4889
201902,502,United States,841869,Refrigerating or freezing equipment (excluding refrigerating and freezing furniture),2731592
201902,502,United States,841899,"Parts of refrigerating or freezing equipment and heat pumps, n.e.s.",704714
201902,502,United States,841911,Instantaneous gas water heaters,19797
201902,502,United States,841919,"Instantaneous or storage water heaters, non-electric (excluding instantaneous gas water heaters and boilers or water heaters for central heating)",304657
201902,502,United States,841920,"Medical, surgical or laboratory sterilisers",155351
201902,502,United States,841939,"Dryers (excluding dryers for agricultural products, for wood, paper pulp, paper or paperboard, for yarns, fabrics and other textile products, dryers for bottles or other containers, hairdryers, hand dryers and domestic appliances)",380243
201902,502,United States,841940,Distilling or rectifying plant,8460
201902,502,United States,841950,Heat exchange units,7076217
201902,502,United States,841960,Machinery for liquefying air or other gases,72682
201902,502,United States,841981,"Machinery, plant and equipment for making hot drinks or for cooking or heating food (excluding domestic appliances)",1159484
201902,502,United States,841989,"Machinery, plant or laboratory equipment, whether or not electrically heated, for the treatment of materials by a process involving a change of temperature such as heating, cooking, roasting, sterilising, pasteurising, steaming, evaporating, vaporising, condensing or cooling, n.e.s. (excluding machinery used for domestic purposes and furnaces, ovens and other equipment of heading 8514)",3411106
201902,502,United States,841990,"Parts of machinery, plant and laboratory equipment, whether or not electrically heated, for the treatment of materials by a process involving a change of temperature, and of non-electric instantaneous and storage water heaters, n.e.s.",1045105
201902,502,United States,842010,Calendering or other rolling machines,255549
201902,502,United States,842091,Cylinders,20659
201902,502,United States,842099,"Parts for calendering or rolling machines, n.e.s. (other than for metals or glass and excluding cylinders)",217653
201902,502,United States,842119,"Centrifuges, incl. centrifugal dryers (excluding isotope separators, cream separators and clothes dryers)",3022558
201902,502,United States,842121,Machinery and apparatus for filtering or purifying water,4833888
201902,502,United States,842122,Machinery and apparatus for filtering or purifying beverages (excludingwater),6587
201902,502,United States,842123,Oil or petrol-filters for internal combustion engines,2691158
201902,502,United States,842129,"Machinery and apparatus for filtering or purifying liquids (excluding such machinery and apparatus for water and other beverages, oil or petrol-filters for internal combustion engines and artificial kidneys)",8795818
201902,502,United States,842131,Intake air filters for internal combustion engines,1248045
201902,502,United States,842139,Machinery and apparatus for filtering or purifying gases (excluding isotope separators and intake air filters for internal combustion engines),20000348
201902,502,United States,842191,"Parts of centrifuges, incl. centrifugal dryers, n.e.s.",414380
201902,502,United States,842199,"Parts of machinery and apparatus for filtering or purifying liquids or gases, n.e.s.",19182392
201902,502,United States,842211,Dishwashing machines of the household type,900
201902,502,United States,842220,Machinery for cleaning or drying bottles or other containers (excluding dishwashing machines),65869
201902,502,United States,842230,"Machinery for filling, closing, sealing or labelling bottles, cans, boxes, bags or other containers; machinery for capsuling bottles, jars, tubes and similar containers; machinery for aerating beverages",914161
201902,502,United States,842240,"Packing or wrapping machinery, incl. heat-shrink wrapping machinery (excluding machinery for filling, closing, sealing or labelling bottles, cans, boxes, bags or other containers and machinery for capsuling bottles, jars, tubes and similar containers)",703381
201902,502,United States,842290,"Parts of dishwashing machines, packing or wrapping machinery and other machinery and apparatus of heading 8422, n.e.s.",360044
201902,502,United States,842310,"Personal weighing machines, incl. baby scales; household scales",960
201902,502,United States,842330,"Constant weight scales and scales for discharging a pre-determined weight of material into a bag or container, incl. hopper scales (excluding scales for continuous weighing of goods on conveyors)",3199
201902,502,United States,842381,"Weighing machinery having a maximum weighing capacity ≤ 30 kg (excluding balances of a sensitivity of 5 cg or better, personal weighing machines, household scales, scales for continuous weighing of goods on conveyors, constant weight scales and scales for discharging a pre-determined weight of material into a bag or container, incl. hopper scales)",29576
201902,502,United States,842382,"Weighing machinery of a maximum weighing capacity > 30 kg but ≤ 5.000 kg (excluding personal weighing machines, scales for continuous weighing of goods on conveyors, constant weight scales and scales for discharging a pre-determined weight of material into a bag or container, incl. hopper scales)",12666
201902,502,United States,842390,"Weighing machine weights of all kinds; parts of weighing machinery, n.e.s.",39234
201902,502,United States,842410,"Fire extinguishers, whether or not charged",717242
201902,502,United States,842420,Spray guns and similar appliances,1844703
201902,502,United States,842430,Steam or sand blasting machines and similar jet projecting machines,786406
201902,502,United States,842441,"Agricultural or horticultural sprayers, portable",58332
201902,502,United States,842489,"Mechanical appliances, whether or not hand-operated, for projecting, dispersing or spraying liquids or powders, n.e.s.",5708671
201902,502,United States,842490,"Parts of fire extinguishers, spray guns and similar appliances, steam or sand blasting machines and similar jet projecting machines and machinery and apparatus for projecting, dispersing or spraying liquids or powders, n.e.s.",4533684
201902,502,United States,842511,"Pulley tackle and hoists, powered by electric motor (other than skip hoists or hoists of a kind used for raising vehicles)",81296
201902,502,United States,842519,"Pulley tackle and hoists (other than skip hoists or hoists of a kind used for raising vehicles), non-powered by electric motor",149064
201902,502,United States,842531,Winches and capstans powered by electric motor,286320
201902,502,United States,842539,"Winches and capstans, non-powered by electric motor",559635
201902,502,United States,842542,"Jacks and hoists, hydraulic (excluding built-in jacking systems used in garages)",51855
201902,502,United States,842549,"Jacks and hoists of a kind used for raising vehicles, not hydraulic",50370
201902,502,United States,842619,"Overhead travelling cranes, transporter cranes, gantry cranes, bridge cranes and mobile lifting frames (excluding overhead travelling cranes on fixed support, mobile lifting frames on tyres, straddle carriers and portal or pedestal jib cranes)",35760
201902,502,United States,842710,Selfpropelled trucks powered by an electric motor,1037774
201902,502,United States,842720,Other selfpropelled trucks,649662
201902,502,United States,842790,"Works trucks fitted with lifting or handling equipment, not self-propelled",12777
201902,502,United States,842810,Lifts and skip hoists,2806
201902,502,United States,842820,Pneumatic elevators and conveyors,53766
201902,502,United States,842832,"Continuous-action elevators and conveyors, for goods or materials, bucket type",3208
201902,502,United States,842833,"Continuous-action elevators and conveyors, for goods or materials, belt type",1509185
201902,502,United States,842839,"Continuous-action elevators and conveyors, for goods or materials (excluding those for underground use and bucket, belt or pneumatic types)",3153063
201902,502,United States,842890,"Machinery for lifting, handling, loading or unloading, n.e.s.",1979214
201902,502,United States,842911,"Bulldozers and angledozers,track laying",80860
201902,502,United States,842940,Tamping machines and road rollers,48677
201902,502,United States,842951,Frontend shovel loaders,376801
201902,502,United States,843020,Snowploughs and snowblowers,326363
201902,502,United States,843041,"Other, self-propelled boring or sinking machinery for boring earth or extracting minerals or ores",585088
201902,502,United States,843049,"Other, boring or sinking machinery for boring earth or extracting minerals or ores, not self-propelled and not hydraulic",19782
201902,502,United States,843069,"Earth moving machinery, not self-propelled, n.e.s.",55757
201902,502,United States,843110,Part of machinery of heading 84.25,99018
201902,502,United States,843120,Part of machinery of heading 84.27,1129992
201902,502,United States,843131,"Part off lifts, skip hoists or escalators, of heading 84.28",661816
201902,502,United States,843139,"Parts of machinery of heading 8428, n.e.s.",1178001
201902,502,United States,843143,Parts for boring or sinking machinery of subheading 8430.41 or,4991705
201902,502,United States,843149,"Parts of machinery of heading 8426, 8429 and 8430, n.e.s.",4946112
201902,502,United States,843290,"Parts of agricultural, horticultural or forestry machinery for soil preparation or cultivation or of lawn or sports-ground rollers, n.e.s.",497684
201902,502,United States,843311,"Powered, with the cutting device rotating in a horizontal plane",35250
201902,502,United States,843319,"Mowers for lawns, parks or sports grounds, powered, with the cutting device rotating in a vertical plane or with cutter bars",250494
