Date of data,Trading partner code,Trading partner,Commodity code,Commodity,US dollar
201902,502,United States,340290,"Surface-active preparations, washing preparations, incl. auxiliary washing preparations and cleaning preparations (excluding those put up for retail sale, organic surface-active agents, soap and organic surface-active preparations in the form of bars, cakes, moulded pieces or shapes, and products and preparations for washing the skin in the form of liquid or cream)",5270944
201902,502,United States,340311,"Preparations for the treatment of textile materials, leather, furskins or other materials",508397
201902,502,United States,340319,"Lubricant preparations, incl. cutting-oil preparations, bolt or nut release preparations, anti-rust or anti-corrosion preparations and mould-release preparations, based on lubricants and containing petroleum oil or bituminous mineral oil (excluding preparations containing, as basic constituents, ≥ 70% of petroleum oil or bituminous mineral oil by weight and preparations for treating textiles, leather, furskins and other materials)",5208001
201902,502,United States,340391,"Preparations for the treatment of textile materials, leather, furskins or other materials",641383
201902,502,United States,340399,"Lubricant preparations, incl. cutting-oil preparations, bolt or nut release preparations, anti-rust or anti-corrosion preparations and mould-release preparations, based on lubricants but not containing petroleum oil or bituminous mineral oil (excluding preparations for the treatment of textiles, leather, furskins and other materials)",8924698
201902,502,United States,340420,Of poly(oxyethylene) (polyethylene glycol),1605686
201902,502,United States,340490,Other,5454107
201902,502,United States,340510,"Polishes, creams and similar preparations for footwear or leather",46285
201902,502,United States,340520,"Polishes, creams and similar preparations for the maintenance of wooden furniture, floors or other woodwork",144579
201902,502,United States,340530,"Polishes and similar preparations for coachwork, other than metal polishes",188865
201902,502,United States,340540,Scouring pastes and powders and other scouring preparations,196028
201902,502,United States,340590,"Glass or metal polishes, whether or not in the form of paper, wadding, felt, nonwovens, cellular plastics or cellular rubber, impregnated, coated or covered with such preparations",4667961
201902,502,United States,340600,"Candles, tapers and the like.",276675
201902,502,United States,340700,"Modelling pastes, including those put up for children's amusement; preparations known as “dental wax”or as “dental impression compounds”, put up in sets, in packings for retail sale or in plates, horseshoe shapes, sticks or similar forms; other preparations for use in dentistry, with a basis of plaster (of calcined gypsum or calcium sulphate).",297469
201902,502,United States,350110,Casein,1872
201902,502,United States,350190,"Caseinates and other casein derivatives; casein glues (excluding those put up for retail sale as glue and weighing ≤ 1 kg, and organic or inorganic compounds of mercury whether or not chemically defined)",299275
201902,502,United States,350211,Dried egg albumin,20648
201902,502,United States,350220,"Milk albumin, including concentrates of two or more whey proteins",7825755
201902,502,United States,350290,"Albumins, albuminates and other albumin derivatives (excluding egg albumin and milk albumin [incl. concentrates of two or more whey proteins containing by weight > 80% whey proteins, calculated on the dry matter], and organic or inorganic compounds of mercury whether or not chemically defined)",8882
201902,502,United States,350300,"Gelatin (including gelatin in rectangular (including square) sheets, whether or not surfaceworked or coloured) and gelatin derivatives; isinglass; other glues of animal origin, excluding casein glues of heading 35.01.",113630
201902,502,United States,350400,"Peptones and their derivatives; other protein substances and their derivatives, not elsewhere specified or included; hide powder, whether or not chromed.",2080968
201902,502,United States,350510,Dextrins and other modified starches,3425420
201902,502,United States,350520,"Glues based on starches, dextrins or other modified starches",501
201902,502,United States,350610,"Products suitable for use as glues or adhesives, put up for retail sale as glues or adhesives, not exceeding a net weight of 1 kg",4604516
201902,502,United States,350691,Adhesives based on polymers of headings 39.01 to 39.13 or on rubber,8263359
201902,502,United States,350699,"Glues, prepared, and other prepared adhesives, n.e.s.",2789544
201902,502,United States,350790,"Enzymes and prepared enzymes, n.e.s. (excluding rennet and concentrates thereof)",2879623
201902,502,United States,360100,Propellent powders.,16009
201902,502,United States,360300,Safety fuses; detonating fuses; percussion or detonating caps;,1148464
201902,502,United States,360410,Fireworks,163488
201902,502,United States,360610,Liquid or liquefiedgas fuels in containers of a kind used for filling or refilling cigarette or similar lighters and of a capacity not exceeding 300 cm3,276484
201902,502,United States,360690,Other,195694
201902,502,United States,370110,"Photographic plates and film in the flat, sensitised, unexposed, for X-ray (excluding of paper, paperboard and textiles)",220035
201902,502,United States,370120,Instant print film,2700
201902,502,United States,370130,"Other plates and film, with any side exceeding 255 mm",787590
201902,502,United States,370191,"Photographic plates and film in the flat, sensitised, unexposed, of any material other than paper, paperboard or textiles, for colour photography ""polychrome"" (excluding instant print film)",700
201902,502,United States,370199,"Photographic plates and film in the flat for monochrome photography, sensitised, unexposed, of any material other than paper, paperboard or textiles (excluding X-ray film and photographic plates, film in the flat with any side > 255 mm, and instant print film)",2156
201902,502,United States,370210,"Photographic film in rolls, unexposed, for X-ray",1426965
201902,502,United States,370231,"Photographic film in rolls, unexposed, for colour photography (polychrome)",28000
201902,502,United States,370232,"Other, with silver halide emulsion",7018
201902,502,United States,370242,"Of a width exceeding 610 mm and of a length exceeding 200 m, other than for colour photography",17681308
201902,502,United States,370243,Of a width exceeding 610 mm and of a length not exceeding 200m,86551
201902,502,United States,370252,"Other film, for colour photography (polychrome) , of a width not exceeding 16 mm",31445
201902,502,United States,370254,"Other film, for colour photography (polychrome) , of a width exceeding 16 mm but not exceeding 35 mm and of a length not exceeding 30 m, other than for slides",206447
201902,502,United States,370256,"Other film, for colour photography (polychrome) , of a width exceeding 35 mm",50900
201902,502,United States,370296,Other film of a width not exceeding 35 mm and of a length not exceeding 30 m,4366
201902,502,United States,370310,In rolls of a width exceeding 610 mm,2379050
201902,502,United States,370320,"Other, for colour photography (polychrome)",535
201902,502,United States,370390,"Photographic paper, paperboard and textiles, sensitised, unexposed, for monochrome photography (excluding products in rolls > 610 mm wide)",37
201902,502,United States,370400,"Photographic plates, film, paper, paperboard and textiles, exposed but not developed.",457
201902,502,United States,370500,"Photographic plates and film, exposed and developed, other than cinematographic film.",374168
201902,502,United States,370710,Sensitising emulsions,1493619
201902,502,United States,370790,"Preparation of chemicals, incl. unmixed products put up in measured portions or put up for retail sale in a form ready for use (excluding varnishes, glues, adhesives and similar preparations, sensitising emulsions and salts and precious-metal compounds etc. of heading 2843 to 2846)",2036258
201902,502,United States,380110,Artificial graphite,2202837
201902,502,United States,380120,Colloidal or semicolloidal graphite,58198
201902,502,United States,380190,"Preparations based on graphite or other carbon in the form of pastes, blocks, plates or other semi-manufactures (excluding carbonaceous pastes for electrodes and similar pastes for furnace linings)",1271651
201902,502,United States,380210,Activated carbon,1751949
201902,502,United States,380290,"Activated kieselguhr and other activated natural mineral products; animal black, whether or not spent (excluding activated carbon, calcinated diatomite without the addition of sintering agents and activated chemical products)",231420
201902,502,United States,380300,"Tall oil, whether or not refined.",536958
201902,502,United States,380400,"Residual lyes from the manufacture of wood pulp, whether or not concentrated, desugared or chemically treated, including lignin sulphonates, but excluding tall oil of heading 38.03.",799891
201902,502,United States,380590,"Crude dipentene; sulphite turpentine and other crude para-cymene; terpenic oils produced by the distillation or other treatment of coniferous woods (excluding gum turpentine, wood turpentine and sulphate turpentine)",131458
201902,502,United States,380610,Rosin and resin acids,88758
201902,502,United States,380620,"Salts of rosin, of resin acids or of derivatives of rosin or resin acids, other than salts of rosin adducts",5678
201902,502,United States,380630,Ester gums,790802
201902,502,United States,380690,"Derivatives of rosin, incl. salts of rosin adducts, and of resin acids, light and heavy resin oils and modified natural resins obtained by heat treatment ""run gums"" (excluding salts of rosin, of resin acids or salts of derivatives of rosin or resin acids, and ester gums)",38663
201902,502,United States,380700,"Wood tar; wood tar oils; wood creosote; wood naphtha; vegetable pitch; brewers' pitch and similar preparations based on rosin, resin acids or on vegetable pitch.",40056
201902,502,United States,380891,Insecticides,6766966
201902,502,United States,380892,Fungicides,5660248
201902,502,United States,380893,"Herbicides, antisprouting products and plantgrowth regulators",4092875
201902,502,United States,380894,Disinfectants,853075
201902,502,United States,380910,With a basis of amylaceous substances,409
201902,502,United States,380991,Of a kind used in the textile or like industries,1109869
201902,502,United States,380992,Of a kind used in the paper or like industries,1804759
201902,502,United States,380993,Of a kind used in the leather or like industries,204266
201902,502,United States,381010,"Pickling preparations for metal surfaces; soldering, brazing or welding powders and pastes consisting of metal and other materials",560860
201902,502,United States,381090,Other,416278
201902,502,United States,381119,Anti-knock preparations for motor fuels (excluding those based on lead compounds),804
201902,502,United States,381121,Containing petroleum oils or oils obtained from bituminous minerals,16722765
201902,502,United States,381129,Other,1580770
201902,502,United States,381190,"Oxidation inhibitors, gum inhibitors, viscosity improvers, anti-corrosive preparations and other prepared additives for mineral oils, incl. gasoline, or for other liquids used for the same purposes as mineral oils (excluding anti-knock preparations and oil lubricant additives)",3863505
201902,502,United States,381210,Prepared rubber accelerators,275823
201902,502,United States,381220,Compound plasticisers for rubber or plastics,566389
201902,502,United States,381239,"Anti-oxidising preparations and other compound stabilisers for rubber or plastics (excl. mixtures of oligomers of 2,2,4-trimethyl-1,2-dihydroquinoline ""TMQ"")",2019786
201902,502,United States,381300,Preparations and charges for fireextinguishers; charged fireextinguishing grenades.,11440
201902,502,United States,381400,"Organic composite solvents and thinners, not elsewhere specified or included; prepared paint or varnish removers.",1171855
201902,502,United States,381511,Supported catalysts with nickel or nickel compounds as the active substance,4144729
201902,502,United States,381512,Supported catalysts with precious metal or precious metal compounds as the active substance,13434696
201902,502,United States,381519,"Supported catalysts, n.e.s. (excluding with precious metal, a precious-metal compound, nickel or a nickel compound as the active substance)",24237728
201902,502,United States,381590,"Reaction initiators, reaction accelerators and catalytic preparations, n.e.s. (excluding rubber accelerators and supported catalysts)",2593290
201902,502,United States,381600,"Refractory cements, mortars, concretes and similar compositions, other than products of heading 38.01.",302565
201902,502,United States,381700,"Mixed alkylbenzenes and mixed alkylnaphthalenes, other than those of heading 27.07 or 29.02.",308518
201902,502,United States,381800,"Chemical elements doped for use in electronics, in the form of discs, wafers or similar forms; chemical compounds doped for use in electronics. form of",7681178
201902,502,United States,381900,"Hydraulic brake fluids and other prepared liquids for hydraulic transmission, not containing or containing less than 70% by weight of petroleum oils or oils obtained from bituminous minerals.",853800
201902,502,United States,382000,Antifreezing preparations and prepared deicing fluids.,347493
201902,502,United States,382100,"Prepared culture media for the development or maintenance of microorganisms (including viruses and the like) or of plant, human or animal cells.",6335128
201902,502,United States,382200,"Diagnostic or laboratory reagents on a backing, prepared diagnostic or laboratory reagents whether or not on a backing, other than those of heading 30.02 or 30.06; certified reference materials.",40946677
201902,502,United States,382311,Stearic acid,11950
201902,502,United States,382312,Oleic acid,9245
201902,502,United States,382313,Tall oil fatty acids,96348
201902,502,United States,382319,"Fatty acids, industrial, monocarboxylic; acid oils from refining (excluding stearic acid, oleic acid and tall oil fatty acids)",143668
201902,502,United States,382370,Industrial fatty alcohols,103643
201902,502,United States,382410,Prepared binders for foundry moulds or cores,38949
201902,502,United States,382430,Nonagglomerated metal carbides mixed together or with metallic binders,168704
201902,502,United States,382440,"Prepared additives for cements, mortars or concretes",139297
201902,502,United States,382478,"Containing perfluorocarbons (PFCs) or hydrofluorocarbons (HFCs), but not containing chlorofluorocarbons (CFCs) or hydrochlorofluorocarbons (HCFCs)",953
201902,502,United States,382479,"Mixtures containing halogenated derivatives of methane, ethane or propane (excluding those of subheadings 3824.71.00 to 3824.78.00)",1288
201902,502,United States,382499,"Chemical products and preparations of the chemical or allied industries, incl. those consisting of mixtures of natural products, n.e.s.",48005880
201902,502,United States,382600,"Biodiesel and mixtures thereof, not containing or containing less than 70% by weight of petroleum oils or oils obtained from bituminous minerals.",332208
201902,502,United States,390110,Polyethylene having a specific gravity of less than 0.94,18748621
201902,502,United States,390120,Polyethylene having a specific gravity of 0.94 or more,5069542
201902,502,United States,390130,Ethylenevinyl acetate copolymers,1947925
201902,502,United States,390140,"Ethylenealphaolefin copolymers, having a specific gravity of less than 0.94",12771693
201902,502,United States,390190,"Polymers of ethylene, in primary forms (excluding polyethylene and ethylene-vinyl acetate copolymers)",8343522
201902,502,United States,390210,Polypropylene,2251935
201902,502,United States,390220,Polyisobutylene,215600
201902,502,United States,390230,Propylene copolymers,606125
201902,502,United States,390290,"Polymers of propylene or of other olefins, in primary forms (excluding polypropylene, polyisobutylene and propylene copolymers)",4205248
201902,502,United States,390311,"Expansible polystyrene, in primary forms",686044
201902,502,United States,390319,"Polystyrene, in primary forms (excluding expansible)",330923
201902,502,United States,390320,Styreneacrylonitrile (SAN) copolymers,109294
201902,502,United States,390330,Acrylonitrilebutadienestyrene (ABS) copolymers,1045878
201902,502,United States,390390,"Polymers of styrene, in primary forms (excluding polystyrene, styrene-acrylonitrile copolymers ""SAN"" and acrylonitrile-butadiene-styrene ""ABS"")",5174390
201902,502,United States,390410,"Poly(vinyl chloride), not mixed with any other substances",20985400
201902,502,United States,390421,Nonplasticised,649260
201902,502,United States,390422,Plasticised,913641
201902,502,United States,390430,Vinyl chloridevinyl acetate copolymers,25381
201902,502,United States,390440,Other vinyl chloride copolymers,13286
201902,502,United States,390450,Vinylidene chloride polymers,2551
201902,502,United States,390461,Polytetrafluoroethylene,941545
201902,502,United States,390469,"Fluoropolymers of vinyl chloride or of other halogenated olefins, in primary forms (excluding polytetrafluoroethylene)",5626607
201902,502,United States,390490,"Polymers of vinyl chloride or other halogenated olefins, in primary forms (excluding poly""vinyl chloride"", copolymers of vinyl chloride, polymers of vinyl chloride and fluoropolymers)",207913
201902,502,United States,390512,"Poly""vinyl acetate"", in aqueous dispersion",156260
201902,502,United States,390519,"Poly""vinyl acetate"", in primary forms (excluding in aqueous dispersion)",115
201902,502,United States,390521,"Vinyl acetate copolymers, in aqueous dispersion",102388
201902,502,United States,390529,"Vinyl acetate copolymers, in primary forms (excluding in aqueous dispersion)",1615
201902,502,United States,390530,"Poly(vinyl alcohol), whether or not containing unhydrolysed acetate groups",501882
201902,502,United States,390591,Copolymers,2993506
201902,502,United States,390599,"Polymers of vinyl esters and other vinyl polymers, in primary forms (excluding those of vinyl chloride or other halogenated olefins, poly""vinyl acetate"", vinyl acetate copolymers and poly""vinyl alcohol"", whether or not containing unhydrolised acetate groups)",2638681
201902,502,United States,390610,"Poly""methyl methacrylate"", in primary forms",274786
201902,502,United States,390690,"Acrylic polymers, in primary forms (excluding poly""methyl methacrylate"")",7396274
201902,502,United States,390710,Polyacetals,2629027
201902,502,United States,390720,Other polyethers,9853772
201902,502,United States,390730,Epoxide resins,4653539
201902,502,United States,390740,Polycarbonates,28076266
201902,502,United States,390750,Alkyd resins,20176
201902,502,United States,390761,"Poly""ethylene terephthalate"", in primary forms, having a viscosity number of 78 ml/g or higher",59436
201902,502,United States,390769,"Poly""ethylene terephthalate"", in primary forms, having a viscosity number of < 78 ml/g",698939
201902,502,United States,390770,Poly(lactic acid),3698227
201902,502,United States,390791,Unsaturated,147349
201902,502,United States,390799,"Saturated polyesters in primary forms (excluding polycarbonates, alkyd resins, poly""ethylene terephthalate"" and poly""lactic acid"")",13415406
201902,502,United States,390810,"Polyamide6, 11, 12, 6,6, 6,9, 6,10 or 6,12 ,in primary forms",16032500
201902,502,United States,390890,"Polyamides, in primary forms (excluding polyamides-6, -11, -12, -6,6, -6,9, -6,10 and -6,12)",10776121
201902,502,United States,390910,Urea resins; thiourea resins,4127
201902,502,United States,390920,Melamine resins,205287
201902,502,United States,390931,"Poly(methylene phenyl isocyanate) (crude MDI, polymeric MDI)",29230
201902,502,United States,390939,"Amino-resins, in primary forms (excl. urea, thiourea and melamine resins and MDI)",11373
201902,502,United States,390940,Phenolic resins,396129
201902,502,United States,390950,Polyurethanes,3144708
201902,502,United States,391000,Silicones in primary forms.,10541336
201902,502,United States,391110,"Petroleum resins, coumarone, indene or coumaroneindene resins and polyterpenes",1747407
201902,502,United States,391190,"Polysulphides, polysulphones and other polymers and prepolymers produced by chemical synthesis, n.e.s., in primary forms",8884646
201902,502,United States,391211,Nonplasticised,5107084
201902,502,United States,391212,Plasticised,421531
201902,502,United States,391231,Carboxymethylcellulose and its salts,44020
201902,502,United States,391239,"Cellulose ethers, in primary forms (excluding carboxymethylcellulose and its salts)",4296328
201902,502,United States,391290,"Cellulose and chemical derivatives thereof, n.e.s., in primary forms (excluding cellulose acetates, cellulose nitrates and cellulose ethers)",3729787
201902,502,United States,391310,"Alginic acid, its salts and esters",9958
201902,502,United States,391390,"Natural polymers and modified natural polymers, e.g. hardened proteins, chemical derivatives of natural rubber, n.e.s., in primary forms (excluding alginic acid and its salts and esters)",1207220
201902,502,United States,391400,"Ionexchangers based on polymers of headings 39.01 to 39.13, in primary forms.",1044070
201902,502,United States,391510,"Waste, parings and scrap, of polymers of ethylene",18085
201902,502,United States,391610,Monofilament of polymers of ethylene,24168
201902,502,United States,391620,Monofilament of polymers of vinyl chloride,4419
201902,502,United States,391690,Monofilament of other plastics,599994
201902,502,United States,391721,"Rigid tubes, pipes and hoses, of polymers of ethylene",178950
201902,502,United States,391722,"Rigid tubes, pipes and hoses, of polymers of propylene",51183
201902,502,United States,391723,"Rigid tubes, pipes and hoses, of polymers of vinyl chloride",131983
201902,502,United States,391729,"Rigid tubes, pipes and hoses, of other plastics",729948
201902,502,United States,391731,"Flexible tubes, pipes and hoses, having a minimum burst pressure of 27.6 Mpa",997958
201902,502,United States,391732,"Other, not reinforced or otherwise combined with other materials,without fittings",3796321
201902,502,United States,391733,"Other, not reinforced or otherwise combined with other materials,without fittings",532761
201902,502,United States,391739,"Flexible tubes, pipes and hoses, of plastics, reinforced or otherwise combined with other materials (excluding those with a burst pressure of ≥ 27,6 MPa)",1430003
201902,502,United States,391740,Fittings,2241360
201902,502,United States,391810,Of polymers of vinyl chloride,140047
201902,502,United States,391890,Of other plastics,1253595
201902,502,United States,391910,"Self-adhesive plates, sheets, film, foil, tape, strip and other flat shapes, of plastics, in rolls ≤ 20 cm wide",4410951
201902,502,United States,391990,"Self-adhesive plates, sheets, film, foil, tape, strip and other flat shapes, of plastics, whether or not in rolls > 20 cm wide (excluding floor, wall and ceiling coverings of heading 3918)",24159765
201902,502,United States,392010,"Plates, sheets, film, foil and strip, of non-cellular polymers of ethylene, not reinforced, laminated, supported or similarly combined with other materials, without backing, unworked or merely surface-worked or merely cut into squares or rectangles (excluding self-adhesive products, and floor, wall and ceiling coverings of heading 3918)",6757050
201902,502,United States,392020,"Plates, sheets, film, foil and strip, of non-cellular polymers of ethylene, not reinforced, laminated, supported or similarly combined with other materials, without backing, unworked or merely surface-worked or merely cut into squares or rectangles (excluding self-adhesive products, and floor, wall and ceiling coverings of heading 3918)",3821190
201902,502,United States,392030,"Plates, sheets, foil, film and strip, of non-cellular polymers of styrene, not reinforced, laminated, supported or similarly combined with other materials, without backing, unworked or merely surface-worked or merely cut into squares or rectangles (excluding self-adhesive products, and floor, wall and ceiling coverings of heading 3918)",140152
201902,502,United States,392043,"Plates, sheets, film, foil and strip, of non-cellular polymers of vinyl chloride, containing by weight ≥ 6% of plasticisers, not reinforced, laminated, supported or similarly combined with other materials, without backing, unworked or merely surface-worked or merely cut into squares or rectangles (excluding self-adhesive products, and floor, wall and ceiling coverings of heading 3918)",172752
201902,502,United States,392049,"Plates, sheets, film, foil and strip, of non-cellular polymers of vinyl chloride, containing by weight < 6% of plasticisers, not reinforced, laminated, supported or similarly combined with other materials, without backing, unworked or merely surface-worked or merely cut into squares or rectangles (excluding self-adhesive products, and floor, wall and ceiling coverings of heading 3918)",1646706
201902,502,United States,392051,"Plates, sheets, film, foil and strip, of non-cellular poly""methyl methacrylate"", not reinforced, laminated, supported or similarly combined with other materials, without backing, unworked or merely surface-worked or merely cut into squares or rectangles (excluding self-adhesive products, and floor, wall and ceiling coverings of heading 3918)",790515
