Date of data,Trading partner code,Trading partner,Commodity code,Commodity,Renminbi Yuan
202501,502,United States,10619,Other mammals,14063906.0
202501,502,United States,10620,Reptiles (including snakes and turtles),28033.0
202501,502,United States,10649,Other insects,1380.0
202501,502,United States,20810,"Meat and edible meat offal of rabbits or hares,fresh, chilled or frozen",1487390.0
202501,502,United States,20890,"Other meat and edible meat offal,fresh, chilled or frozen",1204919.0
202501,502,United States,30111,Ornamental fish of freshwater,312321.0
202501,502,United States,30223,"Sole (Solea spp) ,fresh or chilled",40759.0
202501,502,United States,30289,"Other fish,fresh or chilled",2906399.0
202501,502,United States,30323,"Tilapias (Oreochromis spp) , frozen",7511152.0
202501,502,United States,30324,"Catfish (Pangasius spp, Silurus spp, Clarias spp, Ictalurus spp) , frozen",945719.0
202501,502,United States,30326,"Eels (Anguilla spp) , frozen",965071.0
202501,502,United States,30339,"Other flat fish (Pleuronectidae, Bothidae, Cynoglossidae, Soleidae Scophthalmidae and Citharidae), frozen",120755.0
202501,502,United States,30354,"Mackerel (Scomber scombrus, Scomber australasicus, Scomber japonicus) ,frozen",148079.0
202501,502,United States,30359,"Other herrings (Clupea harengus, Clupea pallasii), anchovies (Engraulis spp.), sardines (Sardina pilchardus, Sardinops spp.), sardinella (Sardinella spp.), brisling or sprats (Sprattus sprattus), mackerel (Scomber scombrus, Scomber australasicus, Scomber japonicus), Indian mackerels (Rastrelliger spp.), seerfishes (Scomberomorus spp), jack and horse mackerel (Trachurus spp.), jacks, crevalles (Caranx spp.), cobia (Rachycentron canadum), silver pomfrets (Pampus spp.), Pacific saury (Cololabis saira), scads (Decapterus spp.), capelin (Mallotus villosus), swordfish (Xiphias gladius), Kawakawa (Euthynnus affinis), bonitos (Sarda spp.), marlins, sailfishes, spearfish (Istiophoridae),frozen",1151780.0
202501,502,United States,30367,"Alaska Pollack (Theragra chalcogramma) ,frozen",382246.0
202501,502,United States,30389,"Other fish ,frozen",84169522.0
202501,502,United States,30391,"Livers, roes and milt,frozen",55897.0
202501,502,United States,30399,"Other fish fins, heads, tails, maws and other edible fish offal,frozen",161550.0
202501,502,United States,30461,Frozen fillets of tilapias (Oreochromis spp),9738976.0
202501,502,United States,30462,"Frozen fillets of catfish (Pangasius spp, Silurus spp, Clarias spp, Ictalurus spp)",6254649.0
202501,502,United States,30469,"Frozen fillets of carp Cyprinus carpio, Carassius carassius, Ctenopharyngodon idellus, Hypophthalmichthys spp., Cirrhinus spp., Mylopharyngodon piceus"", eels ""Anguilla spp."" and snakeheads ""Channa spp.""""",1640207.0
202501,502,United States,30471,"Frozen fillets of cod (Gadus morhua, Gadus ogac, Gadus macrocephalus)",241149918.0
202501,502,United States,30472,Frozen fillets of haddock (Melanogrammus aeglefinus),62616216.0
202501,502,United States,30473,Frozen fillets of coalfish (Pollachius virens),391602.0
202501,502,United States,30474,"Frozen fillets of hake (Merluccius spp, Urophycis spp)",2166454.0
202501,502,United States,30475,Frozen fillets of Alaska Pollock (Theragra chalcogramma),35817126.0
202501,502,United States,30479,"Frozen fillets of fish of the families Bregmacerotidae, Euclichthyidae, Gadidae, Macrouridae, Melanonidae, Merlucciidae, Moridae and Muraenolepididae (excluding cod, haddock, coalfish, hake and Alaska pollack)",1416755.0
202501,502,United States,30481,"Frozen fillets of Pacific salmon (Oncorhynchus nerka, Oncorhynchus gorbuscha, Oncorhynchus keta, Oncorhynchus tschawytscha, Oncorhynchus kisutch, Oncorhynchus masou and Oncorhynchus rhodurus), Atlantic salmon (Salmo salar) and Danube salmon (Hucho hucho)",118054101.0
202501,502,United States,30483,"Frozen fillets of flat fish (Pleuronectidae, Bothidae, Cynoglossidae, Soleidae, Scophthalmidae and Citharidae)",43908749.0
202501,502,United States,30489,"Frozen fish fillets, n.e.s.",19445875.0
202501,502,United States,30495,"Frozen meat, whether or not minced, of fish of the families Bregmacerotidae, Euclichthyidae, Gadidae, Macrouridae, Melanonidae, Merlucciidae, Moridae and Muraenolepididae, other than Alaska Pollack (Theragra chalcogramma)",1513518.0
202501,502,United States,30499,Frozen fish meat n.e.s. (excluding fillets),928733.0
202501,502,United States,30532,"Fillets, dried, salted or in brine, but not smoked, of fish of the families Bregmacerotidae, Euclichthyidae, Gadidae, Macrouridae, Melanonidae, Merlucciidae, Moridae and Muraenolepididae",18130577.0
202501,502,United States,30539,"Fish fillets, dried, salted or in brine, but not smoked (excluding tilapia, catfish, carp, eels, Nile perch, snakeheads and fish of the families Bregmacerotidae, Euclichthyidae, Gadidae, Macrouridae, Melanonidae, Merlucciidae, Moridae and Muraenolepididae)",520415.0
202501,502,United States,30551,"Dried cod (Gadus morhua, Gadus ogac, Gadus macrocephalus)",118730.0
202501,502,United States,30559,"Dried fish, even salted but not smoked (excluding fillets, offal and cod)",417223.0
202501,502,United States,30569,"Other fish, salted or in brine only (excluding fillets, offal, herring, cod, anchovies, tilapia, catfish, carp, eels, Nile perch and snakeheads)",520824.0
202501,502,United States,30572,"Fish heads, tails and maws, smoked, dried, salted or in brine",876360.0
202501,502,United States,30612,Frozen lobsters (Homarus spp),3285949.0
202501,502,United States,30614,Frozen crabs,13645944.0
202501,502,United States,30617,"Frozen shrimps and prawns, even smoked, whether in shell or not, incl. shrimps and prawns in shell, cooked by steaming or by boiling in water (excluding cold-water shrimps and prawns)",33672198.0
202501,502,United States,30636,"Other shrimps and prawns, whether in shell or not, live, fresh or chilled",94.0
202501,502,United States,30695,"Shrimps and prawns,, whether in shell or not, live, fresh or chilled (excl. rock lobster and other sea crawfish, lobsters, crabs, Norway lobsters, shrimps and prawns); flours, meals and pellets of crustaceans, fit for human consumption, fresh or chilled",1339162.0
202501,502,United States,30711,"Oysters, live, fresh, chilled",160010.0
202501,502,United States,30719,"Oysters, smoked, frozen, dried, salted or in brine",97112.0
202501,502,United States,30722,Frozen scallops and other molluscs of the family Pectinidae,68705032.0
202501,502,United States,30729,"Dried, salted or in brine, smoked, scallops and other molluscs of the family Pectinidae",2436836.0
202501,502,United States,30732,"Frozen mussels (Mytilus spp., Perna spp.), with or without shell",178550.0
202501,502,United States,30743,"Frozen cuttle fish and squid, with or without shell",141344848.0
202501,502,United States,30749,"Cuttle fish and squid, smoked, frozen, dried, salted or in brine, with or without shell",295734.0
202501,502,United States,30752,Frozen octopus (Octopus spp.),1651465.0
202501,502,United States,30759,"Octopus (Octopus spp.), smoked, frozen, dried, salted or in brine",288.0
202501,502,United States,30779,"Smoked, frozen, dried, salted or in brine, even in shell, clams, cockles and ark shells families Arcidae, Arcticidae, Cardiidae, Donacidae, Hiatellidae, Mactridae, Mesodesmatidae, Myidae, Semelidae, Solecurtidae, Solenidae, Tridacnidae and Veneridae""""",124124.0
202501,502,United States,30781,"Live, fresh or chilled abalone (Haliotis spp)",38183.0
202501,502,United States,30783,Frozen abalone (Haliotis spp),281806.0
202501,502,United States,30787,"Smoked, dried, salted or in brine, even in shell, abalone (Haliotis spp.)",1680545.0
202501,502,United States,30792,Other frozen Molluscs,229156.0
202501,502,United States,30799,"Other Molluscs,dried/salted/ in brine/smoked",34138.0
202501,502,United States,30811,"Live, fresh or chilled, sea cucumbers (Stichopus japonicus, Holothuroidea)",431.0
202501,502,United States,30830,Jellyfish (Rhopilema spp),3091259.0
202501,502,United States,30890,"Live, fresh, chilled, frozen, dried, salted or in brine, even smoked, aquatic invertebrates (excluding crustaceans, molluscs, sea cucumbers, sea urchins and jellyfish)",16907.0
202501,502,United States,40320,Yogurt,1747384.0
202501,502,United States,40790,"Other birds'eggs, in shell, preserved or cooked",8886528.0
202501,502,United States,40819,Other egg yolks,3257896.0
202501,502,United States,40891,"Dried birds'eggs, not in shell, whether or not sweetened (excluding egg yolks)",469587.0
202501,502,United States,40899,"Other birds'eggs, not in shell, fresh, cooked by steaming or boiling in water, moulded, frozen or otherwise preserved, whether or not sweetened (excluding dried)",867220.0
202501,502,United States,40900,atural honey,20268.0
202501,502,United States,41090,"Other edible products of animal origin, not elsewhere specified or included",5077132.0
202501,502,United States,50210,"Pigs', hogs' or boars' bristles and hair and waste thereof",2422455.0
202501,502,United States,50290,Badger and other brush making hair and waste thereof,2083.0
202501,502,United States,50400,"Guts, bladders and stomachs of animals (other than fish), wholeand pieces thereof, fresh, chilled, frozen, salted, in brine, dried orsmoked",75488909.0
202501,502,United States,50510,Feathers of a kind used for stuffing; down,35236654.0
202501,502,United States,50790,"Tortoiseshell, whalebone, Otherhorns, antlers, hooves, nails, claws and beaks, other powder and waste there of",104801.0
202501,502,United States,50800,"Coral and similar materials, unworked or simply prepared bunot otherwise worked; shells of molluscs, crustaceans or echinoderms and cuttlebone, unworked or simply prepared bunot cut to shape, powder and waste thereof",997245.0
202501,502,United States,51000,"Ambergris, castoreum, civet and musk; cantharides; bile, whether or not dried; glands and other animal products used in the preparation of pharmaceutical products, fresh, chilled, frozen or otherwise provisionally preserved",518.0
202501,502,United States,51191,"Products of fish or crustaceans, molluscs or other aquatic invertebrates; dead animals of Chapter 3",3051539.0
202501,502,United States,51199,"Unkown Products of animal origin, n.e.s., dead animals, unfit for human consumption (excluding fish, crustaceans, molluscs or other aquatic invertebrates)",35582572.0
202501,502,United States,60290,Other live plant,35379397.0
202501,502,United States,60313,"Fresh cut orchids and buds, of a kind suitable for bouquets or for ornamental purposes",5391.0
202501,502,United States,60319,"Fresh cut flowers and buds, of a kind suitable for bouquets or for ornamental purposes",4384369.0
202501,502,United States,60390,"Dried, dyed, bleached, impregnated or otherwise prepared cut flowers and buds, of a kind suitable for bouquets or for ornamental purposes",5212940.0
202501,502,United States,60420,"Foliage, branches and other parts of plants, without flowers or flower buds, and grasses, mosses and lichens, being goods of a kind suitable for bouquets or for ornamental purposes, fresh",14958.0
202501,502,United States,60490,"Foliage, branches and other parts of plants, without flowers or flower buds, and grasses, mosses and lichens, being goods of a kind suitable for bouquets or for ornamental purposes, dried, dyed, bleached, impregnated or otherwise prepared",6554763.0
202501,502,United States,70310,Fresh or chilled onions and shallots,1758079.0
202501,502,United States,70320,Fresh or chilled garlic,94198235.0
202501,502,United States,70951,Fresh or chilled mushrooms of the genus Agaricus,731186.0
202501,502,United States,70952,Fresh or chilled mushrooms of the genus Boletus,3606.0
202501,502,United States,70954,Fresh or chilled shiitake (Lentinus edodes),6492309.0
202501,502,United States,70956,Fresh or chilled truffles (Tuber spp.),328687.0
202501,502,United States,70959,Other fresh or chilled edible mushrooms and truffles,11207782.0
202501,502,United States,70999,Fresh or chilled vegetables n.e.s.,3457692.0
202501,502,United States,71021,Frozen peas (Pisum sativum),563670.0
202501,502,United States,71022,"Frozen beans (Vigna spp., Phaseolus spp.)",487584.0
202501,502,United States,71029,"Leguminous vegetables, shelled or unshelled, uncooked or cooked by steaming or by boiling in water, frozen (excluding peas and beans)",37678091.0
202501,502,United States,71030,"Spinach, New Zealand spinach and orache spinach (garden spinach),frozen.",9684651.0
202501,502,United States,71040,"Sweet corn,frozen.",3870029.0
202501,502,United States,71080,"Other vegetables (uncooked or cooked by steaming or boiling in water),frozen.",41742023.0
202501,502,United States,71090,"Mixtures of vegetables,frozen.",10113047.0
202501,502,United States,71190,Other vegetables; mixtures of vegetables,150888.0
202501,502,United States,71220,"Dried Onions, whole, cut, sliced, broken or in powder, but not further prepared.",5626333.0
202501,502,United States,71231,"Dried Mushrooms of the genus Agaricus, whole, cut, sliced, broken or in powder, but not further prepared.",10896.0
202501,502,United States,71232,"Dried wood ears (Auricularia spp.), whole, cut, sliced, broken or in powder, but not further prepared.",6568736.0
202501,502,United States,71233,"Dried jelly fungi (Tremella spp.), whole, cut, sliced, broken or in powder, but not further prepared.",457080.0
202501,502,United States,71234,Dried shiitake (Lentinus edodes),15952867.0
202501,502,United States,71239,"Dried other mushrooms and truffles, whole, cut, sliced, broken or in powder, but not further prepared.",3142893.0
202501,502,United States,71290,"Dried other vegetables; mixtures of vegetables, whole, cut, sliced, broken or in powder, but not further prepared.",359127740.0
202501,502,United States,71310,"Dried peas (Pisum sativum), shelled, whether or not skinned or split.",46.0
202501,502,United States,71331,"Dried beans of the species Vigna mungo (L.) Hepper or Vigna radiata (L.) Wilczek, shelled, whether or not skinned or split.",7484923.0
202501,502,United States,71332,"Dried small red (Adzuki) beans (Phaseolus or Vigna angularis), shelled, whether or not skinned or split.",1615307.0
202501,502,United States,71333,"Dried kidney beans, including white pea beans (Phaseolus vulgaris), shelled, whether or not skinned or split.",7185.0
202501,502,United States,71335,"Dried cow peas (Vigna unguiculata), shelled, whether or not skinned or split.",19048.0
202501,502,United States,71350,"Dried, shelled broad beans (Vicia faba var. major) and horse beans (Vicia faba var. equina, Vicia faba var. minor)",242.0
202501,502,United States,71390,"Dried, shelled leguminous vegetables, whether or not skinned or split (excluding peas, chickpeas, beans, lentils, broad beans, horse beans and pigeon peas)",322688.0
202501,502,United States,71430,"Yams (Dioscorea spp.), fresh, chilled, frozen or dried, whether or not sliced or in the form of pellets; sago pith.",6245953.0
202501,502,United States,71440,"Taro (Colocasia spp.), fresh, chilled, frozen or dried, whether or not sliced or in the form of pellets; sago pith.",1137755.0
202501,502,United States,71490,"Arrowroot, salep, Jerusalem artichokes and similar roots and tubers with high starch or inulin content, fresh, chilled, frozen or dried, whether or not sliced or in the form of pellets, and sago pith (excluding manioc cassava"", sweet potatoes, yams, taro and yautia)""",7978558.0
202501,502,United States,80232,Shelled walnuts,455364.0
202501,502,United States,80241,In shell chestnuts (Castanea spp.),492378.0
202501,502,United States,80292,"Pine nuts, shelled",48563625.0
202501,502,United States,80299,"Other nuts, fresh or dried",56408.0
202501,502,United States,80390,Fresh or dried bananas (excluding plantains),1657221.0
202501,502,United States,80430,Fresh or dried pineapples,392116.0
202501,502,United States,80450,"Fresh or dried guavas, mangoes and mangosteens",2703713.0
202501,502,United States,80510,Fresh or dried oranges,1920029.0
202501,502,United States,80521,Fresh or dried mandarins (including tangerines and satsumas),9394321.0
202501,502,United States,80540,Fresh or dried grapefruit and pomelos,1019734.0
202501,502,United States,80550,"Fresh or dried lemons (Citrus limon, Citrus limonum) and limes (Citrus aurantifolia, Citrus latifolia)",598011.0
202501,502,United States,80620,Dried Grapes,185877.0
202501,502,United States,80810,Fresh Apples,3166907.0
202501,502,United States,80830,Fresh Pears,19456936.0
202501,502,United States,81110,Frozen Strawberries,113616.0
202501,502,United States,81190,Other Frozen Fruit and nuts,3779035.0
202501,502,United States,81330,Dried Apples,8661506.0
202501,502,United States,81340,Other Dried fruit,46375034.0
202501,502,United States,81350,Mixtures of nuts or dried fruits of this Chapter,6043684.0
202501,502,United States,90111,Coffee not roasted (not decaffeinated),700619.0
202501,502,United States,90121,Coffee roasted (Not decaffeinated ),41778.0
202501,502,United States,90122,Coffee roasted(Decaffeinated ),2197.0
202501,502,United States,90210,Green tea (not fermented) in immediate packings of a content not exceeding 3 kg,13362209.0
202501,502,United States,90220,Other green tea (not fermented) in packings＞3kg,19882610.0
202501,502,United States,90230,"Black tea (fermented) and partly fermented tea, in immediate packings of a content not exceeding 3 kg",3201161.0
202501,502,United States,90240,"Black tea (fermented) and partly fermented tea, in packings exceeding 3 kg",12189807.0
202501,502,United States,90411,Neither crushed nor ground,184657.0
202501,502,United States,90412,Crushed or ground,2313297.0
202501,502,United States,90421,"Dried, neither crushed nor ground",10137523.0
202501,502,United States,90422,Crushed or ground,55508129.0
202501,502,United States,90611,Cinnamon (Cinnamomum zeylanicum Blume),32761.0
202501,502,United States,90619,"Cinnamon and cinnamon-tree flowers (excluding cinnamon Cinnamomum zeylanicum Blume"" and crushed and ground cinnamon)""",252313.0
202501,502,United States,90620,Crushed or ground,581847.0
202501,502,United States,90710,Neither crushed nor ground,192852.0
202501,502,United States,90720,Crushed or ground,11790.0
202501,502,United States,90921,Seeds of coriander Neither crushed nor ground,6956.0
202501,502,United States,90931,Seeds of cumin Neither crushed nor ground,33305.0
202501,502,United States,90932,Seeds of cumin Crushed or ground,164583.0
202501,502,United States,90961,"Seeds of anise, badian, caraway or fennel; juniper berries Neither crushed nor ground",1579769.0
202501,502,United States,90962,"Seeds of anise, badian, caraway or fennel; juniper berries Crushed or ground",4551.0
202501,502,United States,91011,"Seeds of anise, badian, caraway or fennel; juniper berries Neither crushed nor ground",46769512.0
202501,502,United States,91012,"Seeds of anise, badian, caraway or fennel; juniper berries Crushed or ground",7827568.0
202501,502,United States,91030,Turmeric (curcuma),56536.0
202501,502,United States,91091,Mixtures referred to in Note 1 (b) to this Chapter,434428.0
202501,502,United States,91099,Other spices,2859480.0
202501,502,United States,100390,Barley (excluding seed for sowing),4973.0
202501,502,United States,100490,Oats (excluding seed for sowing),11141.0
202501,502,United States,100790,Grain sorghum (excluding seed for sowing),39881.0
202501,502,United States,100810,Buckwheat,7241.0
202501,502,United States,100829,Buckwheat (excluding seed for sowing),123791.0
202501,502,United States,100890,Other cereals,610322.0
202501,502,United States,110290,"Cereal flours (excluding wheat, meslin and maize)",6049.0
202501,502,United States,110412,Rolled or flaked grains of oats,19894.0
202501,502,United States,110422,"Hulled, pearled, sliced, kibbled or otherwise worked oat grains (excluding rolled, flaked, pellets and flour)",22456.0
202501,502,United States,110429,"Grains of cereals, hulled, pearled, sliced, kibbled or otherwise worked (excluding rolled, flaked, flour, pellets, and oats and maize, and husked and semi- or wholly milled rice and broken rice)",1291337.0
202501,502,United States,110430,"Germ of cereals, whole, rolled, flaked or ground",11704.0
202501,502,United States,110620,Of sago or of roots or tubers of heading 07.14,1106272.0
202501,502,United States,110630,Of the products of Chapter 8,7383096.0
202501,502,United States,110813,Potato starch,230310.0
202501,502,United States,110814,Manioc (cassava) starch,19983.0
202501,502,United States,110819,Other starches,880049.0
202501,502,United States,110820,Inulin,8129193.0
202501,502,United States,110900,"Wheat gluten, whether or not dried.",151064.0
202501,502,United States,120190,Other Soya beans,951635.0
202501,502,United States,120600,"Sunflower seeds, whether or not broken.",856929.0
202501,502,United States,120740,Sesamum seeds,426299.0
202501,502,United States,120770,Melon seeds,2546688.0
202501,502,United States,120799,Other oil seeds and oleaginous fruits,2919452.0
202501,502,United States,120890,Flours and meal of oil seeds or oleaginous fruit (excluding soya and mustard),107466.0
202501,502,United States,120925,"Rye grass (Lolium multiflorum Lam., Lolium perenne L.) seeds",3565.0
202501,502,United States,120930,Seeds of herbaceous plants cultivated principally for their flowers,4335371.0
202501,502,United States,120991,Vegetable seeds,18135909.0
202501,502,United States,120999,"Seeds, fruits and spores, for sowing (excluding leguminous vegetables and sweetcorn, coffee, tea, maté and spices, cereals, oil seeds and oleaginous fruits, beets, forage plants, vegetable seeds, and seeds of herbaceous plants cultivated mainly for flowers or used primarily in perfumery, medicaments or for insecticidal, fungicidal or similar purposes)",27941.0
202501,502,United States,121010,"Hop cones, neither ground nor powdered nor in the form of pellets",7.0
202501,502,United States,121120,Ginseng roots,2925054.0
202501,502,United States,121190,"Other plants and parts of plants, of a kind used primarily in perfumery, in pharmacy or for insecticidal, fungicidal or similar purposes",26509313.0
202501,502,United States,121221,Fit for human consumption,2052338.0
202501,502,United States,121291,Sugar beet,306872.0
202501,502,United States,121299,"Fruit stones and kernels and other vegetable products, incl. unroasted chicory roots of the variety cichorium intybus sativum, of a kind used primarily for human consumption, n.e.s.",80509426.0
202501,502,United States,130190,"Lac; natural gums, resins, gum-resins, balsams and other natural oleoresins (excluding gum Arabic)",2515081.0
202501,502,United States,130212,Extracts of liquorice (excluding that with a sucrose content by weight of ＞ 10% or in the form of confectionery),7043510.0
202501,502,United States,130213,Extracts of hops,256905.0
202501,502,United States,130219,"Mucilages and thickeners, derived from locust beans, locust bean seeds or guar seeds, whether or not modified",342399943.0
202501,502,United States,130220,"Pectic substances, pectinates and pectates",4130772.0
202501,502,United States,130231,Agaragar,4944876.0
202501,502,United States,130232,"Mucilages and thickeners, whether or not modified, derived from locust beans, locust bean seeds or guar seeds",1635156.0
202501,502,United States,130239,"Other mucilages and thickeners, derived for vegetable products",16000850.0
202501,502,United States,140110,Bamboos,6166363.0
202501,502,United States,140120,Rattans,86803.0
202501,502,United States,140190,Other vegetable materials of a kind used primarily for plaiting,82050.0
202501,502,United States,140490,Vegetable products not elsewhere specified or included,9770884.0
202501,502,United States,150420,"Fats and oils and their fractions, of fish, other than liver oils",97957943.0
202501,502,United States,150500,Wool grease and fatty substances derived therefrom (including lanolin).,5765474.0
202501,502,United States,150600,"Other animal fats and oils and their fractions, whether or not refined, but not chemically modified.",3589845.0
202501,502,United States,150790,"Soya-bean oil and its fractions, whether or not refined (excluding chemically modified and crude)",72649.0
202501,502,United States,150810,Crude oil of ground-nut,173985.0
202501,502,United States,150890,Other ground-nut oil and its fractions,1143182.0
202501,502,United States,151219,Other oil of sunflower-seed or safflower and its fractions,316394.0
202501,502,United States,151419,"Low erucic acid rape or colza oil fixed oil which has an erucic acid content of ＜ 2%"" and its fractions, whether or not refined, but not chemically modified (excluding crude)""",732067.0
202501,502,United States,151519,"Linseed oil and fractions thereof, whether or not refined, but not chemically modified (excluding crude)",2991811.0
202501,502,United States,151550,Sesame oil and its fractions,4142236.0
202501,502,United States,151560,"Microbial fats and oils and their fractions,not chemically modified",213294.0
202501,502,United States,151590,Other fixed vegetable fats and oils and their fractions,7404132.0
202501,502,United States,151610,Animal fats and oils and their fractions,1097447.0
202501,502,United States,151790,"Other edible fats/oils/fractions of this chptr, excl.that of 15.16",16300035.0
202501,502,United States,151800,"Animal, vegetable or microbial fats and oils and their fractions, boiled, oxidised, dehydrated, sulphurised, blown, polymerised by heat in vacuum or in inert gas or otherwise chemically modified, excluding those of heading 15.16; inedible mixtures or preparations of animal, vegetable or microbial fats or oils or of fractions of different fats or oils of this Chapter, not elsewhere specified or included",130524922.0
202501,502,United States,152110,Vegetable waxes,581232.0
202501,502,United States,152190,"Beeswax, other insect waxes and spermaceti",6685844.0
