Date of data,Trading partner code,Trading partner,Commodity code,Commodity,Renminbi Yuan
201911,502,United States,830630,"Photograph, picture or similar frames, of base metal; mirrors of base metal",27373622
201911,502,United States,830710,"Flexible tubing of iron or steel, with or without fittings",30319190
201911,502,United States,830790,"Flexible tubing of base metal other than iron or steel, with or without fittings",5722690
201911,502,United States,830810,"Hooks, eyes and eyelets, of base metal, of a kind used for clothing, footwear, awnings, handbags, travel goods or other made-up articles",41393107
201911,502,United States,830820,"Tubular or bifurcated rivets, of base metal",9610721
201911,502,United States,830890,"Clasps, frames with clasps without locks, buckles and buckle-clasps, of base metal, for clothing, footwear, handbags, travel goods or other made-up articles, incl. parts of articles of heading 8308, of base metal (excluding hooks, eyes, eyelets and tubular or bifurcated rivets)",3041686
201911,502,United States,830910,Crown corks of base metal,746270
201911,502,United States,830990,"Stoppers, caps and lids, incl. screw caps and pouring stoppers, capsules for bottles, threaded bungs, bung covers, seals and other packing accessories of base metal (excluding crow corks)",45818372
201911,502,United States,831000,"Signplates, nameplates, addressplates and similar plates, numbers, letters and other symbols, of base metal, excluding those of heading 9405",29895305
201911,502,United States,831110,"Coated electrodes of base metal, for electric arc-welding",916762
201911,502,United States,831120,"Cored wire of base metal, for electric arc-welding",649891
201911,502,United States,831130,"Coated rods and cored wire, of base metal, for soldering, brazing or welding by flame (excluding wire and rods cored with solder which, excluding the flux material, contains ≥ 2% by weight of precious metal)",6246447
201911,502,United States,831190,"Wire, rods, tubes, plates, electrodes and the like, of base metal or of metal carbides, coated or cored with flux material, for soldering, brazing, welding or deposition of metal or metal carbides, n.e.s., and wire and rods of agglomerated base metal powder, for metal spraying, n.e.s.",483725
201911,502,United States,840212,Watertube boilers with a steam production not exceeding 45 t per hour,4245
201911,502,United States,840219,"Other vapour generating boilers, including hybrid boilers",1059913
201911,502,United States,840290,"Parts of vapour generating boilers and superheated water boilers, n.e.s.",18832944
201911,502,United States,840310,"Central heating boilers, non-electric (excluding vapour generating boilers and superheated water boilers of heading 8402)",2967622
201911,502,United States,840390,"Parts of central heating boilers, n.e.s.",9212274
201911,502,United States,840410,Auxiliary plant for use with boilers of heading 84.02 or 84.03,12642675
201911,502,United States,840420,Condensers for steam or other vapour power units,15452466
201911,502,United States,840490,"Parts of auxiliary plant of heading 8402 or 8403 and condensers for steam or other vapour power units, n.e.s.",2223830
201911,502,United States,840510,"Producer gas or water gas generators, with or without their purifiers; acetylene gas generators and similar water process gas generators, with or without their purifiers",96747
201911,502,United States,840590,"Parts of producer gas or water gas generators and acetylene gas generators or similar water process gas generators, n.e.s.",332544
201911,502,United States,840690,"Parts of steam and other vapour turbines, n.e.s.",6643483
201911,502,United States,840721,Spark-ignition outboard motors for marine propulsion,44639753
201911,502,United States,840731,"Spark-ignition reciprocating piston engine, of a kind used for the propulsion of vehicles of chapter 87, of a cylinder capacity ≤ 50 ml",75839
201911,502,United States,840732,"Spark-ignition reciprocating piston engine, of a kind used for the propulsion of vehicles of chapter 87, Of a cylinder capacity exceeding 50 cc but not exceeding 250 cc",1048252
201911,502,United States,840733,"Spark-ignition reciprocating piston engine, of a kind used for the propulsion of vehicles of chapter 87, Of a cylinder capacity exceeding 250 cc but not exceeding 1,000 cc",12826765
201911,502,United States,840734,"Spark-ignition reciprocating piston engine, of a kind used for the propulsion of vehicles of chapter 87, Of a cylinder capacity exceeding 1,000 cc",17729912
201911,502,United States,840790,Other engines,159450379
201911,502,United States,840820,Engines of a kind used for the propulsion of vehicles of Chapter 87,8136803
201911,502,United States,840890,Other engines,6120011
201911,502,United States,840910,"Parts suitable for use solely or principally with internal combustion piston engine for aircraft, n.e.s.",1755887
201911,502,United States,840991,"Parts suitable for use solely or principally with spark-ignition internal combustion piston engine, n.e.s.",368790911
201911,502,United States,840999,"Parts suitable for use solely or principally with compression-ignition internal combustion piston engine ""diesel or semi-diesel engine"", n.e.s.",255334693
201911,502,United States,841090,Parts of hydraulic turbines and water wheels incl. regulators,1688578
201911,502,United States,841111,Turbojets of a thrust not exceeding 25 kN,7780096
201911,502,United States,841121,"Turbopropellers of a power not exceeding 1,100 kW",26660
201911,502,United States,841182,"Gas turbines of a power exceeding 5,000 kW",16705204
201911,502,United States,841191,"Parts of turbojets or turbopropellers, n.e.s.",278499208
201911,502,United States,841199,"Parts of gas turbines, n.e.s.",37027572
201911,502,United States,841221,"Hydraulic power engines and motors, linear acting (cylinders)",123766723
201911,502,United States,841229,"Hydraulic power engines and motors (excluding hydraulic turbines and water wheels of heading 8410, steam turbines and hydraulic power engines and motors, linear acting)",29163877
201911,502,United States,841231,"Pneumatic power engines and motors, linear acting (cylinders)",14090454
201911,502,United States,841239,Pneumatic power engines and motors (excluding linear acting),13356597
201911,502,United States,841280,"Engines and motors (excluding steam turbines, internal combustion piston engine, hydraulic turbines, water wheels, gas turbines, reaction engines, hydraulic power engines and motors, pneumatic power engines and motors and electric motors)",3114935
201911,502,United States,841290,"Parts of non-electrical engines and motors, n.e.s.",169561959
201911,502,United States,841311,"Pumps for dispensing fuel or lubricants, of the type used in fillingstations or in garages",2784290
201911,502,United States,841319,"Pumps for liquids, fitted or designed to be fitted with a measuring device (excluding pumps for dispensing fuel or lubricants, of the type used in filling stations or in garages)",4971348
201911,502,United States,841320,"Hand pumps, other than those of subheading 8413.11 or 8413.19",52340025
201911,502,United States,841330,"Fuel, lubricating or cooling medium pumps for internal combustion piston engines",143027882
201911,502,United States,841350,Other reciprocating positive displacement pumps,55830025
201911,502,United States,841360,Other rotary positive displacement pumps,101672653
201911,502,United States,841370,Other centrifugal pumps,163159841
201911,502,United States,841381,"Pumps for liquids, power-driven (excluding those of subheading 8413.11 and 8413.19, fuel, lubricating or cooling medium pumps for internal combustion piston engine, concrete pumps, general reciprocating or rotary positive displacement pumps and centrifugal pumps of all kinds)",44497683
201911,502,United States,841382,Liquid elevators,170738
201911,502,United States,841391,"Parts of pumps for liquids, n.e.s.",311330015
201911,502,United States,841392,"Parts of liquid elevators, n.e.s.",2020949
201911,502,United States,841410,Vacuum pumps,33715163
201911,502,United States,841420,Hand or footoperated air pumps,14320113
201911,502,United States,841430,Compressors of a kind used in refrigerating equipment,85409224
201911,502,United States,841440,Air compressors mounted on a wheeled chassis for towing,1166730
201911,502,United States,841451,"Table, floor, wall, window, ceiling or roof fans, with a selfcontained electric motor of an output not exceeding 125 W",626344454
201911,502,United States,841459,"Fans (excluding table, floor, wall, window, ceiling or roof fans, with a self-contained electric motor of an output ≤ 125 W)",170568460
201911,502,United States,841460,Hoods having a maximum horizontal side not exceeding 120 cm,53986803
201911,502,United States,841480,"Air pumps, air or other gas compressors and ventilating or recycling hoods incorporating a fan, whether or not fitted with filters, having a maximum horizontal side > 120 cm (excluding vacuum pumps, hand- or foot-operated air pumps, compressors for refrigerating equipment and air compressors mounted on a wheeled chassis for towing)",227156317
201911,502,United States,841490,"Parts of: air or vacuum pumps, air or other gas compressors, fans and ventilating or recycling hoods incorporating a fan, n.e.s.",238144361
201911,502,United States,841510,"Air conditioning machines of a kind designed to be fixed to a window, wall, ceiling or floor, selfcontained or .splitsystem.",185021409
201911,502,United States,841520,"Air conditioning machines of a kind used for persons, in motor vehicles",18100289
201911,502,United States,841581,Air conditioning machines incorporating a refrigerating unit and a valve for reversal of the cooling/heat cycle (reversible heat pumps),5451537
201911,502,United States,841582,"Other, air conditioning machines incorporating a refrigerating unit",11926609
201911,502,United States,841583,"Air conditioning machines,not incorporating a refrigerating unit",1065822
201911,502,United States,841590,"Parts of air conditioning machines, comprising a motor-driven fan and elements for changing the temperature and humidity, n.e.s.",367298697
201911,502,United States,841610,Furnace burners for liquid fuel,1026349
201911,502,United States,841620,"Other furnace burners, including combination burners",1032829
201911,502,United States,841690,"Parts of furnace burners such as mechanical stokers, incl. their mechanical grates, mechanical ash dischargers and similar appliances, n.e.s.",3359059
201911,502,United States,841710,"Furnaces and ovens for the roasting, melting or other heattreatment of ores, pyrites or of metals",645373
201911,502,United States,841720,"Bakery ovens, including biscuit ovens",4048882
201911,502,United States,841780,"Industrial or laboratory furnaces and ovens, non-electric, incl. incinerators (excluding those for the roasting, melting or other heat treatment of ores, pyrites or metals, bakery ovens, drying ovens and ovens for cracking operations)",8275879
201911,502,United States,841790,"Parts of industrial or laboratory furnaces, non-electric, incl. incinerators, n.e.s.",4516470
201911,502,United States,841810,"Combined refrigeratorfreezers, fitted with separate external doors",170554362
201911,502,United States,841821,"Household refrigerators, compression-type",150229091
201911,502,United States,841829,"Household refrigerators, absorption-type",23642675
201911,502,United States,841830,"Freezers of the chest type, of a capacity ≤ 800L",78636901
201911,502,United States,841840,"Freezers of the upright type, of a capacity ≤ 900L",39299829
201911,502,United States,841850,"Furniture (chests, cabinets, display counters, show-cases and the like) for storage and display, incorporating refrigerating or freezing equipment (excluding combined refrigerator-freezers with separate external doors, household refrigerators and freezers of the chest type of a capacity ≤ 800L or of the upright type of a capacity ≤ 900L)",172288408
201911,502,United States,841861,Heat pumps other than air conditioning machines of heading 84.15,1987733
201911,502,United States,841869,Refrigerating or freezing equipment (excluding refrigerating and freezing furniture),72464410
201911,502,United States,841891,Furniture designed to receive refrigerating or freezing equipment,485788
201911,502,United States,841899,"Parts of refrigerating or freezing equipment and heat pumps, n.e.s.",127683395
201911,502,United States,841911,Instantaneous gas water heaters,6629254
201911,502,United States,841919,"Instantaneous or storage water heaters, non-electric (excluding instantaneous gas water heaters and boilers or water heaters for central heating)",362961
201911,502,United States,841920,"Medical, surgical or laboratory sterilisers",22976247
201911,502,United States,841939,"Dryers (excluding dryers for agricultural products, for wood, paper pulp, paper or paperboard, for yarns, fabrics and other textile products, dryers for bottles or other containers, hairdryers, hand dryers and domestic appliances)",11895535
201911,502,United States,841940,Distilling or rectifying plant,17554987
201911,502,United States,841950,Heat exchange units,47536460
201911,502,United States,841960,Machinery for liquefying air or other gases,20806224
201911,502,United States,841981,"Machinery, plant and equipment for making hot drinks or for cooking or heating food (excluding domestic appliances)",59431374
201911,502,United States,841989,"Machinery, plant or laboratory equipment, whether or not electrically heated, for the treatment of materials by a process involving a change of temperature such as heating, cooking, roasting, sterilising, pasteurising, steaming, evaporating, vaporising, condensing or cooling, n.e.s. (excluding machinery used for domestic purposes and furnaces, ovens and other equipment of heading 8514)",83695871
201911,502,United States,841990,"Parts of machinery, plant and laboratory equipment, whether or not electrically heated, for the treatment of materials by a process involving a change of temperature, and of non-electric instantaneous and storage water heaters, n.e.s.",85121877
201911,502,United States,842010,Calendering or other rolling machines,2089143
201911,502,United States,842091,Cylinders,12335
201911,502,United States,842099,"Parts for calendering or rolling machines, n.e.s. (other than for metals or glass and excluding cylinders)",289867
201911,502,United States,842112,Centrifugal clothes-dryers,134694
201911,502,United States,842119,"Centrifuges, incl. centrifugal dryers (excluding isotope separators, cream separators and clothes dryers)",16391137
201911,502,United States,842121,Machinery and apparatus for filtering or purifying water,95827803
201911,502,United States,842122,Machinery and apparatus for filtering or purifying beverages (excludingwater),493
201911,502,United States,842123,Oil or petrol-filters for internal combustion engines,67914126
201911,502,United States,842129,"Machinery and apparatus for filtering or purifying liquids (excluding such machinery and apparatus for water and other beverages, oil or petrol-filters for internal combustion engines and artificial kidneys)",45294641
201911,502,United States,842131,Intake air filters for internal combustion engines,44880392
201911,502,United States,842139,Machinery and apparatus for filtering or purifying gases (excluding isotope separators and intake air filters for internal combustion engines),220998231
201911,502,United States,842191,"Parts of centrifuges, incl. centrifugal dryers, n.e.s.",15412141
201911,502,United States,842199,"Parts of machinery and apparatus for filtering or purifying liquids or gases, n.e.s.",214143532
201911,502,United States,842211,Dishwashing machines of the household type,78690252
201911,502,United States,842220,Machinery for cleaning or drying bottles or other containers (excluding dishwashing machines),744560
201911,502,United States,842230,"Machinery for filling, closing, sealing or labelling bottles, cans, boxes, bags or other containers; machinery for capsuling bottles, jars, tubes and similar containers; machinery for aerating beverages",45174206
201911,502,United States,842240,"Packing or wrapping machinery, incl. heat-shrink wrapping machinery (excluding machinery for filling, closing, sealing or labelling bottles, cans, boxes, bags or other containers and machinery for capsuling bottles, jars, tubes and similar containers)",22546588
201911,502,United States,842290,"Parts of dishwashing machines, packing or wrapping machinery and other machinery and apparatus of heading 8422, n.e.s.",30627867
201911,502,United States,842310,"Personal weighing machines, incl. baby scales; household scales",112920895
201911,502,United States,842320,Scales for continuous weighing of goods on conveyors,34961
201911,502,United States,842330,"Constant weight scales and scales for discharging a pre-determined weight of material into a bag or container, incl. hopper scales (excluding scales for continuous weighing of goods on conveyors)",4994926
201911,502,United States,842381,"Weighing machinery having a maximum weighing capacity ≤ 30 kg (excluding balances of a sensitivity of 5 cg or better, personal weighing machines, household scales, scales for continuous weighing of goods on conveyors, constant weight scales and scales for discharging a pre-determined weight of material into a bag or container, incl. hopper scales)",22212172
201911,502,United States,842382,"Weighing machinery of a maximum weighing capacity > 30 kg but ≤ 5.000 kg (excluding personal weighing machines, scales for continuous weighing of goods on conveyors, constant weight scales and scales for discharging a pre-determined weight of material into a bag or container, incl. hopper scales)",17850380
201911,502,United States,842389,Weighing machinery of a maximum weighing capacity > 5.000 kg,643646
201911,502,United States,842390,"Weighing machine weights of all kinds; parts of weighing machinery, n.e.s.",13363817
201911,502,United States,842410,"Fire extinguishers, whether or not charged",7750053
201911,502,United States,842420,Spray guns and similar appliances,68561157
201911,502,United States,842430,Steam or sand blasting machines and similar jet projecting machines,39309074
201911,502,United States,842441,"Agricultural or horticultural sprayers, portable",11283046
201911,502,United States,842449,Agricultural or horticultural sprayers (excl. portable),2193119
201911,502,United States,842482,"Agricultural or horticultural mechanical appliances, whether or not hand-operated, for projecting or dispersing liquids or powders (excl. sprayers)",43087738
201911,502,United States,842489,"Mechanical appliances, whether or not hand-operated, for projecting, dispersing or spraying liquids or powders, n.e.s.",145492343
201911,502,United States,842490,"Parts of fire extinguishers, spray guns and similar appliances, steam or sand blasting machines and similar jet projecting machines and machinery and apparatus for projecting, dispersing or spraying liquids or powders, n.e.s.",144452032
201911,502,United States,842511,"Pulley tackle and hoists, powered by electric motor (other than skip hoists or hoists of a kind used for raising vehicles)",4893997
201911,502,United States,842519,"Pulley tackle and hoists (other than skip hoists or hoists of a kind used for raising vehicles), non-powered by electric motor",17961876
201911,502,United States,842531,Winches and capstans powered by electric motor,65730456
201911,502,United States,842539,"Winches and capstans, non-powered by electric motor",10562733
201911,502,United States,842541,Built-in jacking systems of a type used in garages,4542029
201911,502,United States,842542,"Jacks and hoists, hydraulic (excluding built-in jacking systems used in garages)",172872959
201911,502,United States,842549,"Jacks and hoists of a kind used for raising vehicles, not hydraulic",77056074
201911,502,United States,842611,Overhead travelling cranes on fixed support,1089494
201911,502,United States,842612,Mobile lifting frames on tyres and straddle carriers,185695
201911,502,United States,842619,"Overhead travelling cranes, transporter cranes, gantry cranes, bridge cranes and mobile lifting frames (excluding overhead travelling cranes on fixed support, mobile lifting frames on tyres, straddle carriers and portal or pedestal jib cranes)",204083285
201911,502,United States,842620,Tower cranes,5983639
201911,502,United States,842630,Portal or pedestal jib cranes,60679
201911,502,United States,842641,"Mobile cranes and works trucks fitted with a crane, self-propelled, on tyres (excluding wheel-mounted cranes, mobile lifting frames on tyres and straddle carriers)",7661002
201911,502,United States,842649,"Mobile cranes and works trucks fitted with a crane, self-propelled (excluding those on tyres and straddle carriers)",2323299
201911,502,United States,842691,Cranes designed for mounting on road vehicles,415276
201911,502,United States,842699,"Ships' derricks; cranes, incl. cable cranes (excluding overhead travelling cranes, transporter cranes, gantry cranes, portal or pedestal jib cranes, bridge cranes, mobile lifting frames and straddle carriers, tower cranes, works trucks fitted with a crane, mobile cranes and cranes designed for mounting on road vehicles)",932085
201911,502,United States,842710,Selfpropelled trucks powered by an electric motor,56726770
201911,502,United States,842720,Other selfpropelled trucks,55804979
201911,502,United States,842790,"Works trucks fitted with lifting or handling equipment, not self-propelled",53533536
201911,502,United States,842810,Lifts and skip hoists,2291149
201911,502,United States,842820,Pneumatic elevators and conveyors,760344
201911,502,United States,842831,"Continuous-action elevators and conveyors, for goods or materials, specially designed for underground use",107534
201911,502,United States,842832,"Continuous-action elevators and conveyors, for goods or materials, bucket type",598155
201911,502,United States,842833,"Continuous-action elevators and conveyors, for goods or materials, belt type",16205964
201911,502,United States,842839,"Continuous-action elevators and conveyors, for goods or materials (excluding those for underground use and bucket, belt or pneumatic types)",28222150
201911,502,United States,842840,Escalators and moving walkways,10917152
201911,502,United States,842890,"Machinery for lifting, handling, loading or unloading, n.e.s.",106278700
201911,502,United States,842920,Graders and levellers,3466879
201911,502,United States,842930,Scrapers,2812493
201911,502,United States,842940,Tamping machines and road rollers,24201684
201911,502,United States,842951,Frontend shovel loaders,54826544
201911,502,United States,842952,Machinery with a 360刟 revolving superstructure,182563650
201911,502,United States,842959,"Self-propelled mechanical shovels, excavators and shovel loaders (excluding self-propelled mechanical shovels with a 360° revolving superstructure and front-end shovel loaders)",13689
201911,502,United States,843010,Piledrivers and pileextractors,7136072
201911,502,United States,843020,Snowploughs and snowblowers,46368021
201911,502,United States,843041,"Other, self-propelled boring or sinking machinery for boring earth or extracting minerals or ores",323379
201911,502,United States,843049,"Other, boring or sinking machinery for boring earth or extracting minerals or ores, not self-propelled and not hydraulic",336165
201911,502,United States,843050,"Other machinery, selfpropelled",17273847
201911,502,United States,843061,"Tamping or compacting machinery, not self-propelled (excluding hand-operated tools)",3000417
201911,502,United States,843069,"Earth moving machinery, not self-propelled, n.e.s.",40041487
201911,502,United States,843110,Part of machinery of heading 84.25,35338351
201911,502,United States,843120,Part of machinery of heading 84.27,136526088
201911,502,United States,843131,"Part off lifts, skip hoists or escalators, of heading 84.28",103466460
201911,502,United States,843139,"Parts of machinery of heading 8428, n.e.s.",56149076
201911,502,United States,843141,"Buckets, shovels, grabs and grips",24483210
201911,502,United States,843143,Parts for boring or sinking machinery of subheading 8430.41 or,120029002
201911,502,United States,843149,"Parts of machinery of heading 8426, 8429 and 8430, n.e.s.",497233525
201911,502,United States,843210,Ploughs,2325750
201911,502,United States,843229,"Harrows, scarifiers, cultivators, weeders and hoes for use in agriculture, horticulture or forestry (excluding disc harrows)",8984374
201911,502,United States,843231,"Notill direct seeders, planters and transplanters",1153000
201911,502,United States,843239,"No-till direct seeders, planters and transplanters",759672
201911,502,United States,843241,"Seeders, planters and transplanters (excl. no-till machines)",781304
201911,502,United States,843242,Fertiliser distributors,9003
201911,502,United States,843280,"Agricultural, horticultural or forestry machinery for soil preparation or cultivation; lawn or sports-ground rollers (excluding sprayers and dusters, ploughs, harrows, scarifiers, cultivators, weeders, hoes, seeders, planters, manure spreaders and fertiliser distributors)",2702298
201911,502,United States,843290,"Parts of agricultural, horticultural or forestry machinery for soil preparation or cultivation or of lawn or sports-ground rollers, n.e.s.",40710211
201911,502,United States,843311,"Powered, with the cutting device rotating in a horizontal plane",252261431
201911,502,United States,843319,"Mowers for lawns, parks or sports grounds, powered, with the cutting device rotating in a vertical plane or with cutter bars",7980426
201911,502,United States,843320,"Other mowers, including cutter bars for tractor mounting",394161
201911,502,United States,843330,Other haymaking machinery,167208
