Date of data,Trading partner code,Trading partner,Commodity code,Commodity,Renminbi Yuan
201911,502,United States,392094,"Plates, sheets, film, foil and strip, of non-cellular phenolic resins, not reinforced, laminated, supported or similarly combined with other materials, without backing, unworked or merely surface-worked or merely cut into squares or rectangles (excluding self-adhesive products, floor, wall and ceiling coverings of heading 3918)",1068163
201911,502,United States,392099,"Plates, sheets, film, foil and strip, of non-cellular plastics, n.e.s., not reinforced, laminated, supported or similarly combined with other materials, without backing, unworked or merely surface-worked or merely cut into squares or rectangles (excluding self-adhesive products, floor, wall and ceiling coverings of heading 3918 and sterile surgical or dental adhesion barriers of subheading 3006.10.30)",34968024
201911,502,United States,392111,"Plates, sheets, film, foil and strip, of polymers of styrene",4293730
201911,502,United States,392112,"Plates, sheets, film, foil and strip, of polymers of vinyl chloride",29837131
201911,502,United States,392113,"Plates, sheets, film, foil and strip, of polyurethanes",20947571
201911,502,United States,392114,"Plates, sheets, film, foil and strip, of regenerated cellulose",265478
201911,502,United States,392119,"Plates, sheets, film, foil and strip, of other plastics",22584908
201911,502,United States,392190,"Plates, sheets, film, foil and strip, (excluding of cellular plastic; self-adhesive products, floor, wall and ceiling coverings of heading 3918)",64632484
201911,502,United States,392210,"Baths, showerbaths, sinks and washbasins",69101605
201911,502,United States,392220,Lavatory seats and covers,38468948
201911,502,United States,392290,"Bidets, lavatory pans, flushing cisterns and similar sanitary ware, of plastics (excluding baths, shower-baths, sinks, washbasins, lavatory seats and covers)",13664711
201911,502,United States,392310,"Boxes, cases, crates and similar articles",171276847
201911,502,United States,392321,"Sacks and bags, incl. cones, of polymers of ethylene",359219540
201911,502,United States,392329,"Sacks and bags, incl. cones, of other plastics",169199784
201911,502,United States,392330,"Carboys, bottles, flasks and similar articles",225256576
201911,502,United States,392340,"Spools, cops, bobbins and similar supports",11527379
201911,502,United States,392350,"Stoppers, lids, caps and other closures",171365728
201911,502,United States,392390,"Articles for the conveyance or packaging of goods, of plastics (excluding boxes, cases, crates and similar articles; sacks and bags, incl. cones; carboys, bottles, flasks and similar articles; spools, spindles, bobbins and similar supports; stoppers, lids, caps and other closures)",125052985
201911,502,United States,392410,Tableware and kitchenware,1315152753
201911,502,United States,392490,"Household articles and toilet articles, of plastics (excluding tableware, kitchenware, baths, shower-baths, washbasins, bidets, lavatory pans, seats and covers, flushing cisterns and similar sanitary ware)",696955010
201911,502,United States,392510,"Reservoirs, tanks, vats and similar containers, of a capacity exceeding 300 l",1573789
201911,502,United States,392520,"Doors, windows and their frames and thresholds for doors",42005297
201911,502,United States,392530,"Shutters, blinds (including Venetian blinds) and similar articles and parts thereof",96720860
201911,502,United States,392590,Other,80029462
201911,502,United States,392610,Office or school supplies,139366378
201911,502,United States,392620,"Articles of apparel and clothing accessories (including gloves, mittens and mitts)",537572387
201911,502,United States,392630,"Fittings for furniture, coachwork or the like",63680081
201911,502,United States,392640,Statuettes and other ornamental articles,558654885
201911,502,United States,392690,"Articles of plastics and articles of other materials of heading 3901 to 3914, n.e.s (excluding goods of 9619)",2231029603
201911,502,United States,400122,Technically specified natural rubber (TSNR),4245
201911,502,United States,400129,"Natural rubber in primary forms or in plates, sheets or strip (excluding smoked sheets, technically specified natural rubber ""TSNR"" and natural rubber latex, whether or not prevulcanised)",2955
201911,502,United States,400211,Latex,3254
201911,502,United States,400219,"Styrene-butadiene rubber ""SBR""; carboxylated styrene-butadiene rubber ""XSBR"", in primary forms or in plates, sheets or strip (excluding latex)",1611544
201911,502,United States,400231,Isobuteneisoprene (butyl) rubber (IIR),16639
201911,502,United States,400249,"Chloroprene ""chlorobutadiene rubber, CR"", in primary forms or in plates, sheets or strip (excluding latex)",1311986
201911,502,United States,400259,"Acrylonitrile-butadiene rubber ""NBR"", in primary forms or in plates, sheets or strip (excluding latex)",379983
201911,502,United States,400260,Isoprene rubber (IR),925951
201911,502,United States,400270,Ethylenepropylenenonconjugated diene rubber (EPDM),140889
201911,502,United States,400280,Mixtures of any product of heading 40.01 with any product of this heading,2570
201911,502,United States,400291,Latex,64
201911,502,United States,400299,"Synthetic rubber and factice derived from oils, in primary forms or in plates, sheets or strip (excluding latex, styrene-butadiene rubber ""SBR"", carboxylated styrene-butadiene rubber ""XSBR"", butadiene rubber ""BR"", isobutylene isoprene rubber ""IIR"", halo-isobutene-isoprene rubber ""CIIR"" or ""BIIR"", chloroprene rubber ""CR"", acrylonitrile-butadiene rubber ""NBR"", isoprene rubber ""IR"" and non-conjugated ethylene-propylene diene rubber ""EPDM"")",2033487
201911,502,United States,400300,"Reclaimed rubber in primary forms or in plates, sheets or strip.",5557911
201911,502,United States,400510,Compounded with carbon black or silica,118607
201911,502,United States,400591,"Compounded rubber, unvulcanised, in the form of plates, sheets or strip",8624
201911,502,United States,400599,"Other compounded, unvulcanised rubber in primary forms",231127
201911,502,United States,400610,ìCamelback? strips for retreading rubber tyres,28675
201911,502,United States,400690,"Rods, bars, tubes, profiles and other forms of unvulcanised rubber, incl. mixed rubber, and articles of unvulcanised rubber, incl. mixed rubber (excluding plates, sheets and strip which, apart from basic surface-working, have not been cut, or have merely been cut into square or rectangular shapes, and 'camel-back' strips)",192621
201911,502,United States,400700,Vulcanised rubber thread and cord.,3846162
201911,502,United States,400811,"Plates, sheets and strip, of cellular rubber",2499917
201911,502,United States,400819,"Rods and profile shapes, of cellular rubber",387531
201911,502,United States,400821,"Plates, sheets and strip, of non-cellular rubber",9691861
201911,502,United States,400829,"Rods, tubes and profile shapes, of non-cellular rubber",1026704
201911,502,United States,400911,"Tubes, pipes and hoses, of vulcanised rubber (excluding hard rubber), not reinforced or otherwise combined with other materials, without fittings",7492050
201911,502,United States,400912,"Tubes, pipes and hoses, of vulcanised rubber (excluding hard rubber), not reinforced or otherwise combined with other materials, with fittings",10266507
201911,502,United States,400921,"Tubes, pipes and hoses, of vulcanised rubber (excluding hard rubber), reinforced or otherwise combined only with metal, without fittings",9245673
201911,502,United States,400922,"Tubes, pipes and hoses, of vulcanised rubber (excluding hard rubber), reinforced or otherwise combined only with metal, with fittings",10962317
201911,502,United States,400931,"Tubes, pipes and hoses, of vulcanised rubber (excluding hard rubber), reinforced or otherwise combined only with textile materials, without fittings",18152521
201911,502,United States,400932,"Tubes, pipes and hoses, of vulcanised rubber (excluding hard rubber), reinforced or otherwise combined only with textile materials, with fittings",13797362
201911,502,United States,400941,"Tubes, pipes and hoses, of vulcanised rubber (excluding hard rubber), reinforced or otherwise combined with materials other than metal or textile materials, without fittings",775772
201911,502,United States,400942,"Tubes, pipes and hoses, of vulcanised rubber (excluding hard rubber), reinforced or otherwise combined with materials other than metal or textile materials, with fittings",10102406
201911,502,United States,401011,"Conveyor belts or belting, of vulcanised rubber, reinforced only with metal",2088456
201911,502,United States,401012,"Conveyor belts or belting, of vulcanised rubber, reinforced only with textile materials",20454053
201911,502,United States,401019,"Conveyor belts or belting, of vulcanised rubber (excluding reinforced only with metal or only with textile materials)",248465
201911,502,United States,401031,"Endless transmission belts of trapezoidal crosssection (Vbelts), Vribbed, of an outside circumference exceeding 60 cm but not exceeding 180 cm",1806577
201911,502,United States,401032,"Endless transmission belts of trapezoidal crosssection (Vbelts), other than Vribbed, of an outside circumference exceeding 60 cm but not exceeding 180 cm",1641599
201911,502,United States,401033,"Endless transmission belts of trapezoidal crosssection (Vbelts), Vribbed, of an outside circumference exceeding 180 cm but not exceeding 240 cm",760828
201911,502,United States,401034,"Endless transmission belts of trapezoidal crosssection (Vbelts), other than Vribbed, of an outside circumference exceeding 180 cm but not exceeding 240 cm",211709
201911,502,United States,401035,"Endless synchronous belts, of an outside circumference exceeding 60 cm but not exceeding 150 cm",1901921
201911,502,United States,401036,"Endless synchronous belts, of an outside circumference exceeding 150 cm but not exceeding 198 cm",9946
201911,502,United States,401039,Other,20434147
201911,502,United States,401110,"New pneumatic tyres, of rubber, of a kind used on motor cars (including station wagons and racing cars)",69189866
201911,502,United States,401120,"New pneumatic tyres, of rubber, of a kind used on buses or lorries",270011449
201911,502,United States,401130,"New pneumatic tyres, of rubber, of a kind used on aircraft",337083
201911,502,United States,401140,"New pneumatic tyres, of rubber, of a kind used on motorcycles",11925382
201911,502,United States,401150,"New pneumatic tyres, of rubber, of a kind used on bicycles",4144749
201911,502,United States,401170,"New pneumatic tyres, of rubber, of a kind used on agricultural or forestry vehicles and machines",39859466
201911,502,United States,401180,"New pneumatic tyres, of rubber, of a kind used on construction, mining or industrial handling vehicles and machines",24750924
201911,502,United States,401190,"Other new pneumatic tyres, of rubber, o",96139099
201911,502,United States,401220,Used pneumatic tyres,3494848
201911,502,United States,401290,"Solid or cushion tyres, interchangeable tyre treads and tyre flaps, of rubber",24808046
201911,502,United States,401310,"Inner tubes, of rubber, of a kind used on motor cars (including station wagons and racingcars), buses or lorries",1584177
201911,502,United States,401320,"Inner tubes, of rubber, of a kind used on bicycles",9027541
201911,502,United States,401390,"Inner tubes, of rubber (excluding those of a kind used on motor cars, incl. station wagons and racing cars, buses, lorries and bicycles)",2952791
201911,502,United States,401410,Sheath contraceptives,290270
201911,502,United States,401490,"Hygienic or pharmaceutical articles, incl. teats, of vulcanised rubber (excluding hard rubber), with or without fittings of hard rubber, n.e.s. (excluding sheath contraceptives and articles of apparel and clothing accessories, incl. gloves, for all purposes)",1713381
201911,502,United States,401511,Surgical,56397858
201911,502,United States,401519,"Gloves, mittens and mitts, of vulcanised rubber (excluding surgical gloves)",70080897
201911,502,United States,401590,"Articles of apparel and clothing accessories, for all purposes, of vulcanised rubber (excluding hard rubber and footwear and headgear and parts thereof, and gloves, mittens and mitts)",4361435
201911,502,United States,401610,Articles of rubber,7537942
201911,502,United States,401691,Floor coverings and mats,14119182
201911,502,United States,401692,Erasers,9662268
201911,502,United States,401693,"Gaskets, washers and other seals",125162025
201911,502,United States,401694,"Boat or dock fenders, whether or not inflatable",4163484
201911,502,United States,401695,Other inflatable articles,1981070
201911,502,United States,401699,"Articles of vulcanised rubber (excluding hard rubber), n.e.s",142698500
201911,502,United States,401700,"Hard rubber (for example, ebonite) in all forms, including waste and scrap; articles of hard rubber.",4038357
201911,502,United States,410449,"Hides and skins of bovine ""incl. buffalo"" or equine animals, in the dry state ""crust"", without hair on, whether or not split (excluding further prepared and full grains, unsplit and grain splits)",3475
201911,502,United States,410712,"Grain splits leather ""incl. parchment-dressed leather"", of the whole hides and skins of bovine ""incl. buffalo"" or equine animals, further prepared after tanning or crusting, without hair on (excluding chamois leather, patent leather and patent laminated leather, and metallised leather)",9841970
201911,502,United States,410719,"Leather ""incl. parchment-dressed leather"" of the whole hides and skins of bovine ""incl. buffalo"" or equine animals, further prepared after tanning or crusting, without hair on (excluding unsplit full grains leather, grain splits leather, chamois leather, patent leather and patent laminated leather, and metallised leather)",813
201911,502,United States,410791,"Full grains leather ""incl. parchment-dressed leather"", unsplit, of the portions, strips or sheets of hides and skins of bovine ""incl. buffalo"" or equine animals, further prepared after tanning or crusting, without hair on (excluding chamois leather, patent leather and patent laminated leather, and metallised leather)",28540
201911,502,United States,410792,"Grain splits leather ""incl. parchment-dressed leather"", of the portions, strips or sheets of hides and skins of bovine ""incl. buffalo"" or equine animals, further prepared after tanning or crusting, without hair on (excluding chamois leather, patent leather and patent laminated leather, and metallised leather)",100841
201911,502,United States,410799,"Leather ""incl. parchment-dressed leather"" of the portions, strips or sheets of hides and skins of bovine ""incl. buffalo"" or equine animals, further prepared after tanning or crusting, without hair on (excluding unsplit full grains leather, grain splits leather, chamois leather, patent leather and patent laminated leather, and metallised leather)",62552
201911,502,United States,411420,Patent leather and patent laminated leather; metallised leather,212
201911,502,United States,411510,"Composition leather with a basis of leather or leather fibre, inslabs, sheets or strip, whether or not in rolls",41096
201911,502,United States,420100,"Saddlery and harness for any animal, incl. traces, leads, knee pads, muzzles, saddle cloths, saddlebags, dog coats and the like, of any material",98182907
201911,502,United States,420211,"Trunks, suitcases, vanity cases, executive-cases, briefcases, school satchels and similar containers, with outer surface of leather, composition leather or patent leather",19968132
201911,502,United States,420212,"Trunks, suitcases, vanity cases, executive-cases, briefcases, school satchels and similar containers, with outer surface of plastics or textile materials",712778040
201911,502,United States,420219,"Trunks, suitcases, vanity cases, executive-cases, briefcases, school satchels and similar containers (excluding with outer surface of leather, composition leather, patent leather,",8060380
201911,502,United States,420221,"Handbags, whether or not with shoulder straps, incl. those without handles, with outer surface of leather, composition leather or patent leather",100371625
201911,502,United States,420222,"Handbags, whether or not with shoulder straps, incl. those without handles, with outer surface of plastic sheeting or textile materials",372413843
201911,502,United States,420229,"Handbags, whether or not with shoulder strap, incl. those without handle, with outer surface of vulcanised fibre or paperboard, or wholly or mainly covered with such materials or with paper",1249387
201911,502,United States,420231,"Wallets, purses, key-pouches, cigarette-cases, tobacco-pouches and similar articles carried in the pocket or handbag, with outer surface of leather, composition leather or patent leather",32757607
201911,502,United States,420232,"Wallets, purses, key-pouches, cigarette-cases, tobacco-pouches and similar articles carried in the pocket or handbag, with outer surface of plastic sheeting or textile materials",160939767
201911,502,United States,420239,"Wallets, purses, key-cases, cigarette-cases, tobacco-pouches and similar articles of a kind normally carried in the pocket or handbag, with outer surface of vulcanised fibre or paperboard, or wholly or mainly covered with such materials or with paper, incl. spectacle cases of moulded plastic material",3331918
201911,502,United States,420291,"Travelling-bags, insulated food or beverage bags, toilet bags, rucksacks, shopping-bags, map-cases, tool bags, sports bags, jewellery boxes, cutlery cases, binocular cases, camera cases, musical instrument cases, gun cases, holsters and similar containers, with outer surface of leather, composition leather or patent leather (excluding trunks, briefcases, school satchels and similar containers, handbags and articles normally carried in the pocket or handbag)",9298417
201911,502,United States,420292,"Travelling-bags, insulated food or beverage bags, toilet bags, rucksacks, shopping-bags, map-cases, tool bags, sports bags, jewellery boxes, cutlery cases, binocular cases, camera cases, musical instrument cases, gun cases, holsters and similar containers, with outer surface of plastic sheeting or textile materials (excluding trunks, briefcases, school satchels and similar containers, handbags and articles carried in the pocket or handbag)",842709586
201911,502,United States,420299,"Travelling-bags, shopping or tool bags, jewellery boxes, cutlery cases and similar, with outer surface of vulcanised fibre or paperboard; cases for binoculars, cameras, musical instruments, guns, holsters and similar containers with outer surface of materials (not leather, plastic sheeting or textile materials) (excluding trunks, briefcases, school satchels and similar; handbags; articles normally carried in pocket or handbag)",27006949
201911,502,United States,420310,Articles of apparel,8874718
201911,502,United States,420321,Specially designed for use in sports,19291001
201911,502,United States,420329,"Gloves, mittens and mitts, of leather or composition leather (excluding special sports gloves)",94486425
201911,502,United States,420330,Belts and bandoliers,35581441
201911,502,United States,420340,Other clothing accessories,9497067
201911,502,United States,420500,Other articles of leather or of composition leather.,71001628
201911,502,United States,430219,"Other tanned or dressed furskins, whole, with or without heads, tails or paws, not assembled",91670
201911,502,United States,430220,"Heads, tails, paws and other pieces or cuttings, not assembled",446094
201911,502,United States,430310,Articles of apparel and clothing accessories,20303525
201911,502,United States,430390,"Articles of furskin (excluding articles of apparel, clothing accessories and goods of chapter 95, e.g. toys, games and sports equipment)",4650776
201911,502,United States,430400,Artificial fur and articles thereof.,2659693
201911,502,United States,440122,"Wood in chips or particles (excluding those of a kind used principally for dying or tanning purposes, and coniferous wood)",1351
201911,502,United States,440139,"Sawdust and wood waste and scrap, whether or not agglomerated in logs, briquettes or similar forms (excluding pellets)",2830
201911,502,United States,440210,"Bamboo charcoal, incl. shell or nut charcoal, whether or not agglomerated",1791360
201911,502,United States,440290,"Wood charcoal, incl. shell or nut charcoal, whether or not agglomerated",838536
201911,502,United States,440420,Nonconiferous,760001
201911,502,United States,440711,"Pine (Pinus spp.) sawn or chipped lengthwise, sliced or peeled, whether or not planed, sanded or end-jointed, of a thickness of > 6 mm",228694
201911,502,United States,440719,"Coniferous wood sawn or chipped lengthwise, sliced or peeled, whether or not planed, sanded or end-jointed, of a thickness of > 6 mm (excl. pine ""Pinus spp."", fir ""Abies spp."" and spruce ""Picea spp."")",10522422
201911,502,United States,440799,"Wood, sawn or chipped lengthwise, sliced or peeled, whether or not planed, sanded or end-jointed, of a thickness of > 6 mm",14454111
201911,502,United States,440831,"Sheets for veneering, incl. those obtained by slicing laminated wood, for plywood or for other similar laminated wood and other wood, sawn lengthwise, sliced or peeled, whether or not planed, sanded, spliced or end-jointed, of a thickness of ≤ 6 mm, of dark red meranti, light red meranti and meranti bakau",219313
201911,502,United States,440890,"Sheets for veneering, incl. those obtained by slicing laminated wood, for plywood or for other similar laminated wood and other wood, sawn lengthwise, sliced or peeled, whether or not planed, sanded, spliced or end-jointed, of a thickness of ≤ 6 mm (excluding tropical wood specified in Subheading Note 2 to this chapter and coniferous wood)",3892367
201911,502,United States,440910,"Coniferous wood, incl. strips and friezes for parquet flooring, not assembled, continuously shaped ""tongued, grooved, rebated, chamfered, V-jointed beaded, moulded, rounded or the like"" along any of its edges, ends or faces, whether or not planed, sanded or end-jointed",2946332
201911,502,United States,440921,"Bamboo, incl. strips and friezes for parquet flooring, not assembled, continuously shaped ""tongued, grooved, rebated, chamfered, V-jointed beaded, moulded, rounded or the like"" along any of its edges, ends or faces, whether or not planed, sanded or end-jointed",32248229
201911,502,United States,440922,"Tropical wood, incl. strips and friezes for parquet flooring, not assembled, continuously shaped ""tongued, grooved, rebated, chamfered, V-jointed beaded, moulded, rounded or the like"" along any of its edges, ends or faces, whether or not planed, sanded or end-jointed",6513356
201911,502,United States,440929,"Wood, incl. strips and friezes for parquet flooring, not assembled, continuously shaped ""tongued, grooved, rebated, chamfered, V-jointed beaded, moulded, rounded or the like"" along any of its edges, ends or faces, whether or not planed, sanded or end-jointed (excluding coniferous wood and bamboo)",18494171
201911,502,United States,441011,"Particle board of wood, whether or not agglomerated with resins or other organic binding substances (excluding oriented strand board and waferboard, fibreboard and cellular wood panels)",1257014
201911,502,United States,441012,"Oriented strand board ""OSB"", of wood",138400
201911,502,United States,441019,"Waferboard and similar board, of wood, whether or not agglomerated with resins or other organic binding substances (excluding particle board, oriented strand board, fibreboard and cellular wood panels)",70066
201911,502,United States,441090,"Board of bagasse, bamboo or cereal straw particles or other ligneous materials, whether or not agglomerated with resins or other organic binding substances (excluding of wood, and fibreboard, cellular wood panels, veneered panels, panels of ligneous materials agglomerated with cement, plaster or other mineral binders)",870311
201911,502,United States,441112,Medium density fibreboard (MDF) of a thickness not exceeding 5 mm,1094885
201911,502,United States,441113,Medium density fibreboard (MDF) of a thickness exceeding 5 mm but not exceeding 9 mm,12924317
201911,502,United States,441114,Medium density fibreboard (MDF) of a thickness exceeding 9 mm,54679226
201911,502,United States,441192,"Other ligneous materials,of a density exceeding 0.8 g/cm3",9480362
201911,502,United States,441193,"Other ligneous materials,of a density exceeding 0.5 g/cm3 but not exceeding 0.8 g/cm3",16381
201911,502,United States,441210,"Plywood, veneered panel and similar laminated wood, of bamboo,",25183896
201911,502,United States,441231,"Other plywood, consisting solely of sheets of wood (other than bamboo), each ply not exceeding 6 mm thickness With at least one outer ply of tropical wood",842527
201911,502,United States,441233,"Other, with at least one outer ply of nonconiferous wood of the species alder (Alnus spp.), ash (Fraxinus spp.), beech (Fagus spp.), birch (Betula spp.), cherry (Prunus spp.), chestnut (Castanea spp.), elm (Ulmus spp.), eucalyptus(Eucalyptus spp.), hickory (Carya spp.), horse chestnut (Aesculus spp.), lime (Tilia spp.), maple (Acer spp.), oak (Quercus spp.), plane tree (Platanus spp.), poplar and aspen (Populus spp.), robinia (Robinia spp.), tulipwood (Liriodendron spp.) or walnut (Juglans spp.)",21606992
201911,502,United States,441234,"Other, with at least one outer ply of nonconiferous wood not specified under subheading 4412.33",2559532
201911,502,United States,441239,"Other, with both outer plies of coniferous wood",35863843
