Date of data,Trading partner code,Trading partner,Commodity code,Commodity,Renminbi Yuan
201911,502,United States,611241,"Women's or girls' swimwear of synthetic fibres, knitted or crocheted",247990227
201911,502,United States,611249,"Women's or girls' swimwear of textile materials, knitted or crocheted (excluding synthetic fibres)",91209
201911,502,United States,611300,"Garments, knitted or crocheted, rubberised or impregnated, coated or covered with plastics or other materials (excluding babies' garments and clothing accessories)",42815347
201911,502,United States,611420,Of cotton,30816129
201911,502,United States,611430,Of manmade fibres,217356160
201911,502,United States,611490,Of other textile materials,3287651
201911,502,United States,611510,"Graduated compression hosiery [e.g., stockings for varicose veins], of textile materials, knitted or crocheted (excluding hosiery for babies)",339102
201911,502,United States,611521,"Pantyhose and tights of synthetic fibres, knitted or crocheted, measuring per single yarn < 67 decitex (excluding graduated compression hosiery)",28874238
201911,502,United States,611522,"Pantyhose and tights of synthetic fibres, knitted or crocheted, measuring per single yarn ≥ 67 decitex (excluding graduated compression hosiery)",5310166
201911,502,United States,611529,"Pantyhose and tights of textile materials, knitted or crocheted (excluding graduated compression hosiery, those of synthetic fibres and hosiery for babies)",3820355
201911,502,United States,611530,"Women's full-length or knee-length hosiery, knitted or crocheted, measuring per single yarn < 67 decitex (excluding graduated compression hosiery, pantyhose and tights)",4557939
201911,502,United States,611594,"Full-length or knee-length stockings, socks and other hosiery, incl. footwear without applied soles, of wool or fine animal hair, knitted or crocheted (excluding graduated compression hosiery, pantyhose and tights, women's full-length or knee-length stockings, measuring per single yarn < 67 decitex, and hosiery for babies)",5762959
201911,502,United States,611595,"Full-length or knee-length stockings, socks and other hosiery, incl. footwear without applied soles, of cotton, knitted or crocheted (excluding graduated compression hosiery, pantyhose and tights, women's full-length or knee-length stockings, measuring per single yarn < 67 decitex, and hosiery for babies)",148040761
201911,502,United States,611596,"Full-length or knee-length stockings, socks and other hosiery, incl. footwear without applied soles, of synthetic fibres, knitted or crocheted (excluding graduated compression hosiery, pantyhose and tights, women's full-length or knee-length stockings, measuring per single yarn < 67 decitex, and hosiery for babies)",573202285
201911,502,United States,611599,"Full-length or knee-length stockings, socks and other hosiery, incl. footwear without applied soles, of textile materials, knitted or crocheted (excluding of wool, fine animal hair, cotton or synthetic fibres, graduated compression hosiery, pantyhose and tights, women's full-length or knee-length stockings, measuring per single yarn < 67 decitex, and hosiery for babies)",5841886
201911,502,United States,611610,"Gloves, mittens and mitts, impregnated, coated or covered with plastics or rubber, knitted or crocheted",187347318
201911,502,United States,611691,"Gloves, mittens and mitts, of wool or fine animal hair, knitted or crocheted (excluding for babies)",1173606
201911,502,United States,611692,"Gloves, mittens and mitts, of cotton, knitted or crocheted (excluding impregnated, coated or covered with plastics or rubber, and for babies)",24872025
201911,502,United States,611693,"Gloves, mittens and mitts, of synthetic fibres, knitted or crocheted (excluding impregnated, coated or covered with plastics or rubber, and for babies)",56667700
201911,502,United States,611699,"Gloves, mittens and mitts, of textile materials, knitted or crocheted (excluding of wool, fine animal hair, cotton or synthetic fibres, impregnated, coated or covered with plastics or rubber, and for babies)",11994757
201911,502,United States,611710,"Shawls, scarves, mufflers, mantillas, veils and the like, knitted or crocheted",81834045
201911,502,United States,611780,"Ties, bow ties, cravats and other made-up clothing accessories, knitted or crocheted, n.e.s. (excluding shawls, scarves, mufflers, mantillas, veils and the like)",36074831
201911,502,United States,611790,"Parts of garments or clothing accessories, knitted or crocheted, n.e.s.",3177089
201911,502,United States,620111,"Men's or boys' overcoats, raincoats, car coats, capes, cloaks and similar articles, of wool or fine animal hair",4376602
201911,502,United States,620112,"Men's or boys' overcoats, raincoats, car coats, capes, cloaks and similar articles, of cotton",2334508
201911,502,United States,620113,"Men's or boys' overcoats, raincoats, car coats, capes, cloaks and similar articles, of man-made fibres",18928453
201911,502,United States,620119,"Men's or boys' overcoats, raincoats, car coats, capes, cloaks and similar articles, of textile materials (excluding of wool or fine animal hair, cotton or man-made fibres, knitted or crocheted)",1506381
201911,502,United States,620191,"Men's or boys' anoraks, incl. ski jackets, windcheaters, wind-jackets and similar articles, of wool or fine animal hair (excluding knitted or crocheted, suits, ensembles, jackets, blazers and trousers)",1895266
201911,502,United States,620192,"Men's or boys' anoraks, windcheaters, wind jackets and similar articles, of cotton (not knitted or crocheted and excluding suits, ensembles, jackets, blazers, trousers and tops of ski suits)",26057357
201911,502,United States,620193,"Men's or boys' anoraks, windcheaters, wind jackets and similar articles, of man-made fibres (not knitted or crocheted and excluding suits, ensembles, jackets, blazers, trousers and tops of ski suits)",127981666
201911,502,United States,620211,"Women's or girls' overcoats, raincoats, car coats, capes, cloaks and similar articles, of wool or fine animal hair",7900533
201911,502,United States,620212,"Women's or girls' overcoats, raincoats, car coats, capes, cloaks and similar articles, of cotton",8387948
201911,502,United States,620213,"Women's or girls' overcoats, raincoats, car coats, capes, cloaks and similar articles, of man-made fibres",47769190
201911,502,United States,620219,"Women's or girls' overcoats, raincoats, car coats, capes, cloaks and similar articles, of textile materials (excluding of wool or fine animal hair, cotton or man-made fibres, knitted or crocheted)",1770737
201911,502,United States,620291,"Women's or girls' anoraks, incl. ski jackets, windcheaters, wind-jackets and similar articles, of wool or fine animal hair (excluding knitted or crocheted, suits, ensembles, jackets, blazers and trousers)",2110628
201911,502,United States,620292,"Women's or girls' anoraks, windcheaters, wind jackets and similar articles, of cotton (not knitted or crocheted and excluding suits, ensembles, jackets, blazers, trousers and tops of ski suits)",33996006
201911,502,United States,620293,"Women's or girls' anoraks, windcheaters, wind jackets and similar articles, of man-made fibres (not knitted or crocheted and excluding suits, ensembles, jackets, blazers, trousers and tops of ski suits)",158955051
201911,502,United States,620299,"Women's or girls' anoraks, incl. ski jackets, windcheaters, wind-jackets and similar articles, of textile materials (excluding of wool, fine animal hair, cotton or man-made fibres, knitted or crocheted, suits, ensembles, jackets, blazers and trousers)",683334
201911,502,United States,620311,"Men's or boys' suits of wool or fine animal hair (excluding knitted or crocheted, tracksuits, ski suits and swimwear)",45289169
201911,502,United States,620312,"Men's or boys' suits of synthetic fibres (excluding knitted or crocheted, tracksuits, ski suits and swimwear)",29064795
201911,502,United States,620319,"Men's or boys' suits of textile materials (excluding of wool, fine animal hair or synthetic fibres, knitted or crocheted, tracksuits, ski suits and swimwear)",7399282
201911,502,United States,620322,"Men's or boys' ensembles of cotton (excluding knitted or crocheted, ski ensembles and swimwear)",3200866
201911,502,United States,620323,"Men's or boys' ensembles of synthetic fibres (excluding knitted or crocheted, ski ensembles and swimwear)",1125747
201911,502,United States,620329,"Men's or boys' ensembles of textile materials (excluding of cotton or synthetic fibres, knitted or crocheted, ski ensembles and swimwear)",840268
201911,502,United States,620331,"Men's or boys' jackets and blazers of wool or fine animal hair (excluding knitted or crocheted, and wind-jackets and similar articles)",19726796
201911,502,United States,620332,"Men's or boys' jackets and blazers of cotton (excluding knitted or crocheted, and wind-jackets and similar articles)",54601722
201911,502,United States,620333,"Men's or boys' jackets and blazers of synthetic fibres (excluding knitted or crocheted, and wind-jackets and similar articles)",63316216
201911,502,United States,620339,"Men's or boys' jackets and blazers of textile materials (excluding of wool, fine animal hair, cotton or synthetic fibres, knitted or crocheted, and wind-jackets and similar articles)",6206151
201911,502,United States,620341,"Men's or boys' trousers, bib and brace overalls, breeches and shorts, of wool or fine animal hair (excluding knitted or crocheted, underpants and swimwear)",14579629
201911,502,United States,620342,"Men's or boys' trousers, bib and brace overalls, breeches and shorts, of cotton (excluding knitted or crocheted, underpants and swimwear)",360451829
201911,502,United States,620343,"Men's or boys' trousers, bib and brace overalls, breeches and shorts of synthetic fibres (excluding knitted or crocheted, underpants and swimwear)",158299312
201911,502,United States,620349,"Men's or boys' trousers, bib and brace overalls, breeches and shorts of textile materials (excluding of wool, fine animal hair, cotton or synthetic fibres, knitted or crocheted, underpants and swimwear)",10307251
201911,502,United States,620411,"Women's or girls' suits of wool or fine animal hair (excluding knitted or crocheted, ski overalls and swimwear)",28349
201911,502,United States,620412,"Women's or girls' suits of cotton (excluding knitted or crocheted, ski overalls and swimwear)",33902
201911,502,United States,620413,"Women's or girls' suits of synthetic fibres (excluding knitted or crocheted, ski overalls and swimwear)",1893267
201911,502,United States,620419,"Women's or girls' suits of textile materials (excluding of wool, fine animal hair, cotton or synthetic fibres, knitted or crocheted, ski overalls and swimwear)",187440
201911,502,United States,620422,"Women's or girls' ensembles of cotton (excluding knitted or crocheted, ski overalls and swimwear)",5458563
201911,502,United States,620423,"Women's or girls' ensembles of synthetic fibres (excluding knitted or crocheted, ski overalls and swimwear)",11506847
201911,502,United States,620429,"Women's or girls' ensembles of textile materials (excluding of wool, fine animal hair, cotton or synthetic fibres, knitted or crocheted, ski overalls and swimwear)",2208227
201911,502,United States,620431,"Women's or girls' jackets and blazers of wool or fine animal hair (excluding knitted or crocheted, wind-jackets and similar articles)",3841566
201911,502,United States,620432,"Women's or girls' jackets and blazers of cotton (excluding knitted or crocheted, wind-jackets and similar articles)",190100946
201911,502,United States,620433,"Women's or girls' jackets and blazers of synthetic fibres (excluding knitted or crocheted, wind-jackets and similar articles)",171685620
201911,502,United States,620439,"Women's or girls' jackets and blazers of textile materials (excluding of wool, fine animal hair, cotton or synthetic fibres, knitted or crocheted, wind-jackets and similar articles)",39463303
201911,502,United States,620441,Women's or girls' dresses of wool or fine animal hair (excluding knitted or crocheted and petticoats),397272
201911,502,United States,620442,Women's or girls' dresses of cotton (excluding knitted or crocheted and petticoats),58056811
201911,502,United States,620443,Women's or girls' dresses of synthetic fibres (excluding knitted or crocheted and petticoats),324926220
201911,502,United States,620444,Women's or girls' dresses of artificial fibres (excluding knitted or crocheted and petticoats),64367778
201911,502,United States,620449,"Women's or girls' dresses of textile materials (excluding of wool, fine animal hair, cotton or man-made fibres, knitted or crocheted and petticoats)",20587956
201911,502,United States,620451,Women's or girls' skirts and divided skirts of wool or fine animal hair (excluding knitted or crocheted and petticoats),346130
201911,502,United States,620452,Women's or girls' skirts and divided skirts of cotton (excluding knitted or crocheted and petticoats),43068079
201911,502,United States,620453,Women's or girls' skirts and divided skirts of synthetic fibres (excluding knitted or crocheted and petticoats),55961873
201911,502,United States,620459,"Women's or girls' skirts and divided skirts of textile materials (excluding of wool, fine animal hair, cotton or synthetic fibres, knitted or crocheted and petticoats)",15785803
201911,502,United States,620461,"Women's or girls' trousers, bib and brace overalls, breeches and shorts of wool or fine animal hair (excluding knitted or crocheted, panties and swimwear)",2010759
201911,502,United States,620462,"Women's or girls' trousers, bib and brace overalls, breeches and shorts of cotton (excluding knitted or crocheted, panties and swimwear)",1031954561
201911,502,United States,620463,"Women's or girls' trousers, bib and brace overalls, breeches and shorts of synthetic fibres (excluding knitted or crocheted, panties and swimwear)",134645616
201911,502,United States,620469,"Women's or girls' trousers, bib and brace overalls, breeches and shorts of textile materials (excluding of wool, fine animal hair, cotton or synthetic fibres, knitted or crocheted, panties and swimwear)",97215500
201911,502,United States,620520,"Men's or boys' shirts of cotton (excluding knitted or crocheted, nightshirts, singlets and other vests)",148850719
201911,502,United States,620530,"Men's or boys' shirts of man-made fibres (excluding knitted or crocheted, nightshirts, singlets and other vests)",54202160
201911,502,United States,620590,"Men's or boys' shirts of textile materials (excluding of cotton or man-made fibres, knitted or crocheted, nightshirts, singlets and other vests)",41151898
201911,502,United States,620610,"Women's or girls' blouses, shirts and shirt-blouses of silk or silk waste (excluding knitted or crocheted and vests)",12507101
201911,502,United States,620620,"Women's or girls' blouses, shirts and shirt-blouses of wool or fine animal hair (excluding knitted or crocheted and vests)",135506
201911,502,United States,620630,"Women's or girls' blouses, shirts and shirt-blouses of cotton (excluding knitted or crocheted and vests)",34427335
201911,502,United States,620640,"Women's or girls' blouses, shirts and shirt-blouses of man-made fibres (excluding knitted or crocheted and vests)",78614681
201911,502,United States,620690,"Women's or girls' blouses, shirts and shirt-blouses of textile materials (excluding of silk, silk waste, wool, fine animal hair, cotton or man-made fibres, knitted or crocheted and vests)",7833238
201911,502,United States,620711,Men's or boys' underpants and briefs of cotton,6225134
201911,502,United States,620719,Men's or boys' underpants and briefs of textile materials (excluding cotton and knitted or crocheted),827327
201911,502,United States,620721,"Men's or boys' nightshirts and pyjamas of cotton (excluding knitted or crocheted, vests, singlets and underpants)",3783270
201911,502,United States,620722,"Men's or boys' nightshirts and pyjamas of man-made fibres (excluding knitted or crocheted, vests, singlets and underpants)",1197147
201911,502,United States,620729,"Men's or boys' nightshirts and pyjamas of textile materials (excluding of cotton or man-made fibres, knitted or crocheted, vests, singlets and underpants)",39311
201911,502,United States,620791,"Men's or boys' singlets and other vests, bathrobes, dressing gowns and similar articles of cotton (excluding knitted or crocheted, underpants, nightshirts and pyjamas)",6320720
201911,502,United States,620799,"Men's or boys' singlets and other vests, bathrobes and dressing gowns of textile materials (excluding of cotton, knitted or crocheted, underpants, nightshirts and pyjamas)",22012212
201911,502,United States,620811,Women's or girls' slips and petticoats of man-made fibres (excluding knitted or crocheted and vests),1031657
201911,502,United States,620819,"Women's or girls' slips and petticoats of textile materials (excluding man-made fibres, knitted or crocheted and vests)",131988
201911,502,United States,620821,"Women's or girls' nightdresses and pyjamas of cotton (excluding knitted or crocheted, vests and négligés)",14215890
201911,502,United States,620822,"Women's or girls' nightdresses and pyjamas of man-made fibres (excluding knitted or crocheted, vests and négligés)",22455002
201911,502,United States,620829,"Women's or girls' nightdresses and pyjamas of textile materials (excluding cotton and man-made fibres, knitted or crocheted, vests and négligés)",9374197
201911,502,United States,620891,"Women's or girls' singlets and other vests, briefs, panties, négligés, bathrobes, dressing gowns, housecoats and similar articles of cotton (excluding knitted or crocheted, slips, petticoats, nightdresses and pyjamas, brassières, girdles, corsets and similar articles)",9659007
201911,502,United States,620892,"Women's or girls' singlets and other vests, briefs, panties, négligés, bathrobes, dressing gowns, housecoats and similar articles of man-made fibres (excluding knitted or crocheted, slips, petticoats, nightdresses and pyjamas, brassières, girdles, corsets and similar articles)",31846542
201911,502,United States,620899,"Women's or girls' singlets and other vests, briefs, panties, négligés, bathrobes, dressing gowns, housecoats and similar articles of textile materials (excluding of cotton or man-made fibres, knitted or crocheted, slips, petticoats, nightdresses and pyjamas, brassières, girdles, corsets and similar articles)",4129809
201911,502,United States,620920,"Babies' garments and clothing accessories of cotton (excluding knitted or crocheted and hats, napkins and napkin liners [see 9619])",35735904
201911,502,United States,620930,"Babies' garments and clothing accessories of synthetic fibres (excluding knitted or crocheted and hats, napkins and napkin liners [see 9619])",15615659
201911,502,United States,620990,"Babies' garments and clothing accessories of textile materials (excluding of cotton or synthetic fibres, knitted or crocheted and hats, napkins and napkin liners [see 9619])",1894319
201911,502,United States,621010,"Garments made up of felt or nonwovens, whether or not impregnated, coated, covered or laminated (excluding babies' garments and clothing accessories)",211157955
201911,502,United States,621020,"Garments of the type described in subheading 6201,11 to 6201,19, rubberised or impregnated, coated, covered or laminated with plastics or other substances",27194747
201911,502,United States,621030,"Garments of the type described in subheading 6202,11 to 6202,19, rubberised or impregnated, coated, covered or laminated with plastics or other substances",5533022
201911,502,United States,621040,"Men's or boys' garments of textile fabrics, rubberised or impregnated, coated, covered or laminated with plastics or other substances (excluding of the type described in subheading 6201,11 to 6201,19, and babies' garments and clothing accessories)",134004436
201911,502,United States,621050,"Women's or girls' garments of textile fabrics, rubberised or impregnated, coated, covered or laminated with plastics or other substances (excluding of the type described in subheading 6202,11 to 6202,19, and babies' garments and clothing accessories)",85750945
201911,502,United States,621111,Men's or boys' swimwear,9086306
201911,502,United States,621112,Women's or girls' swimwear,4925171
201911,502,United States,621120,Ski suits,1850499
201911,502,United States,621132,"Men's or boys' tracksuits and other garments, n.e.s. of cotton",18449576
201911,502,United States,621133,"Men's or boys' tracksuits and other garments, n.e.s. of man-made fibres",63689845
201911,502,United States,621139,"Men's or boys' tracksuits and other garments, n.e.s. of textile materials (excluding of cotton or man-made fibres, knitted or crocheted)",3444729
201911,502,United States,621142,"Women's or girls' tracksuits and other garments, n.e.s. of cotton",60498156
201911,502,United States,621143,"Women's or girls' tracksuits and other garments, n.e.s. of man-made fibres",284895583
201911,502,United States,621149,"Women's or girls' tracksuits and other garments, n.e.s. of textile materials (excluding of cotton or man-made fibres, knitted or crocheted and goods of 9619)",20478730
201911,502,United States,621210,"Brassieres of all types of textile materials, whether or not elasticated, incl. knitted or crocheted",341036820
201911,502,United States,621220,"Girdles and panty girdles of all types of textile materials, whether or not elasticated, incl. knitted or crocheted (excluding belts and corselets made entirely of rubber)",12770680
201911,502,United States,621230,"Corselettes of all types of textile materials, whether or not elasticated, incl. knitted or crocheted",28364837
201911,502,United States,621290,"Corsets, braces, garters, suspenders and similar articles and parts thereof, incl. parts of brassieres, girdles, panty girdles and corselettes, of all types of textile materials, whether or not elasticated, incl. knitted or crocheted (excluding complete brassieres, girdles, panty girdles and corselettes)",9192070
201911,502,United States,621320,"Handkerchiefs of cotton, of which no side exceeds 60 cm",4890848
201911,502,United States,621390,"Handkerchiefs of textile materials, of which no side exceeds 60 cm (excluding of cotton, and knitted or crocheted)",3436310
201911,502,United States,621410,"Shawls, scarves, mufflers, mantillas, veils and similar articles of silk or silk waste",8893125
201911,502,United States,621420,"Shawls, scarves, mufflers, mantillas, veils and similar articles of wool or fine animal hair",4131890
201911,502,United States,621430,"Shawls, scarves, mufflers, mantillas, veils and similar articles of synthetic fibres",58933913
201911,502,United States,621440,"Shawls, scarves, mufflers, mantillas, veils and similar articles of artificial fibres",7112472
201911,502,United States,621490,"Shawls, scarves, mufflers, mantillas, veils and similar articles of textile materials (excluding of silk, silk waste, wool, fine animal hair or man-made fibres, knitted or crocheted)",12892702
201911,502,United States,621510,"Ties, bow ties and cravats of silk or silk waste",12516008
201911,502,United States,621520,"Ties, bow ties and cravats of man-made fibres",18231991
201911,502,United States,621590,"Ties, bow ties and cravats of textile materials (excluding of silk, silk waste or man-made fibres, knitted or crocheted)",1276822
201911,502,United States,621600,"Gloves, mittens and mitts, of all types of textile materials (excluding knitted or crocheted and for babies)",73738064
201911,502,United States,621710,"Made-up clothing accessories, of all types of textile materials, n.e.s.",27510982
201911,502,United States,621790,"Parts of garments or clothing accessories, of all types of textile materials, n.e.s.",1618351
201911,502,United States,630110,Electric blankets of all types of textile materials,47732569
201911,502,United States,630120,Blankets and travelling rugs of wool or fine animal hair,4099324
201911,502,United States,630130,Blankets and travelling rugs of cotton,28503998
201911,502,United States,630140,Blankets and travelling rugs of synthetic fibres,674217862
201911,502,United States,630190,Blankets and travelling rugs of textile materials,8545402
201911,502,United States,630210,"Bedlinen, knitted or crocheted",58069917
201911,502,United States,630221,Printed bedlinen of cotton,25466634
201911,502,United States,630222,Printed bedlinen of man-made fibres,113855661
201911,502,United States,630229,"Printed bedlinen of textile materials (excluding cotton and man-made fibres, knitted or crocheted)",1252667
201911,502,United States,630231,"Bedlinen of cotton (excluding printed, knitted or crocheted)",195307083
201911,502,United States,630232,"Bedlinen of man-made fibres (excluding printed, knitted or crocheted)",486414169
201911,502,United States,630239,"Bedlinen of textile materials (excluding of cotton and man-made fibres, printed, knitted or crocheted)",53566382
201911,502,United States,630240,"Table linen, knitted or crocheted",4072330
201911,502,United States,630251,Table linen of cotton,11078258
201911,502,United States,630253,Table linen of man-made fibres,111553273
201911,502,United States,630259,"Table linen of textile materials (excluding of cotton or man-made fibres, knitted or crocheted)",1947106
201911,502,United States,630260,"Toilet linen and kitchen linen, of terry towelling or similar terry fabrics of cotton (excluding floorcloths, polishing cloths, dishcloths and dusters)",236766804
201911,502,United States,630291,"Toilet linen and kitchen linen of cotton (excluding of terry fabrics, floorcloths, polishing cloths, dishcloths and dusters)",15927308
201911,502,United States,630293,"Toilet linen and kitchen linen of flax (excluding floor-cloths, polishing-cloths, dish-cloths and dusters)",57113031
