Date of data,Trading partner code,Trading partner,Commodity code,Commodity,Renminbi Yuan
202501,502,United States,600610,"Fabrics, knitted or crocheted, of a width of ＞ 30 cm, of wool or fine animal hair",3096.0
202501,502,United States,600621,"Unbleached or bleached cotton fabrics, knitted or crocheted, of a width of ＞ 30 cm",230609.0
202501,502,United States,600622,"Dyed cotton fabrics, knitted or crocheted, of a width of ＞ 30 cm",4440770.0
202501,502,United States,600623,"Cotton fabrics, knitted or crocheted, of yarns of different colours, of a width of ＞ 30 cm",228636.0
202501,502,United States,600624,"Printed cotton fabrics, knitted or crocheted, of a width of ＞ 30 cm",1360305.0
202501,502,United States,600631,"Unbleached or bleached fabrics, knitted or crocheted, of synthetic fibres, of a width of ＞ 30 cm",25269337.0
202501,502,United States,600632,"Dyed fabrics, knitted or crocheted, of synthetic fibres, of a width of ＞ 30 cm",39391026.0
202501,502,United States,600633,"Fabrics, knitted or crocheted, of synthetic fibres, of yarns of different colours, of a width of ＞ 30 cm",11162347.0
202501,502,United States,600634,"Printed fabrics, knitted or crocheted, of synthetic fibres, of a width of ＞ 30 cm",3497973.0
202501,502,United States,600641,"Unbleached or bleached fabrics, knitted or crocheted, of artificial fibres, of a width of ＞ 30 cm",1821043.0
202501,502,United States,600642,"Dyed fabrics, knitted or crocheted, of artificial fibres, of a width of ＞ 30 cm",9228636.0
202501,502,United States,600643,"Fabrics, knitted or crocheted, of artificial fibres, of yarns of different colours, of a width of ＞ 30 cm",6961.0
202501,502,United States,600644,"Printed fabrics, knitted or crocheted, of artificial fibres, of a width of ＞ 30 cm",531634.0
202501,502,United States,600690,"Fabrics, knitted or crocheted, of a width of ＞ 30 cm",443179.0
202501,502,United States,610120,"Overcoats, car coats, capes, cloaks, anoraks, incl. ski jackets, windcheaters, wind-jackets and similar articles of cotton, for men or boys, knitted or crocheted",3685118.0
202501,502,United States,610130,"Overcoats, car coats, capes, cloaks, anoraks, incl. ski jackets, windcheaters, wind-jackets and similar articles of man-made fibres, for men or boys, knitted or crocheted",8478263.0
202501,502,United States,610190,"Overcoats, car coats, capes, cloaks, anoraks, incl. ski jackets, windcheaters, wind-jackets and similar articles of textile materials, for men or boys, knitted or crocheted",313923.0
202501,502,United States,610210,"Women's or girls' overcoats, car coats, capes, cloaks, anoraks, incl. ski jackets, windcheaters, wind-jackets and similar articles, of wool or fine animal hair, knitted or crocheted",1682967.0
202501,502,United States,610220,"Women's or girls' overcoats, car coats, capes, cloaks, anoraks, incl. ski jackets, windcheaters, wind-jackets and similar articles of cotton, knitted or crocheted",3913211.0
202501,502,United States,610230,"Women's or girls' overcoats, car coats, capes, cloaks, anoraks, incl. ski jackets, windcheaters, wind-jackets and similar articles of man-made fibres, knitted or crocheted",22821858.0
202501,502,United States,610290,"Women's or girls' overcoats, car coats, capes, cloaks, anoraks, incl. ski jackets, windcheaters, wind-jackets and similar articles, of textile materials, knitted or crocheted",518037.0
202501,502,United States,610310,"Men's or boys' suits of textile materials, knitted or crocheted",3493723.0
202501,502,United States,610322,"Men's or boys' ensembles of cotton, knitted or crocheted",54947820.0
202501,502,United States,610323,"Men's or boys' ensembles of synthetic fibres, knitted or crocheted",22772920.0
202501,502,United States,610329,Men's or boys' ensembles of textile materials,520796.0
202501,502,United States,610331,"Men's or boys' jackets and blazers of wool or fine animal hair, knitted or crocheted",10216076.0
202501,502,United States,610332,"Men's or boys' jackets and blazers of cotton, knitted or crocheted",52357249.0
202501,502,United States,610333,"Men's or boys' jackets and blazers of synthetic fibres, knitted or crocheted",72377252.0
202501,502,United States,610339,Men's or boys' jackets and blazers of textile materials,1622406.0
202501,502,United States,610341,"Men's or boys' trousers, bib and brace overalls, breeches and shorts of wool or fine animal hair, knitted or crocheted",1524144.0
202501,502,United States,610342,"Men's or boys' trousers, bib and brace overalls, breeches and shorts of cotton, knitted or crocheted",143658980.0
202501,502,United States,610343,"Men's or boys' trousers, bib and brace overalls, breeches and shorts of synthetic fibres, knitted or crocheted",414233448.0
202501,502,United States,610349,"Men's or boys' trousers, bib and brace overalls, breeches and shorts of textile materials, knitted or crocheted",6939281.0
202501,502,United States,610413,"Women's or girls' suits of synthetic fibres, knitted or crocheted",2314637.0
202501,502,United States,610419,"Women's or girls' suits of textile materials, knitted or crocheted",1282152.0
202501,502,United States,610422,"Women's or girls' ensembles of cotton, knitted or crocheted",45776111.0
202501,502,United States,610423,"Women's or girls' ensembles of synthetic fibres, knitted or crocheted",166275134.0
202501,502,United States,610429,Women's or girls' ensembles of textile materials,24286038.0
202501,502,United States,610431,"Women's or girls' jackets and blazers of wool or fine animal hair, knitted or crocheted",18163885.0
202501,502,United States,610432,"Women's or girls' jackets and blazers of cotton, knitted or crocheted",115610934.0
202501,502,United States,610433,"Women's or girls' jackets and blazers of synthetic fibres, knitted or crocheted",258051805.0
202501,502,United States,610439,"Women's or girls' jackets and blazers of textile materials, knitted or crocheted",24349567.0
202501,502,United States,610441,"Women's or girls' dresses of wool or fine animal hair, knitted or crocheted",7598713.0
202501,502,United States,610442,"Women's or girls' dresses of cotton, knitted or crocheted",143442751.0
202501,502,United States,610443,"Women's or girls' dresses of synthetic fibres, knitted or crocheted",663002561.0
202501,502,United States,610444,"Women's or girls' dresses of artificial fibres, knitted or crocheted",106992367.0
202501,502,United States,610449,"Women's or girls' dresses of textile materials, knitted or crocheted",12816706.0
202501,502,United States,610451,"Women's or girls' skirts and divided skirts of wool or fine animal hair, knitted or crocheted",2591525.0
202501,502,United States,610452,"Women's or girls' skirts and divided skirts of cotton, knitted or crocheted",38665391.0
202501,502,United States,610453,"Women's or girls' skirts and divided skirts of synthetic fibres, knitted or crocheted",204754490.0
202501,502,United States,610459,"Women's or girls' skirts and divided skirts of textile materials, knitted or crocheted",28338662.0
202501,502,United States,610461,"Women's or girls' trousers, bib and brace overalls, breeches and shorts of wool or fine animal hair, knitted or crocheted",7554083.0
202501,502,United States,610462,"Women's or girls' trousers, bib and brace overalls, breeches and shorts of cotton, knitted or crocheted",297315026.0
202501,502,United States,610463,"Women's or girls' trousers, bib and brace overalls, breeches and shorts of synthetic fibres, knitted or crocheted",850472987.0
202501,502,United States,610469,"Women's or girls' trousers, bib and brace overalls, breeches and shorts of textile materials, knitted or crocheted",70854052.0
202501,502,United States,610510,"Men's or boys' shirts of cotton, knitted or crocheted (excluding nightshirts, T-shirts, singlets and other vests)",81120165.0
202501,502,United States,610520,"Men's or boys' shirts of man-made fibres, knitted or crocheted (excluding nightshirts, T-shirts, singlets and other vests)",244944270.0
202501,502,United States,610590,"Men's or boys' shirts of textile materials, knitted or crocheted (excluding of cotton or man-made fibres, nightshirts, T-shirts, singlets and other vests)",4581017.0
202501,502,United States,610610,"Women's or girls' blouses, shirts and shirt-blouses of cotton, knitted or crocheted (excluding T-shirts and vests)",20665336.0
202501,502,United States,610620,"Women's or girls' blouses, shirts and shirt-blouses of man-made fibres, knitted or crocheted (excluding T-shirts and vests)",50361476.0
202501,502,United States,610690,"Women's or girls' blouses, shirts and shirt-blouses of textile materials, knitted or crocheted (excluding of cotton or man-made fibres, T-shirts and vests)",515460.0
202501,502,United States,610711,"Men's or boys' underpants and briefs of cotton, knitted or crocheted",36316638.0
202501,502,United States,610712,"Men's or boys' underpants and briefs of man-made fibres, knitted or crocheted",233134662.0
202501,502,United States,610719,"Men's or boys' underpants and briefs of other textile materials, knitted or crocheted (excluding of cotton or man-made fibres)",3574823.0
202501,502,United States,610721,"Men's or boys' nightshirts and pyjamas of cotton, knitted or crocheted (excluding vests and singlets)",11875107.0
202501,502,United States,610722,"Men's or boys' nightshirts and pyjamas of man-made fibres, knitted or crocheted (excluding vests and singlets)",74003421.0
202501,502,United States,610729,"Men's or boys' nightshirts and pyjamas of textile materials, knitted or crocheted (excluding of cotton or man-made fibres, and vests and singlets)",756018.0
202501,502,United States,610791,"Men's or boys' bathrobes, dressing gowns and similar articles of cotton, knitted or crocheted",5774425.0
202501,502,United States,610799,"Men's or boys' bathrobes, dressing gowns and similar articles of textile materials, knitted or crocheted (excluding of cotton)",13504462.0
202501,502,United States,610811,"Women's or girls' slips and petticoats of man-made fibres, knitted or crocheted (excluding T-shirts and vests)",1588163.0
202501,502,United States,610819,"Women's or girls' slips and petticoats of textile materials, knitted or crocheted (excluding man-made fibres, T-shirts and vests)",141678.0
202501,502,United States,610821,"Women's or girls' briefs and panties of cotton, knitted or crocheted",112076732.0
202501,502,United States,610822,"Women's or girls' briefs and panties of man-made fibres, knitted or crocheted",278148458.0
202501,502,United States,610829,"Women's or girls' briefs and panties of textile materials, knitted or crocheted (excluding cotton or man-made fibres)",4834906.0
202501,502,United States,610831,"Women's or girls' nightdresses and pyjamas of cotton, knitted or crocheted (excluding T-shirts, vests and négligés)",80537662.0
202501,502,United States,610832,"Women's or girls' nightdresses and pyjamas of man-made fibres, knitted or crocheted (excluding T-shirts, vests and négligés)",400251977.0
202501,502,United States,610839,"Women's or girls' nightdresses and pyjamas of textile materials, knitted or crocheted (excluding of cotton and man-made fibres, T-shirts, vests and négligés)",5495148.0
202501,502,United States,610891,"Women's or girls' négligés, bathrobes, dressing gowns, housejackets and similar articles of cotton, knitted or crocheted (excluding vests, slips, petticoats, briefs and panties, nightdresses, pyjamas, brassiéres, girdles, corsets and similar articles)",15570366.0
202501,502,United States,610892,"Women's or girls' négligés, bathrobes, dressing gowns, housejackets and similar articles of man-made fibres, knitted or crocheted (excluding vests, slips, petticoats, briefs and panties, nightdresses, pyjamas, brassiéres, girdles, corsets and similar articles)",107132807.0
202501,502,United States,610899,"Women's or girls' négligés, bathrobes, dressing gowns, housejackets and similar articles of textile materials, knitted or crocheted (excluding of cotton or man-made fibres, vests, slips, petticoats, briefs and panties, nightdresses, pyjamas, brassiéres, girdles, corsets and similar articles)",282016.0
202501,502,United States,610910,"T-shirts, singlets and other vests of cotton, knitted or crocheted",1014838626.0
202501,502,United States,610990,"T-shirts, singlets and other vests of textile materials, knitted or crocheted (excluding cotton)",1051880438.0
202501,502,United States,611011,"Jerseys, pullovers, cardigans, waistcoats and similar articles, of hair of Kashmir cashmere"" goats, knitted or crocheted (excluding quilted articles)""",53478394.0
202501,502,United States,611012,"Jerseys, pullovers, cardigans, waistcoats and similar articles, of fine animal hair, knitted or crocheted (excluding from hair of Kashmir cashmere"" goats and quilted articles)""",119994803.0
202501,502,United States,611019,"Jerseys, pullovers, cardigans, waistcoats and similar articles, of cotton, knitted or crocheted (excluding wadded waistcoats)",27768513.0
202501,502,United States,611020,"Jerseys, pullovers, cardigans, waistcoats and similar articles, of man-made fibres, knitted or crocheted (excluding wadded waistcoats)",1121405933.0
202501,502,United States,611030,"Jerseys, pullovers, cardigans, waistcoats and similar articles, of textile materials, knitted or crocheted (excluding of wool, fine animal hair, cotton or man-made fibres, and wadded waistcoats)",1382875231.0
202501,502,United States,611090,"bies' garments and clothing accessories, knitted or crocheted (excluding hats)",43906056.0
202501,502,United States,611120,"Babies' garments and clothing accessories of cotton, knitted or crocheted (excluding hats)",268632718.0
202501,502,United States,611130,"Babies' garments and clothing accessories of synthetic fibres, knitted or crocheted (excluding hats)",81049801.0
202501,502,United States,611190,"Babies' garments and clothing accessories of textile materials, knitted or crocheted (excluding of cotton or synthetic fibres, and hats)",40390104.0
202501,502,United States,611211,"Track-suits of cotton, knitted or crocheted",2312608.0
202501,502,United States,611212,"Track-suits of synthetic fibres, knitted or crocheted",15084149.0
202501,502,United States,611219,"Track-suits of textile materials, knitted or crocheted (excluding cotton or synthetic fibres)",355871.0
202501,502,United States,611220,"Ski-suits, knitted or crocheted",221206.0
202501,502,United States,611231,"Men's or boys' swimwear of synthetic fibres, knitted or crocheted",23296116.0
202501,502,United States,611239,"Men's or boys' swimwear of textile materials, knitted or crocheted (excluding synthetic fibres)",73842.0
202501,502,United States,611241,"Women's or girls' swimwear of synthetic fibres, knitted or crocheted",523324733.0
202501,502,United States,611249,"Women's or girls' swimwear of textile materials, knitted or crocheted (excluding synthetic fibres)",956157.0
202501,502,United States,611300,"Garments, knitted or crocheted, rubberised or impregnated, coated or covered with plastics or other materials (excluding babies' garments and clothing accessories)",19745886.0
202501,502,United States,611420,"Other garments of cotton, knitted or crocheted",97194485.0
202501,502,United States,611430,"Other garments of man-made fibres, knitted or crocheted",510537782.0
202501,502,United States,611490,"Other garments of other textile materials, knitted or crocheted",8826867.0
202501,502,United States,611510,"Graduated compression hosiery [e.g., stockings for varicose veins], of textile materials, knitted or crocheted (excluding hosiery for babies)",16264631.0
202501,502,United States,611521,"Pantyhose and tights of synthetic fibres, knitted or crocheted, measuring per single yarn ＜ 67 decitex (excluding graduated compression hosiery)",48456416.0
202501,502,United States,611522,"Pantyhose and tights of synthetic fibres, knitted or crocheted, measuring per single yarn ≥ 67 decitex (excluding graduated compression hosiery)",9446545.0
202501,502,United States,611529,"Pantyhose and tights of textile materials, knitted or crocheted (excluding graduated compression hosiery, those of synthetic fibres and hosiery for babies)",7382687.0
202501,502,United States,611530,"Women's full-length or knee-length hosiery, knitted or crocheted, measuring per single yarn ＜ 67 decitex (excluding graduated compression hosiery, pantyhose and tights)",15323279.0
202501,502,United States,611594,"Full-length or knee-length stockings, socks and other hosiery, incl. footwear without applied soles, of wool or fine animal hair, knitted or crocheted (excluding graduated compression hosiery, pantyhose and tights, women's full-length or knee-length stockings, measuring per single yarn ＜ 67 decitex, and hosiery for babies)",6876442.0
202501,502,United States,611595,"Full-length or knee-length stockings, socks and other hosiery, incl. footwear without applied soles, of cotton, knitted or crocheted (excluding graduated compression hosiery, pantyhose and tights, women's full-length or knee-length stockings, measuring per single yarn ＜ 67 decitex, and hosiery for babies)",189832820.0
202501,502,United States,611596,"Full-length or knee-length stockings, socks and other hosiery, incl. footwear without applied soles, of synthetic fibres, knitted or crocheted (excluding graduated compression hosiery, pantyhose and tights, women's full-length or knee-length stockings, measuring per single yarn ＜ 67 decitex, and hosiery for babies)",864593863.0
202501,502,United States,611599,"Full-length or knee-length stockings, socks and other hosiery, incl. footwear without applied soles, of textile materials, knitted or crocheted (excluding of wool, fine animal hair, cotton or synthetic fibres, graduated compression hosiery, pantyhose and tights, women's full-length or knee-length stockings, measuring per single yarn ＜ 67 decitex, and hosiery for babies)",16041515.0
202501,502,United States,611610,"Impregnated, coated, covered or laminated with plastics or rubber",376044292.0
202501,502,United States,611691,"Gloves, mittens and mitts, of wool or fine animal hair, knitted or crocheted (excluding for babies)",3165386.0
202501,502,United States,611692,"Gloves, mittens and mitts, of cotton, knitted or crocheted (excluding impregnated, coated or covered with plastics or rubber, and for babies)",21976930.0
202501,502,United States,611693,"Gloves, mittens and mitts, of synthetic fibres, knitted or crocheted (excluding impregnated, coated or covered with plastics or rubber, and for babies)",51346372.0
202501,502,United States,611699,"Gloves, mittens and mitts, of textile materials, knitted or crocheted (excluding of wool, fine animal hair, cotton or synthetic fibres, impregnated, coated or covered with plastics or rubber, and for babies)",12292014.0
202501,502,United States,611710,"Shawls, scarves, mufflers, mantillas, veils and the like, knitted or crocheted",83834719.0
202501,502,United States,611780,"Ties, bow ties, cravats and other made-up clothing accessories, knitted or crocheted, n.e.s. (excluding shawls, scarves, mufflers, mantillas, veils and the like)",78832705.0
202501,502,United States,611790,"Parts of garments or clothing accessories, knitted or crocheted, n.e.s.",2275313.0
202501,502,United States,620120,"Men’s or boys’ overcoats, car-coats, capes, cloaks, anoraks (including ski-jackets), wind-cheaters, windjackets and similar artic,of wool or fine animal hair",5034347.0
202501,502,United States,620130,"Men’s or boys’ overcoats, car-coats, capes, cloaks, anoraks (including ski-jackets), wind-cheaters, windjackets and similar artic,of cotton",7498189.0
202501,502,United States,620140,"Men’s or boys’ overcoats, car-coats, capes, cloaks, anoraks (including ski-jackets), wind-cheaters, windjackets and similar artic,of man-made fibres",133044897.0
202501,502,United States,620190,"Men's or boys' overcoats, raincoats, car coats, capes, cloaks and similar articles, of  other textile materials",5107130.0
202501,502,United States,620220,"Women’s or girls’ overcoats, car-coats, capes, cloaks, anoraks (including ski-jackets), wind-cheaters, wind jackets and similar articles, of wool or fine animal hair",11447118.0
202501,502,United States,620230,"Women’s or girls’ overcoats, car-coats, capes, cloaks, anoraks (including ski-jackets), wind-cheaters, wind jackets and similar articles, of cotton",18909136.0
202501,502,United States,620240,"Women’s or girls’ overcoats, car-coats, capes, cloaks, anoraks (including ski-jackets), wind-cheaters, wind jackets and similar articles,of man-made fibres",103719511.0
202501,502,United States,620290,"Women’s or girls’ overcoats, car-coats, capes, cloaks, anoraks (including ski-jackets), wind-cheaters, wind jackets and similar articles, of other textile materials",3349898.0
202501,502,United States,620311,"Men's or boys' suits of wool or fine animal hair (excluding knitted or crocheted, tracksuits, ski suits and swimwear)",63218814.0
202501,502,United States,620312,"Men's or boys' suits of synthetic fibres (excluding knitted or crocheted, tracksuits, ski suits and swimwear)",103738225.0
202501,502,United States,620319,"Men's or boys' suits of textile materials (excluding of wool, fine animal hair or synthetic fibres, knitted or crocheted, tracksuits, ski suits and swimwear)",4731954.0
202501,502,United States,620322,"Men's or boys' ensembles of cotton (excluding knitted or crocheted, ski ensembles and swimwear)",4027745.0
202501,502,United States,620323,"Men's or boys' ensembles of synthetic fibres (excluding knitted or crocheted, ski ensembles and swimwear)",17811943.0
202501,502,United States,620329,"Men's or boys' ensembles of textile materials (excluding of cotton or synthetic fibres, knitted or crocheted, ski ensembles and swimwear)",6979745.0
202501,502,United States,620331,"Men's or boys' jackets and blazers of wool or fine animal hair (excluding knitted or crocheted, and wind-jackets and similar articles)",52490324.0
202501,502,United States,620332,"Men's or boys' jackets and blazers of cotton (excluding knitted or crocheted, and wind-jackets and similar articles)",53344773.0
202501,502,United States,620333,"Men's or boys' jackets and blazers of synthetic fibres (excluding knitted or crocheted, and wind-jackets and similar articles)",99947057.0
202501,502,United States,620339,"Men's or boys' jackets and blazers of textile materials (excluding of wool, fine animal hair, cotton or synthetic fibres, knitted or crocheted, and wind-jackets and similar articles)",22518103.0
202501,502,United States,620341,"Men's or boys' trousers, bib and brace overalls, breeches and shorts, of wool or fine animal hair (excluding knitted or crocheted, underpants and swimwear)",24533651.0
202501,502,United States,620342,"Men's or boys' trousers, bib and brace overalls, breeches and shorts, of cotton (excluding knitted or crocheted, underpants and swimwear)",553713345.0
202501,502,United States,620343,"Men's or boys' trousers, bib and brace overalls, breeches and shorts of synthetic fibres (excluding knitted or crocheted, underpants and swimwear)",582827884.0
202501,502,United States,620349,"Men's or boys' trousers, bib and brace overalls, breeches and shorts of textile materials (excluding of wool, fine animal hair, cotton or synthetic fibres, knitted or crocheted, underpants and swimwear)",32470241.0
202501,502,United States,620411,"Women's or girls' suits of wool or fine animal hair (excluding knitted or crocheted, ski overalls and swimwear)",550141.0
202501,502,United States,620412,"Women's or girls' suits of cotton (excluding knitted or crocheted, ski overalls and swimwear)",621165.0
202501,502,United States,620413,"Women's or girls' suits of synthetic fibres (excluding knitted or crocheted, ski overalls and swimwear)",5914571.0
202501,502,United States,620419,"Women's or girls' suits of textile materials (excluding of wool, fine animal hair, cotton or synthetic fibres, knitted or crocheted, ski overalls and swimwear)",394742.0
202501,502,United States,620422,"Women's or girls' ensembles of cotton (excluding knitted or crocheted, ski overalls and swimwear)",29383882.0
202501,502,United States,620423,"Women's or girls' ensembles of synthetic fibres (excluding knitted or crocheted, ski overalls and swimwear)",99085355.0
202501,502,United States,620429,"Women's or girls' ensembles of textile materials (excluding of wool, fine animal hair, cotton or synthetic fibres, knitted or crocheted, ski overalls and swimwear)",8881099.0
202501,502,United States,620431,"Women's or girls' jackets and blazers of wool or fine animal hair (excluding knitted or crocheted, wind-jackets and similar articles)",4247153.0
202501,502,United States,620432,"Women's or girls' jackets and blazers of cotton (excluding knitted or crocheted, wind-jackets and similar articles)",180022639.0
202501,502,United States,620433,"Women's or girls' jackets and blazers of synthetic fibres (excluding knitted or crocheted, wind-jackets and similar articles)",274090805.0
202501,502,United States,620439,"Women's or girls' jackets and blazers of textile materials (excluding of wool, fine animal hair, cotton or synthetic fibres, knitted or crocheted, wind-jackets and similar articles)",104216131.0
202501,502,United States,620441,Women's or girls' dresses of wool or fine animal hair (excluding knitted or crocheted and petticoats),450750.0
202501,502,United States,620442,Women's or girls' dresses of cotton (excluding knitted or crocheted and petticoats),443943767.0
202501,502,United States,620443,Women's or girls' dresses of synthetic fibres (excluding knitted or crocheted and petticoats),774179532.0
202501,502,United States,620444,Women's or girls' dresses of artificial fibres (excluding knitted or crocheted and petticoats),281705017.0
