Date of data,Trading partner code,Trading partner,Commodity code,Commodity,Renminbi Yuan
201911,502,United States,010611,Primates,19962684
201911,502,United States,010619,Other mammals,99561
201911,502,United States,010620,Reptiles (including snakes and turtles),3600
201911,502,United States,010690,Other lives animals,73293
201911,502,United States,020810,"Meat and edible meat offal of rabbits or hares,fresh, chilled or frozen",2381063
201911,502,United States,030111,Ornamental fish of freshwater,301715
201911,502,United States,030289,"Other fish,fresh or chilled",1243267
201911,502,United States,030323,"Tilapias (Oreochromis spp) , frozen",10839127
201911,502,United States,030324,"Catfish (Pangasius spp, Silurus spp, Clarias spp, Ictalurus spp) , frozen",609951
201911,502,United States,030325,"Carp (Cyprinus spp, Carassius spp, Ctenopharyngodon idellus, , frozen Hypophthalmichthys spp, Cirrhinus spp, Mylopharyngodon piceus, Catla catla, Labeo spp, Osteochilus hasselti, Leptobarbus hoeveni, Megalobrama spp)",918320
201911,502,United States,030326,"Eels (Anguilla spp) , frozen",3903552
201911,502,United States,030339,"Other flat fish (Pleuronectidae, Bothidae, Cynoglossidae, Soleidae Scophthalmidae and Citharidae), frozen",68298
201911,502,United States,030353,"Sardines (Sardina pilchardus, Sardinops spp), sardinella (Sardinella spp), brisling or sprats (Sprattus sprattus),frozen",604690
201911,502,United States,030354,"Mackerel (Scomber scombrus, Scomber australasicus, Scomber japonicus) ,frozen",16166
201911,502,United States,030356,"Cobia (Rachycentron canadum) ,frozen",993983
201911,502,United States,030359,"Other herrings (Clupea harengus, Clupea pallasii), anchovies (Engraulis spp.), sardines (Sardina pilchardus, Sardinops spp.), sardinella (Sardinella spp.), brisling or sprats (Sprattus sprattus), mackerel (Scomber scombrus, Scomber australasicus, Scomber japonicus), Indian mackerels (Rastrelliger spp.), seerfishes (Scomberomorus spp), jack and horse mackerel (Trachurus spp.), jacks, crevalles (Caranx spp.), cobia (Rachycentron canadum), silver pomfrets (Pampus spp.), Pacific saury (Cololabis saira), scads (Decapterus spp.), capelin (Mallotus villosus), swordfish (Xiphias gladius), Kawakawa (Euthynnus affinis), bonitos (Sarda spp.), marlins, sailfishes, spearfish (Istiophoridae),frozen",2178914
201911,502,United States,030389,"Other fish ,frozen",120510017
201911,502,United States,030461,Frozen fillets of tilapias (Oreochromis spp),24597809
201911,502,United States,030462,"Frozen fillets of catfish (Pangasius spp, Silurus spp, Clarias spp, Ictalurus spp)",24551819
201911,502,United States,030469,"Frozen fillets of carp ""Cyprinus carpio, Carassius carassius, Ctenopharyngodon idellus, Hypophthalmichthys spp., Cirrhinus spp., Mylopharyngodon piceus"", eels ""Anguilla spp."" and snakeheads ""Channa spp.""",441364
201911,502,United States,030471,"Frozen fillets of cod (Gadus morhua, Gadus ogac, Gadus macrocephalus)",212384618
201911,502,United States,030472,Frozen fillets of haddock (Melanogrammus aeglefinus),45641400
201911,502,United States,030474,"Frozen fillets of hake (Merluccius spp, Urophycis spp)",2690405
201911,502,United States,030475,Frozen fillets of alaska Pollack (Theragra chalcogramma),47193150
201911,502,United States,030479,"Frozen fillets of fish of the families Bregmacerotidae, Euclichthyidae, Gadidae, Macrouridae, Melanonidae, Merlucciidae, Moridae and Muraenolepididae (excluding cod, haddock, coalfish, hake and Alaska pollack)",19055
201911,502,United States,030481,"Frozen fillets of Pacific salmon (Oncorhynchus nerka, Oncorhynchus gorbuscha, Oncorhynchus keta, Oncorhynchus tschawytscha, Oncorhynchus kisutch, Oncorhynchus masou and Oncorhynchus rhodurus), Atlantic salmon (Salmo salar) and Danube salmon (Hucho hucho)",152131848
201911,502,United States,030483,"Frozen fillets of flat fish (Pleuronectidae, Bothidae, Cynoglossidae, Soleidae, Scophthalmidae and Citharidae)",41381982
201911,502,United States,030487,"Frozen fillets of tunas (of the genus Thunnus), skipjack or stripebellied bonito (Euthynnus (Katsuwonus) pelamis)",1236428
201911,502,United States,030489,"Frozen fish fillets, n.e.s.",8605788
201911,502,United States,030494,"Frozen meat, whether or not minced, of alaska Pollack (Theragra chalcogramma)",1013424
201911,502,United States,030495,"Frozen meat, whether or not minced, of fish of the families Bregmacerotidae, Euclichthyidae, Gadidae, Macrouridae, Melanonidae, Merlucciidae, Moridae and Muraenolepididae, other than Alaska Pollack (Theragra chalcogramma)",894242
201911,502,United States,030499,Frozen fish meat n.e.s. (excluding fillets),5778921
201911,502,United States,030520,"Livers, roes and milt of fish, dried, smoked, salted or in brine",3060351
201911,502,United States,030532,"Fillets, dried, salted or in brine, but not smoked, of fish of the families Bregmacerotidae, Euclichthyidae, Gadidae, Macrouridae, Melanonidae, Merlucciidae, Moridae and Muraenolepididae",18235794
201911,502,United States,030559,"Dried fish, even salted but not smoked (excluding fillets, offal and cod)",533901
201911,502,United States,030569,"Other fish, salted or in brine only (excluding fillets, offal, herring, cod, anchovies, tilapia, catfish, carp, eels, Nile perch and snakeheads)",2152925
201911,502,United States,030572,"Fish heads, tails and maws, smoked, dried, salted or in brine",67899
201911,502,United States,030614,Frozen crabs,8398641
201911,502,United States,030615,Frozen norway lobsters (Nephrops norvegicus),2716736
201911,502,United States,030617,"Frozen shrimps and prawns, even smoked, whether in shell or not, incl. shrimps and prawns in shell, cooked by steaming or by boiling in water (excluding cold-water shrimps and prawns)",22485275
201911,502,United States,030633,"Crabs , whether in shell or not, live, fresh or chilled",296700
201911,502,United States,030636,"Other shrimps and prawns, whether in shell or not, live, fresh or chilled",516
201911,502,United States,030695,"Shrimps and prawns,, whether in shell or not, live, fresh or chilled (excl. rock lobster and other sea crawfish, lobsters, crabs, Norway lobsters, shrimps and prawns); flours, meals and pellets of crustaceans, fit for human consumption, fresh or chilled",3763515
201911,502,United States,030722,"Frozen scallops, incl. queen scallops, of the genera Pecten, Chlamys or Placopecten, even in shell",36472811
201911,502,United States,030729,"Scallops, incl. queen scallops, of the genera Pecten, Chlamys or Placopecten, smoked, frozen, dried, salted or in brine, even in shell",36080
201911,502,United States,030743,"Frozen cuttle fish and squid, with or without shell",100669453
201911,502,United States,030752,Frozen octopus (Octopus spp.),1205586
201911,502,United States,030783,Frozen abalone (Haliotis spp),90614
201911,502,United States,030830,Jellyfish (Rhopilema spp),121409
201911,502,United States,030890,"Live, fresh, chilled, frozen, dried, salted or in brine, even smoked, aquatic invertebrates (excluding crustaceans, molluscs, sea cucumbers, sea urchins and jellyfish); all flours, meals and pellets of aquatic invertebrates other than crustaceans and molluscs, fit for human consumption",90599
201911,502,United States,040299,"Milk and cream, concentrated and sweetened (excluding in solid forms)",170568
201911,502,United States,040790,"Other birds'eggs, in shell, preserved or cooked",2246601
201911,502,United States,040811,Dried egg yolks,871804
201911,502,United States,040819,Other egg yolks,2721399
201911,502,United States,041000,"dible products of animal origin, not elsewhere specified or included",2675524
201911,502,United States,050210,"Pigs', hogs' or boars' bristles and hair and waste thereof",5193355
201911,502,United States,050290,Badger and other brush making hair and waste thereof,81369
201911,502,United States,050400,"Guts, bladders and stomachs of animals (other than fish), whole and pieces thereof, fresh, chilled, frozen, salted, in brine, dried or smoked",53880016
201911,502,United States,050510,Feathers of a kind used for stuffing; down,27746556
201911,502,United States,050790,"Tortoiseshell, whalebone, Otherhorns, antlers, hooves, nails, claws and beaks, other powder and waste there of",42448
201911,502,United States,050800,"Coral and similar materials, unworked or simply prepared bunot otherwise worked; shells of molluscs, crustaceans or echinoderms and cuttlebone, unworked or simply prepared bunot cut to shape, powder and waste thereof",910372
201911,502,United States,051000,"Ambergris, castoreum, civet and musk; cantharides; bile, whether or not dried; glands and other animal products used in the preparation of pharmaceutical products, fresh, chilled, frozen or otherwise provisionally preserved",25452
201911,502,United States,051191,"Products of fish or crustaceans, molluscs or other aquatic invertebrates; dead animals of Chapter 3",1404630
201911,502,United States,051199,"Unkown Products of animal origin, n.e.s., dead animals, unfit for human consumption (excluding fish, crustaceans, molluscs or other aquatic invertebrates)",21682803
201911,502,United States,060110,"Bulbs, tubers, tuberous roots, corms, crowns and rhizomes, dormant",32209
201911,502,United States,060210,Unrooted cuttings and slips,1637076
201911,502,United States,060290,Other live plant,23524095
201911,502,United States,060390,"Dried, dyed, bleached, impregnated or otherwise prepared cut flowers and buds, of a kind suitable for bouquets or for ornamental purposes",840
201911,502,United States,060420,"Foliage, branches and other parts of plants, without flowers or flower buds, and grasses, mosses and lichens, being goods of a kind suitable for bouquets or for ornamental purposes, fresh",400813
201911,502,United States,060490,"Foliage, branches and other parts of plants, without flowers or flower buds, and grasses, mosses and lichens, being goods of a kind suitable for bouquets or for ornamental purposes, dried, dyed, bleached, impregnated or otherwise prepared",6259908
201911,502,United States,070310,Fresh or chilled onions and shallots,1657324
201911,502,United States,070320,Fresh or chilled garlic,73699814
201911,502,United States,070390,"Leeks and other alliaceous vegetables,fresh or chilled",57889
201911,502,United States,070951,Fresh or chilled mushrooms of the genus Agaricus,1655799
201911,502,United States,070959,"Fresh or chilled edible mushrooms and truffles excluding mushrooms of the genus ""Agaricus""",11793783
201911,502,United States,070999,Fresh or chilled vegetables n.e.s.,587907
201911,502,United States,071021,Frozen peas (Pisum sativum),507453
201911,502,United States,071022,"Frozen beans (Vigna spp., Phaseolus spp.)",1375327
201911,502,United States,071029,"Leguminous vegetables, shelled or unshelled, uncooked or cooked by steaming or by boiling in water, frozen (excluding peas and beans)",23819282
201911,502,United States,071030,"Spinach, New Zealand spinach and orache spinach (garden spinach),frozen.",17808831
201911,502,United States,071040,"Sweet corn,frozen.",2979825
201911,502,United States,071080,"Other vegetables (uncooked or cooked by steaming or boiling in water),frozen.",31360266
201911,502,United States,071090,"Mixtures of vegetables,frozen.",10350981
201911,502,United States,071140,"Cucumbers and gherkins , provisionally preserved, e.g. by sulphur dioxide gas, in brine, in sulphur water or in other preservative solutions, but unsuitable in that state for immediate consumption",101450
201911,502,United States,071159,Other mushrooms and truffles,39826
201911,502,United States,071190,Other vegetables; mixtures of vegetables,490635
201911,502,United States,071220,"Dried Onions, whole, cut, sliced, broken or in powder, but not further prepared.",2705251
201911,502,United States,071232,"Dried wood ears (Auricularia spp.), whole, cut, sliced, broken or in powder, but not further prepared.",7563047
201911,502,United States,071233,"Dried jelly fungi (Tremella spp.), whole, cut, sliced, broken or in powder, but not further prepared.",139709
201911,502,United States,071239,"Dried other mushrooms and truffles, whole, cut, sliced, broken or in powder, but not further prepared.",14006264
201911,502,United States,071290,"Dried other vegetables; mixtures of vegetables, whole, cut, sliced, broken or in powder, but not further prepared.",144014945
201911,502,United States,071310,"Dried peas (Pisum sativum), shelled, whether or not skinned or split.",3211
201911,502,United States,071331,"Dried beans of the species Vigna mungo (L.) Hepper or Vigna radiata (L.) Wilczek, shelled, whether or not skinned or split.",11750825
201911,502,United States,071332,"Dried small red (Adzuki) beans (Phaseolus or Vigna angularis), shelled, whether or not skinned or split.",1536327
201911,502,United States,071333,"Dried kidney beans, including white pea beans (Phaseolus vulgaris), shelled, whether or not skinned or split.",603472
201911,502,United States,071335,"Dried cow peas (Vigna unguiculata), shelled, whether or not skinned or split.",64504
201911,502,United States,071390,"Dried, shelled leguminous vegetables, whether or not skinned or split (excluding peas, chickpeas, beans, lentils, broad beans, horse beans and pigeon peas)",364349
201911,502,United States,071420,"Sweet potatoes, fresh, chilled, frozen or dried, whether or not sliced or in the form of pellets; sago pith.",35293
201911,502,United States,071430,"Yams (Dioscorea spp.), fresh, chilled, frozen or dried, whether or not sliced or in the form of pellets; sago pith.",4238166
201911,502,United States,071440,"Taro (Colocasia spp.), fresh, chilled, frozen or dried, whether or not sliced or in the form of pellets; sago pith.",1702118
201911,502,United States,071490,"Arrowroot, salep, Jerusalem artichokes and similar roots and tubers with high starch or inulin content, fresh, chilled, frozen or dried, whether or not sliced or in the form of pellets, and sago pith (excluding manioc ""cassava"", sweet potatoes, yams, taro and yautia)",6941189
201911,502,United States,080111,Desiccated coconuts,35827
201911,502,United States,080241,In shell chestnuts (Castanea spp.),961018
201911,502,United States,080252,Shelled pistachios,4468568
201911,502,United States,080262,Shelled macadamia nuts,9190370
201911,502,United States,080290,Other nuts fresh or dried,19392397
201911,502,United States,080390,Fresh or dried bananas (excluding plantains),469960
201911,502,United States,080420,Fresh or dried figs,20516
201911,502,United States,080430,Fresh or dried pineapples,112561
201911,502,United States,080450,"Fresh or dried guavas, mangoes and mangosteens",74516
201911,502,United States,080620,Dried Grapes,132553
201911,502,United States,080810,Fresh Apples,3246242
201911,502,United States,080830,Fresh Pears,11808456
201911,502,United States,081110,Frozen Strawberries,162922
201911,502,United States,081120,"Frozen Raspberries, blackberries, mulberries, loganberries, black, white or red currants and gooseberries",61444
201911,502,United States,081190,Other Frozen Fruit and nuts,3277232
201911,502,United States,081340,Other Dried fruit,20689533
201911,502,United States,081350,Mixtures of nuts or dried fruits of this Chapter,35705
201911,502,United States,081400,"Peel of citrus fruit or melons (including watermelons), fresh, frozen, dried or provisionally preserved in brine, in sulphur water or in other preservative solutions.",67110
201911,502,United States,090121,Coffee roasted (Not decaffeinated ),57104
201911,502,United States,090122,Coffee roasted(Decaffeinated ),56580
201911,502,United States,090210,Green tea (not fermented) in immediate packings of a content not exceeding 3 kg,9652766
201911,502,United States,090220,Other green tea (not fermented),10076289
201911,502,United States,090230,"Black tea (fermented) and partly fermented tea, in immediate packings of a content not exceeding 3 kg",1891874
201911,502,United States,090240,Other black tea (fermented) and other partly fermented tea,7917019
201911,502,United States,090411,Neither crushed nor ground,522885
201911,502,United States,090412,Crushed or ground,1777074
201911,502,United States,090421,"Dried, neither crushed nor ground",9989540
201911,502,United States,090422,Crushed or ground,29459279
201911,502,United States,090611,Cinnamon (Cinnamomum zeylanicum Blume),12128
201911,502,United States,090619,"Cinnamon and cinnamon-tree flowers (excluding cinnamon ""Cinnamomum zeylanicum Blume"" and crushed and ground cinnamon)",73120
201911,502,United States,090710,Neither crushed nor ground,17278
201911,502,United States,090921,Seeds of coriander Neither crushed nor ground,10665
201911,502,United States,090961,"Seeds of anise, badian, caraway or fennel; juniper berries Neither crushed nor ground",1039911
201911,502,United States,090962,"Seeds of anise, badian, caraway or fennel; juniper berries Crushed or ground",38542
201911,502,United States,091011,"Seeds of anise, badian, caraway or fennel; juniper berries Neither crushed nor ground",36251046
201911,502,United States,091012,"Seeds of anise, badian, caraway or fennel; juniper berries Crushed or ground",2253966
201911,502,United States,091030,Turmeric (curcuma),3427
201911,502,United States,091091,Mixtures referred to in Note 1 (b) to this Chapter,751620
201911,502,United States,091099,Other spices,3469855
201911,502,United States,100390,Barley (excluding seed for sowing),37542
201911,502,United States,100630,"Semimilled or wholly milled rice, whether or not polished or glazed",1101508
201911,502,United States,100790,Grain sorghum (excluding seed for sowing),128934
201911,502,United States,100810,Buckwheat,29710
201911,502,United States,100890,Other cereals,258055
201911,502,United States,110100,Wheat or meslin flour.,299552
201911,502,United States,110290,"Cereal flours (excluding wheat, meslin and maize)",14789
201911,502,United States,110429,"Grains of cereals, hulled, pearled, sliced, kibbled or otherwise worked (excluding rolled, flaked, flour, pellets, and oats and maize, and husked and semi- or wholly milled rice and broken rice)",1089151
201911,502,United States,110610,Of the dried leguminous vegetables of heading 07.13,23933
201911,502,United States,110620,Of sago or of roots or tubers of heading 07.14,346253
201911,502,United States,110630,Of the products of Chapter 8,817615
201911,502,United States,110812,Maize (corn) starch,37637
201911,502,United States,110813,Potato starch,129729
201911,502,United States,110819,Other starches,781878
201911,502,United States,110820,Inulin,638213
201911,502,United States,110900,"Wheat gluten, whether or not dried.",150901
201911,502,United States,120110,"Soya bean seed, for sowing",64
201911,502,United States,120190,Other Soya beans,813063
201911,502,United States,120600,"Sunflower seeds, whether or not broken.",522969
201911,502,United States,120740,Sesamum seeds,608629
201911,502,United States,120770,Melon seeds,5096707
201911,502,United States,120799,Other,1926869
201911,502,United States,120890,Flours and meal of oil seeds or oleaginous fruit (excluding soya and mustard),1183780
201911,502,United States,120910,Sugar beet seeds,5649
201911,502,United States,120930,Seeds of herbaceous plants cultivated principally for their flowers,493215
201911,502,United States,120991,Vegetable seeds,27677992
201911,502,United States,121120,Ginseng roots,4369349
201911,502,United States,121190,Other,13189080
201911,502,United States,121221,Fit for human consumption,562289
201911,502,United States,121299,"Fruit stones and kernels and other vegetable products, incl. unroasted chicory roots of the variety cichorium intybus sativum, of a kind used primarily for human consumption, n.e.s.",39073062
201911,502,United States,130190,"Lac; natural gums, resins, gum-resins, balsams and other natural oleoresins (excluding gum Arabic)",1506182
201911,502,United States,130212,Extracts of liquorice (excluding that with a sucrose content by weight of > 10% or in the form of confectionery),962145
201911,502,United States,130219,"Mucilages and thickeners, derived from locust beans, locust bean seeds or guar seeds, whether or not modified",127051047
201911,502,United States,130220,"Pectic substances, pectinates and pectates",3389398
201911,502,United States,130231,Agaragar,1755215
201911,502,United States,130232,"Mucilages and thickeners, whether or not modified, derived from locust beans, locust bean seeds or guar seeds",613254
201911,502,United States,130239,Other,16110938
201911,502,United States,140110,Bamboos,3557199
201911,502,United States,140120,Rattans,232392
201911,502,United States,140190,Other,150029
201911,502,United States,140490,Other,679649
201911,502,United States,150420,"Fats and oils and their fractions, of fish, other than liver oils",37468805
201911,502,United States,150500,Wool grease and fatty substances derived therefrom (including lanolin).,1433850
201911,502,United States,150600,"Other animal fats and oils and their fractions, whether or not refined, but not chemically modified.",4104966
201911,502,United States,151219,Other,145404
201911,502,United States,151519,"Linseed oil and fractions thereof, whether or not refined, but not chemically modified (excluding crude)",1496774
201911,502,United States,151550,Sesame oil and its fractions,1580613
201911,502,United States,151590,Other,7725087
201911,502,United States,151610,Animal fats and oils and their fractions,255328
201911,502,United States,151790,"Edible mixtures or preparations of animal or vegetable fats or oils and edible fractions of different fats or oils (excluding fats, oils and their fractions, partly or wholly hydrogenated, inter-esterified, re-esterified or elaidinised, whether or not refined, but not further prepared, mixtures of olive oils and their fractions, and solid margarine)",1227930
201911,502,United States,152110,Vegetable waxes,922453
201911,502,United States,152190,Other,1803307
201911,502,United States,160290,"Other, including preparations of blood of any animal",5415776
201911,502,United States,160411,Prepared or preserved salmon,1011264
201911,502,United States,160413,"Prepared or preserved Sardines, sardinella and brisling or sprats",3710728
201911,502,United States,160414,"Prepared or preserved Tunas, skipjack and bonito (Sarda spp.)",4497507
201911,502,United States,160415,Prepared or preserved mackerel,8653741
201911,502,United States,160417,Prepared or preserved eels,30554932
201911,502,United States,160419,"Prepared or preserved fish, whole or in pieces (excluding minced, merely smoked, and salmon, herrings, sardines, sardinella, brisling or sprats, tunas, skipjack, bonito ""sarda spp."", mackerel, anchovies and eels)",285017072
201911,502,United States,160420,Other prepared or preserved fish,15240011
201911,502,United States,160431,Caviar,7806206
201911,502,United States,160432,Caviar substitutes,126892
201911,502,United States,160510,Prepared or preserved Crab,32300811
201911,502,United States,160521,Shrimps and prawns not in airtight container,76292059
201911,502,United States,160529,Other shrimps and prawns,59476920
201911,502,United States,160540,Other crustaceans,36331767
201911,502,United States,160551,Prepared or preserved Oysters,29739931
201911,502,United States,160552,"Prepared or preserved scallops, including queen scallops",5259868
201911,502,United States,160553,Prepared or preserved mussels,3087950
201911,502,United States,160554,Prepared or preserved cuttle fish and squid,88864705
201911,502,United States,160555,Prepared or preserved Octopus,4588648
201911,502,United States,160556,"Prepared or preserved Clams, cockles and arkshells",14311146
201911,502,United States,160557,Prepared or preserved Abalone,1815918
201911,502,United States,160558,"Prepared or preserved Snails, other than sea snails",362067
201911,502,United States,160559,"Molluscs, prepared or preserved (excluding smoked, oysters, scallops, mussels, cuttle fish, squid, octopus, abalone, snails, and clams, cockles and arkshells)",1819402
201911,502,United States,160563,"Jellyfish,prepared or preserved",864200
201911,502,United States,160569,"Aquatic invertebrates, prepared or preserved (excluding smoked, crustaceans, molluscs, sea cucumbers, sea urchins and jellyfish)",249154
201911,502,United States,170199,"Cane or beet sugar and chemically pure sucrose, in solid form (excluding cane and beet sugar containing added flavouring or colouring and raw sugar)",1707055
201911,502,United States,170230,"Glucose and glucose syrup, not containing fructose or containing in the dry state less than 20% by weight of fructose",1146519
201911,502,United States,170260,"Other fructose and fructose syrup, containing in the dry state more than 50% by weight of fructose, excluding invert sugar",20673
201911,502,United States,170290,"Other, including invert sugar and other sugar and sugar syrup blends containing in the dry state 50% by weight of fructose",20120050
201911,502,United States,170410,"Chewing gum, whether or not sugarcoated",2809978
201911,502,United States,170490,Other,142008032
201911,502,United States,180310,"Cocoa paste, not defatted, whether or not defatted.",139016
201911,502,United States,180500,"Cocoa powder, not containing added sugar or other sweetening matter.",4068
201911,502,United States,180610,"Cocoa powder, containing added sugar or other sweetening matter",8631
201911,502,United States,180620,"Other preparations in blocks, slabs or bars weighing more than 2 kg or in liquid, paste, powder, granular or other bulk form in containers or immediate packings, of a content exceeding 2 kg",1368800
201911,502,United States,180631,"Chocolate and other preparations containing cocoa, in blocks, slabs or bars of ≤ 2 kg, filled",334346
201911,502,United States,180632,"Chocolate and other preparations containing cocoa, in blocks, slabs or bars of ≤ 2 kg (excluding filled)",5833379
