Date of data,Trading partner code,Trading partner,Commodity code,Commodity,Renminbi Yuan
202501,502,United States,391190,"Polysulphides, polysulphones and other polymers and prepolymers produced by chemical synthesis, nes, in primary forms",25533276.0
202501,502,United States,391220,"Cellulose nitrates (including collodions), in primary forms",5089006.0
202501,502,United States,391231,"Carboxymethylcellulose and its salts,in primary forms",22269031.0
202501,502,United States,391239,"Cellulose ethers, in primary forms (excluding carboxymethylcellulose and its salts)",2303078.0
202501,502,United States,391290,"Cellulose and chemical derivatives thereof, n.e.s., in primary forms (excluding cellulose acetates, cellulose nitrates and cellulose ethers)",5262739.0
202501,502,United States,391390,"Natural polymers and modified natural polymers, e.g. hardened proteins, chemical derivatives of natural rubber, n.e.s., in primary forms (excluding alginic acid and its salts and esters)",100011168.0
202501,502,United States,391400,"Ionexchangers based on polymers of headings 39.01 to 39.13, in primary forms",47272394.0
202501,502,United States,391590,"Waste, parings and scrap, of other plastics",404145.0
202501,502,United States,391610,Monofilament of polymers of ethylene,6101560.0
202501,502,United States,391620,Monofilament of polymers of vinyl chloride,14534328.0
202501,502,United States,391690,Monofilament of other plastics,196385578.0
202501,502,United States,391710,Artificial guts (sausage casings) of hardened protein or of cellulosic materials,253351.0
202501,502,United States,391721,"Rigid tubes, pipes and hoses, of polymers of ethylene",25875160.0
202501,502,United States,391722,"Rigid tubes, pipes and hoses, of polymers of propylene",6687800.0
202501,502,United States,391723,"Rigid tubes, pipes and hoses, of polymers of vinyl chloride",18931368.0
202501,502,United States,391729,"Rigid tubes, pipes and hoses, of other plastics",17257684.0
202501,502,United States,391731,"Flexible tubes, pipes and hoses, having a minimum burst pressure of 27.6 Mpa",32764566.0
202501,502,United States,391732,"Other plastic tubes, not reinforced or otherwise combined with other materials,without fittings",37952349.0
202501,502,United States,391733,"Other plastic tubes, not reinforced or otherwise combined with other materials,with fittings",47832217.0
202501,502,United States,391739,"Flexible tubes, pipes and hoses, of plastics, reinforced or otherwise combined with other materials (excluding those with a burst pressure of ≥ 27,6 MPa)",241672249.0
202501,502,United States,391740,"Fittings for tubes, of plastic",95823908.0
202501,502,United States,391810,"Wall or floor coverings, of polymers of vinyl chloride",1095943405.0
202501,502,United States,391890,"Wall or floor coverings, of other plastics",230845954.0
202501,502,United States,391910,"Self-adhesive plates, sheets, film, foil, tape, strip and other flat shapes, of plastics, in rolls ≤ 20 cm wide",105576464.0
202501,502,United States,391990,"Self-adhesive plates, sheets, film, foil, tape, strip and other flat shapes, of plastics, whether or not in rolls ＞ 20 cm wide (excluding floor, wall and ceiling coverings of heading 3918)",177744850.0
202501,502,United States,392010,"Plates, sheets, film, foil and strip, of non-cellular polymers of ethylene, not reinforced, laminated, supported or similarly combined with other materials, without backing, unworked or merely surface-worked or merely cut into squares or rectangles (excluding self-adhesive products, and floor, wall and ceiling coverings of heading 3918)",219283120.0
202501,502,United States,392020,"Plates, sheets, film, foil and strip, of non-cellular polymers of ethylene, not reinforced, laminated, supported or similarly combined with other materials, without backing, unworked or merely surface-worked or merely cut into squares or rectangles (excluding self-adhesive products, and floor, wall and ceiling coverings of heading 3918)",27899147.0
202501,502,United States,392030,"Plates, sheets, foil, film and strip, of non-cellular polymers of styrene, not reinforced, laminated, supported or similarly combined with other materials, without backing, unworked or merely surface-worked or merely cut into squares or rectangles (excluding self-adhesive products, and floor, wall and ceiling coverings of heading 3918)",4444534.0
202501,502,United States,392043,"Plates, sheets, film, foil and strip, of non-cellular polymers of vinyl chloride, containing by weight ≥ 6% of plasticisers, not reinforced, laminated, supported or similarly combined with other materials, without backing, unworked or merely surface-worked or merely cut into squares or rectangles (excluding self-adhesive products, and floor, wall and ceiling coverings of heading 3918)",51664665.0
202501,502,United States,392049,"Plates, sheets, film, foil and strip, of non-cellular polymers of vinyl chloride, containing by weight ＜ 6% of plasticisers, not reinforced, laminated, supported or similarly combined with other materials, without backing, unworked or merely surface-worked or merely cut into squares or rectangles (excluding self-adhesive products, and floor, wall and ceiling coverings of heading 3918)",50443471.0
202501,502,United States,392051,"Plates, sheets, film, foil and strip, of non-cellular polymethyl methacrylate"", not reinforced, laminated, supported or similarly combined with other materials, without backing, unworked or merely surface-worked or merely cut into squares or rectangles (excluding self-adhesive products, and floor, wall and ceiling coverings of heading 3918)""",30642613.0
202501,502,United States,392059,"Plates, sheets, film, foil and strip, of non-cellular acrylic polymers, not reinforced, laminated, supported or similarly combined with other materials, without backing, unworked or merely surface-worked or merely cut into squares or rectangles (excluding those of polymethyl methacrylate"", self-adhesive products, and floor, wall and ceiling coverings of heading 3918)""",206599.0
202501,502,United States,392061,"Plates, sheets, film, foil and strip, of non-cellular polycarbonates, not reinforced, laminated, supported or similarly combined with other materials, without backing, unworked or merely surface-worked or merely cut into squares or rectangles (excluding those of polymethyl methacrylate"", self-adhesive products, and floor, wall and ceiling coverings of heading 3918)""",13650433.0
202501,502,United States,392062,"Plates, sheets, film, foil and strip, of non-cellular polyethylene terephthalate"", not reinforced, laminated, supported or similarly combined with other materials, without backing, unworked or merely surface-worked or merely cut into squares or rectangles (excluding those of poly""methyl methacrylate"", self-adhesive products, and floor, wall and ceiling coverings of heading 3918)""",53401727.0
202501,502,United States,392063,"Plates, sheets, film, foil and strip, of non-cellular unsaturated polyesters, not reinforced, laminated, supported or similarly combined with other materials, without backing, unworked or merely surface-worked or merely cut into squares or rectangles (excluding those of polymethyl methacrylate"", self-adhesive products, and floor, wall and ceiling coverings of heading 3918)""",4432532.0
202501,502,United States,392069,"Plates, sheets, film, foil and strip, of non-cellular polyesters, not reinforced, laminated, supported or similarly combined with other materials, not worked or only surface-worked, or only cut to rectangular, incl. square, shapes (excluding polycarbonates, polythylene terephthalate and other unsaturated polyesters, self-adhesive products, and floor, wall and ceiling coverings in heading 3918)",17550436.0
202501,502,United States,392071,"Plates, sheets, film, foil and strip, of non-cellular regenerated cellulose, not reinforced, laminated, supported or similarly combined with other materials, without backing, unworked or merely surface-worked or merely cut into squares or rectangles (excluding self-adhesive products, and floor, wall and ceiling coverings of heading 3918)",76836.0
202501,502,United States,392073,"Plates, sheets, film, foil and strip, of non-cellular cellulose acetates, not reinforced, laminated, supported or similarly combined with other materials, without backing, unworked or merely surface-worked or merely cut into squares or rectangles (excluding self-adhesive products, and floor, wall and ceiling coverings of heading 3918)",328247.0
202501,502,United States,392079,"Plates, sheets, film, foil and strip, of non-cellular cellulose derivatives, not reinforced, laminated, supported or similarly combined with other materials, without backing, unworked or merely surface-worked or merely cut into squares or rectangles (excluding products of cellulose acetates, self-adhesive products, floor, wall and ceiling coverings of heading 3918)",270761.0
202501,502,United States,392091,"Plates, sheets, film, foil and strip, of non-cellular polyvinyl butyral"", not reinforced, laminated, supported or similarly combined with other materials, without backing, unworked or merely surface-worked or merely cut into squares or rectangles (excluding self-adhesive products, floor, wall and ceiling coverings of heading 3918)""",455230.0
202501,502,United States,392092,"Plates, sheets, film, foil and strip, of non-cellular polyamides, not reinforced, laminated, supported or similarly combined with other materials, without backing, unworked or merely surface-worked or merely cut into squares or rectangles (excluding self-adhesive products, floor, wall and ceiling coverings of heading 3918)",3696737.0
202501,502,United States,392093,"Plates, sheets, film, foil and strip, of non-cellular amino-resins, not reinforced, laminated, supported or similarly combined with other materials, without backing, unworked or merely surface-worked or merely cut into squares or rectangles (excluding self-adhesive products, floor, wall and ceiling coverings of heading 3918)",447159.0
202501,502,United States,392094,"Plates, sheets, film, foil and strip, of non-cellular phenolic resins, not reinforced, laminated, supported or similarly combined with other materials, without backing, unworked or merely surface-worked or merely cut into squares or rectangles (excluding self-adhesive products, floor, wall and ceiling coverings of heading 3918)",152823.0
202501,502,United States,392099,"Plates, sheets, film, foil and strip, of non-cellular plastics, n.e.s., not reinforced, laminated, supported or similarly combined with other materials, without backing, unworked or merely surface-worked or merely cut into squares or rectangles (excluding self-adhesive products, floor, wall and ceiling coverings of heading 3918 and sterile surgical or dental adhesion barriers of subheading 3006.10.30)",45972265.0
202501,502,United States,392111,"Plates, sheets, film, foil and strip, of polymers of styrene",7951272.0
202501,502,United States,392112,"Plates, sheets, film, foil and strip, of polymers of vinyl chloride",58917634.0
202501,502,United States,392113,"Plates, sheets, film, foil and strip, of polyurethanes",30755914.0
202501,502,United States,392114,"Plates, sheets, film, foil and strip, of regenerated cellulose",7547093.0
202501,502,United States,392119,"Plates, sheets, film, foil and strip, of other plastics",50187847.0
202501,502,United States,392190,"Plates, sheets, film, foil and strip, (excluding of cellular plastic; self-adhesive products, floor, wall and ceiling coverings of heading 3918)",101343323.0
202501,502,United States,392210,"Baths, showerbaths, sinks and washbasins,of plastics",126219379.0
202501,502,United States,392220,Lavatory seats and covers,38360121.0
202501,502,United States,392290,"Bidets, lavatory pans, flushing cisterns and similar sanitary ware, of plastics (excluding baths, shower-baths, sinks, washbasins, lavatory seats and covers)",47835369.0
202501,502,United States,392310,"Boxes, cases, crates and similar articles",331084039.0
202501,502,United States,392321,"Sacks and bags, incl. cones, of polymers of ethylene",550643124.0
202501,502,United States,392329,"Sacks and bags, incl. cones, of other plastics",292474881.0
202501,502,United States,392330,"Carboys, bottles, flasks and similar articles, of plastics",317180733.0
202501,502,United States,392340,"Spools, cops, bobbins and similar supports, of plastics",33544682.0
202501,502,United States,392350,"Stoppers, lids, caps and other closures, of plastics",309320741.0
202501,502,United States,392390,"Articles for the conveyance or packaging of goods, of plastics (excluding boxes, cases, crates and similar articles; sacks and bags, incl. cones; carboys, bottles, flasks and similar articles; spools, spindles, bobbins and similar supports; stoppers, lids, caps and other closures)",191940591.0
202501,502,United States,392410,"Tableware and kitchenware, of plastics",2312314954.0
202501,502,United States,392490,"Household articles and toilet articles, of plastics (excluding tableware, kitchenware, baths, shower-baths, washbasins, bidets, lavatory pans, seats and covers, flushing cisterns and similar sanitary ware)",1201680954.0
202501,502,United States,392510,"Reservoirs, tanks, vats and similar containers, of a capacity exceeding 300 l, of plastics",3766750.0
202501,502,United States,392520,"Doors, windows and their frames and thresholds for doors, of plastics",132444233.0
202501,502,United States,392530,"Shutters, blinds (including Venetian blinds) and similar articles and parts thereof, of plastics",67829209.0
202501,502,United States,392590,"Builderss ware of plastics, nes",233576953.0
202501,502,United States,392610,"Office or school supplies, of plastics",185453819.0
202501,502,United States,392620,"Articles of apparel and clothing accessories (including gloves, mittens and mitts), of plastics",512169208.0
202501,502,United States,392630,"Fittings for furniture, coachwork or the like, of plastics",174463941.0
202501,502,United States,392640,"Statuettes and other ornamental articles, of plastics",881304064.0
202501,502,United States,392690,"Articles of plastics and articles of other materials of heading 3901 to 3914, n.e.s (excluding goods of 9619)",4088927818.0
202501,502,United States,400211,Latex,22809.0
202501,502,United States,400219,"Styrene-butadiene rubber SBR""; carboxylated styrene-butadiene rubber ""XSBR"", in primary forms or in plates, sheets or strip (excluding latex)""",879576.0
202501,502,United States,400231,Isobuteneisoprene (butyl) rubber (IIR),14725.0
202501,502,United States,400239,"Halo-isobutene-isoprene rubber CIIR"" or ""BIIR"", in primary forms or in plates, sheets or strip""",740436.0
202501,502,United States,400249,"Chloroprene chlorobutadiene rubber, CR"", in primary forms or in plates, sheets or strip (excluding latex)""",1690617.0
202501,502,United States,400259,"Acrylonitrile-butadiene rubber NBR"", in primary forms or in plates, sheets or strip (excluding latex)""",910209.0
202501,502,United States,400270,Ethylenepropylenenonconjugated diene rubber (EPDM),987325.0
202501,502,United States,400299,"Synthetic rubber and factice derived from oils, in primary forms or in plates, sheets or strip (excluding latex, styrene-butadiene rubber SBR"", carboxylated styrene-butadiene rubber ""XSBR"", butadiene rubber ""BR"", isobutylene isoprene rubber ""IIR"", halo-isobutene-isoprene rubber ""CIIR"" or ""BIIR"", chloroprene rubber ""CR"", acrylonitrile-butadiene rubber ""NBR"", isoprene rubber ""IR"" and non-conjugated ethylene-propylene diene rubber ""EPDM"")""",9031899.0
202501,502,United States,400300,"Reclaimed rubber in primary forms or in plates, sheets or strip.",4807349.0
202501,502,United States,400510,"Compounded rubber with carbon black or silica, unvulcanized",33821.0
202501,502,United States,400591,"Compounded rubber, unvulcanised, in the form of plates, sheets or strip",62371.0
202501,502,United States,400690,"Rods, bars, tubes, profiles and other forms of unvulcanised rubber, incl. mixed rubber, and articles of unvulcanised rubber, incl. mixed rubber (excluding plates, sheets and strip which, apart from basic surface-working, have not been cut, or have merely been cut into square or rectangular shapes, and 'camel-back' strips)",1097092.0
202501,502,United States,400700,Vulcanised rubber thread and cord.,8637096.0
202501,502,United States,400811,"Plates, sheets and strip, of cellular rubber",9259186.0
202501,502,United States,400819,"Rods and profile shapes, of cellular rubber",940160.0
202501,502,United States,400821,"Plates, sheets and strip, of non-cellular rubber",18412053.0
202501,502,United States,400829,"Rods, tubes and profile shapes, of non-cellular rubber",1529464.0
202501,502,United States,400911,"Tubes, pipes and hoses, of vulcanised rubber (excluding hard rubber), not reinforced or otherwise combined with other materials, without fittings",25939239.0
202501,502,United States,400912,"Tubes, pipes and hoses, of vulcanised rubber (excluding hard rubber), not reinforced or otherwise combined with other materials, with fittings",40817122.0
202501,502,United States,400921,"Tubes, pipes and hoses, of vulcanised rubber (excluding hard rubber), reinforced or otherwise combined only with metal, without fittings",18679118.0
202501,502,United States,400922,"Tubes, pipes and hoses, of vulcanised rubber (excluding hard rubber), reinforced or otherwise combined only with metal, with fittings",56713413.0
202501,502,United States,400931,"Tubes, pipes and hoses, of vulcanised rubber (excluding hard rubber), reinforced or otherwise combined only with textile materials, without fittings",28350428.0
202501,502,United States,400932,"Tubes, pipes and hoses, of vulcanised rubber (excluding hard rubber), reinforced or otherwise combined only with textile materials, with fittings",54728277.0
202501,502,United States,400941,"Tubes, pipes and hoses, of vulcanised rubber (excluding hard rubber), reinforced or otherwise combined with materials other than metal or textile materials, without fittings",2087156.0
202501,502,United States,400942,"Tubes, pipes and hoses, of vulcanised rubber (excluding hard rubber), reinforced or otherwise combined with materials other than metal or textile materials, with fittings",12274848.0
202501,502,United States,401011,"Conveyor belts or belting, of vulcanised rubber, reinforced only with metal",4920514.0
202501,502,United States,401012,"Conveyor belts or belting, of vulcanised rubber, reinforced only with textile materials",64403199.0
202501,502,United States,401019,"Conveyor belts or belting, of vulcanised rubber (excluding reinforced only with metal or only with textile materials)",1502613.0
202501,502,United States,401031,"Endless transmission belts of trapezoidal crosssection (Vbelts), Vribbed, of an outside circumference exceeding 60 cm but not exceeding 180 cm",6650655.0
202501,502,United States,401032,"Endless transmission belts of trapezoidal crosssection (Vbelts), other than Vribbed, of an outside circumference exceeding 60 cm but not exceeding 180 cm",2233711.0
202501,502,United States,401033,"Endless transmission belts of trapezoidal crosssection (Vbelts), Vribbed, of an outside circumference exceeding 180 cm but not exceeding 240 cm",6391401.0
202501,502,United States,401034,"Endless transmission belts of trapezoidal crosssection (Vbelts), other than Vribbed, of an outside circumference exceeding 180 cm but not exceeding 240 cm",260925.0
202501,502,United States,401035,"Endless synchronous belts, of an outside circumference exceeding 60 cm but not exceeding 150 cm",2750681.0
202501,502,United States,401036,"Endless synchronous belts, of an outside circumference exceeding 150 cm but not exceeding 198 cm",37715.0
202501,502,United States,401039,"Other transmission belts or belting, of valcanized rubber",20198703.0
202501,502,United States,401110,"New pneumatic tyres, of rubber, of a kind used on motor cars (including station wagons and racing cars)",49285126.0
202501,502,United States,401120,"New pneumatic tyres, of rubber, of a kind used on buses or lorries",230360984.0
202501,502,United States,401140,"New pneumatic tyres, of rubber, of a kind used on motorcycles",19738633.0
202501,502,United States,401150,"New pneumatic tyres, of rubber, of a kind used on bicycles",10479225.0
202501,502,United States,401170,"New pneumatic tyres, of rubber, of a kind used on agricultural or forestry vehicles and machines",62010282.0
202501,502,United States,401180,"New pneumatic tyres, of rubber, of a kind used on construction, mining or industrial handling vehicles and machines",31049561.0
202501,502,United States,401190,"Other new pneumatic tyres, of rubber, o",144896396.0
202501,502,United States,401213,"Retreaded pneumatic tyres, of rubber, of a kind used on aircraft",641896.0
202501,502,United States,401220,Used pneumatic tyres,1924550.0
202501,502,United States,401290,"Solid or cushion tyres, interchangeable tyre treads and tyre flaps, of rubber",20401787.0
202501,502,United States,401310,"Inner tubes, of rubber, of a kind used on motor cars (including station wagons and racingcars), buses or lorries",3081288.0
202501,502,United States,401320,"Inner tubes, of rubber, of a kind used on bicycles",14074614.0
202501,502,United States,401390,"Inner tubes, of rubber (excluding those of a kind used on motor cars, incl. station wagons and racing cars, buses, lorries and bicycles)",5307562.0
202501,502,United States,401410,"Sheath contraceptives, of valcanized rubber",17889.0
202501,502,United States,401490,"Hygienic or pharmaceutical articles, incl. teats, of vulcanised rubber (excluding hard rubber), with or without fittings of hard rubber, n.e.s. (excluding sheath contraceptives and articles of apparel and clothing accessories, incl. gloves, for all purposes)",3891539.0
202501,502,United States,401512,"Gloves, mittens and mitts of vulcanised rubber, Of a kind used for medical, surgical, dental or veterinarypurposes",67762360.0
202501,502,United States,401519,"Gloves, mittens and mitts, of vulcanised rubber (excluding surgical gloves)",110043705.0
202501,502,United States,401590,"Articles of apparel and clothing accessories, for all purposes, of vulcanised rubber (excluding hard rubber and footwear and headgear and parts thereof, and gloves, mittens and mitts)",10250989.0
202501,502,United States,401610,"Articles of cellular rubber, of valcanized rubber",40604266.0
202501,502,United States,401691,"Floor coverings and mats, of valcanized rubber",44135983.0
202501,502,United States,401692,"Erasers, of valcanized rubber",14162129.0
202501,502,United States,401693,"Gaskets, washers and other seals,of valcanized rubber",180766836.0
202501,502,United States,401694,"Boat or dock fenders, whether or not inflatable, of valcanized rubber",3807289.0
202501,502,United States,401695,"Other inflatable articles, of valcanized rubber",7390520.0
202501,502,United States,401699,"Articles of vulcanised rubber (excluding hard rubber), n.e.s",266270273.0
202501,502,United States,401700,"Hard rubber (for example, ebonite) in all forms, including waste and scrap; articles of hard rubber",9500864.0
202501,502,United States,410711,"Full grains leather incl. parchment-dressed leather"", unsplit, of the whole hides and skins of bovine ""incl. buffalo"" or equine animals, further prepared after tanning or crusting, without hair on (excluding chamois leather, patent leather and patent laminated leather, and metallised leather)""",1042.0
202501,502,United States,410712,"Grain splits leather incl. parchment-dressed leather"", of the whole hides and skins of bovine ""incl. buffalo"" or equine animals, further prepared after tanning or crusting, without hair on (excluding chamois leather, patent leather and patent laminated leather, and metallised leather)""",1581309.0
202501,502,United States,410719,"Leather incl. parchment-dressed leather"" of the whole hides and skins of bovine ""incl. buffalo"" or equine animals, further prepared after tanning or crusting, without hair on (excluding unsplit full grains leather, grain splits leather, chamois leather, patent leather and patent laminated leather, and metallised leather)""",4041.0
202501,502,United States,410792,"Grain splits leather incl. parchment-dressed leather"", of the portions, strips or sheets of hides and skins of bovine ""incl. buffalo"" or equine animals, further prepared after tanning or crusting, without hair on (excluding chamois leather, patent leather and patent laminated leather, and metallised leather)""",97267.0
202501,502,United States,410799,"Leather incl. parchment-dressed leather"" of the portions, strips or sheets of hides and skins of bovine ""incl. buffalo"" or equine animals, further prepared after tanning or crusting, without hair on (excluding unsplit full grains leather, grain splits leather, chamois leather, patent leather and patent laminated leather, and metallised leather)""",2994.0
202501,502,United States,411320,"Leather further prepared after tanning or crusting incl. parchment-dressed leather"", of pigs, without hair on, whether or not split (excluding chamois leather, patent leather and patent laminated leather, and metallised leather)""",566313.0
202501,502,United States,411390,"Leather further prepared after tanning or crusting incl. parchment-dressed leather"", of antelopes, deer, elks, elephants and other animals, incl. sea animals, without wool or hair on, and leather of hairless animals, whether or not split (excluding leather of bovine and equine animals, sheep and lambs, goats or kids, swine and reptiles, and chamois leather, patent leather, patent laminated leather and metallised leather)""",6625.0
202501,502,United States,411510,"Composition leather with a basis of leather or leather fibre, inslabs, sheets or strip, whether or not in rolls",36983.0
