Date of data,Trading partner code,Trading partner,Commodity code,Commodity,Renminbi Yuan
202501,502,United States,841360,Other rotary positive displacement pumps,129187492.0
202501,502,United States,841370,Other centrifugal pumps,300184265.0
202501,502,United States,841381,"Pumps for liquids, power-driven (excluding those of subheading 8413.11 and 8413.19, fuel, lubricating or cooling medium pumps for internal combustion piston engine, concrete pumps, general reciprocating or rotary positive displacement pumps and centrifugal pumps of all kinds)",7478690.0
202501,502,United States,841382,Liquid elevators,46034.0
202501,502,United States,841391,"Parts of pumps for liquids, n.e.s.",509566947.0
202501,502,United States,841392,"Parts of liquid elevators, n.e.s.",1327882.0
202501,502,United States,841410,Vacuum pumps,61445479.0
202501,502,United States,841420,Hand or footoperated air pumps,24795700.0
202501,502,United States,841430,Compressors of a kind used in refrigerating equipment,285087086.0
202501,502,United States,841440,Air compressors mounted on a wheeled chassis for towing,2129045.0
202501,502,United States,841451,"Table, floor, wall, window, ceiling or roof fans, with a selfcontained electric motor of an output not exceeding 125 W",1645493194.0
202501,502,United States,841459,"Fans (excluding table, floor, wall, window, ceiling or roof fans, with a self-contained electric motor of an output ≤ 125 W)",428653261.0
202501,502,United States,841460,Hoods having a maximum horizontal side not exceeding 120 cm,73297452.0
202501,502,United States,841470,Gas-tight biological safety cabinets,15357.0
202501,502,United States,841480,"Air pumps, air or other gas compressors and ventilating or recycling hoods incorporating a fan, whether or not fitted with filters, having a maximum horizontal side ＞ 120 cm (excluding vacuum pumps, hand- or foot-operated air pumps, compressors for refrigerating equipment and air compressors mounted on a wheeled chassis for towing)",600745473.0
202501,502,United States,841490,"Parts of: air or vacuum pumps, air or other gas compressors, fans and ventilating or recycling hoods incorporating a fan, n.e.s.",339423124.0
202501,502,United States,841510,"Air conditioning machines of a kind designed to be fixed to a window, wall, ceiling or floor, selfcontained or .splitsystem.",543723857.0
202501,502,United States,841520,"Air conditioning machines of a kind used for persons, in motor vehicles",67585096.0
202501,502,United States,841581,Air conditioning machines incorporating a refrigerating unit and a valve for reversal of the cooling/heat cycle (reversible heat pumps),61496904.0
202501,502,United States,841582,"Other, air conditioning machines incorporating a refrigerating unit",226625056.0
202501,502,United States,841583,"Air conditioning machines,not incorporating a refrigerating unit",4955749.0
202501,502,United States,841590,"Parts of air conditioning machines, comprising a motor-driven fan and elements for changing the temperature and humidity, n.e.s.",1483797242.0
202501,502,United States,841610,Furnace burners for liquid fuel,24021.0
202501,502,United States,841620,"Other furnace burners, including combination burners",671415.0
202501,502,United States,841690,"Parts of furnace burners such as mechanical stokers, incl. their mechanical grates, mechanical ash dischargers and similar appliances, n.e.s.",3083198.0
202501,502,United States,841710,"Furnaces and ovens for the roasting, melting or other heattreatment of ores, pyrites or of metals",3325488.0
202501,502,United States,841720,"Bakery ovens, including biscuit ovens",12998746.0
202501,502,United States,841780,"Industrial or laboratory furnaces and ovens, non-electric, incl. incinerators (excluding those for the roasting, melting or other heat treatment of ores, pyrites or metals, bakery ovens, drying ovens and ovens for cracking operations)",8960787.0
202501,502,United States,841790,"Parts of industrial or laboratory furnaces, non-electric, incl. incinerators, n.e.s.",7560756.0
202501,502,United States,841810,"Combined refrigeratorfreezers, fitted with separate external doors or draws, or combinations thereof",449148835.0
202501,502,United States,841821,"Household refrigerators, compression-type",225287784.0
202501,502,United States,841829,"Household refrigerators, absorption-type",26443401.0
202501,502,United States,841830,"Freezers of the chest type, of a capacity ≤ 800L",123781055.0
202501,502,United States,841840,"Freezers of the upright type, of a capacity ≤ 900L",47229106.0
202501,502,United States,841850,"Furniture (chests, cabinets, display counters, show-cases and the like) for storage and display, incorporating refrigerating or freezing equipment (excluding combined refrigerator-freezers with separate external doors, household refrigerators and freezers of the chest type of a capacity ≤ 800L or of the upright type of a capacity ≤ 900L)",256651644.0
202501,502,United States,841861,Heat pumps other than air conditioning machines of heading 84.15,27686678.0
202501,502,United States,841869,Refrigerating or freezing equipment (excluding refrigerating and freezing furniture),512255236.0
202501,502,United States,841891,Furniture designed to receive refrigerating or freezing equipment,4454054.0
202501,502,United States,841899,"Parts of refrigerating or freezing equipment and heat pumps, n.e.s.",226434145.0
202501,502,United States,841911,Instantaneous gas water heaters,38622661.0
202501,502,United States,841912,Solar water heaters,534777.0
202501,502,United States,841919,"Instantaneous or storage water heaters, non-electric (excluding instantaneous gas water heaters and boilers or water heaters for central heating)",467025.0
202501,502,United States,841920,"Medical, surgical or laboratory sterilisers",7145516.0
202501,502,United States,841933,"Lyophilisation apparatus, freeze drying units and spray dryers",867826.0
202501,502,United States,841934,Dryers for agricultural products,1303304.0
202501,502,United States,841935,"Dryers for wood, paper pulp, paper or paperboard",3019750.0
202501,502,United States,841939,"Dryers (excluding dryers for agricultural products, for wood, paper pulp, paper or paperboard, for yarns, fabrics and other textile products, dryers for bottles or other containers, hairdryers, hand dryers and domestic appliances)",46133667.0
202501,502,United States,841940,Distilling or rectifying plant,10266623.0
202501,502,United States,841950,Heat exchange units,245809522.0
202501,502,United States,841960,Machinery for liquefying air or other gases,183160401.0
202501,502,United States,841981,"Machinery, plant and equipment for making hot drinks or for cooking or heating food (excluding domestic appliances)",151673602.0
202501,502,United States,841989,"Machinery, plant or laboratory equipment, whether or not electrically heated, for the treatment of materials by a process involving a change of temperature such as heating, cooking, roasting, sterilising, pasteurising, steaming, evaporating, vaporising, condensing or cooling, n.e.s. (excluding machinery used for domestic purposes and furnaces, ovens and other equipment of heading 8514)",165797354.0
202501,502,United States,841990,"Parts of machinery, plant and laboratory equipment, whether or not electrically heated, for the treatment of materials by a process involving a change of temperature, and of non-electric instantaneous and storage water heaters, n.e.s.",137010464.0
202501,502,United States,842010,Calendering or other rolling machines,56861405.0
202501,502,United States,842091,Cylinders,2327658.0
202501,502,United States,842099,"Parts for calendering or rolling machines, n.e.s. (other than for metals or glass and excluding cylinders)",91314.0
202501,502,United States,842111,Centrifugal cream separators,136444.0
202501,502,United States,842112,Centrifugal clothes-dryers,525124.0
202501,502,United States,842119,"Centrifuges, incl. centrifugal dryers (excluding isotope separators, cream separators and clothes dryers)",21809299.0
202501,502,United States,842121,Machinery and apparatus for filtering or purifying water,243653598.0
202501,502,United States,842122,Machinery and apparatus for filtering or purifying beverages (excludingwater),169586.0
202501,502,United States,842123,Oil or petrol-filters for internal combustion engines,165587012.0
202501,502,United States,842129,"Machinery and apparatus for filtering or purifying liquids (excluding such machinery and apparatus for water and other beverages, oil or petrol-filters for internal combustion engines and artificial kidneys)",103412928.0
202501,502,United States,842131,Intake air filters for internal combustion engines,90838039.0
202501,502,United States,842132,"Catalytic converters or particulate filters, whether or not combined, for purifying or filtering exhaust gases from internal combustion engines",37697226.0
202501,502,United States,842139,Machinery and apparatus for filtering or purifying gases (excluding isotope separators and intake air filters for internal combustion engines),370720353.0
202501,502,United States,842191,"Parts of centrifuges, incl. centrifugal dryers, n.e.s.",13505876.0
202501,502,United States,842199,"Parts of machinery and apparatus for filtering or purifying liquids or gases, n.e.s.",509239702.0
202501,502,United States,842211,Dishwashing machines of the household type,109901377.0
202501,502,United States,842219,Dishwashing machines (excluding those of the household type),3246427.0
202501,502,United States,842220,Machinery for cleaning or drying bottles or other containers (excluding dishwashing machines),19027678.0
202501,502,United States,842230,"Machinery for filling, closing, sealing or labelling bottles, cans, boxes, bags or other containers; machinery for capsuling bottles, jars, tubes and similar containers; machinery for aerating beverages",143768559.0
202501,502,United States,842240,"Packing or wrapping machinery, incl. heat-shrink wrapping machinery (excluding machinery for filling, closing, sealing or labelling bottles, cans, boxes, bags or other containers and machinery for capsuling bottles, jars, tubes and similar containers)",58289820.0
202501,502,United States,842290,"Parts of dishwashing machines, packing or wrapping machinery and other machinery and apparatus of heading 8422, n.e.s.",51769928.0
202501,502,United States,842310,"Personal weighing machines, incl. baby scales; household scales",162945488.0
202501,502,United States,842320,Scales for continuous weighing of goods on conveyors,474840.0
202501,502,United States,842330,"Constant weight scales and scales for discharging a pre-determined weight of material into a bag or container, incl. hopper scales (excluding scales for continuous weighing of goods on conveyors)",2832950.0
202501,502,United States,842381,"Weighing machinery having a maximum weighing capacity ≤ 30 kg (excluding balances of a sensitivity of 5 cg or better, personal weighing machines, household scales, scales for continuous weighing of goods on conveyors, constant weight scales and scales for discharging a pre-determined weight of material into a bag or container, incl. hopper scales)",11922886.0
202501,502,United States,842382,"Weighing machinery of a maximum weighing capacity ＞ 30 kg but ≤ 5.000 kg (excluding personal weighing machines, scales for continuous weighing of goods on conveyors, constant weight scales and scales for discharging a pre-determined weight of material into a bag or container, incl. hopper scales)",20080710.0
202501,502,United States,842389,Weighing machinery of a maximum weighing capacity ＞ 5.000 kg,911160.0
202501,502,United States,842390,"Weighing machine weights of all kinds; parts of weighing machinery, n.e.s.",17233743.0
202501,502,United States,842410,"Fire extinguishers, whether or not charged",19016765.0
202501,502,United States,842420,Spray guns and similar appliances,199258122.0
202501,502,United States,842430,Steam or sand blasting machines and similar jet projecting machines,138399744.0
202501,502,United States,842441,"Agricultural or horticultural sprayers, portable",38249237.0
202501,502,United States,842449,Agricultural or horticultural sprayers (excl. portable),6649212.0
202501,502,United States,842482,"Agricultural or horticultural mechanical appliances, whether or not hand-operated, for projecting or dispersing liquids or powders (excl. sprayers)",49858502.0
202501,502,United States,842489,"Mechanical appliances, whether or not hand-operated, for projecting, dispersing or spraying liquids or powders, n.e.s.",262661834.0
202501,502,United States,842490,"Parts of fire extinguishers, spray guns and similar appliances, steam or sand blasting machines and similar jet projecting machines and machinery and apparatus for projecting, dispersing or spraying liquids or powders, n.e.s.",282581611.0
202501,502,United States,842511,"Pulley tackle and hoists, powered by electric motor (other than skip hoists or hoists of a kind used for raising vehicles)",25890732.0
202501,502,United States,842519,"Pulley tackle and hoists (other than skip hoists or hoists of a kind used for raising vehicles), non-powered by electric motor",32174788.0
202501,502,United States,842531,Winches and capstans powered by electric motor,131475968.0
202501,502,United States,842539,"Winches and capstans, non-powered by electric motor",22407189.0
202501,502,United States,842541,Built-in jacking systems of a type used in garages,42838.0
202501,502,United States,842542,"Jacks and hoists, hydraulic (excluding built-in jacking systems used in garages)",282890262.0
202501,502,United States,842549,"Jacks and hoists of a kind used for raising vehicles, not hydraulic",155344567.0
202501,502,United States,842611,Overhead travelling cranes on fixed support,1698113.0
202501,502,United States,842612,Mobile lifting frames on tyres and straddle carriers,1672846.0
202501,502,United States,842619,"Overhead travelling cranes, transporter cranes, gantry cranes, bridge cranes and mobile lifting frames (excluding overhead travelling cranes on fixed support, mobile lifting frames on tyres, straddle carriers and portal or pedestal jib cranes)",45663613.0
202501,502,United States,842630,Portal or pedestal jib cranes,348892.0
202501,502,United States,842641,"Mobile cranes and works trucks fitted with a crane, self-propelled, on tyres (excluding wheel-mounted cranes, mobile lifting frames on tyres and straddle carriers)",1993323.0
202501,502,United States,842649,"Mobile cranes and works trucks fitted with a crane, self-propelled (excluding those on tyres and straddle carriers)",4974537.0
202501,502,United States,842699,"Ships' derricks; cranes, incl. cable cranes (excluding overhead travelling cranes, transporter cranes, gantry cranes, portal or pedestal jib cranes, bridge cranes, mobile lifting frames and straddle carriers, tower cranes, works trucks fitted with a crane, mobile cranes and cranes designed for mounting on road vehicles)",2352244.0
202501,502,United States,842710,Selfpropelled trucks powered by an electric motor,477795199.0
202501,502,United States,842720,Other selfpropelled trucks,184060237.0
202501,502,United States,842790,"Works trucks fitted with lifting or handling equipment, not self-propelled",72216799.0
202501,502,United States,842810,Lifts and skip hoists,16887247.0
202501,502,United States,842820,Pneumatic elevators and conveyors,2489336.0
202501,502,United States,842832,"Continuous-action elevators and conveyors, for goods or materials, bucket type",3520046.0
202501,502,United States,842833,"Continuous-action elevators and conveyors, for goods or materials, belt type",41394362.0
202501,502,United States,842839,"Continuous-action elevators and conveyors, for goods or materials (excluding those for underground use and bucket, belt or pneumatic types)",92782171.0
202501,502,United States,842840,Escalators and moving walkways,21641108.0
202501,502,United States,842870,Industrial robots,62440435.0
202501,502,United States,842890,"Machinery for lifting, handling, loading or unloading, nes",124732493.0
202501,502,United States,842920,Graders and levellers,875697.0
202501,502,United States,842940,Tamping machines and road rollers,31653727.0
202501,502,United States,842951,Frontend shovel loaders,216277343.0
202501,502,United States,842952,Machinery with a 360? revolving superstructure,219348974.0
202501,502,United States,842959,"Self-propelled mechanical shovels, excavators and shovel loaders (excluding self-propelled mechanical shovels with a 360° revolving superstructure and front-end shovel loaders)",3887496.0
202501,502,United States,843010,Piledrivers and pileextractors,7624278.0
202501,502,United States,843020,Snowploughs and snowblowers,13463803.0
202501,502,United States,843039,"Other, coal or rock cutters and tunnelling machinery, not self-propelled",309262.0
202501,502,United States,843041,"Other, self-propelled boring or sinking machinery for boring earth or extracting minerals or ores",518748.0
202501,502,United States,843049,"Other, boring or sinking machinery for boring earth or extracting minerals or ores, not self-propelled and not hydraulic",3166978.0
202501,502,United States,843050,"Other machinery, selfpropelled",16818484.0
202501,502,United States,843061,"Tamping or compacting machinery, not self-propelled (excluding hand-operated tools)",11637434.0
202501,502,United States,843069,"Earth moving machinery, not self-propelled, n.e.s.",32293985.0
202501,502,United States,843110,Part of machinery of heading 84.25,53764962.0
202501,502,United States,843120,Part of machinery of heading 84.27,197548514.0
202501,502,United States,843131,"Part off lifts, skip hoists or escalators, of heading 84.28",80270695.0
202501,502,United States,843139,"Parts of machinery of heading 8428, n.e.s.",94184980.0
202501,502,United States,843141,"Buckets, shovels, grabs and grips",39496310.0
202501,502,United States,843142,Bulldozer or angledozer blades,226236.0
202501,502,United States,843143,Parts for boring or sinking machinery of subheading 8430.41 or,251415237.0
202501,502,United States,843149,"Parts of machinery of heading 8426, 8429 and 8430, n.e.s.",670279889.0
202501,502,United States,843210,Ploughs,617544.0
202501,502,United States,843229,"Harrows, scarifiers, cultivators, weeders and hoes for use in agriculture, horticulture or forestry (excluding disc harrows)",37843758.0
202501,502,United States,843231,"Notill direct seeders, planters and transplanters",3381846.0
202501,502,United States,843239,"No-till direct seeders, planters and transplanters",3498841.0
202501,502,United States,843241,"Seeders, planters and transplanters (excl. no-till machines)",144336.0
202501,502,United States,843242,Fertiliser distributors,292293.0
202501,502,United States,843280,"Agricultural, horticultural or forestry machinery for soil preparation or cultivation; lawn or sports-ground rollers (excluding sprayers and dusters, ploughs, harrows, scarifiers, cultivators, weeders, hoes, seeders, planters, manure spreaders and fertiliser distributors)",18423546.0
202501,502,United States,843290,"Parts of agricultural, horticultural or forestry machinery for soil preparation or cultivation or of lawn or sports-ground rollers, n.e.s.",101093622.0
202501,502,United States,843311,"Powered, with the cutting device rotating in a horizontal plane",593457828.0
202501,502,United States,843319,"Mowers for lawns, parks or sports grounds, powered, with the cutting device rotating in a vertical plane or with cutter bars",32759643.0
202501,502,United States,843320,"Other mowers, including cutter bars for tractor mounting",13406431.0
202501,502,United States,843330,Other haymaking machinery,105573.0
202501,502,United States,843340,"Straw or fodder balers, including pickup balers",7520288.0
202501,502,United States,843352,Threshing machinery (excluding combine harvester-threshers),43047.0
202501,502,United States,843353,Root or tuber harvesting machines,199446.0
202501,502,United States,843359,"Harvesting machinery for agricultural produce (excluding mowers, haymaking machinery, straw and fodder balers, incl. pick-up balers, combine harvester-threshers, other threshing machinery and root or tuber harvesting machines)",57794.0
202501,502,United States,843360,"Machines for cleaning, sorting or grading eggs, fruit or other agricultural produce",132765.0
202501,502,United States,843390,"Parts of harvesting machinery, threshing machinery, mowers and machines for cleaning, sorting or grading agricultural produce, n.e.s.",232118624.0
202501,502,United States,843410,Milking machines,411694.0
202501,502,United States,843420,Dairy machinery,20902.0
202501,502,United States,843490,"Parts of milking machines and dairy machinery, n.e.s.",5023343.0
202501,502,United States,843510,"Presses, crushers and similar machinery used in the manufacture of wine, cider, fruit juices or similar beverages (excluding machinery for the treatment of these beverages, incl. centrifuges, filter presses, other filtering equipment and domestic appliances)",3520031.0
202501,502,United States,843590,"Parts of presses, crushers and similar machinery used in the manufacture of wine, cider, fruit juices or similar beverages, n.e.s.",1285018.0
202501,502,United States,843610,Machinery for preparing animal feeding stuffs,434818.0
202501,502,United States,843621,Poultry incubators and brooders,15439162.0
202501,502,United States,843629,"Poultry-keeping machinery (excluding machines for sorting or grading eggs, poultry pickers of heading 8438 and incubators and brooders)",3433830.0
202501,502,United States,843680,"Agricultural, horticultural, forestry or bee-keeping machinery, n.e.s.",39659197.0
202501,502,United States,843691,"Parts of poultry-keeping machinery or poultry incubators and brooders, n.e.s.",2445533.0
202501,502,United States,843699,"Parts of agricultural, horticultural, forestry or bee-keeping machinery of heading 84.36, n.e.s.",8557321.0
202501,502,United States,843710,"Machines for cleaning, sorting or grading seed, grain or dried leguminous vegetables",3215063.0
202501,502,United States,843780,"Machinery used in the milling industry or for the working of cereals or dried leguminous vegetables (excluding farm-type machinery, heat treatment equipment, centrifugal dryers, air filters and machines for cleaning, sorting or grading seed, grain or dried leguminous vegetables)",1541920.0
202501,502,United States,843790,"Parts of machinery used in the milling industry or for the working of cereals or dried leguminous vegetables or machines for cleaning, sorting or grading seed, grain or dried leguminous vegetables, n.e.s.",6805276.0
202501,502,United States,843810,"Bakery machinery and machinery for the manufacture of macaroni, spaghetti or similar products",18535751.0
202501,502,United States,843820,"Machinery for the manufacture of confectionery, cocoa or chocolate",15216003.0
202501,502,United States,843830,Machinery for sugar manufacture,373931.0
202501,502,United States,843840,Brewery machinery,16634707.0
202501,502,United States,843850,Machinery for the preparation of meat or poultry,29113149.0
202501,502,United States,843860,"Machinery for the preparation of fruits, nuts or vegetables",9164632.0
202501,502,United States,843880,"Machinery for the industrial preparation or manufacture of food or drink, nes",19633373.0
202501,502,United States,843890,"Parts of machinery for the industrial preparation or manufacture of food or drink, nes",26485468.0
202501,502,United States,843910,Machinery for making pulp of fibrous cellulosic material,861341.0
202501,502,United States,843930,Machinery for finishing paper or paperboard,8454065.0
202501,502,United States,843991,"Parts of machinery for making pulp of fibrous cellulosic material, n.e.s.",6127020.0
202501,502,United States,843999,"Parts of machinery for making or finishing paper or paperboard, n.e.s.",4967853.0
202501,502,United States,844010,"Bookbinding machinery, incl. book-sewing machines (excluding machinery of heading 8441, general-purpose presses, printing machinery of heading 8443 and machines of uses ancillary to printing)",4168220.0
202501,502,United States,844090,"Parts of bookbinding machinery, n.e.s.",54878.0
202501,502,United States,844110,Cutting machines,23727611.0
202501,502,United States,844120,"Machines for making bags, sacks or envelopes",9560046.0
202501,502,United States,844130,"Machines for making cartons, boxes, cases, tubes, drums or similar containers, other than by moulding",11228800.0
202501,502,United States,844140,"Machines for moulding articles in paper pulp, paper or paperboard",4742164.0
202501,502,United States,844180,"Machinery for making up paper pulp, paper or paperboard, n.e.s.",11982985.0
202501,502,United States,844190,"Parts of machinery for making up paper pulp, paper or paperboard, n.e.s.",5512106.0
202501,502,United States,844230,"Machinery, apparatus and equipment",701532.0
202501,502,United States,844240,"Parts of the foregoing machinery, apparatus or equipment",71100.0
202501,502,United States,844250,"Plates, cylinders and other printing components; plates, cylinders and lithographic stones, prepared for printing purposes (for example, planed, grained or polished)",2711858.0
202501,502,United States,844313,Other offset printing machinery,25486304.0
202501,502,United States,844314,"Letterpress printing machinery, reel fed, excluding flexographic printing",406654.0
202501,502,United States,844316,Flexographic printing machinery,202663.0
202501,502,United States,844317,Gravure printing machinery,70277.0
202501,502,United States,844319,"Printing machinery used for printing by means of plates, cylinders and other printing components of heading 8442 (excluding hectograph or stencil duplicating machines, addressing machines and other office printing machines of heading 8469 to 8472, ink jet printing machines and offset, flexographic, letterpress and gravure printing machinery)",19882127.0
