Date of data,Trading partner code,Trading partner,Commodity code,Commodity,Renminbi Yuan
201512,502,United States,5703,"Carpets and other textile floor coverings, tufted, whether or not made up.",134179942
201512,502,United States,5704,"Carpets and other floor coverings, of felt, not tufted or flocked, whether or not made up",5181449
201512,502,United States,5705,"Other carpets and other textile floor coverings, whether or not made up.",83157278
201512,502,United States,5801,"Woven pile fabrics and chenille fabrics (excluding terry towelling and similar woven terry fabrics, tufted textile fabrics and narrow woven fabrics of heading 5806)",80578605
201512,502,United States,5802,"Terry towelling and similar woven terry fabrics, tufted textile fabrics (excluding narrow woven fabrics of heading 5806, carpets and other floor coverings)",853908
201512,502,United States,5803,"Gauze, other than narrow fabrics of heading 58.06",518540
201512,502,United States,5804,"Tulles and other net fabrics, not including woven, knitted or crocheted fabrics; lace in the piece, in strips or in motifs, other than fabrics of headings 60.02 to 60.06.",28553370
201512,502,United States,5805,"Hand-woven tapestries of the type Gobelin, Flanders, Aubusson, Beauvais and the like, and needle-worked tapestries, e.g. petit point, cross-stitch, whether or not made up (excluding Kelem, Schumacks, Karamanie and the like, and tapestries ＞ 100 years old)",8906
201512,502,United States,5806,"Narrow woven fabrics of textile materials, with a width of ≤ 30 cm (excluding labels, badges and similar articles); narrow fabrics consisting of warp without weft assembled by means of an adhesive ""bolducs""",50831947
201512,502,United States,5807,"Cabels, badges and similar articles of textile materials, in the piece, in strips or cut to shape or size, not embroidered.",10126303
201512,502,United States,5808,"Braids of textile materials, in the piece; ornamental trimmings of textile materials, in the piece, not embroidered, other than knitted or crocheted; tassels, pompons and similar articles of textile materials",9407216
201512,502,United States,5809,"Woven fabrics of metal thread and woven fabrics of metallised yarn of heading 5605, of a kind used in apparel, as furnishing fabrics or for similar purposes, n.e.s.",369394
201512,502,United States,5810,"Embroidery on a textile fabric ground, in the piece, in strips or in motifs",40594355
201512,502,United States,5811,"Quilted textile products in the piece, composed of one or more layers of textile materials assembled with padding by stitching or otherwise (excluding embroidery of heading 5810 and quilted fabrics for bedding and furnishings)",1674368
201512,502,United States,5901,"Quilted textile products in the piece, composed of one or more layers of textile materials assembled with padding by stitching or otherwise (excluding embroidery of heading 5810 and quilted fabrics for bedding and furnishings)",26854356
201512,502,United States,5902,"Tyre cord fabric of high-tenacity yarn of nylon or other polyamides, polyesters or viscose rayon, whether or not dipped or impregnated with rubber or plastic",17047230
201512,502,United States,5903,"Textile fabrics impregnated, coated, covered or laminated with plastics, other than those of heading 59.02.",181742668
201512,502,United States,5904,"Linoleum, whether or not cut to shape; floor coverings consisting of a coating or covering applied on a textile backing, whether or not cut to shape.",679733
201512,502,United States,5905,Textile wall coverings.,4547938
201512,502,United States,5906,"Rubberised textile fabrics, other than those of heading 59.02.",3088566
201512,502,United States,5907,"Impregnated, coated or covered textile fabrics; painted canvas being theatrical scenery, studio backcloths or the like, n.e.s.",10836068
201512,502,United States,5908,"Textile wicks, woven, plaited or knitted, for lamps, stoves, lighters, candles or the like; incandescent gas mantles and tubular knitted gas-mantle fabric for incandescent gas mantles, whether or not impregnated",1000370
201512,502,United States,5909,"Textile hosepiping and similar textile tubing, whether or not impregnated or coated, with or without lining, armour or accessories of other materials",7226201
201512,502,United States,5910,"Transmission or conveyor belts or belting, of textile material, whether or not impregnated, coated, covered or laminated with plastics, or reinforced with metal or other material.",4864979
201512,502,United States,5911,"Textile products and articles, for technical use, specified in Note 7 to chapter 59",46444877
201512,502,United States,6001,"Pile fabrics, incl. ""long pile"" fabrics and terry fabrics, knitted or crocheted",49811928
201512,502,United States,6002,"Knitted or crocheted fabrics of a width not exceeding 30cm, containing by weight 5% or more of elastomeric yarn or rubber thread, other than those of heading 60.01.",1414022
201512,502,United States,6003,"Knitted or crocheted fabrics of a width not exceeding 30cm, other than those of heading 60.01 or 60.02.",897023
201512,502,United States,6004,"Knitted or crocheted fabrics of a width exceeding 30 cm, containing by weight 5% or more of elastomeric yarn or rubber thread, other than those of heading 60.01",49724083
201512,502,United States,6005,"Warp knit fabrics (including those made on galloon knitting machines), other than those of headings 60.01 to 60.04.",29307410
201512,502,United States,6006,Other knitted or crocheted fabrics.,254301459
201512,502,United States,6101,"Men's or boys' overcoats, car coats, capes, cloaks, anoraks, incl. ski jackets, windcheaters, wind-jackets and similar articles, knitted or crocheted (excluding suits, ensembles, jackets, blazers, bib and brace overalls and trousers)",20034952
201512,502,United States,6102,"Women's or girls' overcoats, carcoats, capes, cloaks, anoraks (including skijackets), windcheaters, windjackets and similar articles, knitted or crocheted, other than those of heading 61.04.",110675950
201512,502,United States,6103,"Men's or boys' suits, ensembles, jackets, blazers, trousers, bib and brace overalls, breeches and shorts",373613993
201512,502,United States,6104,"Women's or girls' suits, ensembles, jackets, blazers, dresses, skirts, divided skirts, trousers, bib and brace overalls, breeches and shorts, knitted or crocheted",2264208795
201512,502,United States,6105,"en's or boys' shirts, knitted or crocheted.",152360601
201512,502,United States,6106,"Women's or girls' blouses, shirts and shirt-blouses, knitted or crocheted (excluding T-shirts and vests)",103611205
201512,502,United States,6107,"Men's or boys' underpants, briefs, nightshirts, pyjamas, bathrobes, dressing gowns and similar articles, knitted or crocheted (excluding vests and singlets)",174431623
201512,502,United States,6108,"Women's or girls' slips, petticoats, briefs, panties, nightdresses, pyjamas, négligés, bathrobes, dressing gowns, housecoats and similar articles, knitted or crocheted (excluding T-shirts, vests, brassieres, girdles, corsets and similar articles)",709995815
201512,502,United States,6109,"T-shirts, singlets and other vests, knitted or crocheted",1304114698
201512,502,United States,6110,"Jerseys, pullovers, cardigans, waistcoats and similar articles, of wool, knitted or crocheted (excluding wadded waistcoats)",1855982775
201512,502,United States,6111,"Babies' garments and clothing accessories of wool or fine animal hair, knitted or crocheted (excluding hats)",476303105
201512,502,United States,6112,"Track-suits, ski-suits and swimwear, knitted or crocheted",421217578
201512,502,United States,6113,"Garments, knitted or crocheted, rubberised or impregnated, coated or covered with plastics or other materials (excluding babies' garments and clothing accessories)",17527794
201512,502,United States,6114,"Special garments for professional, sporting or other purposes, n.e.s., knitted or crocheted",202396916
201512,502,United States,6115,"Pantyhose, tights, stockings, socks and other hosiery, incl. graduated compression hosiery [e.g., stockings for varicose veins] and footwear without applied soles, knitted or crocheted (excluding for babies)",671867129
201512,502,United States,6116,"Gloves, mittens and mitts, knitted or crocheted (excluding for babies)",188210106
201512,502,United States,6117,"Other made up clothing accessories, knitted or crocheted; knitted or crocheted parts of garments or of clothing accessories.",119481311
201512,502,United States,6201,"Men’s or boys’ overcoats, car-coats, capes, cloaks, anoraks (including ski-jackets), wind-cheaters, windjackets and similar articles, other than those of heading 62.03.",119931173
201512,502,United States,6202,"Women’s or girls’ overcoats, car-coats, capes, cloaks, anoraks (including ski-jackets), wind-cheaters, wind-jackets and similar articles, other than those of heading 62.04.",207564710
201512,502,United States,6203,"Men's or boys' suits, ensembles, jackets, blazers, trousers, bib and brace overalls, breeches and shorts (excluding knitted or crocheted, wind-jackets and similar articles, separate waistcoats, tracksuits, ski suits and swimwear)",1369376523
201512,502,United States,6204,"Women's or girls' suits, ensembles, jackets, blazers, dresses, skirts, divided skirts, trousers, bib and brace overalls, breeches and shorts (excluding knitted or crocheted, wind-jackets and similar articles, slips, petticoats and panties, tracksuits, ski suits and swimwear)",3706389729
201512,502,United States,6205,Men's or boys' shirts.,531830741
201512,502,United States,6206,"Women's or girls' blouses, shirts and shirtblouses.",352342970
201512,502,United States,6207,"Men's or boys' singlets and other vests, underpants, briefs, nightshirts, pyjamas, bathrobes, dressing gowns and similar articles",32912975
201512,502,United States,6208,"Women's or girls' singlets and other vests, slips, petticoats, briefs, panties, nightdresses, pyjamas, négligés, bathrobes, dressing gowns, housecoats and similar articles (excluding knitted or crocheted, brassières, girdles, corsets and similar articles)",256138632
201512,502,United States,6209,Babies garments and clothing accessories of textile materials (excluding knitted or crocheted and hats),97424695
201512,502,United States,6210,"Garments made up of felt or nonwovens, whether or not impregnated, coated, covered or laminated; garments of textile fabrics, rubberised or impregnated, coated, covered or laminated with plastics or other substances (excluding knitted or crocheted, and babies' garments and clothing accessories)",447969965
201512,502,United States,6211,"Tracksuits, ski suits, swimwear and other garments, n.e.s.",574977005
201512,502,United States,6212,"Brassieres, girdles, corsets, braces, suspenders, garters and similar articles and parts thereof, of all types of textile materials, whether or not elasticated, incl. knitted or crocheted (excluding belts and corselets made entirely of rubber)",790039103
201512,502,United States,6213,Handkerchiefs,10837548
201512,502,United States,6214,"Shawls, scarves, mufflers, mantillas, veils and similar articles",130471608
201512,502,United States,6215,"Ties, bow ties and cravats of textile materials",76805890
201512,502,United States,6216,"Gloves, mittens and mitts, of all types of textile materials (excluding knitted or crocheted and for babies)",47377824
201512,502,United States,6217,"Made-up clothing accessories and parts of garments or clothing accessories, of all types of textile materials, n.e.s.",29456790
201512,502,United States,6301,Blankets and travelling rugs,265383470
201512,502,United States,6302,"Bed linen, table linen, toilet linen and kitchen linen.",1048411261
201512,502,United States,6303,Curtains (including drapes) and interior blinds; curtain or bed valances.,379919108
201512,502,United States,6304,"Other furnishing articles, excluding those of heading 94.04.",479395637
201512,502,United States,6305,"Packs and bags, of a kind used for the packing of goods.",133844950
201512,502,United States,6306,"Tarpaulins, awnings and sunblinds; tents; sails for boats, sailboards or landcraft; camping goods of all types of textile materials",401262039
201512,502,United States,6307,"other made up articles, including dress patterns.",1171985985
201512,502,United States,6308,"Sets consisting of woven fabric and yarn, whether or not with accessories, for making up into rugs, tapestries, embroidered table cloths or serviettes, or similar textile articles, put up in packings for retail sale.",1759030
201512,502,United States,6310,"Used or new rags, scrap twine, cordage, rope and cables and worn-out articles thereof, of textile materials",296272
201512,502,United States,6401,"Waterproof footwear with outer soles and uppers of rubber or of plastics, the uppers of which are neither fixed to the sole nor assembled by stitching, riveting, nailing, screwing, plugging or similar processes.",88391381
201512,502,United States,6402,Other footwear with outer soles and uppers of rubber or plastics.,2712671516
201512,502,United States,6403,"ootwear with outer soles of rubber, plastics, leather or composition leather and uppers of leather.",2591238688
201512,502,United States,6404,"Footwear with outer soles of rubber, plastics, leather or composition leather and uppers of textile materials.",2509423705
201512,502,United States,6405,Other footwear.,100437923
201512,502,United States,6406,"Parts of footwear, incl. uppers whether or not attached to soles other than outer soles; removable in-soles, heel cushions and similar articles; gaiters, leggings and similar articles, and parts thereof (excluding articles of asbestos)",84233424
201512,502,United States,6502,"Hatshapes, plaited or made by assembling strips of any material, neither blocked to shape, nor with made brims, nor lined, nor trimmed",3537151
201512,502,United States,6504,"Hats and other headgear, plaited or made by assembling strips of any material, whether or not lined or trimmed",91499742
201512,502,United States,6505,"Hats and other headgear, knitted or crocheted, or made up from lace, felt or other textile fabric, in the piece (but not in strips), whether or not lined or trimmed; hairnets of any material, whether or not lined or trimmed.",470195803
201512,502,United States,6506,"Other headgear, whether or not lined or trimmed.",196620008
201512,502,United States,6507,"Headbands, linings, covers, hat foundations, hat frames, peaks and chinstraps, for headgear",11528663
201512,502,United States,6601,"Umbrellas and sun umbrellas (including walkingstick umbrellas, garden umbrellas and similar umbrellas).",369062104
201512,502,United States,6602,"Walkingsticks, seatsticks, whips, ridingcrops and the like",10348645
201512,502,United States,6603,"Parts, trimmings and accessories of articles of heading 66.01 or 66.02.",24575135
201512,502,United States,6701,"Skins and other parts of birds with their feathers or down, feathers, parts of feathers, down and articles thereof (other than goods of heading 05.05 and worked quills and scapes)",9201190
201512,502,United States,6702,"Artificial flowers, foliage and fruit and parts thereof; articles made of artificial flowers, foliage or fruit.",550682877
201512,502,United States,6703,"Human hair, dressed, thinned, bleached or otherwise worked; wool or other animal hair or other textile materials, prepared for use in making wigs or the like.",40643850
201512,502,United States,6704,"igs, false beards, eyebrows and eyelashes, switches and the like, of human or animal hair or of textile materials; articles of human hair not elsewhere specified or included.",857562300
201512,502,United States,6801,"Setts, curbstones and flagstones, of natural stone (except slate).",1865471
201512,502,United States,6802,"Worked monumental or building stone (except slate) and articles thereof, other than goods of heading 68.01; mosaic cubes and the like, of natural stone (including slate), whether or not on a backing; artificially coloured granules, chippings and powder, of natural stone (including slate).",514886578
201512,502,United States,6803,Worked slate and articles of slate or of agglomerated slate.,29003136
201512,502,United States,6804,"Millstones, grindstones, grinding wheels and the like, without frameworks, for milling, grinding, pulping, sharpening, polishing, trueing or cutting, hand sharpening or polishing stones, and parts thereof, of natural stone, of agglomerated natural or artificial abrasives, or of ceramics, with or without parts of other materials",33230119
201512,502,United States,6805,"Natural or artificial abrasive powder or grain, on a base of textile material, of paper, of paperboard or of other materials, whether or not cut to shape or sewn or otherwise made up.",19413450
201512,502,United States,6806,"Slag-wool, rock-wool and similar mineral wools; exfoliated vermiculite, expanded clays, foamed slag and similar expanded mineral materials; mixtures and articles of heat-insulating, sound-insulating or sound absorbing mineral materials",3447460
201512,502,United States,6807,"Articles of asphalt or of similar material (for example, petroleum bitumen or coal tar pitch).",19994
201512,502,United States,6808,"Panels, boards, tiles, blocks and similar articles of vegetable fibre, of straw or of shavings, chips, particles, sawdust or other waste, of wood, agglomerated with cement, plaster or other mineral binders",3280002
201512,502,United States,6809,Articles of plaster or of compositions based on plaster.,1419237
201512,502,United States,6810,"Articles of cement, of concrete or of artificial stone, whether or not reinforced.",593491551
201512,502,United States,6811,"Articles of asbestos-cement, of cellulose fibre-cement or the like.",22101616
201512,502,United States,6812,"Fabricated asbestos fibres; mixtures with a basis of asbestos or with a basis of asbestos and magnesium carbonate; articles of such mixtures or of asbestos (for example, thread, woven fabric, clothing, headgear, footwear, gaskets), whether or not reinforced, other than goods of heading 68.11 or 68.13.",332134
201512,502,United States,6813,"Friction material and articles thereof, e.g., sheets, rolls, strips, segments, discs, washers, pads, not mounted, for brakes, clutches or the like, with a basis of asbestos, other mineral substances or cellulose, whether or not combined with textile or other materials",1196436
201512,502,United States,6814,"Worked mica and articles of mica, including agglomerated or reconstituted mica, whether or not on a support of paper, paperboard or other materials.",1938253
201512,502,United States,6815,"Articles of stone or of other mineral substances (including carbon fibres, articles of carbon fibres and articles of peat), not elsewhere specified or included.",21304553
201512,502,United States,6901,"Bricks, blocks, tiles and other ceramic goods of siliceous fossil meals (for example, kieselguhr, tripolite or diatomite) or of similar siliceous earths",183145
201512,502,United States,6902,"Refractory bricks, blocks, tiles and similar refractory ceramic constructional goods, other than those of siliceous fossil meals or similar siliceous earths.",33370745
201512,502,United States,6903,"Other refractory ceramic goods (for example, retorts, crucibles, muffles, nozzles, plugs, supports, cupels, tubes, pipes, sheaths and rods), other than those of siliceous fossil meals or of similar siliceous earths.",7269213
201512,502,United States,6904,"Geramic building bricks, flooring blocks, support or filler tiles and the like.",12691703
201512,502,United States,6905,"Roofing tiles, chimneypots, cowls, chimney liners, architectural ornaments and other ceramic constructional goods.",319939
201512,502,United States,6906,"Ceramic pipes, conduits, guttering and pipe fittings",47842
201512,502,United States,6907,"Geramic flags and paving, hearth or wall tiles; ceramic mosaic cubes and the like, whether or not on a backing; finishing ceramics.",118522880
201512,502,United States,6908,-------,303533719
201512,502,United States,6909,"Geramic wares for laboratory, chemical or other technical uses; ceramic troughs, tubs and similar receptacles of a kind used in agriculture; ceramic pots, jars and similar articles of a kind used for the conveyance or packing of goods.",25297563
201512,502,United States,6910,"Geramic sinks, wash basins, wash basin pedestals, baths, bidets, water closet pans, flushing cisterns, urinals and similar sanitary fixtures.",679686836
201512,502,United States,6911,"Tableware, kitchenware, other household articles and toilet articles, of porcelain or china.",614105029
201512,502,United States,6912,"Geramic tableware, kitchenware, other household articles and toilet articles, other than of porcelain or china.",76719255
201512,502,United States,6913,Statuettes and other ornamental ceramic articles.,287641660
201512,502,United States,6914,Other ceramic articles.,147703090
201512,502,United States,7001,Cullet and other waste and scrap of glass; glass in the mass.,2004295
201512,502,United States,7002,"Glass in balls (other than microspheres of heading 70.18), rods or tubes, unworked.",13679911
201512,502,United States,7003,"Cast glass and rolled glass, in sheets or profiles, whether or not having an absorbent, reflecting or nonreflecting layer, but not otherwise worked.",2702382
201512,502,United States,7004,"Drawn glass and blown glass, in sheets, whether or not having an absorbent, reflecting or nonreflecting layer, but not otherwise worked.",624727
201512,502,United States,7005,"Float glass and surface ground or polished glass, in sheets, whether or not having an absorbent, reflecting or nonreflecting layer, but not otherwise worked.",3392143
201512,502,United States,7006,"Glass of heading 70.03, 70.04 or 70.05, bent, edgeworked, engraved, drilled, enamelled or otherwise worked, but not framed or fitted with other materials.",32706301
201512,502,United States,7007,"safety glass, consisting of toughened (tempered) or laminated glass.",227726348
201512,502,United States,7008,Multiplewalled insulating units of glass.,24290518
201512,502,United States,7009,"Glass mirrors, whether or not framed, including rearview mirrors.",275379462
201512,502,United States,7010,"Carboys, bottles, flasks, jars, pots, phials, ampoules and other containers, of glass, of a kind used for the conveyance or packing of goods; preserving jars of glass; stoppers, lids and other closures, of glass.",198361346
201512,502,United States,7011,"Glass envelopes (including bulbs and tubes), open, and glass parts thereof, without fittings, for electric lamps, cathoderay tubes or the like.",8803652
201512,502,United States,7013,"Glassware of a kind used for table, kitchen, toilet, office, indoor decoration or similar purposes (other than that of heading 70.10 or 70.18).",299603685
201512,502,United States,7014,"Signalling glassware and optical elements of glass (other than those of heading 70.15), not optically worked.",105778
201512,502,United States,7015,"Clock or watch glasses and similar glasses, glasses for non corrective or corrective spectacles, curved, bent, hollowed or the like, not optically worked; hollow glass spheres and their segments, for the manufacture of such glasses.",32086
201512,502,United States,7016,"Paving blocks, slabs, bricks, squares, tiles and other articles of pressed or moulded glass, whether or not wired, of a kind used for building or construction purposes; glass cubes and other glass smallwares, whether or not on a backing, for mosaics or similar decorative purposes; leaded lights and the like; multicellular or foam glass in blocks, panels, plates, shells or similar forms.",139495820
201512,502,United States,7017,"Laboratory, hygienic or pharmaceutical glassware, whether or not graduated or calibrated.",17617688
201512,502,United States,7018,"Glass beads, imitation pearls, imitation precious or semiprecious stones and similar glass smallwares, and articles thereof other than imitation jewellery; glass eyes other than prosthetic articles; statuettes and other ornaments of lampworked glass, other than imitation jewellery; glass microspheres not exceeding 1mm in diameter.",67708697
201512,502,United States,7019,"Glass fibres (including glass wool) and articles thereof (for example, yarn, woven fabrics).",176891385
201512,502,United States,7020,Other articles of glass,42713416
201512,502,United States,7101,"Pearls, natural or cultured, whether or not worked or graded but not strung, mounted or set; pearls, natural or cultured, temporarily strung for convenience of transport.",4187644
201512,502,United States,7102,"Diamonds, whether or not worked, but not mounted or set.",23599011
201512,502,United States,7103,"Precious stones and semi-precious stones, whether or not worked or graded, but not strung, mounted or set, ungraded precious stones and semi-precious stones, temporarily strung for convenience of transport",115316
201512,502,United States,7104,"Synthetic or reconstructed precious or semiprecious stones, whether or not worked or graded but not strung, mounted or set; ungraded synthetic or reconstructed precious or semiprecious stones, temporarily strung for convenience of transport.",1313100
201512,502,United States,7105,Dust and powder of natural or synthetic precious or semiprecious stones.,8356291
201512,502,United States,7106,"Silver (including silver plated with gold or platinum), unwrought or in semimanufactured forms, or in powder form.",19987
201512,502,United States,7107,"Base metals clad with silver, not further worked than semimanufactured.",52238
201512,502,United States,7108,"Gold (including gold plated with platinum) unwrought or in semimanufactured forms, or in powder form.",599867
201512,502,United States,7109,"Base metals or silver, clad with gold, not further worked than semimanufactured.",128197
