Date of data,Trading partner code,Trading partner,Commodity code,Commodity,Renminbi Yuan
202104,502,United States,7105,Dust and powder of natural or synthetic precious or semiprecious stones.,12574613.0
202104,502,United States,7106,"Silver (including silver plated with gold or platinum), unwrought or in semimanufactured forms, or in powder form.",13181.0
202104,502,United States,7107,"Base metals clad with silver, not further worked than semimanufactured.",377821.0
202104,502,United States,7108,"Gold (including gold plated with platinum) unwrought or in semimanufactured forms, or in powder form.",654921.0
202104,502,United States,7110,"Platinum, unwrought or in semimanufactured forms, or in powder form.",451840.0
202104,502,United States,7113,"Articles of jewellery and parts thereof, of precious metal or of metal clad with precious metal.",977215864.0
202104,502,United States,7114,"Articles of goldsmiths' or silversmiths' wares and parts thereof, of precious metal or of metal clad with precious metal.",2656606.0
202104,502,United States,7115,Other articles of precious metal or of metal clad with precious metal.,287189.0
202104,502,United States,7116,"Articles of natural or cultured pearls, precious or semiprecious stones (natural, synthetic or reconstructed).",36998360.0
202104,502,United States,7117,Imitation jewellery.,254742829.0
202104,502,United States,7118,Coin.,364641.0
202104,502,United States,7202,Ferroalloys.,4297375.0
202104,502,United States,7205,"Nranules and powders, of pig iron, spiegeleisen, iron or steel",4097793.0
202104,502,United States,7206,Iron and nonalloy steel in ingots or other primary forms (excluding iron of heading 72.03).,481173.0
202104,502,United States,7208,"Flat-rolled products of iron or nonalloy steel, of a width of 600 mm or more, hotrolled, not clad, plated or coated.",227211.0
202104,502,United States,7209,"Flat-rolled products of iron or nonalloy steel, of a width of 600 mm or more, coldrolled (coldreduced), not clad, plated or coated.",1053218.0
202104,502,United States,7210,"at-rolled products of iron or non-alloy steel, of a width ≥ 600 mm, hot-rolled or cold-rolled cold-reduced"", clad, plated or coated""",37336274.0
202104,502,United States,7211,"Flat-rolled products of iron or nonalloy steel, of a width of less than 600 mm, not clad, plated or coated.",682.0
202104,502,United States,7212,"Flat-rolled products of iron or nonalloy steel, of a width of less than 600 mm, clad, plated or coated.",6038443.0
202104,502,United States,7214,"Other bars and rods of iron or nonalloy steel, not further worked than forged, hotrolled, hotdrawn or hotextruded, but including those twisted after rolling.",198146.0
202104,502,United States,7215,Other bars and rods of iron or nonalloy steel.,1759608.0
202104,502,United States,7216,"Angles, shapes and sections of iron or nonalloy steel.",4239942.0
202104,502,United States,7217,Wire of iron or nonalloy steel.,84536633.0
202104,502,United States,7218,Stainless steel in ingots or other primary forms; semifinished products of stainless steel.,398159.0
202104,502,United States,7219,"Flat-rolled products of stainless steel, of a width of 600 mm or more.",26238251.0
202104,502,United States,7220,"Flat-rolled products of stainless steel, of a width of less than 600 mm.",3918702.0
202104,502,United States,7221,"Bars and rods, hotrolled, in irregularly wound coils, of stainless steel.",2665219.0
202104,502,United States,7222,"Other bars and rods of stainless steel; angles, shapes and sections of stainless steel.",3837492.0
202104,502,United States,7223,Wire of stainless steel.,9398194.0
202104,502,United States,7225,"Flat-rolled products of other alloy steel, of a width of 600 mm or more.",1020817.0
202104,502,United States,7226,"Flat-rolled products of alloy steel other than stainless, of a width of ≥ 600 mm, hot-rolled or cold-rolled cold-reduced"" and further worked (excluding plated or coated with zinc and products of silicon-electrical steel)""",1375781.0
202104,502,United States,7227,"Bars and rods, hot-rolled, in irregularly wound coils, of other alloy steel.",8260.0
202104,502,United States,7228,"Other bars and rods of other alloy steel; angles, shapes and sections, of other alloy steel; hollow drill bars and rods, of alloy or nonalloy steel.",37699939.0
202104,502,United States,7229,Wire of other alloy steel.,25035051.0
202104,502,United States,7301,"Sheet piling of iron or steel, whether or not drilled, punched or made from assembled elements; welded angles, shapes and sections, of iron or steel.",1571329.0
202104,502,United States,7302,"Railway or tramway track construction material of iron or steel, the following : rails, check-rails and rack rails, switch blades, crossing frogs, point rods and other crossing pieces, sleepers cross-ties"", fish-plates, chairs, chair wedges, sole plates ""base plates"", rail clips, bedplates, ties and other material specialised for jointing or fixing rails""",11774077.0
202104,502,United States,7303,"Tubes, pipes and hollow profiles, of cast iron.",1038617.0
202104,502,United States,7304,"Tubes, pipes and hollow profiles, seamless, of iron (other than cast iron) or steel.",54681041.0
202104,502,United States,7305,"Other tubes and pipes (for example, welded, riveted or similarly closed), having circular cross-sections, the external diameter of which exceeds 406.4 mm, of iron or steel.",2605828.0
202104,502,United States,7306,"Other tubes, pipes and hollow profiles (for example, open seam or welded, riveted or similarly closed), of iron or steel.",57676148.0
202104,502,United States,7307,"Tube or pipe fittings (for example, couplings, elbows, sleeves), of iron or steel.",468183526.0
202104,502,United States,7308,"Structures (excluding prefabricated buildings of heading 94.06) and parts of structures (for example, bridges and bridgesections, lockgates, towers, lattice masts, roofs, roofing frameworks, doors and windows and their frames and thresholds for doors, shutters, balustrades, pillars and columns), of iron or steel; plates, rods, angles, shapes, sections, tubes and the like, prepared for use in structures, of iron or steel.",671306724.0
202104,502,United States,7309,"eservoirs, tanks, vats and similar containers for any material (other than compressed or liquefied gas), of iron or steel, of a capacity exceeding 300 l, whether or not lined or heatinsulated, but not fitted with mechanical or thermal equipment.",6165251.0
202104,502,United States,7310,"anks, casks, drums, cans, boxes and similar containers, for any material (other than compressed or liquefied gas), of iron or steel, of a capacity not exceeding 300 l, whether or not lined or heatinsulated, but not fitted with mechanical or thermal equipment.",130585419.0
202104,502,United States,7311,"Containers for compressed or liquefied gas, of iron or steel.",55832634.0
202104,502,United States,7312,"Stranded wire, ropes, cables, plaited bands, slings and the like, of iron or steel, not electrically insulated.",89580318.0
202104,502,United States,7313,"Barbed wire of iron or steel; twisted hoop or single flat wire, barbed or not, and loosely twisted double wire, of a kind used for fencing, of iron or steel.",2067331.0
202104,502,United States,7314,"Cloth (including endless bands), grill, netting and fencing, of iron or steel wire; expanded metal of iron or steel.",150238567.0
202104,502,United States,7315,"Chain and parts thereof, of iron or steel.",109844851.0
202104,502,United States,7316,"Anchors, grapnels and parts thereof, of iron or steel.",13624987.0
202104,502,United States,7317,"Nails, tacks, drawing pins, corrugated nails, staples (other than those of heading 83.05) and similar articles, of iron or steel, whether or not with heads of other material, but excluding such articles with heads of copper.",141719527.0
202104,502,United States,7318,"Screws, bolts, nuts, coach screws, screw hooks, rivets, cotters, cotterpins, washers (including spring washers) and similar articles, of iron or steel.",541941579.0
202104,502,United States,7319,"Sewing needles, knitting needles, bodkins, crochet hooks, embroidery stilettos and similar articles, for use in the hand, of iron or steel; safety pins and other pins of iron or steel, not elsewhere specified or included.",7332851.0
202104,502,United States,7320,"Springs and leaves for springs, of iron or steel.",61473850.0
202104,502,United States,7321,"Stoves, ranges, grates, cookers (including those with subsidiary boilers for central heating), barbecues, braziers, gasrings, plate warmers and similar nonelectric domestic appliances, and parts thereof, of iron or steel.",1606235618.0
202104,502,United States,7322,"Radiators for central heating, not electrically heated, and parts thereof, of iron or steel; air heaters and hot air distributors (including distributors which can also distribute fresh or conditioned air), not electrically heated, incorporating a motordriven fan or blower, and parts thereof, of iron or steel.",5624078.0
202104,502,United States,7323,"Table, kitchen or other household articles and parts thereof, of iron or steel; iron or steel wool; pot scourers and scouring or polishing pads, gloves and the like, of iron or steel.",1555486044.0
202104,502,United States,7324,"Sanitary ware and parts thereof, of iron or steel.",310371295.0
202104,502,United States,7325,Other cast articles of iron or steel.,43404501.0
202104,502,United States,7326,Other articles of iron or steel.,1557240289.0
202104,502,United States,7403,"Refined copper and copper alloys, unwrought.",16742.0
202104,502,United States,7406,Copper powders and flakes.,72842.0
202104,502,United States,7407,"Copper bars, rods and profiles.",2718172.0
202104,502,United States,7408,Copper wire.,5135112.0
202104,502,United States,7409,"Copper plates, sheets and strip, of a thickness exceeding 0.15mm.",4558187.0
202104,502,United States,7410,"Copper foil (whether or not printed or backed with paper, paperboard, plastics or similar backing materials) of a thickness (excluding any backing) not exceeding 0.15 mm.",7728506.0
202104,502,United States,7411,Copper tubes and pipes.,63120589.0
202104,502,United States,7412,"Copper tube or pipe fittings (for example, couplings, elbows, sleeves).",88205805.0
202104,502,United States,7413,"Stranded wire, cables, plaited bands and the like, of copper, not electrically insulated.",3001441.0
202104,502,United States,7415,"Nails, tacks, drawing pins, staples (other than those of heading 83.05) and similar articles, of copper or of iron or steel with heads of copper; screws, bolts, nuts, screw hooks, rivets, cotters, cotterpins, washers (including spring washers) and similar articles, of copper.",18988588.0
202104,502,United States,7418,"Table, kitchen or other household articles and parts thereof, of copper; pot scourers and scouring or polishing pads, gloves and the like, of copper; sanitary ware and parts thereof, of copper.",41143031.0
202104,502,United States,7419,Other articles of copper.,17646951.0
202104,502,United States,7504,Nickel powders and flakes.,23013.0
202104,502,United States,7505,"Nickel bars, rods, profiles and wire.",1710618.0
202104,502,United States,7506,"Nickel plates, sheets, strip and foil.",998807.0
202104,502,United States,7507,"Nickel tubes, pipes and tube or pipe fittings (for example, couplings, elbows, sleeves).",1273392.0
202104,502,United States,7508,Other articles of nickel.,4603077.0
202104,502,United States,7601,Unwrought aluminium.,535382.0
202104,502,United States,7603,Aluminium powders and flakes.,1087472.0
202104,502,United States,7604,"Aluminium bars, rods and profiles.",13958642.0
202104,502,United States,7605,Aluminium wire.,4025521.0
202104,502,United States,7606,"Aluminium plates, sheets and strip, of a thickness exceeding 0.2 mm.",237361649.0
202104,502,United States,7607,"Aluminium foil (whether or not printed or backed with paper, paperboard, plastics or similar backing materials) of a thickness (excluding any backing) not exceeding 0.2 mm.",95236983.0
202104,502,United States,7608,Aluminium tubes and pipes.,10112508.0
202104,502,United States,7609,"Aluminium tube or pipe fittings (for example, couplings, elbows, sleeves).",37930242.0
202104,502,United States,7610,"Aluminium structures (excluding prefabricated buildings of heading 94.06) and parts of structures (for example, bridges and bridgesections, towers, lattice masts, roofs, roofing frameworks, doors and windows and their frames and thresholds for doors, balustrades, pillars and columns); aluminium plates, rods, profiles, tubes and the like, prepared for use in structures.",272591049.0
202104,502,United States,7611,"Aluminium reservoirs, tanks, vats and similar containers, for any material (other than compressed or liquefied gas), of a capacity exceeding 300 l, whether or not lined or heatinsulated, but not fitted with mechanical or thermal equipment.",711097.0
202104,502,United States,7612,"Aluminium casks, drums, cans, boxes and similar containers (including rigid or collapsible tubular containers), for any material (other than compressed or liquefied gas), of a capacity not exceeding 300 l, whether or not lined or heatinsulated, but not fitted with mechanical or thermal equipment.",185463091.0
202104,502,United States,7613,Aluminium containers for compressed or liquefied gas.,5388725.0
202104,502,United States,7614,"Stranded wire, cables, plaited bands and the like, of aluminium, not electrically insulated.",279949.0
202104,502,United States,7615,"Table, kitchen or other household articles and parts thereof, of aluminium; pot scourers and scouring or polishing pads, gloves and the like, of aluminium; sanitary ware and parts thereof, of aluminium.",531620768.0
202104,502,United States,7616,Other articles of aluminium.,648704051.0
202104,502,United States,7804,"Lead plates, sheets, strip and foil; lead powders and flakes.",187066.0
202104,502,United States,7806,Other articles of lead.,525178.0
202104,502,United States,7904,"Zinc bars, rods, profiles and wire.",1170442.0
202104,502,United States,7907,Other articles of zinc.,14372517.0
202104,502,United States,8003,"Tin bars, rods, profiles and wire.",1881039.0
202104,502,United States,8007,Other articles of tin.,196034.0
202104,502,United States,8101,"Wungsten (wolfram) and articles thereof, including waste and scrap.",35389750.0
202104,502,United States,8102,"Molybdenum and articles thereof, including waste and scrap.",23906785.0
202104,502,United States,8103,"Tantalum and articles thereof, including waste and scrap.",24771486.0
202104,502,United States,8104,"Magnesium and articles thereof, including waste and scrap.",19149135.0
202104,502,United States,8105,"Cobalt mattes and other intermediate products of cobalt metallurgy; cobalt and articles thereof, including waste and scrap.",2403862.0
202104,502,United States,8106,"Bismuth and articles thereof, including waste and scrap.",14633256.0
202104,502,United States,8108,"Titanium and articles thereof, including waste and scrap.",31454495.0
202104,502,United States,8109,"Zirconium and articles thereof, including waste and scrap.",280758.0
202104,502,United States,8110,"Antimony and articles thereof, including waste and scrap.",31863367.0
202104,502,United States,8111,"Manganese and articles thereof, including waste and scrap.",60340251.0
202104,502,United States,8112,"Beryllium, chromium, germanium, vanadium, gallium, hafnium, indium, niobium (columbium), rhenium and thallium, and articles of these metals, including waste and scrap.",11636209.0
202104,502,United States,8113,"Cermets and articles thereof, including waste and scrap.",5088078.0
202104,502,United States,8201,"Hand tools, the following : spades, shovels, mattocks, picks, hoes, forks and rakes; axes, bill hooks and similar hewing tools; secateurs and pruners of any kind; scythes, sickles, hay knives, hedge shears, timber wedges and other tools of a kind used in agriculture, horticulture or forestry.",92951583.0
202104,502,United States,8202,"Hand saws; blades for saws of all kinds (including slitting, slotting or toothless saw blades).",109536488.0
202104,502,United States,8203,"Files, rasps, pliers (including cutting pliers), pincers, tweezers, metal cutting shears, pipecutters, bolt croppers, perforating punches and similar hand tools.",147058551.0
202104,502,United States,8204,"Hand-operated spanners and wrenches (including torque meter wrenches but not including tap wrenches); interchangeable spanner sockets, with or without handles.",192987026.0
202104,502,United States,8205,"Hand tools (including glaziers' diamonds), not elsewhere specified or included; blow lamps; vices, clamps and the like, other than accessories for and parts of, machinetools or waterjet cutting machines; anvils; portable forges; hand or pedaloperated grinding wheels with frameworks.",467038927.0
202104,502,United States,8206,"Tools of two or more of the headings 82.02 to 82.05, put up in sets for retail sale.",110817279.0
202104,502,United States,8207,"Interchangeable tools for hand tools, whether or not poweroperated, or for machinetools (for example, for pressing, stamping, punching, tapping, threading, drilling, boring, broaching, milling, turning or screw driving), including dies for drawing or extruding metal, and rock drilling or earth boring tools.",461993600.0
202104,502,United States,8208,"Knives and cutting blades, for machines or for mechanical appliances.",36087917.0
202104,502,United States,8209,"Plates, sticks, tips and the like for tools, unmounted, of cermets.",44817119.0
202104,502,United States,8210,"Hand-operated mechanical appliances, weighing 10 kg or less, used in the preparation, conditioning or serving of food or drink.",27916014.0
202104,502,United States,8211,"Knives with cutting blades, serrated or not (including pruning knives), other than knives of heading 82.08, and blades therefor.",286162076.0
202104,502,United States,8212,Razors and razor blades (including razor blade blanks in strips).,58335958.0
202104,502,United States,8213,"Scissors, tailors' shears and similar shears, and blades therefor.",55347856.0
202104,502,United States,8214,"Other articles of cutlery (for example, hair clippers, butchers' or kitchen cleavers, choppers and mincing knives, paper knives); manicure or pedicure sets and instruments (including nail files).",92890844.0
202104,502,United States,8215,"Spoons, forks, ladles, skimmers, cakeservers, fishknives, butterknives, sugar tongs and similar kitchen or tableware.",306424833.0
202104,502,United States,8301,"Padlocks and locks (key, combination or electrically operated), of base metal; clasps and frames with clasps, incorporating locks, of base metal; keys for any of the foregoing articles, of base metal",403162391.0
202104,502,United States,8302,"Base metal mountings, fittings and similar articles suitable for furniture, doors, staircases, windows, blinds, coachwork, saddlery, trunks, chests, caskets or the like; base metal hatracks, hatpegs, brackets and similar fixtures; castors with mountings of base metal; automatic door closers of base metal",1222386294.0
202104,502,United States,8303,"Armoured or reinforced safes, strongboxes and doors and safe deposit lockers for strongrooms, cash or deed boxes and the like, of base metal",156941516.0
202104,502,United States,8304,"Filing cabinets, cardindex cabinets, paper trays, paper rests, pen trays, officestamp stands and similar office or desk equipment, of base metal, other than office furniture of heading 9403",46012381.0
202104,502,United States,8305,"Fittings for looseleaf binders or files, letter clips, letter corners, paper clips, indexing tags and similar office articles, of base metal; staples in strips (for example, for offices, upholstery, packaging), of base metal",48061629.0
202104,502,United States,8306,"Bells, gongs and the like, nonelectric, of base metal; statuettes and other ornaments, of base metal; photograph, picture or similar frames, of base metal; mirrors of base metal",289293130.0
202104,502,United States,8307,"Flexible tubing of base metal, with or without fittings",42420306.0
202104,502,United States,8308,"Clasps, frames with clasps, buckles, buckleclasps, hooks, eyes, eyelets and the like, of base metal, of a kind used for clothing or clothing accessories, footwear, jewellery, wristwatches, books, awnings, leather goods, travel goods or saddlery or for other made up articles; tubular or bifurcated rivets, of base metal; beads and spangles, of base metal",36409253.0
202104,502,United States,8309,"Stoppers, caps and lids (including crown corks, screw caps and pouring stoppers), capsules for bottles, threaded bungs, bung covers, seals and other packing accessories, of base metal",107184333.0
202104,502,United States,8310,"Signplates, nameplates, addressplates and similar plates, numbers, letters and other symbols, of base metal, excluding those of heading 9405",30296956.0
202104,502,United States,8311,"Wire, rods, tubes, plates, electrodes and similar products, of base metal or of metal carbides, coated or cored with flux material, of a kind used for soldering, brazing, welding or deposition of metal or of metal carbides; wire and rods, of agglomerated base metal powder, used for metal spraying",12258075.0
202104,502,United States,8402,Steam or other vapour generating boilers (other than central heating hot water boilers capable also of producing low pressure steam); superheated water boilers.,2026460.0
202104,502,United States,8403,Central heating boilers other than those of heading 8402.,17433210.0
202104,502,United States,8404,"Auxiliary plant for use with boilers of heading 84.02 or 84.03 (for example, economisers, superheaters, soot removers, gas recoverers); condensers for steam or other vapour power units.",1393966.0
202104,502,United States,8405,"Producer gas or water gas generators, with or without their purifiers; acetylene gas generators and similar water process gas generators, with or without their purifiers.",369840.0
202104,502,United States,8406,Steam turbines and other vapour turbines.,2321659.0
202104,502,United States,8407,Sparkignition reciprocating or rotary internal combustion piston engines.,246396731.0
202104,502,United States,8408,Compressionignition internal combustion piston engines (diesel or semidiesel engines).,46516687.0
202104,502,United States,8409,Parts suitable for use solely or principally with the engines of heading 84.07 or 84.08.,820892965.0
202104,502,United States,8410,"Hydraulic turbines, water wheels, and regulators therefor.",1145156.0
202104,502,United States,8411,"Turbojets, turbopropellers and other gas turbines.",460198182.0
202104,502,United States,8412,Other engines and motors.,345588425.0
202104,502,United States,8413,"Pumps for liquids, whether or not fitted with a measuring device; liquid elevators.",903159593.0
202104,502,United States,8414,"Air or vacuum pumps, air or other gas compressors and fans; ventilating or recycling hoods incorporating a fan, whether or not fitted with filters.",2978304363.0
202104,502,United States,8415,"Air conditioning machines, comprising a motordriven fan and elements for changing the temperature and humidity, including those machines in which the humidity cannot be separately regulated.",2032471050.0
202104,502,United States,8416,"Furnace burners for liquid fuel, for pulverised solid fuel or for gas; mechanical stokers, including their mechanical grates,mechanical ash dischargers and similar appliances.",5173943.0
202104,502,United States,8417,"Industrial or laboratory furnaces and ovens, including incinerators, nonelectric.",15145351.0
202104,502,United States,8418,"Refrigerators, freezers and other refrigerating or freezing equipment, electric or other; heat pumps other than air conditioning machines of heading 84.15.",1528118615.0
202104,502,United States,8419,"Machinery, plant or laboratory equipment, whether or not electrically heated (excluding furnaces, ovens and other equipment of heading 85.14), for the treatment of materials by a process involving a change of temperature such as heating, cooking, roasting, distilling, rectifying, sterilising, pasteurising, other than machinery or plant of a kind used for domestic purposes; instantaneous or storage water heaters, nonelectric.",373508238.0
202104,502,United States,8420,"Calendering or other rolling machines, other than for metals or glass, and cylinders therefor.",5754110.0
202104,502,United States,8421,"Centrifuges, including centrifugal dryers; filtering or purifying machinery and apparatus, for liquids or gases.",1153121929.0
202104,502,United States,8422,"Dish washing machines; machinery for cleaning or drying bottles or other containers; machinery for filling, closing, sealing or labelling bottles, cans, boxes, bags or other containers; machinery for capsuling bottles, jars, tubes and similar containers; other packing or wrapping machinery (including heatshrink wrapping machinery); machinery for aerating beverages.",255679599.0
202104,502,United States,8423,"Weighing machinery (excluding balances of a sensitivity of 5 cg or better), including weight operated counting or checking machines; weighing machine weights of all kinds.",265421074.0
202104,502,United States,8424,"Mechanical appliances (whether or not handoperated) for projecting, dispersing or spraying liquids or powders; fire extinguishers, whether or not charged; spray guns and similar appliances; steam or sand blasting machines and similar jet projecting machines.",914113203.0
202104,502,United States,8425,Pulley tackle and hoists other than skip hoists; winches and capstans; jacks.,480383448.0
202104,502,United States,8426,"Ships' derricks; cranes, including cable cranes; mobile lifting frames, straddle carriers and works trucks fitted with a crane.",284315739.0
202104,502,United States,8427,Forklift trucks; other works trucks fitted with lifting or handling equipment.,307990258.0
