Date of data,Trading partner code,Trading partner,Commodity code,Commodity,Renminbi Yuan
201512,502,United States,0101,"Live horses, asses, mules and hinnies",127592
201512,502,United States,0106,Other live animals,5128889
201512,502,United States,0208,"Other meat and edible meat offal, fresh, chilled or frozen",1831934
201512,502,United States,0301,Live fish,81917
201512,502,United States,0302,"Fish, fresh or chilled, excluding fish fillets and other fish meat of heading 0304",155311
201512,502,United States,0303,"Fish, frozen, excluding fish fillets and other fish meat of heading 0304",171815127
201512,502,United States,0304,"Fish fillets and other fish meat (whether or not minced), fresh, chilled or frozen",923789325
201512,502,United States,0305,"Fish, dried, salted or in brine; smoked fish, whether or not cooked before or during the smoking process; flours, meals and pellets of fish, fit for human consumption",34927853
201512,502,United States,0306,"Crustaceans, whether in shell or not, live, fresh, chilled, frozen, dried, salted or in brine; smoked crustaceans, whether in shell or not, whether or not cooked before or during the smoking process; crustaceans, in shell, cooked by steaming or by boiling in water, whether or not chilled, frozen, dried, salted or in brine; flours, meals and pellets of crustaceans, fit for human consumption",111363842
201512,502,United States,0307,"Molluscs, whether in shell or not, live, fresh, chilled, frozen, dried, salted or in brine; smoked molluscs, whether in shell or not, whether or not cooked before or during the smoking process; flours, meals and pellets of molluscs, fit for human consumption",364618702
201512,502,United States,0308,"Aquatic invertebrates other than crustaceans and molluscs, live, fresh, chilled, frozen, dried, salted or in brine; smoked aquatic invertebrates other than crustaceans and molluscs, whether or not cooked before or during the smoking process; flours, meals and pellets of aquatic invertebrates other than crustaceans and molluscs, fit for human consumption",1920509
201512,502,United States,0406,Cheese and curd,1531
201512,502,United States,0407,"Birds' eggs, in shell, fresh, preserved or cooked",5277952
201512,502,United States,0408,"Birds' eggs, not in shell, and egg yolks, fresh, dried, cooked by steaming or by boiling in water, moulded, frozen or otherwise preserved, whether or not containing added sugar or other sweetening matter",222639
201512,502,United States,0410,"dible products of animal origin, not elsewhere specified or included",4527155
201512,502,United States,0502,"Pigs', hogs' or boars' bristles and hair; badger hair and other brush making hair; waste of such bristles or hair",2894533
201512,502,United States,0504,"Guts, bladders and stomachs of animals (other than fish), whole and pieces thereof, fresh, chilled, frozen, salted, in brine, dried or smoked",67474805
201512,502,United States,0505,"Skins and other parts of birds, with their feathers or down, feathers and parts of feathers (whether or not with trimmed edges) and down, not further worked than cleaned, disinfected or treated for preservation;powder and waste of feathers or parts of feathers",37746511
201512,502,United States,0507,"Ivory, tortoiseshell, whalebone and whalebone hair, horns, antlers, hooves, nails, claws and beaks, unworked or simply prepared but not cut to shape; powder and waste of these products",133060
201512,502,United States,0508,"Coral and similar materials, unworked or simply prepared bunot otherwise worked; shells of molluscs, crustaceans or echinoderms and cuttlebone, unworked or simply prepared bunot cut to shape, powder and waste thereof",743735
201512,502,United States,0511,"Animal products not elsewhere specified or included; dead animals of Chapter 1 or 3, unfit for human consumption",7828562
201512,502,United States,0601,"Bulbs, tubers, tuberous roots, corms, crowns and rhizomes, dormant, in growth or in flower; chicory plants and roots other than roots of heading 12.12.",432882
201512,502,United States,0602,"Other live plants (including their roots), cuttings and slips; mushroom spawn.",11304251
201512,502,United States,0603,"Cut flowers and flower buds of a kind suitable for bouquets or for ornamental purposes, fresh, dried, dyed, bleached, impregnated or otherwise prepared.",9837
201512,502,United States,0604,"Foliage, branches and other parts of plants, without flowers or flower buds, and grasses, mosses and lichens, being goods of a kind suitable for bouquets or for ornamental purposes, fresh,dried, dyed, bleached, impregnated or otherwise prepared",3629432
201512,502,United States,0703,"Onions, shallots, garlic, leeks and other alliaceous vegetables, fresh or chilled.",67518361
201512,502,United States,0709,"Other vegetables, fresh or chilled.",19054836
201512,502,United States,0710,"Vegetables (uncooked or cooked by steaming or boiling in water),frozen.",67930538
201512,502,United States,0711,"Vegetables provisionally preserved (for example, by sulphur dioxide gas, in brine, in sulphur water or in other preservative solutions), but unsuitable in that state for immediate consumption.",221030
201512,502,United States,0712,"Dried vegetables, whole, cut, sliced, broken or in powder, but not further prepared.",154587808
201512,502,United States,0713,"Dried leguminous vegetables, shelled, whether or not skinned or split.",19922844
201512,502,United States,0714,"Manioc, arrowroot, salep, Jerusalem artichokes, sweet potatoes and similar roots and tubers with high starch or inulin content, fresh, chilled, frozen or dried, whether or not sliced or in the form of pellets; sago pith.",9408605
201512,502,United States,0802,"Other nuts, fresh or dried, whether or not shelled or peeled.",37514485
201512,502,United States,0803,"Bananas, including plantains, fresh or dried.",125604
201512,502,United States,0804,"Dates, figs, pineapples, avocados, guavas, mangoes and mangosteens, fresh or dried.",432520
201512,502,United States,0808,"Apples, pears and quinces, fresh.",15296616
201512,502,United States,0811,"Fruit and nuts, uncooked or cooked by steaming or boiling in water, frozen, whether or not containing added sugar or other sweetening matter.",9901725
201512,502,United States,0813,"Fruit, dried, other than that of headings 08.01 to 08.06; mixtures of nuts or dried fruits of this Chapter.",18891767
201512,502,United States,0814,"Peel of citrus fruit or melons (including watermelons), fresh, frozen, dried or provisionally preserved in brine, in sulphur water or in other preservative solutions.",53174
201512,502,United States,0901,"Coffee, whether or not roasted or decaffeinated; coffee husks and skins; coffee substitutes containing coffee in any proportion.",2182449
201512,502,United States,0902,"Tea, whether or not flavoured.",55311114
201512,502,United States,0904,Pepper of the genus Piper; dried or crushed or ground fruits of the genus Capsicum or of the genus Pimenta.,37017033
201512,502,United States,0906,Cinnamon and cinnamontree flowers.,16541
201512,502,United States,0909,"Seeds of anise, badian, fennel, coriander, cumin or caraway; juniper berries.",326023
201512,502,United States,0910,"Ginger, saffron, turmeric (curcuma), thyme, bay leaves, curry and other spices.",24200616
201512,502,United States,1003,Barley,46876
201512,502,United States,1006,Rice.,755224
201512,502,United States,1007,Grain sorghum.,45155
201512,502,United States,1008,"Buckwheat, millet and canary seeds; other cereals.",621902
201512,502,United States,1101,Wheat or meslin flour.,911419
201512,502,United States,1102,Cereal flours other than of wheat or meslin.,46172
201512,502,United States,1103,"Cereal groats, meal and pellets.",19720
201512,502,United States,1104,"Cereal grains otherwise worked (for example, hulled, rolled, flaked, pearled, sliced or kibbled), except rice of heading 10.06; germ of cereals, whole, rolled, flaked or ground.",1167680
201512,502,United States,1105,"Flour, meal, powder, flakes, granules and pellets of potatoes.",238597
201512,502,United States,1106,"Flour, meal and powder of the dried leguminous vegetables of heading 07.13, of sago or of roots or tubers of heading 07.14 or of the products of Chapter 8.",4985762
201512,502,United States,1108,tarches; inulin.,822721
201512,502,United States,1109,"Wheat gluten, whether or not dried.",1424710
201512,502,United States,1201,"Soya beans, whether or not broken.",8877147
201512,502,United States,1204,"Linseed, whether or not broken.",54378
201512,502,United States,1206,"Sunflower seeds, whether or not broken.",3945475
201512,502,United States,1207,"Other oil seeds and oleaginous fruits, whether or not broken.",3698626
201512,502,United States,1209,"Seeds, fruit and spores, of a kind used for sowing.",37429760
201512,502,United States,1211,"lants and parts of plants (including seeds and fruits), of a kind used primarily in perfumery, in pharmacy or for insecticidal, fungicidal or similar purposes, fresh, chilled, frozen or dried, whether or not cut, crushed or powdered.",24032091
201512,502,United States,1212,"Locust beans, seaweeds and other algae, sugar beet and sugar cane, fresh, chilled, frozen or dried, whether or not ground; fruit stones and kernels and other vegetable products (including unroasted chicory roots of the variety Cichorium intybus sativum) of a kind used primarily for human consumption, not elsewhere specified or included.",54339718
201512,502,United States,1301,"Lac; natural gums, resins, gumresins and oleoresins (for example, balsams).",937493
201512,502,United States,1302,"Vegetable saps and extracts; pectic substances, pectinates and pectates; agaragar and other mucilages and thickeners, whether or not modified, derived from vegetable products.",188739867
201512,502,United States,1401,"Vegetable materials of a kind used primarily for plaiting (for example, bamboos, rattans, reeds, rushes, osier, raffia, cleaned, bleached or dyed cereal straw, and lime bark).",5151515
201512,502,United States,1404,Vegetable products not elsewhere specified or included.,87009
201512,502,United States,1504,"ats and oils and their fractions, of fish or marine mammals, whether or not refined, but not chemically modified.",23762201
201512,502,United States,1505,Wool grease and fatty substances derived therefrom (including lanolin).,1339801
201512,502,United States,1506,"Other animal fats and oils and their fractions, whether or not refined, but not chemically modified.",172249
201512,502,United States,1508,"Groundnut oil and its fractions, whether or not refined, but not chemically modified.",319433
201512,502,United States,1509,"Olive oil and its fractions, whether or not refined, but not chemically modified.",4090
201512,502,United States,1515,"Other fixed vegetable fats and oils (including jojoba oil) and their fractions, whether or not refined, but not chemically modified.",18316876
201512,502,United States,1517,"Margarine; edible mixtures or preparations of animal or vegetable fats or oils or of fractions of different fats or oils of this Chapter, other than edible fats or oils or their fractions of heading 15.16.",960808
201512,502,United States,1518,"Animal or vegetable fats and oils and their fractions, boiled, oxidised,dehydrated, sulphurised, blown, polymerised by heat in vacuum or in inert gas or otherwise chemically modified, excluding those of heading 15.16; inedible mixtures or preparations of animal or vegetable fats or oils or of fractions of different fats or oils of this Chapter, not elsewhere specified or included.",672424
201512,502,United States,1521,"egetable waxes (other than triglycerides), beeswax, other insect waxes and spermaceti, whether or not refined or coloured.",3517176
201512,502,United States,1602,"Other prepared or preserved meat, meat offal or blood.",5906169
201512,502,United States,1604,Prepared or preserved fish; caviar and caviar substitutes prepared from fish eggs.,364374504
201512,502,United States,1605,"rustaceans, molluscs and other aquatic invertebrates, prepared or preserved.",501388977
201512,502,United States,1701,"Cane or beet sugar and chemically pure sucrose, in solid form.",5045994
201512,502,United States,1702,"Other sugars, including chemically pure lactose, maltose, glucose and fructose, in solid form; sugar syrups not containing added flavouring or colouring matter; artificial honey, whether or not mixed with natural honey; caramel.",26781879
201512,502,United States,1704,"ugar confectionery (including white chocolate), not containing cocoa.",86699646
201512,502,United States,1806,hocolate and other food preparations containing cocoa.,7567494
201512,502,United States,1901,"Malt extract; food preparations of flour, groats, meal, starch or malt extract, not containing cocoa or containing less than 40% by weight of cocoa calculated on a totally defatted basis, not elsewhere specified or included; food preparations of goods of headings 04.01 to 04.04,not containing cocoa or containing less than 5% by weight of cocoa calculated on a totally efatted basis, not elsewhere specified or included.",9156163
201512,502,United States,1902,"Pasta, whether or not cooked or stuffed (with meat or other substances) or otherwise prepared, such as spaghetti, macaroni, noodles, lasagne, gnocchi, ravioli, cannelloni; couscous, whether or not prepared.",73799600
201512,502,United States,1904,"repared foods obtained by the swelling or roasting of cereals or cereal products (for example, corn flakes); cereals (other than maize (corn)) in grain form or in the form of flakes or other worked grains (except flour, groats and meal), precooked, or otherwise prepared, not elsewhere specified or included.",13771491
201512,502,United States,1905,"read, pastry, cakes, biscuits and other bakers' wares, whether or not containing cocoa; communion wafers, empty cachets of a kind suitable for pharmaceutical use, sealing wafers, rice paper and similar products.",7065845
201512,502,United States,2001,"Vegetables, fruit, nuts and other edible parts of plants, prepared or preserved by vinegar or acetic acid.",5996562
201512,502,United States,2002,Tomatoes prepared or preserved otherwise than by vinegar or acetic acid.,1431389
201512,502,United States,2003,"Mushrooms and truffles, prepared or preserved otherwise than by vinegar or acetic acid.",2574745
201512,502,United States,2004,"Other vegetables prepared or preserved otherwise than by vinegar or acetic acid, frozen, other than products of heading 20.06.",24387424
201512,502,United States,2005,"Other vegetables prepared or preserved otherwise than by vinegar or acetic acid, not frozen, other than products of heading 20.06.",107330859
201512,502,United States,2006,"Vegetables, fruit, nuts, fruitpeel and other parts of plants, preserved by sugar (drained, glacé or crystallised).",5008335
201512,502,United States,2007,"Jams, fruit jellies, marmalades, fruit or nut purée and fruit or nut pastes, obtained by cooking, whether or not containing added sugar or other sweetening matter.",8461208
201512,502,United States,2008,"Fruit, nuts and other edible parts of plants, otherwise prepared or preserved, whether or not containing added sugar or other sweetening matter or spirit, not elsewhere specified or included.",365829973
201512,502,United States,2009,"ruit juices (including grape must) and vegetable juices, unfermented and not containing added spirit, whether or not containing added sugar or other sweetening matter.",291999503
201512,502,United States,2101,"Extracts, essences and concentrates, of coffee, tea or maté and preparations with a basis of these products or with a basis of coffee, tea or mate; roasted chicory and other roasted coffee substitutes, and extracts, essences and concentrates thereof",6319077
201512,502,United States,2102,"Yeasts (active or inactive); other singlecell microorganisms, dead (but not including vaccines of heading 30.02); prepared baking powders.",8919397
201512,502,United States,2103,"Sauce and preparations therefor; mixed condiments and mixed seasonings; mustard flour and meal, whether or not prepared, and mustard",58148329
201512,502,United States,2104,Soups and broths and preparations therefor; homogenised composite food preparations.,564615
201512,502,United States,2106,Food preparations not elsewhere specified or included.,132806181
201512,502,United States,2201,"Waters, including natural or artificial mineral waters andaerated waters, not containing added sugar or other sweetening matter nor flavoured; ice and snow.",322872
201512,502,United States,2202,"Waters, including mineral waters and aerated waters, containing added sugar or other sweetening matter or flavoured, and other nonalcoholic beverages, not including fruit or vegetable juices of heading 20.09.",10003615
201512,502,United States,2203,Beer made from malt.,5213848
201512,502,United States,2204,"Wine of fresh grapes, including fortified wines; grape must other than that of heading 20.09.",357310
201512,502,United States,2206,"Other fermented beverages (for example, cider, perry, mead, saké); mixtures of fermented beverages and mixtures of fermented beverages and nonalcoholic beverages, not elsewhere specified or included.",1374885
201512,502,United States,2207,"Undenatured ethyl alcohol of an alcoholic strength by volume of 80% vol.or higher; ethyl alcohol and other spirits, denatured, of any strength.",383
201512,502,United States,2208,"Undenatured ethyl alcohol of an alcoholic strength by volume of Undenatured ethyl alcohol of an alcoholic strength by volume of less than 80% vol.; spirits, liqueurs and other spirituous beverages.",15547147
201512,502,United States,2209,Vinegar and substitutes for vinegar obtained from acetic acid.,1382907
201512,502,United States,2303,"Residues of starch manufacture and similar residues, beetpulp, bagasse and other waste of sugar manufacture, brewing ordistilling dregs and waste, whether or not in the form of pellets.",3911
201512,502,United States,2304,"Oilcake and other solid residues, whether or not ground or in the form of pellets, resulting from the extraction of soyabean oil.",37931782
201512,502,United States,2306,"Oilcake and other solid residues, whether or not ground or in the form of pellets, resulting from the extraction of vegetable fats or oils,other than those of heading 23.04 or 23.05.",1209273
201512,502,United States,2308,"Vegetable materials and vegetable waste, vegetable residues and byproducts, whether or not in the form of pellets, of a kind used in animal feeding, not elsewhere specified or included.",1224128
201512,502,United States,2309,Preparations of a kind used in animal feeding.,189618413
201512,502,United States,2402,"Cigars, cheroots, cigarillos and cigarettes, of tobacco or of tobacco substitutes.",4597984
201512,502,United States,2403,Other manufactured tobacco and manufactured tobacco substitutes; “homogenised” or reconstituted” tobacco; tobacco extracts and essences.,2086726
201512,502,United States,2501,"Salts, incl. table salt and denatured salt, and pure sodium chloride, whether or not in aqueous solution or containing added anti-caking or free-flowing agents; sea water",390972
201512,502,United States,2504,Natural graphite.,768152
201512,502,United States,2506,"Quartz (excluding natural sands); quartzite, whether or not roughly trimmed or merely cut, by sawing or otherwise, into blocks or slabs of a square or rectangular shape",2772245
201512,502,United States,2507,"Kaolin and other kaolinic clays, whether or not calcined",150966
201512,502,United States,2508,"Other clays (not including expanded clays of heading 68.06), andalusite, kyanite and sillimanite, whether or not calcined; mullite; chamotte or dinas earths.",10504218
201512,502,United States,2511,"Natural barium sulphate (barytes); natural barium carbonate (witherite), whether or not calcined, other than barium oxide of heading 28.16.",117664413
201512,502,United States,2513,"Pumice stone; emery; natural corundum, natural garnet and other natural abrasives, whether or not heat-treated",246126
201512,502,United States,2514,"Slate, whether or not roughly trimmed or merely cut, by sawing or otherwise, into blocks or slabs of a square or rectangular shape; slate powder and slate refuse",2381890
201512,502,United States,2515,"Marble, travertine, ecaussine and other calcareous monumental or building stone of an apparent specific gravity of 2.5 or more, and alabaster, whether or not roughly trimmed or merely cut, by sawing or otherwise, into blocks or slabs of a rectangular (including square) shape.",203603
201512,502,United States,2516,"Granite, porphyry, basalt, sandstone and other monumental or building stone, whether or not roughly trimmed or merely cut, by sawing or otherwise, into blocks or slabs of a rectangular (including square) shape.",1680076
201512,502,United States,2517,"Pebbles, gravel, broken or crushed stone, for concrete aggregates, for road metalling or for railway ballast, shingle and flint, whether or not heat-treated; macadam of slag, dross or similar industrial waste, whether or not incorporating the materials cited in the first part of the heading; tarred macadam; granules, chippings and powder, of stones of heading 2515 and 2516, whether or not heat-treated",467065
201512,502,United States,2519,"Natural magnesium carbonate ""magnesite""; fused magnesia; dead-burned ""sintered"" magnesia, whether or not containing small quantities of other oxides added before sintering; other magnesium oxide, whether or not pure",56300631
201512,502,United States,2520,"Gypsum; anhydrite; plasters consisting of calcined gypsum or calcium sulphate, whether or not coloured, with or without small quantities of accelerators or retarders",19770
201512,502,United States,2521,"Limestone flux; limestone and other calcareous stone, of a kind used for the manufacture of lime or cement",32584
201512,502,United States,2522,"Quicklime, slaked lime and hydraulic lime (excluding pure calcium oxide and calcium hydroxide)",3307
201512,502,United States,2523,"Portland cement, aluminous cement, slagcement, supersulphate cement and similar hydraulic cements, whether or not coloured or in the form of clinkers.",77938952
201512,502,United States,2525,"Mica, including splittings; mica waste.",478800
201512,502,United States,2526,"Natural steatite, whether or not roughly trimmed or merely cut, by sawing or otherwise, into blocks or slabs of a rectangular (including square) shape; talc.",249216
201512,502,United States,2529,"Feldspar; leucite, nepheline and nepheline syenite; fluorspar.",13720605
201512,502,United States,2530,Mineral substances not elsewhere specified or included.,4352444
201512,502,United States,2621,"Other slag and ash, including seaweed ash (kelp); ash and residues from the incineration of municipal waste.",2636926
201512,502,United States,2707,Oils and other products of the distillation of high temperature coal tar; similar products in which the weight of the aromatic constituents exceeds that of the non-aromatic constituents,2410694
201512,502,United States,2708,"Pitch and pitch coke, obtained from coal tar or from other mineral tars",698521
201512,502,United States,2709,"Petroleum oils and oils obtained from bituminous minerals, crude.",153
201512,502,United States,2710,"Petroleum oils and oils obtained from bituminous minerals, other than crude; preparations not elsewhere specified or included, containing by weight 70% or more of petroleum oils or of oils obtained from bituminous minerals, these oils being the basic constituents of the preparations; waste oils.",570958397
201512,502,United States,2711,Petroleum gases and other gaseous hydrocarbons.,177380
201512,502,United States,2712,"Petroleum jelly, paraffin wax, micro- crystalline petroleum wax, slack wax, ozokerite, lignite wax, peat wax, other mineral waxes, and similar products obtained by synthesis or by other processes, whether or not coloured",95606963
201512,502,United States,2713,"Petroleum coke, petroleum bitumen and other residues of petroleum oils or of oils obtained from bituminous minerals.",3233436
201512,502,United States,2714,"Bitumen and asphalt, natural; bituminous or oil-shale and tar sands; asphaltites and asphaltic rocks",103110
201512,502,United States,2803,Carbon (carbon blacks and other forms of carbon not elsewhere specified or included).,5601677
201512,502,United States,2804,"ydrogen, rare gases and other nonmetals.",12370412
201512,502,United States,2805,"Alkali or alkaline-earth metals; rare-earth metals, scandium and yttrium, whether or not intermixed or interalloyed; mercury",5965862
201512,502,United States,2809,"Diphosphorus pentaoxide; phosphoric acid; polyphosphoric acids, whether or not chemically defined",44630794
201512,502,United States,2810,Oxides of boron; boric acids.,116536
201512,502,United States,2811,Other inorganic acids and other inorganic oxygen compounds of nonmetals.,39537833
201512,502,United States,2812,Halides and halide oxides of nonmetals.,2689768
201512,502,United States,2815,"Sodium hydroxide (caustic soda), potassium hydroxide (caustic potash); peroxides of sodium or potassium",14453473
201512,502,United States,2816,"Oydroxide and peroxide of magnesium; oxides, hydroxides and peroxides, of strontium or barium.",2320501
201512,502,United States,2817,Zinc oxide; zinc peroxide.,257784
201512,502,United States,2818,"Artificial corundum, whether or not chemically defined;aluminium oxide; aluminium hydroxide.",24870364
201512,502,United States,2819,Chromium oxides and hydroxides,2648501
201512,502,United States,2820,Manganese oxides.,50590
201512,502,United States,2821,Iron oxides and hydroxides; earth colours containing 70% or more by weight of combined iron evaluated as Fe2O3.,55808015
201512,502,United States,2822,Cobalt oxides and hydroxides; commercial cobalt oxides.,2538959
201512,502,United States,2823,Titanium oxides.,5729769
