Date of data,Trading partner code,Trading partner,Commodity code,Commodity,Renminbi Yuan
201512,502,United States,7110,"Platinum, unwrought or in semimanufactured forms, or in powder form.",8213868
201512,502,United States,7112,"Waste and scrap of precious metal or of metal clad with precious metal; other waste and scrap containing precious metal or precious metal compounds, of a kind used principally for the recovery of precious metal.",11265751
201512,502,United States,7113,"Articles of jewellery and parts thereof, of precious metal or of metal clad with precious metal.",1584013835
201512,502,United States,7114,"Articles of goldsmiths' or silversmiths' wares and parts thereof, of precious metal or of metal clad with precious metal.",14825154
201512,502,United States,7115,Other articles of precious metal or of metal clad with precious metal.,361722
201512,502,United States,7116,"Articles of natural or cultured pearls, precious or semiprecious stones (natural, synthetic or reconstructed).",86829584
201512,502,United States,7117,Imitation jewellery.,501313693
201512,502,United States,7118,Coin.,42201
201512,502,United States,7202,Ferroalloys.,3802045
201512,502,United States,7205,"Nranules and powders, of pig iron, spiegeleisen, iron or steel",4459425
201512,502,United States,7208,"Flat-rolled products of iron or nonalloy steel, of a width of 600 mm or more, hotrolled, not clad, plated or coated.",5302
201512,502,United States,7209,"Flat-rolled products of iron or nonalloy steel, of a width of 600 mm or more, coldrolled (coldreduced), not clad, plated or coated.",18090
201512,502,United States,7210,"at-rolled products of iron or non-alloy steel, of a width ≥ 600 mm, hot-rolled or cold-rolled ""cold-reduced"", clad, plated or coated",36805886
201512,502,United States,7211,"Flat-rolled products of iron or nonalloy steel, of a width of less than 600 mm, not clad, plated or coated.",921024
201512,502,United States,7212,"Flat-rolled products of iron or nonalloy steel, of a width of less than 600 mm, clad, plated or coated.",1903479
201512,502,United States,7213,"Bars and rods, hotrolled, in irregularly wound coils, of iron or nonalloy steel.",30465
201512,502,United States,7214,"Other bars and rods of iron or nonalloy steel, not further worked than forged, hotrolled, hotdrawn or hotextruded, but including those twisted after rolling.",5114728
201512,502,United States,7215,Other bars and rods of iron or nonalloy steel.,806550
201512,502,United States,7216,"Angles, shapes and sections of iron or nonalloy steel.",4713750
201512,502,United States,7217,Wire of iron or nonalloy steel.,52961921
201512,502,United States,7218,Stainless steel in ingots or other primary forms; semifinished products of stainless steel.,4302
201512,502,United States,7219,"Flat-rolled products of stainless steel, of a width of 600 mm or more.",57608391
201512,502,United States,7220,"Flat-rolled products of stainless steel, of a width of less than 600 mm.",5902827
201512,502,United States,7221,"Bars and rods, hotrolled, in irregularly wound coils, of stainless steel.",7765945
201512,502,United States,7222,"Other bars and rods of stainless steel; angles, shapes and sections of stainless steel.",2451853
201512,502,United States,7223,Wire of stainless steel.,12566564
201512,502,United States,7224,Other alloy steel in ingots or other primary forms; semifinished products of other alloy steel.,473752
201512,502,United States,7225,"Flat-rolled products of other alloy steel, of a width of 600 mm or more.",15822183
201512,502,United States,7226,"Flat-rolled products of alloy steel other than stainless, of a width of ≥ 600 mm, hot-rolled or cold-rolled ""cold-reduced"" and further worked (excluding plated or coated with zinc and products of silicon-electrical steel)",923177
201512,502,United States,7228,"Other bars and rods of other alloy steel; angles, shapes and sections, of other alloy steel; hollow drill bars and rods, of alloy or nonalloy steel.",127444095
201512,502,United States,7229,Wire of other alloy steel.,28816267
201512,502,United States,7301,"Sheet piling of iron or steel, whether or not drilled, punched or made from assembled elements; welded angles, shapes and sections, of iron or steel.",2737260
201512,502,United States,7302,"Railway or tramway track construction material of iron or steel, the following : rails, check-rails and rack rails, switch blades, crossing frogs, point rods and other crossing pieces, sleepers ""cross-ties"", fish-plates, chairs, chair wedges, sole plates ""base plates"", rail clips, bedplates, ties and other material specialised for jointing or fixing rails",23359632
201512,502,United States,7303,"Tubes, pipes and hollow profiles, of cast iron.",12927847
201512,502,United States,7304,"Tubes, pipes and hollow profiles, seamless, of iron (other than cast iron) or steel.",117797714
201512,502,United States,7305,"Other tubes and pipes (for example, welded, riveted or similarly closed), having circular cross-sections, the external diameter of which exceeds 406.4 mm, of iron or steel.",19622831
201512,502,United States,7306,"Other tubes, pipes and hollow profiles (for example, open seam or welded, riveted or similarly closed), of iron or steel.",102064519
201512,502,United States,7307,"Tube or pipe fittings (for example, couplings, elbows, sleeves), of iron or steel.",476542626
201512,502,United States,7308,"Structures (excluding prefabricated buildings of heading 94.06) and parts of structures (for example, bridges and bridgesections, lockgates, towers, lattice masts, roofs, roofing frameworks, doors and windows and their frames and thresholds for doors, shutters, balustrades, pillars and columns), of iron or steel; plates, rods, angles, shapes, sections, tubes and the like, prepared for use in structures, of iron or steel.",554870074
201512,502,United States,7309,"eservoirs, tanks, vats and similar containers for any material (other than compressed or liquefied gas), of iron or steel, of a capacity exceeding 300 l, whether or not lined or heatinsulated, but not fitted with mechanical or thermal equipment.",17890018
201512,502,United States,7310,"anks, casks, drums, cans, boxes and similar containers, for any material (other than compressed or liquefied gas), of iron or steel, of a capacity not exceeding 300 l, whether or not lined or heatinsulated, but not fitted with mechanical or thermal equipment.",125958496
201512,502,United States,7311,"Containers for compressed or liquefied gas, of iron or steel.",50003201
201512,502,United States,7312,"Stranded wire, ropes, cables, plaited bands, slings and the like, of iron or steel, not electrically insulated.",100003163
201512,502,United States,7313,"Barbed wire of iron or steel; twisted hoop or single flat wire, barbed or not, and loosely twisted double wire, of a kind used for fencing, of iron or steel.",838331
201512,502,United States,7314,"Cloth (including endless bands), grill, netting and fencing, of iron or steel wire; expanded metal of iron or steel.",129774773
201512,502,United States,7315,"Chain and parts thereof, of iron or steel.",95167018
201512,502,United States,7316,"Anchors, grapnels and parts thereof, of iron or steel.",6790344
201512,502,United States,7317,"Nails, tacks, drawing pins, corrugated nails, staples (other than those of heading 83.05) and similar articles, of iron or steel, whether or not with heads of other material, but excluding such articles with heads of copper.",133274166
201512,502,United States,7318,"Screws, bolts, nuts, coach screws, screw hooks, rivets, cotters, cotterpins, washers (including spring washers) and similar articles, of iron or steel.",489926868
201512,502,United States,7319,"Sewing needles, knitting needles, bodkins, crochet hooks, embroidery stilettos and similar articles, for use in the hand, of iron or steel; safety pins and other pins of iron or steel, not elsewhere specified or included.",4278766
201512,502,United States,7320,"Springs and leaves for springs, of iron or steel.",83628245
201512,502,United States,7321,"Stoves, ranges, grates, cookers (including those with subsidiary boilers for central heating), barbecues, braziers, gasrings, plate warmers and similar nonelectric domestic appliances, and parts thereof, of iron or steel.",941644228
201512,502,United States,7322,"Radiators for central heating, not electrically heated, and parts thereof, of iron or steel; air heaters and hot air distributors (including distributors which can also distribute fresh or conditioned air), not electrically heated, incorporating a motordriven fan or blower, and parts thereof, of iron or steel.",6197844
201512,502,United States,7323,"Table, kitchen or other household articles and parts thereof, of iron or steel; iron or steel wool; pot scourers and scouring or polishing pads, gloves and the like, of iron or steel.",879658070
201512,502,United States,7324,"Sanitary ware and parts thereof, of iron or steel.",187053547
201512,502,United States,7325,Other cast articles of iron or steel.,36949717
201512,502,United States,7326,Other articles of iron or steel.,1208811525
201512,502,United States,7406,Copper powders and flakes.,34378
201512,502,United States,7407,"Copper bars, rods and profiles.",2087780
201512,502,United States,7408,Copper wire.,10977850
201512,502,United States,7409,"Copper plates, sheets and strip, of a thickness exceeding 0.15mm.",4706154
201512,502,United States,7410,"Copper foil (whether or not printed or backed with paper, paperboard, plastics or similar backing materials) of a thickness (excluding any backing) not exceeding 0.15 mm.",6078653
201512,502,United States,7411,Copper tubes and pipes.,32020650
201512,502,United States,7412,"Copper tube or pipe fittings (for example, couplings, elbows, sleeves).",105397423
201512,502,United States,7413,"Stranded wire, cables, plaited bands and the like, of copper, not electrically insulated.",879789
201512,502,United States,7415,"Nails, tacks, drawing pins, staples (other than those of heading 83.05) and similar articles, of copper or of iron or steel with heads of copper; screws, bolts, nuts, screw hooks, rivets, cotters, cotterpins, washers (including spring washers) and similar articles, of copper.",13506704
201512,502,United States,7418,"Table, kitchen or other household articles and parts thereof, of copper; pot scourers and scouring or polishing pads, gloves and the like, of copper; sanitary ware and parts thereof, of copper.",51625460
201512,502,United States,7419,Other articles of copper.,19169852
201512,502,United States,7502,nwrought nickel.,5959307
201512,502,United States,7503,Nickel waste and scrap.,2323355
201512,502,United States,7505,"Nickel bars, rods, profiles and wire.",2193397
201512,502,United States,7506,"Nickel plates, sheets, strip and foil.",579560
201512,502,United States,7507,"Nickel tubes, pipes and tube or pipe fittings (for example, couplings, elbows, sleeves).",1576118
201512,502,United States,7508,Other articles of nickel.,2603709
201512,502,United States,7601,Unwrought aluminium.,1077058
201512,502,United States,7602,Aluminium waste and scrap.,1448
201512,502,United States,7603,Aluminium powders and flakes.,2491315
201512,502,United States,7604,"Aluminium bars, rods and profiles.",26918004
201512,502,United States,7605,Aluminium wire.,8939285
201512,502,United States,7606,"Aluminium plates, sheets and strip, of a thickness exceeding 0.2 mm.",426025122
201512,502,United States,7607,"Aluminium foil (whether or not printed or backed with paper, paperboard, plastics or similar backing materials) of a thickness (excluding any backing) not exceeding 0.2 mm.",274548061
201512,502,United States,7608,Aluminium tubes and pipes.,9119276
201512,502,United States,7609,"Aluminium tube or pipe fittings (for example, couplings, elbows, sleeves).",37573411
201512,502,United States,7610,"Aluminium structures (excluding prefabricated buildings of heading 94.06) and parts of structures (for example, bridges and bridgesections, towers, lattice masts, roofs, roofing frameworks, doors and windows and their frames and thresholds for doors, balustrades, pillars and columns); aluminium plates, rods, profiles, tubes and the like, prepared for use in structures.",170297728
201512,502,United States,7611,"Aluminium reservoirs, tanks, vats and similar containers, for any material (other than compressed or liquefied gas), of a capacity exceeding 300 l, whether or not lined or heatinsulated, but not fitted with mechanical or thermal equipment.",105619
201512,502,United States,7612,"Aluminium casks, drums, cans, boxes and similar containers (including rigid or collapsible tubular containers), for any material (other than compressed or liquefied gas), of a capacity not exceeding 300 l, whether or not lined or heatinsulated, but not fitted with mechanical or thermal equipment.",11766922
201512,502,United States,7613,Aluminium containers for compressed or liquefied gas.,1044421
201512,502,United States,7614,"Stranded wire, cables, plaited bands and the like, of aluminium, not electrically insulated.",4119644
201512,502,United States,7615,"Table, kitchen or other household articles and parts thereof, of aluminium; pot scourers and scouring or polishing pads, gloves and the like, of aluminium; sanitary ware and parts thereof, of aluminium.",275295645
201512,502,United States,7616,Other articles of aluminium.,396998447
201512,502,United States,7804,"Lead plates, sheets, strip and foil; lead powders and flakes.",447
201512,502,United States,7806,Other articles of lead.,656667
201512,502,United States,7904,"Zinc bars, rods, profiles and wire.",1640823
201512,502,United States,7907,Other articles of zinc.,33303836
201512,502,United States,8007,Other articles of tin.,446992
201512,502,United States,8101,"Wungsten (wolfram) and articles thereof, including waste and scrap.",27510212
201512,502,United States,8102,"Molybdenum and articles thereof, including waste and scrap.",14453878
201512,502,United States,8103,"Tantalum and articles thereof, including waste and scrap.",26614217
201512,502,United States,8104,"Magnesium and articles thereof, including waste and scrap.",8193826
201512,502,United States,8105,"Cobalt mattes and other intermediate products of cobalt metallurgy; cobalt and articles thereof, including waste and scrap.",4817387
201512,502,United States,8106,"Bismuth and articles thereof, including waste and scrap.",5326842
201512,502,United States,8108,"Titanium and articles thereof, including waste and scrap.",25783392
201512,502,United States,8109,"Zirconium and articles thereof, including waste and scrap.",33360694
201512,502,United States,8110,"Antimony and articles thereof, including waste and scrap.",5337490
201512,502,United States,8111,"Manganese and articles thereof, including waste and scrap.",10114471
201512,502,United States,8112,"Beryllium, chromium, germanium, vanadium, gallium, hafnium, indium, niobium (columbium), rhenium and thallium, and articles of these metals, including waste and scrap.",11225641
201512,502,United States,8113,"Cermets and articles thereof, including waste and scrap.",4240541
201512,502,United States,8201,"Hand tools, the following : spades, shovels, mattocks, picks, hoes, forks and rakes; axes, bill hooks and similar hewing tools; secateurs and pruners of any kind; scythes, sickles, hay knives, hedge shears, timber wedges and other tools of a kind used in agriculture, horticulture or forestry.",104296080
201512,502,United States,8202,"Hand saws; blades for saws of all kinds (including slitting, slotting or toothless saw blades).",82106955
201512,502,United States,8203,"Files, rasps, pliers (including cutting pliers), pincers, tweezers, metal cutting shears, pipecutters, bolt croppers, perforating punches and similar hand tools.",109790620
201512,502,United States,8204,"Hand-operated spanners and wrenches (including torque meter wrenches but not including tap wrenches); interchangeable spanner sockets, with or without handles.",106140650
201512,502,United States,8205,"Hand tools (including glaziers' diamonds), not elsewhere specified or included; blow lamps; vices, clamps and the like, other than accessories for and parts of, machinetools or waterjet cutting machines; anvils; portable forges; hand or pedaloperated grinding wheels with frameworks.",322201331
201512,502,United States,8206,"Tools of two or more of the headings 82.02 to 82.05, put up in sets for retail sale.",104254243
201512,502,United States,8207,"Interchangeable tools for hand tools, whether or not poweroperated, or for machinetools (for example, for pressing, stamping, punching, tapping, threading, drilling, boring, broaching, milling, turning or screw driving), including dies for drawing or extruding metal, and rock drilling or earth boring tools.",285950358
201512,502,United States,8208,"Knives and cutting blades, for machines or for mechanical appliances.",23826735
201512,502,United States,8209,"Plates, sticks, tips and the like for tools, unmounted, of cermets.",57059364
201512,502,United States,8210,"Hand-operated mechanical appliances, weighing 10 kg or less, used in the preparation, conditioning or serving of food or drink.",20825504
201512,502,United States,8211,"Knives with cutting blades, serrated or not (including pruning knives), other than knives of heading 82.08, and blades therefor.",181829145
201512,502,United States,8212,Razors and razor blades (including razor blade blanks in strips).,40959850
201512,502,United States,8213,"Scissors, tailors' shears and similar shears, and blades therefor.",46574567
201512,502,United States,8214,"Other articles of cutlery (for example, hair clippers, butchers' or kitchen cleavers, choppers and mincing knives, paper knives); manicure or pedicure sets and instruments (including nail files).",78555427
201512,502,United States,8215,"Spoons, forks, ladles, skimmers, cakeservers, fishknives, butterknives, sugar tongs and similar kitchen or tableware.",216416418
201512,502,United States,8301,"Padlocks and locks (key, combination or electrically operated), of base metal; clasps and frames with clasps, incorporating locks, of base metal; keys for any of the foregoing articles, of base metal",401648254
201512,502,United States,8302,"Base metal mountings, fittings and similar articles suitable for furniture, doors, staircases, windows, blinds, coachwork, saddlery, trunks, chests, caskets or the like; base metal hatracks, hatpegs, brackets and similar fixtures; castors with mountings of base metal; automatic door closers of base metal",1079713975
201512,502,United States,8303,"Armoured or reinforced safes, strongboxes and doors and safe deposit lockers for strongrooms, cash or deed boxes and the like, of base metal",93926396
201512,502,United States,8304,"Filing cabinets, cardindex cabinets, paper trays, paper rests, pen trays, officestamp stands and similar office or desk equipment, of base metal, other than office furniture of heading 9403",31545896
201512,502,United States,8305,"Fittings for looseleaf binders or files, letter clips, letter corners, paper clips, indexing tags and similar office articles, of base metal; staples in strips (for example, for offices, upholstery, packaging), of base metal",84921751
201512,502,United States,8306,"Bells, gongs and the like, nonelectric, of base metal; statuettes and other ornaments, of base metal; photograph, picture or similar frames, of base metal; mirrors of base metal",483856401
201512,502,United States,8307,"Flexible tubing of base metal, with or without fittings",19542661
201512,502,United States,8308,"Clasps, frames with clasps, buckles, buckleclasps, hooks, eyes, eyelets and the like, of base metal, of a kind used for clothing or clothing accessories, footwear, jewellery, wristwatches, books, awnings, leather goods, travel goods or saddlery or for other made up articles; tubular or bifurcated rivets, of base metal; beads and spangles, of base metal",57809234
201512,502,United States,8309,"Stoppers, caps and lids (including crown corks, screw caps and pouring stoppers), capsules for bottles, threaded bungs, bung covers, seals and other packing accessories, of base metal",28957696
201512,502,United States,8310,"Signplates, nameplates, addressplates and similar plates, numbers, letters and other symbols, of base metal, excluding those of heading 9405",26679218
201512,502,United States,8311,"Wire, rods, tubes, plates, electrodes and similar products, of base metal or of metal carbides, coated or cored with flux material, of a kind used for soldering, brazing, welding or deposition of metal or of metal carbides; wire and rods, of agglomerated base metal powder, used for metal spraying",10296452
201512,502,United States,8402,Steam or other vapour generating boilers (other than central heating hot water boilers capable also of producing low pressure steam); superheated water boilers.,19885012
201512,502,United States,8403,Central heating boilers other than those of heading 8402.,7065662
201512,502,United States,8404,"Auxiliary plant for use with boilers of heading 84.02 or 84.03 (for example, economisers, superheaters, soot removers, gas recoverers); condensers for steam or other vapour power units.",24750446
201512,502,United States,8405,"Producer gas or water gas generators, with or without their purifiers; acetylene gas generators and similar water process gas generators, with or without their purifiers.",560329
201512,502,United States,8406,Steam turbines and other vapour turbines.,12163591
201512,502,United States,8407,Sparkignition reciprocating or rotary internal combustion piston engines.,292602047
201512,502,United States,8408,Compressionignition internal combustion piston engines (diesel or semidiesel engines).,58255843
201512,502,United States,8409,Parts suitable for use solely or principally with the engines of heading 84.07 or 84.08.,596246252
201512,502,United States,8410,"Hydraulic turbines, water wheels, and regulators therefor.",1591289
201512,502,United States,8411,"Turbojets, turbopropellers and other gas turbines.",487781179
201512,502,United States,8412,Other engines and motors.,268233326
201512,502,United States,8413,"Pumps for liquids, whether or not fitted with a measuring device; liquid elevators.",771116793
201512,502,United States,8414,"Air or vacuum pumps, air or other gas compressors and fans; ventilating or recycling hoods incorporating a fan, whether or not fitted with filters.",1465126319
201512,502,United States,8415,"Air conditioning machines, comprising a motordriven fan and elements for changing the temperature and humidity, including those machines in which the humidity cannot be separately regulated.",756926051
201512,502,United States,8416,"Furnace burners for liquid fuel, for pulverised solid fuel or for gas; mechanical stokers, including their mechanical grates,mechanical ash dischargers and similar appliances.",13108479
201512,502,United States,8417,"Industrial or laboratory furnaces and ovens, including incinerators, nonelectric.",61262333
201512,502,United States,8418,"Refrigerators, freezers and other refrigerating or freezing equipment, electric or other; heat pumps other than air conditioning machines of heading 84.15.",626650619
201512,502,United States,8419,"Machinery, plant or laboratory equipment, whether or not electrically heated (excluding furnaces, ovens and other equipment of heading 85.14), for the treatment of materials by a process involving a change of temperature such as heating, cooking, roasting, distilling, rectifying, sterilising, pasteurising, other than machinery or plant of a kind used for domestic purposes; instantaneous or storage water heaters, nonelectric.",457376705
201512,502,United States,8420,"Calendering or other rolling machines, other than for metals or glass, and cylinders therefor.",4342284
201512,502,United States,8421,"Centrifuges, including centrifugal dryers; filtering or purifying machinery and apparatus, for liquids or gases.",508703377
201512,502,United States,8422,"Dish washing machines; machinery for cleaning or drying bottles or other containers; machinery for filling, closing, sealing or labelling bottles, cans, boxes, bags or other containers; machinery for capsuling bottles, jars, tubes and similar containers; other packing or wrapping machinery (including heatshrink wrapping machinery); machinery for aerating beverages.",117244831
201512,502,United States,8423,"Weighing machinery (excluding balances of a sensitivity of 5 cg or better), including weight operated counting or checking machines; weighing machine weights of all kinds.",159518842
201512,502,United States,8424,"Mechanical appliances (whether or not handoperated) for projecting, dispersing or spraying liquids or powders; fire extinguishers, whether or not charged; spray guns and similar appliances; steam or sand blasting machines and similar jet projecting machines.",512828572
201512,502,United States,8425,Pulley tackle and hoists other than skip hoists; winches and capstans; jacks.,379078451
201512,502,United States,8426,"Ships' derricks; cranes, including cable cranes; mobile lifting frames, straddle carriers and works trucks fitted with a crane.",2391044
201512,502,United States,8427,Forklift trucks; other works trucks fitted with lifting or handling equipment.,186305814
201512,502,United States,8428,"Other lifting, handling, loading or unloading machinery (for example, lifts, escalators, conveyors, teleferics).",99647229
201512,502,United States,8429,"Self-propelled bulldozers, angledozers, graders, levellers, machines and road rollers.",48990242
201512,502,United States,8430,"Other moving, grading, levelling, scraping, excavating, tamping, compacting, extracting or boring machinery, for earth, minerals or ores; piledrivers and pileextractors; snowploughs and snowblowers.",46016127
201512,502,United States,8431,Parts suitable for use solely or principally with the machinery of headings 84.25 to 84.30.,673248019
