Date of data,Trading partner code,Trading partner,Commodity code,Commodity,Renminbi Yuan
202104,502,United States,3905,"Polymers of vinyl acetate or of other vinyl esters, in primary forms; other vinyl polymers in primary forms.",5585597.0
202104,502,United States,3906,crylic polymers in primary forms.,84343976.0
202104,502,United States,3907,"Polyacetals, other polyethers and epoxide resins, in primary forms; polycarbonates, alkyd resins, polyallyl esters and other polyesters, in primary forms.",201941615.0
202104,502,United States,3908,Polyamides in primary forms.,15335887.0
202104,502,United States,3909,"minoresins, phenolic resins and polyurethanes, in primary forms.",218593772.0
202104,502,United States,3910,Silicones in primary forms.,25083688.0
202104,502,United States,3911,"etroleum resins, coumaroneindene resins, polyterpenes, polysulphides, polysulphones and other products specified in Note 3 to this Chapter, not elsewhere specified or included, in primary forms.",31457970.0
202104,502,United States,3912,"Cellulose and its chemical derivatives, not elsewhere specified or included, in primary forms.",16950477.0
202104,502,United States,3913,"Natural polymers (for example, alginic acid) and modified natural polymers (for example, hardened proteins, chemical derivatives of natural rubber), not elsewhere specified or included, in primary forms.",49878144.0
202104,502,United States,3914,"Ionexchangers based on polymers of headings 39.01 to 39.13, in primary forms.",26796161.0
202104,502,United States,3915,"Waste, parings and scrap, of plastics.",871401.0
202104,502,United States,3916,"Monofilament of which any crosssectional dimension exceeds 1 mm, rods, sticks and profile shapes, whether or not surfacworked but not otherwise worked, of plastics.",86563466.0
202104,502,United States,3917,"Tubes, pipes and hoses, and fittings therefor (for example, joints,elbows, flanges), of plastics.",380116194.0
202104,502,United States,3918,"Floor coverings of plastics, whether or not selfadhesive, in rolls or in the form of tiles; wall or ceiling coverings of plastics, as defined in Note 9 to this Chapter.",1879683384.0
202104,502,United States,3919,"Selfadhesive plates, sheets, film, foil, tape, strip and other flat shapes, of plastics, whether or not in rolls.",248876642.0
202104,502,United States,3920,"Other plates, sheets, film, foil and strip, of plastics, noncellular and not reinforced, laminated, supported or similarly combined with other materials.",314976718.0
202104,502,United States,3921,"Other plates, sheets, film, foil and strip, of plastics.",186380784.0
202104,502,United States,3922,"Baths, showerbaths, sinks, washbasins, bidets, lavatory pans, seats and covers, flushing cisterns and similar sanitary ware, of plastics.",149156473.0
202104,502,United States,3923,"Articles for the conveyance or packing of goods, of plastics; stoppers, lids, caps and other closures, of plastics.",1663404547.0
202104,502,United States,3924,"Tableware, kitchenware, other household articles and hygienic or toilet articles, of plastics.",2363979505.0
202104,502,United States,3925,"Builders' ware of plastics, not elsewhere specified or included.",293922006.0
202104,502,United States,3926,Other articles of plastics and articles of other materials of headings 39.01 to 39.14.,5659139203.0
202104,502,United States,4001,"Natural rubber, balata, guttapercha, guayule, chicle and similar natural gums, in primary forms or in plates, sheets or strip.",1223.0
202104,502,United States,4002,"Synthetic rubber and factice derived from oils, in primary forms or in plates, sheets or strip; mixtures of any product of heading 40.01 with any product of this heading, in primary forms or in plates, sheets or strip.",8676557.0
202104,502,United States,4003,"Reclaimed rubber in primary forms or in plates, sheets or strip.",6419685.0
202104,502,United States,4005,"ompounded rubber, unvulcanised, in primary forms or in plates, sheets or strip.",246545.0
202104,502,United States,4006,"Other forms (for example, rods, tubes and profile shapes) and articles (for example, discs and rings), of unvulcanised rubber.",588599.0
202104,502,United States,4007,Vulcanised rubber thread and cord.,4218936.0
202104,502,United States,4008,"lates, sheets, strip, rods and profile shapes, of vulcanised rubber other than hard rubber.",15040602.0
202104,502,United States,4009,"Tubes, pipes and hoses, of vulcanised rubber other than hard rubber, with or without their fittings (for example, joints, elbows, flanges).",108191942.0
202104,502,United States,4010,"Conveyor or transmission belts or belting, of vulcanised rubber.",53896578.0
202104,502,United States,4011,"New pneumatic tyres, of rubber.",602923626.0
202104,502,United States,4012,"Retreaded or used pneumatic tyres of rubber; solid or cushion tyres, tyre treads and tyre flaps, of rubber.",19830282.0
202104,502,United States,4013,"Inner tubes, of rubber.",15613356.0
202104,502,United States,4014,"Hygienic or pharmaceutical articles (including teats), of vulcanised rubber other than hard rubber, with or without fittings of hard rubber.",3660152.0
202104,502,United States,4015,"Articles of apparel and clothing accessories (including gloves, mittens and mitts), for all purposes, of vulcanised rubber other than hard rubber.",1690482661.0
202104,502,United States,4016,Other articles of vulcanised rubber other than hard rubber.,384374908.0
202104,502,United States,4017,"Hard rubber (for example, ebonite) in all forms, including waste and scrap; articles of hard rubber.",4331218.0
202104,502,United States,4104,"Tanned or crust hides and skins of bovine (including buffalo) or equine animals, without hair on, whether or not split, but not further prepared.",18766.0
202104,502,United States,4107,"Leather further prepared after tanning or crusting, including parchmentdressed leather, of bovine (including buffalo) or equine animals, without hair on, whether or not split, other than leather of heading 41.14.",2595967.0
202104,502,United States,4113,"Leather further prepared after tanning or crusting, including parchmentdressed leather, of other animals, without wool or hair on, whether or not split, other than leather of heading 41.14.",1485243.0
202104,502,United States,4115,"Composition leather with a basis of leather or leather fibre, in slabs, sheets or strip, whether or not in rolls; parings and other waste of leather or of composition leather, not suitable for the manufacture of leather articles; leather dust, powder and flour.",13426.0
202104,502,United States,4201,"Saddlery and harness for any animal, incl. traces, leads, knee pads, muzzles, saddle cloths, saddlebags, dog coats and the like, of any material",210624799.0
202104,502,United States,4202,"Trunks, suitcases, vanitycases, executivecases, briefcases, school satchels, spectacle cases, binocular cases, camera cases, musical instrument cases, gun cases, holsters and similar containers; travellingbags, insulated food or beverages bags, toilet bags, rucksacks, handbags, shoppingbags, wallets, purses, mapcases, cigarettecases, tobaccopouches, tool bags, sports bags, bottlecases, jewellery boxes, powderboxes, cutlery cases and similar containers, of leather or of composition leather, of sheeting of plastics, of textile materials, of vulcanised fibre or of paperboard, or wholly or mainly covered with such materials or with paper.",2245185146.0
202104,502,United States,4203,"Articles of apparel and clothing accessories, of leather or of composition leather.",85780615.0
202104,502,United States,4205,Other articles of leather or of composition leather.,127882816.0
202104,502,United States,4302,"Tanned or dressed furskins (including heads, tails, paws and other pieces or cuttings), unassembled, or assembled (without the addition of other materials) other than those of heading 43.03.",479153.0
202104,502,United States,4303,"rticles of apparel, clothing accessories and other articles of furskin.",7341426.0
202104,502,United States,4304,Artificial fur and articles thereof.,2943081.0
202104,502,United States,4401,"Fuel wood, in logs, billets, twigs, faggots or similar forms; wood in chips or particles; sawdust and wood waste and scrap, whether or not agglomerated in logs, briquettes, pellets or similar forms",124765.0
202104,502,United States,4402,"Wood charcoal (including shell or nut charcoal), whether or notagglomerated.",1846599.0
202104,502,United States,4404,"Hoopwood; split poles; piles, pickets and stakes of wood, pointed but not sawn lengthwise; wooden sticks, roughly trimmed but not turned, bent or otherwise worked, suitable for the manufacture of walkingsticks,umbrellas, tool handles or the like; chipwood and the like.",73969.0
202104,502,United States,4407,"Wood sawn or chipped lengthwise, sliced or peeled, whether or not planed, sanded or endjointed, of a thickness exceeding 6 mm.",5353318.0
202104,502,United States,4408,"Sheets for veneering, incl. those obtained by slicing laminated wood, for plywood or for other similar laminated wood and other wood, sawn lengthwise, sliced or peeled, whether or not planed, sanded, spliced or end-jointed, of a thickness of ≤ 6 mm",2401775.0
202104,502,United States,4409,"Wood, incl. strips and friezes for parquet flooring, not assembled, continuously shaped tongued, grooved, rebated, chamfered, V-jointed beaded, moulded, rounded or the like"" along any of its edges, ends or faces, whether or not planed, sanded or end-jointed""",36154547.0
202104,502,United States,4410,"Particle board, oriented strand board (OSB) and similar board (for example, waferboard) of wood or other ligneous materials, whether or not agglomerated with resins or other organic binding substances.",5241260.0
202104,502,United States,4411,"Fibreboard of wood or other ligneous materials, whether or not bonded with resins or other organic substances.",63201245.0
202104,502,United States,4412,"Plywood, veneered panels and similar laminated wood.",194044330.0
202104,502,United States,4413,"Densified wood, in blocks, plates, strips or profile shapes.",116870.0
202104,502,United States,4414,"Wooden frames for paintings, photographs, mirrors or similar objects.",126916074.0
202104,502,United States,4415,"Packing cases, boxes, crates, drums and similar packings, of wood; cabledrums of wood; pallets, box pallets and other loadboards,of wood; pallet collars of wood.",5876464.0
202104,502,United States,4416,"Casks, barrels, vats, tubs and other coopers' products and parts thereof, of wood, including staves.",1619989.0
202104,502,United States,4417,"Tools, tool bodies, tool handles, broom or brush bodies and handles, of wood; boot or shoe lasts and trees, of wood.",1567311.0
202104,502,United States,4418,"Builders' joinery and carpentry of wood, including cellular wood panels, assembled flooring panels, shingles and shakes.",159928454.0
202104,502,United States,4419,"Tableware and kitchenware, of wood.",121841410.0
202104,502,United States,4420,"Wood marquetry and inlaid wood; caskets and cases for jewellery or cutlery, and similar articles, of wood; statuettes and other ornaments, of wood; wooden articles of furniture (excluding furniture, lighting fixtures and parts thereof)",356535374.0
202104,502,United States,4421,Other articles of wood.,652147491.0
202104,502,United States,4503,Articles of natural cork.,1953.0
202104,502,United States,4504,"Agglomerated cork, with or without a binding substance, and articles of agglomerated cork",3791421.0
202104,502,United States,4601,"Plaits and similar products of plaiting materials, whether or not assembled into strips; plaiting materials, plaits and similar products of plaiting materials, bound together in parallel strands or woven, in sheet form, whether or not being finished articles (for example, mats, matting, screens).",37529153.0
202104,502,United States,4602,"Basketwork, wickerwork and other articles, made directly to shape from plaiting materials or made up from goods of heading 46.01; articles of loofah.",200779546.0
202104,502,United States,4706,"Pulps of fibres derived from recovered waste and scrap"" paper or paperboard or of other fibrous cellulosic material""",1088605.0
202104,502,United States,4801,"Newsprint, in rolls or sheets.",62000.0
202104,502,United States,4802,"Uncoated paper and paperboard, of a kind used for writing, printing or other graphic purposes, and non perforated punchcards and punch tape paper, in rolls or rectangular (including square) sheets, of any size, other than paper of heading 48.01 or 48.03; handmade paper and paperboard.",4765635.0
202104,502,United States,4803,"Toilet or facial tissue stock, towel or napkin stock and similar paper of a kind used for household or sanitary purposes, cellulose wadding and webs of cellulose fibres, whether or not creped, crinkled, embossed, perforated, surfacecoloured, surfacedecorated or printed, in rolls or sheets.",3642230.0
202104,502,United States,4804,"Uncoated kraft paper and paperboard, in rolls or sheets, other than that of heading 48.02 or 48.03.",1722130.0
202104,502,United States,4805,"Other uncoated paper and paperboard, in rolls or sheets, not further worked or processed than as specified in Note 3 to this Chapter.",36837615.0
202104,502,United States,4806,"vegetable parchment, greaseproof papers, tracing papers and glassine and other glazed transparent or translucent papers, in rolls or sheets.",229489.0
202104,502,United States,4807,"Composite paper and paperboard (made by sticking flat layers of paper or paperboard together with an adhesive), not surfacecoated or impregnated, whether or not internally reinforced, in rolls or sheets.",58659.0
202104,502,United States,4808,"Paper and paperboard, corrugated (with or without glued flat surface sheets), creped, crinkled, embossed or perforated, in rolls or sheets, other than paper of the kind described in heading 48.03.",1507727.0
202104,502,United States,4809,"Carbon paper, selfcopy paper and other copying or transfer papers (including coated or impregnated paper for duplicator stencils or offset plates), whether or not printed, in rolls or sheets.",2893931.0
202104,502,United States,4810,"Paper and paperboard, coated on one or both sides with kaolin (China clay) or other inorganic substances, with or without a binder, and with no other coating, whether or not surface coloured, surfacedecorated or printed, in rolls or rectangular (including square) sheets, of any size.",5332407.0
202104,502,United States,4811,"Paper, paperboard, cellulose wadding and webs of cellulose fibres,coated,impregnated,covered, surfacecoloured, surface decorated or printed, in rolls or rectangular (including square) sheets, of any size, other than goods of the kind described in heading 48.03, 48.09 or 48.10.",43603025.0
202104,502,United States,4812,"Filter blocks, slabs and plates, of paper pulp.",454125.0
202104,502,United States,4813,"Cigarette paper, whether or not cut to size or in the form of booklets or tubes.",266540.0
202104,502,United States,4814,Wallpaper and similar wall coverings; window transparencies of paper.,9460649.0
202104,502,United States,4816,"Carbon paper, self-copy paper and other copying or transfer papers, in rolls of a width of ≤ 36 cm or in rectangular or square sheets with no side measuring ＞ 36 cm in the unfolded state, or cut into shapes other than rectangles or squares, together with full duplicator stencils and offset plates of paper, whether or not in boxes",5356263.0
202104,502,United States,4817,"Envelopes, letter cards, plain postcards and correspondence cards, of paper or paperboard; boxes, pouches, wallets and writing compendiums, of paper or paperboard, containing an assortment of paper stationery.",54953481.0
202104,502,United States,4818,"Toilet paper and similar paper, cellulose wadding or webs of cellulose fibres, of a kind used for household or sanitary purposes, in rolls of a width ≤ 36 cm, or cut to size or shape; handkerchiefs, cleansing tissues, towels, tablecloths, serviettes, bedsheets and similar household, sanitary or hospital articles, articles of apparel and clothing accessories, of paper pulp, paper, cellulose wadding or webs of cellulose fibres",127153403.0
202104,502,United States,4819,"Cartons, boxes, cases, bags and other packing containers, of paper, paperboard, cellulose wadding or webs of cellulose fibres, n.e.s.; box files, letter trays, and similar articles, of paperboard of a kind used in offices, shops or the like",657822967.0
202104,502,United States,4820,"Registers, account books, note books, order books, receipt books, letter pads, memorandum pads,diaries and similar articles, exercise books, blottingpads, binders (looseleaf or other), folders, file covers, manifold business forms, interleaved carbon sets and other articles of stationery, of paper or paperboard; albums for samples or for collections and book covers, of paper or paperboard.",193379642.0
202104,502,United States,4821,"paper or paperboard labels of all kinds, whether or not printed.",69711841.0
202104,502,United States,4822,"Bobbins, spools, cops and similar supports of paper pulp, paper or paperboard (whether or not perforated or hardened).",5475976.0
202104,502,United States,4823,"Other paper, paperboard, cellulose wadding and webs of cellulose fibres, cut to size or shape; other articles of paper pulp, paper,paperboard, cellulose wadding or webs of cellulose fibres.",327748962.0
202104,502,United States,4901,"Printed books, brochures, leaflets and similar printed matter, whether or not in single sheets.",219057329.0
202104,502,United States,4902,"Newspapers, journals and periodicals, whether or not illustrated or containing advertising material.",360762.0
202104,502,United States,4903,"Children's picture, drawing or colouring books.",91532953.0
202104,502,United States,4905,"Maps and hydrographic or similar charts of all kinds, including atlases, wall maps, topographical plans and globes, printed.",511856.0
202104,502,United States,4907,"Unused postage, revenue or similar stamps of current or new issue in the country in which they have, or will have, a recognised face value; stamp-impressed paper; banknotes; cheque forms; stock, share or bond certificates and similar documents of title",2679390.0
202104,502,United States,4908,Transfers (decalcomanias),60058024.0
202104,502,United States,4909,"Printed or illustrated postcards; printed cards bearing personal greetings, messages or announcements, whether or not illustrated, with or without envelopes or trimmings.",86736305.0
202104,502,United States,4910,"Calendars of any kind, printed, including calendar blocks.",20988367.0
202104,502,United States,4911,"Other printed matter, including printed pictures and photographs.",225209212.0
202104,502,United States,5004,Silk yarn (other than yarn spun from silk waste) not put up for retail sale.,7710376.0
202104,502,United States,5006,"Silk yarn and yarn spun from silk waste, put up for retail sale;silkworm gut.",22222.0
202104,502,United States,5007,Woven fabrics of silk or of silk waste.,2931701.0
202104,502,United States,5105,"Wool and fine or coarse animal hair, carded or combed (including combed wool in fragments).",2738132.0
202104,502,United States,5106,"Yarn of carded wool, not put up for retail sale.",341922.0
202104,502,United States,5107,"Yarn of combed wool, not put up for retail sale.",24344270.0
202104,502,United States,5108,"yarn of fine animal hair (carded or combed), not put up for retail sale.",1750570.0
202104,502,United States,5109,"Yarn of wool or of fine animal hair, put up for retail sale.",958610.0
202104,502,United States,5111,Woven fabrics of carded wool or of carded fine animal hair.,138838.0
202104,502,United States,5112,Woven fabrics of combed wool or of combed fine animal hair.,452627.0
202104,502,United States,5204,"Cotton sewing thread, whether or not put up for retail sale.",268240.0
202104,502,United States,5205,"Cotton yarn (other than sewing thread), containing 85% or more by weight of cotton, not put up for retail sale.",148140.0
202104,502,United States,5206,"otton yarn (other than sewing thread), containing less than 85% by weight of cotton, not put up for retail sale.",988861.0
202104,502,United States,5207,otton yarn (other than sewing thread) put up for retail sale.,1628714.0
202104,502,United States,5208,"Woven fabrics of cotton, containing 85% or more by weight of cotton, weighing not more than 200 g/m2",40314635.0
202104,502,United States,5209,"Woven fabrics of cotton, containing 85% or more by weight of cotton, weighing more than 200 g/m2",13137114.0
202104,502,United States,5210,"Woven fabrics of cotton, containing less than 85% by weight of cotton, mixed mainly or solely with manmade fibres, weighing not more than 200 g/m2.",3609246.0
202104,502,United States,5211,"Woven fabrics of cotton, containing less than 85% by weight of cotton, mixed mainly or solely with manmade fibres, weighing more than 200 g/m2.",8131412.0
202104,502,United States,5212,Other woven fabrics of cotton.,518613.0
202104,502,United States,5306,lax yarn.,11233.0
202104,502,United States,5307,Yarn of jute or of other textile bast fibres of heading 53.03.,123416.0
202104,502,United States,5308,Yarn of other vegetable textile fibres; paper yarn.,1032733.0
202104,502,United States,5309,Woven fabrics of flax.,7188266.0
202104,502,United States,5310,Woven fabrics of jute or of other textile bast fibres of heading 5303,498341.0
202104,502,United States,5311,Woven fabrics of other vegetable textile fibres; woven fabrics of paper yarn.,105028.0
202104,502,United States,5401,"Sewing thread of manmade filaments, whether or not put up for retail sale.",2626422.0
202104,502,United States,5402,"Synthetic filament yarn (other than sewing thread), not put up for retail sale, including synthetic monofilament of less than 67 decitex.",69248879.0
202104,502,United States,5404,"Synthetic monofilament of 67 decitex or more and of which no crosssectional dimension exceeds 1 mm; strip and the like (for example, artificial straw) of synthetic textile materials of an apparent width not exceeding 5 mm.",4316477.0
202104,502,United States,5405,"Artificial monofilament of 67 decitex or more and of which no crosssectional dimension exceeds 1 mm; strip and the like (for example, artificial straw) of artificial textile materials of an apparent width not exceeding 5 mm.",184046.0
202104,502,United States,5406,"Manmade filament yarn (other than sewing thread), put up for retail sale.",23766368.0
202104,502,United States,5407,"Woven fabrics of synthetic filament yarn, including woven fabrics obtained from materials of heading 54.04.",151622036.0
202104,502,United States,5408,"Woven fabrics of artificial filament yarn, including woven fabrics obtained from materials of heading 54.05.",3056444.0
202104,502,United States,5501,Synthetic filament tow.,2217289.0
202104,502,United States,5503,"Synthetic staple fibres, not carded, combed or otherwise processed for spinning.",25402481.0
202104,502,United States,5504,"Artificial staple fibres, not carded, combed or otherwise processed for spinning.",13800314.0
202104,502,United States,5506,"Synthetic staple fibres, carded, combed or otherwise processed for spinning.",9817.0
202104,502,United States,5508,"Sewing thread of manmade staple fibres, whether or not put up for retail sale.",3779156.0
202104,502,United States,5509,"Yarn (other than sewing thread) of synthetic staple fibres, not put up for retail sale.",10831865.0
202104,502,United States,5510,"Yarn (other than sewing thread) of artificial staple fibres, not put up for retail sale.",453442.0
202104,502,United States,5511,"Yarn (other than sewing thread) of manmade staple fibres, put up for retail sale.",2544163.0
202104,502,United States,5512,"Woven fabrics of synthetic staple fibres, containing 85% or more by weight of synthetic staple fibres.",14889741.0
202104,502,United States,5513,"Woven fabrics of synthetic staple fibres, containing less than 85% by weight of such fibres, mixed mainly or solely withcotton, of a weight not exceeding 170 g/m2.",6377162.0
202104,502,United States,5514,"Woven fabrics of synthetic staple fibres, containing less than 85% by weight of such fibres, mixed mainly or solely with cotton, of a weight exceeding 170g/m2.",1940289.0
202104,502,United States,5515,Other woven fabrics of synthetic staple fibres.,10919835.0
202104,502,United States,5516,Woven fabrics of artificial staple fibres.,15179629.0
202104,502,United States,5601,"Wadding of textile materials and articles thereof; textile fibres, not exceeding 5 mm in length (flock),textile dust and mill neps.",16628857.0
202104,502,United States,5602,"Felt, whether or not impregnated, coated, covered or laminated.",19281354.0
202104,502,United States,5603,"Nonwovens, whether or not impregnated, coated, covered or laminated.",227864754.0
202104,502,United States,5604,"Textile-covered rubber thread and cord; textile yarn, strip and the like of heading 5404 and 5405, impregnated, coated, covered or sheathed with rubber or plastics",23333388.0
202104,502,United States,5605,"Metallised yarn, whether or not gimped, being textile yarn, or strip or the like of heading 5404 or 5405, of textile fibres, combined with metal in the form of thread, strip or powder or covered with metal",400358.0
202104,502,United States,5606,"Gimped yarn, gimped strip and the like of heading 5404 or 5405; chenille yarn, incl. flock chenille yarn, and loop wale-yarn",16447909.0
202104,502,United States,5607,"Twine, cordage, ropes and cables, whether or not plaited or braided and whether or not impregnated, coated, covered or sheathed with rubber or plastics",90392902.0
202104,502,United States,5608,"Knotted netting of twine, cordage or rope; made up fishing nets and other made up nets, of textile materials.",60301962.0
