Date of data,Trading partner code,Trading partner,Commodity code,Commodity,Renminbi Yuan
202009,502,United States,611595,"Full-length or knee-length stockings, socks and other hosiery, incl. footwear without applied soles, of cotton, knitted or crocheted (excluding graduated compression hosiery, pantyhose and tights, women's full-length or knee-length stockings, measuring per single yarn < 67 decitex, and hosiery for babies)",47968
202009,502,United States,611596,"Full-length or knee-length stockings, socks and other hosiery, incl. footwear without applied soles, of synthetic fibres, knitted or crocheted (excluding graduated compression hosiery, pantyhose and tights, women's full-length or knee-length stockings, measuring per single yarn < 67 decitex, and hosiery for babies)",41207
202009,502,United States,611599,"Full-length or knee-length stockings, socks and other hosiery, incl. footwear without applied soles, of textile materials, knitted or crocheted (excluding of wool, fine animal hair, cotton or synthetic fibres, graduated compression hosiery, pantyhose and tights, women's full-length or knee-length stockings, measuring per single yarn < 67 decitex, and hosiery for babies)",154388
202009,502,United States,611610,"Gloves, mittens and mitts, impregnated, coated or covered with plastics or rubber, knitted or crocheted",877
202009,502,United States,611691,"Gloves, mittens and mitts, of wool or fine animal hair, knitted or crocheted (excluding for babies)",572
202009,502,United States,611692,"Gloves, mittens and mitts, of cotton, knitted or crocheted (excluding impregnated, coated or covered with plastics or rubber, and for babies)",8765
202009,502,United States,611693,"Gloves, mittens and mitts, of synthetic fibres, knitted or crocheted (excluding impregnated, coated or covered with plastics or rubber, and for babies)",157786
202009,502,United States,611699,"Gloves, mittens and mitts, of textile materials, knitted or crocheted (excluding of wool, fine animal hair, cotton or synthetic fibres, impregnated, coated or covered with plastics or rubber, and for babies)",13224
202009,502,United States,611710,"Shawls, scarves, mufflers, mantillas, veils and the like, knitted or crocheted",387434
202009,502,United States,611780,"Ties, bow ties, cravats and other made-up clothing accessories, knitted or crocheted, n.e.s. (excluding shawls, scarves, mufflers, mantillas, veils and the like)",363801
202009,502,United States,611790,"Parts of garments or clothing accessories, knitted or crocheted, n.e.s.",21267
202009,502,United States,620111,"Men's or boys' overcoats, raincoats, car coats, capes, cloaks and similar articles, of wool or fine animal hair",12172
202009,502,United States,620112,"Men's or boys' overcoats, raincoats, car coats, capes, cloaks and similar articles, of cotton",122323
202009,502,United States,620113,"Men's or boys' overcoats, raincoats, car coats, capes, cloaks and similar articles, of man-made fibres",303442
202009,502,United States,620119,"Men's or boys' overcoats, raincoats, car coats, capes, cloaks and similar articles, of textile materials (excluding of wool or fine animal hair, cotton or man-made fibres, knitted or crocheted)",121
202009,502,United States,620191,"Men's or boys' anoraks, incl. ski jackets, windcheaters, wind-jackets and similar articles, of wool or fine animal hair (excluding knitted or crocheted, suits, ensembles, jackets, blazers and trousers)",38547
202009,502,United States,620192,"Men's or boys' anoraks, windcheaters, wind jackets and similar articles, of cotton (not knitted or crocheted and excluding suits, ensembles, jackets, blazers, trousers and tops of ski suits)",129310
202009,502,United States,620193,"Men's or boys' anoraks, windcheaters, wind jackets and similar articles, of man-made fibres (not knitted or crocheted and excluding suits, ensembles, jackets, blazers, trousers and tops of ski suits)",370145
202009,502,United States,620199,"Men's or boys' anoraks, incl. ski jackets, windcheaters, wind-jackets and similar articles of textile materials (excluding of wool, fine animal hair, cotton or man-made fibres, knitted or crocheted, suits, ensembles, jackets, blazers and trousers)",6009
202009,502,United States,620211,"Women's or girls' overcoats, raincoats, car coats, capes, cloaks and similar articles, of wool or fine animal hair",71069
202009,502,United States,620212,"Women's or girls' overcoats, raincoats, car coats, capes, cloaks and similar articles, of cotton",77288
202009,502,United States,620213,"Women's or girls' overcoats, raincoats, car coats, capes, cloaks and similar articles, of man-made fibres",305655
202009,502,United States,620219,"Women's or girls' overcoats, raincoats, car coats, capes, cloaks and similar articles, of textile materials (excluding of wool or fine animal hair, cotton or man-made fibres, knitted or crocheted)",400
202009,502,United States,620291,"Women's or girls' anoraks, incl. ski jackets, windcheaters, wind-jackets and similar articles, of wool or fine animal hair (excluding knitted or crocheted, suits, ensembles, jackets, blazers and trousers)",24593
202009,502,United States,620292,"Women's or girls' anoraks, windcheaters, wind jackets and similar articles, of cotton (not knitted or crocheted and excluding suits, ensembles, jackets, blazers, trousers and tops of ski suits)",68096
202009,502,United States,620293,"Women's or girls' anoraks, windcheaters, wind jackets and similar articles, of man-made fibres (not knitted or crocheted and excluding suits, ensembles, jackets, blazers, trousers and tops of ski suits)",134930
202009,502,United States,620299,"Women's or girls' anoraks, incl. ski jackets, windcheaters, wind-jackets and similar articles, of textile materials (excluding of wool, fine animal hair, cotton or man-made fibres, knitted or crocheted, suits, ensembles, jackets, blazers and trousers)",2130
202009,502,United States,620311,"Men's or boys' suits of wool or fine animal hair (excluding knitted or crocheted, tracksuits, ski suits and swimwear)",73875
202009,502,United States,620322,"Men's or boys' ensembles of cotton (excluding knitted or crocheted, ski ensembles and swimwear)",3446
202009,502,United States,620323,"Men's or boys' ensembles of synthetic fibres (excluding knitted or crocheted, ski ensembles and swimwear)",4661
202009,502,United States,620331,"Men's or boys' jackets and blazers of wool or fine animal hair (excluding knitted or crocheted, and wind-jackets and similar articles)",40207
202009,502,United States,620332,"Men's or boys' jackets and blazers of cotton (excluding knitted or crocheted, and wind-jackets and similar articles)",855355
202009,502,United States,620333,"Men's or boys' jackets and blazers of synthetic fibres (excluding knitted or crocheted, and wind-jackets and similar articles)",488843
202009,502,United States,620339,"Men's or boys' jackets and blazers of textile materials (excluding of wool, fine animal hair, cotton or synthetic fibres, knitted or crocheted, and wind-jackets and similar articles)",120520
202009,502,United States,620341,"Men's or boys' trousers, bib and brace overalls, breeches and shorts, of wool or fine animal hair (excluding knitted or crocheted, underpants and swimwear)",45344
202009,502,United States,620342,"Men's or boys' trousers, bib and brace overalls, breeches and shorts, of cotton (excluding knitted or crocheted, underpants and swimwear)",2532052
202009,502,United States,620343,"Men's or boys' trousers, bib and brace overalls, breeches and shorts of synthetic fibres (excluding knitted or crocheted, underpants and swimwear)",492077
202009,502,United States,620349,"Men's or boys' trousers, bib and brace overalls, breeches and shorts of textile materials (excluding of wool, fine animal hair, cotton or synthetic fibres, knitted or crocheted, underpants and swimwear)",35855
202009,502,United States,620412,"Women's or girls' suits of cotton (excluding knitted or crocheted, ski overalls and swimwear)",1807
202009,502,United States,620413,"Women's or girls' suits of synthetic fibres (excluding knitted or crocheted, ski overalls and swimwear)",2200
202009,502,United States,620422,"Women's or girls' ensembles of cotton (excluding knitted or crocheted, ski overalls and swimwear)",7171
202009,502,United States,620423,"Women's or girls' ensembles of synthetic fibres (excluding knitted or crocheted, ski overalls and swimwear)",5310
202009,502,United States,620431,"Women's or girls' jackets and blazers of wool or fine animal hair (excluding knitted or crocheted, wind-jackets and similar articles)",351566
202009,502,United States,620432,"Women's or girls' jackets and blazers of cotton (excluding knitted or crocheted, wind-jackets and similar articles)",1690642
202009,502,United States,620433,"Women's or girls' jackets and blazers of synthetic fibres (excluding knitted or crocheted, wind-jackets and similar articles)",261775
202009,502,United States,620439,"Women's or girls' jackets and blazers of textile materials (excluding of wool, fine animal hair, cotton or synthetic fibres, knitted or crocheted, wind-jackets and similar articles)",367307
202009,502,United States,620441,Women's or girls' dresses of wool or fine animal hair (excluding knitted or crocheted and petticoats),118485
202009,502,United States,620442,Women's or girls' dresses of cotton (excluding knitted or crocheted and petticoats),1200677
202009,502,United States,620443,Women's or girls' dresses of synthetic fibres (excluding knitted or crocheted and petticoats),900135
202009,502,United States,620444,Women's or girls' dresses of artificial fibres (excluding knitted or crocheted and petticoats),374975
202009,502,United States,620449,"Women's or girls' dresses of textile materials (excluding of wool, fine animal hair, cotton or man-made fibres, knitted or crocheted and petticoats)",404949
202009,502,United States,620451,Women's or girls' skirts and divided skirts of wool or fine animal hair (excluding knitted or crocheted and petticoats),97872
202009,502,United States,620452,Women's or girls' skirts and divided skirts of cotton (excluding knitted or crocheted and petticoats),98153
202009,502,United States,620453,Women's or girls' skirts and divided skirts of synthetic fibres (excluding knitted or crocheted and petticoats),164849
202009,502,United States,620459,"Women's or girls' skirts and divided skirts of textile materials (excluding of wool, fine animal hair, cotton or synthetic fibres, knitted or crocheted and petticoats)",154415
202009,502,United States,620461,"Women's or girls' trousers, bib and brace overalls, breeches and shorts of wool or fine animal hair (excluding knitted or crocheted, panties and swimwear)",155950
202009,502,United States,620462,"Women's or girls' trousers, bib and brace overalls, breeches and shorts of cotton (excluding knitted or crocheted, panties and swimwear)",3791012
202009,502,United States,620463,"Women's or girls' trousers, bib and brace overalls, breeches and shorts of synthetic fibres (excluding knitted or crocheted, panties and swimwear)",515694
202009,502,United States,620469,"Women's or girls' trousers, bib and brace overalls, breeches and shorts of textile materials (excluding of wool, fine animal hair, cotton or synthetic fibres, knitted or crocheted, panties and swimwear)",294593
202009,502,United States,620520,"Men's or boys' shirts of cotton (excluding knitted or crocheted, nightshirts, singlets and other vests)",1760984
202009,502,United States,620530,"Men's or boys' shirts of man-made fibres (excluding knitted or crocheted, nightshirts, singlets and other vests)",124378
202009,502,United States,620590,"Men's or boys' shirts of textile materials (excluding of cotton or man-made fibres, knitted or crocheted, nightshirts, singlets and other vests)",46890
202009,502,United States,620610,"Women's or girls' blouses, shirts and shirt-blouses of silk or silk waste (excluding knitted or crocheted and vests)",323479
202009,502,United States,620630,"Women's or girls' blouses, shirts and shirt-blouses of cotton (excluding knitted or crocheted and vests)",556783
202009,502,United States,620640,"Women's or girls' blouses, shirts and shirt-blouses of man-made fibres (excluding knitted or crocheted and vests)",224129
202009,502,United States,620690,"Women's or girls' blouses, shirts and shirt-blouses of textile materials (excluding of silk, silk waste, wool, fine animal hair, cotton or man-made fibres, knitted or crocheted and vests)",27307
202009,502,United States,620711,Men's or boys' underpants and briefs of cotton,84544
202009,502,United States,620719,Men's or boys' underpants and briefs of textile materials (excluding cotton and knitted or crocheted),32383
202009,502,United States,620721,"Men's or boys' nightshirts and pyjamas of cotton (excluding knitted or crocheted, vests, singlets and underpants)",1102
202009,502,United States,620791,"Men's or boys' singlets and other vests, bathrobes, dressing gowns and similar articles of cotton (excluding knitted or crocheted, underpants, nightshirts and pyjamas)",8840
202009,502,United States,620799,"Men's or boys' singlets and other vests, bathrobes and dressing gowns of textile materials (excluding of cotton, knitted or crocheted, underpants, nightshirts and pyjamas)",267
202009,502,United States,620821,"Women's or girls' nightdresses and pyjamas of cotton (excluding knitted or crocheted, vests and négligés)",14733
202009,502,United States,620822,"Women's or girls' nightdresses and pyjamas of man-made fibres (excluding knitted or crocheted, vests and négligés)",10513
202009,502,United States,620891,"Women's or girls' singlets and other vests, briefs, panties, négligés, bathrobes, dressing gowns, housecoats and similar articles of cotton (excluding knitted or crocheted, slips, petticoats, nightdresses and pyjamas, brassières, girdles, corsets and similar articles)",15057
202009,502,United States,620892,"Women's or girls' singlets and other vests, briefs, panties, négligés, bathrobes, dressing gowns, housecoats and similar articles of man-made fibres (excluding knitted or crocheted, slips, petticoats, nightdresses and pyjamas, brassières, girdles, corsets and similar articles)",20373
202009,502,United States,620899,"Women's or girls' singlets and other vests, briefs, panties, négligés, bathrobes, dressing gowns, housecoats and similar articles of textile materials (excluding of cotton or man-made fibres, knitted or crocheted, slips, petticoats, nightdresses and pyjamas, brassières, girdles, corsets and similar articles)",10405
202009,502,United States,620920,"Babies' garments and clothing accessories of cotton (excluding knitted or crocheted and hats, napkins and napkin liners [see 9619])",36939
202009,502,United States,620930,"Babies' garments and clothing accessories of synthetic fibres (excluding knitted or crocheted and hats, napkins and napkin liners [see 9619])",13951
202009,502,United States,620990,"Babies' garments and clothing accessories of textile materials (excluding of cotton or synthetic fibres, knitted or crocheted and hats, napkins and napkin liners [see 9619])",755
202009,502,United States,621010,"Garments made up of felt or nonwovens, whether or not impregnated, coated, covered or laminated (excluding babies' garments and clothing accessories)",2027655
202009,502,United States,621040,"Men's or boys' garments of textile fabrics, rubberised or impregnated, coated, covered or laminated with plastics or other substances (excluding of the type described in subheading 6201,11 to 6201,19, and babies' garments and clothing accessories)",85041
202009,502,United States,621050,"Women's or girls' garments of textile fabrics, rubberised or impregnated, coated, covered or laminated with plastics or other substances (excluding of the type described in subheading 6202,11 to 6202,19, and babies' garments and clothing accessories)",13974
202009,502,United States,621111,Men's or boys' swimwear,5026
202009,502,United States,621112,Women's or girls' swimwear,588
202009,502,United States,621132,"Men's or boys' tracksuits and other garments, n.e.s. of cotton",437991
202009,502,United States,621133,"Men's or boys' tracksuits and other garments, n.e.s. of man-made fibres",162620
202009,502,United States,621139,"Men's or boys' tracksuits and other garments, n.e.s. of textile materials (excluding of cotton or man-made fibres, knitted or crocheted)",11054
202009,502,United States,621142,"Women's or girls' tracksuits and other garments, n.e.s. of cotton",325357
202009,502,United States,621143,"Women's or girls' tracksuits and other garments, n.e.s. of man-made fibres",546082
202009,502,United States,621149,"Women's or girls' tracksuits and other garments, n.e.s. of textile materials (excluding of cotton or man-made fibres, knitted or crocheted and goods of 9619)",144570
202009,502,United States,621210,"Brassieres of all types of textile materials, whether or not elasticated, incl. knitted or crocheted",415195
202009,502,United States,621220,"Girdles and panty girdles of all types of textile materials, whether or not elasticated, incl. knitted or crocheted (excluding belts and corselets made entirely of rubber)",152576
202009,502,United States,621230,"Corselettes of all types of textile materials, whether or not elasticated, incl. knitted or crocheted",3985
202009,502,United States,621290,"Corsets, braces, garters, suspenders and similar articles and parts thereof, incl. parts of brassieres, girdles, panty girdles and corselettes, of all types of textile materials, whether or not elasticated, incl. knitted or crocheted (excluding complete brassieres, girdles, panty girdles and corselettes)",3550
202009,502,United States,621320,"Handkerchiefs of cotton, of which no side exceeds 60 cm",2830
202009,502,United States,621410,"Shawls, scarves, mufflers, mantillas, veils and similar articles of silk or silk waste",24858
202009,502,United States,621420,"Shawls, scarves, mufflers, mantillas, veils and similar articles of wool or fine animal hair",32266
202009,502,United States,621430,"Shawls, scarves, mufflers, mantillas, veils and similar articles of synthetic fibres",77217
202009,502,United States,621440,"Shawls, scarves, mufflers, mantillas, veils and similar articles of artificial fibres",41918
202009,502,United States,621490,"Shawls, scarves, mufflers, mantillas, veils and similar articles of textile materials (excluding of silk, silk waste, wool, fine animal hair or man-made fibres, knitted or crocheted)",3491
202009,502,United States,621510,"Ties, bow ties and cravats of silk or silk waste",37361
202009,502,United States,621520,"Ties, bow ties and cravats of man-made fibres",14839
202009,502,United States,621590,"Ties, bow ties and cravats of textile materials (excluding of silk, silk waste or man-made fibres, knitted or crocheted)",3613
202009,502,United States,621600,"Gloves, mittens and mitts, of all types of textile materials (excluding knitted or crocheted and for babies)",136809
202009,502,United States,621710,"Made-up clothing accessories, of all types of textile materials, n.e.s.",268464
202009,502,United States,621790,"Parts of garments or clothing accessories, of all types of textile materials, n.e.s.",34202
202009,502,United States,630110,Electric blankets of all types of textile materials,10950
202009,502,United States,630120,Blankets and travelling rugs of wool or fine animal hair,26353
202009,502,United States,630130,Blankets and travelling rugs of cotton,10442
202009,502,United States,630140,Blankets and travelling rugs of synthetic fibres,16800
202009,502,United States,630190,Blankets and travelling rugs of textile materials,1315
202009,502,United States,630210,"Bedlinen, knitted or crocheted",1220
202009,502,United States,630221,Printed bedlinen of cotton,12570
202009,502,United States,630231,"Bedlinen of cotton (excluding printed, knitted or crocheted)",69195
202009,502,United States,630232,"Bedlinen of man-made fibres (excluding printed, knitted or crocheted)",26670
202009,502,United States,630239,"Bedlinen of textile materials (excluding of cotton and man-made fibres, printed, knitted or crocheted)",11732
202009,502,United States,630251,Table linen of cotton,2853
202009,502,United States,630253,Table linen of man-made fibres,2022
202009,502,United States,630260,"Toilet linen and kitchen linen, of terry towelling or similar terry fabrics of cotton (excluding floorcloths, polishing cloths, dishcloths and dusters)",31386
202009,502,United States,630291,"Toilet linen and kitchen linen of cotton (excluding of terry fabrics, floorcloths, polishing cloths, dishcloths and dusters)",5429
202009,502,United States,630293,"Toilet linen and kitchen linen of flax (excluding floor-cloths, polishing-cloths, dish-cloths and dusters)",3039
202009,502,United States,630299,Toilet linen and kitchen linen of textile materials,4322
202009,502,United States,630312,"Curtains, incl. drapes, and interior blinds, curtain or bed valances of synthetic fibres, knitted or crocheted (excluding awnings and sunblinds)",644793
202009,502,United States,630392,"Curtains, incl. drapes, and interior blinds, curtain or bed valances of synthetic fibres (excluding knitted or crocheted, awnings and sunblinds)",1226650
202009,502,United States,630399,"Curtains, incl. drapes, and interior blinds, curtain or bed valances of textile materials (excluding of cotton and synthetic fibres, knitted or crocheted, awnings and sunblinds)",373549
202009,502,United States,630411,Knitted or crocheted bedspreads,873
202009,502,United States,630491,"Articles for interior furnishing, knitted or crocheted (excluding blankets and travelling rugs, bedlinen, table linen, toilet linen, kitchen linen, curtains, incl. drapes, interior blinds, curtain or bed valances, bedspreads, lampshades and articles of heading 9404)",31851
202009,502,United States,630492,"Articles for interior furnishing, of cotton (excluding knitted or crocheted, blankets and travelling rugs, bedlinen, table linen, toilet linen, kitchen linen, curtains, incl. drapes, interior blinds, curtain or bed valances, bedspreads, lampshades and articles of heading 9404)",8166
202009,502,United States,630493,"Articles for interior furnishing, of synthetic fibres (excluding knitted or crocheted, blankets and travelling rugs, bedlinen, table linen, toilet linen, kitchen linen, curtains, incl. drapes, interior blinds, curtain or bed valances, bedspreads, lampshades and articles of heading 9404)",1259845
202009,502,United States,630499,"Articles for interior furnishing, of textile materials (excluding of cotton or synthetic fibres, knitted or crocheted, blankets and travelling rugs, bedlinen, table linen, toilet linen, kitchen linen, curtains, incl. drapes, interior blinds, curtain or bed valances, bedspreads, lampshades and articles of heading 9404)",3355903
202009,502,United States,630510,"Sacks and bags, for the packing of goods, of jute or other textile bast fibres of heading 5303",9051
202009,502,United States,630520,"Sacks and bags, for the packing of goods, of cotton",4668
202009,502,United States,630533,"Sacks and bags, for the packing of goods, of polyethylene or polypropylene strip or the like (excluding flexible intermediate bulk containers)",317855
202009,502,United States,630539,"Sacks and bags, for the packing of goods, of man-made textile materials (excluding of polyethylene or polypropylene strip or the like, and flexible intermediate bulk containers)",38707
202009,502,United States,630590,"Sacks and bags, for the packing of goods, of textile materials (excluding man-made, cotton, jute or other textile bast fibres of heading 5303)",11410
202009,502,United States,630612,"Tarpaulins, awnings and sunblinds of synthetic fibres (excluding flat covers of light fabrics made up as tarpaulins)",3121
202009,502,United States,630619,"Tarpaulins, awnings and sunblinds of textile materials (excluding of synthetic fibres and flat covers of light fabrics made up as tarpaulins)",172833
202009,502,United States,630622,Tents of synthetic fibres (excluding umbrella and play tents),71070
202009,502,United States,630710,"Floorcloths, dishcloths, dusters and similar cleaning cloths",1873514
202009,502,United States,630720,Lifejackets and lifebelts,1378728
202009,502,United States,630790,"Made-up articles of textile materials, incl. dress patterns, n.e.s.",7590529
202009,502,United States,630800,"Sets consisting of woven fabric and yarn, whether or not with accessories, for making up into rugs, tapestries, embroidered table cloths or serviettes, or similar textile articles, put up in packings for retail sale.",11213
202009,502,United States,640110,Footwear incorporating a protective metal toecap,1210
202009,502,United States,640192,Covering the ankle but not covering the knee,33256
202009,502,United States,640199,"Waterproof footwear covering neither the ankle nor the knee, with outer soles and uppers of rubber or of plastics, the uppers of which are neither fixed to the sole nor assembled by stitching, riveting, nailing, screwing, plugging or similar processes (excluding covering the ankle but not the knee, footwear incorporating a protective metal toecap, orthopaedic footwear, skating boots with ice or roller skates attached and sports and toy footwear)",384
202009,502,United States,640212,"Skiboots, crosscountry ski footwear and snowboard boots",749
202009,502,United States,640219,"Sports footwear with outer soles and uppers of rubber or plastics,other",963213
202009,502,United States,640220,Footwear with upper straps or thongs assembled to the sole by means of plugs,14561
202009,502,United States,640291,Covering the ankle,58983
202009,502,United States,640299,"Footwear with outer soles and uppers of rubber or plastics, other",298260
202009,502,United States,640312,"Skiboots, crosscountry ski footwear and snowboard boots",5711
