Date of data,Trading partner code,Trading partner,Commodity code,Commodity,Renminbi Yuan
202009,502,United States,842710,Selfpropelled trucks powered by an electric motor,6164419
202009,502,United States,842720,Other selfpropelled trucks,2557178
202009,502,United States,842790,"Works trucks fitted with lifting or handling equipment, not self-propelled",146872
202009,502,United States,842810,Lifts and skip hoists,82756
202009,502,United States,842820,Pneumatic elevators and conveyors,3992240
202009,502,United States,842833,"Continuous-action elevators and conveyors, for goods or materials, belt type",30792
202009,502,United States,842839,"Continuous-action elevators and conveyors, for goods or materials (excluding those for underground use and bucket, belt or pneumatic types)",13905574
202009,502,United States,842890,"Machinery for lifting, handling, loading or unloading, n.e.s.",17292066
202009,502,United States,842920,Graders and levellers,387887
202009,502,United States,842951,Frontend shovel loaders,3359031
202009,502,United States,842952,Machinery with a 360刟 revolving superstructure,2389714
202009,502,United States,843020,Snowploughs and snowblowers,2137
202009,502,United States,843041,"Other, self-propelled boring or sinking machinery for boring earth or extracting minerals or ores",1190394
202009,502,United States,843049,"Other, boring or sinking machinery for boring earth or extracting minerals or ores, not self-propelled and not hydraulic",413971
202009,502,United States,843050,"Other machinery, selfpropelled",12784662
202009,502,United States,843061,"Tamping or compacting machinery, not self-propelled (excluding hand-operated tools)",96178
202009,502,United States,843110,Part of machinery of heading 84.25,598054
202009,502,United States,843120,Part of machinery of heading 84.27,15988242
202009,502,United States,843131,"Part off lifts, skip hoists or escalators, of heading 84.28",1776446
202009,502,United States,843139,"Parts of machinery of heading 8428, n.e.s.",6658665
202009,502,United States,843141,"Buckets, shovels, grabs and grips",2493528
202009,502,United States,843143,Parts for boring or sinking machinery of subheading 8430.41 or,18233641
202009,502,United States,843149,"Parts of machinery of heading 8426, 8429 and 8430, n.e.s.",23663387
202009,502,United States,843241,"Seeders, planters and transplanters (excl. no-till machines)",423269
202009,502,United States,843290,"Parts of agricultural, horticultural or forestry machinery for soil preparation or cultivation or of lawn or sports-ground rollers, n.e.s.",2921929
202009,502,United States,843311,"Powered, with the cutting device rotating in a horizontal plane",40178
202009,502,United States,843319,"Mowers for lawns, parks or sports grounds, powered, with the cutting device rotating in a vertical plane or with cutter bars",1291300
202009,502,United States,843320,"Other mowers, including cutter bars for tractor mounting",14262
202009,502,United States,843330,Other haymaking machinery,1220544
202009,502,United States,843340,"Straw or fodder balers, including pickup balers",9408968
202009,502,United States,843351,Combine harvester-threshers,4840464
202009,502,United States,843352,Threshing machinery (excluding combine harvester-threshers),453176
202009,502,United States,843359,"Harvesting machinery for agricultural produce (excluding mowers, haymaking machinery, straw and fodder balers, incl. pick-up balers, combine harvester-threshers, other threshing machinery and root or tuber harvesting machines)",712387
202009,502,United States,843360,"Machines for cleaning, sorting or grading eggs, fruit or other agricultural produce",698230
202009,502,United States,843390,"Parts of harvesting machinery, threshing machinery, mowers and machines for cleaning, sorting or grading agricultural produce, n.e.s.",11660215
202009,502,United States,843410,Milking machines,2196424
202009,502,United States,843490,"Parts of milking machines and dairy machinery, n.e.s.",3774989
202009,502,United States,843621,Poultry incubators and brooders,6256
202009,502,United States,843680,"Agricultural, horticultural, forestry or bee-keeping machinery, n.e.s.",6121257
202009,502,United States,843691,"Parts of poultry-keeping machinery or poultry incubators and brooders, n.e.s.",159498
202009,502,United States,843699,"Parts of agricultural, horticultural, forestry or bee-keeping machinery of heading 84.36, n.e.s.",613500
202009,502,United States,843710,"Machines for cleaning, sorting or grading seed, grain or dried leguminous vegetables",152493
202009,502,United States,843780,"Machinery used in the milling industry or for the working of cereals or dried leguminous vegetables (excluding farm-type machinery, heat treatment equipment, centrifugal dryers, air filters and machines for cleaning, sorting or grading seed, grain or dried leguminous vegetables)",556385
202009,502,United States,843810,"Bakery machinery and machinery for the manufacture of macaroni, spaghetti or similar products",485
202009,502,United States,843820,"Machinery for the manufacture of confectionery, cocoa or chocolate",8921142
202009,502,United States,843850,Machinery for the preparation of meat or poultry,684549
202009,502,United States,843860,"Machinery for the preparation of fruits, nuts or vegetables",4216244
202009,502,United States,843880,"Machinery for the industrial preparation or manufacture of food or drink, n.e.s.",14665869
202009,502,United States,843890,"Parts of machinery for the industrial preparation or manufacture of food or drink, n.e.s.",1010207
202009,502,United States,843910,Machinery for making pulp of fibrous cellulosic material,1259676
202009,502,United States,843991,"Parts of machinery for making pulp of fibrous cellulosic material, n.e.s.",12401585
202009,502,United States,843999,"Parts of machinery for making or finishing paper or paperboard, n.e.s.",774653
202009,502,United States,844010,"Bookbinding machinery, incl. book-sewing machines (excluding machinery of heading 8441, general-purpose presses, printing machinery of heading 8443 and machines of uses ancillary to printing)",1340
202009,502,United States,844110,Cutting machines,75733
202009,502,United States,844190,"Parts of machinery for making up paper pulp, paper or paperboard, n.e.s.",2867612
202009,502,United States,844240,"Parts of the foregoing machinery, apparatus or equipment",40714
202009,502,United States,844250,"Plates, cylinders and other printing components; plates, cylinders and lithographic stones, prepared for printing purposes (for example, planed, grained or polished)",300393
202009,502,United States,844331,"Machines which perform two or more of the functions of printing, copying or facsimile transmission, capable of connecting to an automatic data processing machine or to a network",4826149
202009,502,United States,844332,"Other, capable of connecting to an automatic data processing machine or to a network",5843395
202009,502,United States,844339,"Printers, copying machines and facsimile machines, whether or not combined (excluding those capable of connecting to an automatic data processing machine or to a network and printing machinery used for printing by means of plates, cylinders and other printing components of heading 8442)",379209
202009,502,United States,844391,"Parts and accessories of printing machinery used for printing by means of plates, cylinders and other printing components of heading 84.42",1486236
202009,502,United States,844399,"Parts and accessories of printers, copying machines and facsimile machines, n.e.s. (excluding of printing machinery used for printing by means of plates, cylinders and other printing components of heading 8443)",92482852
202009,502,United States,844400,"Machines for extruding, drawing, texturing or cutting man-made textile materials",757390
202009,502,United States,844711,"Circular knitting machines, with cylinder diameter ≤ 165 mm",297422
202009,502,United States,844819,"Auxiliary machinery for machines of heading 8444, 8445, 8446 or 8447 (excluding doobies and jacquards, card reducing, copying, punching or assembling machines for use therewith)",147388
202009,502,United States,844820,Parts and accessories of machines of heading 84.44 or of their auxiliary machinery,202948
202009,502,United States,844831,Card clothing,3851
202009,502,United States,844832,"Parts and accessories of machines for preparing textile fibres, n.e.s. (other than card clothing)",4565
202009,502,United States,844833,"Spindles, spindle flyers, spinning rings and ring travellers",890092
202009,502,United States,844839,"Parts and accessories of machines of heading 8445, n.e.s.",30520
202009,502,United States,844849,"Parts and accessories of weaving machines (looms)and their auxiliary machinery, n.e.s.",250464
202009,502,United States,844859,"Parts and accessories of machines of heading 8447, n.e.s.",209758
202009,502,United States,845011,"Fully-automatic household or laundry-type washing machines, of a dry linen capacity ≤ 6 kg",4829
202009,502,United States,845020,"Laundry-type washing machines, each of a dry linen capacity exceeding 10 kg",70285
202009,502,United States,845090,"Parts of household or laundry-type washing machines, n.e.s.",248565
202009,502,United States,845129,"Drying machines for textile yarns, fabrics or made-up textile articles (excluding machines of a dry linen capacity ≤ 10 kg and centrifugal driers)",405582
202009,502,United States,845130,Ironing machines and presses (including fusing presses),136085
202009,502,United States,845140,"Washing, bleaching or dyeing machines",11007
202009,502,United States,845150,"Machines for reeling, unreeling, folding, cutting or pinking textile fabrics",2070074
202009,502,United States,845180,"Machinery for dressing, finishing, coating or impregnating textile yarns, fabrics or other made-up textile articles and machines used in the manufacture of linoleum or other floor coverings for applying the paste to the base fabric or other support (excluding machinery for dressing or finishing felt, calenders and general purpose presses)",94930
202009,502,United States,845190,"Parts of machines for washing, cleaning, wringing, drying, ironing, pressing, bleaching, dyeing, dressing, finishing, coating or impregnating textile yarns, fabrics or made-up textile articles; parts of machines used in the manufacture of linoleum or other floor coverings for applying the paste to the base fabric or other support; parts of machines for reeling, unreeling, folding, cutting or pinking textile fabrics, n.e.s.",1143064
202009,502,United States,845221,"Automatic sewing machines, industrial type",89414
202009,502,United States,845290,"Furniture, bases and covers for sewing machines and parts thereof; other parts of sewing machines",98552
202009,502,United States,845390,"Parts of machinery for preparing, tanning or working hides, skins or leather or for making or repairing footwear or other articles of hides, skins or leather, n.e.s.",11920
202009,502,United States,845420,Ingot moulds and ladles,8230992
202009,502,United States,845430,Casting machines,27705242
202009,502,United States,845490,"Parts of converters, ladles, ingot moulds and casting machines of a kind used in metallurgy or in metal foundries, n.e.s.",14911150
202009,502,United States,845510,Tube mills,4000466
202009,502,United States,845521,Hot or combination hot and cold metal-rolling mills (excluding tubes mills),33319667
202009,502,United States,845530,Rolls for rolling mills,10611402
202009,502,United States,845590,"Parts of metal-rolling mills, n.e.s.",3524558
202009,502,United States,845611,"Machine tools for working any material by removal of material, operated by laser (excl. soldering and welding machines, also those which can be used for cutting, material testing machines and machines for the manufacture of semiconductor devices or of electronic integrated circuits)",26699914
202009,502,United States,845620,"Machine tools for working any material by removal of material, operated by ultrasonic processes",129546
202009,502,United States,845640,"Machine tools for working any material by removal of material, operated by plasma arc processes",7559249
202009,502,United States,845690,"Machine tools for working any material by removal of material, operated by electro-chemical processes or electron beam, ion beam or plasma arc processes; water-jet cutting machines (excluding for soldering and welding machines, materials testing machines and machines for the manufacture of semiconductor devices or of electronic integrated circuits)",5512984
202009,502,United States,845710,Machining centres,25998733
202009,502,United States,845811,"Horizontal lathes, incl. turning centres, for removing metal, numerically controlled",2351237
202009,502,United States,845819,"Horizontal lathes, incl. turning centres, for removing metal, not numerically controlled",999708
202009,502,United States,845929,"Drilling machines for working metal, not numerically controlled (excluding way-type unit head machines and hand-operated machines)",10000
202009,502,United States,845949,"Boring machines for metals, not numerically controlled (excl. way-type unit head machines and boring-milling machines)",1664335
202009,502,United States,845951,"Milling machines for metals, knee-type, numerically controlled",45948
202009,502,United States,845961,"Milling machines for metals, numerically controlled (excluding way-type unit head machines, boring-milling machines, knee-type milling machines and gear cutting machines)",1399640
202009,502,United States,845970,Threading or tapping machines for metals (excluding way-type unit head machines),420347
202009,502,United States,846039,"Sharpening ""tool or cutter grinding"" machines, not numerically controlled",6383
202009,502,United States,846040,"Honing or lapping machines, for working metals, metal carbides or cermets (excluding gear cutting, gear grinding or gear finishing machines)",501481
202009,502,United States,846090,"Machines for deburring, grinding or polishing metals, metal carbides or cermets (excluding grinding machines in which the positioning in any one axis can be set up to an accuracy of at least 0,01 mm, gear cutting, gear grinding or gear finishing machines and machines for working in the hand)",317000
202009,502,United States,846150,Sawing or cuttingoff machines,1863783
202009,502,United States,846190,"Planing machines and other machine tools for working metals, metal carbides or cermets by removing material, n.e.s.",7999
202009,502,United States,846210,Forging or diestamping machines (including presses) and hammers,175770
202009,502,United States,846229,"Bending, folding, straightening or flattening machines, incl. presses, not numerically controlled, for working metal",112196
202009,502,United States,846239,"Shearing machines, incl. presses, not numerically controlled, for working metal (excluding combined punching and shearing machines)",60000
202009,502,United States,846249,"Punching or notching machines, incl. presses, and combined punching and shearing machines, not numerically controlled, for working metal",165894
202009,502,United States,846291,"Hydraulic presses for working metal (excluding forging, bending, folding, straightening and flattening presses)",3108503
202009,502,United States,846299,"Presses, not hydraulic, for working metal (excluding forging, bending, folding, straightening and flattening presses)",269845
202009,502,United States,846320,Thread rolling machines,6771606
202009,502,United States,846330,Machines for working wire,476192
202009,502,United States,846390,"Machine tools for working metal, sintered metal carbides or cermets, without removing metal (excluding forging, bending, folding, straightening and flattening presses, shearing machines, punching or notching machines, presses, draw-benches, thread rolling machines, machines for working metal wire and machines for working in the hand)",1817120
202009,502,United States,846410,"Sawing machines for working stone, ceramics, concrete, asbestos-cement or like mineral materials or for cold-working glass",65698
202009,502,United States,846420,"Grinding or polishing machines, for working stone, ceramics, concrete, asbestos-cement or like mineral materials or for cold-working glass",585414
202009,502,United States,846490,"Machine tools for working stones, concrete, asbestos cement or similar mineral substances or for cold-working glass (excluding sawing machines, grinding machines, polishing machines, hand-operated machines and machines for scribing or scoring semiconductor wafers)",2223036
202009,502,United States,846591,"Sawing machines for working wood, cork, bone, hard rubber, hard plastics or similar hard materials (excluding machines for working in the hand)",35695
202009,502,United States,846593,"Grinding, sanding or polishing machines for working wood, cork, bone, hard rubber, hard plastics or similar hard materials (excluding machines for working in the hand)",262101
202009,502,United States,846596,"Splitting, slicing or paring machines, for working wood",377293
202009,502,United States,846610,"Tool holders, incl. tool holders for any type of tool for working in the hand, and self-opening dieheads, for machine tools",4436583
202009,502,United States,846620,Work holders for machine tools,3933905
202009,502,United States,846630,"Dividing heads and other special attachments for machine tools, n.e.s.",4427736
202009,502,United States,846691,"Parts and accessories for machine tools for working stone, ceramics, concrete, asbestos-cement or like mineral materials or for cold-working glass, n.e.s.",923422
202009,502,United States,846692,"Parts and accessories for machine tools for working wood, cork, bone, hard rubber, hard plastics or similar hard materials, n.e.s.",503545
202009,502,United States,846693,"Parts and accessories for machine tools for working metal by removing material, n.e.s.",20151036
202009,502,United States,846694,"Parts and accessories for machine tools for working metal without removing material, n.e.s.",5455562
202009,502,United States,846711,Rotary type (including combined rotary-percussion),1698229
202009,502,United States,846719,"Pneumatic tools for working in the hand, non-rotary type",1487001
202009,502,United States,846721,"Drills of all kinds for working in the hand, with self-contained electric motor",21353
202009,502,United States,846722,"Saws for working in the hand, with self-contained electric motor",239371
202009,502,United States,846729,"Electromechanical tools for working in the hand, with self-contained electric motor (excluding saws and drills)",4188211
202009,502,United States,846781,"Chain saws, with self-contained electric motor",545088
202009,502,United States,846789,"Tools for working in the hand, hydraulic or with self-contained non-electric motor (excluding chainsaws and pneumatic tools)",12908511
202009,502,United States,846791,"Parts of chainsaws, for working in the hand, with self-contained electric or non-electric motor, n.e.s.",2299640
202009,502,United States,846792,"Parts of pneumatic tools for working in the hand, n.e.s.",1422741
202009,502,United States,846799,"Parts of pneumatic tools for working in the hand, hydraulic or with self-contained electric or non-electric motor, n.e.s.",11408351
202009,502,United States,846820,Other gasoperated machinery and apparatus,47442
202009,502,United States,846880,"Machinery and apparatus for welding, not gas-operated (excluding electric machines and apparatus of heading 8515)",375840
202009,502,United States,846890,"Parts of machinery and apparatus for soldering, brazing, welding or surface tempering, non-electric, n.e.s.",784755
202009,502,United States,847010,"Electronic calculators capable of operation without an external source of electric power and pocketsize data recording, reproducing and displaying machines with calculating functions",5916
202009,502,United States,847050,Cash registers,5060998
202009,502,United States,847130,"Portable automatic data processing machines, weighing not more than 10 kg, consisting of at least a central processing unit, a keyboard and a display",542647
202009,502,United States,847141,"Comprising in the same housing at least a central processing unit and an input and output unit, whether or not combined",24533617
202009,502,United States,847149,"Other, presented in the form of systems",11964456
202009,502,United States,847150,"Processing units other than those of subheading 8471.41 or 8471.49, whether or not containing in the same housing one or two of the following types of unit : storage units, input units, output units",159944789
202009,502,United States,847160,"Input or output units, whether or not containing storage units in the same housing",6115263
202009,502,United States,847170,Storage units,41947086
202009,502,United States,847180,Other units of automatic data processing machines,124827664
202009,502,United States,847190,"Magnetic or optical readers, machines for transcribing data onto data media in coded form and machines for processing such data, n.e.s.",7615405
202009,502,United States,847290,"Office machines, n.e.s.",79025
202009,502,United States,847321,"Parts and accessories of electronic calculating machines of subheading 8470.10, 8470.21 or 8470.29, n.e.s.",419
202009,502,United States,847329,"Parts and accessories of non-electronic calculators for accounting machines, cash registers or other machines, incorporating a calculating device, of heading 8470, n.e.s.",246482
202009,502,United States,847330,Parts and accessories of the machines of heading 84.71,27330724
202009,502,United States,847340,Parts and accessories of the machines of heading 84.72,541313
202009,502,United States,847410,"Sorting, screening, separating or washing machines",2856290
202009,502,United States,847432,Machines for mixing mineral substances with bitumen,569737
202009,502,United States,847439,"Machinery for mixing or kneading solid mineral substances, incl. those in powder or paste form",358844
202009,502,United States,847480,"Machinery for agglomerating, shaping or moulding solid mineral fuels, ceramic paste, unhardened cements, plastering materials and other mineral products in powder or paste form; machines for forming foundry moulds of sand",6268347
202009,502,United States,847490,"Parts of machinery for working mineral substances of heading 8474, n.e.s.",4654859
202009,502,United States,847529,Machines for manufacturing or hot working glass or glassware (excluding machines for making optical fibres and preforms thereof and furnaces and heating apparatus for manufacturing toughened glass),2696073
202009,502,United States,847590,"Parts of machines for assembling electric or electronic lamps, tubes or valves or flashbulbs, in glass envelopes and of machines for manufacturing or hot working glass or glassware, n.e.s.",1056505
202009,502,United States,847690,"Parts of automatic goods-vending machines, incl. money changing machines, n.e.s.",108345
202009,502,United States,847710,Injectionmoulding machines,90039
202009,502,United States,847720,Extruders,2196412
202009,502,United States,847730,Blow moulding machines,1154270
202009,502,United States,847740,Vacuum moulding machines and other thermoforming machines,30085
202009,502,United States,847759,"Machinery for moulding or otherwise forming products from rubber or plastics (excluding injection-moulding machines, extruders, blow-moulding machines, vacuum-moulding and other thermoforming machines; machinery for moulding or retreading pneumatic tyres or for moulding or otherwise forming inner tubes)",1479000
202009,502,United States,847780,"Machinery for working rubber or plastics or for the manufacture of products from these materials, not specified or included elsewhere in this chapter",7640320
202009,502,United States,847790,"Parts of machinery for working rubber or plastics or for the manufacture of products from these materials, n.e.s.",16817293
202009,502,United States,847910,"Machinery for public works, building or the like",4782456
202009,502,United States,847940,Rope or cablemaking machines,84410
202009,502,United States,847950,"Industrial robots, not elsewhere specified or included",2499271
202009,502,United States,847960,Evaporative air coolers,4234
202009,502,United States,847981,"Machinery for treating metal, incl. electric wire coil-winders, n.e.s. (excluding industrial robots, furnaces, dryers, spray guns and the like, high-pressure cleaning equipment and other jet cleaners, rolling millls or machines, machine tools and rope or cable-making machines)",3950905
202009,502,United States,847982,"Mixing, kneading, crushing, grinding, screening, sifting, homogenising, emulsifying or stirring machines",29710131
202009,502,United States,847989,"Machines and mechanical appliances, n.e.s.",317037697
202009,502,United States,847990,"Parts of machines and mechanical appliances, n.e.s.",128921907
202009,502,United States,848010,Moulding boxes for metal foundry,2877
202009,502,United States,848041,Injection or compression types,512314
202009,502,United States,848049,"Moulds for metal or metal carbides (excluding moulds of graphite or other carbons, ceramic or glass moulds, linotype moulds or matrices, injection or compression-type moulds and ingot moulds)",121026
202009,502,United States,848050,Moulds for glass,2035550
202009,502,United States,848060,Moulds for mineral materials,8404859
202009,502,United States,848071,Injection or compression types,13692731
202009,502,United States,848079,Moulds for rubber or plastics (other than injection or compression types),3333103
202009,502,United States,848110,Pressurereducing valves,33895586
202009,502,United States,848120,Valves for oleohydraulic or pneumatic transmissions,76464479
202009,502,United States,848130,Check (nonreturn) valves,31061297
202009,502,United States,848140,Safety or relief valves,39122610
